
/**********************
luchadb archive (for year 1956)
export started at 2026-02-03 02:11:00
export finished at 2026-02-03 02:12:11

particular parser syntax for nerds:

PROMOTION (DAY) MM/DD/YYYY ArenaName [linkURL linkName]
MatchNo) side1-1, side1-2, side1-3 DECISION side2-1, side2-2, side2-3 [matchstip]

special codes 
(c) champion obviously
## note attached to preeceding match
&& note attached to event
%% attendence (always integer, always suspect) 
** event name
**********************/
indy (SUN) 01/01/1956 Arena Canada Dry, Guadalajara, Jalisco [El Informador 1956-01-01]
1) ? vs ??
2) Paul Carpentier, Torbellino Negro vs Kiko Torres, Kiko Van Dick
3) El Enfermero vs Red Terror
4) El Espectro  (c) vs Rolando Vera [OCCIDENTE MIDDLE, hair]
## Vera’s hair vs Espectro’s belt. Probably a title change.

indy (SUN) 01/01/1956 Plaza de Toros Valente Arellano, Torreón, Coahuila [El Siglo de Torreon 1956-01-01]
1) Bicha Martinez vs Chacal Ramírez
2) Pedro Bolaños vs Tony Fussary
3) Lotario vs Gonzalo Gómez
4) Manuel Muñiz vs Mario Prado
5) El Mongol, Medico Asesino vs Joe Marín, Polo Torres

Dipp (TUE) 01/03/1956 Arena Olimpico Laguna, Gomez Palacio, Durango [El Siglo de Torreon 1956-01-03]
1) Chu Chu García vs Bicha Martinez
2) Eddie Martinez vs Tacho Martí
3) Pedro Bolaños vs El Ángel
4) El Mongol, Mario Prado vs Lotario, Manuel Muñiz
5) Medico Asesino vs Polo Torres

indy (TUE) 01/03/1956 Plaza de Toros el Progreso, Guadalajara, Jalisco [El Informador 1956-01-03]
1) Paul Carpentier vs Rolando Vera, El Espectro, Red Terror, El Enfermero, Kiko Torres, Kiko Van Dick, Llanero Solitario, Luis Rangel, El Corzo I, Torbellino Negro, Fili Espinosa [battle royal]
## 500 pesos for the winner.

indy (WED) 01/04/1956 Plaza de Toros Valente Arellano, Torreón, Coahuila [El Siglo de Torreon 1956-01-04]
1) Tony Fussary vs Chacal Ramírez
2) Medico Asesino vs Manuel Muñiz, El Mongol, Polo Torres, Mario Prado, El Ángel, Pedro Bolaños, Lotario [battle royal]

EMLL (FRI) 01/06/1956 Arena Coliseo [Box Y Lucha 199]
1) Ángel Negro b Jaibo García
2) Huroki Sito b Red Man
3) Gorila Macías III DRAW Dr. Castro
4) Apolo Sureño b Ed Mangoetch [quarterfinal]
5) Tarzán López b Chico Casasola [quarterfinal]
6) Cavernario Galindo b Halcón Quintana [quarterfinal]
7) Black Shadow b Gorilita Flores [quarterfinal]
8) Cavernario Galindo b Tarzán López [semifinal]
9) Black Shadow b Apolo Sureño [semifinal]
10) Cavernario Galindo b Black Shadow [final]
## Galindo took 2/3

EMLL (SUN) 01/08/1956 Arena Coliseo [Box Y Lucha 199]
1) Juan Diaz b Baryck Rivers
2) Eskimo Blancarte b Enrique Camarena
## straight falls
3) Manuel Robles b Eddie Saxon
4) Jorge Allende b Jalisco González
5) Blue Demon, Joe Marín b Canelo Segura, El Santo
## Demon's team took 2/3,

indy (SUN) 01/08/1956 Arena Canada Dry, Guadalajara, Jalisco [El Informador 1956-01-08]
1) ? vs ??
2) ? vs ??
3) Rolando Vera vs Red Terror
4) Paul Carpentier vs El Enfermero
5) Huracán Ramírez vs El Espectro

indy (SUN) 01/08/1956 Plaza de Toros Valente Arellano, Torreón, Coahuila [El Siglo de Torreon 1956-01-08]
1) Cavernario II vs Bicha Martinez
2) Rene Guajardo vs Tony Fussary
3) Pedro Bolaños vs Mario Prado
4) Polo Torres, Sordomudo Rodríguez vs Eddie Martinez, El Mongol
5) Medico Asesino vs Lotario

Dipp (TUE) 01/10/1956 Arena Olimpico Laguna, Gomez Palacio, Durango [El Siglo de Torreon 1956-01-10]
1) Tony Fussary vs Chacal Ramírez
2) Eddie Martinez vs Rene Guajardo
3) Sordomudo Rodríguez vs Mario Prado
4) Lotario vs El Mongol
5) Cavernario Galindo, El Verdugo vs Manuel Muñiz, Polo Torres

indy (TUE) 01/10/1956 Plaza de Toros el Progreso, Guadalajara, Jalisco [El Informador 1956-01-10]
1) ? vs ??
2) ? vs ??
3) Huracán Ramírez, Rolando Vera vs El Espectro, Red Terror
4) El Enfermero, Medico Asesino vs Paul Carpentier, Torbellino Negro

indy (WED) 01/11/1956 Plaza de Toros Valente Arellano, Torreón, Coahuila [El Siglo de Torreon 1956-01-11]
1) Tonny Fussari vs Bicha Martinez
2) Mario Prado vs Rene Guajardo
3) Sordomudo Rodríguez vs Eddie Martinez
4) El Verdugo vs Manuel Muñiz
5) Cavernario Galindo, El Mongol vs Lotario, Polo Torres

EMLL (FRI) 01/13/1956 Arena Coliseo [https://twitter.com/therealfredo/status/908438294605598720 @therealfredo, Box Y Lucha 199]
1) Gorila Osorio vs Juan Diaz
2) Eskimo Blancarte vs Carlos Segura
3) Daniel Aldana vs Jacobo Macías
4) Eddie Saxon vs Chico Veloz
5) Pepe Mendieta vs Apolo Sureño
6) Tarzán López vs Chico Casasola
7) Cavernario Galindo, Gorilita Macias vs Black Shadow, Halcón Quintana

EMLL (SUN) 01/15/1956 Arena Coliseo [https://twitter.com/therealfredo/status/908438294605598720 @therealfredo, Box Y Lucha 199]
1) El Coyote vs José Munoz
2) Sordomudo Quiroz vs El Pirata
3) Ed Mangoetch vs Dientes Hernández
4) Jalisco González vs Manuel Robles
5) Blue Demon, Joe Marín vs Carlos Moreno, Jorge Allende

indy (SUN) 01/15/1956 Arena Canada Dry, Guadalajara, Jalisco [El Informador 1956-01-15]
1) Rolando Vera vs Ray Mendoza, El Espectro, Red Terror, Black Killer, Kiko Torres [battle royal]
2) El Enfermero, Medico Asesino vs Paul Carpentier, Torbellino Negro

indy (SUN) 01/15/1956 Plaza de Toros Valente Arellano, Torreón, Coahuila [El Siglo de Torreon 1956-01-15]
1) Tony Fussary vs Chacal Ramírez
2) Rene Guajardo vs Tacho Martí
3) Pedro Bolaños vs Mario Prado
4) Lotario vs Sordomudo Rodríguez
5) Manuel Muñiz, Polo Torres vs El Mongol, Oso Negro

Dipp (TUE) 01/17/1956 Arena Olimpico Laguna, Gomez Palacio, Durango [El Siglo de Torreon 1956-01-17]
1) Chacal Ramírez vs Bicha Martinez
2) Mario Prado vs Rene Guajardo
3) Pedro Bolaños vs El Mongol
4) Sordomudo Rodríguez vs Oso Negro
5) Bulldog Perez, Carnicero Butcher vs Manuel Muñiz, Polo Torres

indy (TUE) 01/17/1956 Plaza de Toros el Progreso, Guadalajara, Jalisco [El Informador 1956-01-17]
1) ? vs ??
2) Llanero Solitario, Rolando Vera vs El Espectro, Red Terror
3) El Enfermero vs Ray Mendoza
4) Medico Asesino vs Paul Carpentier

indy (WED) 01/18/1956 Plaza de Toros Valente Arellano, Torreón, Coahuila [El Siglo de Torreon 1956-01-18]
1) Chacal Ramírez vs Little Wonder
2) Rene Guajardo vs Pedro Bolaños
3) Eddie Martinez vs Mario Prado
4) El Mongol vs Sordomudo Rodríguez
5) Bull Dog Perez, Carnicero Butcher, Oso Negro vs Lotario, Manuel Muñiz, Polo Torres

EMLL (FRI) 01/20/1956 Arena Coliseo
1) Troglodita Flores vs Chico Hernández
2) Dientes Hernández vs Eric Bouloff
3) Gorila Macias II vs Dr. Castro
4) Orquídea vs Canelo Segura
5) Jalisco González vs Jorge Allende
6) Halcón Negro vs Gorilita Flores
7) Chico Casasola, El Santo vs Blue Demon, Tarzán López

indy (SUN) 01/22/1956 Plaza de Toros el Progreso, Guadalajara, Jalisco [El Informador 1956-01-22]
1) ? vs ??
2) ? vs ??
3) ? vs ??
4) ? vs ??
5) El Enfermero, El Santo vs Huracán Ramírez, Rolando Vera

indy (SUN) 01/22/1956 Plaza de Toros Valente Arellano, Torreón, Coahuila [El Siglo de Torreon 1956-01-22, http://h.elsiglodetorreon.com.mx/Repository/getFiles.asp?Style=OliveXLib:LowLevelEntityToSaveGifMSIE_ELSIGLO&Type=text/html&Locale=spanish-skin-custom&Path=EDT/1956/01/23&ChunkNum=-1&ID=Ar00907&PageLabel=9 El Siglo de Torreon 1956-01-23]
1) Chacal Ramírez b Black Nassel
## Ramirez toko 1/3
2) Pedro Bolaños b Huroki Sito
## Bolanos took 1/3.
3) Gonzalo Gómez DRAW Raúl Reyes
4) Manuel Muñiz DQ Mario Prado
5) Lotario, Polo Torres b Bull Dog Perez, Carnicero Butcher

Dipp (TUE) 01/24/1956 Arena Olimpico Laguna, Gomez Palacio, Durango [El Siglo de Torreon 1956-01-24]
1) Black Nassel vs Tony Fussary
2) Huroki Sito vs Eddie Martinez
3) Lotario vs Gonzalo Gómez
4) Polo Torres vs Raúl Reyes
5) Blue Demon vs Bulldog Perez

indy (TUE) 01/24/1956 Plaza de Toros el Progreso, Guadalajara, Jalisco [El Informador 1956-01-24]
1) ? vs ??
2) El Enfermero, Medico Asesino vs Huracán Ramírez, Rolando Vera and El Espectro, Red Terror and Adolfo Bonales, Torbellino Negro and Abel Krim, Kiko Torres and Black Killer, Penado 14 [torneo]
## 1000 pesos to the winning team

indy (WED) 01/25/1956 Plaza de Toros Valente Arellano, Torreón, Coahuila [El Siglo de Torreon 1956-01-25, http://h.elsiglodetorreon.com.mx/Repository/getFiles.asp?Style=OliveXLib:LowLevelEntityToSaveGifMSIE_ELSIGLO&Type=text/html&Locale=spanish-skin-custom&Path=EDT/1956/01/26&ChunkNum=-1&ID=Ar01517&PageLabel=15 El Siglo de Torreon 1956-01-26]
1) Black Nassel DRAW Chu Chu García
2) Polo Torres b Gonzalo Gómez
3) Huroki Sito b Bull Dog Perez
4) Blue Demon b Mario Prado
5) Lotario b Raúl Reyes

EMLL (FRI) 01/27/1956 Arena Coliseo [http://superluchas.com/2015/01/27/en-un-dia-como-hoy-1956-santo-vs-blue-demon-en-mano-mano-emll-vs-pum/ SuperLuchas]
1) Memo Rubio b Apolo Sureño
## Memo Remo is ex-PUM
2) Dorrel Dixon b Califa
## Califa is ex PUM
3) Chale Romero b Joe Marín
## Romero is ex-PUM
4) Eduardo Bonada b Eddie Saxon
5) El Santo DQ Blue Demon
## actual main event
6) Sheik Mar Allah b Jaibo García
## prelim match done last.
&& EMLL vs ex memebrs of PUM (Jack OBrien promotion); they were still independent outsiders but unaffilated. EMLL also began prelim matches last so everyone wouldn't leave at the same time. This was continued over the next two decades.

indy (SUN) 01/29/1956 Arena Canada Dry, Guadalajara, Jalisco [El Informador 1956-01-29]
1) ? vs ??
2) ? vs ??
3) El Enfermero, Medico Asesino vs Abel Krim, Huracán Ramírez
4) Jorge Allende vs Rolando Vera
## Vera is a double middleweight champion

indy (SUN) 01/29/1956 Arena Jalisco, Guadalajara, Jalisco [El Informador 1956-01-29]
1) ? vs ??
2) ? vs ??
3) ? vs ??
4) Red Terror, Relámpago León vs Kiko Torres, Kiko Van Dick

indy (SUN) 01/29/1956 Arena Xalapa, Xalapa, Veracruz
1) El Angelito vs Chico Carta Blanca
2) Hijo Del Muerto vs El Brillante Japonés
3) Estrella Surena vs Araña Negra
4) Ciclón Corona, Tomás Riande vs Dandy, White Demon

Dipp (TUE) 01/31/1956 Arena Olimpico Laguna, Gomez Palacio, Durango [El Siglo de Torreon 1956-01-31, http://h.elsiglodetorreon.com.mx/Repository/getFiles.asp?Style=OliveXLib:LowLevelEntityToSaveGifMSIE_ELSIGLO&Type=text/html&Locale=spanish-skin-custom&Path=EDT/1956/02/01&ChunkNum=-1&ID=Ar00922&PageLabel=9 El Siglo de Torreon 1956-02-01]
1) Black Nassel b Chuchu García
## Chacal took 1/3.
2) Huroki Sito b Chacal Ramírez
3) Candela b Eddie Martinez
4) Manuel Muñiz b Oso Negro
## Muinz took 2/3
5) Lotario, Polo Torres b Bulldog Perez, Chico Casasola
## Polo's team took 1/3.

indy (TUE) 01/31/1956 Arena Xalapa, Xalapa, Veracruz
1) Daniel Aldana, Pepe Mendieta vs Carlos Moreno, Joaqiun Murrieta

indy (TUE) 01/31/1956 Plaza de Toros el Progreso, Guadalajara, Jalisco [El Informador 1956-01-31]
1) ? vs ??
2) ? vs ??
3) Adolfo Bonales, Jorge Allende vs Huracán Ramírez, Rolando Vera
4) Medico Asesino  (c) vs Abel Krim [OCCIDENTE HEAVY]

indy (WED) 02/01/1956 Plaza de Toros Valente Arellano, Torreón, Coahuila [El Siglo de Torreon 1956-02-01]
1) Black Nassel vs Bicha Martinez
2) Raúl Reyes vs Tacho Martí
3) Manuel Muñiz vs Huroki Sito
4) Chico Casasola, Oso Negro vs Lotario, Polo Torres
5) Carnicero Butcher vs Bull Dog Perez [super libre]

EMLL (FRI) 02/03/1956 Arena Coliseo [https://www.facebook.com/LuchaLibreDeAyerdeHoyYSiempre/posts/1087440447970356 DJ Spectro]
1) Jhonny Black b Gorila Osorio
## Jhonny Black is from PUM
2) Kiko Torres b Eskimo Blancarte
## TOrres is from PUM
3) El Califa b Chico Veloz
4) Cavernario Galindo, Dorrel Dixon b Black Killer, Blue Demon, Chale Romero, Gorilita Flores, Halcón Negro, Ray Mendoza [seeding battle royal]
5) Ray Mendoza DRAW Blue Demon
## PUM vs EMLL
6) Halcón Negro b Black Killer
## EMLL vs PUM
7) Chale Romero b Gorilita Flores
## PUM vs PUM
8) Dorrel Dixon DQ Cavernario Galindo
## straight falls by DQ
&& PUM vs EMLL themed show

EMLL (SUN) 02/05/1956 Arena Coliseo [Box y Lucha 237A]
1) Black Shadow, Joe Marín b Chico Casasola, El Enfermero
## debut of Enfermero

indy (SUN) 02/05/1956 Arena Canada Dry, Guadalajara, Jalisco [El Informador 1956-02-05]
1) ? vs ??
2) ? vs ??
3) Jorge Allende vs Huracán Ramírez
4) Cavernario Galindo, Medico Asesino vs Abel Krim, Pepe Mendieta

indy (SUN) 02/05/1956 Plaza de Toros Valente Arellano, Torreón, Coahuila [El Siglo de Torreon 1956-02-05]
1) Chacal Ramírez vs Black Nassel
2) Huroki Sito vs Red Man
3) Mario Prado vs La Rosa Blanca
4) Manuel Muñiz, Polo Torres vs Eskimo Blancarte, Oso Negro
5) Carnicero Butcher vs Bull Dog Perez [hair]

Dipp (TUE) 02/07/1956 Arena Olimpico Laguna, Gomez Palacio, Durango [El Siglo de Torreon 1956-02-07, http://h.elsiglodetorreon.com.mx/Repository/getFiles.asp?Style=OliveXLib:LowLevelEntityToSaveGifMSIE_ELSIGLO&Type=text/html&Locale=spanish-skin-custom&Path=EDT/1956/02/08&ChunkNum=-1&ID=Ar00705&PageLabel=7 El Siglo de Torreon 1956-02-08]
1) Chacal Ramírez b Black Nassel
2) Bicha Martinez b Huroki Sito
3) Mario Prado TLDRAW The Red Man
4) Manuel Muñiz, Pedro Bolaños b Eskimo Blancarte, Oso Negro
5) Bulldog Perez b Lotario

indy (TUE) 02/07/1956 Plaza de Toros el Progreso, Guadalajara, Jalisco [Box y Lucha 205A, El Informador 1956-02-07]
1) ? vs ??
2) ? vs ??
3) Jorge Allende, Medico Asesino b Apolo Águilar, Pepe Mendieta
4) Cavernario Galindo b Huracán Ramírez

indy (WED) 02/08/1956 Plaza de Toros Valente Arellano, Torreón, Coahuila [El Siglo de Torreon 1956-02-08]
1) Black Nassel vs Chu Chu García
2) Huroki Sito vs Mario Prado
3) Pedro Bolaños vs Red Man
4) Manuel Muñiz, Polo Torres vs Eskimo Blancarte, Oso Negro
5) Bull Dog Perez vs Carnicero Butcher [hair]
## rematch of a hair match days ago?

EMLL (FRI) 02/10/1956 Arena Coliseo [Box y Lucha 237A]
1) Enfermero, Gori Guerrero b Blue Demon, Tarzán López
## straight falls, setting up an Enfermero/Demon title match
&& location unclear

indy (SUN) 02/12/1956 Arena Canada Dry, Guadalajara, Jalisco [El Informador 1956-02-12]
1) ? vs ??
2) ? vs ??
3) Adolfo Bonales, Medico Asesino vs Apolo Águilar, Bobby Segura
4) Cavernario Galindo, Jorge Allende vs Huracán Ramírez, Pepe Mendieta

indy (SUN) 02/12/1956 Plaza de Toros Valente Arellano, Torreón, Coahuila [El Siglo de Torreon 1956-02-12, http://h.elsiglodetorreon.com.mx/Repository/getFiles.asp?Style=OliveXLib:LowLevelEntityToSaveGifMSIE_ELSIGLO&Type=text/html&Locale=spanish-skin-custom&Path=EDT/1956/02/13&ChunkNum=-1&ID=Ar01000&PageLabel=10 El Siglo de Torreon 1956-02-13]
1) Tonny Fussari DRAW Tacho Martí
2) Pedro Bolaños b Huroki Sito
3) Red Man b Mario Prado
## Red Man took 1/3.
4) Manuel Muñiz b Canelo Segura
5) Bull Dog Perez, Eskimo Blancarte b Lotario, Polo Torres
## Rudos toko 1/3

Dipp (TUE) 02/14/1956 Arena Olimpico Laguna, Gomez Palacio, Durango [El Siglo de Torreon 1956-02-14]
1) Chacal Ramírez vs Bicha Martinez
2) Huroki Sito vs Tony Fussary
3) The Red Man vs Eddie Martinez
4) Mario Prado vs Canelo Segura
5) Lotario, Manuel Muñiz vs Bulldog Perez, Eskimo Blancarte

indy (TUE) 02/14/1956 Plaza de Toros el Progreso, Guadalajara, Jalisco [El Informador 1956-02-14]
1) 1A, 1B vs 2A, 2B and 3A, 3B and 4A, 4B and 5A, 5B and 6A, 6B and 7A, 7B and 8A, 8B [torneo]
## 1000 pesos to the winner

indy (WED) 02/15/1956 Plaza de Toros Valente Arellano, Torreón, Coahuila [El Siglo de Torreon 1956-02-15, http://h.elsiglodetorreon.com.mx/Repository/getFiles.asp?Style=OliveXLib:LowLevelEntityToSaveGifMSIE_ELSIGLO&Type=text/html&Locale=spanish-skin-custom&Path=EDT/1956/02/16&ChunkNum=-1&ID=Ar00910&PageLabel=9 El Siglo de Torreon 1956-02-16]
1) Tony Fussary b Bicha Martinez
## Fussary took 1/3.
2) Pacho Bolaños b Tacho Martí
3) Huroki Sito DCOR The Red Man
4) Mario Prado b Eddie Martinez
## rudos took 2/3.
5) Bull Dog Perez, Canelo Segura, Eskimo Blancarte b Lotario, Manuel Muñiz, Polo Torres

EMLL (FRI) 02/17/1956 Arena Coliseo [Box y Lucha 205A, Box y Lucha 237A]
1) Carnicero Grimaldo b Mara
2) Chico Veloz b El Corzo
3) Dr. Castro b Fantomas
4) Fernando Oses b Murciélago Velazquez
5) Ray Mendoza b Jalisco González
## Ray Mendoza’s first win in Arena COliseo
6) Halcón Negro, Tarzán López b Carlos Moreno, Gorilita Flores
7) Blue Demon  (c) b El Enfermero [NWA WELTER]
## Enfermero has Demon in a hold but Demon is in the ropes, Enfermero argues with the referee, Demon topes him and wins.

EMLL (SUN) 02/19/1956 Arena Coliseo [Box y Lucha 205A]
1) Juan Diaz b Johnny Black
2) Apolo Sureño TLDRAW Kiko Torres
3) Moloch b José Macias
4) Black Killer b Akio Yoshihara
## both bled
5) Dorrel Dixon, Joe Grant b Chico Casasola, Gori Guerrero

indy (SUN) 02/19/1956 Arena Canada Dry, Guadalajara, Jalisco [El Informador 1956-02-19]
1) ? vs ??
2) ? vs ??
3) Medico Asesino vs Pepe Mendieta
4) Halcón Negro, Huracán Ramírez vs Cavernario Galindo, Jorge Allende
## Halcon Negro will unmask after the match.

indy (SUN) 02/19/1956 Plaza de Toros Valente Arellano, Torreón, Coahuila [El Siglo de Torreon 1956-02-19]
1) Chacal Ramírez vs El Maciste
2) The Red Man vs Tonny Fussari
3) Eskimo Blancarte vs Pedro Bolaños
4) Bull Dog Perez vs Lotario
5) Mario Prado, Polo Torres vs Canelo Segura, Manuel Muñiz

Dipp (TUE) 02/21/1956 Arena Olimpico Laguna, Gomez Palacio, Durango [El Siglo de Torreon 1956-02-21]
1) Tony Fussary vs Chu Chu García
2) Tacho Martí vs Eddie Martinez
3) The Red Man vs Mario Prado
4) Canelo Segura vs Pedro Bolaños
5) Lotario, Polo Torres vs Bulldog Perez, Eskimo Blancarte

indy (TUE) 02/21/1956 Plaza de Toros el Progreso, Guadalajara, Jalisco [El Informador 1956-02-21]
1) ? vs ??
2) ? vs ??
3) Jorge Allende vs Huracán Ramírez
4) Cavernario Galindo, Medico Asesino vs Bobby Segura, Pepe Mendieta

indy (WED) 02/22/1956 Plaza de Toros Valente Arellano, Torreón, Coahuila [El Siglo de Torreon 1956-02-22]
1) Tacho Martí vs El Maciste
2) Polo Torres vs Pedro Bolaños, Red Man, Mario Prado, Canelo Segura, Eskimo Blancarte, Manuel Muñiz, Bull Dog Perez

EMLL (FRI) 02/24/1956 Arena Coliseo [Box y Lucha 205A, Box y Lucha 206A]
1) Rudy Castillo vs Bruno Lopez
2) Sordomudo Quiroz vs El Pirata
3) Dientes Hernández vs Fernando Oses
4) Eduardo Bonada vs El Califa
5) Akio Yoshihara vs Orquídea
6) El Gladiador b Chale Romero
7) Dorrel Dixon, Joe Grant DQ El Santo, Gori Guerrero
## DQ for excessive double teaming, putting on La Estrella! In an interview, Dixon says he had trouble in this match because he idolizes Santo so much he didn’t want to hit him.
&& Box y Lucha talks a lot about the main event and doesn’t have results for the opening matches

EMLL (SAT) 02/25/1956 Arena Puebla [Box y Lucha 206A]
1) Gori Guerrero b Tarzán López
## straight falls

EMLL (SUN) 02/26/1956 Arena Coliseo [Box y Lucha 205A, Box y Lucha 206A]
1) Ali Bey b Sombra Azul
2) Gorila Macías III b Kiko Torres
## straight falls
3) Black Killer b Jalisco González
4) Halcón Negro b Gorilita Flores
## straight falls, first by DQ.
5) Blue Demon, Joe Marín b Chico Casasola, El Enfermero

indy (SUN) 02/26/1956 Arena Canada Dry, Guadalajara, Jalisco [El Informador 1956-02-26]
1) ? vs ??
2) Jorge Allende, Red Terror vs Apolo Águilar, Huracán Ramírez
3) Medico Asesino vs Pepe Mendieta
4) Gori Guerrero vs Cavernario Galindo

indy (SUN) 02/26/1956 Plaza de Toros Valente Arellano, Torreón, Coahuila [El Siglo de Torreon 1956-02-26, http://h.elsiglodetorreon.com.mx/Repository/getFiles.asp?Style=OliveXLib:LowLevelEntityToSaveGifMSIE_ELSIGLO&Type=text/html&Locale=spanish-skin-custom&Path=EDT/1956/02/27&ChunkNum=-1&ID=Ar00909&PageLabel=9 El Siglo de Torreon 1956-02-27]
1) Eddie Martinez b El Maciste
## straight falls
2) Red Man DRAW Pedro Bolaños
3) Mario Prado b Canelo Segura
## Mario took 1/3.
4) Apolo Sureño b Lotario
## Apolo took 1/3.
5) Polo Torres, Rolando Vera DQ El Mongol, Manuel Muñiz

Dipp (TUE) 02/28/1956 Arena Olimpico Laguna, Gomez Palacio, Durango [El Siglo de Torreon 1956-02-28]
1) Chacal Ramírez vs Tony Fussary
2) The Red Man vs Tacho Martí
3) Eddie Martinez vs Canelo Segura
4) Apolo Sureño, Manuel Muñiz vs Mario Prado, Polo Torres
5) Rolando Vera vs El Mongol

indy (TUE) 02/28/1956 Plaza de Toros el Progreso, Guadalajara, Jalisco [El Informador 1956-02-28]
1) ? vs ??
2) ? vs ??
3) El Espectro, Jorge Allende vs Huracán Ramírez, Pepe Mendieta
4) Cavernario Galindo, Monje Loco vs Adolfo Bonales, Medico Asesino

indy (WED) 02/29/1956 Plaza de Toros Valente Arellano, Torreón, Coahuila [El Siglo de Torreon 1956-02-29]
1) Apolo Sureño, Red Man vs El Mongol, Tony Fussari and Canelo Segura, Tacho Martí and Eddie Martinez, Manuel Muñiz and Lotario, Pedro Bolaños and Mario Prado, Polo Torres [torneo]
## 2000 pesos for the winner

EMLL (FRI) 03/02/1956 Arena Coliseo [Box y Lucha 206A, Box y Lucha 207A]
1) Ángel Negro b Chamaco Vega
2) Jalisco González TLDRAW José Macias
## 30 minute draw
3) Daniel Aldana b Ali Bey
4) Halcón Negro b Black Killer [quarterfinal]
5) Joe Grant b Ray Mendoza [quarterfinal]
6) El Gladiador b Gorilla Flores [quarterfinal]
7) Blue Demon b Fernando Oses [quarterfinal]
8) Halcón Negro b Joe Grant [semifinal]
9) El Gladiador b Blue Demon [semifinal]
10) Halcón Negro b El Gladiador [final]

EMLL (SUN) 03/04/1956 Arena Coliseo [Box y Lucha 206A, Box y Lucha 207A]
1) Mar Allah b Rudy Tinoco
2) Ed Mangoetech b Carlos Segura
## straight falls
3) Akio Yoshihara DQ Canelo Segura
## straight falls, second by DQ
4) Carlos Moreno b Chale Romero
5) El Enfermero, El Santo b Blue Demon, Joe Marín

indy (SUN) 03/04/1956 Arena Canada Dry, Guadalajara, Jalisco [El Informador 1956-03-04]
1) ? vs ??
2) El Espectro vs Huracán Ramírez
3) Adolfo Bonales, Medico Asesino vs Jorge Allende, Monje Loco
4) Halcón Negro vs Cavernario Galindo

indy (SUN) 03/04/1956 Plaza de Toros Valente Arellano, Torreón, Coahuila [El Siglo de Torreon 1956-03-04, http://h.elsiglodetorreon.com.mx/Repository/getFiles.asp?Style=OliveXLib:LowLevelEntityToSaveGifMSIE_ELSIGLO&Type=text/html&Locale=spanish-skin-custom&Path=EDT/1956/03/05&ChunkNum=-1&ID=Ar01208&PageLabel=12 El Siglo de Torreon 1956-03-05]
1) Tonny Fussari b El Maciste
2) Red Man b Chacal Ramírez
3) Apolo Sureño b Mario Prado
4) Lotario b Gorila Macias II
5) Eddie Martinez, Manuel Muñiz b Jalisco González, Polo Torres
## Gonzalez's debut ehre

Dipp (TUE) 03/06/1956 Arena Olimpico Laguna, Gomez Palacio, Durango [El Siglo de Torreon 1956-03-06]
1) Jalisco González vs ? [battle royal]
2) The Red Man vs Mario Prado [mask, hair]

indy (TUE) 03/06/1956 Plaza de Toros el Progreso, Guadalajara, Jalisco [El Informador 1956-03-06]
1) ? vs ??
2) Jorge Allende vs Pepe Mendieta
3) Medico Asesino vs Monje Loco
4) Halcón Negro, Huracán Ramírez vs Cavernario Galindo, El Espectro

indy (WED) 03/07/1956 Plaza de Toros Valente Arellano, Torreón, Coahuila [El Siglo de Torreon 1956-03-07]
1) Tonny Fussari vs Chacal Ramírez
2) Red Man vs Eddie Martinez
3) Mario Prado vs Pedro Bolaños
4) Apolo Sureño, Gorila Macias II vs Jalisco González, Polo Torres
5) Manuel Muñiz vs Lotario

EMLL (FRI) 03/09/1956 Arena Coliseo [Box y Lucha 207A, Box y Lucha 208A]
1) Rogelio De La Paz b Gorila Osorio
2) Fantomas b Juan Diaz
3) Sordomudo Rodríguez b Dientes Hernández
## return of Rodirguez
4) Dr. Castro DRAW Oso Negro
## return of Oso Negro. Said to be a great match.
5) Fernando Oses b Canelo Segura
6) Joe Marín b Gorilita Flores
7) El Santo, Enfermero b Dorrel Dixon, Joe Grant
## Santo gets the win after he and Gori were DQed last week. Article talks about how Enfermero learned his new hold from Buddy Rodgers
&& Results are spread out through the magazine

EMLL (SUN) 03/11/1956 Arena Coliseo [Box y Lucha 207A, Box y Lucha 209A]
1) Mar Allah b Johnny Black
2) Carnicero Grimaldo b El Corzo
3) Akio Yoshihara b Eduardo Bonada
4) Ray Mendoza b Murciélago Velazquez
5) Black Killer, Gladiador DQ Black Shadow, Halcón Negro
## return of BLack Shadow. Killer claims Halcon fouled Gladiador. Referee believes it but Box y Lucha is unconvinced

indy (SUN) 03/11/1956 Arena Canada Dry, Guadalajara, Jalisco [El Informador 1956-03-11]
1) 1A, 1B vs 2A, 2B and 3A, 3B and 4A, 4B and 5A, 5B and 6A, 6B and 7A, 7B and 8A, 8B [torneo]
## 2000 pesos to the winner

indy (SUN) 03/11/1956 Plaza de Toros Valente Arellano, Torreón, Coahuila [El Siglo de Torreon 1956-03-11, http://h.elsiglodetorreon.com.mx/Repository/getFiles.asp?Style=OliveXLib:LowLevelEntityToSaveGifMSIE_ELSIGLO&Type=text/html&Locale=spanish-skin-custom&Path=EDT/1956/03/12&ChunkNum=-1&ID=Ar00911&PageLabel=9 El Siglo de Torreon 1956-03-12]
1) Jaibo García DQ Tony Fussari
2) Tacho Martí DRAW Johnny Rodríguez
3) Apolo Sureño b Pedro Bolaños
4) Jalisco González, Polo Torres b Eddie Martinez, Gorila Macias II
## Torres team took 2/3.
5) Manuel Muñiz DQ Lotario

Dipp (TUE) 03/13/1956 Arena Olimpico Laguna, Gomez Palacio, Durango [El Siglo de Torreon 1956-03-13]
1) Chabela Romero vs Toña La Tapatia
2) La Enfermera vs Rosa Williams
3) Irma González vs Dama Enmascarada
4) Jalisco González, Polo Torres vs Apolo Sureño, Manuel Muñiz

indy (TUE) 03/13/1956 Plaza de Toros el Progreso, Guadalajara, Jalisco [El Informador 1956-03-13]
1) ? vs ??
2) ? vs ??
3) El Espectro, Monje Loco vs Huracán Ramírez, Pepe Mendieta
4) Adolfo Bonales, Canelo Segura vs Cavernario Galindo, Jorge Allende

indy (WED) 03/14/1956 Plaza de Toros Valente Arellano, Torreón, Coahuila [El Siglo de Torreon 1956-03-14]
1) Chacal Ramírez vs Chu Chu García
2) Chabela Romero vs La Enfermera
3) Dama Enmascarada vs Toña La Tapatia
4) Irma González vs Rosa Williams
5) Apolo Sureño, Gorila Macias II, Manuel Muñiz vs Lotario, Pedro Bolaños, Polo Torres

EMLL (FRI) 03/16/1956 Arena Coliseo [Box y Lucha 208A, Box y Lucha 209A]
1) Pery Lopez b Taro Hito
## may have taken place after the main event
2) El Pirata b Rogelio De La Paz
3) Eduardo Bonada b Fantomas
4) Oso Negro b Akio Yoshihara
5) Gorilita Flores b Fernando Oses
6) El Mongol b Chico Casasola
## debut of Mongol
7) El Enfermero, El Santo b Black Shadow, Blue Demon
## Santo & Enfermero took ⅔.

EMLL (SUN) 03/18/1956 Arena Coliseo [Box y Lucha 200A, Box y Lucha 208A]
1) Sombra Azul b Bobby Rolando
## return of Bobby Rolando
2) Eskimo Blancarte TLDRAW Kiko Torres
## 30 minutes
3) Murciélago Velazquez b Dientes Hernández
4) Dorrel Dixon b Ray Mendoza
5) Black Killer, El Gladiador b Halcón Negro, Joe Marín

indy (SUN) 03/18/1956 Arena Jalisco, Guadalajara, Jalisco [El Informador 1956-03-18]
1) Penado 14 vs Red Terror [mask, cash, super libre]
## Red Terror is masked, but unclear who’s got what on the line

indy (SUN) 03/18/1956 Plaza de Toros Valente Arellano, Torreón, Coahuila [El Siglo de Torreon 1956-03-18, http://h.elsiglodetorreon.com.mx/Repository/getFiles.asp?Style=OliveXLib:LowLevelEntityToSaveGifMSIE_ELSIGLO&Type=text/html&Locale=spanish-skin-custom&Path=EDT/1956/03/19&ChunkNum=-1&ID=Ar00916&PageLabel=9 El Siglo de Torreon 1956-03-19]
1) Chacal Ramírez DRAW Jaibo García
2) Chu Chu García b Tonny Fussari
3) Gonzalo Gómez b Tacho Martí
4) Johnny Rodríguez, Polo Torres b Eddie Martinez, Gorila Macias II
## Team Polo took 2/3
5) Manuel Muñiz b Lotario [hair]
## said to be 90 minutes long!

Dipp (TUE) 03/20/1956 Arena Olimpico Laguna, Gomez Palacio, Durango [El Siglo de Torreon 1956-03-20, http://h.elsiglodetorreon.com.mx/Repository/getFiles.asp?Style=OliveXLib:LowLevelEntityToSaveGifMSIE_ELSIGLO&Type=text/html&Locale=spanish-skin-custom&Path=EDT/1956/03/21&ChunkNum=-1&ID=Ar00908&PageLabel=9 El Siglo de Torreon 1956-03-21]
1) Jaibo García b Tony Fussary
2) Johnny Rodríguez DQ Tacho Martí
3) Eddie Martinez DRAW Gonzalo Gómez
4) La Enfermera b Chabela Romero
## Enfermera took 2/3.
5) Irma González, Toña La Tapatia b Dama Enmascarada, Rosa Williams

indy (TUE) 03/20/1956 Plaza de Toros el Progreso, Guadalajara, Jalisco [El Informador 1956-03-20]
1) ? vs ??
2) ? vs ??
3) Canelo Segura, Gori Casanova vs Tonny Smith, Tony López
4) El Mongol vs Monje Loco

indy (WED) 03/21/1956 Plaza de Toros Valente Arellano, Torreón, Coahuila [El Siglo de Torreon 1956-03-21]
1) Tony Fussari vs Sombra Del Norte
2) Toña La Tapatia vs Chabela Romero
3) Rosa Williams vs La Enfermera
4) Dama Enmascarada vs Irma González
5) Johnny Rodríguez, Polo Torres vs Eddie Martinez, Manuel Muñiz

EMLL (FRI) 03/23/1956 Arena Coliseo [Box y Lucha 209A, Box y Lucha 210A, Box y Lucha 237A]
1) Kid Vanegas b Bruno Lopez
## actually happened after the main event
2) Carnicero Grimaldo b Sordomudo Quiroz
3) Akio Yoshihara b Dientes Hernández
4) Oso Negro b Orquídea
5) Carlos Moreno b Ray Mendoza
## best match of the night
6) Chale Romero, El Mongol b Halcón Negro, Joe Marín
## Halcon Negro also listed as Halcon Quintana
7) Enfermero CO Black Shadow
## Black Shadow has Enfermo beat with a tope but referee Rudy Blancarte is out of the ring due to a neck injury. Shadow tries another tope, Enfermero moves out of the way, and Shadow can not stand before 20.

EMLL (SUN) 03/25/1956 Arena Coliseo [Box y Lucha 209A, Box y Lucha 210A, Box y Lucha 237A]
1) Mar Ala b Rocky Man
2) Daniel Aldana b Joaquin Murrieta
3) Gorila Macias II DRAW Dr. Castro
4) Dorrel Dixon b Gorilla Flores
5) Blue Demon, Tarzán López b Gladiador, The Black Killer

indy (SUN) 03/25/1956 Arena Canada Dry, Guadalajara, Jalisco [Box y Lucha 211A, El Informador 1956-03-25]
1) 1 vs 2, 3, 4, 5, 6
2) Jalisco González DQ Canelo Segura
3) El Santo b Halcón Negro

indy (SUN) 03/25/1956 Plaza de Toros Valente Arellano, Torreón, Coahuila [El Siglo de Torreon 1956-03-25, http://h.elsiglodetorreon.com.mx/Repository/getFiles.asp?Style=OliveXLib:LowLevelEntityToSaveGifMSIE_ELSIGLO&Type=text/html&Locale=spanish-skin-custom&Path=EDT/1956/03/26&ChunkNum=-1&ID=Ar00903&PageLabel=9 El Siglo de Torreon 1956-03-26]
1) Toña La Tapatia b Rosa Williams
2) La Enfermera b Chabela Romero
3) Irma González b Dama Enmascarada
4) Lotario, Raúl Reyes b Gonzalo Gómez, Tacho Martí
5) Manuel Muñiz b Polo Torres

indy (TUE) 03/27/1956 Arena Olimpico Laguna, Gomez Palacio, Durango [http://h.elsiglodetorreon.com.mx/Repository/getFiles.asp?Style=OliveXLib:LowLevelEntityToSaveGifMSIE_ELSIGLO&Type=text/html&Locale=spanish-skin-custom&Path=EDT/1956/03/28&ChunkNum=-1&ID=Ar00707&PageLabel=7 El Siglo de Torreon]
1) Jaibo García b Cavernario Galindo II
2) Chu Chu García b Chacal Ramírez
3) Maciste DRAW Tony Fussary
4) Raúl Reyes b Tacho Martí
5) Lotario, Polo Torres b Gonzalo Gómez, Manuel Muñiz
## straight falls

indy (TUE) 03/27/1956 Plaza de Toros el Progreso, Guadalajara, Jalisco [Box y Lucha 211A, El Informador 1956-03-27]
1) ? vs ??
2) ? vs ??
3) Frankenstein vs Índio Mejia
4) Adolfo Bonales vs Tonny Lopez
5) El Espectro b Jalisco González

EMLL (SAT) 03/31/1956 Arena Coliseo [Box y Lucha 210A, Box y Lucha 211A, Box y Lucha 237A]
1) Taro Hito b Mar Ala
2) Juan Diaz b El Corzo
3) Chico Veloz DRAW Kiko Torres
4) Sordomudo Rodríguez b Orquídea
5) Pepe Mendieta b Black Killer
6) Halcón Negro b El Mongol
7) El Santo, Enfermero b Dorrel Dixon, Joe Grant

EMLL (SUN) 04/01/1956 Arena Coliseo [Box y Lucha 210A, Box y Lucha 211A]
1) Carnicero Grimaldo vs Bruno Lopez
2) Akio Yoshihara vs Red Man
3) Dr. Castro b El Bulldog
4) Joe Marín DQ Chale Romero
## straight falls, DQs in both.
5) Black Shadow, Blue Demon DRAW Bobby Bonales, Gladiador
## double pin with Shadow and Bonales.
&& no mention of the opening matches

indy (SUN) 04/01/1956 Arena Canada Dry, Guadalajara, Jalisco [El Informador 1956-04-01]
1) ? vs ??
2) ? vs ??
3) ? vs ??
4) Halcón Negro, Tarzán López DQ El Espectro, El Santo
## Espectro fouled Tarzan

indy (SUN) 04/01/1956 Plaza de Toros Valente Arellano, Torreón, Coahuila [El Siglo de Torreon 1956-04-01]
1) Chu Chu García vs Cavernario III
2) Jaibo García vs Sombra Del Norte
3) Raúl Reyes vs Karloff Lagarde
4) Gorilla Flores vs Mario Teelo
5) Lotario, Polo Torres vs El Califa, Manuel Muñiz

Dipp (TUE) 04/03/1956 Arena Olimpico Laguna, Gomez Palacio, Durango [El Siglo de Torreon 1956-04-03]
1) Jaibo García vs Chu Chu García
2) El Maciste vs Tacho Martí
3) Karloff Lagarde vs Mario Teelo
4) Lotario vs Manuel Muñiz
5) El Califa, Gorilla Flores vs Polo Torres, Raúl Reyes

indy (TUE) 04/03/1956 Plaza de Toros el Progreso, Guadalajara, Jalisco [Box y Lucha 212A, El Informador 1956-04-03]
1) ? vs ??
2) ? vs ??
3) Canelo Segura vs Tony López
4) Jalisco González, Tarzán López b El Espectro, Monje Loco

indy (WED) 04/04/1956 Plaza de Toros Valente Arellano, Torreón, Coahuila [El Siglo de Torreon 1956-04-04]
1) Jaibo García vs Chu Chu García
2) Polo Torres vs Gorilita Flores, Manuel Muñiz, El Califa, Karloff Lagarde, Lotario, Mario Teelo, Raúl Reyes [battle royal]

EMLL (FRI) 04/06/1956 Arena Coliseo [Box y Lucha 211A]
1) Johnny Black vs El Gavilán
## not listed in the results
2) Rogelio De La Paz b Carlos Segura
3) Chico Veloz b Dientes Hernández
4) Eduardo Bonada DRAW Moloch
5) Black Killer b Orquídea
## Orquidea replaecd Fernando Oses
6) Dorrel Dixon b Joe Marín
7) Black Shadow, Blue Demon b Chale Romero, El Mongol
## lots of topes to knock down the bigger man

EMLL (SUN) 04/08/1956 Arena Coliseo [Box y Lucha 211A, Box y Lucha 212A]
1) Bobby Rolando b Rudy Castillo
2) Kiko Torres b Fantomas
3) Orquídea b Akio Yoshihara
4) Pepe Mendieta b El Bulldog
5) Bobby Bonales, Gladiador b Chico Casasola, El Enfermero

indy (SUN) 04/08/1956 Arena Canada Dry, Guadalajara, Jalisco [Box y Lucha 213A, El Informador 1956-04-08]
1) ? vs ??
2) ? vs ??
3) ? vs ??
4) Blue Demon vs El Espectro

indy (SUN) 04/08/1956 Plaza de Toros Valente Arellano, Torreón, Coahuila [El Siglo de Torreon 1956-04-08]
1) Jaibo García vs El Maciste
2) Tacho Martí vs Toro Cisneros
3) Karloff Lagarde vs Ray Plata
4) Ray Mendoza vs Lotario
5) Polo Torres, Raúl Reyes vs Gorilla Flores, Manuel Muñiz

indy (MON) 04/09/1956 Plaza de Toros Valente Arellano, Torreón, Coahuila [El Siglo de Torreon 1956-04-09]
1) Chu Chu García vs Bicha Martinez
2) Jaibo García vs Toro Cisneros
3) Tacho Martí vs El Maciste
4) Karloff Lagarde vs Raúl Reyes
5) Lotario, Polo Torres, Rey Plata vs Goriita Flores, Manuel Muñiz, Ray Mendoza

Dipp (TUE) 04/10/1956 Arena Olimpico Laguna, Gomez Palacio, Durango [El Siglo de Torreon 1956-04-10]
1) Chuchu García vs Cavernario Galindo II
2) Jaibo García vs Bicha Martinez
3) Karloff Lagarde vs Maciste
4) Manuel Muñiz vs Ray Plata
5) Gorilla Flores, Ray Mendoza vs Polo Torres, Raúl Reyes

indy (TUE) 04/10/1956 Plaza de Toros el Progreso, Guadalajara, Jalisco [El Informador 1956-04-10]
1) ? vs ??
2) ? vs ??
3) Carlos Moreno vs Adolfo Bonales
4) Blue Demon, Tarzán López vs El Espectro, Monje Loco

indy (WED) 04/11/1956 Plaza de Toros Valente Arellano, Torreón, Coahuila [El Siglo de Torreon 1956-04-11]
1) Chu Chu García vs Bicha Martinez
2) Jaibo García vs Toro Cisneros
3) Tacho Martí vs El Maciste
4) Karloff Lagarde vs Raúl Reyes
5) Lotario, Polo Torres, Ray Plata vs Gorilita Flores, Manuel Muñiz, Ray Mendoza

EMLL (FRI) 04/13/1956 Arena Coliseo [Box y Lucha 212A, Box y Lucha 213A]
1) Taro Hito b Kid Vanegas
2) Sordomudo Quiroz b Rogelio De La Paz
3) Gorila Macías III DRAW Joaquin Murrieta
4) Oso Negro b Sordomudo Rodríguez
5) Joe Marín DQ El Mongol
6) Halcón Quintana b Frank Butcher
## ex-Televcentro Butcher loses in his debut here
7) Rolando Vera b El Santo

EMLL (SUN) 04/15/1956 Arena Coliseo [Box y Lucha 212A, Box y Lucha 213A]
1) Carlos Segura b El Corzo
2) Chico Veloz b Red Man
3) Dr. Castro DQ Murciélago Velazquez
## straight falls (one of them by DQ)
4) Chico Casasola, El Enfermero b Black Killer, Bobby Bonales
5) El Gladiador b Black Shadow
## a savage battle

indy (SUN) 04/15/1956 Arena Canada Dry, Guadalajara, Jalisco [El Informador 1956-04-15]
1) ? vs ??
2) ? vs ??
3) Carlos Moreno, Carlos Segura vs Apolo Águilar, Jalisco González
4) El Espectro, Jorge Allende vs Huracán Ramírez, Tarzán López

indy (SUN) 04/15/1956 Plaza de Toros Valente Arellano, Torreón, Coahuila [El Siglo de Torreon 1956-04-15]
1) El Maciste vs Toro Cisneros
2) Jaibo García vs Chacal Ramírez
3) Karloff Lagarde vs Ray Plata
4) Ray Mendoza vs Polo Torres
5) Halcón Negro, Raúl Reyes vs Gorila Macías III, Gorilla Flores

Dipp (TUE) 04/17/1956 Arena Olimpico Laguna, Gomez Palacio, Durango [El Siglo de Torreon 1956-04-17]
1) Toro Cisneros vs Black Martinez
2) Karloff Lagarde vs Chacal Ramírez
3) Ray Plata vs Tacho Martí
4) Gorila Macías III, Ray Mendoza vs Polo Torres, Raúl Reyes
5) Halcón Negro vs Gorilita Flores

indy (TUE) 04/17/1956 Plaza de Toros el Progreso, Guadalajara, Jalisco [El Informador 1956-04-17]
1) ? vs ??
2) ? vs ??
3) Adolfo Bonales vs Carlos Moreno
4) Jorge Allende, Monje Loco vs Huracán Ramírez, Jalisco González

indy (WED) 04/18/1956 Plaza de Toros Valente Arellano, Torreón, Coahuila [El Siglo de Torreon 1956-04-18]
1) Chu Chu García vs Jaibo García
2) El Maciste vs Tacho Martí
3) Karloff Lagarde vs Raúl Reyes
4) Gorila Macías III vs Ray Plata
5) Halcón Negro, Polo Torres vs Gorilla Flores, Ray Mendoza

EMLL (FRI) 04/20/1956 Arena Coliseo [Box y Lucha 213A, Box y Lucha 214A]
1) Mar Allah b Johnny Black
## appears to have actually taken place after the main event
2) Red Man b Juan Diaz
3) Sordomudo Rodríguez b Chico Veloz
4) El Califa b Dr. Castro
5) Black Killer b Canelo Segura
6) Pepe Mendieta b Chico Casasola
## Mendieta took ⅓, losing the second by DQ.
7) Blue Demon, Rolando Vera b Bobby Bonales, El Gladiador

EMLL (SUN) 04/22/1956 Arena Coliseo [Box y Lucha 213A, Box y Lucha 214A]
1) Carnicero Grimaldo b Kid Vanegas
2) Bobby Rolando TLDRAW Kiko Torres
## 20 minutes
3) Oso Negro b Akio Yoshihara
## straight falls
4) Gorilita Flores b Emilio Charles
5) Carnicero Butcher, El Mongol b Halcón Negro, Joe Grant

indy (SUN) 04/22/1956 Arena Canada Dry, Guadalajara, Jalisco [El Informador 1956-04-22]
1) ? vs ??
2) ? vs ??
3) ? vs ??
4) Blue Demon  (c) b El Espectro [NWA WELTER]
## Demon took 1/3 to retain

indy (SUN) 04/22/1956 Plaza de Toros Valente Arellano, Torreón, Coahuila [El Siglo de Torreon 1956-04-22, http://h.elsiglodetorreon.com.mx/Repository/getFiles.asp?Style=OliveXLib:LowLevelEntityToSaveGifMSIE_ELSIGLO&Type=text/html&Locale=spanish-skin-custom&Path=EDT/1956/04/23&ChunkNum=-1&ID=Ar00900&PageLabel=9 El Siglo de Torreon 1956-04-23]
1) Bicha Martinez b Jaibo García
2) Mishima Ota DRAW Karloff Lagarde
3) Ray Mendoza b Gonzalo Gómez
4) Llanero Solitario, Raúl Reyes b Gorila Macías III, Manuel Muñiz
## debut of Llanero Solitario
5) El Santo b Dorrel Dixon
&& Arena said to be a sell out

indy (TUE) 04/24/1956 Plaza de Toros el Progreso, Guadalajara, Jalisco [El Informador 1956-04-24]
1) ? vs ??
2) ? vs ??
3) Frankenstein, Monje Loco vs Chico Chow, Chico Veloz
4) Blue Demon, Jalisco González vs Carlos Moreno, Jorge Allende

indy (WED) 04/25/1956 Plaza de Toros Valente Arellano, Torreón, Coahuila [El Siglo de Torreon 1956-04-25]
1) Jaibo García vs Jesus Chavez
2) Mishima Ota vs Chacal Ramírez
3) Karloff Lagarde vs Llanero Solitario
4) Raúl Reyes vs Manuel Muñiz
5) Dorrel Dixon vs Gorila Macías III

indy (THU) 04/26/1956 Arena Canada Dry, Guadalajara, Jalisco [El Informador 1956-04-26]
1) ? vs ??
2) ? vs ??
3) ? vs ??
4) Bobby Bonales vs El Enfermero

EMLL (FRI) 04/27/1956 Arena México [Box y Lucha 215A, https://twitter.com/CMLL_OFICIAL/status/1387069276838715395/photo/1 CMLL, Lucha Libre 148]
1) Erick Bouloff b Carlos Segura
## Carlos Segura replaced Bobby Rolando. Firpo Segura, Carlos' father, watched the match from the 10th row. Boulouff has been around long enough to wrestle Firpo. Actually took place after the main event.
2) Canelo Segura b Dr. Castro
3) Black Killer b Manuel Robles
4) Joe Marín b El Califa
## said to be best match on the show
5) Bobby Bonales b Gorilla Flores
6) El Gladiador b El Enfermero
7) El Santo, Medico Asesino b Blue Demon, Rolando Vera
## Medico Aseisno debut in Arena Mexico. He had been a Televicentro star who wrestled independently and internationally following the demise of that group. (He wouldn't be around long; those other places pay better, but Box y Lucha notices he's got a big size advantage on his opponents.) Santo & Asesino took 2/3.
&& Firpo Segura, Dientes Hernandez and Tarzan Lopez appeared as legends to welcome in the new arena. Box y Lucha has a photo of Firpo breaking a champagne bottle on the side of a ringpost to welcome the building. Box y Lucha keeps writing the attendance as 25,000 people, far higher than capacity was reported historically. The show had three announcers: Picoro, Maximiliano Aguilar and Alfredo Adam (who had done just the boxing shows to this point.) Gate is said to be over 100,000, breaking the 87,000 record set by Santo/Shadow.

Indy (SAT) 04/28/1956 Arena Puebla [Box y Lucha 214A]
1) Enfermero, Medico Asesino b Joe Marín, Rolando Vera

EMLL (SUN) 04/29/1956 Arena México [Box y Lucha 214A, Box y Lucha 215A]
1) Juan Diaz b Rogelio De La Paz
2) Akio Yoshihara b Fantomas
3) Emilio Charles b Moloch
4) Pepe Mendieta b Chale Romero
5) Dorrel Dixon, Joe Grant b Carnicero Butcher, El Mongol

indy (SUN) 04/29/1956 Plaza de Toros Valente Arellano, Torreón, Coahuila [Box y Lucha 215A, El Siglo de Torreon 1956-04-29]
1) Chacal Ramírez vs Jaibo García
2) Mishima Ota vs Chu Chu García
3) Huracán Ramírez vs Tacho Martí
4) Llanero Solitario, Raúl Reyes vs Apolo Sureño, Karloff Lagarde
5) Medico Asesino b Gorila Macías III

Dipp (TUE) 05/01/1956 Arena Olimpico Laguna, Gomez Palacio, Durango [El Siglo de Torreon 1956-05-01]
1) Jaibo García vs Chacal Ramírez
2) Mishima Ota vs Karloff Lagarde
3) Llanero Solitario vs El Maciste
4) Huracán Ramírez vs Gorila Macías III
5) Medico Asesino vs Raúl Reyes

EMLL (TUE) 05/01/1956 Arena México [Box y Lucha 214A, Box y Lucha 215A]
1) Mar Allah b José Munoz
2) Kiko Torres b Carlos Segura
## straight falls
3) Dientes Hernández b Oso Negro
## straight falls, first by DQ
4) Canelo Segura b Manuel Robles
## bloody match
5) Bobby Bonales, El Gladiador b Chico Casasola, El Santo
## match came down to Gladaidor beating El Santo
&& Box y Lucha says CMLL ran this Tuesday Arena Mexico so that everyone who was working on Friday or couldn’t get a ticket would have another chance to see the new building. It worked, strong turnout.

indy (TUE) 05/01/1956 Arena Canada Dry, Guadalajara, Jalisco [El Informador 1956-05-01]
1) 1A, 1B vs 2A, 2B and 3A, 3B and 4A, 4B and 5A, 5B and 6A, 6B and 7A, 7B and 8A, 8B [torneo]
## 1000 pesos to the winner

indy (WED) 05/02/1956 Plaza de Toros Valente Arellano, Torreón, Coahuila [El Siglo de Torreon 1956-05-02]
1) Chu Chu García vs Cavernario III
2) Mishima Ota vs Jaibo García
3) Llanero Solitario vs Tacho Martí
4) Huracán Ramírez vs Karloff Lagarde
5) Apolo Sureño, Medico Asesino vs Polo Torres, Raúl Reyes

EMLL (FRI) 05/04/1956 Arena México [Box y Lucha 215A, Box y Lucha 216A]
1) Red Man b Bruno Lopez
## actually took place after the main event
2) Akio Yoshihara b Juan Diaz
3) Manuel Robles b Murciélago Velazquez
4) Joe Marín, Pepe Mendieta b Bulldog, Gorilla Flores [quarterfinal]
5) Bobby Bonales, Gladiador b Rolando Vera, Tarzán López [quarterfinal]
6) Dorrel Dixon, Joe Grant b Chale Romero, El Califa [quarterfinal]
7) Enfermero, Medico Asesino b Carnicero Butcher, Mongol [quarterfinal]
8) Carnicero Butcher, Mongol b Bobby Bonales, Gladiador [semifinal]
9) Dorrel Dixon, Joe Grant b El Enfermero, Medico Asesino [semifinal]
10) Dorrel Dixon, Joe Grant b Bobby Bonales, Gladiador [final]
## Dixon and Grant won trophies and 10,000 pesos

EMLL (SUN) 05/06/1956 Arena Coliseo [Box y Lucha 215A, Box y Lucha 216A]
1) Sombra Azul b Chico Hernández
2) Dientes Hernández b Fantomas
3) José Macias b Moloch
4) Canelo Segura, Chico Casasola b Dr. Castro, Emilio Charles
## Charles went to the ring after having a few alcholic beverages and was subsequently suspended
5) El Santo b El Gladiador [super libre]
## Santo wins the rematch

EMLL (SUN) 05/06/1956 Cuernavaca, Morelos [Box y Lucha 215A]
1) Irma González vs Rosa Williams
## Gonzalez is champion at this point

indy (SUN) 05/06/1956 Arena Canada Dry, Guadalajara, Jalisco [El Informador 1956-05-06]
1) ? vs ??
2) ? vs ??
3) Oso Negro vs Jalisco González
4) Carlos Moreno, Jorge Allende vs Dorrel Dixon, Rolando Vera

indy (SUN) 05/06/1956 Plaza de Toros Valente Arellano, Torreón, Coahuila [El Siglo de Torreon 1956-05-06, http://h.elsiglodetorreon.com.mx/Repository/getFiles.asp?Style=OliveXLib:LowLevelEntityToSaveGifMSIE_ELSIGLO&Type=text/html&Locale=spanish-skin-custom&Path=EDT/1956/05/07&ChunkNum=-1&ID=Ar01004&PageLabel=10 El Siglo de Torreon 1956-05-07]
1) Bicha Martinez b Jaibo García [NORTE LIGHT, #1 Contenders, quarterfinal]
2) Chu Chu García b Joe Galindo [NORTE LIGHT, #1 Contenders, quarterfinal]
3) Mishima Ota b Jesus Chavez [NORTE LIGHT, #1 Contenders, quarterfinal]
4) Karloff Lagarde b Llanero Solitario [NORTE LIGHT, #1 Contenders, quarterfinal]
5) Huracán Ramírez, Polo Torres DQ Apolo Sureño, Bobby Bonales
## straight falls

PRI (SUN) 05/06/1956 Guadalajara, Jalisco [RB]
1) Bulldog II vs Chacal Jr.
2) Súper Ratón vs Ruben López
3) Chaie García vs Tony García
4) Robot vs Raúl López
5) Fraile Zapopan, La Mujer Leopardo vs La Tapatía, Rayito Norteño

Dipp (TUE) 05/08/1956 Arena Olimpico Laguna, Gomez Palacio, Durango [El Siglo de Torreon 1956-05-08]
1) Jaibo García vs Jesus Chavez
2) Bicha Martinez vs El Maciste
3) Mishima Ota vs Chuchu García
4) Karloff Lagarde vs Chacal Ramírez
5) Apolo Sureño, Bobby Bonales vs Huracán Ramírez, Llanero Solitario

indy (TUE) 05/08/1956 Plaza de Toros el Progreso, Guadalajara, Jalisco [El Informador 1956-05-08]
1) ? vs ??
2) ? vs ??
3) ? vs ??
4) Huracán Ramírez, Orquídea vs Carlos Moreno, Jorge Allende

indy (WED) 05/09/1956 Plaza de Toros Valente Arellano, Torreón, Coahuila [El Siglo de Torreon 1956-05-09]
1) Karloff Lagarde vs Llanero Solitario
2) Apolo Sureño vs Mario Teelo
3) Bobby Bonales vs Huracán Ramírez
4) Apolo Sureño, Bobby Bonales, Karloff Lagarde vs Huracán Ramírez, Llanero Solitario, Mario Teelo

EMLL (FRI) 05/11/1956 Arena Coliseo [Box y Lucha 215A]
1) Gorila Osorio vs Taro Hito
2) Kiko Torres vs Ali Bey
3) Frankenstein vs Dr. Castro
4) Orquídea vs El Califa
5) Black Killer vs Joe Marín
6) Pepe Mendieta vs El Mongol
7) Dorrel Dixon, Joe Grant vs Enfermero, Medico Asesino

EMLL (SUN) 05/13/1956 Arena Coliseo [Box y Lucha 215A]
1) El Coyote vs Mar Ala
2) Carnicero Grimaldo vs Juan Diaz
3) Manuel Robles vs Chale Romero
4) El Mongol vs Halcón Negro
5) Chico Casasola, Santo vs Rolando Vera, Tarzán López

indy (SUN) 05/13/1956 Arena Canada Dry, Guadalajara, Jalisco [El Informador 1956-05-13]
1) ? vs ??
2) ? vs ??
3) ? vs ??
4) El Gladiador, Moloch vs Carlos Moreno, Jorge Allende

indy (SUN) 05/13/1956 Plaza de Toros Valente Arellano, Torreón, Coahuila [El Siglo de Torreon 1956-05-13, http://h.elsiglodetorreon.com.mx/Repository/getFiles.asp?Style=OliveXLib:LowLevelEntityToSaveGifMSIE_ELSIGLO&Type=text/html&Locale=spanish-skin-custom&Path=EDT/1956/05/14&ChunkNum=-1&ID=Ar00901&PageLabel=9 El Siglo de Torreon 1956-05-14]
1) Chacal Ramírez b Jaibo García
2) Chu Chu García b Bicha Martinez [NORTE LIGHT, semifinal, #1 Contenders]
3) Mishima Ota b Karloff Lagarde [NORTE LIGHT, semifinal, #1 Contenders]
4) Carlos Segura b Llanero Solitario
5) Apolo Sureño, Bobby Bonales b Alex Romano, Huracán Ramírez

Dipp (TUE) 05/15/1956 Arena Olimpico Laguna, Gomez Palacio, Durango [El Siglo de Torreon 1956-05-15]
1) ? vs ??
2) Jaibo García vs Chu Chu García
3) Mario Texas vs El Maciste
4) Llanero Solitario vs Karloff Lagarde
5) Apolo Sureño, Bobby Bonales vs Carlos Segura, Huracán Ramírez

indy (TUE) 05/15/1956 Plaza de Toros el Progreso, Guadalajara, Jalisco [El Informador 1956-05-15]
1) ? vs ??
2) ? vs ??
3) Carlos Moreno, Oso Negro vs Jalisco González, Kiko Torres
4) El Gladiador vs Jorge Allende

indy (WED) 05/16/1956 Guatemala City, Guatemala [Lucha Libre 126]
1) El Santo b Rolando Vera [NWA MIDDLE]

indy (WED) 05/16/1956 Plaza de Toros Valente Arellano, Torreón, Coahuila [El Siglo de Torreon 1956-05-16]
1) Bobby Bonales vs Tacho Martí, Carlos Segura, Llanero Solitario, Karloff Lagarde, Mario Texas, Huracán Ramírez, Apolo Sureño [battle royal]
2) Mishima Ota vs Chu Chu García [NORTE LIGHT, #1 Contenders, final]

EMLL (FRI) 05/18/1956 Arena Coliseo [Lucha Libre 153]
1) El Pirata vs Kid Vanegas
2) Ciclón Veloz vs Jean Michaud
3) Joe García vs Chamaco Castro
4) Francisco Pino vs Tarzán López
5) Gori Guerrero vs Cavernario Galindo

indy (SUN) 05/20/1956 Arena Canada Dry, Guadalajara, Jalisco [El Informador 1956-05-20]
1) ? vs ??
2) ? vs ??
3) El Gladiador vs Huracán Ramírez
4) Black Shadow, Dorrel Dixon vs Carlos Moreno, Jorge Allende

indy (SUN) 05/20/1956 Plaza de Toros Valente Arellano, Torreón, Coahuila [El Siglo de Torreon 1956-05-20]
1) Mario Texas vs Tacho Martí
2) Karloff Lagarde vs Llanero Solitario
3) Huracán Ramírez vs Carlos Segura
4) Mishima Ota vs Chu Chu García [NORTE LIGHT, #1 Contenders, final]
## again? Sunday rained out?
5) Pepe Mendieta, Polo Torres vs Adolfo Bonales, Apolo Sureño

indy (TUE) 05/22/1956 Plaza de Toros el Progreso, Guadalajara, Jalisco [El Informador 1956-05-22]
1) 1 vs 2, 3, 4, 5, 6, 7, 8 [torneo]
2) Alejandro Cruz vs El Gladiador

indy (WED) 05/23/1956 Plaza de Toros Valente Arellano, Torreón, Coahuila [El Siglo de Torreon 1956-05-23]
1) El Maciste vs Jaibo García
2) Apolo Sureño vs Karloff Lagarde, Adolfo Bonales, Mario Texas, Carlos Segura, Huracán Ramírez, Pepe Mendieta, Polo Torres [torneo]

EMLL (FRI) 05/25/1956 Arena Coliseo [Punch 95]
1) Rogelio De La Paz b El Coyote
2) Juan Diaz b Gorila Osorio
3) Memo Rubio b Fantomas
4) El Mongol b Gorilita Flores
5) El Santo b Gran Markus
## debut of Markus
6) Tarzán López b Carnicero Butcher
7) Rolando Vera b Bobby Bonales
## Vera took 2/3
&& top 4 matches set by battle royal

indy (SUN) 05/27/1956 Arena Canada Dry, Guadalajara, Jalisco [El Informador 1956-05-27]
1) ? vs ??
2) ? vs ??
3) Carlos Moreno, El Bulldog, Jorge Allende vs Dorrel Dixon, Huracán Ramírez, Tonny Lopez
4) Black Shadow vs El Gladiador

indy (SUN) 05/27/1956 Plaza de Toros Valente Arellano, Torreón, Coahuila [El Siglo de Torreon 1956-05-27, http://h.elsiglodetorreon.com.mx/Repository/getFiles.asp?Style=OliveXLib:LowLevelEntityToSaveGifMSIE_ELSIGLO&Type=text/html&Locale=spanish-skin-custom&Path=EDT/1956/05/28&ChunkNum=-1&ID=Ar01206&PageLabel=12 El Siglo de Torreon 1956-05-28]
1) Chacal Ramírez b Cavernario III
2) Mishima Ota b Jaibo García
3) Karloff Lagarde DRAW Mario Texas
4) Adolfo Bonales b Carlos Segura
5) Huracán Ramírez, Polo Torres b Apolo Sureño, El Santo

Dipp (TUE) 05/29/1956 Arena Olimpico Laguna, Gomez Palacio, Durango [El Siglo de Torreon 1956-05-29]
1) Chacal Ramírez vs Cavernario Galindo II
2) Mishima Ota vs Bicha Martinez
3) Huracán Ramírez vs Karloff Lagarde
4) Carlos Segura vs Apolo Sureño
5) El Santo vs Adolfo Bonales

EMLL (TUE) 05/29/1956 Arena México [Lucha Libre 50]
1) Blue Demon, Joe Grant, Polo Torres vs El Enfermero, El Santo, Medico Asesino

indy (TUE) 05/29/1956 Plaza de Toros el Progreso, Guadalajara, Jalisco [El Informador 1956-05-29]
1) ? vs ??
2) ? vs ??
3) ? vs ??
4) Black Shadow, Dorrel Dixon vs Carlos Moreno, Jorge Allende

indy (WED) 05/30/1956 Plaza de Toros Valente Arellano, Torreón, Coahuila [El Siglo de Torreon 1956-05-30]
1) Jaibo García vs Chu Chu García
2) Mario Texas vs El Maciste
3) Carlos Segura vs Karloff Lagarde
4) Huracán Ramírez, Polo Torres vs Apolo Sureño, The Black Killer

indy (SUN) 06/03/1956 Arena Canada Dry, Guadalajara, Jalisco [El Informador 1956-06-03]
1) ? vs ??
2) ? vs ??
3) Carlos Moreno, Gargantua, Jorge Allende vs Dorrel Dixon, Kiko Torres, Tony López
4) El Espectro vs Black Shadow

indy (SUN) 06/03/1956 Plaza de Toros Valente Arellano, Torreón, Coahuila [El Siglo de Torreon 1956-06-03]
1) ? vs ??
2) ? vs ??
3) Black Killer vs Carlos Segura
4) Apolo Sureño, El Enfermero vs Pepe Mendieta, Polo Torres

Dipp (TUE) 06/05/1956 Arena Olimpico Laguna, Gomez Palacio, Durango [El Siglo de Torreon 1956-06-05]
1) Tiburón Cubano vs Maciste
2) Mishima Ota vs Dragón Negro
3) Roble Ocadiz vs Tacho Martí
4) Black Killer vs Mario Texas
5) Apolo Sureño, El Enfermero vs Canelo Segura, Pepe Mendieta

indy (TUE) 06/05/1956 Plaza de Toros el Progreso, Guadalajara, Jalisco [El Informador 1956-06-05]
1) 1A, 1B vs 2A, 2B and 3A, 3B and 4A, 4B and 5A, 5B and 6A, 6B and 7A, 7B and 8A, 8B [torneo]
## 1000 pesos

indy (WED) 06/06/1956 Plaza de Toros Valente Arellano, Torreón, Coahuila [El Siglo de Torreon 1956-06-06]
1) Chu Chu García vs Cavernario III
2) El Maciste vs El Tiburón Cubano
3) Mario Texas vs Tacho Martí
4) Carlos Segura, Pepe Mendieta vs Apolo Sureño, The Black Killer
5) El Enfermero vs Joe Marín

EMLL (FRI) 06/08/1956 Arena Coliseo [Box y Lucha 237A, Lucha Libre 50]
1) Medico Asesino b Joe Grant [super libre]
2) El Enfermero b Blue Demon

EMLL (SUN) 06/10/1956 Aguascalientes, Aguascalientes [CLINCH 225]
1) Black Shadow, Dorrel Dixon DQ Carlos Moreno, Red Terror
## Moreno arrested after a crowd fight during the match - held from 11 pm to 4 pm the next day. Fined 40 pesos and suspended from wrestling in the state for a year. Moreno tells Clinch 224 that the security wasn’t doing their job, and the Aguascalientes commission disputes that version in Clinch 225.

indy (SUN) 06/10/1956 Plaza de Toros el Progreso, Guadalajara, Jalisco [El Informador 1956-06-10]
1) ? vs ??
2) ? vs ??
3) ? vs ??
4) El Enfermero, El Santo vs Carlos Moreno, Jorge Allende

indy (SUN) 06/10/1956 Plaza de Toros Valente Arellano, Torreón, Coahuila [El Siglo de Torreon 1956-06-10]
1) Chu Chu García vs Dragón Negro
2) Roble Ocadiz vs Tiburón González
## the same person who’s been called Tiburon Cubano
3) Carlos Segura vs Tacho Martí
4) Pepe Medieta, Polo Torres vs Apolo Sureño, Mario Texas
5) Mishima Ota b Chacal Ramírez  (c) [NORTE LIGHT]
## Ota is listed as champ on next show

indy (TUE) 06/12/1956 Plaza de Toros el Progreso, Guadalajara, Jalisco [El Informador 1956-06-12]
1) ? vs ??
2) Dorrel Dixon vs Jorge Allende
3) El Enfermero vs Carlos Moreno
4) Gargantua, Moloch vs El Espectro, Monje Loco

EMLL (FRI) 06/15/1956 Distrito Federal [Lucha Libre 148, RB]
1) El Enfermero, El Santo, Medico Asesino b Black Shadow, Dorrel Dixon, Joe Grant
&& location unknown

indy (SUN) 06/17/1956 Plaza de Toros el Progreso, Guadalajara, Jalisco [El Informador 1956-06-17]
1) ? vs ??
2) ? vs ??
3) ? vs ??
4) El Santo vs Jorge Allende
5) El Enfermero b Carlos Moreno [beard, mask]
## Carlos Moreno put his beard (and lost if it happened.)

indy (SUN) 06/17/1956 Plaza de Toros Valente Arellano, Torreón, Coahuila [El Siglo de Torreon 1956-06-17]
1) Chacal Ramírez vs Ray Mejia
2) Rene Guajardo vs El Coyote
3) Carlos Segura vs Mario Texas
4) Pepe Mendieta, Polo Torres vs Apolo Sureño, Carnicero Butcher
5) Mishima Ota vs Karloff Lagarde

Dipp (TUE) 06/19/1956 Arena Olimpico Laguna, Gomez Palacio, Durango [El Siglo de Torreon 1956-06-19]
1) Chu Chu García vs Dragón Negro
2) Ocadiz vs Tiburón González
3) El Coyote vs Ray Mejia
4) Canelo Segura, Rene Guajardo vs Apolo Sureño, Mario Texas
5) Carnicero Butcher vs Polo Torres

indy (TUE) 06/19/1956 Arena Aficion
1) Don Gil vs Chato García
2) Luis Hernández vs Troglodita Flores
3) Frankenstein vs Charro Lopez
4) Lorenzo Soto vs Enrique Camarena
## Soto is state Middleweight champion
5) Irma González, La Enfermera vs Chabela Romero, Rosita Williams

indy (TUE) 06/19/1956 Plaza de Toros el Progreso, Guadalajara, Jalisco [El Informador 1956-06-19]
1) 1 vs 2, 3, 4, 5, 6, 7, 8 [torneo]
2) Black Shadow, Huracán Ramírez vs Carlos Moreno, Jorge Allende

EMLL (FRI) 06/22/1956 Arena México [Box y Lucha 237A, Lucha Libre 149]
1) Blue Demon  (c) b Enfermero [NWA WELTER]
2) El Santo  (c) b Rolando Vera [NWA MIDDLE]
&& Record gate of 160,000 pesos. First show with two world titles in play.

indy (SUN) 06/24/1956 Plaza de Toros el Progreso, Guadalajara, Jalisco [El Informador 1956-06-24]
1) ? vs ??
2) ? vs ??
3) ? vs ??
4) El Santo b Jorge Allende [mask, hair]
## Santo won if it happened.

indy (SUN) 06/24/1956 Plaza de Toros Valente Arellano, Torreón, Coahuila [El Siglo de Torreon 1956-06-24, http://h.elsiglodetorreon.com.mx/Repository/getFiles.asp?Style=OliveXLib:LowLevelEntityToSaveGifMSIE_ELSIGLO&Type=text/html&Locale=spanish-skin-custom&Path=EDT/1956/06/25&ChunkNum=-1&ID=Ar01309&PageLabel=13 El Siglo de Torreon 1956-06-25]
1) Chacal Ramírez b Dragón Negro
## straight falls
2) Mishima Ota DQ El Coyote
## Coyote foul
3) Rene Guajardo b Mario Texas
## Rene took 1/3.
4) Carlos Segura DCOR Huroki Sito
5) Joe Marín, Polo Torres b Apolo Sureño, Carnicero Butcher

Dipp (TUE) 06/26/1956 Arena Olimpico Laguna, Gomez Palacio, Durango [El Siglo de Torreon 1956-06-26]
1) ? vs ??
2) Huroki Sito vs Apolo Sureño, Carnicero Butcher, El Coyote, Manuel Muñiz, Carlos Segura, Mario Texas, Rene Guajardo [battle royal]

indy (TUE) 06/26/1956 Plaza de Toros el Progreso, Guadalajara, Jalisco [El Informador 1956-06-26]
1) ? vs ??
2) ? vs ??
3) Black Shadow vs Carlos Moreno
4) La Coreana, Rosa Williams vs Irma González, La Enfermera Del Médico Asesino

EMLL (SUN) 07/01/1956 Arena Coliseo [CLINCH 225]
1) El Pirata b Mar Allah
2) Black Killer TLDRAW Gorilita Flores
## 30 minute draw. Very exciting
3) Carlos Moreno b Emilio Charles
4) Bobby Bonales b Jalisco González
5) Rolando Vera b Chico Casasola
## straight falls
&& matches set by battle royal

indy (SUN) 07/01/1956 Plaza de Toros el Progreso, Guadalajara, Jalisco [El Informador 1956-07-01]
1) ? vs ??
2) ? vs ??
3) ? vs ??
4) Irma González  (c) vs Rosa Williams [MEX WOMEN]
5) El Santo vs Cavernario Galindo

indy (SUN) 07/01/1956 Plaza de Toros Valente Arellano, Torreón, Coahuila [El Siglo de Torreon 1956-07-01]
1) Chu Chu García vs Bicha Martinez
2) Chacal Ramírez vs Chamaco Ranger
3) Mishima Ota vs El Coyote
4) Apolo Sureño, Huroki Sito vs Carlos Segura, Rene Guajardo
5) Polo Torres vs Carnicero Butcher

Dipp (TUE) 07/03/1956 Arena Olimpico Laguna, Gomez Palacio, Durango [El Siglo de Torreon 1956-07-03]
1) Chu Chu García vs Cavernario Galindo II
2) El Coyote vs Chacal Ramírez
3) Carlos Segura vs Huroki Sito
4) Apolo Sureño vs Rene Guajardo
5) Jalisco González vs Busher

indy (TUE) 07/03/1956 Arena Aficion
1) Rubio Negrete vs Jabalí
2) Sombra Azul vs Ángel Grandos
3) Daniel Aldana vs Ali Bey [#1 Contenders, MEX HEAVY]
4) Juan Diaz, Memo Rubi vs Luis Hernández, Troglodita Flores
5) Karis La Momia vs Canelo Segura

indy (TUE) 07/03/1956 Plaza de Toros el Progreso, Guadalajara, Jalisco [El Informador 1956-07-03]
1) 1 vs 2, 3, 4, 5, 6, 7, 8 [torneo]
2) Moloch vs El Espectro [mask]

EMLL (FRI) 07/06/1956 Arena Coliseo [CLINCH 225]
1) El Pirata b Rudy García
2) Juan Diaz TLDRAW Seki Moto
## 15 minutes
3) Frankenstein b Chico Veloz
4) Mario Tello b Oso Negro
5) Jorge Allende b Pepe Mendieta
6) El Enfermero b Bobby Bonales
7) Dorrel Dixon, Joe Marín, Rolando Vera b Carlos Moreno, El Mongol, Gorilita Flores

EMLL (SUN) 07/08/1956 Arena Coliseo [CLINCH 225]
1) Ali Bey b Sombra Azul
2) Joaquin Murrieta b José Macias
3) Adolfo Bonales DRAW Manuel Robles
4) Tarzán López b Chico Casasola
5) Medico Asesino b Joe Grant

indy (SUN) 07/08/1956 Plaza de Toros el Progreso, Guadalajara, Jalisco [El Informador 1956-07-08]
1) ? vs ??
2) ? vs ??
3) ? vs ??
4) Alejandro Cruz, Blue Demon vs Cavernario Galindo, El Bulldog

indy (SUN) 07/08/1956 Plaza de Toros Valente Arellano, Torreón, Coahuila [http://h.elsiglodetorreon.com.mx/Repository/getFiles.asp?Style=OliveXLib:LowLevelEntityToSaveGifMSIE_ELSIGLO&Type=text/html&Locale=spanish-skin-custom&Path=EDT/1956/07/09&ChunkNum=-1&ID=Ar00702&PageLabel=7 El Siglo de Torreon]
1) Chacal Ramírez b Ray Mejia
2) Mishima Ota b Chuchu García
## Ota will defend his lightweight tile against Karloff Lagarde next week
3) Carlos Segura b Tacho Martí
4) Jalisco González, Rene Guajardo b El Coyote, Huroki Sito
5) Polo Torres  (c) b Carnicero Butcher [NORTE HEAVY]

Dipp (TUE) 07/10/1956 Arena Olimpico Laguna, Gomez Palacio, Durango [El Siglo de Torreon 1956-07-10]
1) Chu Chu García vs Bicha Martinez
2) Tacho Martí vs Ray Mejia
3) Rene Guajardo vs El Coyote
4) Huroki Sito vs Carlos Segura
5) Jalisco González, Polo Torres vs Apolo Sureño, Carnicero Butcher

indy (TUE) 07/10/1956 Plaza de Toros el Progreso, Guadalajara, Jalisco [El Informador 1956-07-10]
1) 1A, 1B vs 2A, 2B and 3A, 3B and 4A, 4B and 5A, 5B and 6A, 6B and 7A, 7B and 8A, 8B [torneo]
## 2000 pesos to the winner

EMLL (FRI) 07/13/1956 Arena Coliseo [CLINCH 225]
1) Kid Vanegas b Carnicero Grimaldo
2) Beau Brummel b Bobby Rolando
3) Orquídea DRAW Frankenstein
4) Mario Tello b Manuel Robles
5) Giuliano b Chale Romero
6) Rolando Vera b Jorge Allende
7) Dorrel Dixon, Joe Grant b Enfermero, Medico Asesino

EMLL (SUN) 07/15/1956 Arena Coliseo [CLINCH 225]
1) Bruno Lopez b Wama
2) José Macias b Eskimo Blancarte
3) Adolfo Bonales b Jacobo Macías
4) Black Killer b Emilio Charles
5) Carlos Moreno, Mongol, Verdugo b Joe Marín, Pepe Mendieta, Tarzán López

indy (SUN) 07/15/1956 Plaza de Toros el Progreso, Guadalajara, Jalisco [El Informador 1956-07-15]
1) 1 vs 2, 3, 4, 5, 6 [battle royal]
2) Alejandro Cruz, Blue Demon vs Cavernario Galindo, El Bulldog

indy (SUN) 07/15/1956 Plaza de Toros Valente Arellano, Torreón, Coahuila [El Siglo de Torreon 1956-07-15]
1) Chu Chu García vs Cavernario III
2) El Coyote vs El Maciste
3) Huroki Sito vs Rene Guajardo
4) Carnicero Butcher, Manuel Robles vs Carlos Segura, Jalisco González
5) Mishima Ota  (c) vs Karloff Lagarde [NORTE LIGHT]

Dipp (TUE) 07/17/1956 Arena Olimpico Laguna, Gomez Palacio, Durango [El Siglo de Torreon 1956-07-17, http://h.elsiglodetorreon.com.mx/Repository/getFiles.asp?Style=OliveXLib:LowLevelEntityToSaveGifMSIE_ELSIGLO&Type=text/html&Locale=spanish-skin-custom&Path=EDT/1956/07/18&ChunkNum=-1&ID=Ar01312&PageLabel=13 El Siglo de Torreon 1956-07-18]
1) Manuel Robles b Rene Guajardo
2) Carnicero Butcher b Popeye Franco
3) Carlos Segura b Coyote
4) Jalisco González b Huroki Sito

indy (TUE) 07/17/1956 Plaza de Toros el Progreso, Guadalajara, Jalisco [El Informador 1956-07-17]
1) ? vs ??
2) ? vs ??
3) Rosa Williams vs Irma González
4) El Bulldog vs Alejandro Cruz
5) Blue Demon vs Cavernario Galindo

EMLL (FRI) 07/20/1956 Arena Coliseo [CLINCH 225]
1) Guapo Rodríguez b Mar Allah
2) Centella Inca b Memo Rubio
3) Canelo Segura b Orquídea
4) Black Killer DQ Mario Teelo
5) Giullano b Gorilita Flores
6) El Santo, Medico Asesino b Dorrel Dixon, Joe Grant

EMLL (SAT) 07/21/1956 Arena Puebla [Clinch 225, Lucha Libre 106]
** Arena Puebla 3rd Anniversary
1) Kiko Torres vs Frankenstein
2) Pepe Mendieta vs El Espectro
3) El Enfermero, Medico Asesino vs Mongol, Ray Mendoza
4) El Santo  (c) b Rolando Vera [NWA MIDDLE]
## Santo's 6th defense, said to be the first Mexican to reach that mark with a world title

EMLL (SUN) 07/22/1956 Arena Coliseo [CLINCH 225]
1) Chale Romero, Mongol b ?, ?? [quarterfinal]
2) Dorrel Dixon, Gran Markus b ?, ?? [quarterfinal]
3) Carlos Moreno, Jorge Allende b Joe Marín, Pepe Mendieta [quarterfinal]
4) Rolando Vera, Tarzán López b Enfermero, Moloch [quarterfinal]
5) Carlos Moreno, Jorge Allende b Dorrel Dixon, Gran Markus [semifinal]
6) Rolando Vera, Tarzán López b Chale Romero, Mongol [semifinal]
7) Rolando Vera, Tarzán López b Carlos Moreno, Jorge Allende [final]

indy (SUN) 07/22/1956 Plaza de Toros el Progreso, Guadalajara, Jalisco [El Informador 1956-07-22]
1) ? vs ??
2) ? vs ??
3) Cavernario Galindo, El Bulldog, Lalo El Exotico vs Alejandro Cruz, Blue Demon, Ray Valadez

indy (SUN) 07/22/1956 Plaza de Toros Valente Arellano, Torreón, Coahuila [El Siglo de Torreon 1956-07-22, http://h.elsiglodetorreon.com.mx/Repository/getFiles.asp?Style=OliveXLib:LowLevelEntityToSaveGifMSIE_ELSIGLO&Type=text/html&Locale=spanish-skin-custom&Path=EDT/1956/07/23&ChunkNum=-1&ID=Ar01305&PageLabel=13 El Siglo de Torreon 1956-07-23]
1) Gorila Buigani b Chacal Ramírez
2) Tacho Martí b Popeye Franco
3) El Coyote DCOR Mishima Ota
4) Chivo García b Rene Guajardo
5) Carlos Segura, Jalisco González, Polo Torres DQ Carnicero Butcher, Huroki Sito, Manuel Robles

Dipp (TUE) 07/24/1956 Arena Olimpico Laguna, Gomez Palacio, Durango [El Siglo de Torreon 1956-07-24]
1) Gorila Bulgani vs El Maciste
2) El Coyote vs Chu Chu García
3) Huroki Sito vs Popeye Franco
4) Manuel Robles vs Rene Guajardo
5) Carnicero Butcher, Chivo García vs Carlos Segura, Jalisco González

indy (TUE) 07/24/1956 Plaza de Toros el Progreso, Guadalajara, Jalisco [El Informador 1956-07-24]
1) ? vs ??
2) ? vs ??
3) El Bulldog, Monje Loco vs Blue Demon, Ray Valadez
4) Alejandro Cruz vs Cavernario Galindo

EMLL (FRI) 07/27/1956 Arena Coliseo [CLINCH 225]
1) Wama b Mar Allah
2) Chico Veloz b Eskimo Blancarte
3) Tony Barbetta b Kiko Torres
4) Black Killer DRAW Jalisco González
5) Espectro b Joe Marín
## debut of Espectro
6) Giullano b Mongol
## Mongol first loss (as a singles?)
7) El Santo, Medico Asesino b Joe Grant, Rolando Vera

indy (SUN) 07/29/1956 Plaza de Toros el Progreso, Guadalajara, Jalisco [El Informador 1956-07-29]
1) ? vs ??
2) ? vs ??
3) Carnicero Butcher vs Ray Valadez
4) El Bulldog, Medico Asesino vs Alejandro Cruz, Joe Grant

indy (SUN) 07/29/1956 Plaza de Toros Valente Arellano, Torreón, Coahuila [El Siglo de Torreon 1956-07-29, http://h.elsiglodetorreon.com.mx/Repository/getFiles.asp?Style=OliveXLib:LowLevelEntityToSaveGifMSIE_ELSIGLO&Type=text/html&Locale=spanish-skin-custom&Path=EDT/1956/07/30&ChunkNum=-1&ID=Ar01227&PageLabel=12 El Siglo de Torreon 1956-07-30]
1) Mishima Ota vs Chacal Ramírez
2) Popeye Franco vs El Coyote
3) Rene Guajardo vs King Kong
4) Chivo García, Huroki Sito b Carlos Segura, Polo Torres
5) Manuel Robles b Blue Demon

Dipp (TUE) 07/31/1956 Arena Olimpico Laguna, Gomez Palacio, Durango [El Siglo de Torreon 1956-07-31, http://h.elsiglodetorreon.com.mx/Repository/getFiles.asp?Style=OliveXLib:LowLevelEntityToSaveGifMSIE_ELSIGLO&Type=text/html&Locale=spanish-skin-custom&Path=EDT/1956/08/01&ChunkNum=-1&ID=Ar01522&PageLabel=15 El Siglo de Torreon 1956-08-01]
1) Gorila Bulgani b Chu Chu García
2) Chacal Ramírez b El Coyote
3) Carlos Segura DQ King Kong
## debut of King Kong (replacing Cabecitas Alvarez)
4) Huroki Sito, Manuel Robles b Popeye Franco, Rene Guajardo
5) Blue Demon b Chivo García

indy (TUE) 07/31/1956 Plaza de Toros el Progreso, Guadalajara, Jalisco [El Informador 1956-07-31]
1) ? vs ??
2) ? vs ??
3) El Bulldog vs Ray Valadez
4) Carnicero Butcher vs Alejandro Cruz
5) Medico Asesino vs Joe Grant

EMLL (FRI) 08/03/1956 Arena México [Box y Lucha 237A]
1) Canelo Segura b ?? [MEX WELTER, quarterfinal]
2) Joe Marín b ?? [MEX WELTER, quarterfinal]
3) Jalisco González b Black Killer [MEX WELTER, quarterfinal]
4) Enfermero b Orquídea [MEX WELTER, quarterfinal]

EMLL (SUN) 08/05/1956 Arena Coliseo [Box y Lucha 230A]
1) Miguel King b ? [MEX HEAVY, quarterfinal]
2) Lotario b Carlos Moreno [MEX HEAVY, quarterfinal]
3) Medico Asesino b Joaquin Murrieta [MEX HEAVY, quarterfinal]
4) Pepe Mendieta b ? [MEX HEAVY, quarterfinal]
&& matches assumed based on 08/12 results

indy (SUN) 08/05/1956 Plaza de Toros el Progreso, Guadalajara, Jalisco [El Informador 1956-08-05]
1) ? vs ??
2) ? vs ??
3) Cavernario Galindo, El Verdugo vs Carnicero Butcher, Lalo El Exotico
4) El Enfermero vs Alejandro Cruz

indy (SUN) 08/05/1956 Plaza de Toros Valente Arellano, Torreón, Coahuila [El Siglo de Torreon 1956-08-05]
1) El Coyote vs Chu Chu García
2) King Kong vs Popeye Franco
3) Huroki Sito vs Carlos Segura
4) Polo Torres, Rene Guajardo vs Cabecitas Alvarez, Chivo García
5) Blue Demon vs Manuel Robles [mask, hair]
## Demon kept his mask and took Robles’ hair if match occurred

Dipp (TUE) 08/07/1956 Arena Olimpico Laguna, Gomez Palacio, Durango [El Siglo de Torreon 1956-08-07]
1) El Coyote vs El Maciste
2) King Kong vs Gorila Bulgani
3) Huroki Sito vs Chacal Ramírez
4) Rene Guajardo vs Cabecistas Alvarez
5) Blue Demon, Carlos Segura vs Chivo García, Manuel Robles

indy (TUE) 08/07/1956 Plaza de Toros el Progreso, Guadalajara, Jalisco [El Informador 1956-08-07]
1) ? vs ??
2) ? vs ??
3) Alejandro Cruz vs Carnicero Butcher [super libre]
4) El Enfermero, Medico Asesino vs Cavernario Galindo, El Bulldog

EMLL (WED) 08/08/1956 Acapulco, Guerrero [Box y Lucha 230A]
1) Espectro, Gorilita Flores b ?, ?? [torneo]

EMLL (FRI) 08/10/1956 Arena México [Box y Lucha 230A, Box y Lucha 237A]
1) Jalisco González b Canelo Segura [MEX WELTER, semifinal]
## Rated 7 ½
2) Enfermero b Joe Marín [MEX WELTER, semifinal]
## mentioned in a photo caption. Rated 7 ½
3) Espectro, Santo b Blue Demon, Dorrel Dixon
## Santo & Espectro praised as a team. Dixon lost but talks about getting a title match against Santo in September later in the magazine. Rated 7 ½
&& 230A only talks about the main event; Enfermero/Marin is referred to in a photo caption. 237A clarifies that was a tournament match and adds the Jalisco Gonzalez win.

EMLL (SUN) 08/12/1956 Arena Coliseo [Box y Lucha 230A]
1) Bobby Rolando b Ali Bey
2) Adolfo Bonales b Kiko Torres
3) Lotario b Miguel King [semifinal, MEX HEAVY]
## Lotario got a big head cut and was out for a short amount of time. He beat Carlos Moreno in the quarterfinals.
4) Medico Asesino b Pepe Mendieta [semifinal, MEX HEAVY]
## Straight falls. Asesino previously beat Joaquin Murrieta also in straight falls
5) Jorge Allende, Ray Mendoza b Joe Grant, Tarzán López [super libre]
## Rated 7

Indy (SUN) 08/12/1956 Arena Aficion [Box y Lucha 230A]
1) Black Killer, El Gladiador b Espectro, La Momia

Indy (SUN) 08/12/1956 Pachuca, Hidalgo [Box y Lucha 230A]
1) Jalisco González vs Joe Marín
## said to be a great technical match that the crowd didn’t care about

indy (SUN) 08/12/1956 Plaza de Toros el Progreso, Guadalajara, Jalisco [El Informador 1956-08-12]
1) ? vs ??
2) ? vs ??
3) El Bulldog, El Verdugo vs Alejandro Cruz, Giuliano
4) Dorrel Dixon vs Cavernario Galindo

indy (SUN) 08/12/1956 Plaza de Toros Valente Arellano, Torreón, Coahuila [El Siglo de Torreon 1956-08-12, http://h.elsiglodetorreon.com.mx/Repository/getFiles.asp?Style=OliveXLib:LowLevelEntityToSaveGifMSIE_ELSIGLO&Type=text/html&Locale=spanish-skin-custom&Path=EDT/1956/08/13&ChunkNum=-1&ID=Ar00305&PageLabel=3 El Siglo de Torreon 1956-08-13]
1) El Coyote b Mishima Ota
2) Popeye Franco b Chivo García
3) Cabecitas Alvarez DRAW Tacho Martí
4) Carlos Segura, Eddie Martinez b Huroki Sito, Manuel Robles
5) Blue Demon b Manuel Robles
## Manuel Robles replaced Enfermero (fever!)

Dipp (TUE) 08/14/1956 Arena Olimpico Laguna, Gomez Palacio, Durango [El Siglo de Torreon 1956-08-14]
1) ? vs ??
2) Manuel Robles vs Carlos Segura, Cabecistas Alvarez, Rene Guajardo, King Kong, Popeye Franco, Gonzalo Gómez, El Coyote

indy (TUE) 08/14/1956 Plaza de Toros el Progreso, Guadalajara, Jalisco [El Informador 1956-08-14]
1) ? vs ??
2) ? vs ??
3) ? vs ??
4) Cavernario Galindo, El Verdugo vs Alejandro Cruz, Dorrel Dixon
5) Medico Asesino vs El Bulldog

EMLL (FRI) 08/17/1956 Arena Coliseo [Box y Lucha 230A, Box y Lucha 231A]
1) Troglodita Flores b Chico Hernández
2) Kiko Torres b Centella Inca
3) Adolfo Bonales DRAW Murciélago Velazquez
4) Tony Barbetta b Dr. Castro
5) Umeyiri Kiyomigawa b Miguel King
## debut of Kiyomigawa
6) Carlos Moreno b Masahiko Kimura
## debut of Kimura; Box y Lucha has no idea what to make out of his (likely heavily judo) wrestling style
7) Black Shadow, Blue Demon DQ Cavernario Galindo, Ray Mendoza
## Blue Demon replaced Lotario (out of action after getting a head cut the previous Sunday.) Box y Lucha notes Blue Demon is an upgrade. Tecnicos took 2 (weird DQ) and 3, with Black Shadow landing a (reverse) tope that wows everyone. Rated 7 ½

Indy (FRI) 08/17/1956 Hermosillo, Sonora [Box y Lucha 231A]
1) Bobby Segura, Tony López b El Zombie, La Momia [mask]
## only La Momia was unmasked - or he was supposed, but he split. Box y Lucha reveals he’s Angel Ceballos of Pachuca.

EMLL (SAT) 08/18/1956 Arena Puebla [Box y Lucha 230A]
1) Cavernario Galindo, Ray Mendoza vs Black Shadow, Blue Demon

EMLL (SAT) 08/18/1956 Huachinango, Veracruz, Veracruz [Box y Lucha 230A]
1) Irma González vs Rosa Williams

indy (SAT) 08/18/1956 Old Arena México, Ciudad de México, Distrito Federal [Lucha Libre 110]
1) Alberto Campos b Bobby Samson

EMLL (SUN) 08/19/1956 Arena Coliseo [Box y Lucha 230A, Box y Lucha 231A]
1) Enrique Camarena vs Lorenzo Soto
2) Blue Demon, Tarzán López b Chale Romero, José Macias [quarterfinal]
3) Carlos Moreno, Gorilita Flores b Canelo Segura, Moloch [quarterfinal]
4) Black Killer, Gladiador b Orquídea, Pepe Mendieta [quarterfinal]
5) Jalisco González, Joe Grant b Espectro, Frankenstein [quarterfinal]
6) Blue Demon, Tarzán López b Carlos Moreno, Gorilita Flores [semifinal]
7) Black Killer, Gladiador b Jalisco González, Joe Grant [semifinal]
8) Black Killer, Gladiador b Blue Demon, Tarzán López [final]
## winners got trophies and 6000 pesos. Rated 7 ¼

indy (SUN) 08/19/1956 Arena Coliseo Monterrey [Box y Lucha 231A, http://superluchas.com/2015/08/19/en-un-dia-como-hoy-1988-hijo-del-santo-destapa-al-leon-chino-1956-el-santo-es-destronado-por-rolando-vera-pero-la-comision-revierte-el-resultado/ SuperLuchas]Attendance: 6000
1) Jaibo García b Mario Texas
2) Johnny Rodríguez b El Fugitivo
3) Karloff Lagarde b Sordomudo Rodríguez
4) Mongol, Samar Selem b Emilio Charles, Huracán Ramírez
5) Rolando Vera b El Santo  (c) [NWA MIDDLE]
## Santo loses his head in the third fall and starts throwing punches, Vera grabs an arm and pulls Santo into la reinera to win. Commission would later overturn this finish, but there’s no indication that’s going to happen here. Commission claimed Santo was too tired from defending it three times a month and had already beaten Rolando twice so match shouldn’t have happened. (A Box y Lucha column makes same point.) The Commission tried to give the belt back to Santo, but Santo rejected it. A rematch was held two months later in Arena Mexico that Vera won.
&& said to be a full house, and a full house is said to be 6,000 at this point. 3,000 people were left outside the building and police had to be called. Rolando Vera credited with being very over.

Indy (SUN) 08/19/1956 Cuernavaca, Morelos [Box y Lucha 230A]
1) Memo Rubio vs Murciélago Velazquez
2) Chabela Romero, Irma González vs Dama Enmascarada, Rosa Williams

indy (SUN) 08/19/1956 Plaza de Toros el Progreso, Guadalajara, Jalisco [El Informador 1956-08-19]
1) ? vs ??
2) ? vs ??
3) ? vs ??
4) Giuliano, Tonny Barbetta vs El Bulldog, El Verdugo
5) Medico Asesino vs Dorrel Dixon

indy (SUN) 08/19/1956 Plaza de Toros Valente Arellano, Torreón, Coahuila [El Siglo de Torreon 1956-08-19]
1) El Coyote vs Chacal Ramírez
2) Gorila Buigani vs Cabecitas Alvarez
3) Carlos Segura vs Huroki Sito
4) Manuel Robles vs Popeye Franco
5) El Enfermero, Gorila Macías III vs Polo Torres, Rene Guajardo

Indy (MON) 08/20/1956 Arena Puebla [Box y Lucha 230A]
1) Maravilla Enmascarada vs ?
2) Ángel Negro, La Momia vs Dr. Astro, Juan Diaz

Dipp (TUE) 08/21/1956 Arena Olimpico Laguna, Gomez Palacio, Durango [El Siglo de Torreon 1956-08-21]
1) Mishima Ota vs El Coyote
2) King Kong vs Cabecistas Alvarez
3) Huroki Sito vs Popeye Franco
4) Gorila Macías III, Manuel Robles vs Carlos Segura, Rene Guajardo

indy (TUE) 08/21/1956 Plaza de Toros el Progreso, Guadalajara, Jalisco [El Informador 1956-08-21]
1) ? vs ??
2) ? vs ??
3) Tonny Barbetta vs Lalo El Exotico
4) Dorrel Dixon vs El Verdugo
5) Medico Asesino vs El Bulldog [super libre]

Indy (WED) 08/22/1956 Pachuca, Hidalgo [Box y Lucha 230A]
1) Daniel Aldana vs Ali Bey, Dientes Hernández, Red Terror, Juan Diaz
## scheduled to appear

EMLL (FRI) 08/24/1956 Arena Coliseo [Box y Lucha 231A, Box y Lucha 232A]
1) Eskimo Blancarte b Sordomudo Quiroz
2) Centella Inca b Fantomas
3) Mario Tello DRAW Frankenstein
4) Gladiador b Gorilla Flores [MEX MIDDLE, quarterfinal]
5) El Santo b Blue Demon [MEX MIDDLE, quarterfinal]
## Rated 7 ½
6) Black Shadow b Bobby Bonales [MEX MIDDLE, quarterfinal]
## Rated 7 ¾
7) Cavernario Galindo b Espectrito I [MEX MIDDLE, quarterfinal]
&& tournament matches set by battle royal

EMLL (SAT) 08/25/1956 Arena Puebla [Box y Lucha 231A]
1) Huracán Ramírez vs Orquídea
2) Kimura vs Lotario
3) Black Shadow, Blue Demon vs Cavernario Galindo, Ray Mendoza

EMLL (SUN) 08/26/1956 Arena Coliseo [Box y Lucha 231A, Box y Lucha 232A]
1) Joe Grant b Ray Mendoza [MEX LH, quarterfinal]
2) Tarzán López b Adolfo Bonales [MEX LH, quarterfinal]
## said to be a great match even though it went two falls. Rated 7 ¼
3) Pepe Mendieta b Chivo García [MEX LH, quarterfinal]
4) Mongol b Moloch [MEX LH, quarterfinal]
5) Henry Pilusso, Lotario b Masahiko Kimura, Umeyiri Kiyomigara
## a hard win

indy (SUN) 08/26/1956 Plaza de Toros el Progreso, Guadalajara, Jalisco [El Informador 1956-08-26]
1) ? vs ??
2) ? vs ??
3) Dorrel Dixon vs El Gladiador
4) Medico Asesino vs Carlos Moreno

indy (SUN) 08/26/1956 Plaza de Toros Valente Arellano, Torreón, Coahuila [El Siglo de Torreon 1956-08-26]
1) El Coyote vs Cabecitas Alvarez
2) Carlos Segura vs Tacho Martí
3) Popeye Franco vs Huroki Sito
4) Polo Torres, Rene Guajardo vs Gorila Macías III, Manuel Robles
5) El Espectro vs Emilio Charles

Dipp (TUE) 08/28/1956 Arena Olimpico Laguna, Gomez Palacio, Durango [El Siglo de Torreon 1956-08-28]
1) Cavernario Galindo II vs Chu Chu García
2) King Kong vs Tacho Martí
3) Eddie Martinez vs Cabecistas Alvarez
4) Rene Guajardo vs Huroki Sito
5) El Espectro, Gorila Macías III vs Emilio Charles, Popeye Franco

indy (TUE) 08/28/1956 Plaza de Toros el Progreso, Guadalajara, Jalisco [El Informador 1956-08-28]
1) ? vs ??
2) ? vs ??
3) Bobby Bonales, El Gladiador vs Carlos Moreno, El Verdugo
4) Medico Asesino vs El Bulldog [super libre]

EMLL (FRI) 08/31/1956 Arena Coliseo [Box y Lucha 232A, Box y Lucha 233A, Clinch 227]
1) Enrique Camarena b Kid Vanegas
2) Memo Rubio DRAW Carlos Segura
3) Chivo García b Kiko Torres
4) Canelo Segura b Akio Yoshihara
5) Huracán Ramírez b Giuliano
## debut of Huracan Ramirez! Announced as the stunt double of actor David Silva, 21 years old, and had wrestled in succesfully in Guatemala and Salvador.
6) El Gladiador b Black Shadow [MEX MIDDLE, semifinal]
## Box y Lucha claims this match went 90 minutes, which seems hard to believe. Said to be the match of the year
7) El Santo b Cavernario Galindo [MEX MIDDLE, semifinal]

EMLL (SUN) 09/02/1956 Arena Coliseo [Box y Lucha 232A, Box y Lucha 233A, Clinch 227]
1) Seki Moto b Chico Hernández
2) Dientes Hernández b Fantomas
3) Joe Grant b Pepe Mendieta [MEX LH, semifinal]
4) Tarzán López b El Mongol [MEX LH, semifinal]
5) Masahiko Kimura, Umeyiri Kiyomigawa b Miguel King, Ray Mendoza

EMLL (SUN) 09/02/1956 Arena Puebla [Box y Lucha 232A]
1) Chico Veloz, Juan Diaz, Orquídea vs Ángel Negro, El Gavian, Gorila Osorio

indy (SUN) 09/02/1956 Plaza de Toros el Progreso, Guadalajara, Jalisco [Box y Lucha 234A, Clinch 227, El Informador 1956-09-02]
1) ? vs ??
2) ? vs ??
3) Dorrel Dixon, Rolando Vera vs Carlos Moreno, El Verdugo
4) Medico Asesino b El Bulldog [super libre, mask, hair]
## Medico Asesino saved his mask and took Bulldog's hair

indy (SUN) 09/02/1956 Plaza de Toros Valente Arellano, Torreón, Coahuila [El Siglo de Torreon 1956-09-02]
1) Mishima Ota vs Tonny Fussari
2) Popeye Franco vs Cabecitas Alvarez
3) Memo Rubio vs Huroki Sito
4) El Espectro vs Emilio Charles
5) Joe Marín, Polo Torres vs Gorila Macías III, Manuel Robles

Dipp (TUE) 09/04/1956 Arena Olimpico Laguna, Gomez Palacio, Durango [El Siglo de Torreon 1956-09-04]
1) Tony Fussary vs Chu Chu García
2) Dr. Drake vs Chacal Ramírez
3) Huroki Sito vs Popeye Franco
4) Manuel Robles vs Memo Rubio
5) Emilio Charles, Joe Marín vs El Espectro, Gorila Macías III

indy (TUE) 09/04/1956 Plaza de Toros el Progreso, Guadalajara, Jalisco [El Informador 1956-09-04]
1) ? vs ??
2) 1 vs 2, 3, 4, 5, 6 [battle royal]
3) Rolando Vera vs El Enfermero

EMLL (FRI) 09/07/1956 Arena México [Box y Lucha 233A, Box y Lucha 234A, Clinch 227]
1) Akio Yoshihara b Chico Veloz
2) Huracán Ramírez DQ Gorilita Flores
3) Bobby Bonales TLDRAW Ray Mendoza
## 20 minute draw
4) Masahiko Kimura b Steiko Watanabe [judo]
5) Tarzán López b Joe Grant [MEX LH, final]
## Tarzan took ⅓.
6) Medico Asesino b Lotario [MEX HEAVY, final]
## Medico took ⅔ to win

EMLL (SUN) 09/09/1956 Arena Coliseo [Box y Lucha 233A, Clinch 227]
1) Carlos Segura b Sordomudo Quiroz
2) Adolfo Bonales b Centella Inca
3) Mario Tello DRAW Canelo Segura
4) Umeyiri Kiyomoigawa b Miguel King
5) Black Shadow, Henry Pilusso b Cavernario Galindo, El Mongol
## controveral finish, Shadow got pinned but interfered behind the referee’s back
&& strong turnaround

indy (SUN) 09/09/1956 Plaza de Toros el Progreso, Guadalajara, Jalisco [Box y Lucha 236A, El Informador 1956-09-09]
1) ? vs ??
2) ? vs ??
3) ? vs ??
4) El Santo DQ Rolando Vera
## Santo told Box y Lucha he won this via DQ by when Vera dropkicked the referee.

indy (SUN) 09/09/1956 Plaza de Toros Valente Arellano, Torreón, Coahuila [El Siglo de Torreon 1956-09-09, http://h.elsiglodetorreon.com.mx/Repository/getFiles.asp?Style=OliveXLib:LowLevelEntityToSaveGifMSIE_ELSIGLO&Type=text/html&Locale=spanish-skin-custom&Path=EDT/1956/09/10&ChunkNum=-1&ID=Ar01301&PageLabel=13 El Siglo de Torreon 1956-09-10]
1) Dr. Drake b Jimmy Charles
2) Chacal Ramírez b Tonny Fussari
3) Memo Rubio b Eddie Martinez
4) Manuel Robles b Popeye Franco
5) Emilio Charles, Joe Marín, Polo Torres b El Espectro, Gorila Macías III, Huroki Sito

Dipp (TUE) 09/11/1956 Arena Olimpico Laguna, Gomez Palacio, Durango [El Siglo de Torreon 1956-09-11]
1) ? vs ??
2) Joe Marín vs El Espectro, Emilio Charles, Gorila Macías III, Popeye Franco, Manuel Robles, Memo Rubio, Huroki Sito [battle royal]

indy (TUE) 09/11/1956 Plaza de Toros el Progreso, Guadalajara, Jalisco [El Informador 1956-09-11]
1) ? vs ??
2) El Bulldog, El Verdugo vs Black Killer, Rogelio De La Paz
3) Rolando Vera vs El Mongol

EMLL (FRI) 09/14/1956 Arena Coliseo [https://www.facebook.com/96186896558/posts/10153284178536559 Box Y Lucha, Box y Lucha 1456, Box y Lucha 234A, Box y Lucha 235A]
1) Frankenstein b Centella Inca
2) Dr. Castro DRAW Moloch
3) Giuliano b Canelo Segura
4) Joe Grant b Bobby Bonales
5) Black Shadow b Cavernario Galindo
6) Medico Asesino b Masahiko Kimura
## Medico Asesino farwell match
7) El Santo b Gladiador [MEX MIDDLE, final]
## Santo took 2/3 to win the title, the last when he caught Gladiador by surprise with a hold.  Mask match challenges followed, leading to a match the following week.
&& An usually poor turnout for a Santo show

EMLL (FRI) 09/14/1956 Arena Puebla [Box y Lucha 234A]
1) Orquídea vs Akio Yoshihara
2) Lotario vs Miguel King
3) Henry Pilusso, Pepe Mendieta, Tarzán López vs Gorilita Flores, Jorge Allende, Ray Mendoza

EMLL (FRI) 09/14/1956 Huauchinango, Puebla [Box y Lucha 234A]
1) Umekii Kiyomigara vs Daniel Aldana
2) Huracán Ramírez vs Chivo García

EMLL (SUN) 09/16/1956 Arena Coliseo [Box y Lucha 234A, Box y Lucha 235A, Clinch 227]
1) Mar Allah b Rudy Tinoco
2) Dientes Hernández vs Seki Moto
## straight falls
3) Adolfo Bonales b Maravilla Enmascarada
4) Orquídea DQ Giuliano
5) Bobby Bonales, Gladiador b Cavernario Galindo, Verdugo
## a return for Verdugo, but in a loss.
&& shows in Arena Coliseo and Arena Mexico on the same day

EMLL (SUN) 09/16/1956 Arena México [Box y Lucha 234A, Box y Lucha 235A]
1) Ángel Negro vs Juan Diaz
2) Steiko Watanabe, Umeyiri Kiyomigawa b Charle Ramírez, Gorilita Macias [quarterfinal]
## opponents in match a guess based on lineup; not listed in results
3) Huracán Ramírez, Lotario b Chivo García, Miguel King [quarterfinal]
## opponents in match a guess based on lineup; not listed in results
4) Dorrel Dixon, Joe Grant b Pepe Mendieta, Tarzán López [quarterfinal]
5) Jorge Allende, Ray Mendoza b Black Shadow, Henry Pilusso [quarterfinal]
## Ray Mendoza and Jorge Allende almost fight the crowd somewhere during this show.
6) Jorge Allende, Ray Mendoza b Steiko Watanabe, Umeyiri Kiyomigawa [semifinal]
7) Dorrel Dixon, Joe Grant b Huracán Ramírez, Lotario [semifinal]
## Huracan’s first loss
8) Dorrel Dixon, Joe Grant b Jorge Allende, Ray Mendoza [final]
## 10000 pesos for the winning team (out of a 16000 gate, a bad turnout)
&& shows in Arena Coliseo and Arena Mexico on the same day

EMLL (SUN) 09/16/1956 Arena Puebla [Box y Lucha 234A]
1) Gorila Osorio, Murciélago Velazquez vs Chico Veloz, Hércules Poblano
2) Dama Enmascarada vs Chabela Romero

Indy (SUN) 09/16/1956 Cuernavaca, Morelos [Box y Lucha 234A]
1) Rosa Williams vs Dama Enmascarada
2) Frankenstein, Joaquin Murrieta vs Daniel Aldana, Mario Tello

indy (SUN) 09/16/1956 Plaza de Toros el Progreso, Guadalajara, Jalisco [Clinch 227, El Informador 1956-09-16]
1) ? vs ??
2) ? vs ??
3) Carlos Moreno vs Black Killer
4) El Mongol vs El Bulldog
5) Rolando Vera DRAW El Santo [super libre]

indy (SUN) 09/16/1956 Plaza de Toros Valente Arellano, Torreón, Coahuila [El Siglo de Torreon 1956-09-16]
1) Chu Chu García vs Dr. Drake
2) Polo Torres vs Chacal Ramírez
3) Emilio Charles, Memo Rubio vs Gorila Macías III, Tony Fussari and El Espectro, Tacho Martí and Joe Marín, Popeye Franco and Huroki Sito, Manuel Robles and Chacal Ramírez, Polo Torres [torneo]
## 1000 pesos to the winner

Dipp (TUE) 09/18/1956 Arena Olimpico Laguna, Gomez Palacio, Durango [El Siglo de Torreon 1956-09-18]
1) Jimmy Charles vs Dr. Drake
2) Mishima Ota vs Bicha Martinez
3) Huroki Sito vs Memo Rubio
4) Gorila Macías III vs Popeye Franco
5) El Espectro, Manuel Robles vs Emilio Charles, Joe Marín

Flores (TUE) 09/18/1956 Pachuca, Hidalgo [Box y Lucha 234A]
1) Eskimo Blancarte vs Lorenzo Soto, Chico Hernández
## scheduled to appear
2) Rosa Williams vs Irma González

indy (TUE) 09/18/1956 Plaza de Toros el Progreso, Guadalajara, Jalisco [El Informador 1956-09-18]
1) ? vs ??
2) Red Man, Red Terror vs Black Killer, Doc Curtis
3) Carlos Moreno vs El Mongol
4) El Bulldog vs Rolando Vera

EMLL (WED) 09/19/1956 Acapulco, Guerrero [Box y Lucha 234A]
1) Adolfo Bonales, Bobby Bonales vs Chivo Arcia, Miguel King and Huracán Ramírez, Lotario

EMLL (FRI) 09/21/1956 Arena México [Box y Lucha 1456, Box y Lucha 236A, Clinch 227, https://www.facebook.com/LuchaLibreDeAyerdeHoyYSiempre/posts/871400442907692 DJ Spectro, https://twitter.com/ElHijodelSanto/status/1572598926959874048 El Hijo del Santo, Punos 13]
** EMLL 22nd Aniversario
1) Chivo García DRAW Kiko Torres
2) Orquídea DQ Adolfo Bonales
## Box y lucha has this as a DQ, Clinch 227 lists as a draw
3) Lotario b Miguel King
4) Huracán Ramírez b Carlos Segura
## Canelo Seugra replaced Jorge Allande
5) Henry Pilusso b Ray Mendoza
6) Black Shadow, Tarzán López b Cavernario, Mongol
7) El Santo b El Gladiador [mask]
## 35 minute match. Santo takes fall 1/3. Santo submits Gladiador to win, though Gladiador argues he didn't give up and the match is resumed. Santo again submits Gladiador to a double armbar and there was no doubt that time. Gladiador is Luis Ramirez Romero.
&& A history piece in Box y Lucha 1456 lists "20,000" fans. Box y Lucha 236A, at the time, calls it just over 15,000 fans. Box y Lucha also guesses payoffs based on the gate and percentage: King/Loatario 460 pesos, Pilusso/Mendoza 675, Tarzan/Shadow/Caverario/Mongol 1,600 pesos and Santo/Gladiador could not be making more than 2000.

EMLL (SUN) 09/23/1956 Arena México [Box y Lucha 235A, Box y Lucha 236A]
1) Rudy García b Guapo Rodríguez
2) Tony Barbetta DRAW Daniel Aldana
3) El Verdugo b Giuliano
4) Gorilita Flores b Pepe Mendieta
5) Dorrel Dixon, Joe Grant b Kimura, Kiyomigawa

indy (SUN) 09/23/1956 Plaza de Toros el Progreso, Guadalajara, Jalisco [Box y Lucha 237A, El Informador 1956-09-23]
1) Índio Mejia b Fili Espinosa
2) Jack O’Brien b Black Killer
3) Jalisco González DQ Frank Butcher
4) Lotario, Rolando Vera b Carlos Moreno, Cavernario Galindo

indy (SUN) 09/23/1956 Plaza de Toros Valente Arellano, Torreón, Coahuila [El Siglo de Torreon 1956-09-23]
1) Mishima Ota vs Bicha Martinez
2) Tonny Fussari vs Eddie Martinez
3) Gorila Macías III vs Memo Rubio
4) Joe Marín, Popeye Franco vs Huroki Sito, Manuel Robles
5) El Espectro vs Emilio Charles [mask, hair]
## Espectro’s mask vs Emilio’s hair. Espectro won if it happened.

EMLL (MON) 09/24/1956 Tampico, Tamaulipas [Box y Lucha 235A]
1) Canelo Segura vs La Momia

Dipp (TUE) 09/25/1956 Arena Olimpico Laguna, Gomez Palacio, Durango [El Siglo de Torreon 1956-09-25]
1) Bicha Martinez vs Jimmy Charles
2) Eddie Martinez vs Dr. Drake
3) Tony Fussary vs Mishima Ota
4) Huroki Sito vs Memo Rubio
5) Emilio Charles, Joe Marín, Popeye Franco vs El Espectro, Gorila Macías III, Manuel Robles

indy (TUE) 09/25/1956 Plaza de Toros el Progreso, Guadalajara, Jalisco [Box y Lucha 237A, El Informador 1956-09-25]
1) ? vs ??
2) ? vs ??
3) Carnicero Butcher b Jack O’Brien
4) Carlos Moreno b Lotario
5) Cavernario Galindo b Rolando Vera
## bloody match

EMLL (WED) 09/26/1956 Acapulco, Guerrero [Box y Lucha 235A]
1) Cavernario Galindo, Mongol vs Dorrel Dixon, Joe Grant

EMLL (FRI) 09/28/1956 Arena México [Box y Lucha 236A, Box y Lucha 237A]
1) Bobby Rolando b Carlos Segura
2) Centella Inca b Chico Veloz
3) Pepe Mendieta b Giuliano
4) Black Shadow b El Santo [quarterfinal]
## an opening round tournament match! Rated 7 ¾
5) Gladiador b Dorrel Dixon [quarterfinal]
6) Cavernario Galindo b Tarzán López [quarterfinal]
7) Bobby Bonales b Blue Demon [quarterfinal]
8) Black Shadow DQ Gladiador [semifinal]
## Gladiador fouled Shadow by accident. Rated 7 ¼
9) Cavernario Galindo b Bobby Bonales [semifinal]
10) Black Shadow b Cavernario Galindo [final]
## Shadow wowed with his technique. Rated 7 ¼
&& this tournament was billed as a NWA Middleweight #1 contenders match in 236A, then recapped as a 10,000 pesos and a trophy to the winner tournament in 237A

EMLL (SUN) 09/30/1956 Arena México [Box y Lucha 236A, Box y Lucha 237A, Punos 13]
1) Hércules Poblano b Sordomudo Quiroz
2) Juan Diaz DRAW Fantomas
3) Dr. Castro b Murciélago Velazquez
## Rated 7
4) Huracán Ramírez b Verdugo
## Rated 7
5) Cavernario Galindo, Gorilita Flores, Ray Mendoza b Blue Demon, Henry Pilusso, Joe Grant
## Rated 7

indy (SUN) 09/30/1956 Plaza de Toros el Progreso, Guadalajara, Jalisco [Box y Lucha 238A, El Informador 1956-09-30]
1) ? vs ??
2) ? vs ??
3) ? vs ??
4) ? vs ??
5) El Santo b Black Shadow
## straight falls, Shadow injured in fall 2.

indy (SUN) 09/30/1956 Plaza de Toros Valente Arellano, Torreón, Coahuila [http://h.elsiglodetorreon.com.mx/Repository/getFiles.asp?Style=OliveXLib:LowLevelEntityToSaveGifMSIE_ELSIGLO&Type=text/html&Locale=spanish-skin-custom&Path=EDT/1956/10/01&ChunkNum=-1&ID=Ar01207&PageLabel=12 El Siglo de Torreon, El Siglo de Torreon 1956-09-30]
1) Mishima Ota DRAW Chu Chu García
2) Memo Rubio b Tonny Fussari
3) Emilio Charles b Huroki Sito
4) Joe Marín, Polo Torres b Gorila Macías III, Manuel Robles
5) Tarzán López b El Espectro

Dipp (TUE) 10/02/1956 Arena Olimpico Laguna, Gomez Palacio, Durango [El Siglo de Torreon 1956-10-02]
1) ? vs ??
2) Tarzán López vs Joe Marín, Emilio Charles, Huroki Sito, Manuel Robles, Tony Fussary, Gorila Macías III, Eddie Martinez

indy (TUE) 10/02/1956 Plaza de Toros el Progreso, Guadalajara, Jalisco [El Informador 1956-10-02]
1) ? vs ??
2) ? vs ??
3) Carnicero Butcher, Lalo El Exotico vs Black Killer, Lotario
4) El Santo vs Huracán Ramírez

EMLL (FRI) 10/05/1956 Arena México [Box y Lucha 237A, Box y Lucha 238A, Punos 13]
1) Memo Rubio b Eskimo Blancarte
## may have actually be the post-main event match
2) Frankenstein b Kiko Torres
3) Chivo García DRAW Orquídea
4) Mario Tello b Chale Romero
5) Huracán Ramírez b El Verdugo
## Verdugo ripped up Ramirez’s mask. Ramirez has won six straight singles matches since debuting.
6) Jalisco González b Enfermero [MEX WELTER, final]
## surprise result. Jalisco took ⅔ to win the title. Punos explains Enfermero had a left arm injury, so the delayed final. Title history has wrong location here!
7) Cavernario Galindo, Gladiador b Black Shadow, Blue Demon
## Shadow tope accidentally took out Demon, setting up the rudo win

EMLL (SAT) 10/06/1956 Arena Puebla [Box y Lucha 237A]
1) Murciélago vs Steiko Watanabe
2) Masahiko Kimura vs Carlo Moreno
3) Gladiador vs Blue Demon

EMLL (SUN) 10/07/1956 Arena Coliseo [Box y Lucha 237A, Box y Lucha 238A]
1) Bobby Rolando b Rudy Castillo
2) Akio Yoshihara b Chico Veloz
3) Giuliano b Adolfo Bonales
4) Masahiko Kimura b Ray Mendoza
## Kimura took took ⅔, the last when Mendoza was hurt and bleeding
5) Dorrel Dixon, Henry Pilusso, Joe Grant b Carlos Moreno, Gorilla Flores, Mongol Chino

EMLL (SUN) 10/07/1956 Arena Puebla [Box y Lucha 237A]
1) Dr. Castro, Orquídea vs Frankenstein, Momia

EMLL (SUN) 10/07/1956 Cuernavaca, Morelos [Box y Lucha 237A]
1) Chivo García, Ramsés vs Kiko Torres, Mario Tello

indy (SUN) 10/07/1956 Arena Canada Dry, Guadalajara, Jalisco [El Informador 1956-10-07]
1) ? vs ??
2) ? vs ??
3) Huracán Ramírez vs El Verdugo
4) Carnicero Butcher vs Lotario [super libre]

indy (SUN) 10/07/1956 Plaza de Toros Valente Arellano, Torreón, Coahuila [El Siglo de Torreon 1956-10-07, http://h.elsiglodetorreon.com.mx/Repository/getFiles.asp?Style=OliveXLib:LowLevelEntityToSaveGifMSIE_ELSIGLO&Type=text/html&Locale=spanish-skin-custom&Path=EDT/1956/10/08&ChunkNum=-1&ID=Ar01322&PageLabel=13 El Siglo de Torreon 1956-10-08]
1) Mishima Ota b Cavernario Galindo
2) Tacho Martí b Tonny Fussari
3) Bruno Lopez b Eddie Martinez
4) Emilio Charles b Carnicero Grimaldo
5) Gorila Macías III, Huroki Sito, Manuel Robles b Joe Marín, Polo Torres, Tarzán López

Dipp (TUE) 10/09/1956 Arena Olimpico Laguna, Gomez Palacio, Durango [El Siglo de Torreon 1956-10-09]
1) Mishima Ota vs Chuchu García
2) Tacho Martí vs Grimaldo
3) Tony Fussary vs Dr. Drake
4) Bruno Lopez, Emilio Charles vs Huroki Sito, Manuel Robles
5) Tarzán López vs Gorila Macías III [hair]

indy (TUE) 10/09/1956 Plaza de Toros el Progreso, Guadalajara, Jalisco [El Informador 1956-10-09]
1) Henry Pilusso vs Ray Mendoza, 3, 4, 5, 6, 7, 8, 9, 10 [battle royal]
## Box y Lucha 239A says Mendoza beat Huracan Ramirez after a battle royal in Guadalajara, so probably part of this some how.

EMLL (WED) 10/10/1956 Acapulco, Guerrero [Box y Lucha 237A]
1) Cavernario Galindo vs Black Shadow

EMLL (WED) 10/10/1956 Nuevo Laredo, Tamaulipas [Box Y Lucha 239A]
1) Bobby Bonales b Karloff Lagarde
## Bonales wins but bleeds a lot, gets eight stitches and told to sit out two weeks. Lagarde hits hard.

EMLL (FRI) 10/12/1956 Arena México [Box y Lucha 238A, Box y Lucha 239A]
1) Juan Diaz b El Coyote
## “super estrella” match actually held after the main event
2) Akio Yoshihara b Fantomas
3) Orquídea b Centella Inca
4) Joe Marín b Canelo Segura
5) Jalisco González b Jorge Allende
6) Henry Pilusso b Masahiko Kimura
7) Black Shadow, Blue Demon b Cavernario Galindo, Gladiador

EMLL (SUN) 10/14/1956 Arena Coliseo [Box y Lucha 238A, Box y Lucha 239A]
1) Sordomudo Quiroz b Kid Vanegas
2) Gran Markus b Seki Moto
## said to be horrible
3) Mario Tello b Maravilla Enmascarada
## called out as a gift win from referee Hiram Blancarte
4) El Enfermero b Gorilita Flores
## Enfermero took 2/3
5) Carlos Moreno, El Mongol b Dorrel Dixon, Joe Grant
## rudos took ⅓.

EMLL (SUN) 10/14/1956 Pachuca, Hidalgo [Box y Lucha 238A]
1) Black Shadow vs Gladiador

indy (SUN) 10/14/1956 Arena Canada Dry, Guadalajara, Jalisco [El Informador 1956-10-14]
1) ? vs ??
2) ? vs ??
3) ? vs ??
4) Carnicero Butcher, Ray Mendoza vs Huracán Ramírez, Lotario

indy (SUN) 10/14/1956 Plaza de Toros Valente Arellano, Torreón, Coahuila [El Siglo de Torreon 1956-10-14]
1) Tonny Fussari vs Dr. Drake
2) Bruno Lopez vs Tacho Martí
3) Carnicero Grimaldo vs Huroki Sito
4) Manuel Robles vs Emilio Charles
5) Henry Pilusso, Polo Torres vs Gorila Macías III, Piero Giuliano

Dipp (TUE) 10/16/1956 Arena Olimpico Laguna, Gomez Palacio, Durango [El Siglo de Torreon 1956-10-16]
1) Cavernario Galindo II vs Bicha Martinez
2) Tony Fussary vs Tacho Martí
3) Eddie Martinez vs Carnicero Grimaldo
4) Bruno Lopez vs Huroki Sito
5) Emilio Charles, Henry Pilusso vs Manuel Robles, Piero Giullano

indy (TUE) 10/16/1956 Plaza de Toros el Progreso, Guadalajara, Jalisco [El Informador 1956-10-16]
1) 1A, 1B vs 2A, 2B and 3A, 3B and 4A, 4B and 5A, 5B and 6A, 6B and 7A, 7B and 8A, 8B [torneo]
## 1000 pesos to the winner

EMLL (WED) 10/17/1956 Acapulco, Guerrero [Box y Lucha 238A]
1) Blue Demon, Joe Marín vs Cavernario Galindo, El Mongol

EMLL (FRI) 10/19/1956 Arena México [Box y Lucha 239A, Box y Lucha 240A]
1) Chico Veloz b Fantomas
## superestrella - after the main event
2) Dr. Castro b Akio Yoshihara
3) Gorilita Flores b Mario Tello
4) El Enfermero DRAW El Caballero
## debut of Caballero
5) El Gladiador b Black Shadow
## Box y Lucha says this was a fast count. 6.75
6) Blue Demon b Cavernario Galindo
## 7.5 (of 10)
7) Rolando Vera b El Santo  (c) [NWA MIDDLE]
## El Santo announced as champion, but he has refused the title after losing to Vera in Monterrey (a title match later thrown out due to NWA not listing Vera as a contender.) EMLL does not list Santo as champion in their programming, feuling speculation this is really a commission issue. Vera takes ⅔. The key moment is Santo putting Vera in a half crab, Vera tapping Santo in the back twice while in the hold, and Santo releasing because he thinks the referee is signaling the match is over. Vera instead catches him in a suastica and Santo submits. Vera reveals he was in a car accident on Wednesday and EMLL wanted to postpone the match, but he insisted on doing it. Box y Lucha rates this a 7.5
&& final show in Arena Mexico for now

EMLL (SUN) 10/21/1956 Arena Coliseo [Box y Lucha 239A, Box y Lucha 240A]
1) El Gavilán vs Mar Allah
2) Gladiador, Mongol b Chale Romero, Frankenstein [quarterfinal]
3) Dorrel Dixon, Joe Grant b Chivo García, Tony Barbetta [quarterfinal]
4) Canelo Segura, Enfermero b Jalisco González, Pepe Mendieta [quarterfinal]
5) Mario Segura, Tarzán López b Carlos Moreno, Jorge Allende [quarterfinal]
6) Gladiador, Mongol b Dorrel Dixon, Joe Grant [semifinal]
## Dixon KOed at the of the match. This and all other tournaments matches rated a 6.
7) Joe Marín, Tarzán López b Canelo Segura, Enfermero
## 7 (of 10)
&& finals on 10/28, a concept Box y Lucha disliked

indy (SUN) 10/21/1956 Arena Canada Dry, Guadalajara, Jalisco [El Informador 1956-10-21]
1) ? vs ??
2) ? vs ??
3) ? vs ??
4) Gargantua vs Monje Loco [mask]

Dipp (TUE) 10/23/1956 Arena Olimpico Laguna, Gomez Palacio, Durango [El Siglo de Torreon 1956-10-23]
1) Dr. Drake vs Tony Fussary
2) Emilio Charles, Henry Pilusso vs Huroki Sito, Piero Giullano
3) Umejiri Kiyomigawa vs Lotario

indy (TUE) 10/23/1956 Plaza de Toros el Progreso, Guadalajara, Jalisco [Box y Lucha 241A, El Informador 1956-10-23]
1) 1 vs 2, 3, 4, 5, 6
2) Joe Grant, Raúl Reyes DQ Carnicero Butcher, Ray Mendoza

EMLL (FRI) 10/26/1956 Arena Coliseo [Box y Lucha 240A, Box y Lucha 241A]
1) Jaibo García vs El Coyote
## not listed in the results
2) Kiko Torres b Eskimo Blancarte
3) Chivo García b Memo Rubio
4) El Caballero b Orquídea
5) Carlos Moreno b Manuel Robles
6) El Enfermero b Dorrel Dixon
7) Espectro, Santo b Blue Demon, Rolando Vera
## Vera goes for the suastica again, but Santo has an answer this week and submits him. Rated 7 ¾. The Espectro de Ultratumba name gets used in the notes.In 245A, Espectro explains he was out for months after breaking his right arm on a dive in Monterrey. He says he was out three months, seems less than that (unelss he’s referring to some other pause.

indy (FRI) 10/26/1956 Plaza de Toros Centenario, Tlaquepaque, Jalisco [El Informador 1956-10-26]
1) Javier Marquez vs Mario Díaz
2) Golden Demond vs Luis Rangel
3) Red Man, Red Terror vs Doc Curtis, Fili Espinosa

EMLL (SUN) 10/28/1956 Arena Coliseo [Box y Lucha 240A, na Box y Lucha 241A]
1) Hércules Poblano b Ali Bey
2) Carlos Segura b Chico Veloz
## rated 7 of 10
3) Pepe Mendieta b Tony Barbetta
## straight falls
4) Gorilita Flores b Huracán Ramírez
## Huracan Ramirez taking a singles loss
5) El Gladiador, El Mongol b Joe Marín, Tarzán López [final]
## rated 8 of 10.

indy (SUN) 10/28/1956 Arena Canada Dry, Guadalajara, Jalisco [El Informador 1956-10-28]
1) ? vs ??
2) ? vs ??
3) ? vs ??
4) Carnicero Butcher, Ray Mendoza vs Jack O’Brien, Raúl Reyes
5) Rosa Williams vs Irma González

indy (SUN) 10/28/1956 Plaza de Toros Valente Arellano, Torreón, Coahuila [El Siglo de Torreon 1956-10-28]
1) Tacho Martí vs El Leñador
2) Bruno Lopez vs Tony Fussari
3) Huroki Sito vs Carnicero Grimaldo
4) Emilio Charles vs Piero Giuliano
5) Masahiko Kimura, Umejiri Kiyomigawa vs Henry Pilusso, Lotario

