
/**********************
luchadb archive (for year 1972)
export started at 2025-11-11 02:24:31
export finished at 2025-11-11 02:25:42

particular parser syntax for nerds:

PROMOTION (DAY) MM/DD/YYYY ArenaName [linkURL linkName]
MatchNo) side1-1, side1-2, side1-3 DECISION side2-1, side2-2, side2-3 [matchstip]

special codes 
(c) champion obviously
## note attached to preeceding match
&& note attached to event
%% attendence (always integer, always suspect) 
** event name
**********************/
EMLL (SAT) 01/01/1972 Arena Coliseo [Box y Lucha 1002]
1) Gran Davis vs Rey Halcón
2) Leo López vs Agente X
3) Bleda vs Mano Negra
4) Huroki Sito vs Cesar Sliva
5) Manuel Robles vs Mr. Steel
6) Coloso Colosetti vs Chino Chow
7) Karloff Lagarde, Kitazawa, Shibata vs Anibal, Black Shadow, Blue Demon

EMLL (SAT) 01/01/1972 Arena Coliseo Guadalajara [El Informador 1972-01-01]
1) ? vs ??
2) ? vs ??
3) ? vs ??
4) ? vs ??
5) Alberto Muñoz, Rayo de Jalisco vs Alfonso Dantes, Índio Jerónimo
6) El Solitario  (c) vs Ciclón Veloz [NWA LH]

EMLL (SAT) 01/01/1972 Pista Arena Revolución [Box y Lucha 1002]
1) Caligula vs Joe Martin
2) Escorpión I, Escorpión II vs José Luis Mendieta, Rostro and Villano I and El Rebelde, Sergio Borrayo and El Nazi, Perro Aguayo and El Cóndor, Estrella Blanca

EMLL (SUN) 01/02/1972 Arena Coliseo [Box y Lucha 1002]
1) Zorro Plateado vs Saeta Azteca
2) Mario Rocca vs Dick Angelo
3) Bruno Victoria, Mazambula vs Carlos Plata, El Greco
4) Cesar Valentino, Gran Markus vs Audaz, Raúl Reyes
5) Dr. Wagner vs Dorrel Dixon

EMLL (SUN) 01/02/1972 Arena Coliseo Guadalajara [El Informador 1972-01-02]
1) ? vs ??
2) ? vs ??
3) ? vs ??
4) ? vs ??
5) Gemelo Diablo I, Gemelo Diablo II vs Black Shadow, Blue Demon
6) Alberto Muñoz, Anibal vs Ángel Blanco, Renato Torres

EMLL (SUN) 01/02/1972 Pista Arena Revolución [Box y Lucha 1002]
1) Destino Negro vs El Troyano
2) El Capitán vs Joe Martin
3) Gran Davis vs Danny Ortiz
4) Tino Herrera vs Tauro
5) El Polaco, Leo López vs Agente X, Mano Negra
6) Huroki Sito, Manuel Robles vs Chino Chow, Mr. Steel

Indy (SUN) 01/02/1972 Arena Ecatepec de Morelos, Ecatepec, Estado de México [Box y Lucha 1002]
1) Tarasco I b Roy Davis [#1 Contenders, MEX LIGHT]

Indy (SUN) 01/02/1972 Arena Lopez Mateos
1) Bird Man vs El Recio
## tie breaker
2) Conde Drácula vs Cadáver I
3) Hermano Orfeo Negro I, Hermano Orfeo Negro II vs El Fantasma De La Ópera, Gori Rivera
4) Bulldog Quintero, El Alacrán, Operman vs El Delfin, Scaramouche, Terry Bolaños
5) Chuco El Roto vs Gorla Vera [mask]

Indy (SUN) 01/02/1972 Arena Rosales, Iztapalapa, Distrito Federal
1) ? vs ??
2) Terry Bernal vs Pequeño Black
3) Makabro II vs Tres Estrellas
4) Benny Cruz, Nacho Valentino vs Bufalo Salvaje, Nick Mendoza
5) Makabro I vs Golden Star, El Chicano, Ki Dbohemio

Indy (SUN) 01/02/1972 Arena San Juan Pantitlan, Ciudad Nezahualcóyotl, Estado de México
1) El Maniatico vs Potro Salvaje
2) El Gavilán Negro vs Estrella del Sur
3) El Irlandés vs Alma Negro
4) Bobby Arreola, Gladiador De Atenas vs El Sanguianrio, Índio Cherokee
5) El Chivo Martinez, El Isterio Blanco, El Tamulipeco vs Horoscopo II, Killer Millan, Rudy Vazquez

Indy (SUN) 01/02/1972 Arena Santa Barbara, Tlalnepantla, Estado de México
1) Zurod I vs Zurdo I, Raúl Medina, El Panterita, El Cachorro, Pegaso, Maricano II, El Chivo Negro, Pequeño Veneno, Halcón Escudero
2) Hermano Silver King I, Hermano Silver King II vs Viento Rojo I, Viento Rojo II

indy (SUN) 01/02/1972 Arena Toluca, Toluca, Estado de México [https://www.facebook.com/189993269593754/posts/689481552978254 Arena Clasica]
1) Bestia Mangifica, El Toluco vs Caligula, Pepe Casas and Tiburón, Toro Zuniga and El Invasor, Oso Blanco and Blue Prince, Jhonny Lopez and Black Sugar, Red Man and Espía I, Espia II and Muerte De La Barranca I, Muerte De La Barranca II [torneo]

Indy (SUN) 01/02/1972 Plaza de Toros el Cortijo, Venustiano Carranza, Distrito Federal
1) Dardo Aguilar vs Nahur Kaliff
2) Memo Valles vs Zeus
3) Villano II vs Rafael Salamanca
4) Villano I vs Sergio Borrayo
5) El Nazi, Karloff Lagarde, Perro Aguayo vs El Rostro, Garo Katcherian, José Luis Mendieta

CMLL (FRI) 01/07/1972 Arena Coliseo [RB, SL 318]
1) Perro Aguayo DQ Raúl Reyes

EMLL (FRI) 01/07/1972 Arena Coliseo Guadalajara [El Informador 1972-01-07]
1) ? vs ??
2) ? vs ??
3) ? vs ??
4) Mario Alcala, Ringo Mendoza vs El Mongol, Frank Tejeda
5) Alberto Muñoz, Ciclón Veloz Jr., Enrique Vera vs Gemelo Diablo I, Gemelo Diablo II, Renato Torres

EMLL (SUN) 01/09/1972 Arena Coliseo Guadalajara [El Informador 1972-01-09]
1) Comando I vs Comando II, El Samuray, Félix Mosqueda, El Ídolo, El Vengador, Enrique Vera, Misterio Negro [battle royal]
2) Dr. Wagner, El Solitario, Renato Torres vs Anibal, Black Shadow, Blue Demon
3) ? vs ??
4) ? vs ??

EMLL (TUE) 01/11/1972 Arena Coliseo Guadalajara [El Informador 1972-01-11]
1) ? vs ??
2) ? vs ??
3) ? vs ??
4) Índio Jerónimo, Perro Aguayo vs El Ídolo, Ringo Mendoza
5) El Solitario, Renato Torres vs Alberto Muñoz, Enrique Vera

EMLL (SUN) 01/16/1972 Arena Coliseo Guadalajara [El Informador 1972-01-16]
1) ? vs ??
2) ? vs ??
3) ? vs ??
4) Enrique Vera, Mario Alcala vs Gemelo Diablo I, Gemelo Diablo II
5) Alberto Muñoz, Anibal, Blue Demon vs Cesar Valentino, El Solitario, Renato Torres

indy (MON) 01/17/1972 Cancha San Pedro, Atencingo, Chietla, Puebla [https://www.facebook.com/LuchayBoxPuebla/photos/486849415453602/ Comisión Box y Lucha Puebla]
1) Jacinto Guzmman vs Marinero Loco
2) Águila Blanca vs El Beduino
3) Caballero Tiger, Súper Halcón vs El Silencioso, Javier Meza

EMLL (TUE) 01/18/1972 Arena Coliseo Guadalajara [El Informador 1972-01-18]
1) Índio I, Índio II vs Gemelo Diablo I, Gemelo Diablo II and El Ídolo, Pancho Ramírez and El Vengador, Enrique Vera and Mario Alcala, Ringo Mendoza and El Mongol, Luis González and Cesar Valentino, Perro Aguayo and Comando I, Comando II [torneo]

EMLL (SUN) 01/23/1972 Arena Coliseo [http://superluchas.com/2015/01/23/en-un-dia-como-hoy-1972-black-shadow-vs-motoyuki-kitazawa-1938-inicia-el-torneo-por-el-campeonato-nacional-de-peso-medio/ SuperLuchas]
1) José Luis Mendieta, Rayo de Jalisco b Coloso Colosetti, El Nazi
&& 10 man seeding battle battle royal

EMLL (SUN) 01/23/1972 Arena Coliseo Guadalajara [http://superluchas.com/2015/01/23/en-un-dia-como-hoy-1972-black-shadow-vs-motoyuki-kitazawa-1938-inicia-el-torneo-por-el-campeonato-nacional-de-peso-medio/ SuperLuchas]
1) El Vengador, Enrique Vera b Comando II, Perro Aguayo
2) Alberto Muñoz, Anibal, Tinieblas DQ Cesar Valentino, El Solitario, Renato Torres
## Solitario foul to Tinieblas

EMLL (SUN) 01/23/1972 Arena Puebla [http://superluchas.com/2015/01/23/en-un-dia-como-hoy-1972-black-shadow-vs-motoyuki-kitazawa-1938-inicia-el-torneo-por-el-campeonato-nacional-de-peso-medio/ SuperLuchas]
1) Milo Ventura, Porthos b As Negro., Gorila Osorio
2) Atila b Lalo Montenegro [hair]
## Atila's mask vs Lalo's hiar

EMLL (SUN) 01/23/1972 Córdoba, Veracruz [http://superluchas.com/2015/01/23/en-un-dia-como-hoy-1972-black-shadow-vs-motoyuki-kitazawa-1938-inicia-el-torneo-por-el-campeonato-nacional-de-peso-medio/ SuperLuchas]
1) Marinero Acosta, Tony Mulliquin b Sansón, Yoyo Garduño
2) El Trueno b Dr. Brian
## This Trueno is 2010s Delta's father.
&& for Benjamín Mora Horta's promotion

EMLL (SUN) 01/23/1972 Plaza de Toros Valente Arellano, Torreón, Coahuila [http://superluchas.com/2015/01/23/en-un-dia-como-hoy-1972-black-shadow-vs-motoyuki-kitazawa-1938-inicia-el-torneo-por-el-campeonato-nacional-de-peso-medio/ SuperLuchas]
1) Hielero Águilar b Rudy Palma [hair]
## hair vs hair
2) Blue Demon, Humberto Garza, Polo Torres b Espanto II, Gran Markus, Vick Amezcua

indy (SUN) 01/23/1972 Arena KO Algusto, Naucalpan, Estado de México [http://superluchas.com/2015/01/23/en-un-dia-como-hoy-1972-black-shadow-vs-motoyuki-kitazawa-1938-inicia-el-torneo-por-el-campeonato-nacional-de-peso-medio/ SuperLuchas]
1) El Enfermero, Espectro I b El Cid, Goliat Ayala [torneo, final]

indy (SUN) 01/23/1972 Arena San Juan Pantitlan, Ciudad Nezahualcóyotl, Estado de México [http://superluchas.com/2015/01/23/en-un-dia-como-hoy-1972-black-shadow-vs-motoyuki-kitazawa-1938-inicia-el-torneo-por-el-campeonato-nacional-de-peso-medio/ SuperLuchas]
1) El Lince b El Beduino.
2) Caballero Tigre II, Halcón Dorado II b Buddy Montes, Javier Meza

indy (SUN) 01/23/1972 Ecatepec, Estado de México [http://superluchas.com/2015/01/23/en-un-dia-como-hoy-1972-black-shadow-vs-motoyuki-kitazawa-1938-inicia-el-torneo-por-el-campeonato-nacional-de-peso-medio/ SuperLuchas]
1) El Tarasco, Shadito Cruz, Tony Cardenas b El Mariscal, Lancer, Roy Meneses

indy (SUN) 01/23/1972 Plaza de Toros el Cortijo, Venustiano Carranza, Distrito Federal [http://superluchas.com/2015/01/23/en-un-dia-como-hoy-1972-black-shadow-vs-motoyuki-kitazawa-1938-inicia-el-torneo-por-el-campeonato-nacional-de-peso-medio/ SuperLuchas]
1) Mano Negra, Tino Herrera b Bleda, Dick Angelo
2) Villano I, Villano II DRAW El Greco, Estrella Blanca
3) Black Shadow b Motoyuki Kitazawa

indy (SUN) 01/23/1972 Plaza de Toros La Aurora, Ciudad Nezahualcóyotl, Estado de México [http://superluchas.com/2015/01/23/en-un-dia-como-hoy-1972-black-shadow-vs-motoyuki-kitazawa-1938-inicia-el-torneo-por-el-campeonato-nacional-de-peso-medio/ SuperLuchas]
1) Joe Franco, Maravilla Peruana, Rayo Dorado b El Duque, El Inhumano, Loco Valentino Sr.

indy (SUN) 01/23/1972 Plaza de Toros Las Palmas, Jerécuaro, Guanajuato [https://www.facebook.com/photo/?fbid=511572843812323&set=g.1063818623692271 Angel Luzbel Nezahualcoyotl]
1) Terror Blanco vs Bat Masterson
2) Drake vs Tony Villa
3) Carta Brava I, Carta Brava II vs Chang Lee, El Satana

EMLL (TUE) 01/25/1972 Arena Coliseo Guadalajara [El Informador 1972-01-25]
1) ? vs ??
2) ? vs ??
3) ? vs ??
4) Mario Alcala, Ringo Mendoza vs Luis González, Perro Aguayo
5) Índio I, Índio II vs Gemelo Diablo I, Gemelo Diablo II

indy (WED) 01/26/1972 Arena Coliseo Acapulco, Acapulco, Guerrero [Box Y Lucha 1007]
1) Rayo de Jalisco b Ángel Blanco
2) Black Shadow b Leo López
3) José Luis Mendieta DRAW Escorpión II
4) Coloso Colosetti, El Solitario b Anibal, Garo Katcherian
&& good turnout for big name card

indy (THU) 01/27/1972 Arena Aficion [https://www.facebook.com/photo/?fbid=273834877876259&set=a.189806719612409 Arena Clasica]
1) El Tiburón, Toro Zuniga vs Cara Igual I, Cara Igual II
2) Blue Prince vs Dr. Misterio [HIDALGO WELTER]
3) Black Man vs Bobby Ramírez [HIDALGO LIGHT]
4) León Reyes vs Jhonny Lopez

indy (THU) 01/27/1972 Chilpancingo, Guerrero [Box Y Lucha 1007]
1) El Ermitano b Gema
2) Saeta Imperial DRAW El Fúnebre
3) Caballero De La Cruz b La Gardenia
4) Ben Ali Pasha, El Chacal De La Rosa b Ave Blanca, La Rata

EMLL (FRI) 01/28/1972 Arena Coliseo [Box Y Lucha 1007]
1) Zeus b Saeta Azteca
2) Villano I DQ Atila
3) Rafael Salamanca DRAW Villano I
4) Carlos Plata b Rodolfo Ruiz
5) Tony López b Rizado Ruiz
6) Ciclón Veloz Jr., Raúl Reyes b Cesar Valentino, Enfermero
## straight falls, leading to a Reyes/Valentino hair match next week
7) Ángel Blanco, El Solitario, Renato Torres b Alberto Muñoz, Black Shadow, Rayo de Jalisco

EMLL (SUN) 01/30/1972 Arena Coliseo Guadalajara [El Informador 1972-01-30]
1) ? vs ??
2) ? vs ??
3) ? vs ??
4) Índio Medina, Luis González vs El Ídolo, Mario Alcala
5) Alberto Muñoz, Garo Katcherian, Tinieblas vs Cesar Valentino, El Solitario, Índio Jerónimo

Indy (SUN) 01/30/1972 Plaza de Toros el Cortijo, Venustiano Carranza, Distrito Federal [Arena 702, RB]
1) César Silva, Rafael Salamanca b Bruno Victoria, El Maldito
2) Blue Demon, Ciclón Veloz Jr. b El Enfermero, Renato Torres

EMLL (TUE) 02/01/1972 Arena Coliseo Guadalajara [El Informador 1972-02-01, Halcon 136]
1) ? vs ??
2) ? vs ??
3) ? vs ??
4) Índio I, Índio II vs Gemelo Diablo I, Gemelo Diablo II [super libre]
5) Ringo Mendoza b Perro Aguayo  (c) [OCCIDENTE MIDDLE]
## Perro Aguayo, in Box y Lucha 978 (July 16, 1971), says he beat Munoz to win this title (at some point in the last few months, probably before Munoz won the NWA WELTER title in June 1971.)

indy (WED) 02/02/1972 Arena San Juan Pantitlan, Ciudad Nezahualcóyotl, Estado de México [Box Y Lucha 1007]
1) Caballero Loco vs Caballero As
2) Estrella Roja vs El Lunatico
3) Rudy Vazquez, Tamaulipeco vs El Reptil Verde, Potro Salvaje
4) El Sanguinario, Gato Negro vs Chacal, Killer Millan

Indy (THU) 02/03/1972 Arena Chilpancingo, Chilpancingo, Guerrero [RB]
1) Esclavo Negro vs Halcón Plateado
2) Saeta Imperial vs Fúnebre
3) Copetes De Oro vs Caballero De La Cruz
4) Johny García, Máscara De Hierro vs Pokarito Ramírez, Tiger Hispano

EMLL (FRI) 02/04/1972 Arena México [Box Y Lucha 1007, Box Y Lucha 1164, RB]
1) Danny Ortiz DQ El Polaco
2) Carlos Plata b León Negro
3) Beto Veloz b Coloso Colosetti
4) David Morgan b Ángel Blanco
5) Dr. Wagner, El Solitario b Huracán Ramírez, Manuel Polman
6) Black Shadow, Tinieblas b Michael Martelli, Rene Guajardo
7) Raúl Reyes b Cesar Valentino [hair]
&& matches 3-6 set by battle royal

indy (FRI) 02/04/1972 Chilpancingo, Guerrero [Box Y Lucha 1007]
1) ? vs ??
2) ? vs ??
3) Copetes De Oro vs Caballero De La Cruz
4) Pokraito Ramírez, Tigre Hispano vs Johnny García, Máscara De Hierro

EMLL (SAT) 02/05/1972 Pista Arena Revolución [Box Y Lucha 1007, RB]
1) Dardo Aguilar vs Gran Davis
2) Memo Valles vs El Maldito
3) Tino Herrera vs Bleda
4) El Greco vs Leo López [super libre]
5) Estrella Blanca, Mano Negra vs Dick Angelo, El Tauro
6) Alberto Muñoz, José Luis Mendieta vs El Enfermero, Renato Torres
7) Blue Demon vs Karloff Lagarde

Indy (SAT) 02/05/1972 Centro Social Deportivo y Cultural Tepito, Cuauhtémoc, Distrito Federal [RB]
1) Rocco vs La Gardenia
2) Chamaco Ruiz vs Apolo Real
3) Misterlo Infernal, Solano López vs Apolo De Oro, Saeta Imperial
4) Comanche, Fúnebre vs Enrique Hernández, Príncipe Maravilla  (c)
5) Cristian Welch, La Llorona I, La Llorona II vs Alzadu, Johnny García, Máscara De Hierro

EMLL (SUN) 02/06/1972 Arena Coliseo [RB]
1) Lalo Montenegro vs Zorro Plateado
2) Anibal, Tony López vs Chino Chow, Garo Katcherian and Coloso Colosetti, El Nazi and Alfonso Dantes, Vick Amezcua and Huroki Sito, Manuel Robles and Escorpión I, Escorpión II and El Rebelde, El Rostro and Villano I, Villano II [torneo]

EMLL (SUN) 02/06/1972 Arena Coliseo Guadalajara [El Informador 1972-02-06]
1) ? vs ??
2) ? vs ??
3) ? vs ??
4) Mario Alcala, Ringo Mendoza vs Rizado Ruiz, Rodolfo Ruiz
5) Alberto Muñoz, Manuel Polman, Ray Morgan vs Cesar Valentino, El Solitario, Renato Torres

EMLL (SUN) 02/06/1972 Pista Arena Revolución [Box Y Lucha 1007, RB]
1) El Duende vs Alberto Ventura
2) Chato García vs El Troyano
3) Nahur Kaliff vs Saeta Azteca
4) El Polaco vs Agente X
5) Dr. O’Borman vs Milo Ventura
6) Águila India, Gran Cochisse, Perro Aguayo vs Carlos Plata, Mr. Steel, Ringo Mendoza

Indy (SUN) 02/06/1972 Arena Benny, San Miguel Chalmita, Estado de México [RB]
1) Gardenia vs Danny York
2) Halcón Plateado vs Chamaco Ruiz
3) Fantasma Solitario vs Halcón Negro
4) Enrique Hernández, Saeta Imperial vs Fúnebre, Misterio Infernal
5) Araña I, Araña II, Cristian Welch vs El Matematico, Johnny García, Mr. S

Indy (SUN) 02/06/1972 Arena Culiacán, Culiacán, Sinaloa [Box Y Lucha 1007]
1) Caballero As vs Místico
2) Diplomatico vs Zurdo Perez
3) Estrella Roja vs Golden Star
4) El Virgo vs Gladiador De Atenas
5) Killer Millan, Potro Salvaje vs Estrella del Sur, Tamaulipeco

Indy (SUN) 02/06/1972 Arena Ecatepec de Morelos, Ecatepec, Estado de México [RB]
1) Manny Guzman vs Galileo, El Dandy, Jungla, Black Monster, El Poderoso, El Búfalo Negro, Gorilita Flores, Mario Plata, Shaito Cruz, Polo Curier, Chico Sanchez
2) Gory Casanova vs El Salvaje I [super libre]

Indy (SUN) 02/06/1972 Arena el Moral, Iztapalapa, Distrito Federal [RB]
1) King Pardo vs Gran Pelusso
2) Aristos II vs Azabache
3) Muerte Soltiaria vs The Black Fox II
4) El Emitano, Fuin Kazan vs Ray Rosas, The Black Fox I
5) Chucho Conde vs Golden Ángel [hair, mask]

indy (SUN) 02/06/1972 Arena La Escondida, Tepotzotlán, Estado de México [Box Y Lucha 1007]
1) El Ingeles vs Chamaco Hernández
2) Tenna Vick vs Tono Lopez
3) Azhor vs Piraña Humana I
4) Black Demon vs Jesus Valdicia
5) El Daver II vs Felix Lozada

indy (SUN) 02/06/1972 Arena Lopez Mateos [Box Y Lucha 1007]
1) Mr. Rhobos vs Bird Man
2) Rocky Nava vs Tigre Negro
3) Terry Bolaños vs Joe Marino
4) Ángel Infernal I, Ángel Infernal II, Gatubedo vs Chamaco Ortiz, Conde Azul, Huracán Negro
5) El Alacrán, Luzbel, Operman vs Costeñito Nava, Osideo, Scaramouche I

Indy (SUN) 02/06/1972 Arena Moyotzingo, Moyotzingo, Puebla [RB]
1) Johnny Ortega vs Zarco II
2) Al Hernana vs El Zarzo I
3) Mancha Roja II vs Johnny Reyes
4) Incógnito Rojo, Macnha Roja I vs El Sagitario, Jorge Linares
5) Ave Negra, El Yeti, Impala vs Chino Lopez, Cometa Negra, El Zapateito

Indy (SUN) 02/06/1972 Arena Olimpia, Ecatepec, Estado de México [RB]
1) Drake vs Chamaco Richard
2) Centuion I, Centuion II vs Benny Angeles, Rtio Moreno and Águila Imperial, Tony Cadenas and El Cubano, Roy Lance and Genio Negro, Rudy Espinosa and Irazú, Murciélago Infernal

Indy (SUN) 02/06/1972 Arena Olimpica, Gustavo A. Madero, Distrito Federal [RB]
1) El Saminarista vs Águila Imperial
2) Genio Negro vs Filli Guerrero
3) El Intruso I vs Abu Kassin
4) Loco Valentino vs Mario Plata
5) El Duque, El Inhumano vs Maravilla Peruana, Rayo Doaod

indy (SUN) 02/06/1972 Arena Rosales, Iztapalapa, Distrito Federal [Box Y Lucha 1007, RB]
1) Carnicerito vs Pedro Nieves
2) Tarasco vs Chan Lee
3) Loco Valentino vs Rudy Rivera
4) Fantomas vs Alex De Alba
5) Ángel de Oro, Halcón Dorado II vs Espectro, Gori Casanova

indy (SUN) 02/06/1972 Arena San Juan Pantitlan, Ciudad Nezahualcóyotl, Estado de México [Box Y Lucha 1007, RB]
1) Carnicerito vs Lalo Miranda
2) Tono De La Cruz vs Gori Rivera
3) Genaro Contreras vs Reyes Oliva
4) La Muerte II vs Astro I
5) Caballero Tigre, El Lince vs Javier Meza, La Sombra Vengadora

Indy (SUN) 02/06/1972 Arena Zitácuaro, Zitácuaro, Michoacán [RB]
1) Pepe Trueno vs El Impala
2) Maravilla Negra vs Astro Young
3) Delfin González vs Ray Martinez
4) Kenji Kaplin vs Lobo Potosino
5) Taro Yonekura vs Chacal de la Rosa
6) Comanche, Solano Lopez vs Caballero De La Cruz, Kactus

Indy (SUN) 02/06/1972 Banos Danubio, Iztapalapa, Distrito Federal [RB]
1) Índio Tizoc vs Mr. Lancer.
2) Tom Mix vs Gato Chino
3) Filli Guerrero vs El Diabólico
4) Halcón Dorado, Rav Acosta vs El Mava, Rav Aragón

Indy (SUN) 02/06/1972 Club Arena Santa Fe, Álvaro Obregón, Distrito Federal [RB]
1) El Mercenario vs Rayo Atómico
2) Chinto Gomez vs Cruz Gamada
3) El Magno vs Tritón Rojo
4) Chucho El Roto, Scaramouche II vs Beto González, Índio Chichimeca
5) Fantasmon I vs Ciclón Villegas

indy (SUN) 02/06/1972 Plaza de Toros el Cortijo, Venustiano Carranza, Distrito Federal [Box Y Lucha 1007, RB]
1) El Invasor vs Oso Blanco
2) Rey Halcón vs Pepe Casas
3) César Silva vs Leo López
4) Rafael Salamanca, Sergio Borrayo vs Atila, Bleda
5) Dr. Wagner, El Enfermero vs Ciclón Veloz, José Luis Mendieta

Indy (SUN) 02/06/1972 Plaza de Toros La Aurora, Ciudad Nezahualcóyotl, Estado de México [RB]
1) Thor vs El Seminarista
2) Dragón Azul vs Nick Barracuda
3) El Inhumano, Gory Casanova vs Carta Brava II, Juan Bravo
4) Joe Franco, Maravilla Peruana, Rayo Dorado vs El Duque, El Hindú, Loco Valentin
5) Carta Brava I vs Rasputín [mask, beard]

EMLL (TUE) 02/08/1972 Arena Coliseo Guadalajara [El Informador 1972-02-08]
1) ? vs ??
2) ? vs ??
3) ? vs ??
4) Cesar Valentino, Perro Aguayo vs Mario Alcala, Ringo Mendoza
5) Índio I, Índio II  (c) vs Gemelo Diablo I, Gemelo Diablo II [OCCIDENTE TAG]

CMLL (FRI) 02/11/1972 Arena México [RB, SL 315]
1) Anibal, Rey Morgan, Tinieblas b Karloff Lagarde, Michael Martell, Rene Guajardo
&& sell out

indy (FRI) 02/11/1972 Gimnasio Nacional Teodoro Palacio Flores, Guatemala City, Guatemala [https://www.facebook.com/photo.php?fbid=1095626414114858&set=p.1095626414114858&type=1&theater Francisco Ayerdi?]
1) Jorge Mendoza vs Lacandón
2) Rayo Chapin vs El Apache
3) Leonel Rivas vs Vega Dingo
4) Echeverria, Mil Máscaras vs El Cirujano, Massambula

EMLL (SUN) 02/13/1972 Arena Coliseo Guadalajara [El Informador 1972-02-13]
1) ? vs ??
2) ? vs ??
3) ? vs ??
4) David Rey Morgan, Manuel Polman vs Alfonso Dantes, Dr. Wagner
5) Alberto Muñoz vs El Solitario
## champion vs champion

indy (SUN) 02/13/1972 Arena Aficion
1) Caras Iguales vs Tauro, El Capitán, León Reyes, Negro Grandaos, Jhonny Lopez, Bobby Ramírez [seeding battle royal]
2) Cesar Valentino, El Enfermero vs Audaz, Mano Negra

EMLL (TUE) 02/15/1972 Arena Coliseo Guadalajara [El Informador 1972-02-15]
1) ? vs ??
2) ? vs ??
3) ? vs ??
4) Gemelo Diablo I, Gemelo Diablo II vs El Vengador, Enrique Vera
5) Índio Jerónimo vs Perro Aguayo, Ringo Mendoza [hair]

Indy 1 (WED) 02/16/1972 Forum, Naucalpan, Estado de México [Arena 748, RB]
1) El Lobo b El Oaxaqueno
2) Genaro Contreras b El Apache
3) Bengala b Mario Prado
4) El Salvaje, Villano III b Halcón Dorado, Octavio Gaona
5) Gori Medina, Nahur Kaliff b Blue Demon, Dos Caras

indy (THU) 02/17/1972 Gimnasio Municipal Josué Neri Santos, Ciudad Juárez, Chihuahua [https://www.facebook.com/photo.php?fbid=2225612314342771&set=pb.100006820717653.-2207520000..&type=3&theater Jose Renteria]
1) Legionario vs Tigre Romano
2) Roy Estrada vs Lobo Feroz
3) Beto Monterrosa, Carlos Monterrosa, El Marquez vs Chacal Ruiz, Fishman, Príncipe Fiera
4) Henry Pilusso, Mao Chang vs Bulldog Villegas, Ruby Ruvalcaba
5) Carlos Mata vs El Cobarde []

EMLL (FRI) 02/18/1972 Arena México [http://superluchas.com/2015/02/18/en-un-dia-como-hoy-1972-sicodelico-regresa-de-japon-con-las-cenizas-de-poncho-aguirre-blue-demon-y-el-espanol-manolo-pollman-vs-los-rebeldes/ SuperLuchas]
1) Anibal, David Morgan, Tinieblas b Ángel Blanco, El Solitario, Renato Torres
2) Blue Demon, Manuel Polman DRAW Karloff Lagarde, Rene Guajardo
3) Michael Martelli b Raúl Reyes
## Raul Reyes is the current national heavyweight champion
4) Chino Chow b Vick Amezcua
5) Huroki Sito b Mr. Steel
6) El Rebelde b León Negro

Arias (SUN) 02/20/1972 Centro Deportivo Dr. G. Bolanos Cacho, Querétaro, Querétaro [https://www.facebook.com/photo/?fbid=509081597394781&set=g.1063818623692271 Angel Luzbel Nezahualcoyotl]
1) Centella Negra vs La Cobra
2) Johnny El Mulato vs Satán
3) Elgato, Taras Bubla vs Pulgarcito, Tarzan Ramírez
4) Black Stomberg, Fantasma Negro vs Comunista I, Fantasmon II

EMLL (SUN) 02/20/1972 Arena Coliseo [El Arte de Gotch, MF, RB]
1) El Maldito vs Mano Negra
2) El León Negro vs Mr. Steel
3) Huroki Sito, Vick Amezcua vs Chino Chow, El Rebelde
4) El Nazi, Karloff Lagarde vs Blue Demon, José Luis Mendieta
5) El Rostro b Manuel Robles [hair]

EMLL (SUN) 02/20/1972 Arena Coliseo Guadalajara [El Informador 1972-02-20]
1) ? vs ??
2) ? vs ??
3) ? vs ??
4) Alfonso Dantes, Gemelo Diablo I vs Ringo Mendoza, Sergio Borrayo
5) Colosso Colosetti, Michael Martel, Rene Guajardo vs Alberto Muñoz, Ciclón Veloz Jr., Ray Morgan

EMLL (TUE) 02/22/1972 Arena Coliseo Guadalajara [El Informador 1972-02-22]
1) ? vs ??
2) ? vs ??
3) ? vs ??
4) Caligula, El Mongol vs Joe Martin, Mario Alcala
5) Coloso Colosetti, Perro Aguayo, Rene Guajardo vs Ciclón Veloz, El Ídolo, Rubén Juárez

EMLL (FRI) 02/25/1972 Arena México [Box Y Lucha 1167]
1) Saeta Azteca b Pepe Casas
2) Carlos Plata b Atila
3) Anibal, David Morgan b Alberto Muñoz, Manolo Polman and Huracán Ramírez, Tinieblas and Black Shadow, Blue Demon and Ángel Blanco, Dr. Wagner and El Solitario, Renato Torres and El Nazi, Michael Martelli and Karloff Lagarde, Rene Guajardo [torneo]
&& eight team tournament. David MOrgan & Anibal beat Huracan Ramirez & Tinieblas in final.

EMLL (SAT) 02/26/1972 Pista Arena Revolución [Box y Lucha 1011, Box y Lucha 3539 (reprint), MF]
1) Estrella Blanca b Tauro [mask]
## Tauro is Antonio Grimaldo

EMLL (SUN) 02/27/1972 Arena Coliseo Guadalajara [El Informador 1972-02-27]
1) ? vs ??
2) ? vs ??
3) ? vs ??
4) Bleda, Michael Martel vs El Vengador, Tony López
5) Alfonso Dantes, Colosso Colosetti, Rene Guajardo vs Ciclón Veloz, Huracán Ramírez, Rey Morgan

indy (SUN) 02/27/1972 Arena Ecatepec de Morelos, Ecatepec, Estado de México [https://www.facebook.com/photo/?fbid=511572517145689&set=g.1063818623692271 Angel Luzbel Nezahualcoyotl]
1) Javier Meza vs El Buitre, El Benduino, Manny Guzman, Pedro Nieves, Chang Lee, Ave Negra, Tarasco I, Satán, Benny Angeles, Chico Sanchez, Tarasco II, Jungla, Mar Allah, Abudd Kassim
&& year is a guess

EMLL (TUE) 02/29/1972 Arena Coliseo Guadalajara [El Informador 1972-02-29]
1) ? vs ??
2) ? vs ??
3) ? vs ??
4) Comando II, La Furia vs Ringo Mendoza, Sergio Borrayo
5) Alfonso Dantes, Rene Guajardo vs Ciclón Veloz, Rubén Juárez

indy (WED) 03/01/1972 Arena San Juan Pantitlan, Ciudad Nezahualcóyotl, Estado de México [Box y Lucha 1012]
1) El Sanguinario  (c) b Gato Negro [mask]
## Gato negro is Benny Cruz

Chavez (THU) 03/02/1972 Arena Aficion, Iguala, Guerrero [RL]
1) ? vs ??
2) ? vs ??
3) ? vs ??
4) Talismán vs Águila Imperial
5) Blue Demon, Tarasco I vs Gory Casanova, Roy Meneses

EMLL (SAT) 03/04/1972 Pista Arena Revolución [RL]
1) Nahur Kaliff vs Lalo Montenegro
2) El Rebelde, Huracán Ramírez vs Tauro, Vick Amezcua and César Silva, Raúl Reyes and El Índio Jeronimo, Perro Aguayo and Audaz, Ringo Mendoza and Huroki Sito, Manuel Robles and Carlos Plata, Estrella Blanca and Cesar Valentino, Enfermero [torneo]

Indy (SAT) 03/04/1972 Arena Internacional, Tepeji, Hidalgo [RL]
1) Tarasco I vs Bengala I, Manny Guzman, El Buitre II, Tony Cardenas, Irazú, Tarasco II, Talismán, Roy Meneses, El Mariscal, El Húngaro, Bengala II, Chico Sánchez, Jungla

Indy (SAT) 03/04/1972 ARENA SANTA ANA, Chiautempan, Estado de México
1) El Índio Tizoc vs El Gato Chino
2) Ray Jimenez vs Pedro Nieves
3) El Maya, Rolando Valentino vs Ángel de Oro, Caballero Tigre
4) Escorpión I, Escorpión II vs El Halcón Dorado, El Lince

Indy (SAT) 03/04/1972 Centro Social Deportivo y Cultural Tepito, Cuauhtémoc, Distrito Federal
1) Mr. Robert vs Pequeño Yaqui
2) Danny York vs Delfin González
3) Relámpago Dorado vs Ángel Solitario
4) Apolo De Oro, Rocco vs José De León, La Araña 1
5) Mario Correa, Popeye vs La Lechuza, Mr. ?
6) El Vagabundo, El Veracruzano vs El Leopardo, La Mosca
## El Gran Nicolarr is the wild card

EMLL (SUN) 03/05/1972 Arena Coliseo [RL]
1) Caligula vs La Saeta Azteca
2) Danny Ortiz vs Mazambula El Brujo
3) Bruno Estrada vs Rafael Salamanca
4) El Nazi, Escorpión I, Escorpión II vs Chino Chow, El Rostro, José Luis Mendieta
5) Alberto Muñoz, Black Shadow vs Dr. Wagner, Renato Torres

EMLL (SUN) 03/05/1972 Arena Coliseo Guadalajara [El Informador 1972-03-05]
1) ? vs ??
2) ? vs ??
3) Alfonso Dantes, Rene Guajardo vs Ciclón Veloz, Rey David Morgan and Colosso Colosetti, Vick Amezcua and Anibal, Manuel Polman and Carlos Plata, Ringo Mendoza [torneo]

EMLL (SUN) 03/05/1972 Pista Arena Revolución [RL]
1) Frank Hernández vs León Reyes
2) El Capitán vs Memo Valles
3) El Maldito vs Joe Martin
4) Bruno Victoria vs Mario Rocca
5) Dr. O’Borman, El Polaco vs El Cóndor, Mano Negra
6) Blue Demon, Enrique Vera vs Gemelo Diablo I, Gemelo Diablo II

Indy (SUN) 03/05/1972 Arena Aficion, Iguala, Guerrero [RL]
1) ? vs ??
2) ? vs ??
3) Caballero Gardenia vs El Indomable
4) El Clavo vs Thor
5) Centurion I, Centurion II vs Benny Angeles, Genio Negro

Indy (SUN) 03/05/1972 Arena Ecatepec de Morelos, Ecatepec, Estado de México [RL]
1) Zuanga vs Abudd Kassim
2) Talismán vs Irazú
3) Ruddy Espinsa vs Tony Cardenas
4) Octavio Gaona Jr., Sheik Mar Allah, Tarasco II vs El Beduino, Javier Meza, Manny Guzman
5) Tarasco I vs Jungla, Ave Negra [mask]

Indy (SUN) 03/05/1972 Arena el Moral, Iztapalapa, Distrito Federal [RL]
1) Satelite Azul vs Chucho Conde Jr.
2) Danny York vs Súper X
3) Indornable De Tepito vs Cometa Negro
4) Chucho Conde, El Nahual vs Coster, Flecha Veloz
5) Impala I, Impala II vs Impostor I, Impostor II

Indy (SUN) 03/05/1972 Arena Lopez Mateos [RL]
1) Chamaco Torres vs Pantera Escarlata
2) Ráfaga Azul vs Conde Murciélago
3) Operman vs Gatúvedo
4) Scaramouche I vs Joe Marino, Rockv Nava, Luzbel, Beto González, Scaramouche II, The Stronger, Chico Vertiz
5) Costeñito Nava vs Tigre Negro
6) El Delfin vs Odiseo

Indy (SUN) 03/05/1972 Arena Olimpia, Ecatepec, Estado de México [RL]
1) Leo Pineda vs El Inmortal
2) El Poderoso vs Fantasma Maya
3) El Universo vs El Seminarista
4) Ruddy Rivera vs El Rey
5) El Buitre II, El Zombie vs Blue Starr, Rito Moreno

Indy (SUN) 03/05/1972 Arena Rosales, Iztapalapa, Distrito Federal [RL]
1) El Aguililla vs Antorcha Dorada
2) El Monetarfo vs Tony Bernal, Manuel Hernández, Atómico Blanco, Rey Trueno, Jet Man, Tres Estrellas, Buffon Negro
3) Nacho Valentino vs Kid Bohemio
4) Benny Cruz, El Átomo vs El Árabe, Makabro 1

Indy (SUN) 03/05/1972 Arena San Juan Pantitlan, Ciudad Nezahualcóyotl, Estado de México [RL]
1) El Carnicerito vs Erick Romano
2) Gato Chino vs Toño De La Cruz
3) Índio Tizoc vs Tom Mix
4) El Salvaje, Goliat Ayala vs Genaro Contreras, Niño Montana
5) Buddy Montes, Rolando Valentino vs Caballero Tigre, El Halcón Dorado

Indy (SUN) 03/05/1972 Plaza de Toros el Cortijo, Venustiano Carranza, Distrito Federal [RL]
1) Dardo Aguilar vs El Invasor
2) Pepe Casas vs Agente X
3) El Índio Jeronimo, Perro Aguayo vs Audaz, Garo Katcherian and Huroki Sito, Manuel Robles and Villano I, Villano II and El Rebelde, Ringo Mendoza

Indy (SUN) 03/05/1972 Plaza de Toros La Aurora, Ciudad Nezahualcóyotl, Estado de México [RL]
1) El Lince vs Joe Franco, Maravilla Peruana, Rayo Dorado, El Único, Relámpago Potosino, Filli Guerrero, El Hindú, El Duque, Gory Casanova, El Inhumano, Raspuntin, Búfalo Negro, Tetzu Higami

EMLL (TUE) 03/07/1972 Arena Coliseo Guadalajara [El Informador 1972-03-07]
1) ? vs ??
2) ? vs ??
3) ? vs ??
4) El Vengador, Ringo Mendoza vs Comando II, La Furia
5) Anibal, Huracán Ramírez vs Colosso Colosetti, Vick Amezcua

EMLL (SAT) 03/11/1972 Pista Arena Revolución [RB]
1) Memo Valles b El Invasor
2) Agente X b Zeus
3) Bruno Victoria b Mario Rocca
4) Tauro b Milo Ventura
5) Mr. Steel DQ Bruno Estrada
6) El Enfermero, Leo López b El Rebelde, Rafael Salamanca
7) Audaz, Ciclón Veloz Jr., El Rostro b El Nazi, Gemelo Diablo I, Gemelo Diablo II
## took 1/3

EMLL (SUN) 03/12/1972 Arena Coliseo Guadalajara [El Informador 1972-03-12]
1) ? vs ??
2) ? vs ??
3) ? vs ??
4) Colosso Colosetti, Comando I vs El Vengador, Ringo Mendoza
5) Ciclón Veloz Jr., Tinieblas vs Karloff Lagarde, Rene Guajardo

EMLL (TUE) 03/14/1972 Arena Coliseo Guadalajara [El Informador 1972-03-14]
1) ? vs ??
2) ? vs ??
3) ? vs ??
4) Luis Chavira, Luis González vs Pancho Ramírez, Sergio Borrayo
5) Alfonso Dantes, El Vikingo vs Carlos Mata, Rubén Juárez

indy (THU) 03/16/1972 Plaza de Toros San Mateo, Chilpancingo, Guerrero
1) Chino Lopez, Cometa Negra, Diablo Salvaje, Jhnny Reno, Mr. Robets vs Copetes De Oro, Fantasma Dorada, Impala I, Impala II, Príncipe Mulato [battle royal]
&& year is a guess

EMLL (FRI) 03/17/1972 Arena México [RB]
1) Huracán Ramírez b Karloff Lagarde
2) Raúl Reyes b Michael Martelli [hair]
3) David Morgan b El Solitario  (c) [NWA LH]

EMLL (SUN) 03/19/1972 Arena Coliseo Guadalajara [El Informador 1972-03-19]
1) ? vs ??
2) ? vs ??
3) ? vs ??
4) Audaz, Tinieblas vs Alfonso Dantes, Coloso Colosetti
5) Ciclón Veloz Jr. vs Rene Guajardo [super libre]

indy (SUN) 03/19/1972 Arena Azteca, Iztapalapa, Distrito Federal [https://www.facebook.com/photo/?fbid=509082910727983&set=g.1063818623692271 Angel Luzbel Nezahualcoyotl]
1) Ráfaga Azul vs Conde Murciélago
2) Casanova Jr. vs Estrella del Sur
3) Cometa Azul vs Fantasma Asesino
4) Águila Blanca vs El Alacrán
5) Black Stromberg, Odiseo vs Cadáver I, Cadáver II

EMLL (TUE) 03/21/1972 Arena Coliseo Guadalajara [El Informador 1972-03-21]
1) ? vs ??
2) ? vs ??
3) ? vs ??
4) Luis Chavira, Luis González vs Carlos Mata, Rey Halcón
5) El Vikingo, Escorpión I, Escorpión II vs Audaz, Luis Mariscal, Ringo Mendoza

EMLL (SUN) 03/26/1972 Arena Coliseo Guadalajara [El Informador 1972-03-26]
1) ? vs ??
2) ? vs ??
3) ? vs ??
4) Chino Chow, Ringo Mendoza, Tinieblas vs Alfonso Dantes, El Nazi, Vick Amezcua
5) Ciclón Veloz Jr.  (c) vs Rene Guajardo [MEX MIDDLE]

indy (SUN) 03/26/1972 Arena Coliseo, Zacapu, Michoacán [https://www.facebook.com/photo/?fbid=511572270479047&set=g.1063818623692271 Angel Luzbel Nezahualcoyotl]
1) Tigre Gomez vs Thessu Higami, Látigo Negro, Chang Lee, Chivo Riverita, Satán, Alejandro Duval, Murciélago Dorado, Javier Duval, Boby Soriano

EMLL (TUE) 03/28/1972 Arena Coliseo Guadalajara [El Informador 1972-03-28]
1) ? vs ??
2) ? vs ??
3) ? vs ??
4) Carlos Plata, Ciclón Veloz Jr., El Vengador vs Alfonso Dantes, Bleda, Luis Mariscal
5) La Gacela vs Lorenzo El Gitano, Félix Mosqueda [hair]

EMLL (SUN) 04/02/1972 Arena Coliseo Guadalajara [El Informador 1972-04-02]
1) ? vs ??
2) ? vs ??
3) ? vs ??
4) Bleda, Vick Amezcua vs El Vengador, Ringo Mendoza
5) Audaz, Ciclón Veloz Jr., Rey Morgan vs Alfonso Dantes, Ángel Blanco, Dr. Wagner

indy (SUN) 04/02/1972 Arena Iguala, Iguala, Guerrero [MF]
1) El Centurión b Benny Angeles [hair]

indy (SUN) 04/02/1972 Arena San Fernando, Naucalpan, Estado de México
1) Chino Torres vs Araña de Plata
2) El Gringo vs Black Demon, Fantasma Dorado I, Fantasma Dorado II, El Kaiser, Caballero Audaz, Pequeño Daniel, Memo Juarez, Vagabundo II, Jesus Valdicia, Felix Lozada, Magudu, Vick Lugo, Boby González, Juan Segura, El Molusco

EMLL (TUE) 04/04/1972 Arena Coliseo Guadalajara [El Informador 1972-04-04]
1) ? vs ??
2) ? vs ??
3) ? vs ??
4) Pancho Ramírez, Sergio Borrayo vs Luis Chavira, Luis González
5) Carlos Mata, El Ídolo, Tony López vs Alfonso Dantes, El Mongol, Luis Mariscal

EMLL (FRI) 04/07/1972 Arena México [https://www.facebook.com/cmll.oficial/photos/a.352219088254374.1073741827.351036975039252/557413501068264/?type=1 CMLL, luchawiki, wrestling-titles]
1) El Solitario b Rey Morgan [hair]
2) Ángel Blanco b Raúl Reyes  (c) [MEX HEAVY]

indy (FRI) 04/07/1972 Arena Libertad, Tulancingo, HIdalgo
1) Tony Zuniga vs Bobby Ramírez
2) Mano Negra vs Frank Tejeda
3) Black Shadow, Carlos Plata vs Coloso Colosetti, El Enfermero
4) Huracán Ramírez vs El Nazi

Chavez (SUN) 04/09/1972 Arena Aficion, Iguala, Guerrero [Box y Lucha 1018, RB]
1) Pegasso b Lalo Miranda
2) Águila Imperial b La Momia Del Terror II
## rematch
3) Blue Star, Tom Mix b Centurion II, Gran Tony
4) El Santo, Sheik Mar Allah b La Momia Del Terror I, Rebelde Rojo
&& huge crowd; Mario Chavez said to be promoter

EMLL (SUN) 04/09/1972 Arena Coliseo Guadalajara [El Informador 1972-04-09]
1) ? vs ??
2) ? vs ??
3) ? vs ??
4) Bleda, El Hippie vs El Vengador, Tony López
5) Ángel Blanco, Dr. Wagner, El Solitario vs Black Shadow, Huracán Ramírez, Ray Mendoza

indy (SUN) 04/09/1972 Arena Olimpia, Tlalnepantla, Estado de México [MF]
1) Duque b Yaqui I [mask]
## Yaqui is Yaqui Vargas

Indy (SUN) 04/09/1972 Arena Rosales, Iztapalapa, Distrito Federal [Box y Lucha 1018, RB]
1) Tony Bernal b Jorge Rubi [? FEATHER]

Indy (SUN) 04/09/1972 Arena San Juan Pantitlan, Ciudad Nezahualcóyotl, Estado de México [Box y Lucha 1018, RB]
1) Ciclón Mexicano, La Cobra I b Buddy Montes, Rudy Montes

Indy (SUN) 04/09/1972 Arena Santa Fe, Guadalajara, Jalisco [Box y Lucha 1018, RB]
1) Espía Negro II b Oso Ramírez [SANTA FE HEAVY]
2) Caballo Dorado, el Signo, Fugaz b Caballero Blanco, Irlandés, Tigre Negro

indy (SUN) 04/09/1972 Arena Zamora, Zamora, Michoacán [https://www.facebook.com/photo/?fbid=511572353812372&set=g.1063818623692271 Angel Luzbel Nezahualcoyotl]
1) Chang Lee vs Alex Caballero, Tessu Higami, Carlos Zimbron, Satán, Reyes Oliva, Suriano, Chon Mena, Mack Ruiz, Roy Lancer

EMLL (TUE) 04/11/1972 Arena Coliseo Guadalajara [El Informador 1972-04-11]
1) ? vs ??
2) ? vs ??
3) ? vs ??
4) Escorpión I, Escorpión II vs Mario Alcala, Martin Escobedo
5) Enrique Vera, Ray Mendoza, Ringo Mendoza vs El Solitario, Luis Mariscal, Vick Amezcua

EMLL (WED) 04/12/1972 Arena Coliseo Acapulco, Acapulco, Guerrero [Box y Lucha 1018, RB]
1) Hércules b Frank Tejada
2) El Centauro b León Negro
3) Ciclón Veloz Jr., Rey Morgan b El Nazi, Rene Guajardo
4) Estrella Blanca DQ Tauro [MEX LIGHT]
## 32 minutes; Roberto Rangel called the DQ on a foul, but it wasn’t totally clear it was a foul
5) Alberto Muñoz  (c) b Karloff Lagarde [NWA WELTER]
## 30+ minutes

Indy (WED) 04/12/1972 Arena San Juan Pantitlan, Ciudad Nezahualcóyotl, Estado de México [Box y Lucha 1018, RB]
1) Killer Millan, Rudy Vazquez b Cherokee, Potro Salvaje
2) Caballero As DQ El Chacal

EMLL (FRI) 04/14/1972 Arena México [Box y Lucha 1018, RB]
1) Carlos Plata b Leo López
2) Alfonso Dantes b El Rostro
3) Dr. Wagner b Enrique Vera
4) Ray Mendoza b Ángel Blanco
5) El Solitario b Tinieblas
6) Ray Mendoza b El Solitario
7) Alberto Muñoz, Rayo de Jalisco b Karloff Lagarde, Rene Guajardo
&& Friday format at this point is the top 2 matches are 2/3 falls, and the five singles matches are one fall. Ray Mendoza/Solitario is ⅔ falls unlike the other singles matches

EMLL (SAT) 04/15/1972 Pista Arena Revolución [Box y Lucha 1018, MF, RB]
1) Zeus vs Memo Valles
2) Bruno Victoria vs El Trueno
3) Dr. O’Borman vs Rafael Salamanca
4) Dick Angelo, Mazambula vs El Rebelde, Mano Negra
5) Atila vs Mr. Steel
6) Black Shadow, Huracán Ramírez b Cesar Valentino, Renato Torres
7) Tauro b Milo Ventura [hair]

EMLL (SUN) 04/16/1972 Arena Coliseo Guadalajara [El Informador 1972-04-16]
1) ? vs ??
2) ? vs ??
3) ? vs ??
4) Mario Alcala, Tony López vs Escorpión II, Luis Mariscal
5) Huracán Ramírez, Ray Mendoza, Rayo de Jalisco vs Ángel Blanco, Dr. Wagner, El Solitario

indy (SUN) 04/16/1972 Arena Ecatepec de Morelos, Ecatepec, Estado de México [MF]
1) Chamaco Richard b Tony Cruz [hair]

indy (SUN) 04/16/1972 Auditorio Municipal, Purepero, Michoacán [https://www.facebook.com/photo/?fbid=511572453812362&set=g.1063818623692271 Angel Luzbel Nezahualcoyotl]
1) Tessu Higami vs El Recio
2) Roy Lancer vs El Suriano
3) Murciélago Dorado vs El Versátil
4) Chang Lee, Satán vs Alex Caballero, Javier Duval

EMLL (TUE) 04/18/1972 Arena Coliseo Guadalajara [El Informador 1972-04-18]
1) ? vs ??
2) ? vs ??
3) ? vs ??
4) Agente X, Danny Ortiz vs Gran Davis, Luis Chavira
5) Bleda, El Solitario, Vick Amezcua vs El Vengador, Huracán Ramírez, Ringo Mendoza

Indy (WED) 04/19/1972 Arena San Juan Pantitlan, Ciudad Nezahualcóyotl, Estado de México [Box y Lucha 1018, RB]
1) Gato Negro vs Gladiador De Atenas [EDM HEAVY, #1 Contenders]
## winner El Arabe next week
2) Caballero As, El Tamaulipeco vs El Chacal, Killer Millan

indy (THU) 04/20/1972 Gimnasio Municipal, Ciudad Juárez, Chihuahua [https://www.facebook.com/photo.php?fbid=2212610732309596&set=pb.100006820717653.-2207520000..&type=3&theater Jose Renteria]
1) Humberto Escobedo vs Black Danger
2) El Delfin vs Black Cat II
3) El Marquez vs Fishman
4) Chucho Villa, Índio Medina, Tony Reyna vs Bulldog Villegas, Espectro II, Rodolfo Ruiz
5) Mao Chang vs Rizado Ruiz

EMLL (FRI) 04/21/1972 Arena México [Box y Lucha 1638, RB]
** Arena Mexico 16th Anniversary
1) Ray Mendoza b David Morgan  (c) [NWA LH]
2) Karloff Lagarde b Alberto Muñoz [hair]

EMLL (SUN) 04/23/1972 Arena Coliseo Guadalajara [El Informador 1972-04-23]
1) ? vs ??
2) ? vs ??
3) ? vs ??
4) Ángel Blanco, El Enfermero vs Black Shadow, Ciclón Veloz Jr.
5) Ray Mendoza vs El Solitario

EMLL (MON) 05/01/1972 Arena Coliseo Guadalajara [El Informador 1972-05-01]
1) ? vs ??
2) ? vs ??
3) ? vs ??
4) El Vengador, Ray Mendoza, Tony López vs Ángel Blanco, Bleda, Luis Mariscal
5) Vick Amezcua vs Ringo Mendoza [hair]

EMLL (SUN) 05/07/1972 Arena Coliseo Guadalajara [El Informador 1972-05-07]
1) ? vs ??
2) ? vs ??
3) ? vs ??
4) Alberto Muñoz, Tony López vs Cesar Valentino, Luis Mariscal
5) El Solitario vs Ray Mendoza [super libre]

EMLL (TUE) 05/09/1972 Arena Coliseo Guadalajara [El Informador 1972-05-09]
1) Bleda, Luis Mariscal vs Escorpión I, Escorpión II and El Mongol, La Furia and Ringo Mendoza, Tony López and Luis Chavira, Luis González and El Cordobes, El Ídolo and José Torres, Martin Escobedo and Carlos Mata, Mario Alcala [torneo]

EMLL (SUN) 05/14/1972 Arena Coliseo Guadalajara [El Informador 1972-05-14]
1) ? vs ??
2) ? vs ??
3) ? vs ??
4) Ringo Mendoza, Tony López vs Escorpión I, Luis Mariscal
5) Cesar Valentino, El Solitario, Renato Torres vs Alberto Muñoz, Audaz, Rayo de Jalisco

indy (SUN) 05/14/1972 Arena Cocotitlán, Cocotitlán, Estado de México
1) ? vs ??
2) Perro I vs Chamaco Vauquez
3) Black Vazquez vs Relámpago Azul
4) Ray Martinez vs El Tlaxcalteca
5) Fantasma Dorado I, Fantasma Dorado II vs Príncipe Olimpia I, Príncipe Olimpia II
6) Faraón I, Faraón II, Faraón III vs Gladiador Marino, Huracán Negro, Ray Rosas

indy (SUN) 05/14/1972 Plaza de Toros, Reynosa, Tamaulipas [https://www.facebook.com/photo/?fbid=511572913812316&set=g.1063818623692271 Angel Luzbel Nezahualcoyotl]
1) Genaro Contreras vs Ray Jimenez, Chang Lee, Reyes Oliva, Chico Baez, Tony Romano [battle royal]
2) El Santo, Rebelde Rojo vs Goliath Ayala, Gori Casanova
&& year is a guess

EMLL (TUE) 05/16/1972 Arena Coliseo Guadalajara [El Informador 1972-05-16]
1) ? vs ??
2) ? vs ??
3) ? vs ??
4) El Ídolo, Mario Alcala vs Bleda, La Furia
5) Black Shadow, Ciclón Veloz Jr. vs Hippie I, Hippie II

EMLL (SAT) 05/20/1972 Pista Arena Revolución [http://www.boxylucha.com/foro/viewtopic.php?p=736818#p736818 CARDENAL @ box y lucha, MF]
1) Oso Blanco vs El Lobo
2) Dr. O’Borman vs Danny Ortiz
3) Milo Ventura vs Dick Angelo
4) Bruno Estrada vs Villano II
5) Comando I, Comando II vs El Rostro, José Luis Mendieta
6) Black Shadow, Tinieblas vs Alfonso Dantes, Coloso Colosetti
7) Estrella Blanca  (c) b Tauro [MEX LIGHT]
## Estrella Blanca is champion.

indy (SAT) 05/20/1972 Arena Rosales, Iztapalapa, Distrito Federal [Box y Lucha, RL]
1) Pequeño Tigre vs La Máscara Roja
2) Dick Trébol vs Chamaco Juarez
3) Pielo Roja, Tony Berneal vs El Aventurero, Makabro II
4) El Comanche, Makabro I vs Apolo Chino, Yaqui Fernandez
5) El Efe vs Benny Cruz

indy (SAT) 05/20/1972 Arena San Juan Pantitlan, Ciudad Nezahualcóyotl, Estado de México [Box y Lucha, RL]
1) Black Center vs Daniel Boon
2) Rubi Muralla vs Índio Chichimeca
3) El Sanguinario vs La Maravilla Peruana
4) Monje Siniestro vs Niño Montana
5) Tinieblas vs Gori Casanova

EMLL (SUN) 05/21/1972 Arena Coliseo Guadalajara [El Informador 1972-05-21]
1) Escorpión I vs Bleda, Escorpión II, Nahuar Kaliff, Tony López, La Furia, Mario Alcala, Ringo Mendoza [torneo]
2) Audaz, Blue Demon, Huracán Ramírez vs Colosso Colosetti, Karloff Lagarde, Luis Mariscal

indy (SUN) 05/21/1972 Arena Iguala, Iguala, Guerrero
1) Blue Star b Bello Memo [hair]

EMLL (TUE) 05/23/1972 Arena Coliseo Guadalajara [El Informador 1972-05-23]
1) ? vs ??
2) ? vs ??
3) ? vs ??
4) Escorpión I, Escorpión II vs José Torres, Martin Escobedo
5) Karloff Lagarde, Rene Guajardo vs Black Shadow, Huracán Ramírez

EMLL (SUN) 05/28/1972 Arena Coliseo Guadalajara [El Informador 1972-05-28]
1) ? vs ??
2) ? vs ??
3) ? vs ??
4) Bleda, Escorpión I vs Ringo Mendoza, Tony López
5) Anibal, Audaz, El Marquez vs Alfonso Dantes, Karloff Lagarde, Luis Mariscal

EMLL (TUE) 05/30/1972 Arena Coliseo Guadalajara [El Informador 1972-05-30]
1) ? vs ??
2) ? vs ??
3) ? vs ??
4) Escorpión I, Escorpión II vs El Ídolo, Mario Alcala
5) Ángel Blanco, Cesar Valentino vs Anibal, El Marquez

EMLL (SUN) 06/04/1972 Arena Coliseo Guadalajara [El Informador 1972-06-04]
1) ? vs ??
2) ? vs ??
3) ? vs ??
4) Mario Alcala, Ringo Mendoza vs Black Shadow, Blue Demon
5) Anibal, Black Shadow, Chino Chow vs Colosso Colosetti, Índio Jerónimo, Perro Aguayo
&& Black Shadow in two matches?

indy (SUN) 06/04/1972 Arena Mexicaltzingo, Mexicaltzingo, Estado de México [https://www.facebook.com/photo/?fbid=509081694061438&set=g.1063818623692271 Angel Luzbel Nezahualcoyotl]
1) Centella vs Mike Palma
2) Agente Fantasma vs King Olimpic
3) Fantasma Del Calvario I, Fantasma Del Calvario II vs Aguilucho, Pancho Lopez
4) Alex Dínamo, Black Stomberg vs El Batallador, El Tunco Maclovio

EMLL (TUE) 06/06/1972 Arena Coliseo Guadalajara [El Informador 1972-06-06]
1) ? vs ??
2) ? vs ??
3) ? vs ??
4) El Mongol, Luis Chavira vs José Escobedo, Martin Escobedo
5) Chino Chow, El Ídolo, Rayo de Jalisco vs Espanto I, Espanto II, Luis Mariscal

MORENO (FRI) 06/09/1972 Naucalpan, Estado de México [Box y Lucha 1027, RB]
1) Ángel de Oro, El Bombero, El Invasor b Búfalo Negro, Fantomas, Gori Medina
## Angel de Oro said to be top local arena star. Also a weird bit suggested Angel De Oro & Fili Guerrero are brothers?
&& listed as Arena Naucalpan? Famous building doesn’t exist yet. Date is a guess

EMLL (SUN) 06/11/1972 Arena Coliseo Guadalajara [El Informador 1972-06-11]
1) ? vs ??
2) ? vs ??
3) ? vs ??
4) Frank Tejeda, Luis Mariscal vs José Luis Mendieta, Ringo Mendoza
5) Anibal, Chino Chow, El Marquez vs Colosso Colosetti, El Nazi, Rene Guajardo

indy (SUN) 06/11/1972 Arena Ecatepec de Morelos, Ecatepec, Estado de México [MF]
1) Sheik Mar Allah b Jimmy Black [hair]

EMLL (TUE) 06/13/1972 Arena Coliseo
1) Diamante Verde vs Toro Zúñiga
2) Caligula vs El Embajador
3) Lalo Montenegro vs Dr. Misterio
4) Tony Cardenas vs El Capitán
5) Dany Ortiz vs Oso Blanco
6) El Cóndor, Mario Rocca vs Atila, El Polaco
7) Agente X, Milo Ventura, Tino Herrera vs Bruno Victoria, Dr. O’Borman, Mazambula

EMLL (TUE) 06/13/1972 Arena Coliseo Guadalajara [El Informador 1972-06-13]
1) ? vs ??
2) ? vs ??
3) ? vs ??
4) Luis González, Luiz Chavira vs José Escobedo, Martin Escobedo
5) Colosso Colosetti, El Nazi, Espanto III vs Carlos Plata, Chino Chow, José Luis Mendieta

EMLL (FRI) 06/16/1972 Arena Coliseo [Box y Lucha 1027, RB]
1) Bruno Victoria b El Halcón
2) Tauro b Tino Herrera
3) Sergio Borrayo b Huroki Sito
4) Tony López DQ Cesar Valentino
5) Audaz b Renato Torres
6) El Vikingo b Chucho Villa
## long boring match
&& all matches 1 fall except semi-main

indy (FRI) 06/16/1972 Auditorio de Tijuana, Tijuana, Baja California [Halcon 1, RB]
1) Alfonso Dantes b Ray Mendoza  (c) [NWA LH]
## Arena 875's error prone title history has this on June 3rd instead.

EMLL (SUN) 06/18/1972 Arena Coliseo Guadalajara [El Informador 1972-06-18]
1) ? vs ??
2) ? vs ??
3) El Nazi, Vick Amezcua vs Gemelo Diablo I, Gemelo Diablo II and José Luis Mendieta, Ringo Mendoza and Carlos Mata, Chino Chow
4) Rene Guajardo vs Anibal [super libre]

indy (SUN) 06/18/1972 Arena Iguala, Iguala, Guerrero [MF]
1) Talismán b Momia Del Terror [mask]
## Momia is Chamaco Ramirez

Indy (SUN) 06/18/1972 Arena KO Algusto, Naucalpan, Estado de México [Box y Lucha 1027, RB]
1) Octavio Gaona Jr. b Rasputín [hair]

indy (SUN) 06/18/1972 arena unknown, city unknown, state unknown [wrestling-titles]
1) Enrique Vera b Raúl Mata  (c) [MEX LH]

Indy (SUN) 06/18/1972 Puebla, Puebla [Box y Lucha 1029]
1) Estrella Blanca b Dick Angelo [hair]
## Blanca saved his mask. Angelo is on a run on losing apuesta matches.

EMLL (TUE) 06/20/1972 Arena Coliseo Guadalajara [El Informador 1972-06-20]
1) ? vs ??
2) ? vs ??
3) ? vs ??
4) José Escobedo, Martin Escobedo vs Espanto III, Luis González
5) Alberto Muñoz, El Ídolo, Ray Mendoza vs Gemelo Diablo II, Karloff Lagarde, Vick Amezcua

Indy (WED) 06/21/1972 Arena San Juan Pantitlan, Ciudad Nezahualcóyotl, Estado de México [Box y Lucha 1027]
1) ?, ??, ??? vs ????, ?????, ??????
2) ?, ??, ??? vs ????, ?????, ??????
3) Mr. Henry vs El Sarahuato
4) El Caballero As, Potro Salvaje vs Dr. Muerte I, Dr. Muerte II
5) El Gladiador De Atenas, El Rey Sol vs Gato Negro, Killer Millan

EMLL (FRI) 06/23/1972 Arena Coliseo [Box y Lucha 1027]
1) Agente X vs Atila
2) Rubí Ruvalcaba vs Rafael Salamanca
3) Rodolfor Uiz vs Sergio Borrayo
4) El Enfermero vs Carlos Plata
5) El Vikingo vs César Silva
6) Gran Markus vs Audaz
7) Ángel Blanco, Dr. Wagner, El Solitario vs El Marques, Enrique Vera, Rayo de Jalisco

Indy (FRI) 06/23/1972 Auditorio de Tijuana, Tijuana, Baja California [Box y Lucha 1029]
1) El Faraón b Azteca
2) Malditos b Mario Alcala
3) Trueno vs Zorro Plateado
4) Anibal, José Luis Mendieta b Alfonso Dantes, Gemelo Diablo I

EMLL (SAT) 06/24/1972 Pista Arena Revolución [Box y Lucha 1027]
1) Lalo Montenegro vs Oso Blanco
2) El Capitán vs Saeta Azteca
3) La Furia vs Rey Halcón
4) Danny Ortiz vs Dick Angelo
5) El Cóndor vs Huroki Sito
6) Escorpión I, Escorpión II vs Halcón Dorado, Mr. Steel
7) Comando I, Comando II, Rene Guajardo vs Alberto Muñoz, Estrella Blanca, Ray Mendoza

EMLL (SUN) 06/25/1972 Arena Coliseo [Box y Lucha 1027]
1) El Polaco vs El Invasor
2) Bleda vs El Greco
3) Mazambula vs El Rebelde
4) Huroki Sito, Índio Jerónimo vs El Rostro, Tony López
5) Black Shadow, Dorrel Dixon, Rubén Juárez vs Coloso Colosetti, Karloff Lagarde, Perro Aguayo

EMLL (SUN) 06/25/1972 Arena Coliseo Guadalajara [El Informador 1972-06-25]
1) ? vs ??
2) ? vs ??
3) ? vs ??
4) Rene Guajardo, Vick Amezcua vs Alberto Muñoz, Ray Mendoza
5) El Nazi vs Carlos Plata [hair]

EMLL (SUN) 06/25/1972 Pista Arena Revolución [Box y Lucha 1027]
1) El Lobo vs Caligula
2) Zeus vs El Troyano
3) Dr. O’Borman vs Mario Rocca
4) Bruno Victoria vs Milo Ventura
5) El Enfermero vs Sergio Borrayo
6) Audaz, César Silva, Enrique Vera vs El Vikingo, Rizado Ruiz, Rodolfo Ruiz

Indy (SUN) 06/25/1972 Arena Rosales, Iztapalapa, Distrito Federal [Box y Lucha 1027]
1) Manuel Rojas vs Al Martinez
2) Boston Kid vs Dick Trébol
3) El Gavilán Negro, Jorge Rubio vs La Mancha Veloz, Tony Bernal
4) Benny Cruz, Ráfaga Azul vs El Apache, El Makabro I

Indy (SUN) 06/25/1972 Arena San Juan Pantitlan, Ciudad Nezahualcóyotl, Estado de México [Box y Lucha 1027]
1) Garo Castell vs Benny Angeles
2) Tizoc vs El Húngaro
3) Joe Franco, Tom Mix vs El Maya, Rey Aragon
4) Dos Caras, Rayo Volador, Tono De La Cruz vs Javier Meza, Manny Guzman, Ulises

Indy (SUN) 06/25/1972 Arena Santa Barbara, Tlalnepantla, Estado de México [Box y Lucha 1027]
1) José Luis vs El Montes
2) Mike Rubio vs King Cruz
3) Mr. Libra vs Murciélago Negro
4) Dixon Morales, El Relámpago vs Apolo Animas, Príncipe Vengador
5) Chino Lopez, Pro Ende Rad, Tony Rodal vs El Chivo Negro, El Malvado, Max Linder

Indy (SUN) 06/25/1972 Plaza de Toros el Cortijo, Venustiano Carranza, Distrito Federal [Box y Lucha 1027]
1) Nahur Kaliff vs Dardo Aguilar
2) Agente X vs La Furia
3) El Cóndor vs Rubí Ruvalcaba
4) Comando I, Comando II vs Estrella Blanca, Halcón Dorado
5) Gran Markus, Renato Torres vs Chucho Villa, El Marques

EMLL (TUE) 06/27/1972 Arena Coliseo Guadalajara [El Informador 1972-06-27]
1) ? vs ??
2) ? vs ??
3) ? vs ??
4) Espanto III, Frank Tejeda vs José Escobedo, Martin Escobedo
5) Alfonso Dantes, Luis Mariscal vs Chino Chow, Ray Mendoza

Chavez (THU) 06/29/1972 Iguala, Guerrero [Box y Lucha 1029]
1) Chamaco Richard b Lalo Flores
2) El Gitano b Frak Hernández
3) Bobby Charles b El Inhumano
4) Tawa Vera DRAW Ja Vir Duval
5) Dos Caras, Tarasco I b Gori Medina, Gran Tony
&& promoter “Chavez”

EMLL (FRI) 06/30/1972 Arena Coliseo [Box y Lucha 1029, http://superluchas.com/2015/06/30/en-un-dia-como-hoy-1972-angel-blanco-expone-el-titulo-nacional-completo-ante-enrique-vera-1934-la-lucha-libre-llega-a-veracruz/ SuperLuchas]
1) El Marquez, Ray Mendoza DQ El Solitario, Gran Markus
## straight falls
2) Ángel Blanco  (c) DRAW Enrique Vera [MEX HEAVY]
## Blanco took, Vera took 2, double pin on a cradle
&& Box y Lucha has just the top two matches.

EMLL (SUN) 07/02/1972 Arena Coliseo Guadalajara [El Informador 1972-07-02]
1) ? vs ??
2) ? vs ??
3) ? vs ??
4) Luis Mariscal, Vick Amezcua vs Chino Chow, Ringo Mendoza
5) Alfonso Dantes, El Nazi, Karloff Lagarde vs Alberto Muñoz, La Araña, Rayo de Jalisco

EMLL (TUE) 07/04/1972 Arena Coliseo Guadalajara [El Informador 1972-07-04]
1) ? vs ??
2) ? vs ??
3) ? vs ??
4) El Mongol, Frank Tejeda vs El Ídolo, El Trueno
5) Alfonso Dantes, Espanto III, Vick Amezcua vs Alberto Muñoz, José Escobedo, Martin Escobedo

indy (TUE) 07/04/1972 Arena Aficion [https://www.facebook.com/189993269593754/posts/277916280801452 Arena Clasica]
1) Chabela Romero b Chela Salazar  (c) [MEX WOMEN]
## recap mentions Romero would lose the title to Irma Gonzalez a few weeks later

Indy (WED) 07/05/1972 Arena San Juan Pantitlan, Ciudad Nezahualcóyotl, Estado de México [Box y Lucha 1029]
1) Guila India vs Sarahuato
2) German González vs El Olmeca
3) El Pocho vs Micki Rubio
4) Yamba vs Potro Salvaje
5) El Caballero As, Kenji Kaplin vs Killer Milan, Príncipe Gitano

EMLL (FRI) 07/07/1972 Arena Coliseo [Box Y Lucha 1029, Box Y Lucha 1085, Box Y Lucha 1185]
1) Trueno b Oso Blanco
2) Comando I, Comando II vs Audaz, Raúl Reyes and Cesar Valentino, El Vikingo and Índio Jerónimo, Perro Aguayo [torneo]
3) El Solitario, Gran Markus, Ray Mendoza, Tony López vs Alfonso Dantes, Rizado Ruiz and Beto Veloz, Enrique Vera [semifinal]
4) Ray Mendoza, Tony López b El Solitario, Gran Markus [final]
&& These are two different tournaments on the show. We know the final of the second tournament and the names in both of them. Box Y Lucha 1185 says this instead is a single tournament.

EMLL (SAT) 07/08/1972 Pista Arena Revolución [Box y Lucha 1029]
1) El Capitán vs El Invasor
2) La Saeta Azteca vs Zeus
3) Danny Ortiz vs Dr. O’Borman
4) Milo Ventura vs Bleda
5) El Cóndor vs Rubí Ruvalcaba
6) Estrella Blanca, Halcón Dorado vs El Enfermero, Tauro
7) Alberto Muñoz, Black Shadow vs Coloso Colosetti, Karloff Lagarde

EMLL (SUN) 07/09/1972 Arena Coliseo [Box y Lucha 1029]
1) Diamante Verde vs Caligula
2) Dardo Aguilar vs Nahur Kaliff
3) Rey Halcón vs El Polaco
4) Mario Rocca vs Bruno Victoria
5) El Greco, Mr. Steel vs León Negro, Rizado Ruiz
6) Audaz, Enrique Vera vs Índio Jerónimo, Perro Aguayo

EMLL (SUN) 07/09/1972 Arena Coliseo Guadalajara [El Informador 1972-07-09]
1) ? vs ??
2) ? vs ??
3) ? vs ??
4) Chino Chow, El Rostro vs Colosso Colosetti, Luis Mariscal
5) Alberto Muñoz, Black Shadow, Rayo de Jalisco vs Alfonso Dantes, El Nazi, Karloff Lagarde

EMLL (SUN) 07/09/1972 Plaza de Toros el Cortijo, Venustiano Carranza, Distrito Federal [Box y Lucha 1029]
1) Zeus vs Remo
2) La Furia vs Danny Ortiz
3) Mazambula vs Cóndor
4) El Enfermero, Rubí Ruvalcaba vs Halcón Dorado, Tony López
5) Cesar Valentino, Gran Markus vs Comando I, Comando II

indy (SUN) 07/09/1972 Arena Azteca, Iztapalapa, Distrito Federal [https://www.facebook.com/photo/?fbid=509082950727979&set=g.1063818623692271 Angel Luzbel Nezahualcoyotl]
1) Dragón Oriental vs Garras De Gato II
2) Chico Baeza vs Fantasma Asesino [super lire]
3) Alazdu, Orfeo Negro I vs Hermano Horoscopo I, Hermano Horoscopo II
4) Odiseo vs Conde Drácula [super libre]
5) Cadáver II vs Black Stromberg [AZTECA WELTER]

Indy (SUN) 07/09/1972 Arena KO Algusto, Naucalpan, Estado de México [RB]
1) El Suriano vs ?
2) Billy Guerrero vs ?
3) El Ángel De Oro, El Bombero vs Buffalo Negro, El Suriano
4) Fantomas, Gory Medina vs Niño Montana, Octavio Gaona
5) Dos Caras, La Cobra, Mil Máscaras vs Goliath Ayala, Jorge Allende, Rasputín

Indy (SUN) 07/09/1972 Arena Lopez Mateos [Box y Lucha 1029]
1) El Magno vs Chamaco Ortiz, Operman, Fantasma de la Opera, Furia Negra, Vengador Romano, Gori Rivera, Chico Vertiz, Recio, Chichimeca, Ángel Infernal I [cash, battle royal]
## 500 pesos to the winner
2) Scaramouche I vs Scaramouche II
3) Conde Azul  (c) vs Bufalo Salvaje [EDM JW]

Indy (SUN) 07/09/1972 Arena Rosales, Iztapalapa, Distrito Federal [Box y Lucha 1029]
1) Jorge Rubio vs Mancha Veloz
2) El Monetario Dorado vs La Ráfaga Azul, Flash Man, Tony Bernal, Rey Trueno, Makabro I, Makabro II, Dr. Muerte, Gavilán Negro II, Vicirebol
3) Oso Ramírez vs Benny Cruz

indy (SUN) 07/09/1972 Arena San Juan Pantitlan, Ciudad Nezahualcóyotl, Estado de México [http://www.boxylucha.com/foro/viewtopic.php?f=1&t=64704 Box Y Lucha, Box y Lucha 1029]
1) Tetzu Higami vs Gorilita Flores
2) Carnicerito vs Lalo Castell
3) Tom Mix vs Índio Tizoc
4) Rey Volador vs El Húngaro
## Hungaro is listed as Mexico lightweight champion
5) Dos Caras vs Ulises Onassis
6) Mil Máscaras vs Tinieblas

Indy (SUN) 07/09/1972 Arena Santa Barbara, Tlalnepantla, Estado de México [Box y Lucha 1029]
1) Satán Azul vs Príncipe Vengador
2) Dixoon Morales vs El Montes
3) As Dorado vs Torbellino Blanco
4) El Gladiador Marino, Ray Rojas vs Águila Salvaje, Comando Azteca
5) El Chino Lopez, El Diplomatico, Tony Rojas vs Chivo Negro, El Malvado, Johnny Reno

EMLL (TUE) 07/11/1972 Arena Coliseo [Halcon 1]
1) Enrique Vera, Tony López vs Comando I, Comando II

EMLL (TUE) 07/11/1972 Arena Coliseo Guadalajara [El Informador 1972-07-11]
1) ? vs ??
2) ? vs ??
3) ? vs ??
4) El Ídolo, Mario Alcala vs El Maldito, El Mongol
5) Anibal, José Escobedo, Martin Escobedo vs El Nazi, Frank Tejeda, Vick Amezcua

indy (SAT) 07/15/1972 Arena Iguala, Iguala, Guerrero [MF]
1) Tawa Vera b Roy Meneses

EMLL (SUN) 07/16/1972 Arena Coliseo Guadalajara [El Informador 1972-07-16]
1) ? vs ??
2) ? vs ??
3) ? vs ??
4) Chino Chow, Humberto Garza vs Coloso Colosetti, Espanto III
5) Alberto Muñoz, Black Shadow, Rayo de Jalisco vs Alfonso Dantes, El Nazi, Karloff Lagarde

indy (SUN) 07/16/1972 Plaza de Toros El Pinal, Teziutlan, Puebla [https://www.facebook.com/photo/?fbid=511572627145678&set=g.1063818623692271 Angel Luzbel Nezahualcoyotl]
1) Tony Romano vs Muerte De La Barranca, Alex Caballero, Chang Li, Genaro Conteras, Chico Baez
2) Rebelde Rojo, Santo vs Águila Azteca, Gori Casanova

indy (SUN) 07/16/1972 San Juan Ixhuatepec, Estado de México
1) Rayo De México vs El Malala
2) Ángel o Demonio vs El Renegedo
3) Perro Del Ring vs Chavo Roldan [super libre]
4) El Romano vs Chino Torres
5) Fantasma Dorada I, Fantasma Dorada II vs Mohicano, Tigre Moreliano
6) Germano I, Germano II, Ray Martinez vs Arturo Gaona, Jorge Gaona, Vagabundo II

EMLL (TUE) 07/18/1972 Arena Coliseo [Box Y Lucha 1972]
1) Caligula b Ray Acosta
2) El Capitán b Yanga
## Yanga debut. Didn't seem in condition
3) Danny Ortiz TLDRAW El Maldito
## best match of the night. No time mentioned
4) Mario Rocca b Bleda
5) La Furia b Remo
6) El Trueno, Estrella Blanca b Bruno Victoria, Mazambula
## 1/3
7) Enrique Vera, Tony López b Índio Jerónimo, Perro Aguayo
## straight falls
&& billed as 8000, a full house

EMLL (TUE) 07/18/1972 Arena Coliseo Guadalajara [El Informador 1972-07-18]
1) ? vs ??
2) Pancho Ramírez vs El Fantasma
3) Colosso Colosetti, Karloff Lagarde vs Espanto III, Luis Mariscal and Chino Chow, Ringo Mendoza and José Escobedo, Martin Escobedo and Mario Alcala, Zorro Plateado

EMLL (FRI) 07/21/1972 Arena Coliseo [Box Y Lucha 1188, http://wrestlingclassics.com/cgi-bin/.ubbcgi/ultimatebb.cgi?ubb=get_topic;f=1;t=145334;p=0 Matt Farmer]
1) Zorro Plateado b Saeta Azteca
2) Atila b Tino Herrera
3) Sergio Borrayo b Adorable Rubi
4) Chucho Villa DQ El Enfermero
5) Enrique Vera b Gran Markus
6) Blue Demon, Raúl Reyes b Ángel Blanco, Dr. Wagner
7) Ciclón Veloz Jr., Ray Mendoza b Alfonso Dantes, Karloff Lagarde

EMLL (SAT) 07/22/1972 Pista Arena Revolución [Box y Lucha 3539]
1) Estrella Blanca b Tauro [hair]
## rematch from February, same outcome

indy (SAT) 07/22/1972 Puebla, Puebla [Halcon 1]
1) Ciclón Veloz  (c) vs Perro Aguayo [MEX MIDDLE]
2) Índio Jerónimo vs Enrique Vera

EMLL (SUN) 07/23/1972 Arena Coliseo Guadalajara [El Informador 1972-07-23]
1) ? vs ??
2) ? vs ??
3) ? vs ??
4) Alberto Muñoz, El Marquez vs Dr. Wagner, El Enfermero
5) Alfonso Dantes  (c) vs Rayo de Jalisco [MEX LH]

EMLL (TUE) 07/25/1972 Arena Coliseo Guadalajara [El Informador 1972-07-25]
1) ? vs ??
2) ? vs ??
3) ? vs ??
4) El Cobarde, Luis Chavira vs Carlos Monterrosa, Chino Chow
5) El Nazi, Gemelo Diablo I, Gemelo Diablo II vs Alberto Muñoz, José Escobedo, Martin Escobedo

Iny (WED) 07/26/1972 Arena San Juan Pantitlan, Ciudad Nezahualcóyotl, Estado de México [Box y Lucha, Lucha Libre Espacio Retro, RB]
1) El Avispón Dorado vs El Germán
2) El Príncipe Gitano vs Azor
3) Dr. Muerte I, Dr. Muerte II, Rudy Vazquez vs Fantasma Dorada I, Fantasma Dorada II, Fantasma Dorada III
4) El Gato Negro vs Kenji Kaplin
5) La Sombra Vengadora vs El Gladiador De Atenas

indy (THU) 07/27/1972 Arena Danubio Azul, Tijuana, Baja California [https://www.facebook.com/photo/?fbid=511572790478995&set=g.1063818623692271 Angel Luzbel Nezahualcoyotl]
1) Bobo Johnson vs Osito De Peravillo
2) Chang Lee vs Frank Tejeda
3) Renato Torres vs Audaz
4) Humberto Garza vs Benny Romero
5) Espanto II, Espanto III vs Apolo Curiel, Felipe Ham Lee

indy (THU) 07/27/1972 Cuernavaca, Morelos [Halcon 1]
1) Huracán Ramírez  (c) vs Perro Aguayo [MEX WELTER]

EMLL (FRI) 07/28/1972 Arena México [http://superluchas.com/2015/07/28/en-un-dia-como-hoy-1985-hijo-del-santo-desenmascara-a-aristoteles-1972-alfonso-dantes-retiene-el-campeonato-mundial-semicompleto-nwa-ante-ray-mendoza/ SuperLuchas]
1) Tauro TLDRAW Mr. Steel
2) Luis Mariscal b Halcón Dorado
## Luis' debut
3) El Vikingo b Chucho Villa
4) El Nazi b Black Shadow
## a bit of an upset
5) Huracán Ramírez, Rayo de Jalisco DQ Karloff Lagarde, Rene Guajardo
## straight falls, last DQ by excessive violence
6) Ángel Blanco b Raúl Reyes [hair]
## Angel Blanco put up his mask
7) Alfonso Dantes  (c) b Ray Mendoza [NWA LH]

EMLL (SAT) 07/29/1972 Pista Arena Revolución [Box y Lucha, Lucha Libre Espacio Retro, RB]
1) El Troyano vs Zeus
2) El Polaco vs El Rey Halcón
3) Bleda vs Agente X
4) Mazambula vs El Greco
5) El Rebelde vs El León Negro
6) César Silva, Milo Ventura vs Rodolfo Ruiz, Vic Amezcua
7) Blue Demon, El Marques vs Comando I, Comando II

EMLL (SUN) 07/30/1972 Arena Coliseo [Box y Lucha, Lucha Libre Espacio Retro, RB]
1) El Zorro Plateado vs Danny Ortiz
2) Rafael Salamanca vs Bruno Victoria
3) Sergio Borrayo vs Rubí Ruvalcaba
4) Chino Chow, Tony López vs Huroki Sito, Manuel Robles
5) Coloso Colosetti, El Índio Jeronimo, Perro Aguayo vs Alberto Muñoz, Anibal, Enrique Vera

EMLL (SUN) 07/30/1972 Arena Coliseo Guadalajara [El Informador 1972-07-30]
1) ? vs ??
2) ? vs ??
3) ? vs ??
4) Gemelo Diablo I, Gemelo Diablo II vs José Luis Mendieta, Ringo Mendoza
5) Ray Mendoza, Rayo de Jalisco vs Alfonso Dantes, Karloff Lagarde

EMLL (SUN) 07/30/1972 Pista Arena Revolución
1) Huracán Ramírez, Raúl Reyes vs Ángel Blanco, Cesar Valentino
2) Chucho Villa, Mr. Steel vs Escorpión I, Escorpión II
3) El Trueno vs Dick Angelo
4) Mario Rocca vs Pepe Casas
5) La Saeta Azteca vs Zeus
6) El Lobo vs El Oso Blanco

Indy (SUN) 07/30/1972 Arena Lopez Mateos [Box y Lucha, Lucha Libre Espacio Retro, RB]
1) El Lucero vs Phobos
2) El Recio vs Alzadú
3) Ángel Solitario I, Ángel Solitario II, Gunga Din vs Cadáver I, Cadáver II, Casanova Jr.
4) El Chamaco Ortiz vs El Índio Chichimeca
5) El Fantasma De La Ópera, El Mercurio vs Chico Vertiz, Terry Bolaños

Indy (SUN) 07/30/1972 Arena San Juan Pantitlan, Ciudad Nezahualcóyotl, Estado de México [Box y Lucha, Lucha Libre Espacio Retro, RB]
1) Gerson vs Benny Angeles
2) El Índio Tzoc vs Lalo Castell
3) El Rey Volador vs El Húngaro
4) Dos Caras vs Ulises Onassis

Indy (SUN) 07/30/1972 Arena Santa Barbara, Tlalnepantla, Estado de México [Box y Lucha, Lucha Libre Espacio Retro, RB]
1) Zurdo I vs Zurdo II, Jorge Linares, Terry Rojas, Tempestad Negra, Cruz Diabolic, Impala I, , Impala II, Cosmito Rojo, Dixon Morales, Torbellino Blanco, El Debutante
2) El Chino Lopez, El Diplomatico, Ringo Sevilla vs El Águila Salvaje, El Yaqui, Manuel De La Fuente

Indy (SUN) 07/30/1972 Plaza de Toros el Cortijo, Venustiano Carranza, Distrito Federal [Box y Lucha, Lucha Libre Espacio Retro, RB]
1) Dardo Aguilar vs Remo
2) El Rey Halcón vs Bleda
3) El Greco vs Mazambula
4) César Silva, El Halcón Dorado vs Rodolfo Ruiz, Vic Amezcua
5) Black Shadow, El Marques vs Comando I, Comando II

EMLL (TUE) 08/01/1972 Arena Coliseo Guadalajara [El Informador 1972-08-01]
1) ? vs ??
2) ? vs ??
3) ? vs ??
4) Espanto III, Luis Chavira vs Carlos Manterrosa, Lalo Montenegro
5) Alberto Muñoz, El Ídolo, El Rostro vs El Cobarde, Gemelo Diablo I, Gemelo Diablo II

EMLL (FRI) 08/04/1972 Arena Coliseo [RL]
1) Dardo Aguilar vs El Polaco
2) Mr. Steel vs El León Negro
3) Estrella Blanca vs Ruby Ruvalcaba
4) César Silva vs Luis Mariscal
5) Raúl Reyes vs El Vikingo
6) Huracán Ramírez, Ray Mendoza vs Ángel Blanco, Cesar Valentino and Alberto Muñoz, Ciclón Veloz Jr. and El Nazi, Karloff Lagarde

EMLL (SAT) 08/05/1972 Pista Arena Revolución [RL]
1) Atila vs Bleda, Pepe Casas, Gran Davis, La Furia, Tino Herrera, Agente X, Danny Ortiz, Trueno [battle royal]
2) El Rebelde, Halcón Dorado vs Escorpión I, Escorpión II
3) Blue Demon, El Marques, Milo Ventura vs Alfonso Dantes, Rodolfo Ruiz, Vick Amezcua

Indy (SAT) 08/05/1972 Centro Social Deportivo y Cultural Tepito, Cuauhtémoc, Distrito Federal [RL]
1) El Olímpico vs Impala I
2) Muerte Solitario vs El Flo?
3) Impala II vs The ? Fox II
4) Kactus, Saeta Imperial vs Jimmy Cuevas, Príncipe ?
5) Ben Ali Pasha, Chacal de la Rosa, Dr. Z vs Caballero De La Cruz, Chamaco Ruiz, The Black Fox I
6) El Popeye, La Sombra Vengadora vs La Moska, Tony Salazar

Indy (SAT) 08/05/1972 Plaza de Toros La Aurora, Ciudad Nezahualcóyotl, Estado de México [RL]
1) El Inhumano vs Rayo Dorado II, El Carnicerito, Tono De La Cruz, Mr. Bronce, Mario Plata, Gato Chino, Diamante Verde, Jimmy Black, Gasto Del Valle [battle royal]
2) El Lince, El Versátil, Rayo Dorado vs El Duque, Erick Romano, Ruddy Espinoza

EMLL (SUN) 08/06/1972 Arena Coliseo [RL]
1) Saeta Azteca vs El Capitán
2) El Cóndor vs Bruno Victoria
3) Rafael Salamanca vs Mazambula
4) El Rostro, Tony López vs Huroki Sito, Manuel Robles
5) Coloso Colosetti, Índio Jerónimo, Perro Aguayo vs Anibal, Black Shadow, Enrique Vera

EMLL (SUN) 08/06/1972 Arena Coliseo Guadalajara [El Informador 1972-08-06]
1) ? vs ??
2) ? vs ??
3) ? vs ??
4) El Ídolo, Mario Alcala vs El Cobarde, León Negro
5) José Luis Mendieta, Ray Mendoza, Rayo de Jalisco vs Ángel Blanco, Cesar Valentino, Gemelo Diablo I

EMLL (SUN) 08/06/1972 Pista Arena Revolución [RL]
1) Dardo Aguilar vs El Troyano
2) Remo vs Zeus
3) Dick Angelo vs Rey Halcón
4) Mr. Steel vs Tauro
5) Luis Mariscal, Ruby Ruvalcaba vs Chucho Villa, Sergio Borrayo
6) El Nazi, Karloff Lagarde vs Huracán Ramírez, Raúl Reyes

Gori Guerrero (SUN) 08/06/1972 Plaza de Toros Alberto Balderas, Ciudad Juárez, Chihuahua [http://superluchas.com/2015/08/06/en-un-dia-como-hoy-1972-dos-caras-rapa-a-ulises-onassis-cinco-cabelleras-mas-caen-a-lo-largo-de-mexico/ SuperLuchas]
1) Carlos Lubumba, Marina Rey b El Bucanero, Estela Molina
2) Frankenstein b Elías Chávez
3) Flama Azul b Zombi Palacios [hair]
## Flama Azul's mask was on the line

Indy (SUN) 08/06/1972 Arena Aficion, Iguala, Guerrero [RL]
1) Gorilita Flores Jr. vs Bello Memo
2) Mr. Lancer vs El Indomable
3) Javier Duval, Tom Mix vs Genio Negro, Leo Pineda
4) El Centurión I vs Rey Jimenez
5) El Centurión II vs Rayo de Plata

indy (SUN) 08/06/1972 Arena Azteca, Iztapalapa, Distrito Federal [http://superluchas.com/2015/08/06/en-un-dia-como-hoy-1972-dos-caras-rapa-a-ulises-onassis-cinco-cabelleras-mas-caen-a-lo-largo-de-mexico/ SuperLuchas]
1) Conde Drácula b Odiseo [hair]
## Conde Dracula had his mask on the line. Odiseo is the future Fantastik.

Indy (SUN) 08/06/1972 Arena Ecatepec de Morelos, Ecatepec, Estado de México [RL]
1) Tony Revilla vs El Caiman
2) El Suriano vs Black Fox
3) El Mariscal vs Rito Moreno
4) Águila Imperial, Chamaco Ramírez vs Roy Lancer, Zuanga
5) El Gitano, Maravilla Peruana vs Hombre X, Roy Meneses

indy (SUN) 08/06/1972 Arena KO Algusto, Naucalpan, Estado de México [http://superluchas.com/2015/08/06/en-un-dia-como-hoy-1972-dos-caras-rapa-a-ulises-onassis-cinco-cabelleras-mas-caen-a-lo-largo-de-mexico/ SuperLuchas]
1) Gori Medina b Genaro Contreras [hair]

indy (SUN) 08/06/1972 Arena Lopez Mateos [RL, http://superluchas.com/2015/08/06/en-un-dia-como-hoy-1972-dos-caras-rapa-a-ulises-onassis-cinco-cabelleras-mas-caen-a-lo-largo-de-mexico/ SuperLuchas]
1) Lemur vs Lucero
2) Alzadu vs Mr. Phobos
3) Casanova Jr., Terry Bolaños b Huracán Negro, Mercurio
4) Fantasmon I, Fantasmon II b Ángel Infernal I, Ángel Infernal II
5) Chamaco Ortiz b Índio Chihimeca [hair]
6) Cadáver I, Cadáver II vs Chico Aviles, Fantasma de la Opera

Indy (SUN) 08/06/1972 Arena Olimpia, Tlalnepantla, Estado de México [RL]
1) Impala vs Relámpago Negro
2) Bobby Rivera vs Caballero Gardenia
3) Chamaco Richard vs Neutrón II
4) El Zombie vs Jim Vazquez
5) Hércules Rojo, Igor vs Abbud Kassim, El Duende

Indy (SUN) 08/06/1972 Arena Rosales, Iztapalapa, Distrito Federal [RL]
1) Al Martinez vs Gaby Mendoza
2) Tony Bernal vs Max Perez
3) Yaqui Fernandez vs Ray Cruz
4) Makabro I, Makabro II vs Boston Kidd, Charrio De Oro
5) Orfeo Negro I vs El Delfin

indy (SUN) 08/06/1972 Arena San Juan Pantitlan, Ciudad Nezahualcóyotl, Estado de México [http://superluchas.com/2015/08/06/en-un-dia-como-hoy-1972-dos-caras-rapa-a-ulises-onassis-cinco-cabelleras-mas-caen-a-lo-largo-de-mexico/ SuperLuchas]
1) Dos Caras b Ulises Onassis [hair]
## Young Dos Caras had his mask on the line

Indy (SUN) 08/06/1972 Arena San pedro, Cuautepec, Hidalgo [RL]
1) Águila Descalza vs El Fachoso
2) La Lechuza vs Ray Cabrera, El Ermitano, Látigo, Roberto Lozada, Caballero Águila, Caballero Roso, Benny Islas
3) Chacal de la Rosa, El Cisne, Pequeño Bulldog vs Químico I, Químico II, Treblo Negro

indy (SUN) 08/06/1972 Arena Toluca, Toluca, Estado de México [http://superluchas.com/2015/08/06/en-un-dia-como-hoy-1972-dos-caras-rapa-a-ulises-onassis-cinco-cabelleras-mas-caen-a-lo-largo-de-mexico/ SuperLuchas]
1) Cuitláhuac b Pedro Nieves [hair]
## Cuitláhuac mask on the line

EMLL (TUE) 08/08/1972 Arena Coliseo Guadalajara [El Informador 1972-08-08]
1) ? vs ??
2) ? vs ??
3) ? vs ??
4) El Cordobes, El Invasor vs Dr. O’Borman, Frank Tejeda
5) Gemelo Diablo I, Gemelo Diablo II vs José Escobedo, Martin Escobedo

indy (WED) 08/09/1972 Arena San Juan Pantitlan, Ciudad Nezahualcóyotl, Estado de México
1) Águila Dorado vs Astonomo
2) Príncipe Gitano vs Potro Salvaje
3) Gladiador De Atenas vs Killer Millan
4) Kenji Kaplin  (c) vs Gato Negro [EDM WELTER]
5) Chacal, Muerte I, Muerte II vs Fantasma Dorado I, Fantasma Dorado II, Fantasma Dorado III

EMLL (SUN) 08/13/1972 Arena Coliseo Guadalajara [El Informador 1972-08-13]
1) ? vs ??
2) ? vs ??
3) ? vs ??
4) Anibal, Raúl Reyes vs Cesar Valentino, Gemelo Diablo II
5) Rayo de Jalisco vs Ángel Blanco [super libre]

indy (SUN) 08/13/1972 Arena Iguala, Iguala, Guerrero [MF]
1) Centurion II b Rayo de Plata [hair]

indy (SUN) 08/13/1972 Arena Olimpica, Gustavo A. Madero, Distrito Federal [Halcon 5]
1) Zombie II b Jimmy Vazquez [hair]
&& date may be off a week

indy (SUN) 08/13/1972 Arena Puebla [Halcon 5]
1) Dr. O’Borman, Gorila Oscrio b El Trueno, Estrella Blanca
2) La Vendetta b La Gitanilla [hair]
## Vendetta's mask was on the line. Gitanilla is a Puebla local, Vendetta from Mexico City

indy (MON) 08/14/1972 Tampico, Tamaulipas [Halcon 5]
1) Huracán Ramírez  (c) b Perro Aguayo [MEX WELTER]

EMLL (TUE) 08/15/1972 Arena Coliseo [Halcon 5]
1) Ray Acosta b Diamante Verde
2) Escorpión I, Escorpión II DQ César Silva, Chino Chow [final]
## straight falls, both DQ, the last when Chow/Silva broke up.
3) El Polaco, Pepe Casas b Bruno Victoria, Dr. O’Borman [final]
## Polaco/Pepe took 1/3 in a bloody match
4) César Silva, Chino Chow b Huroki Sito, Ruby Ruvalcaba [semifinal]
5) Escorpión I, Escorpión II b El Rostro, Estrella Blanca [semifinal]
6) Bruno Victoria, Dr. O’Borman b Agente X, Villano I [semifinal]
## Villano I returning as a sub for an injuried Milo Ventura
7) El Polaco, Pepe Casas b El Trueno, Tino Herrera [semifinal]
&& two different tournametns on this show

EMLL (TUE) 08/15/1972 Arena Coliseo Guadalajara [El Informador 1972-08-15]
1) ? vs ??
2) ? vs ??
3) ? vs ??
4) Gemelo Diablo I, Gemelo Diablo II vs José Escobedo, Martin Escobedo
5) Dr. Wagner, El Cobarde vs Carlos Monterrosa, Humberto Garza

indy (THU) 08/17/1972 Arena Puebla [Halcon 5]
1) Black Shadow, Blue Demon b Índio Jerónimo, Perro Aguayo

EMLL (FRI) 08/18/1972 Arena Coliseo [Halcon 5]
1) Atila b Danny Ortiz
2) Ruby Ruvalcaba b Mr. Steel
3) Chino Chow DRAW Luis Mariscal
4) José Luis Mendieta DQ El Vikingo
5) El Marques b Perro Aguayo
6) Alberto Muñoz, Anibal DQ Ángel Blanco, Dr. Wagner
## Blanco/Wagner are Ola Blanca by now, though that seems new.
7) Alfonso Dantes, Rene Guajardo b Huracán Ramírez, Rayo de Jalisco
## Rudos took 1/3

EMLL (SAT) 08/19/1972 Pista Arena Revolución [Halcon 5, RL]
1) Zorro Plateado vs Saeta Azul
2) El Greco vs Bleda
3) Agente X vs Dick Angelo
4) Huroki Sito vs Villano I
5) Escorpión I, Escorpión II vs Chucho Villa, El Rostro
6) Black Shadow, Ciclón Veloz Jr. vs Comando I, Comando II
7) Rodolfo Ruiz b Milo Ventura [hair]

Indy (SAT) 08/19/1972 Deportivo Tepito, Cuauhtémoc, Distrito Federal [RL]
1) El Cóndor Azul vs Diablo Salvaje
2) Maravilla Negra vs El Florista
3) Ave, Rata Blanca vs El Impala, Lobo Potosino
4) El Vagabundo, Kenji Kaplin vs Astro Rey, La Lechuza
5) Johnny García, Saeta Imperial, Taro Yonkeura vs Chacal de la Rosa, Johnny Cuevas, Príncipe Odin

EMLL (SUN) 08/20/1972 Arena Coliseo [RL]
1) Pepe Casas vs El Invasor
2) Bruno Victoria vs Rey Halcón
3) Dr. O’Borman vs Rafael Salamanca
4) César Silva, El Rebelde vs Índio Jerónimo, Manuel Robles
5) Coloso Colosetti, El Nazi, Karloff Lagarde vs Blue Demon, Enrique Vera, Tony López
## return of Demon

EMLL (SUN) 08/20/1972 Arena Coliseo Guadalajara [El Informador 1972-08-20]
1) ? vs ??
2) ? vs ??
3) ? vs ??
4) Gemelo Diablo II, Perro Aguayo vs Carlos Monterrosa, Humberto Garza
5) Alberto Muñoz, Ciclón Veloz Jr., Ray Mendoza vs Ángel Blanco, Cesar Valentino, Dr. Wagner

EMLL (SUN) 08/20/1972 Pista Arena Revolución [RL]
1) El Troyano vs Zeus
2) El Maldito vs Remo
3) Gran Davis vs El Trueno
4) Atila vs Tino Herrera
5) Ruby Ruvalcaba, Tauro vs El Cóndor, Mr. Steel
6) El Cobarde, El Vikingo vs Huracán Ramírez, José Luis Mendieta

Indy (SUN) 08/20/1972 Arena Ecatepec de Morelos, Ecatepec, Estado de México [RL]
1) El Impala vs Cangrejo Negro
2) Roy Lancer vs Conde Maravilla
3) El Príncipe vs El Suriano
4) El Gitano vs Rey Aragon
5) Abbud Kassim, Hombre X, Yanga vs Águila Imperial, Chamaco Ramírez, Tigre Gomez

Indy (SUN) 08/20/1972 Arena La Aficion, Iguala, Guerrero [RL]
1) Bobby Rivera vs El Pegazo
2) El Centurión I vs Gran Tony, Rayo de Plata, El Centurión II, La Cobra, Ray Jimenez, Tom Mix, Villano III, Talismán, Change Lee, El Ciclón Mexicano, Indomable [battle royal]

Indy (SUN) 08/20/1972 Arena Lopez Mateos [RL]
1) Capitán Marte vs El Profeta
2) Gunga Din vs Lemur
3) Chico Aviles, Fantasma de la Opera vs Casanova Jr., El Recio
4) Furia Negra, Orfeo Negro II, Scaramouche I vs Conde Drácula, Fantasmon I, Fantasmon II
5) El Delfin, Scaramouche II vs Orfeo Negro I, Príncipe Azteca

Indy (SUN) 08/20/1972 Arena Olimpia, Tlalnepantla, Estado de México [RL]
1) Índio Tizoc vs Ray Valentino, Sombra Blanca, Rito Moreno, Jim Vazquez, Caballero Gardenia, Igor, El Anima, Torbellino García, Gorilita Flores Jr.
2) Chamaco Richard vs Drake [OLIMPIA LIGHT]

Indy (SUN) 08/20/1972 Arena Rosales, Iztapalapa, Distrito Federal [RL]
1) Águila Solitaria vs Gaby Mendoza
2) Dínamo Romano vs El Indigena
3) Makabro II, Roy Cruz vs Rayito Blanco, Tony Bernal
4) India Chichimeca, Kid Bohemio vs Ráfaga Azul, Yaqui Fernandez
5) Makabro I  (c) vs Nick Mendoza [ROSALES MIDDLE]

Indy (SUN) 08/20/1972 Arena San Juan Pantitlan, Ciudad Nezahualcóyotl, Estado de México [RL]
1) Estrella Roja vs Yamba
2) El Átomo, El Sanguinario vs El Irlandés, Estrella del Sur and El Chacal, El Sarahuato and Caballero As, Potro Salvaje
3) Llorona I, Llorona II vs Killer Millan, Rudy Vazquez and El Tamaulipeco, Juan Manuel and Fumanchu, Gato Negro

Indy (SUN) 08/20/1972 Arena San Pedro, San Pedro, Coahuila [RL]
1) Benny Islas vs El Dragón, El Misterio, Astro Rey, Jimmy Cuevas, El Cisne, Chacal de la Rosa, Trébol Negro, Roberto Lozado, Ursus, José De León, La Araña I, Le Lechuza, Ray Cabrera, Caballero Águila, Gonzalo Rodríguez, Roberto Gutierrez

indy (SUN) 08/20/1972 Arena Toluca, Toluca, Estado de México [Halcon 5]
1) El Tarasco, El Toluco vs ?, ?? [TOLUCA TAG]

Indy (SUN) 08/20/1972 Plaza de Toros La Aurora, Ciudad Nezahualcóyotl, Estado de México [RL]
1) El Inhumano vs Jim Black, Relámpago Poostino, Tono De La Cruz, Mario Plata, El Carnicerito, Gato Chino, Gasto Del Valle, El Versátil, Kronos
2) El Lince, Maravilla Peruana, Rayo I vs Erick Romano, Gory Casanova, Ruddy Espinosa

Indy (MON) 08/21/1972 Cancha San Pedro, Atencingo, Chietla, Puebla [RL]
1) Talismán Poblano vs Torbellino García
2) Benny Angeles, Lalo Castell vs Saeta China I, Saeta China II
3) Halcón Dorado I, Halcón Dorado II, Sheik Mar Allah vs Cavernario Galindo, Gary Casanova, Ray Jimenez

EMLL (TUE) 08/22/1972 Arena Coliseo [Halcon 6, http://wrestlingclassics.com/cgi-bin/.ubbcgi/ultimatebb.cgi?ubb=get_topic&f=10&t=004698 Matt Farmer]
1) Tony Cardenas b Ray Acosta
2) Remo b Diamante Verde
3) El Maldito b Rey Halcón
4) Invasor DQ Zeus
## mask ripping
5) La Furia b Mario Rocca
6) Estrella Blanca, Johnny Lezcano DQ El Polaco, Pepe Casas
## Polaco & Casas are on a run of getting DQed
7) El Nazi, Escorpión I, Escorpión II DRAW César Silva, Chino Chow, El Rostro
## Tecnicos took 1, rudos second, Nazi/Chow double pin in 3
&& MF has this as 1978 but Halcon magazine has it earlier (and Lezcano is wrestling instead of Kato Kung Lee, Escorpion still masked, Chino Chow exists)

EMLL (TUE) 08/22/1972 Arena Coliseo Guadalajara [El Informador 1972-08-22, Halcon 19]
1) Juan Ramírez vs Antonio Cruz
2) Relámpago León vs La Gacela
3) Frank Tejada vs Luis Chavira
4) El Villano, Humberto Garza vs Bruno Estrada, El Enfermero
5) Gemelo Diablo I, Gemelo Diablo II  (c) vs José Escobedo, Martin Escobedo [OCCIDENTE TAG]

indy (THU) 08/24/1972 Arena Ecatepec de Morelos, Ecatepec, Estado de México [MF]
1) Rudy Rivera b Conde Maravilla [mask]
## Conde Maravilla is Aurelio Posada Mercado

indy (THU) 08/24/1972 Arena Toluca, Toluca, Estado de México [Halcon 7]
1) Huracán Ramírez  (c) b Karloff Lagarde [MEX WELTER]

EMLL (FRI) 08/25/1972 Arena Coliseo [Halcon 6, RL]
1) Dick Angelo b El Trueno
2) Rafael Salamanca b Ruby Ruvalcaba
3) César Silva b Luis Mariscal
4) José Luis Mendieta b El Cobarde
5) El Marques b El Vikingo
6) Alberto Muñoz, Ciclón Veloz DQ Ángel Blanco, Dr. Wagner
7) Alfonso Dantes, Rene Guajardo DRAW Ray Mendoza, Rayo de Jalisco
## Guajardo & Dantes won fall 1, second went to a draw, tecnicos took the third for th eoverall draw.

Indy (SAT) 08/26/1972 Deportivo Tepito, Cuauhtémoc, Distrito Federal
1) Trébol De Plata vs Impala I
2) Tony Vazquez vs Gavilán Negro
3) Indomable De Tepito, Lobo Poostino vs Ave Blanca, Rata Blanca
4) El Vagabundo, Kenji Kaplin vs Impala II, Leopardo Negro
5) Saeta Imperial vs Príncipe Odin

EMLL (SUN) 08/27/1972 Arena Coliseo Guadalajara [El Informador 1972-08-27]
1) ? vs ??
2) ? vs ??
3) ? vs ??
4) Gemelo Diablo II, Luis González vs El Ídolo, Humberto Garza
5) Dr. Wagner, El Solitario vs Huracán Ramírez, Ray Mendoza

indy (SUN) 08/27/1972 Arena Ecatepec de Morelos, Ecatepec, Estado de México [MF, RL]
1) Alejandro Duval vs Kilowatito
2) Conde Maravilla vs Ruddy Rivera
3) Sheik Mar Allah vs Roy Lancer
4) Bengala I, Tigre Gomez vs Fili Guerrero, Rey Aragon
5) Hombre X b Chamaco Ramírez [hair]

Indy (SUN) 08/27/1972 Arena Lopez Mateos
1) Rabia Negra vs Chamaco Torres
2) Águila Blanca vs El Profeta
3) Beto González vs Fantasma de la Opera
4) Chico Aviles, Orfeo Negro II, Scaramouche I vs Bufalo Salvaje, Fantasmon I, Fantasmon II
5) Orfeo Negro, Príncipe Azteca vs El Delfin, Scaramouche II

Indy (SUN) 08/27/1972 Arena Olimpia, Tlalnepantla, Estado de México
1) Rayo de Plata vs Sombra Blanca, Sombra Verde, Mulato De Oro, Relámpago Negro, El Príncipe, El Anima, Chamaco Richard, Centenario
2) El Zombie vs Jim Vazuqez [mask, hair]

Indy (SUN) 08/27/1972 Arena Rosales, Iztapalapa, Distrito Federal
1) El Farsante vs Al Martinez
2) Rayito Blanco vs Ray Cruz
3) Kid Bohemio vs Yaqui Fernandez
4) Águila Solitaria, Indigena I, Indigena II vs Águila Descanza, Dínamo Romano, Gaby Mendoza
5) Tony Bernal  (c) vs Makabro II [ROSALES FEATHER]
6) Índio Chichimeca, Murciélago Infernal II vs Nick Mendoza, Ráfaga Azul

Indy (SUN) 08/27/1972 Arena San Juan Pantitlan, Ciudad Nezahualcóyotl, Estado de México
1) Magia Blanca vs Avispón Dorado
2) Juan Manuel vs Yamba
3) Chacal vs El Sarahuato
4) El Tamaulipeco, Estrella del Sur, Kenji Kaplin vs El Átomo, El Sabatino, Fumanchu
5) Killer Millan, Ruddy Vazquez vs Caballero As, Potro Salvaje

Indy (SUN) 08/27/1972 Arena San Pedro, San Pedro, Coahuila
1) Dragón Místico vs Tony Morales
2) Caballero De La Cruz vs Jimmy Cuevas, Ray Tabera, Roberto Lozada, Trébol Negro, Chacal de la Rosa, Caballero Águila [San Pedro MIDDLE]
3) Caballero Rojo, Roberto Gutierrrez vs Ermitano, Látigo Rojo

Indy (SUN) 08/27/1972 Plaza de Toros La Aurora, Ciudad Nezahualcóyotl, Estado de México
1) Relámpago Potosino vs Gaston del Valle
2) Mr. Lancer vs Mario Plata
3) Kronos vs Jim Black
4) El Versátil, Rayo II vs El Inhumano, Rudy Espinosa
5) El Lince, Maravilla Peruana, Sombra Vengadora vs El Duque, Erikc Romano, Gory Casanova

indy (SUN) 08/27/1972 Querétaro, Querétaro [Halcon 7]
1) El Solitario vs Anibal

EMLL (TUE) 08/29/1972 Arena Coliseo Guadalajara [El Informador 1972-08-29]
1) ? vs ??
2) ? vs ??
3) ? vs ??
4) El Solitario, Gemelo Diablo II vs Ray Mendoza, Ringo Mendoza
5) Gemelo Diablo I vs Martin Escobedo [super libre]

Indy (WED) 08/30/1972 Arena Bravo, Col. Peralvillo, Cuauhtémoc, Distrito Federal [RL]
1) Gori Guerrero vs ?

EMLL (SUN) 09/03/1972 Arena Coliseo Guadalajara [El Informador 1972-09-03]
1) ? vs ??
2) ? vs ??
3) ? vs ??
4) Luis González, Luis Masriscal vs El Ídolo, Ringo Mendoza
5) Ángel Blanco, El Solitario vs Alberto Muñoz, Ray Mendoza

EMLL (TUE) 09/05/1972 Arena Coliseo Guadalajara [El Informador 1972-09-05]
1) Gemelo Diablo I, Gemelo Diablo II vs Frank Tejeda, León Negro and Luis Chavira, Luis González and Corzo I, Corzo II and Mario Alcala, Pancho Ramírez and Carlos Monterrosa, Ringo Mendoza and José Escobedo, Martin Escobedo and El Cordobes, El Ídolo

indy (WED) 09/06/1972 Arena San Juan Pantitlan, Ciudad Nezahualcóyotl, Estado de México
1) Caballero Loco vs Mingo
2) Red Marvel vs Reptil Verde
3) Mike Guzman vs Flas Man
4) El Sirio, Lalo Flores vs El Charro, Killer Millan
5) Fantasma Dorado I, Fantasma Dorado II, Fantasma Dorado II vs Chacal, El Rey Sol, La Muerte Maldita

EMLL (SAT) 09/09/1972 Pista Arena Revolución [Lucha Libre 480]
1) Estrella Blanca  (c) DRAW Rodolfo Ruiz [MEX LIGHT]

EMLL (SUN) 09/10/1972 Arena Coliseo Guadalajara [El Informador 1972-09-10]
1) ? vs ??
2) ? vs ??
3) ? vs ??
4) Luis González, Luis Mariscal vs Alberto Muñoz, Ringo Mendoza
5) El Nazi, Rene Guajardo vs Blue Demon, Ray Mendoza

EMLL (TUE) 09/12/1972 Arena Coliseo Guadalajara [El Informador 1972-09-12]
1) ? vs ??
2) ? vs ??
3) ? vs ??
4) Raúl Reyes, Ray Mendoza vs Gemelo Diablo I, Perro Aguayo
5) Gemelo Diablo II vs José Escobedo
## Jose or Javier?

indy (THU) 09/14/1972 Toluca, Estado de México [Box y Lucha 1041, Halcon 10]
1) Manuel Robles b Tony López [hair]

indy (FRI) 09/15/1972 Puente Sierra, Magdalena Contreras, Distrito Federal
1) Maravilla Azteca vs El Franco
2) Magiste vs Fantasma Azul
3) Golden Tiger I vs Tjeano
4) Baby González, Jesus Vladivia vs Fantasma Dorado II, Kaiser

EMLL (SUN) 09/17/1972 Arena Coliseo Guadalajara [El Informador 1972-09-17]
1) ? vs ??
2) ? vs ??
3) ? vs ??
4) Espanto III vs Atila
5) Ray Mendoza, Ringo Mendoza vs Índio Jerónimo, Luis Mariscal and Enrique Vera, Raúl Mata and Gemelo Diablo I, Gemelo Diablo II

EMLL (TUE) 09/19/1972 Arena Coliseo Guadalajara [El Informador 1972-09-19]
1) ? vs ??
2) ? vs ??
3) ? vs ??
4) Mario Alcala, Sergio Borrayo vs Corzo I, Corzo II
5) Huracán Ramírez, José Luis Mendieta vs Gemelo Diablo I, Gemelo Diablo II

Indy (WED) 09/20/1972 Arena Bravo, Cuauhtémoc, Distrito Federal [Box y Lucha 1041, RB]
1) Príncipe Azteca b Scaramouche II
2) Chamaco Ortiz, Conde Azul b El Alacrán, Gori Rivera
3) El Delfin b Odiseo
4) Cadáver II b Scaramouche I
5) Bufalo Salvaje b Fantasma de la Opera
6) El Cadáver I b Vengador Romano
&& Matches 2-5 determined by battle royale

EMLL (FRI) 09/22/1972 Arena México [Halcon 10]
1) El Greco b Oso Blanco
2) Sergio Borrayo b Tauro
3) Manuel Robles b El Rebelde
4) Cesar Valentino DRAW Raúl Reyes
5) El Marques b Índio Jerónimo
## Marques on a run of win
6) Alfonso Dantes, Coloso Colosetti b Anibal, Raúl Mata
## return of Raul Mata
7) Arpad Weber, Ray Mendoza, Rayo de Jalisco b Ángel Blanco, Dr. Wagner, El Solitario
## Straight falls. Wagner & Blanco having issues with Solitario, who is going tecnico.

indy (SAT) 09/23/1972 Querétaro, Querétaro [Halcon 10]
1) Raúl Mata, Raúl Reyes b Alfonso Dantes, Coloso Colosetti

EMLL (SUN) 09/24/1972 Arena Coliseo Guadalajara [El Informador 1972-09-24]
1) ? vs ??
2) ? vs ??
3) ? vs ??
4) El Ídolo, Mario Alcala vs Gemelo Diablo I, Gemelo Diablo II
5) Huracán Ramírez, Rayo de Jalisco, Ringo Mendoza vs Colosso Colosetti, Karloff Lagarde, Luis Mariscal

EMLL (TUE) 09/26/1972 Arena Coliseo Guadalajara [El Informador 1972-09-26]
1) ? vs ??
2) ? vs ??
3) ? vs ??
4) Corzo I, Corzo II vs El Cordobes, El Ídolo
5) José Escobedo, Martin Escobedo, Ringo Mendoza vs Índio Jerónimo, Luis Mariscal, Perro Aguayo

Indy (WED) 09/27/1972 Arena Bravo, Cuauhtémoc, Distrito Federal [Box y Lucha 1041]
1) Pepe Luna vs Sevillano
2) Índio Chichimeca vs Chico Aviles
3) Fantasma de la Opera vs Bufalo Salvaje
4) Cadáver I, Cadáver II, Scaramouche II vs Joe Marino, Príncipe Azteca, Scaramouche I
5) Chamaco Ortiz, Conde Azul, Odiseo vs El Alacrán, El Delfin, Gori Rivera

Indy (WED) 09/27/1972 Arena San Juan Pantitlan, Ciudad Nezahualcóyotl, Estado de México [Box y Lucha 1041]
1) El Caballo vs Halcón Rojo
2) Olmeca vs Mike Guzman
3) Bobby Rojas vs El Dinámico
4) El Indomable De Tepito vs El Maricano
5) Killer Millan, Rudy Vazquez vs Caballero As, Potro Salvaje

indy (THU) 09/28/1972 Arena Aficion [Halcon 12]
1) El Santo, Tinieblas Jr. vs Alfonso Dantes, Enfermero
&& Jacobo Gorilla Macias retirement show.

EMLL (FRI) 09/29/1972 Arena México [Box y Lucha 1041]
1) Rey Halcón vs Gran Davis
2) Milo Ventura vs Bleda
3) Arpad Weber, Ray Mendoza vs Raúl Mata, Rayo de Jalisco and Anibal, Huracán Ramírez and Blue Demon, El Marques and Black Shadow, El Solitario and Ángel Blanco, Coloso Colosetti and Alfonso Dantes, Dr. Wagner and Cesar Valentino, El Cobarde

EMLL (SAT) 09/30/1972 Pista Arena Revolución [Box y Lucha 1041]
1) Bruno Victoria vs Dr. O’Borman, Mazambula, Tauro, El Plateado, Sergio Borrayo, El Cóndor, Agente X, Danny Ortiz, Mario Rocca
2) Gemelo Diablo I, Gemelo Diablo II vs César Silva, El Rostro
3) Karloff Lagarde, Luis Mariscal, Rodolfo Ruiz vs Alberto Muñoz, Ciclón Veloz, Estrella Blanca

EMLL (SUN) 10/01/1972 Arena Coliseo [Box y Lucha 1041]
1) Bruno Victoria vs Dr. O’Borman, Mazambula, Tauro, Zorro, Sergio Borrayo, El Cóndor, Agente X, Danny Ortiz, Mario Rocca
2) Gemelo Diablo I, Gemelo Diablo II vs César Silva, El Rostro
3) Karloff Lagarde, Luis Mariscal, Rodolfo Ruiz vs Alberto Muñoz, Ciclón Veloz, Estrella Blanca

EMLL (SUN) 10/01/1972 Arena Coliseo Guadalajara [El Informador 1972-10-01]
1) ? vs ??
2) ? vs ??
3) ? vs ??
4) Huracán Ramírez, Rayo de Jalisco vs Colosso Colosetti, Karloff Lagarde
5) Ringo Mendoza vs Luis Mariscal [hair]

Indy (SUN) 10/01/1972 Arena San Juan Pantitlan, Ciudad Nezahualcóyotl, Estado de México [Box y Lucha 1041]
1) Dinámico vs Misterio Blanco II
2) Indomable De Tepito vs Caballero Gardenia
3) Verdugo Del Valle vs El Gringo
4) Chacal, Índio Cherokee vs Gladiador De Atenas, Lalo Flores
5) Hermano Flores I, Hermano Flores II vs Potro Salvaje, Tamaulipeco

Indy (SUN) 10/01/1972 Pista Arena Revolución [Box y Lucha 1041]
1) Caligula vs Dardo Aguilar
2) Oso Blanco vs Lalo Montenegro
3) Polaco vs Tino Herrera
4) Gran Davis vs Saeta Azteca
5) Leo López vs Chino Chow
6) Cesar Valentino, El Cobarde, El Enfermero vs Ray Mendoza, Villano I, Villano II

Indy (SUN) 10/01/1972 Plaza de Toros el Cortijo, Venustiano Carranza, Distrito Federal [Box y Lucha 1041]
1) Zorro Plateado vs Dr. O’Borman, Bruno Victoria, Pepe Casas, La Furia
2) Gemelo Diablo I, Gemelo Diablo II vs Alberto Muñoz, Ciclón Veloz

EMLL (TUE) 10/03/1972 Arena Coliseo [Halcon 12]
1) Tony Cardenas b Dardo Aguilar
2) Bruno Victoria, Dr. O’Borman b Leo López, Pepe Casas [quarterfinal]
3) Villano I, Villano II b Manuel Robles, Tauro [quarterfinal]
4) Villano I, Villano II b El Polaco, León Negro [semifinal]
5) Bruno Victoria, Dr. O’Borman b Estrella Blanca, Saeta Blanca [semifinal]
6) Villano I, Villano II b Bruno Victoria, Dr. O’Borman [final]
## Villanos are Martes tag team champions
&& two quarter final matcehs missing? Tournament order may not be correct.

EMLL (TUE) 10/03/1972 Arena Coliseo Guadalajara [El Informador 1972-10-03]
1) ? vs ??
2) ? vs ??
3) ? vs ??
4) Corzo I, Espanto III vs Carlos Monterrosa, Mario Alcala
5) Perro Aguayo, Rene Guajardo vs Martin Escobedo, Rayo de Jalisco

EMLL (TUE) 10/03/1972 Arena México [RL]
1) Mano Negra vs Bruno Victoria
2) Mr. Steel vs Dick Angelo
3) Enrique Vera vs El Gemelo Diablo II
4) El Gemelo Diablo I vs Garo Katcherian
5) Alberto Muñoz vs Michael Martel
6) Karloff Lagarde, Rene Guajardo vs Blue Demon, Manolo Polman
7) Anibal, Rey Morgan, Tinieblas vs Ángel Blanco, Dr. Wagner, El Solitario

indy (THU) 10/05/1972 Plaza de Zitácuaro, Zitácuaro, Michoacán [Halcon 12]
1) Toña La Tapatia vs Chela Salazar

EMLL (FRI) 10/06/1972 Arena México [Halcon 12]
1) Mazambula b Greco
2) Escorpión II b El Rebelde
3) Chino Chow DQ Manuel Robles
4) Luis Mariscal b Pepe Mendieta
5) Raúl Mata b Cesar Valentino
6) Ángel Blanco, Dr. Wagner b Arpad Weber, Ciclón Veloz
7) El Solitario, Ray Mendoza DQ Alfonso Dantes, Rene Guajardo

EMLL (SAT) 10/07/1972 Pista Arena Revolución [Halcon 12]
1) Estrella Blanca  (c) vs Rodolfo Ruiz [MEX LIGHT]

EMLL (SUN) 10/08/1972 Arena Coliseo Guadalajara [El Informador 1972-10-08]
1) ? vs ??
2) ? vs ??
3) ? vs ??
4) El Ídolo, Ringo Mendoza vs Espanto III, Perro Aguayo
5) Huracán Ramírez, Raúl Mata, Rayo de Jalisco vs Ángel Blanco, Dr. Wagner, Renato Torres

Indy (SUN) 10/08/1972 Arena Santa Fe, Iztacalco, Distrito Federal
1) El Invencible vs Ray Fonseca
2) Avispón Azul vs Lucio Risas
3) Cóndor Azul vs Rams II
4) Ave Blanca, Rata Blanca vs Azteca Rubio, Solano Lopez
5) Dimension X, Taro Yonekura vs Gato Negro I, Gavilán Negro I

Indy (SUN) 10/08/1972 Cuernavaca, Morelos [Box y Lucha 1046, RB]
1) Irma González  (c) b Toña La Tapatia [MEX WOMEN]

indy (SUN) 10/08/1972 Nueva Arena Bravo, Cuauhtémoc, Distrito Federal [https://www.facebook.com/photo/?fbid=509083214061286&set=g.1063818623692271 Angel Luzbel Nezahualcoyotl]
1) Ráfaga vs Casanova Jr.
2) Orfeo Negro I vs Furia Negra, Ángel Solitario I, Ángel Solitario II, Índio Chichimeca, El Apache, Fantasmon I, Fantasmon II
3) Black Stromberg, El Magno vs Bufalo Salvaje, Pepe Luna

EMLL (TUE) 10/10/1972 Arena Coliseo Guadalajara [El Informador 1972-10-10]
1) ? vs ??
2) ? vs ??
3) ? vs ??
4) Carlos Monterrosa, Chucho Villa vs Dick Angelo, Gran Davis
5) Huracán Ramírez, José Escobedo, Martin Escobedo vs El Nazi, Índio Jerónimo, Perro Aguayo

indy (THU) 10/12/1972 Plaza de Toros el Progreso, Guadalajara, Jalisco [El Informador 1972-10-12]
1) ? vs ??
2) ? vs ??
3) El Inmortal, Raúl Guerrero vs Many Guzman, Pedro Nieves
4) Caballero Tiger II, El Santo vs Gory Casanova, Silencio

EMLL (FRI) 10/13/1972 Arena México [Arena 738]
1) Tauro vs Agente X
2) Mr. Steel vs Gemelo Diablo II
3) César Silva vs Gemelo Diablo I
4) Tony López vs El Nazi
## return of El Nazi
5) Huracán Ramírez vs Karloff Lagarde
6) El Solitario, Ray Mendoza vs Arpad Weber, Rayo de Jalisco and Ángel Blanco, Dr. Wagner and Alfonso Dantes, Rene Guajardo [torneo]

EMLL (SAT) 10/14/1972 Pista Arena Revolución [Arena 738]
1) La Saeta Azteca vs El Capitán
2) Cesar Valentino, Renato Torres vs Blue Demon, José Luis Mendieta and Comando I, Comando II and Ciclón Veloz Jr., El Rostro and El Cobarde, Leo López and Chino Chow, Raúl Reyes and Huroki Sito, Manuel Robles and Chucho Villa, Marques [torneo]
## return of Renato Torres

Indy (SAT) 10/14/1972 Centro Social Deportivo y Cultural Tepito, Cuauhtémoc, Distrito Federal [Arena 738]
1) Águila Descalza vs El Indigena
2) Gato vs Gavilán Negro, Tigre Hispano, Indomable De Tepito, Leopardo Negro I, Maravilla Negra, Johnny García, Enrique Hernández, Saeta Imperial, Tony Vazquez, Apolo Chino, Rata Blanca

indy (SAT) 10/14/1972 Querétaro, Querétaro [Halcon 14]
1) Rayo de Jalisco b Alfonso Dantes
## Rayo earned a title match

EMLL (SUN) 10/15/1972 Arena Coliseo [Arena 738]
1) Estrella Blanca vs El Rebelde, Sergio Borrayo, Johnny Lezcano, Mario Alcala, Ruby Ruvalcaba, Rodolfo Ruiz, Mazambula, El León Negro, El Fantasma
2) Alberto Muñoz, Anibal, Black Shadow vs Coloso Colosetti, El Nazi, Karloff Lagarde

EMLL (SUN) 10/15/1972 Arena Coliseo Guadalajara [El Informador 1972-10-15]
1) ? vs ??
2) ? vs ??
3) ? vs ??
4) José Escobedo, Martin Escobedo vs Bleda, Índio Jerónimo
5) El Marquez, Huracán Ramírez, Rayo de Jalisco vs Ángel Blanco, Dr. Wagner, Gran Markus

EMLL (SUN) 10/15/1972 Pista Arena Revolución [Arena 738]
1) Dr. O’Borman vs Pepe Casas, Dick Angelo, Luis Chavira, La Furia, El Greco, Agente X, El Cóndor, Mario Rocca, El Invasor [battle royal]
## return of Luis Chavira
2) Ray Mendoza, Villano I, Villano II vs Gemelo Diablo I, Gemelo Diablo II, Luis Mariscal

Indy (SUN) 10/15/1972 Acapulco, Guerrero [Box y Lucha 1046, RB]
1) Irma González  (c) b Toña La Tapatia [MEX WOMEN]
## Box y Lucha treats Irma’s recent matches as exhibitions, not real matches

Indy (SUN) 10/15/1972 Arena Aficion [Arena 738]
1) El Incógnito vs Chamaco Richard
2) Águila Imperial vs ?
3) Halcón Dorado, Rayo de Plata, Relámpago Gutierrez vs Gabby Rosales, Muerte De La Barranca I, Muerte De La Barranca II
4) Mariscal vs Talismán [IGUALA LIGHT]
5) Tawa Vera vs Roy Meneses [hair]

Indy (SUN) 10/15/1972 Arena Cine Bravo, Cuauhtémoc, Distrito Federal [Arena 738]
1) Guanga-Din vs Conde Murciélago I
2) Casanova Jr. vs Ráfaga Azul
3) Índio Chichimeca vs Chucho El Roto
4) Cadáver I, Cadáver II vs Ángel Solitario I, Ángel Solitario II
5) Black Stormberg vs Pepe Luna

Indy (SUN) 10/15/1972 Arena Ecatepec de Morelos, Ecatepec, Estado de México [Arena 738]
1) El Inhumao II vs Sombra Blanca
2) Chico Riverita vs Tetzu Higami
3) Roy Lancer vs Chamaco Ramírez
4) Gitano, Rayo Dorado vs El Suriano, Hombre X
5) El Maldito, Espectro I, Zuanga vs ?, Gengis Khan, Remo

Indy (SUN) 10/15/1972 Arena Lopez Mateos [Arena 738]
1) Mr. Phobos vs El Planetario
2) Birdman, Furia Negra vs Ángel Infernal I, Ángel Infernal II
3) Bufalo Salvaje, Gatuvedo, Luzbel vs Chamaco Ortiz, Orfeo Negro I, Vengador Romano
4) Oso Ramírez, Scaramouche II, Terry Bolaños vs Beto González, Príncipe Azteca, Scaramouche I

Indy (SUN) 10/15/1972 Arena Olimpia, Tlalnepantla, Estado de México [Arena 738]
1) Eddy González vs Impala
2) Tony Mercado vs Fantasma Maya
3) Andres Cuellar vs Caballero Gardenia
4) El Príncipe vs Gato Chino
5) Carta Brava, El Versátil vs El Intruso, Lobo Mendoza

Indy (SUN) 10/15/1972 Arena Rosales, Iztapalapa, Distrito Federal [Arena 738]
1) Nube Negra vs Aguililila
2) Chamaco Juarez vs Imperio
3) Gaby Mendoza vs Jorge Rubio
4) Macabro I, Macabro II vs Nick Mendoza, Tony Bernail
5) Águila Solitaria, El Chicano, Ruddy Vazquez vs Alzadu, Ráfaga Azul, Ray Cruz

Indy (SUN) 10/15/1972 Arena San Pedro, Cuautepec, Estado de México [Arena 738]
1) Siberiano I, Siberiano II vs Golden Shakey, La Lechuza and Químico I, Químico II and Caballero Águila I, Caballero Águila II and Roberto Lozado, Trébol Negro and El Cisne, El Látigo and Astucia, El Ermitano [SAN PEDRO TAG]

indy (SUN) 10/15/1972 Nueva Arena Bravo, Cuauhtémoc, Distrito Federal [https://www.facebook.com/photo/?fbid=509083160727958&set=g.1063818623692271 Angel Luzbel Nezahualcoyotl]
1) Bunga Din vs Conde Murciélago I
2) Ráfaga Azul vs Casanova Jr.
3) Índio Chichimeca vs Chucho El Roto
4) Cadáver I, Cadáver II vs Ángel Solitario I, Ángel Solitario II

Indy (SUN) 10/15/1972 Plaza de Toros el Cortijo, Venustiano Carranza, Distrito Federal [Arena 738]
1) El Capitán vs Dardo Aguilar
2) Tauro vs El Trueno
3) Manuel Robles vs Mr. Steel
4) Comando I, Comando II vs Chucho Villa, El Rostro
5) Blue Demon, Chino Chow, Ciclón Veloz Jr. vs Cesar Valentino, El Cobarde, Renato Torres

Indy (SUN) 10/15/1972 Plaza de Toros La Aurora, Ciudad Nezahualcóyotl, Estado de México [Arena 738]
1) Mr. Bronce vs El Anima
2) Ringo Ramírez vs Jimmy Vazquez
3) Juan Bravo vs El Duende
4) Mario Plata vs Torbellino García
5) El Santo, Kronos, Látigo Negro vs El Duque, Erick Romano, Jimmy Black

Indy (SUN) 10/15/1972 Plaza San Juan Pantitlan, Ciudad Nezahualcóyotl, Estado de México [Arena 738]
1) Juan Manuel vs El Marciano
2) El Verduo Del Valle vs El Estrangulador, Thor, Kenji Kaplin, Lalo Flores, Hermano Flores I, Hermano Flores II, Llorona I, Llorona II, Killer Millan [battle royal]

Indy (MON) 10/16/1972 Cancha San Pedro, Atencingo, Chietla, Puebla [Arena 738]
1) El Inmortal vs El Bandolero
2) El Tarasco, El Toluco vs Pedro Nieves, Ruddy Espinosa
3) Caballero Tigre II, Halcón Dorado II vs ?, Manny Guzman

EMLL (TUE) 10/17/1972 Arena Coliseo [Halcon 14]
1) Troyano b Tony Cardenas
2) Dardo Aguilar b El Capitán
3) Lalo Montenegro b Juan Galvan
4) Zorro Plateado b Rudy Palma [super libre]
5) La Gacela b El Fantasma
6) Bruno Victoria, Dr. O’Borman b El Trueno, Mario Alcala
## Rudos took 1/3
7) Chucho Villa, Estrella Blanca, José Luis Mendieta DQ Leo López, Luis Mariscal, Pepe Casas
## straight falls, DQ involved.

EMLL (TUE) 10/17/1972 Arena Coliseo Guadalajara [El Informador 1972-10-17]
1) ? vs ??
2) ? vs ??
3) ? vs ??
4) Carlos Monterrosa, Pancho Ramírez vs Corzo I, Corzo II
5) Atila, Dr. Wagner, Perro Aguayo vs Danny Ortiz, Enrique Vera, Ringo Mendoza

indy (THU) 10/19/1972 Plaza de Toros el Progreso, Guadalajara, Jalisco [El Informador 1972-10-19]
1) ? vs ??
2) ? vs ??
3) ? vs ??
4) Caballero Tiger, Halcón Dorado vs Espía I, Manny Guzman
5) Cavernario Galindo, Gory Casanova vs El Lince, Maravilla Peruana

EMLL (FRI) 10/20/1972 Arena México [Arena 875, Halcon 14, RB]
** CMLL 39th Aniversario
1) Mazambula b El Rebelde
2) José Luis Mendieta b Manuel Robles
3) Chino Chow DRAW Cesar Valentino
4) Ciclón Veloz Jr. b Coloso Colosetti
5) Dr. Wagner, Gran Markus b Arpad Weber, Rayo de Jalisco
6) Karloff Lagarde b Huracán Ramírez  (c) [MEX WELTER]
## tease of a hair vs mask match rematch
7) Alfonso Dantes  (c) b El Solitario [NWA LH]

EMLL (SUN) 10/22/1972 Arena Coliseo Guadalajara [El Informador 1972-10-22]
1) ? vs ??
2) ? vs ??
3) ? vs ??
4) El Rebelde, El Vengador vs Gran Davis, Luis González
5) Alberto Muñoz, Anibal, Rayo de Jalisco vs Ángel Blanco, Dr. Wagner, Gran Markus

EMLL (TUE) 10/24/1972 Arena Coliseo Guadalajara [El Informador 1972-10-24]
1) ? vs ??
2) ? vs ??
3) ? vs ??
4) José Escobedo, Martin Escobedo, Ringo Mendoza vs Índio Jerónimo, Iván El Bronco, Perro Aguayo
5) Danny Ortiz, Rey Halcón vs Corzo I, Corzo II

EMLL (WED) 10/25/1972 Arena Coliseo Acapulco, Acapulco, Guerrero [Box y Lucha 1046, RB]
1) El Diabolik b Murciélago
2) Huroki Sito b Hércules
3) El Rostro, Lucifer b Adorable Rubi, Bruno Victoria
4) Ciclón Veloz Jr., Ray Mendoza, Rayo de Jalisco b Coloso Colosetti, El Nazi, Karloff Lagarde

indy (THU) 10/26/1972 Plaza de Toros el Progreso, Guadalajara, Jalisco [El Informador 1972-10-26]
1) ? vs ??
2) Bengala I, Bengala II vs Rey Acosta, Rudy Espinoza
3) Caballero Tiger, Halcón Dorado vs Espía I, Many Guzman

EMLL (FRI) 10/27/1972 Arena México [Box y Lucha 1046, RB]
1) Gemelo Diablo II b Sergio Borrayo
2) Chucho Villa b Gemelo Diablo I
3) Tony López b Luis Mariscal
4) Enrique Vera DQ El Nazi
5) Alberto Muñoz, Ciclón Veloz Jr. b Coloso Colosetti, Karloff Lagarde
6) Arpad Weber, El Solitario, Ray Mendoza b Ángel Blanco, Dr. Wagner, Renato Torres

EMLL (SUN) 10/29/1972 Arena Coliseo Guadalajara [El Informador 1972-10-29]
1) ? vs ??
2) ? vs ??
3) ? vs ??
4) José Escobedo, Martin Escobedo  (c) vs Índio Jerónimo, Perro Aguayo [OCCIDENTE TAG]
5) Alberto Muñoz, El Solitario, Ray Mendoza vs Iván El Bronco, Karloff Lagarde, Rene Guajardo

