
/**********************
luchadb archive (for year 1974)
export started at 2025-12-23 02:28:17
export finished at 2025-12-23 02:29:41

particular parser syntax for nerds:

PROMOTION (DAY) MM/DD/YYYY ArenaName [linkURL linkName]
MatchNo) side1-1, side1-2, side1-3 DECISION side2-1, side2-2, side2-3 [matchstip]

special codes 
(c) champion obviously
## note attached to preeceding match
&& note attached to event
%% attendence (always integer, always suspect) 
** event name
**********************/
EMLL (TUE) 01/01/1974 Arena Coliseo [http://wrestlingclassics.com/cgi-bin/.ubbcgi/ultimatebb.cgi?ubb=get_topic;f=10;t=005177;p=0 Matt Farmer]
1) Ángel Negro b La Furia
2) Coloso Colosetti b Danny Dubois
3) Adorable Rubi, Karloff Lagarde b Blue Demon, Sergio Borrayo [quarterfinal]
## Sergio Borrayo replaced Black Shadow
4) El Rostro, Raúl Reyes b El Halcón, El Marquez [quarterfinal]
5) Cesar Valentino, Dr. Wagner b El Rostro, Raúl Reyes [quarterfinal]
6) Escorpión I, Escorpión II b Adorable Rubi, Karloff Lagarde [semifinal]
7) Ringo Mendoza, Tony López b Cesar Valentino, Dr. Wagner [semifinal]
8) Ringo Mendoza, Tony López b Escorpión I, Escorpión II [final]

EMLL (TUE) 01/01/1974 Arena Coliseo Guadalajara [El Informador 1974-01-01]
1) ? vs ??
2) ? vs ??
3) ? vs ??
4) Ángel Blanco, Gemelo Diablo I vs Ciclón Veloz, Martin Escobedo
5) Enrique Vera  (c) vs Alfonso Dantes [MEX HEAVY]

indy (WED) 01/02/1974 Arena KO Algusto, Naucalpan, Estado de México [Halcon 79]
1) El Mariscal, Satán, Villano III vs Bombero, El Suriano, Ray Acosta

indy (WED) 01/02/1974 Nueva Arena Bravo, Cuauhtémoc, Distrito Federal [https://www.facebook.com/photo/?fbid=509082670728007&set=g.1063818623692271 Angel Luzbel Nezahualcoyotl]
1) Astro Boy vs Bulldog Sanchez
2) Pedro Sosa vs Laberinto
3) el Signo vs Arturo Gaona
4) Octavio Gaona, Príncipe Azteca vs Delfin I, Delfin II
5) Black Stomberg, Scaramouche I vs Cadáver II, Scaramouche II

EMLL (FRI) 01/04/1974 Arena Coliseo [Halcon 78, http://wrestlingclassics.com/cgi-bin/.ubbcgi/ultimatebb.cgi?ubb=get_topic;f=10;t=005177;p=0 Matt Farmer]
1) Irazú b El Troyano
2) Huroki Sito DRAW Mr. Tempest
3) Mario Llanes DQ Manuel Robles
4) Bruno Victoria b Carlos Mata
5) Tony López b Rizado Ruiz
## best match of the night
6) Paco Pardinez, Ringo Mendoza b Ángel Blanco, Cesar Valentino
## Ringo Mendoza replaced Black Shadow (who missed Tuesday's show as well) His team took 1/3.
7) El Halcón, Mano Negra DRAW Adorable Rubi, Alfonso Dantes
## Rudos took fall 1, tecnicos took fall 2, double pin in the third

EMLL (SUN) 01/06/1974 Arena Coliseo Guadalajara [El Informador 1974-01-06]
1) ? vs ??
2) ? vs ??
3) ? vs ??
4) Gemelo Diablo II, Iván El Bronco vs El Vengador, Mario Alcala
5) El Solitario, Enrique Vera, Rayo de Jalisco vs Ángel Blanco, El Vikingo, Gemelo Diablo I

Indy (SUN) 01/06/1974 Arena Azteca, Iztapalapa, Distrito Federal [RB]
1) Rolling vs ?
2) Pequeño Demonio vs ?
3) Fantasma De La Ópera, Máscara De Hierro vs Benny, Índio Chichimeca
4) Ghurka, Skovirkán vs Chacal de la Rosa, Tigre Hispano
5) Golden Sharkey, Mil Máscaras, Odiseo vs El Enfermero, Fantasma Asesino, Gory Medina
&& 2nd Anniversary

indy (MON) 01/07/1974 Nueva Arena Bravo, Cuauhtémoc, Distrito Federal [https://www.facebook.com/photo/?fbid=509081930728081&set=g.1063818623692271 Angel Luzbel Nezahualcoyotl]
1) Chico Baeza vs El Profeta
2) Oso Ramírez vs Terry Bolaños, Horoscopo I, Horoscorpio II, Chico Vertiz, Chucho El Roto, Scaramouche I, Orfeo Negro I, Orfeo Negro II, Joe Marino
3) Odiseo vs Luzbel [EDMMIDDLE]
4) Gatuvedo vs Black Stromberg [mask]

EMLL (TUE) 01/08/1974 Arena Coliseo [Halcon 79, http://wrestlingclassics.com/cgi-bin/.ubbcgi/ultimatebb.cgi?ubb=get_topic;f=10;t=005177;p=0 Matt Farmer]
1) Ursus b El Diabólico
2) Tony Cardenas b Látigo Negro
3) Roy Steve b Talismán
4) Atila, El Invasor b La Furia, Mario Rocca
5) Irazú, Milo Ventura b Dardo Aguilar, El Polaco
6) Carlos Mata, Estrella Blanca, Raúl Reyes b Bruno Victoria, El Rebelde, Rizado Ruiz
## Straight falls, Polaco fouled Irazu

EMLL (TUE) 01/08/1974 Arena Coliseo Guadalajara [El Informador 1974-01-08]
1) ? vs ??
2) ? vs ??
3) ? vs ??
4) Bruno Estrada, Luis Chavira vs El Cordobes, El Ídolo
5) Comando I, Comando II, Índio Jerónimo vs José Escobedo, Martin Escobedo, Rayo de Jalisco

EMLL (FRI) 01/11/1974 Arena Coliseo [Halcon 79, http://wrestlingclassics.com/cgi-bin/.ubbcgi/ultimatebb.cgi?ubb=get_topic;f=10;t=005177;p=0 Matt Farmer]
1) Dardo Aguilar b Dick Angelo
2) Villano II b Escorpión I
3) Villano I b Escorpión II
4) El Rebelde b Carlos Mata
5) Bruno Victoria b Chino Chow
6) Ringo Mendoza DQ El Vikingo
7) Alfonso Dantes, El Halcón, Karloff Lagarde b Adorable Ruvalcaba, Mano Negra, Paco Pardinez
## straight falls but not easy

EMLL (SUN) 01/13/1974 Arena Coliseo [Lucha Libre 535, http://wrestlingclassics.com/cgi-bin/.ubbcgi/ultimatebb.cgi?ubb=get_topic;f=10;t=005177;p=0 Matt Farmer]
1) La Furia b El Troyano
2) Rey Halcón b Agente X
3) Rafael Salamanca DRAW Huroki Sito
4) Danny Dubois, Manuel Robles b El Rostro, Tony López
5) Anibal, Blue Demon DQ Cesar Valentino, Dr. Wagner
## straight falls, Wagner fouling Wagner

EMLL (SUN) 01/13/1974 Arena Coliseo Guadalajara [El Informador 1974-01-13]
1) ? vs ??
2) ? vs ??
3) ? vs ??
4) Comando I, Comando II vs José Escobedo, Martin Escobedo
5) El Solitario, Enrique Vera, Rayo de Jalisco vs Ángel Blanco, El Vikingo, Gemelo Diablo I

EMLL (TUE) 01/15/1974 Arena Coliseo Guadalajara [El Informador 1974-01-15]
1) ? vs ??
2) ? vs ??
3) ? vs ??
4) El Vengador, Mario Alcala vs Índio Jerónimo, Iván El Bronco
5) Demonio Blanco, El Solitario, Pantera Azul vs Ángel Blanco, Gemelo Diablo I, Gemelo Diablo II

indy (THU) 01/17/1974 Arena Aficion [https://www.facebook.com/aquilalucha/photos/a.721082084645039.1073741839.673071696112745/1236401479779761/?type=3&theater Aqui La Lucha]
1) Javier Montez DQ Destino Negro
2) Cuitlahuac b Blackaman
3) Dos Caras, Lalo Montenegro b Dr. Misterio, Médico I
4) Irma González b Chabela Romero [hair]

EMLL (SUN) 01/20/1974 Arena Coliseo Guadalajara [El Informador 1974-01-20]
1) Iván El Bronco vs José Escobedo, Comando II, Mario Alcala, Índio Jerónimo, Martin Escobedo, Gemelo Diablo II, El Vengador [battle royal]
2) El Solitario, Enrique Vera, Rayo de Jalisco vs Ángel Blanco, Cesar Valentino, Comando I

EMLL (TUE) 01/22/1974 Arena Coliseo [Box y Lucha, RB]
1) El Maldito vs El Diabólico
2) Roy Steve vs El Troyano
3) Oso Blanco vs Ángel Negro
4) El Invasor DQ Dick Angelo
5) Carlos Mata, Estrella Blanca, Tony López DRAW Danny Dubois, El Cobarde, El Rebelde
6) Irazú, Polaco b Dardo Aguilar, Milo Ventura
&& screen grab of recap page is super blurry, names may be wrong, finishes are unreadable

EMLL (TUE) 01/22/1974 Arena Coliseo Guadalajara [El Informador 1974-01-22]
1) ? vs ??
2) ? vs ??
3) ? vs ??
4) El Ídolo, La Gacela vs El Mongol, Luis González
5) Enrique Vera, Pantera Azul, Rayo de Jalisco vs Cesar Valentino, Gemelo Diablo I, Gemelo Diablo II

indy (WED) 01/23/1974 Arena KO Algusto, Naucalpan, Estado de México [Halcon 80]
1) El Toluco, Memo Ventura b Alimaña, Mariscal
## finals of a four team touranment
2) Villano III b Bombero  (c) [KO WELTER]

EMLL (SUN) 01/27/1974 Arena Aficion [http://superluchas.com/2015/01/27/en-un-dia-como-hoy-1956-santo-vs-blue-demon-en-mano-mano-emll-vs-pum/ SuperLuchas]
1) Tauro  (c) b Dr. Misterio [MEX LIGHT]

EMLL (SUN) 01/27/1974 Arena Coliseo [http://superluchas.com/2015/01/27/en-un-dia-como-hoy-1956-santo-vs-blue-demon-en-mano-mano-emll-vs-pum/ SuperLuchas]
1) Blue Demon, El Halcón, Paco Pardines b Dr. Wagner, El Vikingo, Gran Markus
## Paco is the future Lawerence of Arabia

EMLL (SUN) 01/27/1974 Arena Coliseo Guadalajara [http://superluchas.com/2015/01/27/en-un-dia-como-hoy-1956-santo-vs-blue-demon-en-mano-mano-emll-vs-pum/ SuperLuchas]
1) El Ídolo, José Escobedo vs El Cobarde, Índio Jerónimo
2) Ángel Blanco, Cesar Valentino, Iván El Bronco vs Ciclón Veloz Jr., El Solitario, Ringo Mendoza

EMLL (SUN) 01/27/1974 Arena Puebla [http://superluchas.com/2015/01/27/en-un-dia-como-hoy-1956-santo-vs-blue-demon-en-mano-mano-emll-vs-pum/ SuperLuchas]
1) Angélica Galicia, Irma González, Karina b Charito Silva, La Vendetta, Toña La Tapatia

EMLL (SUN) 01/27/1974 Pista Arena Revolución [http://superluchas.com/2015/01/27/en-un-dia-como-hoy-1956-santo-vs-blue-demon-en-mano-mano-emll-vs-pum/ SuperLuchas]
1) Bruno Victoria, Karloff Lagarde b Enrique Vera, Mano Negra

EMLL (SUN) 01/27/1974 Plaza de Toros el Cortijo, Venustiano Carranza, Distrito Federal [http://superluchas.com/2015/01/27/en-un-dia-como-hoy-1956-santo-vs-blue-demon-en-mano-mano-emll-vs-pum/ SuperLuchas]
1) Anibal, Black Shadow b Alfonso Dantes, Rizado Ruiz

EMLL (SUN) 01/27/1974 Plaza de Toros La Aurora, Ciudad Nezahualcóyotl, Estado de México [http://superluchas.com/2015/01/27/en-un-dia-como-hoy-1956-santo-vs-blue-demon-en-mano-mano-emll-vs-pum/ SuperLuchas]
1) El Búho b Apache Negro [mask]
&& not a DF La Aurora?

indy (SUN) 01/27/1974 Arena Bravo, Cuauhtémoc, Distrito Federal [http://superluchas.com/2015/01/27/en-un-dia-como-hoy-1956-santo-vs-blue-demon-en-mano-mano-emll-vs-pum/ SuperLuchas]
1) Chamaco Ortiz b Gatúbedo I [hair]

indy (SUN) 01/27/1974 Arena KO Algusto, Naucalpan, Estado de México [Halcon 80]
1) La Cobra b Villano III [KO WELTER]
## a switch after just four days!
2) Audaz, El Padrino, Toluco b El Enfermero, El Extraño, Saul Montes

indy (SUN) 01/27/1974 Auditorio Municipal Profesor Efrain Fernandez Castillejo, Tuxtla Gutiérrez, Chiapas [https://www.facebook.com/photo/?fbid=511570673812540&set=g.1063818623692271 Angel Luzbel Nezahualcoyotl]
1) El Índio vs Dr. Karonte
2) Dr. Sirius vs Tony Gomez
3) Demonio Negro, León Dorado vs Chang Lee, El Recio
4) Huracán Ramírez vs El Delfin

EMLL (TUE) 01/29/1974 Arena Coliseo Guadalajara [El Informador 1974-01-29]
1) ? vs ??
2) ? vs ??
3) ? vs ??
4) El Vengador, Mario Alcala vs Gemelo Diablo I, Gemelo Diablo II
5) El Solitario, José Escobedo, Martin Escobedo vs Ángel Blanco, Comando I, Comando II

Flores (TUE) 01/29/1974 Arena Aficion [Halcon 80]
1) Troglodita Flores b Chamaco Robles
2) El Tiburón b Rafael Salamanca
3) El Rostro b Manuel Robles
4) Black Shadow, Blue Demon b Dantes, Rizado Ruiz
5) Mano Negra  (c) b Karloff Lagarde [NWA WELTER]
## first defense
&& 12th Anniversary of the building. Francisco Flores promoter. Looks like a strong turnout

indy (THU) 01/31/1974 Xalapa, Veracruz [Halcon 80]
1) El Matematico b Júpiter [hair]

EMLL (FRI) 02/01/1974 Arena Coliseo [http://wrestlingclassics.com/cgi-bin/.ubbcgi/ultimatebb.cgi?ubb=get_topic;f=10;t=005177;p=0 Matt Farmer]
1) Roy Steve b Agente X
2) Sergio Borrayo DRAW Huroki Sito
3) José Luis Mendieta b Danny Dubois
4) El Rostro b Rizado Ruiz
5) Ciclón Veloz Jr. vs El Vikingo
6) Anibal, Enrique Vera, Paco Pardines DQ Adorable Rubi, Bruno Victoria, Karloff Lagarde
## Tecnicos took 1/3, Rubi foul in the third
7) Alfonso Dantes b El Halcón
## Dantes took 1 (snuck a foul) and 3

EMLL (SUN) 02/03/1974 Arena Coliseo [http://wrestlingclassics.com/cgi-bin/.ubbcgi/ultimatebb.cgi?ubb=get_topic;f=10;t=005177;p=0 Matt Farmer]
1) Rey Halcón vs Dardo Aguilar
2) Tauro vs Estrella Blanca
3) Manuel Robles vs Carlos Mata
4) El Cobarde, Gran Markus vs Chino Chow, Tony López
5) Alfonso Dantes, Coloso Colosetti vs Anibal, Blue Demon

EMLL (SUN) 02/03/1974 Arena Coliseo Guadalajara [El Informador 1974-02-03, luchawiki]
1) ? vs ??
2) ? vs ??
3) ? vs ??
4) Ray Mendoza, Ringo Mendoza vs Comando I, Dr. Wagner
5) El Solitario b Ángel Blanco [mask, hair]

indy (SUN) 02/03/1974 Tulyehualco, Distrito Federal [Halcon 80]
1) Huracán Ramírez, Odiseo b Espectro I, Espectro II

EMLL (TUE) 02/05/1974 Arena Coliseo Guadalajara [El Informador 1974-02-05]
1) ? vs ??
2) ? vs ??
3) ? vs ??
4) Demonio Blanco, Pantera Azul vs Gemelo Diablo I, Iván El Bronco
5) José Escobedo, Ray Mendoza vs Ángel Blanco, Índio Jerónimo

EMLL (SUN) 02/10/1974 Arena Coliseo Guadalajara [El Informador 1974-02-10]
1) ? vs ??
2) ? vs ??
3) ? vs ??
4) El Vengador, José Escobedo vs Gemelo Diablo I, Gemelo Diablo II
5) El Solitario, Ray Mendoza, Ringo Mendoza vs Ángel Blanco, Dr. Wagner, Índio Jerónimo

Indy (SUN) 02/10/1974 Arena Jalisco, Guadalajara, Jalisco [RB]
1) Cometa Azul vs Legendario
2) Guerrero Samuray vs Tony Montes
3) Jesus Soto vs Cavernario Galindo II
4) Black Terry, Luis Canales vs Pancho Robes, Rayo Negro
5) Bucanero I, Bucanero II vs Centella Verde, Genghis Khan
&& first show in building

indy (SUN) 02/10/1974 Arena KO Algusto, Naucalpan, Estado de México [Halcon 85]
1) Villano III b La Cobra  (c) [KO WELTER]

indy (SUN) 02/10/1974 Palacio de los Deportes, Villahermosa, Tabasco
1) Libertador, Tigre Dorado vs Alex Camay, Relámpago Cortes
2) El Monarca, Furia vs Cadáver I, Remington
3) Audaz, Maciste vs Noruego, Príncipe Azteca

EMLL (TUE) 02/12/1974 Arena Coliseo [Halcon 85]
1) Tony Cardenas b Ursus
2) Ángel Negro DRAW Perseo
3) Invasor DQ Oso Blanco
4) Roy Steve b Saeta Azteca
5) Javier Llanes b Pepe Casas
6) Dardo Aguilar, Estrella Blanca, Milo Ventura DQ Irazú, Rizado Ruiz, Rodolfo Ruiz
## straight falls. Rudos looked impressive despite the loss.
7) Ciclón Veloz Jr., José Luis Mendieta b El Cobarde, Gran Markus

EMLL (TUE) 02/12/1974 Arena Coliseo Guadalajara [El Informador 1974-02-12]
1) ? vs ??
2) ? vs ??
3) ? vs ??
4) César Silva, El Ídolo vs Bruno Estrada, El Fantasma
5) El Solitario, Mario Alcala, Martin Escobedo vs Comando I, Comando II, Perro Aguayo

indy (WED) 02/13/1974 Arena Bravo, Cuauhtémoc, Distrito Federal [Halcon 85, RL]
1) El Apache vs El Veterinario
2) Barba Negra, Barba Roja vs Conde Azul, El Magno
3) Huracán Ramírez, Terry Bolaños b El Greco, Javier Meza

EMLL (FRI) 02/15/1974 Arena México [Halcon 85, http://superluchas.com/2015/02/15/en-un-dia-como-hoy-1987-perro-aguayo-rapa-sangre-chicana-en-una-de-las-mas-grandes-rivalidades-de-los-80s/ SuperLuchas]
1) Pepe Casas b Saeta Azteca
2) Tony López b Huroki Sito
3) Chino Chow b Danny Dubois
4) Joseph Molnar DQ Septiembre Negro
5) Dr. Wagner b Arpad Weber
6) Adorable Rubi, Tigre Colombiano b Paco Pardinez, Ringo Mendoza
7) Alfonso Dantes, Karloff Lagarde, Rene Guajardo b Ray Mendoza, Rayo de Jalisco, Steven Wright
## Chris Colt was presented in between matches, in what was supposed to be the start of run here for him. Recap calls him eccentric.

EMLL (SUN) 02/17/1974 Arena Coliseo Guadalajara [El Informador 1974-02-17]
1) ? vs ??
2) ? vs ??
3) ? vs ??
4) Chino Chow, Tony López vs Comando I, Comando II
5) El Solitario, Ray Mendoza, Ringo Mendoza vs Karloff Lagarde, Perro Aguayo, Rene Guajardo

indy (SUN) 02/17/1974 Arena KO Algusto, Naucalpan, Estado de México [Halcon 85]
1) Villano III b La Cobra [mask]

indy (SUN) 02/17/1974 Arena Lopez Mateos [Halcon 85]
1) El Duende, Silencio vs Ciclón Mexicano, Rayo de Plata

Indy (SUN) 02/17/1974 Arena Olimpica ALberto Munoz, Culiacán, Sinaloa
1) Dr. Muerte, Huracán Ramírez vs La Moska, Príncipe Odin

indy (SUN) 02/17/1974 Club Deportivo Madero, Saltillo, Coahuila
1) Sombre Lagunera vs Ruddy Valverde
2) Ray Badillo vs Índio Lopez
3) Relámpago Sam vs Ruddy Salas
4) Costeñito Moy, El Milan vs El Pantera, Halcón  Morales

EMLL (TUE) 02/19/1974 Arena Coliseo Guadalajara [El Informador 1974-02-19]
1) ? vs ??
2) ? vs ??
3) ? vs ??
4) Iván El Bronco, Luis Mariscal vs Mario Alcala, Martin Escobedo
5) Ray Mendoza, Ringo Mendoza vs Índio Jerónimo, Perro Aguayo

indy (THU) 02/21/1974 Arena Toluca, Toluca, Estado de México
1) El Halcón, Paco Pardines vs Septiembre Negro, Tigre Colombiano

EMLL (FRI) 02/22/1974 Arena México [http://wrestlingclassics.com/cgi-bin/.ubbcgi/ultimatebb.cgi?ubb=get_topic;f=10;t=005177;p=0 Matt Farmer]
1) Sergio Arroyo b Dr. O’Borman
2) Leo López b El Rostro
3) Black Shadow b El Cobarde
4) Blue Demon b Joseph Molnar
5) Anibal DQ Ángel Blanco
6) El Solitario, Paco Pardinez b Adorable Rubi, Tigre Colombiano
7) Ray Mendoza, Rayo de Jalisco, Steven Wright b Alfonso Dantes, Chris Colt, Rene Guajardo

EMLL (SUN) 02/24/1974 Arena Coliseo Guadalajara [El Informador 1974-02-24]
1) ? vs ??
2) ? vs ??
3) ? vs ??
4) Martin Escobedo vs El Vengador, José Escobedo, Mario Alcala, Índio Jerónimo, Luis Mariscal, Iván El Bronco, Bruno Estrada [battle royal]
5) Alfonso Dantes, Cristi Colt, Rene Guajardo vs El Halcón, El Solitario, Steve Wright

EMLL (TUE) 02/26/1974 Arena Coliseo Guadalajara [El Informador 1974-02-26]
1) ? vs ??
2) ? vs ??
3) ? vs ??
4) César Silva, La Gacela vs Frank Tejeda, Luis Chavira
5) José Escobedo, Steve Wright vs Perro Aguayo, Rene Guajardo

indy (TUE) 02/26/1974 Arena Aficion
1) Enrique Vera, Rayo de Jalisco, Ringo Mendoza vs Adorable Rubi, Karloff Lagarde, Tigre Colombiano

indy (WED) 02/27/1974 Arena Coliseo Acapulco, Acapulco, Guerrero [Halcon 102]
1) Tauro b El Rebelde [hair]
2) Adorable Rubi  (c) b Anibal [MEX MIDDLE]
&& gate of 57,622, reported to be highest of first half of the year

EMLL (FRI) 03/01/1974 Arena México [http://wrestlingclassics.com/cgi-bin/.ubbcgi/ultimatebb.cgi?ubb=get_topic;f=10;t=005177;p=0 Matt Farmer]
1) Tino Herrera b El Halcón
2) Mazambula b Javier Llanes
3) Tigre Colombiano b Anibal
4) Enrique Vera b Joseph Molnar
5) Pepe Casas b Saeta Azteca
6) Rene Guajardo NC Steven Wright
7) El Solitario, Ray Mendoza b Chris Colt, Septiembre Negro
8) Joseph Molnar DQ Septiembre Negro
9) Dr. Wagner b Arpad Weber
10) Adorable Rubi, Tigre Colombiano b Paco Pardinez, Ringo Mendoza [relevos suicidas]
11) Adorable Rubi b Paco Pardinez [hair]
12) Ray Mendoza, Rayo de Jalisco, Steven Wright b Alfonso Dantes, Karloff Lagarde, Rene Guajardo

EMLL (SAT) 03/02/1974 Pista Arena Revolución [El Arte de Gotch, RB]
1) El Suriano vs La Furia
2) Ángel Negro vs Gran Davis
3) El Invasor vs Rey Halcón
4) León Negro vs Javier Llanes
5) Escorpión II vs Mario Llanes
6) Carlos Mata, Estrella Blanca vs Dick Angelo, Rodolfo Ruiz
7) Coloso Colosetti, Fishman, Karloff Lagarde vs El Halcón, Mano Negra, Ringo Mendoza

EMLL (SUN) 03/03/1974 Arena Coliseo Guadalajara [El Informador 1974-03-03]
1) ? vs ??
2) ? vs ??
3) ? vs ??
4) El Vengador, Mario Alcala vs Iván El Bronco, Luis Mariscal
5) Alfonso Dantes, Cristi Colt, Rene Guajardo vs El Halcón, El Solitario, Steve Wright

indy (SUN) 03/03/1974 Arena Isabel, Cuernavaca, Morelos [Halcon 88]
1) Ultratumba II b Kaliman [MORELOS WELTER]

indy (SUN) 03/03/1974 Irapuato, Guanajuato [Halcon 88]
1) Faraón De Oro b El Exterminador [mask]

indy (SUN) 03/03/1974 León, Guanajuato [Halcon 88]
1) Misterio Negro b Fantasma de la Quebrada [mask]
## Fanasma is

EMLL (TUE) 03/05/1974 Arena Coliseo [Halcon 88]
1) Ursus b El Diabólico
2) Gran Davis b Tony Cardenas
3) Mario Rocca b La Furia
4) Dr. O’Borman b Agente X
5) Villano I, Villano II b Leo López, Rodolfo Ruiz
6) Black Shadow, Enrique Vera, José Luis Mendieta b Bruno Victoria, Fishman, Nazi

EMLL (TUE) 03/05/1974 Arena Coliseo Guadalajara [El Informador 1974-03-05]
1) ? vs ??
2) ? vs ??
3) ? vs ??
4) Demonio Blanco, Pantera Azul vs Bruno Estrada, El Mongol
5) Índio Jerónimo, Perro Aguayo, Rene Guajardo vs José Escobedo, Martin Escobedo, Steve Wright

indy (WED) 03/06/1974 Arena KO Algusto, Naucalpan, Estado de México [Halcon 88]
1) El Mariscal vs Javier Montes [MEX LIGHT, #1 Contenders]

EMLL (FRI) 03/08/1974 Arena México [Halcon 88]
1) Dardo Aguilar b Oso Blanco
2) Rafael Salamanca DQ León Negro
3) Paco Pardinez, Rayo de Jalisco b Adorable Ruvalcaba, Tigre Colombiano [quarterfinal]
## Ruvalcaba replaced Bestia de Colombia
4) Dantes, Septiembre Negro b Arpad Weber, Steven Wright [quarterfinal]
5) Anibal, El Solitario b Ángel Blanco, Dr. Wagner [quarterfinal]
6) Karloff Lagarde, Rene Guajardo b Ray Mendoza, Rikidozan [quarterfinal]
## Rikidozan betrayed Mendoza
7) Dantes, Septiembre Negro b Paco Pardinez, Rayo de Jalisco [semifinal]
8) Anibal, El Solitario b Karloff Lagarde, Rene Guajardo [semifinal]
9) Anibal, El Solitario b Dantes, Septiembre Negro [final]

EMLL (SAT) 03/09/1974 Pista Arena Revolución [Halcon 88]
1) Mano Negra  (c) b Fishman [NWA WELTER]
&& Date a guess. Halcon 88 seem sto say it's on 03/02 but the poster for the show lists both men in trios instead.

EMLL (SUN) 03/10/1974 Arena Coliseo Guadalajara [El Informador 1974-03-10]
1) El Solitario vs Rene Guajardo
2) Ángel Blanco vs Alfonso Dantes, Perro Aguayo, Índio Jerónimo, Leo López, El Halcón, Steve Wright, Chucho Villa, Martin Escobedo, José Escobedo [battle royal]
## only the last four go into matches

indy (SUN) 03/10/1974 Arena Azteca, Tulyehualco, Xochimilco, Distrito Federal [Halcon 88]
1) Fantasma de la Opera b ? [MEX LIGHT, #1 Contenders]

EMLL (TUE) 03/12/1974 Arena Coliseo Guadalajara [Box y Lucha 1118, El Informador 1974-03-12, RB]
1) Demonio Rojo b Lornezo El Gitano
2) Relámpago León b Juan Ramírez
3) La Gacela b Apolo Romano
4) César Silva, Saeta Azteca b Comando II, Huroki Sito
## Comando II subbed for Pepe Casas.
5) Steve Wright, Tony López DQ Iván El Bronco, Rene Guajardo

EMLL (FRI) 03/15/1974 Arena México [Box y Lucha 1118, RB]
1) Paco Pardines b Septiembre Negro
2) Arpad Weber DCO Cesar Valentino
3) El Cobarde b José Luis Mendieta
4) Manuel Robles b Carlos Mata
5) El Invasor b El Polaco
## this is called the
6) Anibal, Steve Wright DQ Adorable Rubi, Tigre Colombiano
## 2 falls, bloody
7) Alfonso Dantes, Rene Guajardo, Rikidozan COR El Solitario, Ray Mendoza, Rayo de Jalisco
## rare KO finish, rudos threw Solitario forcing him to headbutt his own opponents who fell out of the ring & all got counted out

Indy (FRI) 03/15/1974 Arena Ecatepec de Morelos, Ecatepec, Estado de México [Box y Lucha 1118, RB]
1) El Fiscal, Mar Allah b El Humano, Gaston del Valle
2) Enrique Vera, Mano Negra b Dr. Wagner, El Vikingo

indy (FRI) 03/15/1974 Tepic, Nayarit [Halcon 148]
1) Dr. Wagner, El Faraón, Iván El Bronco b El Solitario, Hermano Escobedo I, Hermano Escobedo II

EMLL (SAT) 03/16/1974 Arena Puebla
1) Hércules Poblano vs Apolo Acosta
2) Agente X vs As Negro
3) El Nazi, Rikidozan vs Black Shadow, Mano Negra
4) Milo Ventura vs Tauro [mask]
5) Rene Guajardo, Septiembre Negro vs Ray Mendoza, Rayo de Jalisco

EMLL (SUN) 03/17/1974 Arena Coliseo Guadalajara [El Informador 1974-03-17]
1) ? vs ??
2) ? vs ??
3) ? vs ??
4) El Vengador, José Luis Mendieta vs Iván El Bronco, Perro Aguayo
5) El Halcón, El Solitario, Steve Wright vs Ángel Blanco, Cesar Valentino, Dr. Wagner

EMLL (SUN) 03/17/1974 Pista Arena Revolución [Box y Lucha 1118, RB]
1) Carlos Mata b Dick Angelo
## not specified if it was a singles or not, just that he beat him

FDL (SUN) 03/17/1974 Arena Azteca, Iztapalapa, Distrito Federal [Halcon 88]
1) Tauro  (c) vs Fantasma de la Opera [MEX LIGHT]

Indy (SUN) 03/17/1974 Arena Atlixco, Atlixco, Puebla
1) Red Silver vs Pequeño Halcón
2) Hebreo vs Chamaco Hernández
3) Rayo Rojo vs Rudy Espinosa
4) Tarzan Rocha, Zeus vs Dr. Koro, El Cochise

Indy (SUN) 03/17/1974 Arena del Moral, Iztapalapa, Distrito Federal [Box y Lucha 1118, RB]
1) El Salvaje b Pepe El Toro [hair]

Indy (SUN) 03/17/1974 Arena Puebla [Box y Lucha 1120]
1) Milo Ventura b Tauro [hair]
&& date is a guess

Indy (SUN) 03/17/1974 Arena Raff, Ciudad Nezahualcóyotl, Estado de México [Box y Lucha 1118, RB]
1) Anima, Javier Duval b El Gangster, Lord Boris
2) Tono De La Cruz b Benny Cruz

EMLL (TUE) 03/19/1974 Arena Coliseo Guadalajara [El Informador 1974-03-19]
1) ? vs ??
2) ? vs ??
3) ? vs ??
4) José Escobedo, Mario Alcala vs Índio Jerónimo, Luis Chavira
5) Chino Chow, El Halcón, Martin Escobedo vs Cesar Valentino, Comando I, Comando II

indy (TUE) 03/19/1974 Club Deportivo Madero, Saltillo, Coahuila
1) Príncipe Erik vs Reed Mr.
2) Sombra Lagunera vs Desconocido II
3) Águila Blanca, Costeñito Moy vs Ruddy Valverde, Rudy Gloria
4) Black Power vs Relámpago Sam [mask, hair]

Indy (WED) 03/20/1974 Arena San Juan Pantitlan, Ciudad Nezahualcóyotl, Estado de México [Box y Lucha 1118]
1) Memo Valles vs Juanito Ramírez
2) Zandor vs Chamaco Cortes
3) Mike Guzman vs Águila India
4) Misterio Blanco I, Misterio Blanco II vs Sarahuato I, Sarahuato II
5) Chivo Martinez vs El Chicano

EMLL (FRI) 03/22/1974 Arena México [Box y Lucha 1118]
1) Escorpión I vs Rafael Salamanca
2) Estrella Blanca vs Huroki Sito
3) Chino Chow vs El Cobarde
4) Ringo Mendoza vs Coloso Colosetti
5) El Halcón vs Septiembre Negro
6) Adorable Rubi, Tigre Colombiano vs Anibal, Blue Demon
7) Ray Mendoza, Rayo de Jalisco, Steve Wright vs Alfonso Dantes, Rene Guajardo, Rikidozan

EMLL (SAT) 03/23/1974 Pista Arena Revolución [Box y Lucha 1118]
1) El Rebelde vs El León Negro, Atila, Tauro, Polaco, Villano I, Villano II, Dr. O’Borman, Mr. Steel, Agente X
2) Cesar Valentino, Dr. Wagner, El Vikingo vs Arpad Weber, Enrique Vera, Mano Negra

EMLL (SUN) 03/24/1974 Arena Coliseo [Box y Lucha 1118]
1) El Perseo vs El Troyano
2) Javier Llanes vs Mazambula
3) Mr. Tempest vs Bruno Victoria
4) Gran Markus, Manuel Robles vs El Rostro, Tony López
5) Black Shadow, El Solitario, Paco Pardines vs El Nazi, Karloff Lagarde, Rene Guajardo

EMLL (SUN) 03/24/1974 Arena Coliseo Guadalajara [El Informador 1974-03-24]
1) ? vs ??
2) ? vs ??
3) ? vs ??
4) César Silva, Martin Escobedo vs Comando I, Índio Jerónimo
5) Blue Demon, Ray Mendoza, Steve Wright vs Ángel Blanco, Cesar Valentino, Dr. Wagner

EMLL (SUN) 03/24/1974 Pista Arena Revolución [Box y Lucha 1118]
1) Ursus vs El Diabólico
2) Gran Davis vs El Invasor
3) Irazú vs La Saeta Azteca
4) Dick Angelo vs Dardo Aguilar
5) Escorpión I, Escorpión II vs Mario Llanes, Rafael Salamanca
6) Rubí Ruvalcaba, Septiembre Negro vs Anibal, Ringo Mendoza

Indy (SUN) 03/24/1974 Arena Atlixco, Atlixco, Puebla [Box y Lucha 1120]
1) Zeus b Dr. Koro [mask]
&& date is a guess

Indy (SUN) 03/24/1974 Arena Bravo, Cuauhtémoc, Distrito Federal [Box y Lucha 1118]
1) Bulldog Sanchez vs Cagliostro
2) El Chino Lopez vs Lemur
3) Pepe Luna vs Raúl Gona
4) Black Stromberg, Tony Revilla vs El Emperador, Javier Meza
5) Pantera Roja I, Pantera Roja II vs Hermano Orefo Negro I, Hermano Orefo Negro II

Indy (SUN) 03/24/1974 Arena Lopez Mateos [Box y Lucha 1118]
1) Demonio Negro vs Halcón Escobedo
2) Ave Asesina vs Jimmy Morales
3) El Conde Azul, El Magno vs Ángel Infernal I, Ángel Infernal II
4) Chamaco Ortiz, Cienfuegos, Scaramouche I vs Barba Negra, El Apache, Tamba
5) Príncipe Azteca, Tinieblas vs El Bedunio, El Delfin

Indy (SUN) 03/24/1974 Arena Rosales, Iztapalapa, Distrito Federal [Box y Lucha 1118]
1) Ángel Plateado vs Pequeño Tigre
2) Torrente vs El Endemoniado
3) Halcón Ramírez vs As De Hidalgo
4) Zapelin Rojo vs Índio Magudu
5) El Incógnito Dorado vs Tony Bernal
6) Terror Blanco vs Bat Masterson
7) Estrella del Sur vs El Bandolero

Indy (SUN) 03/24/1974 Arena San Juan Pantitlan, Ciudad Nezahualcóyotl, Estado de México [Box y Lucha 1118]
1) Misterio Blanco vs El Dinámico
2) El Chivo Martinez vs El Ciervo
3) Odiseo, Rolando Manzur vs El Potro Salvaje, Thor
4) Tony Salazar vs Puños De Oro
5) El Santo, La Cebra vs Gori Casanova, Scorpió
&& 12th Anniversary

Indy (SUN) 03/24/1974 Plaza de Toros el Cortijo, Venustiano Carranza, Distrito Federal [Box y Lucha 1118]
1) Ángel Negro vs Oso Blanco
2) Mario Rocca vs Rey Halcón
3) Villano II vs Rodolfo Ruiz
4) Carlos Mata vs El Rebelde
5) Chino Chow, Enrique Vera, Mano Negra vs Coloso Colosetti, El Cobarde, Rizado Ruiz

EMLL (TUE) 03/26/1974 Arena Coliseo [Box y Lucha 1120, RB]
1) Mr. Lancer b El Diabólico
2) El Cobarde, El Rebelde b Javier Llanes, Mario Llanes [quarterfinal]
3) El Rostro, Ringo Mendoza b Rizado Ruiz, Rodolfo Ruiz [quarterfinal]
4) Black Shadow, Tony López b Bruno Victoria, Tauro [quarterfinal]
5) Escorpión I, Escorpión II b Carlos Mata, Estrella Blanca [quarterfinal]
6) El Rostro, Ringo Mendoza b El Cobarde, El Rebelde [semifinal]
7) Escorpión I, Escorpión II b Black Shadow, Tony López [semifinal]
8) El Rostro, Ringo Mendoza b Escorpión I, Escorpión II [final]
## all 3 falls said to go under 15 minutes
&& no date listed but just going by one week before the next week's lineups page. No location mentioned.

EMLL (TUE) 03/26/1974 Arena Coliseo Guadalajara [El Informador 1974-03-26]
1) ? vs ??
2) ? vs ??
3) ? vs ??
4) El Ídolo, Remo vs El Maldito, Pepe Casas
5) Blue Demon, El Vengador, José Escobedo vs Ángel Blanco, Dr. Wagner, Iván El Bronco

EMLL (WED) 03/27/1974 Arena Coliseo Acapulco, Acapulco, Guerrero [Box y Lucha 1120]
1) Charro Valdez b Yanco
2) Chanoc DRAW El Centauro
3) El Cobarde, Gran Markus b El Rostro, Enrique Vera
## very bloody match
4) Adorable Rubi, Rene Guajardo, Septiembre Negro b El Solitario, Mano Negra, Ringo Mendoza

EMLL (FRI) 03/29/1974 Arena México [Box y Lucha 1120, RB]
1) Tony López b Comando II
2) Arpad Weber b Comando I
3) Ray Mendoza, Ringo Mendoza b ?, ?? [seeding battle royal]
## they advance directly to the final of the five team tournament
4) Ángel Blanco, Dr. Wagner b Rikidozan, Tigre Colombiano [quarterfinal]
5) Alfonso Dantes, Karloff Lagarde b Enrique Vera, Rayo de Jalisco [quarterfinal]
6) Ángel Blanco, Dr. Wagner b Alfonso Dantes, Karloff Lagarde [semifinal]
7) Ray Mendoza, Ringo Mendoza b Ángel Blanco, Dr. Wagner [final]
8) Rene Guajardo b Steven Wright [NWA MIDDLE]
9) Anibal b Adorable Rubi [mask, hair]
&& Going by lineup, no date listed. There was also a ceremony for Alberto Munoz who announced he was retirin. He would end up returning in 1975.

EMLL (SUN) 03/31/1974 Arena Coliseo Guadalajara [El Informador 1974-03-31]
1) ? vs ??
2) ? vs ??
3) ? vs ??
4) El Rostro vs José Escobedo, César Silva, El Vengador, La Sombra, Iván El Bronco, El Fantasma, Luis Chavira
5) Blue Demon, El Halcón, Ray Mendoza vs Ángel Blanco, Cesar Valentino, Dr. Wagner

Indy (SUN) 03/31/1974 Arena Atlixco, Atlixco, Puebla
1) Tarátula vs Leo 19
## name is a guess
2) El Espadachín, El Marcado vs Chamaco Hernández, Saeta Negra
3) Chamaco Richardi, Rudy Espinosa vs Caballero Príncipe, Rayo Rojo
4) Zeus vs Dr. Kor [mask]

EMLL (TUE) 04/02/1974 Arena Coliseo [Halcon 94]
1) Perseo vs ?
2) Oso Blanco vs Mario Rocca
3) Irazú vs El Invasor
4) León Negro vs Agente X
5) Dick Angelo vs Javier Llanes
6) Bruno Victoria, Tauro vs Carlos Mata, Estrella Blanca
7) Anibal, Mano Negra, Ringo Mendoza vs Adorable Rubi, El Nazi, Karloff Lagarde

EMLL (TUE) 04/02/1974 Arena Coliseo Guadalajara [El Informador 1974-04-02]
1) ? vs ??
2) ? vs ??
3) ? vs ??
4) César Silva, Remo vs Bruno Estrada, Frank Tejeda
5) Chucho Villa, Martin Escobedo, Ray Mendoza vs Cesar Valentino, Rizado Ruiz, Rodolfo Ruiz

Indy (WED) 04/03/1974 Arena San Juan Pantitlan, Ciudad Nezahualcóyotl, Estado de México [Box y Lucha 1120]
1) Al Suarez vs Azhor Del Campo
2) Mike Guzman vs Chamaco Cortes
3) Misterio Blanco I, Misterio Blanco II vs Roy, Tino Cruz
4) Apolo Chino I, Apolo Chino II vs El Chacal, Rudy Vazquez
5) El Sarahuato vs Águila India [EDM FEATHER]

indy (THU) 04/04/1974 Arena Morelos, Chilpancingo, Guerrero [Halcon 94]
1) Braulio Mendoza, Corachi b Médico II, Médico II
2) Abunido Radilla, El Centauro b El Polaco, El Rebelde
3) Yanco b Mario Valenzuela [hair]
&& gate above 10,000 pesos

EMLL (FRI) 04/05/1974 Arena México [Box y Lucha 1120]
1) Tino Herrera vs Pepe Casas
2) Chino Chow vs Comando I
3) Arpad Weber vs Comando II
4) Paco Pardines vs El Vikingo
5) Mano Negra vs Rikidozan
6) Anibal, Ray Mendoza, Steve Wright vs Adorable Rubi, Septiembre Negro, Tigre Colombiano
7) Ángel Blanco, Dr. Wagner vs Alfonso Dantes, Rene Guajardo

EMLL (SAT) 04/06/1974 Pista Arena Revolución [Box y Lucha 1120]
1) Tony Cardenas vs Gran Davis
2) Ángel Negro vs Rey Halcón
3) Dardo Aguilar vs Polaco
4) Milo Ventura vs Dr. O’Borman
5) León Negro vs Rafael Salamanca
6) El Rebelde, Manuel Robles vs Carlos Mata, Sergio Borrayo
7) Black Shadow, Blue Demon, El Solitario vs Coloso Colosetti, Fishman, Karloff Lagarde

EMLL (SUN) 04/07/1974 Arena Coliseo [Box y Lucha 1120]
1) El Troyano vs Roy Steve
2) Tauro vs Mr. Steel
3) Huroki Sito vs Javier Llanes
4) El Cobarde, El Vikingo vs Mr. Tempest, Tony López
5) Arpad Weber, Ray Mendoza, Ringo Mendoza vs Alfonso Dantes, El Nazi, Septiembre Negro

EMLL (SUN) 04/07/1974 Arena Coliseo Guadalajara [El Informador 1974-04-07]
1) ? vs ??
2) ? vs ??
3) ? vs ??
4) Martin Escobedo, Remo vs Rey Halcón, Rizado Ruiz
5) Blue Demon, El Solitario, Steve Wright vs Ángel Blanco, Cesar Valentino, Dr. Wagner

EMLL (SUN) 04/07/1974 Pista Arena Revolución [Box y Lucha 1120]
1) El Maldito vs Ursus
2) El Oso Blanco vs El Invasor
3) Irazú vs Tino Herrera
4) Atila vs Javier Llanes
5) Mazambula vs Estrella Blanca
6) Adorable Rubi, Comando I, Comando II vs Anibal, Chino Chow, Paco Pardines

Indy (SUN) 04/07/1974 Arena Bravo, Cuauhtémoc, Distrito Federal [Box y Lucha 1120]
1) Pequeño Gladiador vs Astroboy
2) Bulldog Sanchez vs Golden Tiger
3) El Delfin II vs Tony Revilla
4) El Chino Lopez, Jimmy Morales vs Pantera Roja I, Pantera Roja II
5) Black Strombero, Octavio Gaona vs Cadáver I, Cadáver II

Indy (SUN) 04/07/1974 Arena Lopez Mateos [Box y Lucha 1120]
1) Hacha Negra vs Halcón Escobedo
2) El Apache vs Coyote Prisin
3) Ángel Infernal I, Ángel Infernal II vs Conde Azul, El Magno
4) Chamaco Ortiz, Cienfuegos I, Príncipe Azteca vs Hermano Orfeo Negro I, Hermano Orfeo Negro II, Tamba
5) Scaramouche I, Tinieblas vs El Beduino, El Delfin

Indy (SUN) 04/07/1974 Arena Rosales, Iztapalapa, Distrito Federal [Box y Lucha 1120]
1) Látigo vs Memo Salinas
2) El Fuego vs Chamaco Juarez
3) Ángel Plateado vs El Endemoniado
4) Rayito Blanco, Tony Bernal vs As De Hidalgo, Índio Magudu
5) Bat Masterson, Puños De Oro vs El Makabro I, Rudy Vazquez

Indy (SUN) 04/07/1974 Arena San Juan Pantitlan, Ciudad Nezahualcóyotl, Estado de México [Box y Lucha 1120]
1) Rudy Vazquez vs El Ciervo
2) Rolando Manzur vs Mario Solar
3) La Llorona I, La Llorona II vs El Potro Salvaje, Thor
4) El Chivo Martinez vs Odiseo
5) El Fantasma de la Quebrada, La Sombra Vengadora vs Kenji Kaplin, Taro Yonekura

Indy (SUN) 04/07/1974 Plaza de Toros el Cortijo, Venustiano Carranza, Distrito Federal [Box y Lucha 1120]
1) Gran Davis vs Ángel Negro
2) El Polaco vs Mario Rocca
3) El Rebelde vs Sergio Borrayo
4) Manuel Robles vs Carlos Mata
5) Bruno Victoria, Coloso Colosetti, Fishman vs Black Shadow, El Halcón, El Rostro

EMLL (TUE) 04/09/1974 Arena Coliseo [Halcon 93]
1) Mr. Lancer b Ursus
2) Gran Davis b Tony Cardenas
3) Talismán b El Maldito
4) Oso Blanco b Saeta Azteca
5) Irazú b El Invasor
6) Dick Angelo, El Polaco b Dardo Aguilar, Tino Herrera
7) Black Shadow, El Rostro, Enrique Vera b El Cobarde, Fishman, Nazi

EMLL (TUE) 04/09/1974 Arena Coliseo Guadalajara [El Informador 1974-04-09]
1) ? vs ??
2) ? vs ??
3) ? vs ??
4) El Ídolo, Raúl Torres vs Bruno Estrada, Leo López
5) El Solitario, El Vengador, José Escobedo vs Dr. Wagner, Iván El Bronco, Perro Aguayo

EMLL (SUN) 04/14/1974 Arena Coliseo Guadalajara [El Informador 1974-04-14]
1) ? vs ??
2) ? vs ??
3) La Gacela vs Rodolfo Ruiz
4) El Vengador, José Escobedo vs Iván El Bronco, Rizado Ruiz
5) Alfonso Dantes, Perro Aguayo, Rikidozan vs Blue Demon, Ciclón Veloz Jr., Rayo de Jalisco

indy (SUN) 04/14/1974 Toluca, Estado de México [Halcon 94]
1) Javier Montes b El Tarasco [8f]
2) Javier Montes b Demerius [quarterfinal]
3) Javier Montes b Rey Tigre [semifinal]
4) Javier Montes b El Toluco [final]
&& partial results for the the tournament. new championship.

EMLL (TUE) 04/16/1974 Arena Coliseo Guadalajara [El Informador 1974-04-16]
1) ? vs ??
2) ? vs ??
3) ? vs ??
4) El Ídolo, Raúl Torres vs El Mongol, Luis González
5) Blue Demon, José Luis Mendieta, Martin Escobedo vs Índio Jerónimo, Rizado Ruiz, Rodolfo Ruiz

EMLL (TUE) 04/16/1974 Arena México [Halcon 103]
1) Ray Mendoza  (c) b Ángel Blanco [NWA LH]
## Blanco mentions this match in a later interview, explaining he took two months off to rest and heal his left ankle after.

EMLL (WED) 04/17/1974 Arena Coliseo Acapulco, Acapulco, Guerrero [Halcon 94]
1) Hércules b Chanoc
2) Mazambula b Mr. Steel
3) Chino Chow b Manuel Robles
4) Anibal, Ringo Mendoza b El Nazi, Tigre Colombiano
## Anibal replaced Ray Mendoza
5) Enrique Vera  (c) b Gran Markus [MEX HEAVY]
6) Mano Negra  (c) b Septiembre Negro [NWA WELTER]
&& gate of 51,038.25

indy (WED) 04/17/1974 Club Deportivo Madero, Saltillo, Coahuila
1) Príncipe Azul vs Sombra Lagunera
2) Ray Badillo vs Chamaco Gloria
3) Costeñito Moy, Lobo Yaqui vs Frank Palomo, Imperio Rojo
4) Relámpago Sam vs Halcón Morales [hair, ? CHAMP]
## belt not said, most likely a Coahuila Welter

EMLL (FRI) 04/19/1974 Arena México [Halcon 94]
1) El Troyano b El Maldito
2) Leo López b El Vengador
3) El Nazi b Arpad Weber
4) Paco Pardinez b Gran Markus
5) Ringo Mendoza b Rikidozan Jr.
## very good match
6) Anibal, Blue Demon, Steven Wright vs Dantes, Rene Guajardo, Tigre Colombiano
7) Ángel Blanco, Dr. Wagner b Ray Mendoza, Rayo de Jalisco
## Blanco/Mendoza and Wagner/Jalisco challenges.

indy (FRI) 04/19/1974 Arena Isabel, Cuernavaca, Morelos [Halcon 94]
1) El Polaco b Mario Rocca
2) Bruno Victoria, El Nazi b Chino Chow, El Rostro
3) Black Shadow, Mano Negra DQ Adorable Ruvlacaba, Septiembre Negro
4) Fishman  (c) b Carlos Mata [MEX WELTER]

indy (SAT) 04/20/1974 Ecatepec, Estado de México [Halcon 94]
1) El Rostro, Ray Mendoza vs Dr. Wagner, Gran Markus

EMLL (SUN) 04/21/1974 Arena Coliseo Guadalajara [El Informador 1974-04-21, http://superluchas.com/2015/04/21/en-un-dia-como-hoy-1974-santo-y-mantequilla-napoles-ante-16-mil-aficionados-en-ciudad-juarez-gran-davis-debuta-como-referi/ SuperLuchas]
1) Javier Llanes ?? Luis Chavira
2) Índio Jerónimo, Perro Aguayo b El Ídolo, José Luis Mendieta
3) Blue Demon, Martin Escobedo, Rayo de Jalisco b Alfonso Dantes, El Nazi, Rikidozan Jr.

indy (SUN) 04/21/1974 Arena Coliseo Acapulco, Acapulco, Guerrero [http://superluchas.com/2015/04/21/en-un-dia-como-hoy-1974-santo-y-mantequilla-napoles-ante-16-mil-aficionados-en-ciudad-juarez-gran-davis-debuta-como-referi/ SuperLuchas]
1) Médico I, Médico II b Araña De Morelos, Zorro
2) Villano I, Villano II b El León Negro, Huroki Sito

indy (SUN) 04/21/1974 Arena Puebla [http://superluchas.com/2015/04/21/en-un-dia-como-hoy-1974-santo-y-mantequilla-napoles-ante-16-mil-aficionados-en-ciudad-juarez-gran-davis-debuta-como-referi/ SuperLuchas]
1) Maravilla Pérez, Milo Ventura b Gorila Osorio, Pepe Casas
2) Escorpión I, Escorpión II b Dardo Aguilar, Estrella Blanca

indy (SUN) 04/21/1974 Arena Raff, Ciudad Nezahualcóyotl, Estado de México [Halcon 94]
1) Tono De La Cruz b Javier Duval [RAFF WELTER]

indY (SUN) 04/21/1974 Cuernavaca, Morelos [Halcon 94]
1) Tarasco I, Tarasco II vs El Maya, Ultratumba II

indy (SUN) 04/21/1974 Plaza de Toros el Cortijo, Venustiano Carranza, Distrito Federal [http://superluchas.com/2015/04/21/en-un-dia-como-hoy-1974-santo-y-mantequilla-napoles-ante-16-mil-aficionados-en-ciudad-juarez-gran-davis-debuta-como-referi/ SuperLuchas]
1) Black Shadow, Mano Negra DQ El Cobarde, El Vikingo
## Gran Davis debuted as referee on this show, including this main event.

indy (SUN) 04/21/1974 Plaza de Toros La Aurora, Ciudad Nezahualcóyotl, Estado de México [http://superluchas.com/2015/04/21/en-un-dia-como-hoy-1974-santo-y-mantequilla-napoles-ante-16-mil-aficionados-en-ciudad-juarez-gran-davis-debuta-como-referi/ SuperLuchas]
1) Halcón Dorado, Skorvikán b Piraña Humana, Tigre Sánchez
2) Cavernario Galindo, Dr. Karonte, Tigre Hispano b Carta Brava I, Carta Brava II, El Profanador

indy (SUN) 04/21/1974 Plaza de Toros La Monumental, Ciudad Juárez, Chihuahua [http://superluchas.com/2015/04/21/en-un-dia-como-hoy-1974-santo-y-mantequilla-napoles-ante-16-mil-aficionados-en-ciudad-juarez-gran-davis-debuta-como-referi/ SuperLuchas]Attendance: 16000
1) Gori Guerrero DRAW Espectro II
2) Chavo Guerrero, Mando Guerrero b El Greco, Rebelde Rojo
3) Dorado Hernández b Perrucho Luján
## boxer Mantequilla Napoles was referee. Dorado tooks 1/3.
4) El Santo b El Kriminal
&& yea, a Plaza de Toros La Monumenta in Ciudad Juarez. Gori Guerrero promoted the show and it aired on Juarez TV. Show was said to be disappointing

indy (SUN) 04/21/1974 Plaza de Toros Valente Arellano, Torreón, Coahuila [http://superluchas.com/2015/04/21/en-un-dia-como-hoy-1974-santo-y-mantequilla-napoles-ante-16-mil-aficionados-en-ciudad-juarez-gran-davis-debuta-como-referi/ SuperLuchas]
1) El Marquez, Rubén Juárez b Gemelo Diablo I, Gemelo Diablo II
2) Angelica Galicia, Irma González, Karina b Charito Silva, La Vendetta, Toña La Tapatia

EMLL (TUE) 04/23/1974 Arena Coliseo [Halcon 99]
1) El Rostro b Comando I
2) Mr. Tempest DQ Comando II
3) El Rebelde b Sergio Borrayo
4) Mr. Steel b León Negro
5) Dick Angelo b Agente X
6) Black Shadow DQ El Nazi
7) El Halcón, Enrique Vera, Mano Negra b Cesar Valentino, Dr. Wagner, El Cobarde
&& date may be wrong

EMLL (TUE) 04/23/1974 Arena Coliseo Guadalajara [El Informador 1974-04-23]
1) ? vs ??
2) ? vs ??
3) ? vs ??
4) Mario Alcala, Raúl Torres vs Frank Tejeda, La Furia
5) Martin Escobedo, Rayo de Jalisco, Reo vs Alfonso Dantes, Rizado Ruiz, Rodolfo Ruiz

EMLL (FRI) 04/26/1974 Arena México [http://wrestlingclassics.com/cgi-bin/.ubbcgi/ultimatebb.cgi?ubb=get_topic;f=10;t=005177;p=0 Matt Farmer]
1) Anibal, Steven Wright b Rene Guajardo, Tigre Colombiano [mask, hair]
## Tigre Colombia is Bill Martinez

EMLL (SUN) 04/28/1974 Arena Coliseo [Halcon 96]
1) Adorable Ruvalcaba  (c) b Ringo Mendoza [MEX MIDDLE]

EMLL (SUN) 04/28/1974 Arena Coliseo Guadalajara [El Informador 1974-04-28]
1) ? vs ?? [battle royal]
## women’s match
2) El Marquez, Villano I vs Argost, Rizado Ruiz
3) Alfonso Dantes, Rikidozan, Tigre Colombiano vs Arpad Weber, El Solitario, Steve Wright

Indy (SUN) 04/28/1974 Arena Independencia, Ciudad Juárez, Chihuahua [RB]
1) El Caudillo vs Prisionero Del Ring
2) El Yaki vs El Daktary
3) El Fugitivo, Morenito Chávez vs Mosco Escobar, Pancho Lonas
4) El Cachorro, Furia Negra, Ray Frutos vs Eddy Delgado, Ray Golden, Rudy Delgado
5) El Rebelde vs Julio Cruz [hair, ? CHAMP]
&& location is a guess based on advertisements on poster. Year is a guess based on it being a Sunday (could be 1963, 1968 or 1986)

EMLL (TUE) 04/30/1974 Arena Coliseo [Box Y Lucha 1125, Halcon 96, http://wrestlingclassics.com/cgi-bin/.ubbcgi/ultimatebb.cgi?ubb=get_topic;f=10;t=005177;p=0 Matt Farmer]
1) Perseo b Lancer
2) El Maldito b Ursus
3) Talismán b Roy Steve
4) Ángel Negro b La Furia
5) El Polaco b Saeta Azteca
6) Dardo Aguilar, Estrella Blanca DRAW Leo López, Tauro
7) Black Shadow, Carlos Mata, El Rostro DQ Comando I, Comando II, Fishman
## Fishman fouled Black Shadow

EMLL (TUE) 04/30/1974 Arena Coliseo Guadalajara [El Informador 1974-04-30]
1) ? vs ??
2) ? vs ??
3) ? vs ??
4) La Gacela, Mario Alcala vs Calavera I, Rodolfo Ruiz
5) El Halcón, José Luis Mendieta, Remo vs Astro Rey, Perro Aguayo, Rikidozan

indy (WED) 05/01/1974 Arena Coliseo San Luis Potosí, San Luis Potosí, San Luis Potosí
1) Rikidozan, Tigre Colombiano vs El Marques, Ringo Mendoza

EMLL (FRI) 05/03/1974 Arena Coliseo [Box Y Lucha 1125, https://twitter.com/ostpies/status/1392987463354773507 Halcon 196]
1) Gran Davis vs Ángel Negro
2) Bruno Estrada vs Agente X
3) Karloff Lagarde, Rikidozan b Chino Chow, Paco Pardinez [quarterfinal]
4) Blue Demon, Mario Llanes b Coloso Colosetti, Manuel Robles [quarterfinal]
5) Bruno Victoria, Dr. Wagner b Carlos Mata, Ray Mendoza [quarterfinal]
6) El Halcón, Mano Negra b Adorable Rubi, Tigre Colombiano [quarterfinal]
7) El Halcón, Mano Negra b Karloff Lagarde, Rikidozan [semifinal]
8) Bruno Victoria, Dr. Wagner b Blue Demon, Mario Llanes [semifinal]
9) El Halcón, Mano Negra b Bruno Victoria, Dr. Wagner [final]

EMLL (SAT) 05/04/1974 Arena Puebla [KO 1101, RB]
1) Gorila Osorio b El Troyano
2) Atila b Marinero Acosta
3) Carlos Mata, Chino Chow, El Rostro b Fishman, Manuel Robles, Tigre Colombiano
4) Pepe Pardinez, Ray Mendoza b Dr. Wagner, El Cobarde
## Pardinez is a sub for sub for an ill Rayo De Jalisco

EMLL (SUN) 05/05/1974 Arena Coliseo Guadalajara [El Informador 1974-05-05, KO 1101, RB]
1) Relámpago León b Pedro Anguiano
2) Calavera I b El Capitán
3) El Cobarde b Roy Steve
4) Índio Jerónimo, Rizado Ruiz DRAW José Luis Mendieta, Mario Alcala
5) El Halcón, El Marquez, Ray Mendoza DQ Alfonso Dantes, Karloff Lagarde, Perro Aguayo

indy (SUN) 05/05/1974 Arena Azteca, Tulyehualco, Xochimilco, Distrito Federal [Halcon 96]
1) Arco Iris b Águila Plateada [mask]
## Aguila Plateda is Gabriel Rivas

Indy (SUN) 05/05/1974 Arena Coliseo Acapulco, Acapulco, Guerrero [KO 1101, RB]
1) Charro Valdez b Diabolic
2) Aristóteles b Yanco
3) Médico I, Médico II b El Centauro, El Zorro
## said to be Medicos 7th straight win
4) La Furia, León Negro b Mario Rocca, Tino Herrera
## very bloody

indy (SUN) 05/05/1974 Arena, Atlixco, Puebla [Halcon 97]
1) Tauro b Milo Ventura [MEX LIGHT]

Indy (SUN) 05/05/1974 Plaza de Toros Valente Arellano, Torreón, Coahuila [KO 1101, RB]
1) Lalo Marquez b Guapo Ibarra
2) Juanito García b Eric el Rojo
3) Halcón Suriano b Roy Lancer
4) Flama Azul, Tony Reyna b El Impostor, King
5) César Silva, Polo Torres, Rubén Juárez b Espanto III, Golden Boy, Manny Águilar

indy (SUN) 05/05/1974 Querétaro, Querétaro [Halcon 97]
1) Coloso b Fantasma Negro  (c) [QRO WELTER]

Indy (MON) 05/06/1974 Cancha San Pedro, Atencingo, Chietla, Puebla [KO 1101, RB]
1) Flamarión b Comodín
2) Apolo Vargas b Gardenio
3) El Corzo, El Puma b Trueno Negro, Yaco El Gitano
4) El Matematico, Tony Salazar b La Mosca, Yeti

EMLL (TUE) 05/07/1974 Arena Coliseo [Halcon 97]
1) El Suriano b Mr. Lancer
2) El Polaco, Tauro b El Vengador, Estrella Blanca [semifinal]
3) Dardo Aguilar, Milo Ventura b Dick Angelo, León Negro [semifinal]
4) Dardo Aguilar, Milo Ventura b El Polaco, Tauro [final]
5) Comando I, Comando II b Mario Llanes, Mr. Tempest [semifinal]
6) Carlos Mata, Chino Chow b El Rebelde, Manuel Robles [semifinal]
7) Carlos Mata, Chino Chow DQ Comando I, Comando II [final]
## straight DQs
&& two seperate tournaments

EMLL (TUE) 05/07/1974 Arena Coliseo Guadalajara [El Informador 1974-05-07, KO 1101]
1) José Gomez b Demonio Rojo
2) Fantasmon b Chales Casillas
3) La Gacela DRAW Rodolfo Ruiz
4) Charito Silva, La Vendetta, Toña La Tapatia DQ Angelica Galicia, Karina, Lola González
5) Ciclón Veloz, Remo b Astro Rey, Cesar Valentino

EMLL (WED) 05/08/1974 Arena Coliseo Acapulco, Acapulco, Guerrero [Halcon 97]
1) El Centauro, Zorro b Galeno I, Galeno II [mask, hair]

indy (WED) 05/08/1974 Arena San Juan Pantitlan, Ciudad Nezahualcóyotl, Estado de México [Box y Lucha 1125]
1) Misterio Blanco II vs Juanito Ramírez
2) Flashman vs Al Suarez
3) Águila India vs Black Center
4) Misterio Blanco I vs El Chacal
5) Apolo Chino I, Apolo Chino II vs Killer Millan, Príncipe Odin

EMLL (FRI) 05/10/1974 Arena Coliseo [Box y Lucha 1125, Lucha Libre 551]
1) Pepe Casas b El Invasor
2) Mazambula b Mr. Steel
3) Leo López DCOR Sergio Borrayo
4) Carlos Mata b Comando II
## win via accidental foul, though Lucha Libre didn't think it was truly an accidnent
5) Comando I b Tony López
6) El Rostro, Paco Pardines DQ Coloso Colosetti, Rikidozan
## straight falls, Coloso unmasked Rostro in the second
7) El Halcón, Mano Negra b Alfonso Dantes, Tigre Colombiano

EMLL (SAT) 05/11/1974 Pista Arena Revolución [Box y Lucha 1125]
1) Irazú vs El Talismán
2) Chino Chow vs Rafael Salamanca
3) El Rebelde, Septiembre Negro vs Anibal, Estrella Blanca and Dr. Wagner, El Cobarde and Enrique Vera, Mario Llanes and Bruno Victoria, Fishman and Ciclón Veloz, Villano II and Escorpión I, Escorpión II [torneo]

EMLL (SUN) 05/12/1974 Arena Coliseo [Box y Lucha 1125]
1) Gran Davis vs Saeta Azteca
2) Bruno Estrada vs Dardo Aguilar
3) Tauro vs El Vengador
4) Carlos Mata, Mr. Tempest vs Huroki Sito, Manuel Robles
5) Black Shadow, Enrique Vera, Ringo Mendoza vs Adorable Rubi, Coloso Colosetti, Tigre Colombiano

EMLL (SUN) 05/12/1974 Arena Coliseo Guadalajara [El Informador 1974-05-12]
1) Gemelo Diablo I vs Gemelo Diablo II, Índio Jerónimo, Rizado Ruiz, Astro Rey, José Luis Mendieta, Mario Alcala, El Cordobes [battle royal]
2) Anibal, El Halcón, El Marquez vs Alfonso Dantes, Perro Aguayo, Septiembre Negro

EMLL (SUN) 05/12/1974 Pista Arena Revolución [Box y Lucha 1125]
1) El Diabólico vs El Troyano
2) Pepe Casas vs Mario Rocca
3) La Furia vs Agente X
4) León Negro vs Dick Angelo
5) Mazambula vs Mr. Steel
6) Comando I, Comando II, Rikidozan vs El Rostro, Mano Negra, Tony López

Indy (SUN) 05/12/1974 Arena Azteca, Iztapalapa, Distrito Federal [KO 1101, RB]
1) Águila Blanca, Pedro Sosa b Águila Plateada, Jimmy Cuevas

indy (SUN) 05/12/1974 Arena Bravo, Cuauhtémoc, Distrito Federal [Box y Lucha 1125]
1) Astroboy vs Bulldog Sanchez
2) Jimmy Morales vs Pepe Luna
3) Arturo Gaona vs El Cadáver I
4) Cadáver II, El Beduino vs Cien Fuego, el Signo
5) El Delfin, Tamba vs Octavio Gaona, Príncipe Azteca

Indy (SUN) 05/12/1974 Arena Coliseo Monterrey [KO 1101, RB]
1) Mario Segura b Luis Martinez
2) Juan Ramírez b Roy Lancer
3) César Silva, Chucho Villa b Cumbia, Golden Boy
4) Bruno Victoria, Mario Ramírez b Humberto Garza, Rubén Juárez
5) Dr. Wagner DQ Ciclón Veloz Jr.
&& poor turnout

Indy (SUN) 05/12/1974 Arena Córdoba, Córdoba, Veracruz [KO 1101, RB]
1) El Frayle b Relámpago García
2) Raúl Arellano b El Azteca
3) Hermano Robinson I, Hermano Robinson II b Danny Guzman, Mr. Randall
4) Apolo, Marinero Acosta, Tawa Vera b Dean II, Luzbel, Tupamaro I

Indy (SUN) 05/12/1974 Arena Juventud 78, La Paz, Estado de México [KO 1101, RB]
1) Estrella b El Minero
2) Tauro Espinoza b Galackus
3) ? b Black Tempest
4) Azor, Ringo Ruiz b Asesino ?, Thor
5) Estrella Dorado b El Búho [mask]

indy (SUN) 05/12/1974 Arena Lopez Mateos [Box y Lucha 1125]
1) Hacha Negra vs Dragón Oriental
2) Ave Asesino vs Al Galicia
3) Bufalo Salvaje, El Apache, Índio Chichimeca vs Birdman, Conde Azul, Terry Bolaños
4) El Duque, Yanga vs Chamaco Ortiz, Osideo
5) El Emperador vs El Magno [EDM JW]

indy (SUN) 05/12/1974 Arena Reforma, Naucalpan, Estado de México [KO 1101, RB]
1) El Inolvidable b Águila Mixteca
2) Índio Zuick b Voltra
3) Chucho Conde b Jefe Yaqui
4) Chucho Conde, Hermano Tapatío I, Hermano Tapatío II b Ángel Rojo, Chino Alonso, El Infernal
5) La Malinche b La Panterita

indy (SUN) 05/12/1974 Arena San Fernando, Naucalpan, Estado de México [Box y Lucha 1125]
1) Caglisotro vs Hombre De La Nieves
2) La Perca vs El Brasero
3) Tiburón Negro vs Carabeo
4) Felix Lozada, Insólito vs Escarabajo, Índio Magudu

indy (SUN) 05/12/1974 Arena San Juan Pantitlan, Ciudad Nezahualcóyotl, Estado de México [Box y Lucha 1125, KO 1101, RB]
1) El Dinámico vs Misterio Blanco II
2) Lobo Potosino vs El Chacal
3) Potro Salvaje vs La Llorona I
4) Chivo Martinez, El Sanguinario b Chacal, El Padrino [semifinal]
## Chacal a sub for Genaro Contreras
5) El Cóndor, El Lince b Luis Rangel, Sombra Vengadora [semifinal]
6) El Cóndor, El Lince b Chico Martinez, El Sanguinario [final]

Indy (SUN) 05/12/1974 Atlixco, Puebla [KO 1101, RB]
1) Raúl Peralta b Hosmar Hernández
2) Rayo Rojo, Saeta Negra b El Jaguar, Terror Negro
3) Dr. Koro, El Húngaro b Caballero Príncipe, Canuto Reyes
4) El Cirujano b Torbellino Azul
&& sellout

indy (SUN) 05/12/1974 Club Deportivo Madero, Saltillo, Coahuila
1) Príncipe Erik vs Mongol De La Muerte
2) Reed Mr. vs La Hiena
3) Ray Badillo, Sombra Lagunera vs Desconocido I, Desconocido II
4) Costeñito Moy, Ruddy Valverde vs Black Power, Halcón Morales

indy (SUN) 05/12/1974 Plaza de Toros el Cortijo, Venustiano Carranza, Distrito Federal [Box y Lucha 1125]
1) Tony Cardenas vs Perseo
2) El Maldito vs El Talismán
3) El Rebelde vs Villano II
4) Escorpión I, Escorpión II vs Mario Llanes, Rafael Salamanca
5) Cesar Valentino, El Cobarde vs Chino Chow, Paco Pardines

Indy (MON) 05/13/1974 Nuevo Laredo, Tamaulipas [KO 1101, RB]
1) Huroki Sito, Sombra Vengadora b Cavernario Galindo, Gory Casanova
&& big turnout

Indy (MON) 05/13/1974 Tampico, Tamaulipas [KO 1101, RB]
1) Asesino Negro, Atila b Espectro I, Espectro Jr. [final]

EMLL (TUE) 05/14/1974 Arena Coliseo Guadalajara [El Informador 1974-05-14]
1) ? vs ??
2) ? vs ??
3) ? vs ??
4) Angelica Galicia, Irma González, Karina vs Charito Silva, La Vendetta, Toña La Tapatia
5) Demonio Blanco, José Luis Mendieta, Pantera Azul vs Astro Rey, El Nazi, Rodolfo Ruiz

Indy (TUE) 05/14/1974 Cuautitlán, Estado de México [KO 1101, RB]
1) Rudy Espinoza b El Gavilán
2) Irazú b Talismán
3) El Vengador b Angelo
## Vengador is the son-in-law of Ray Plata
4) Dr. O’Borman, Huroki Sito b El Húngaro, Rafael Salamanca
5) Black Shadow, Pepe Pardinez b Cesar Valentino, El Cobarde

EMLL (FRI) 05/17/1974 Arena Coliseo [Lucha Libre 552]
1) Polaco b Ángel Negro
2) Vengador DRAW Bruno Estrada
3) Manuel Robles b Estrella Blanca
4) Tony López DQ Fishman
## foul for the DQ
5) Rostro b Bruno Victoria
6) Ciclón Veloz DQ Rikidozan
## Rikidozan called the worst import of the season. Foul for the DQ.
7) Cesar Valentino, Dr. Wagner, El Cobarde b El Halcón, Mano Negra, Paco Pardinez

EMLL (SAT) 05/18/1974 Arena Puebla [KO 1103]
1) Tawa Vera DQ Pepe
2) Chino Chow DQ Cesar Valentino
3) Mano Negra, Paco Pardinez b Fishman, Rikidozan
4) Ciclón Veloz Jr., El Halcón DQ El Nazi, Rubí Ruvalcaba
&& matches set by battle royal

EMLL (SUN) 05/19/1974 Arena Coliseo Guadalajara [Arena KO 1103, El Informador 1974-05-19]
1) Capitán b Lorenzo El Gitano
2) El Polaco b La Gacela
3) Rizado Ruiz, Rodolfo Ruiz b El Ídolo, Villano II
4) El Marquez, Pantera Negra b Cesar Valentino, Índio Jerónimo
5) Alfonso Dantes DRAW El Halcón [super libre]

Indy (SUN) 05/19/1974 Arena Aficion [KO 1101, RB]
1) Chamaco Ramírez vs Leo Pineda
2) Black Gorr vs Chamaco Segura
## Black Gorr seems like a typo
3) Gorila Flores Jr. vs Perro González
4) Ángel de Oro, Chico Lima, El Toluco vs Alberto Ventura, Lalo Montenegro, Villano III

Indy (SUN) 05/19/1974 Arena Aficion

Indy (SUN) 05/19/1974 Arena Bravo, Cuauhtémoc, Distrito Federal [KO 1101, RB]
1) Astro Boy vs Yarbick
2) Jimmy Morales vs Bulldog Sanchez
3) Ave Asesina vs Chino Lopez
4) El Delfin, Pepe Luna vs Arturo Gaona, Tony Revilla
5) Cadáver I, Cadáver II vs Birdman, Terry Bolaños

Indy (SUN) 05/19/1974 Arena El Palmar, Distrito Federal [KO 1101, RB]
1) Pillo De Tepito vs El Ilustre Desconocido
2) Apache Negro vs El Minero
3) Black Templer vs Caballero Guzarein
4) Azar, Galactus vs Solin Hernández, Tony Villa
5) El Cinico, La Malinche vs La Panterita, Tauro Espinoza
## This is man vs woman versus man vs woman; KO shocked it’s being allowed.
&& location unknown

Indy (SUN) 05/19/1974 Arena Lopez Mateos [KO 1101, RB]
1) Hacha Negra vs El Coralillo
2) Al Galicia vs Bufalo Salvaje
3) El Apache, El Emperador, Índio Magudu vs Conde Azul, El Magno, el Signo
4) Beto González, El Beduino vs Cienfuegos, Octavio Gaona
5) Chamaco Ortiz vs Yanga [hair]

indy (SUN) 05/19/1974 Arena Puebla [KO 1103]
1) Sombra Negra b Profesor Dantes
2) Dardo Aguilar, Estrella Blanca, Tino Herrera b Dean II, Dr. O’Borman, Hércules Poblano
3) Atila b Petroneo Limon  (c) [PUEBLA MIDDLE]

Indy (SUN) 05/19/1974 Arena Reforma, Naucalpan, Estado de México [KO 1101, RB]
1) Rudy Guzman vs El Inolvidable
2) El Desconfiado vs Príncipe Fantasma
3) Caballo Loco vs El Malvado
4) Ciclón Tapatío vs Chino Alonso
5) Electrodo, Hermano Tapatío I, Hermano Tapatío II vs Ángel Rojo, El Infernal, León Marino

Indy (SUN) 05/19/1974 Arena Rosales, Iztapalapa, Distrito Federal [KO 1101, RB]
1) Fantasma Negro vs Sagitario Dorado
2) Ermitano, Tony Bernal vs As Del Hidalgo I, As Del Hidalgo II
3) El Cóndor, Fantasma de la Quebrada vs Chino Lopez, Jimmy Cuevas

Indy (SUN) 05/19/1974 Arena San Juan Pantitlan, Ciudad Nezahualcóyotl, Estado de México [KO 1101, RB]
1) Misterio Blanco II vs Águila India
2) Misterio Blanco I vs Lobo Potosino
3) Potro Salvaje vs El Sanguinario
4) Chivo Martinez vs El Cóndor
5) El Lince, Tinieblas vs Luis Rangel, Sombra Vengadora

Indy (SUN) 05/19/1974 Arena Toluca, Toluca, Estado de México [KO 1101, RB]
1) Marte vs Rey Tigre
2) Capitán Marvel vs ?
3) Scorpió vs Ray Acosta
4) Hombre sin Rostro vs Dr. Misterio
5) Cuitlahuac, Javier Montes vs Tiburón, Troglodita Flores
&& all singles matches are part of tournament for Arena Toluca Middleweight Title

Indy (SUN) 05/19/1974 Atlixco, Puebla [KO 1101, RB]
1) Torbellino Azul vs El Cirujano [mask]

indy (SUN) 05/19/1974 Torreón, Coahuila [KO 1103]
1) Rayito Sanchez b Guapo Ibarra
2) Joanito García b El Mulato
3) Halcón Suriano b Roy Lancer
4) Flama Azul, La Sombra, Tony Reyna b Manny Águilar, The King, Tony Romay
5) César Silva, Rubén Juárez b Espanto III, Fishman

Moreno (SUN) 05/19/1974 Arena KO Algusto, Naucalpan, Estado de México [Halcon 99, KO 1101, RB]
1) Juanito García vs Relámpago Negro
2) Centella Nolasco vs Rudy Espinoza
3) ?, El Alimania vs Ciclón Mexicano, Fili Guerrero
4) El Mariscal ()C vs Memo Ventura [EDM LIGHT]
5) Canaima, Maravilla Perez, Maravilla Peruana vs Espectro, Jorge Allende, Renato Torres

indy (MON) 05/20/1974 Veracruz, Veracruz [KO 1103]
1) Tupamaro I b Jon Mullequn
2) Maravilla Perez b Irazú
3) Bruno Victoria b Tempest
4) Cesar Valentino, Dr. Wagner b Enrique Vera, Ringo Mendoza

EMLL (TUE) 05/21/1974 Arena Coliseo Guadalajara [Arena KO 1103, El Informador 1974-05-21]
1) Félix Mosqueda b Argost
2) La Gacela b Calavera I
3) Iván El Bronco b Ídolo
4) Irma González b Charito Silva
5) Demonio Blanco, Pantera Azul, Perro Aguayo b El Marquez, José Luis Mendieta, Remo

indy (WED) 05/22/1974 Arena Coliseo Acapulco, Acapulco, Guerrero [Halcon 99]
1) El Troyano b Mario Valenzuela
2) El Centauro DQ Manuel Robles
3) Black Shadow, Enrique Vera b Bruno Victoria, Perro Aguayo
4) Cesar Valentino, Dr. Wagner DRAW Mano Negra, Ringo Mendoza
5) Dr. O’Borman b Invasor [mask]
## Invasor is Rodolfo Hurtado Quintero.  Rangel referee.
&& Pepe Valdez promoter.

indy (WED) 05/22/1974 Ciudad Juárez, Chihuahua [Halcon 99]
1) El Delfin b Índio Jerónimo

indy (THU) 05/23/1974 Arena Toluca, Toluca, Estado de México [KO 1103]
1) Talismán b La Furia
2) Tony López b Bruno Victoria
3) Adorable Rubi, El Nazi, Perro Aguayo b Cesar Valentino, Dr. Wagner, El Cobarde

EMLL (FRI) 05/24/1974 Arena Coliseo [Lucha Libre 554]
1) Dick Angelo b Agente X
2) Mr. Steel b León Negro
3) El Rebelde b Sergio Borrayo
4) Mr. Tempest DQ Comando II
5) Rostro b Comando I
6) Black Shadow DQ El Nazi
## foul for DQ
7) El Halcón, Enrique Vera, Mano Negra b Cesar Valentino, Dr. Wagner, El Cobarde

indy (SAT) 05/25/1974 Arena Alberto Munoz, Saltillo, Coahuila
1) Carnicero Macias vs Black Power
2) Ray Badillo vs El Dragón
3) Costeñito Moy vs Rudy Valverde
4) Chamaco Gloria, Frank Cortes vs Halcón Morales, Terror Amarillo

EMLL (SUN) 05/26/1974 Arena Coliseo Guadalajara [El Informador 1974-05-26]
1) ? vs ??
2) ? vs ??
3) Rodolfo Ruiz vs Raúl Torres
4) El Marquez, José Escobedo vs Astro Rey, Iván El Bronco
5) El Halcón, Enrique Vera, Pantera Negra vs Alfonso Dantes, Índio Jerónimo, Septiembre Negro

EMLL (SUN) 05/26/1974 Monterrey, Nuevo León [KO 1103]
1) Chuy Carrillo b Tony Crest
2) Shadito Cruz b Tarzan Rocha
3) Canek b Mr. Niebla
## Not a good match. Niebla is green.
4) Dick Medrano, Gallo Tapado b Black Face, El Vikingo
5) Rene Guajardo, TNT b Dorrel Dixon, Ham Lee
&& recap complaints the matches are too long and the young wrestlers aren't good. They say the promoter needs to do better without saying the name of the promoter (so probably Guajardo.)

Indy (SUN) 05/26/1974 Arena del Moral, Iztapalapa, Distrito Federal
1) Centella Poblana vs Voluntario I
2) Toro Hernández vs Capitán Zovek
3) Bulldog Ramírez vs Ángel Zepeda
4) Dr. Brown, Jaon vs Escorpión III, Poder Negro
5) Sheik Mar Allah, Sugi Sito vs Mario Prado, Ulises Onassis

indy (SUN) 05/26/1974 Tlalnepantla, Estado de México [Halcon 100]
1) El Emperador  (c) b Apache [TLALNEPANTLA WELTER]

Indy (MON) 05/27/1974 Arena Veracruz, Veracruz, Veracruz
1) Cuervo II vs Cuervo I
2) El Oso Blanco vs Jorge Oropeza
3) Black Shadow, Estrella Blanca vs El Cobarde, El Rebelde
4) Ringo Mendoza vs Dr. Wagner

EMLL (TUE) 05/28/1974 Arena Coliseo Guadalajara [El Informador 1974-05-28]
1) ? vs ??
2) ? vs ??
3) ? vs ??
4) Luis Chavira, Roy Stive vs Remo, Villano I
5) José Luis Mendieta, Mario Alcala, Ray Mendoza vs Demonio Blanco, Karloff Lagarde, Pantera Azul

EMLL (FRI) 05/31/1974 Arena Coliseo [Halcon 100]
1) Escorpión I b Saeta Azteca
2) Cesar Valentino, Dr. Wagner b Paco Pardinez, Ray Mendoza [semifinal]
## return of Ray Mendoza
3) El Halcón, Mano Negra b Karloff Lagarde, Rikidozan [semifinal]
4) El Halcón, Mano Negra b Cesar Valentino, Dr. Wagner
## 2/3 [final]
5) Javier Llanes, Mario Llanes b El Rebelde, Leo López [semifinal]
6) Huroki Sito, Manuel Robles b Sergio Borrayo, Vengador [semifinal]
## 1/3
7) Huroki Sito, Manuel Robles b Javier Llanes, Mario Llanes [final]
&& last Friday night in Arena Coliseo. Two four team tournaments.

indy (SAT) 06/01/1974 Arena Azteca, Iztapalapa, Distrito Federal [KO 1103]
1) Skorvirkan vs Ghurka, Hombre De Negro, Fantasma Asesino, Máscara De Hierro, Tiger Hispano [AZTECA MIDDLE]
2) Danny García, Tony Vilichis vs Benny Castello, El Profeta
&& Gordoa promoter

EMLL (SUN) 06/02/1974 Arena Coliseo Guadalajara [El Informador 1974-06-02]
1) ? vs ??
2) ? vs ??
3) Astro Rey vs Remo
4) El Marquez, José Luis Mendieta vs Rizado Ruiz, Roy Stive
5) Rayo de Jalisco, Ringo Mendoza, Tony Stone vs Cesar Valentino, Dr. Wagner, El Cobarde

indy (SUN) 06/02/1974 Arena Bravo, Cuauhtémoc, Distrito Federal [KO 1103]
1) Halcón Escobedo vs Alex Castellanos
2) Astroboy vs Jimmy Morales
3) Hacha Negra vs El Coralillo
4) Emperador vs Pepe Luna
5) Chino Flores vs Arturo Gaona

indy (SUN) 06/02/1974 Arena Lopez Mateos [KO 1103]
1) Encapuchado Negro vs Maravilla Negra
2) Bulldog González vs Caglisotro
3) Bufalo Salvaje vs Fantasma de la Opera
4) Cadáver I, Cadáver II vs Cienfuego, el Signo
5) El Beduino, Tigre Negro vs Conde Azul, Octavio Gaona

indy (SUN) 06/02/1974 Arena San Juan Pantitlan, Ciudad Nezahualcóyotl, Estado de México [KO 1103]
1) Águila India vs Black Center
2) Mario Solar vs El Chicano
3) Lobo Potosino vs El Sanguinario
4) Potro Salvaje vs Misterio Blanco I
5) Chivo Martinez vs Kaplin
6) Odiseo, Sombra Vengadora vs El Cóndor, El Lince [sin referi]

indy (SUN) 06/02/1974 Plaza de Toros el Cortijo, Venustiano Carranza, Distrito Federal [KO 1103]
1) Talismán vs Perseo
2) Mario Rocca vs Pepe Casas
3) Iván El Bronco vs Jhonny Lezcano
4) Escorpión I, Escorpión II vs Rafael Salamanca, Sergio Borrayo
5) Black Shadow, Carlos Mata vs Fishman, Perro Aguayo
&& date is a guess

Fraternidad (MON) 06/03/1974 Auditorio de Tijuana, Tijuana, Baja California [KO 1103]
1) Gallo Tapado vs Tony Salazar
2) Huracán Ramírez, Santo vs Dory Dixon, El Greco
&& promoter is Aurelio Calva Flores but magazine talks about new promotion Fraternidad being responible

EMLL (TUE) 06/04/1974 Arena Coliseo Guadalajara [El Informador 1974-06-04]
1) ? vs ??
2) ? vs ??
3) ? vs ??
4) José Escobedo, Mario Alcala vs Índio Jerónimo, Rizado Ruiz
5) Martin Escobedo, Pantera Negra, Tony Stone vs Demonio Blanco, Dr. Wagner, Pantera Azul

indy (WED) 06/05/1974 Arena KO Algusto, Naucalpan, Estado de México [Halcon 101]
1) Villano III  (c) b Ray Acosta [EDM WELTER]

EMLL (FRI) 06/07/1974 Arena México [Halcon 101]
1) Villano I DRAW Leo López
## non-battle royal match
2) Adorable Ruvalcaba b Paco Pardinez
3) El Halcón b Rikidozan
4) Tony Salazar DQ Dr. Wagner
5) Rayo de Jalisco, Superstar b El Nazi, Karloff Lagarde
## Superstar debut. Magazine shoots down rumor he is Chris Colt under a mask.
6) Anibal, Blue Demon, Ray Mendoza b Coloso Colosetti, Dantes, Septiembre Negro
&& matches set by 16 battle royal, said to be only the third ever

indy (FRI) 06/07/1974 Plaza de Toros Victoria, Ciudad Victoria, Tamaulipas
1) Astro Azul vs El Babalu
2) Sergio el Hermoso vs Comodín
3) Relámpago Gutierrez vs Corsario Blanco
4) Dr. Dínamo, El Solitario, The Zebra Kidd vs El Aeropira, Oso Matius, Renato Torres

EMLL (SAT) 06/08/1974 Pista Arena Revolución [Halcon 101]
1) Black Shadow, Carlos Mata b Fishman, Perro Aguayo and Chino Chow, Mano Negra and Bruno Victoria, El Cobarde
## a legit four corner tag match! Said to be first in this programacion (not sure EMLL or building.)

EMLL (SUN) 06/09/1974 Arena Coliseo Guadalajara [El Informador 1974-06-09]
1) ? vs ??
2) ? vs ??
3) ? vs ??
4) El Cobarde, Índio Jerónimo vs El Marquez, Mario Alcala
5) Mano Negra, Rayo de Jalisco, Tony Stone vs Adorable Rubi, Karloff Lagarde, Rizado Ruiz

LMPL (SUN) 06/09/1974 La Paz, Baja California [Halcon 101]
1) El Rebelde, Santo vs Greco, Tony Salazar

EMLL (TUE) 06/11/1974 Arena Coliseo Guadalajara [El Informador 1974-06-11]
1) ? vs ??
2) ? vs ??
3) ? vs ??
4) José Luis Mendieta, Villano II vs Astro Rey, Gemelo Diablo I
5) José Escobedo, Martin Escobedo, Rayo de Jalisco vs Ángel Blanco, Demonio Blanco, Pantera Azul

EMLL (FRI) 06/14/1974 Arena México [Halcon 102, Lucha Libre 556]
1) León Negro b Tino Herrera
2) Estrella Blanca b El Rebelde
3) Tony López b Manuel Robles
4) Paco Pardinez DQ Bruno Victoria
5) Tony Salazar b Índio Jerónimo
## Jeronimo looked great
6) Coloso Colosetti, Dr. Wagner b El Nazi, Karloff Lagarde
7) Anibal, Ray Mendoza, Superstar b Adorable Ruvalcaba, Dantes, Septiembre Negro

EMLL (SAT) 06/15/1974 Pista Arena Revolución [Halcon 101]
1) Fishman  (c) b Black Shadow [MEX WELTER]
## Fishman has defended against Shadow, Marquez, and Carlos Mata
2) Perro Aguayo b Carlos Mata [hair]

EMLL (SUN) 06/16/1974 Arena Coliseo Guadalajara [El Informador 1974-06-16]
1) ? vs ??
2) ? vs ??
3) ? vs ??
4) El Marquez, José Luis Mendieta vs Fishman, Gemelo Diablo I
5) Ángel Blanco, Coloso Colosetti, Dr. Wagner vs Audaz, Rayo de Jalisco, Tony Stone

EMLL (TUE) 06/18/1974 Arena Coliseo [Halcon 106]
1) Ursus vs El Diabólico
2) Gran Davis vs El Suriano
3) Oso Blanco vs Tony Cardenas
4) Tupamaro vs Talismán
5) La Furia vs Johnny Lezcano
6) Dr. O’Borman, Pepe Casas vs Dardo Aguilar, Estrella Blanca [super libre]
7) Cesar Valentino, Leo López, Manuel Robles vs Black Shadow, Chino Chow, El Rostro

EMLL (TUE) 06/18/1974 Arena Coliseo Guadalajara [El Informador 1974-06-18, Halcon 103]
1) ? vs ??
2) ? vs ??
3) ? vs ??
4) El Ídolo, Pantera Negra vs Gemelo Diablo II, Rizado Ruiz
5) Demonio Blanco, Pantera Azul vs José Escobedo, Martin Escobedo  (c) [OCCIDENTE TAG]
## Halcon 103 believes Escobedos probably lost the titles but aren't repoting it.

EMLL (FRI) 06/21/1974 Arena México [Halcon 103, Lucha Libre 557]
1) Tauro b Villano II
2) Bruno Estrada b Ángel Negro
3) Coloso Colosetti, Dr. Wagner DQ Ray Mendoza, Superstar [quarterfinal]
## Coloso fouoled Superstar, Superstar fouled Wagne, only the last was caught.
4) Dantes, El Nazi b Ángel Blanco, Cesar Valentino [quarterfinal]
5) Karloff Lagarde, Rubí Ruvalcaba b Rayo de Jalisco, Tony Salazar [quarterfinal]
6) Anibal, Blue Demon b Rikidozan, Septiembre Negro [quarterfinal]
## Septiembre Negro replaced Akio Murasaki.
7) Coloso Colosetti, Dr. Wagner b Dantes, El Nazi [semifinal]
## setting up a Nazi/Colosetti hair match
8) Anibal, Blue Demon b Karloff Lagarde, Rubí Ruvalcaba [semifinal]
## Anibal challenged Ruvalcaba to a title match
9) Anibal, Blue Demon b Coloso Colosetti, Dr. Wagner [final]

EMLL (SUN) 06/23/1974 Arena Coliseo Guadalajara [El Informador 1974-06-23]
1) ? vs ??
2) ? vs ??
3) ? vs ??
4) El Marquez, Martin Escobedo vs Gemelo Diablo I, Gemelo Diablo II
5) Ángel Blanco, Coloso Colosetti, Dr. Wagner vs Pantera Negra, Rayo de Jalisco, Tony Stone

EMLL (TUE) 06/25/1974 Arena Aficion [Halcon 104]
1) Ray Mendoza  (c) b Alfonso Dantes [NWA LH]

EMLL (TUE) 06/25/1974 Arena Coliseo [Halcon 104]
1) Tino Herrera b León Negro
## first of matches determined by battle royal
2) Rodolfo Ruiz b Talismán
3) El Troyano DQ Dick Angelo
4) Johnny Lezcano b Mazambula
5) Dardo Aguilar DQ Tauro
## last match by battle royal
6) Dr. O’Borman, Pepe Casas vs El Invasor, Estrella Blanca
## rematch of mask match
7) Chino Chow, El Rostro, Mano Negra b Cesar Valentino, Leo López, Manuel Robles

EMLL (TUE) 06/25/1974 Arena Coliseo Guadalajara [El Informador 1974-06-25]
1) ? vs ??
2) ? vs ??
3) ? vs ??
4) Mario Alcala, Raúl Torres vs Astro Rey, El Mongol
5) Enrique Vera, José Luis Mendieta, Rayo de Jalisco vs Demonio Azul, Dr. Wagner, Pantera Azul

EMLL (FRI) 06/28/1974 Arena México [Halcon 104, http://superluchas.com/2015/06/28/en-un-dia-como-hoy-1974-coloso-colosetti-rapa-a-el-nazi-anibal-se-corona-como-campeon-nacional-de-peso-medio-ante-adorable-rubi/ SuperLuchas]
1) Paco Pardinez b Comando I
2) Ciclón Veloz Jr. b Karloff Lagarde
## Karloff subbed for Akio Murasaki, who could not work due to paperwork issues
3) Tony Salazar b Alfonso Dantes
4) Ray Mendoza, Superstar b Ángel Blanco, Dr. Wagner
5) Anibal b Rubí Ruvalcaba  (c) [MEX MIDDLE]
## title change!
6) Coloso Colosetti b El Nazi [hair]
&& first show of a run of Arena Mexico shows

EMLL (SUN) 06/30/1974 Arena Coliseo Guadalajara [El Informador 1974-06-30, Halcon 105]
** 15 anniversary show
1) Astro Rey vs José Luis Mendieta
2) Gemelo Diablo II vs El Marquez
3) Gemelo Diablo I vs Pantera Negra
4) Paco Pardines, Rayo de Jalisco, Super Star vs Ángel Blanco, Coloso Colosetti, Dr. Wagner
5) Demonio Blanco, Pantera Azul b José Escobedo, Martin Escobedo [mask, hair]
## Halcon 105 confirms Demonio & Pantera held on to their mask and took the hair of the Escobedos.

indy (SUN) 06/30/1974 Arena Azteca, Iztapalapa, Distrito Federal [Halcon 104]
1) Tigre Hispano b Ghurka [AZTECA MIDDLE, final]
## finals of a tournament (where they were partners)

EMLL (TUE) 07/02/1974 Arena Coliseo [Halcon 104]
1) El Suriano b Diabolik
## debut of Diabolik, from Acapulco
2) El Maldito b Mr. Lancer
3) Perseo DCOR El Troyano
4) Saeta Azteca b Oso Blanco
5) Tino Herrera DQ Bruno Estrada
6) Dardo Aguilar, Estrella Blanca, Invasor b León Negro, Rodolfo Ruiz, Tauro
## bestter than the main event
7) Chino Chow, Enrique Vera b Iván El Bronco, Rizado Ruiz
## recap dislikes the match for being a street fight and not a wrestling match

EMLL (TUE) 07/02/1974 Arena Coliseo Guadalajara [El Informador 1974-07-02]
1) ? vs ??
2) ? vs ??
3) ? vs ??
4) Remo, Sergio Borrayo vs Flama Azul, Roy Stive
5) Mario Alcala, Pantera Negra, Ringo Mendoza vs Astro Rey, Demonio Blanco, Dr. Wagner

EMLL (FRI) 07/05/1974 Arena Coliseo [Box y Lucha 1134, Halcon 104]
1) Rizado Ruiz b Mario Llanes
2) Estrella Blanca DQ Iván El Bronco
3) Huroki Sito b Mr. Steel
4) Dardo Aguilar b Irazú
5) Índio Jerónimo b Chino Chow
6) Anibal, Tony Stone b Akio Murasaki, Rikidozan [quarterfinal]
## Anibal subbed for Ray Mendoza. Halcon results say Tony, Box y Lucha 1134 clarify it was Tony Stone.
7) Coloso Colosetti, Dr. Wagner b El Halcón, Paco Padrinez
## Wagner & Colosetti should've defeated someone - it's listed as a five team touranment - but no match is mentioned.
8) Anibal, Tony Stone b Coloso Colosetti, Dr. Wagner [semifinal]
9) Anibal, Tony Stone b Alfonso Dantes, Karloff Lagarde [final]
## Lagarde & Dantes won a seeding battle to advance straight to the fainls

indy (FRI) 07/05/1974 Plaza de Toros La Monumental, Monterrey, Nuevo León [Halcon 105, Halcon 106, KO 1112]
1) Súper Sam, Tinieblas vs El Vikingo, Renato Torres
2) Rene Guajardo  (c) b El Solitario [NWA MIDDLE]
## title match outside of EMLL and not approved by NWA, ultimately leading to Guajardo being stripped from the title.
&& big turnout. Around 90,000 gate according to KO 1112. Magazine says a rematch in Nuevo Laredo a few days later drew 75,000 but has no date.

EMLL (SUN) 07/07/1974 Arena Coliseo Guadalajara [El Informador 1974-07-07]
1) ? vs ??
2) ? vs ??
3) Mario Alcala vs Sergio Borrayo
4) José Luis Mendieta, Remo vs Astro Rey, Roy Stive
5) Cesar Valentino, Coloso Colosetti, Dr. Wagner vs Anibal, Pantera Negra, Super Star

Indy (SUN) 07/07/1974 Cancha Municipal, Ozumba de Alzate, Hidalgo
1) El Padrino, Halcón Dorado vs El Bandolero, El Salvaje
2) Bat Masterson vs Terror Blanco
3) Jorge Gaona vs Ray Tapia
4) Halcón Ramírez vs As De Hidalgo
5) Rams vs As De Hidalgo II

Indy (SUN) 07/07/1974 Plaza de Toros Valente Arellano, Torreón, Coahuila [Lucha LIbre 88, RB]
1) Lalo Marquez b Guapo Ibarra
2) Juanito García DRAW Erick El Rojo
3) Vicente Nuno b Ruben Palma
4) Manny Águilar, Tigre Romano b La Sombra, Tony Reyna
5) El Faraón, Espanto III, Scorpió b Carlos Mata, César Silva, El Cordobes
## said to be Scorpio debut here so possibly not the Scorpio Sr. we know

EMLL (TUE) 07/09/1974 Arena Coliseo Guadalajara [El Informador 1974-07-09]
1) ? vs ??
2) ? vs ??
3) ? vs ??
4) Calavera I, Calavera II vs Agente X, The King
5) Anibal, El Marquez, José Escobedo vs Fishman, Gemelo Diablo I, Gemelo Diablo II

EMLL (THU) 07/11/1974 Arena Isabel, Cuernavaca, Morelos [Box Y Lucha 1135]
1) Mano Negra  (c) b Karloff Lagarde [NWA WELTER]
## third time Lagarde has failed to beat Negra.

EMLL (FRI) 07/12/1974 Arena México [Box Y Lucha 1135, Halcon 106, http://wrestlingclassics.com/cgi-bin/.ubbcgi/ultimatebb.cgi?ubb=get_topic;f=10;t=005177;p=0 Matt Farmer]
1) Tino Herrera DRAW Bruno Estrada
2) Rodolfo Ruiz b Johnny Lezcano
3) Iván El Bronco b Sergio Sarabia
4) Tony López DQ Rizado Ruiz
5) Índio Jerónimo b Black Shadow
6) Enrique Vera DQ Akio Murasaki
## boring match. Straight falls, foul in the second
7) Anibal, El Halcón, Tony Salazar b Cesar Valentino, Coloso Colosetti, Dr. Wagner
## ByL recap notes they can't remember the last time Anibal lost. Halcon 106 calls the match emotionless.

EMLL (SAT) 07/13/1974 Pista Arena Revolución [Box y Lucha 1134]
1) Talismán vs Ursus
2) El Nazi, Huroki Sito vs Carlos Mata, Mano Negra and Leo López, Rikidozan and Comando I, Comando II and Villano I, Villano II and Escorpión I, Escorpión II and Alfonso Dantes, Mr. Steel and El Rostro, Estrella Blanca

indy (SAT) 07/13/1974 Partido Revolucionario Institucional, San Pedro, Coahuila [https://www.facebook.com/814221596590755/posts/1422980965714812 El Elegante del Ring]
1) La Sombra vs Espanto III, Jesus Chavez, Black Danger, Rayito Sanchez, Many Águilar, Lalo Marquez, Eric el Rojo, Juanito García, Guapo Ibarra

EMLL (SUN) 07/14/1974 Arena Coliseo [Box y Lucha 1134]
1) El Polaco vs Ángel Negro
2) Dr. O’Borman vs Milo Ventura
3) El Rebelde vs El Vengador
4) Bruno Estrada, Manuel Robles vs Chino Chow, Rafael Salamanca
5) El Halcón, Paco Pardines, Ringo Mendoza vs Adorable Ruvalcaba, Karloff Lagarde, Septiembre Negro

EMLL (SUN) 07/14/1974 Arena Coliseo Guadalajara [El Informador 1974-07-14]
1) ? vs ??
2) ? vs ??
3) ? vs ??
4) El Marquez, Martin Escobedo vs Fishman, Perro Aguayo
5) Cesar Valentino, Coloso Colosetti, Dr. Wagner vs Anibal, Mano Negra, Super Star

EMLL (SUN) 07/14/1974 Pista Arena Revolución [Box y Lucha 1134]
1) Diabolik vs Tupamaro
2) El Suriano vs Irazú
3) Mario Rocca vs Bruno Estrada
4) El Invasor vs Ángel Negro
5) Javier Llanes, Mario Llanes vs Iván El Bronco, Rizado Ruiz
6) Black Shadow, Enrique Vera vs Índio Jerónimo, Rizado Ruiz

indy (SUN) 07/14/1974 Acapulco, Guerrero [Halcon 108]
1) El Centauro, El Extraño, Yanco b Chanoc, Corachi, Galeno II
2) Brujo Mazambula, Sergio Sarabia b El Troyano, Tino Herrera
## debut here of Ciudad Juarez's Sarabia

Indy (SUN) 07/14/1974 Arena Bravo, Cuauhtémoc, Distrito Federal [Box y Lucha 1134]
1) El Coralillo vs Jimmy Morales
2) Maravilla Negra vs Golden Tiger
3) Chino Lopez vs Lemur
4) Astroboy, Birdman vs Al Galicia, Ave Asesina
5) Cruz Gavilán, El Magno vs El Apache, Tigre Negro

Indy (SUN) 07/14/1974 Arena Lopez Mateos [Box y Lucha 1134]
1) Encapuchado Negro vs Maravilla Negra
2) Arturo Gaona vs Chico Aviles
3) Tmba vs Delfin II
4) Conde Azul, el Signo vs Emperador, Pepe Luna
5) Beduino, Conde Drácula, El Duque vs Chamaco Ortiz, Cienfuegos, Terry Bolaños

indy (SUN) 07/14/1974 Arena Raff, Ciudad Nezahualcóyotl, Estado de México [Halcon 106]
1) Javier Duval b Danny Cruz [hair]

Indy (SUN) 07/14/1974 Arena Rosales, Iztapalapa, Distrito Federal [Box y Lucha 1134]
1) El Farahon Negro vs Danton
2) Zeppelin Rojo vs Manuel Rojas
3) Torrente vs Anzari
4) Al Martinez vs Tony Bernal
5) Búho Negro, Jabato vs Desertor, Ray Cruz
6) Costeño Nava vs Henry Hosking
7) Apolo Cruz vs Pequeño Tigre
&& Chela Salazar benefit show

Indy (SUN) 07/14/1974 Arena San Juan Pantitlan, Ciudad Nezahualcóyotl, Estado de México [Box y Lucha 1134]
1) Águila India vs Misterio Blanco II
2) El Greco vs Buddy Montes, Verdugo Negro, Memo Salazar, Odiseo, Thor, Potro Salvaje, El Chicano [battle royal]
3) Felipe Ham Lee vs TNT
4) Misterio Blanco I vs El Ciervo [mask]

indy (SUN) 07/14/1974 Ecatepec, Estado de México [Halcon 106]
1) Rayo Dorado I, Rayo Dorado II b Águila Imperial, Chamaco Ramírez

Indy (SUN) 07/14/1974 Plaza de Toros el Cortijo, Venustiano Carranza, Distrito Federal [Box y Lucha 1134]
1) Huroki Sito vs Leo López, León Negro, Pepe Casas, Mr. Steel, Johnny Lezcano, Agente X, Saeta Azteca [battle royal]
2) Comando I, Comando II, El Nazi vs Carlos Mata, Tony López, Tony Stone

EMLL (TUE) 07/16/1974 Arena Coliseo [Box Y Lucha 1135, Halcon 107]
1) Diabolik vs Gran Davis
2) Carlos Mata, Milo Ventura b El Vengador, Estrella Blanca
3) Black Shadow, Johny Lezcano vs Villano I, Villano II
4) Rizado Ruiz, Rodolfo Ruiz b Iván El Bronco, Leo López and León Negro, Mazambula and Dr. O’Borman, Manuel Robles
&& Notes column mentions the Ruiz brothers winning a tournament and the one tag match

EMLL (TUE) 07/16/1974 Arena Coliseo Guadalajara [Arena KO 1112, El Informador 1974-07-16]
1) Juan Ramírez b Antonio Cruz
2) Cachorro Mendoza b Araña Atómica
3) El Mongol b Ray Saul
4) Astro Rey, Roy Steve b Mario Alcala, Sergio Borrayo
5) Cesar Valentino, El Bengalí, El Cobarde b Audaz, José Escobedo, José Luis Mendieta

indy (TUE) 07/16/1974 Mante, tamaulipas [KO 1112]
1) Amenaza Negra b El Príncipe
2) Comodín b Mely Rivera
3) Ruddy Valentino, Sergio Aragon b El Norteño, Zebra Kid
4) Misterio Negro b Dink El Duende [mask]

EMLL (FRI) 07/19/1974 Arena Coliseo [Box Y Lucha 1135]
1) Pepe Casas vs Dardo Aguilar
2) Atila vs Javier Llanes
3) El Rebelde b Rafael Salamanca
4) Ciclón Veloz b Akio Murasaki
5) Enrique Vera b Índio Jerónimo
## match of the night
6) Paco Pardinez, Tony Salazar b El Nazi, Rikidozan
7) Anibal, Black Shadow b Karloff Lagarde, Rubí Ruvalcaba
## tecnicos took 2/3
&& top 4 matches set by battle royal

EMLL (SAT) 07/20/1974 Arena Puebla [Halcon 107, Halcon 108]
1) Mario Rocca b Dick Angelo [hair]
2) Anibal  (c) b Adorable Ruvalcaba [MEX MIDDLE]

EMLL (SAT) 07/20/1974 Pista Arena Revolución [Box Y Lucha 1135]
1) Perseo vs El Suriano
2) Irazú vs El Troyano
3) Bruno Estrada vs Tino Herrera
4) León Negro vs Milo Ventura
5) Rodolfo Ruiz vs Estrella Blanca
6) Escorpión I, Escorpión II vs Villano I, Villano II
7) Comando I, Comando II, Septiembre Negro vs El Rostro, Raúl Reyes, Ringo Mendoza

EMLL (SUN) 07/21/1974 Arena Coliseo [Box Y Lucha 1135]
1) Iván El Bronco vs Rizado Ruiz, Manuel Robles, Leo López, Mario Llanes, El Vengador, Johny Lezcano, Mr. Steel [battle royal]
2) Anibal, El Halcón, Paco Pardinez vs Cesar Valentino, Coloso Colosetti, El Cobarde

EMLL (SUN) 07/21/1974 Arena Coliseo Guadalajara [El Informador 1974-07-21, KO 1112]
1) Gemelo Diablo II b Mario Alcala
2) José Escobedo b Gemelo Diablo I
3) Perro Aguayo b José Luis Mendieta
4) El Marquez b Fishman
5) Black Shadow, Ciclón Veloz, Super Star DQ Akio Murasaki, Alfonso Dantes, Karloff Lagarde
## Dantees unmasked Super Star, who looked unimpressive.

EMLL (SUN) 07/21/1974 Arena Puebla [Halcon 107]
1) Tauro  (c) b Estrella Blanca [MEX LIGHT]
## ninth defense

EMLL (SUN) 07/21/1974 Pista Arena Revolución [Box Y Lucha 1135]
1) Ángel Negro vs Gran Davis
2) Oso Blanco vs Talismán
3) El Polaco vs Saeta Azteca
4) Atila vs Agente X
5) Huroki Sito vs Rafael Salamanca
6) Bruno Victoria, El Nazi, Índio Jerónimo vs Carlos Mata, Chino Chow, Enrique Vera

indy (SUN) 07/21/1974 Arena Bravo, Cuauhtémoc, Distrito Federal [Box Y Lucha 1135]
1) Maravilla Negra vs Yaspik
2) Jemur vs Jimmy Morales
3) Chino Lopez vs Birdman
4) Astroboy vs Ave Asesina
5) Cruz Gavilán, El Magno, Joe Marino vs Al Galicia, El Apache, Tigre Negro

indy (SUN) 07/21/1974 Arena Lopez Mateos [Box Y Lucha 1135, Halcon 108]
1) Bobby Sanchez vs El Brujo
2) Arturo Gaona vs La Zorra
3) Chico Aviles, Conde Azul vs Conde Dracule, Pepe Luna
4) Chamaco Ortiz, Cienfuego vs El Beduino, El Duque
5) el Signo b El Emperador  (c) [EDM WELTER]

indy (SUN) 07/21/1974 Arena Rosales, Ciudad Nezahualcóyotl, Estado de México [Box Y Lucha 1135]
1) Apolo Cruz vs Dayton
2) Faraón Negro vs Capulin Rojo
3) Al Martinez vs Sagitario Dorado
4) Azor Del Campo vs Carlos Centella
5) El Jabato, Ray Cruz, Tony Bernal vs El Desertor, Exotico Chowl, Pequeño Tigre
6) Chamaco Ortiz, Chino Lopez vs Índio Chichimeca, Kid Bohemia

indy (SUN) 07/21/1974 Plaza de Toros el Cortijo, Venustiano Carranza, Distrito Federal [Box Y Lucha 1135]
1) La Furia vs Ursus
2) El Tupamaro vs Mario Rocca
3) Dr. O’Borman vs Milo Ventura
4) Escorpión II vs Villano II
5) Escorpión I vs Villano I
6) Comando I, Comando II vs El Rostro, Ringo Mendoza

indy (SUN) 07/21/1974 Torreón, Coahuila [KO 1112]
1) Guapo Ibarra b Rayito Sanchez
2) Juanito García b Jesus Chavez
3) Ruben Palma b Erik El Rojo
4) Flama Azul, Scorpió b La Sombra, The King
5) César Silva, Chuco Villa, Polo Torres b Espanto II, Manny Águilar, Rikidozan

EMLL (TUE) 07/23/1974 Arena Coliseo Guadalajara [El Informador 1974-07-23]
1) ? vs ??
2) ? vs ??
3) ? vs ??
4) Remo, Sergio Borrayo vs El Bengalí, Iván El Bronco
5) Ciclón Veloz Jr., El Marquez, Rayo de Jalisco vs Ángel Blanco, Fishman, Karloff Lagarde

EMLL (TUE) 07/23/1974 Gimnasio Municipal Lic. Benito Juárez, Cuautitlán, Estado de México [Halcon 108]
1) El Húngaro b Tony Cardenas [EDM LIGHT]
2) Enrique Vera  (c) b Índio Jerónimo [MEX HEAVY]

EMLL (FRI) 07/26/1974 Arena Coliseo [Halcon 108]
1) Tino Herrera b El Polaco
2) Rodolfo Ruiz b Mr. Steel
3) Iván El Bronco b El Vengador
4) Akio Murasaki b Carlos Mata
5) Ciclón Veloz b Rikidozan
6) Nazi b Paco Pardines
## Nazi took 1/3
7) Alfonso Dantes, Karloff Lagarde, Rubí Ruvalcaba DQ Anibal, Enrique Vera, Tony Salazar

indy (FRI) 07/26/1974 Arena Córdoba, Córdoba, Veracruz [KO 1112]
1) El Cometa b Mohicano I
## debut of Mohicano
2) Robinson b Gran Morefas
3) El Extraño, Joe Mullequin DQ Dean II, El Etio
4) Jorge Oropeza, Marinero Acosta b Luzbael, Yoyo Garduño

indy (SAT) 07/27/1974 Arena Puebla [KO 1112]
1) Petroneo Limbon b Dean II
2) Vengador b Atila
3) Mario Llanes, Mr. Steel b Huroki Sito, Tauro
4) Anibal, Beto Veloz, Stone b Alfonso Dantes, Karloff Lagarde, Rubí Ruvalcaba

EMLL (SUN) 07/28/1974 Arena Coliseo Guadalajara [El Informador 1974-07-28]
1) ? vs ??
2) ? vs ??
3) ? vs ??
4) El Bengalí, El Faraón vs Martin Escobedo, Pantera Negra
5) Alfonso Dantes, Fishman, Septiembre Negro vs El Marquez, Rayo de Jalisco, Super Star

indy (SUN) 07/28/1974 Arena Coliseo Acapulco, Acapulco, Guerrero [KO 1112]
1) Ranger DQ Caudillo
## foul
2) Radilla b Diabolic
3) El Centauro, Zorro b Atila, Johnny Ceballos
4) El Polaco, Sergio Sarabia b Estrella Blanca, Saeta Azteca
## Polaco repalced Burno Vicotira
5) Yanco b Corachi [hair]

indy (SUN) 07/28/1974 Arena Ecatepec de Morelos, Ecatepec, Estado de México [KO 1112]
1) Inhumano II b Príncipe I
2) Fili Guerrero b Jim Vazquez
3) Tom Mix DQ Chico Baeza
4) Águila Imperial, Rayo Dorado II b El Húngaro, Frank Hernández
5) Inhumano I, Sombra Vengadora DQ Erick Romano, Zuanga

indy (SUN) 07/28/1974 Arena Isabel, Cuernavaca, Morelos [KO 1112]
1) Lince Negro b Mr. Terror
2) Torbellino Poblano b Aires
3) Cordobles Rosales, El Maya, Gaby Tapatia b Garambuyo, Marvel, Panama Panther
## Garambuyo betrayed Marvel. Straight falls
4) Espía I, Espia II b Araña De Morelos, Corsario Morelense

indy (MON) 07/29/1974 Arena Veracruz, Veracruz, Veracruz [KO 1112]
1) El Caiman b El Cuervo
## Cuervo replaced Raul Arellano
2) Maravilla Perez b Tupamaro II
## Tupamaro II replaced Dr. Oborman
3) Chino Chow b Comando I
4) Enrique Vera, Ringo Mendoza DQ Cesar Valentino, El Cobarde

EMLL (TUE) 07/30/1974 Arena Coliseo Guadalajara [El Informador 1974-07-30]
1) ? vs ??
2) ? vs ??
3) ? vs ??
4) Calavera I, Calavera II vs La Gacela, Mario Alcala
5) José Escobedo, José Luis Mendieta, Super Star vs Alfonso Dantes, Gemelo Diablo I, Gemelo Diablo II

indy (WED) 07/31/1974 Veracruz, Veracruz [KO 1112]
1) El Cobarde DQ Danny Guzman
## Cobrade replaced Chino Chow
2) Maravilla Perez  (c) b El Polaco [VERACRUZ MIDDLE]

Indy (THU) 08/01/1974 Arena Crucero, Manzanillo, Colima [Arena, RB]
1) Guerrero Samurai b Bestia Nazi [mask]
## Bestia Nazi is Juan Gonzalez Diaz

Indy (THU) 08/01/1974 Plaza De Toros Almoloyan, Colima, Colima [Arena, RB]
1) Black Terry b Águila Roja [mask]
## Aguila Roja is Jose Luis Alanis
&& happened in August, unclear which day

indy (FRI) 08/02/1974 Poza Rica, Veracruz [KO 1112]
1) El Delfin vs Tinieblas [mask, hair]

Fraternidad (SUN) 08/04/1974 Plaza de Toros el Progreso, Guadalajara, Jalisco [Halcon 108]
1) El Santo, El Solitario, Huracán Ramírez vs El Vikingo, Renato Torres, Rene Guajardo

indy (SUN) 08/04/1974 Arena Azteca, Iztapalapa, Distrito Federal [KO 1112]
1) El Profeta vs Benny Castello, Pequeño Demonio, Caballero Águila I, Espartaco, Águila Blanca, Sombra Escarlata, Golden Star
2) El Enfermero, Tigre Hispano vs Fantasma de la Opera, Odiseo

indy (SUN) 08/04/1974 Arena Bravo, Cuauhtémoc, Distrito Federal [Ko 1112]
1) Maravilla Negra vs Lemur
2) Conde Drácula vs Príncipe Azteca, Al Galcia, El Magno, Jimmy Morales, Chino Lopez, Astorboy, Joe Marino, Tigre Negro
3) El Apache vs Cruz Gavilán [hair]

indy (SUN) 08/04/1974 Arena Isabel, Cuernavaca, Morelos [KO 1112]
1) Lince Negro vs Águila Tirana
2) Saeta Morelense vs Garambuyo
3) Capitán Marvel, Gacela Azteca, Panama Panther vs El Africano, El Cordobes, El Maya
4) Espía I, Espia II vs Araña De Morelos, Corsario Morelense [hair, mask]
&& Don Ramon Cue promoter

indy (SUN) 08/04/1974 Arena Lopez Mateos [Ko 1112]
1) Astucia vs Índio Siox
2) Pepe Luna vs Arturo Gaona
3) Octavio Gaona vs Beto González
4) Conde Azul vs El Emperador
5) el Signo vs Beduno
6) El Duque vs Chamaco Ortiz [EDM MIDDLE]
7) Superzan, Tinieblas vs El Alacrán, Gory Casanova

indy (SUN) 08/04/1974 Arena San Juan Pantitlan, Ciudad Nezahualcóyotl, Estado de México [KO 1112]
1) Al Flores vs Black Center
2) Águila India vs Dinámico
3) Llorona I vs Potro Salvaje
4) Puños De Oro vs Llorona II  (c) [EDM LH]
5) Fantasma de la Quebrada, Odiseo vs Kaplin, Yonekura

indy (SUN) 08/04/1974 Plaza de Toros el Cortijo, Venustiano Carranza, Distrito Federal [KO 1112]
1) El Troyano vs La Furia
2) Leo López, Mambula vs Irazú, Mario Rocca
3) Escorpión I, Escorpión II vs Villano I, Villano II
4) Akio Murasaki, Rikidozan vs Carlos Mata, Ringo Mendoza

EMLL (THU) 08/08/1974 Arena Isabel, Cuernavaca, Morelos [Halcon 110]
1) Mario Rocca b Pepe Casas [hair]
2) Anibal  (c) b Perro Aguayo [MEX MIDDLE]
## bloody match

EMLL (FRI) 08/09/1974 Arena Coliseo [Halcon 110]
1) Talismán b El Capitán
2) Huroki Sito b Javier Llanes
3) César Silva b Manuel Robles
## best match of the night
4) Índio Jerónimo b Rafael Salamanca
5) Paco Pardinez b Septiembre Negro
6) Ciclón Veloz, El Halcón DQ Cesar Valentino, El Cobarde
## straight falls
7) Alfonso Dantes, Rubí Ruvalcaba DRAW Anibal, Tony Salazar
## Stone & Dantes double pin in the third, hair match coming

indy (SUN) 08/18/1974 Arena KO Algusto, Naucalpan, Estado de México [Halcon 112]
1) El Espectro, El Mariscal b Bombero, Memo Ventura  (c) [EdM TAG]

indy (SUN) 08/18/1974 Club Deportivo Antonio Cardenas, Saltillo, Coahuila
1) El Suavecito vs Tarzan Martinez
2) Rudy Valverde vs Desconocido I
3) Chamaco Gloria, Costeñito Moy vs Black Power, Red Power
4) Benny Torres vs La Hiena [hair, mask]

indy (SUN) 08/18/1974 Plaza de Toros Valente Arellano, Torreón, Coahuila [El Siglo de Torreon 1974-08-18]
1) Rayito Sanchez vs El Mulato
2) Juanito García vs Eric el Rojo
3) Halcón Suriano vs Vicente Nuño
4) Astro Rey, El Delfin vs El Extraño, Gorilita Flores
5) Eduardo De Linch, Flama Azul, Polo Torres vs Bruno Victoria, Demetrius, Frankenstein

indy (SUN) 08/18/1974 Toluca, Estado de México [Halcon 112]
1) Javier Montes b Nahur Kaliff [hair]

EMLL (TUE) 08/20/1974 Arena Coliseo [Halcon 112, http://wrestlingclassics.com/cgi-bin/.ubbcgi/ultimatebb.cgi?ubb=get_topic;f=1;t=145819;p=0 Matt Farmer]
1) Mr. Lancer b El Capitán
2) Chino Chow, Talismán b Irazú, Iván El Bronco
3) Black Shadow, Estrella Blanca b Escorpión I, Escorpión II
4) Carlos Mata, El Vengador b Black Shadow, Estrella Blanca
5) Índio Jerónimo, León Negro b Carlos Mata, El Vengador
6) Manuel Robles, Tauro b Chino Chow, Talismán
7) Índio Jerónimo, León Negro b César Silva, Dardo Aguilar

indy (TUE) 08/20/1974 Mante, Tamaulipas [Halcon 112]
1) Villano III b Zebra Kid [hair]
## Zebra Kid is Flash Rubio

EMLL (FRI) 08/23/1974 Arena México [http://wrestlingclassics.com/cgi-bin/.ubbcgi/ultimatebb.cgi?ubb=get_topic;f=1;t=145819;p=0 Matt Farmer]Attendance: 15000
1) Ciclón Veloz, Rudo Martin b Akio Murasaki, Perro Aguayo
2) Tigre Colombiano b Audaz
3) Enrique Vera DQ Goro Tanaka
4) El Halcón, Superstar b Black Gordman, Coloso Colosetti
5) Anibal  (c) DRAW Adorable Rubi [MEX MIDDLE]
## Anibal took 1, Rubi took 2, double pin in the third
6) Alfonso Dantes b Tony Salazar [hair]

Salazar (FRI) 08/23/1974 Arena Ecatepec de Morelos, Ecatepec, Estado de México [Halcon 112]
1) El Maldito vs Talismán
2) Dardo Aguilar vs Irazú
3) Carlos Mata, Estrella Blanca vs León Negro, Tauro
4) César Silva, Ciclón Veloz, Tony López vs El Cobarde, Índio Jerónimo, Iván El Bronco
&& Chela Salazar second time running as a promoter. May be a week later

EMLL (SUN) 08/25/1974 Arena Coliseo [http://wrestlingclassics.com/cgi-bin/.ubbcgi/ultimatebb.cgi?ubb=get_topic;f=10;t=005177;p=0 Matt Farmer]
1) José Escobedo, Martin Escobedo vs Coloso Colosetti, Goliath and Cesar Valentino, El Cobarde and Pantera Azul, Rikidozan Jr. and Black Shadow, Mano Negra and César Silva, Chino Chow and Comando I, Comando II and García Barajas, Paco Pardinez

indy (SUN) 08/25/1974 Arena Raff, Ciudad Nezahualcóyotl, Estado de México [https://www.facebook.com/photo/?fbid=511570350479239&set=g.1063818623692271 Angel Luzbel Nezahualcoyotl]
1) Drake vs El Bárbaro
2) Murciélago Infernal vs Tony Mercado [super libre]
3) Dimension X vs Aquaman
4) Chang Lee, Chico Baeza, Cordobes Rosales vs Gaston del Valle, Sheik Mar Allah, Tono De La Cruz
5) Agente X, Chino Chow vs Danny Cruz, Zeus

indy (SUN) 08/25/1974 Plaza de Toros Valente Arellano, Torreón, Coahuila [El Siglo de Torreon 1974-08-25]
1) Rayito Sanchez vs Guapo Ibarra
2) Juanito García vs Loco Díaz
3) Halcón Suriano vs Eric el Rojo
4) El Trueno, Gorilita Flores Jr., Ruben Palma vs Astro Rey, Bulldog Villegas, Jungla Negra
5) Adorable Rubi, Bruno Victoria, The Scorpió vs Blue Demon, Enrique Vera, Flama Azul

indy (SAT) 08/31/1974 Gimnasio STPRM, Huauchinango, Puebla [https://www.facebook.com/photo?fbid=4448778705192084&set=pcb.4448778931858728 Arturo Gaona Jr.]
1) El Alacrán, La Moska vs Arturo Gaona Jr., Octavio Gaona
2) El Gitano vs ?

indy (SAT) 08/31/1974 Puebla, Puebla [Halcon 114]
1) Atila b Mario Rocca [hair]

EMLL (SUN) 09/01/1974 Arena Coliseo Guadalajara [Arena, RB]
1) El Hawaiano b Roman Juarez
2) Ursus b Calavera II
3) Bruno Estrada b Gemelo Diablo II
4) Pantera Negra, Sergio Borrayo b Bruno Victoria, Gemelo Diablo I
5) Fishman, Karloff Lagarde, Tigre Colombiano b Anibal, Enrique Vera, Mano Negra

Indy (SUN) 09/01/1974 Arena Cuatro Caminos, Nuevo Laredo, Tamaulipas [Arena, RB]
1) Manny Cabreras b El Danes
2) Rudy Lopez b Fantasma Rojo
3) Chico García b Blade González
4) El Tartaro, Pantera Negra b Asesino Negro, Flama Roja
5) El Vikingo, Rene Guajardo b El Solitario, Villano III

Indy (SUN) 09/01/1974 Arena Jalisco, Guadalajara, Jalisco [Arena, RB]
1) Chacal Asesino b El Infame
2) El Misterioso b Chato Quezada
3) El Zorro De Jalisco DQ Legendario Rojo
4) El Azteca, El Tapatío b Jorge Monti, Nati Arreola
5) Bucanero II, Lorenzo El Gitano b Félix Mosqueda, Genghis Khan

indy (SUN) 09/01/1974 Distrito Federal [Halcon 114]
1) Señor Tormenta b Mario el Exotico [hair]

indy (SUN) 09/01/1974 Plaza de Toros Alberto Balderas, Ciudad Juárez, Chihuahua [Halcon 110]
1) Humberto Garza, La Máscara, Rubén Juárez vs El Vikingo, Frankenstein, Renato Torres

indy (SUN) 09/01/1974 Plaza de Toros Valente Arellano, Torreón, Coahuila [El Siglo de Torreon 1974-09-01]
1) Rayito Sanchez vs Lalo Marquez
2) Juanito García vs Jesus Chavez
3) Halcón Suriano vs The King
4) Chucho Villa, El Trueno vs Astro Rey, Bulldog Villegas
5) Comando I, Rikidozan, Rudo Martin vs Chino Chow, Eduardo De Linch, Flama Azul

EMLL (TUE) 09/03/1974 Arena Coliseo Guadalajara [Arena, El Informador 1974-09-03, RB]
1) Antonio Cruz b Juan Ramírez
2) Luis Chavira, Pancho Ramírez b Gran Cochisse, Relámpago León
3) El Dorado, La Gacela b Luis González, Sergio Sarabia
4) El Faraón, Roy Stive, Septiembre Negro DQ Anibal, El Ídolo, Mario Alcala

EMLL (FRI) 09/06/1974 Arena México [Halcon 114, http://superluchas.com/2015/09/06/en-un-dia-como-hoy-1974-inicia-el-torneo-para-buscar-a-un-nuevo-campeon-mundial-de-peso-medio-nwa/ SuperLuchas]
1) Sergio Sarabia b Javier Llanes
2) Enrique Vera, Superstar b ? [seeding battle royale]
## team advaanced directly to the final
3) Ángel Blanco, Dr. Wagner b Goro Tanaka, Tigre Colombiano [torneo, quarterfinal]
4) Audaz, El Halcón b Alfonso Dantes, Karloff Lagarde [torneo, quarterfinal]
5) Ángel Blanco, Dr. Wagner b Audaz, El Halcón [torneo, semifinal]
6) Ángel Blanco, Dr. Wagner b Enrique Vera, Superstar [torneo, final]
7) El Cobarde b Septiembre Negro [NWA MIDDLE, quarterfinal]
## battle royal set seeding. Finalists for vacant itlte would be determined on future show.
8) Adorable Ruvalcaba b Blue Demon [NWA MIDDLE, quarterfinal]
9) Tony Salazar b Ringo Mendoza [NWA MIDDLE, quarterfinal]
10) Anibal b Paco Pardinez [NWA MIDDLE, quarterfinal]

EMLL (SAT) 09/07/1974 Arena Puebla [Box Y Lucha 1144, https://www.patreon.com/posts/box-y-lucha-no-9-48057112 LuchaWorld]
1) Anibal  (c) b Perro Aguayo [MEX MIDDLE]

EMLL (SUN) 09/08/1974 Arena Coliseo
1) Ángel Blanco, Rudo Martin vs Enrique Vera, Ringo Mendoza
2) Alfonso Dantes vs Dr. Wagner, Coloso Colosetti, Cesar Valentino, Tigre Colombiano, Superstar, El Halcón, Tony Salazar [NWA LH, torneo]

EMLL (SUN) 09/08/1974 Arena Coliseo Guadalajara [El Informador 1974-09-08]
1) ? vs ??
2) ? vs ??
3) ? vs ??
4) Comando II, Luis Mariscal vs Memo Valles, Tony López
5) Comando I, Fishman, Karloff Lagarde vs Blue Demon, Ciclón Veloz Jr., Mano Negra

Indy (SUN) 09/08/1974 Arena Cuatro Caminos, Nuevo Laredo, Tamaulipas [Arena 840, RB]
1) Relámpago Gutierrez b El Adonis
## El Adonis is from Tampico
2) El Tartaro, Mil Máscaras, Villano III b Asesino Negro, Flama Roja, The Destroyer

Indy (SUN) 09/08/1974 Arena Marquez, la Fama, Nuevo Leon [RB]
1) El Fariseo, Euben Otero vs Lucero Moreno, Pequeño Diamante
2) Desastre, Mixteca vs El Marcado, Lupe Contreras
3) Índio Huichol, Many Martinez vs Abel Romhan, Cayetano Moreno

indy (SUN) 09/08/1974 Club Deportivo Antonio Cardenas, Saltillo, Coahuila
1) Chamaco Tormenta vs La Hiena
2) Chamaco Gloria vs Red Power
3) Costeñito Moy vs Halcón Morales
4) Dorado Del Norte, Relámpago Sam vs El Azteca, Imperio Rojo

Indy (SUN) 09/08/1974 Deportivo Guadalupe, Guadalupe, Nuevo Leon [Arena 840]
1) Balam, Dinámico b Dragon Rojo, Korak
2) Justiciero, Saeta Azul b Majestad I, Red Rebel
3) El Acorazado Rojo, El Renegado DQ Olímpico, Relámpago Ramírez

indy (SUN) 09/08/1974 Plaza de Toros Valente Arellano, Torreón, Coahuila [El Siglo de Torreon 1974-09-08]
1) Juanito García vs El Mulato
2) Jesus Chavez vs Eric el Rojo
3) Halcón Suriano vs The King
4) Cuauhtémoc Torres, Flama Azul, Polo Torres vs Espectro, Frankenstein, Mario Ramírez
5) Eduardo De Linch, Paco Pardines vs El Cobarde, Rikidozan

EMLL (TUE) 09/10/1974 Arena Coliseo [Box Y Lucha 1144, https://www.patreon.com/posts/box-y-lucha-no-9-48057112 LuchaWorld]
1) El Troyano b Tupamaro
2) El Talismán b Pepe Casas
3) Milo Ventura b Dick Angelo
4) Irazú b Vengador
5) Atila b Johnny Lezcano
6) Dardo Aguilar, Estrella Blanca DQ El Rebelde, León Negro
## Straight falls. Leon Negro was left bloody and his mask was ripped as well.
7) Black Shadow, José Escobedo, Martin Escobedo b Leo López, Perro Aguayo, Sergio Sarabia
## Tecnicos took 2/3.
&& matches set by battle royal (won by Atila)

EMLL (TUE) 09/10/1974 Arena Coliseo Guadalajara [El Informador 1974-09-10]
1) ? vs ??
2) ? vs ??
3) ? vs ??
4) El Cordobes, Mario Alcala vs Dr. O’Borman, Luis González
5) El Marquez, José Luis Mendieta, Pantera Negra vs El Faraón, Gemelo Diablo I, Roy Stive

EMLL (FRI) 09/13/1974 Arena México [Box Y Lucha 1144, Halcon 114, https://www.patreon.com/posts/box-y-lucha-no-9-48057112  LuchaWorld]
1) Dr. O’Borman b Johnny Lezcano
2) El Marques b Akio Murasaki
3) Paco Pardines b Septiembre Negro
4) Goro Tanaka, Karloff Lagarde b Ringo Mendoza, Tigre Colombiano
5) El Cobarde b Adorable Ruvalcaba [NWA MIDDLE, semifinal]
## Best match of the show, Cobrade took 1/3.
6) Anibal b Tony Salazar [NWA MIDDLE, semifinal]
## Anibal took 2/3
7) Enrique Vera, Superstar, Tony Stone b Ángel Blanco, Coloso Colosetti, Dr. Wagner
## Tecnicos took 2/3.

EMLL (FRI) 09/13/1974 Toluca, Estado de México [Box Y Lucha 1144, https://www.patreon.com/posts/box-y-lucha-no-9-48057112 LuchaWorld]
1) Enrique Vera  (c) b Alfonso Dantes [MEX HEAVY]

EMLL (SUN) 09/15/1974 Arena Coliseo [Arena 840, RB]
1) Guerrillero Valentino, Manuel Robles, Rudo Martin vs Black Shadow, José Escobedo, Martin Escobedo
## Rudo Martin recently turned tecnico.

EMLL (SUN) 09/15/1974 Arena Coliseo Guadalajara [El Informador 1974-09-15]
1) ? vs ??
2) ? vs ??
3) ? vs ??
4) Índio Jerónimo, Perro Aguayo vs Mario Alcala, Tony López
5) Alfonso Dantes, Babe Face, Fishman vs Mano Negra, Ringo Mendoza, Super Star

indy (SUN) 09/15/1974 Plaza de Toros Valente Arellano, Torreón, Coahuila [El Siglo de Torreon 1974-09-15]
1) Rayito Sanchez vs Guapo Ibarra
2) Juanito García vs Eric el Rojo
3) Halcón Suriano vs The King [super libre]
4) Chucho Villa, Cuauhtémoc Torres vs Jungla Negra, Manny Águilar
5) Eduardo De Linch, Enrique Vera, Raúl Reyes vs Coloso Colosetti, El Nazi, Frankenstein

Moreno (SUN) 09/15/1974 Arena San Bartolo, Naucalpan, Estado de México [Arena 840, RB]
1) Memo Ventura b Zimba [ASB WELTER]

EMLL (MON) 09/16/1974 Arena Coliseo Guadalajara [El Informador 1974-09-16]
1) ? vs ??
2) ? vs ??
3) ? vs ??
4) El Cordobes, El Ídolo vs El Faraón, Roy Stive
5) Mil Caras, Pantera Negra, Ringo Mendoza vs Alfonso Dantes, Comando I, Comando II
## debut of Mil (future Cien Caras)

indy (MON) 09/16/1974 Cancha San Pedro, Atencingo, Chietla, Puebla [KO 1170]
1) Relámpago b Vengador Negro
2) Gardenio b Ray Cóndor
3) Puma, Tony García DRAW Fili Guerrero, Lilo
4) Dos Caras, El Cóndor b Jibaro, Juan Colorado [mask]
&& may be Arena Puebla

Indy (MON) 09/16/1974 Plaza De Toros, Mérida, Yucatan [Arena 840, RB]
1) El Santo, Huracán Ramírez vs Rene Guajardo, Tony Salazar

EMLL (FRI) 09/20/1974 Arena México [Arena 840, Box y Lucha 3519 (reprint), https://www.facebook.com/photo.php?fbid=576087485772324&set=a.461505387230535.102143.454597374588003&type=1 DJ Spectro, Halcon 117, http://wrestlingclassics.com/.ubb/ultimatebb.php?ubb=get_topic;f=1;t=146551#000000 Matt Farmer]
** EMLL 41st Anniversary Show
1) Rizado Ruiz b César Silva
2) El Marquez b Cesar Valentino
3) Paco Pardinez b Black Shadow
4) Ringo Mendoza DRAW Rubí Ruvalcaba
5) Alfonso Dantes, Goro Tanaka b Tigre Colombiano, Tony Stone
## Halcon lists Tony Salazar, other magazines say it was Tony Stone.
6) Anibal b El Cobarde [NWA MIDDLE, final]
## Tournament final for vacant title. Rene Guajardo had been champion but left EMLL. Anibal wasn't long for EMLL either.
7) Ángel Blanco, Dr. Wagner b Enrique Vera, Superstar [mask, hair]
## Super Star is Armando Lopez, 26, from Guadalajara but currently living in Los Angeles. Wagner was about to turn tecnico but still rudo here.

indy (FRI) 09/20/1974 Plaza de Toros La Monumental, Monterrey, Nuevo León [Halcon 117]
1) El Matematico, Villano III b Corzo I, Corzo II

EMLL (SAT) 09/21/1974 Pista Arena Revolución [Arena 840, Halcon 117, RB]
1) Mario Rocca b El Polaco
2) Tino Herrera DQ Atila
3) Rodolfo Ruiz b Milo Ventura
## return of Ruiz
4) Villano I DRAW Iván El Bronco
5) Tauro  (c) b Dardo Aguilar [MEX LIGHT]
## 9th defense
