
/**********************
luchadb archive (for year 1976)
export started at 2023-10-05 17:26:53
export finished at 2023-10-05 17:29:26

particular parser syntax for nerds:

PROMOTION (DAY) MM/DD/YYYY ArenaName [linkURL linkName]
MatchNo) side1-1, side1-2, side1-3 DECISION side2-1, side2-2, side2-3 [matchstip]

special codes 
(c) champion obviously
## note attached to preeceding match
&& note attached to event
%% attendence (always integer, always suspect) 
** event name
**********************/
indy (THU) 01/01/1976 Monterrey, Nuevo León [Halcon 186]
1) Lobo Rubio L Atila, Humberto Garza [hair]
## Atila took Lobo Rubio's hair with Garza also involved

EMLL (FRI) 01/02/1976 Arena Coliseo [Box Y Lucha 1212]
1) El Invasor b Marcos Alcala
2) Gorilita Flores b Tauro
3) Tino Herrera b Escorpión I
4) Leo López b Flama Azul
5) Bruno Victoria b Halcón Dorado
6) Tony Salazar b José Luis Mendieta
## Return of JLM
7) Dr. Wagner, El Halcón, Mano Negra DQ Adorable Rubi, Coloso Colosetti, Raúl Reyes
## Tecnicos took 2/3. Rubi unmasked Wagner for the DQ.
&& strong turnout

EMLL (SUN) 01/04/1976 Arena Coliseo Guadalajara [El Informador 1976-01-04]
1) ? vs ??
2) ? vs ??
3) ? vs ??
4) Cachorro Mendoza, Máscara Roja vs Araña Atómica, Iván El Bronco
5) Alberto Muñoz, Enrique Vera, Raúl Mata vs Alfonso Dantes, Gemelo Diablo I, Gemelo Diablo II

indy (SUN) 01/04/1976 Coliseo Olimpico Universidad de Guadalajara, Guadalajara, Jalisco [http://www.facebook.com/LuchaLibreDeAyerdeHoyYSiempre/posts/865747460139657 DJ Spectro]
1) El Vengador b Satánico [mask]

indy (SUN) 01/04/1976 Plaza de Toros el Progreso, Guadalajara, Jalisco [El Informador 1976-01-04]
1) ? vs ??
2) ? vs ??
3) Cesar Valentino, Renato Torres vs El Galeno, Pantera Negra
4) El Solitario, Sunny War Cloud vs Ángel Blanco, TNT
5) Rene Guajardo  (c) vs Anibal [UWA MIDDLE]

indy (SUN) 01/04/1976 Plaza de Toros Valente Arellano, Torreón, Coahuila [El Siglo de Torreon 1976-01-04]
1) ? vs ??
2) ? vs ??
3) Vicente Nuño vs Ruben Palma
4) Eric el Rojo, Satán vs Halcón Suriano, Tony Escobedo
5) Jungla Negra I, Jungla Negra II, Pelón Águilar vs Cuauhtémoc Torres, La Sombra, Mario Ramírez

EMLL (TUE) 01/06/1976 Arena Coliseo [Box Y Lucha 1212]
1) Titanic vs Toro Toro
2) El Troyano vs Bufalo Salvaje
3) El Trueno vs El Invasor
4) Cachorro Mendoza, Flama Azul vs Rodolfo Ruiz, Roy Steve
5) Chucho Villa, Halcón Dorado vs Escorpión I, Escorpión II
6) Chino Chow, Gallo Tapado, José Luis Mendieta vs Demonio Blanco, El Nazi, Tony Salazar

EMLL (TUE) 01/06/1976 Arena Coliseo Guadalajara [El Informador 1976-01-06]
1) ? vs ??
2) ? vs ??
3) ? vs ??
4) Cesar Curiel, Cinta Negra vs Calavera I, Memo Valles
5) El Faraón, Raúl Mata, Ringo Mendoza vs Comando I, Comando II, Septiembre Negro

EMLL (WED) 01/07/1976 Arena Coliseo Acapulco, Acapulco, Guerrero [Halcon 188]
1) Mr. Lancer b The Ranger
2) Lucifero b Polaco
3) Chino Chow, Mr. Tempest DQ Escorpión I, Escorpión II
## Escorpion unmasked Tempest for the DQ
4) Adorable Rubi, Karloff Lagarde, Perro Aguayo b El Halcón, Mano Negra, Ringo Mendoza

indy (THU) 01/08/1976 Arena Apatlaco, Iztapalapa, Distrito Federal [Box Y Lucha 1212]
1) Marcos Alcala vs Gran Davis
2) Mario Alcala vs Scaramouche II
3) Tony López vs Manuel Robles
4) Gallo Tapado, Mano Negra vs Karloff Lagarde, Tony Salazar

indy (THU) 01/08/1976 Mexicali, Baja California
1) Ray Mendoza  (c) b El Solitario [UWA LH]
&& may be February 8th

EMLL (FRI) 01/09/1976 Arena Coliseo [Box Y Lucha 1212, Halcon 186]
1) Gorilla Flores b El Suriano
2) Mr. Steel TLDRAW Roy Steve
## 20 minute draw
3) Cachorro Mendoza b Huroki Sito
4) Leo López b Chucho Villa
5) José Luis Mendieta b Demonio Blanco
6) Bruno Victoria b Chino Chow
7) Adorable Rubi, Gemelo Diablo I, Gemelo Diablo II b Dr. Wagner, El Halcón, Ringo Mendoza
## Gemelos going by Hijos del Infierno now. Rudos took 1/3.

EMLL (SAT) 01/10/1976 Pista Arena Revolución [Box Y Lucha 1212]
1) Mr. Lancer vs Mario Rocca
2) Estrella Blanca, Mano Negra vs Coloso Colosetti, Manuel Robles and Dardo Aguilar, El Faraón and Espectro I, Espectro II and Cacique Mara, Tony López and Demonio Blanco, El Polaco and Flama Azul, Mr. Tempest and Escorpión I, Escorpión II [tornoe]

indy (SAT) 01/10/1976 Arena Zapata, Cuautla, Morelos [Box Y Lucha 1212]
1) Hawfman vs El Remolino
2) Rudy Espinosa vs Rudy Vazquez
3) Misterio Blanco I vs Arturo Cruz
4) Muerte De La Barranca I, Muerte De La Barranca II vs Bengala I, Bengala II
5) Dos Caras, Potro Salvaje, Tawa Vera vs Budy Montes, Chimaco, Escorpión

EMLL (SUN) 01/11/1976 Arena Coliseo [Box Y Lucha 1212]
1) Talismán vs Irazú
2) Marcos Alcala, Mario Alcala vs Dick Angelo, Rodolfo Ruiz and Rafael Salamanca, Tino Herrera and Dr. O’Borman, Tauro
3) Blue Demon, Gallo Tapado vs Coloso Colosetti, El Nazi and El Faraón, Ringo Mendoza and Karloff Lagarde, Tony Salazar [torneo]

EMLL (SUN) 01/11/1976 Arena Coliseo Guadalajara [El Informador 1976-01-11]
1) ? vs ??
2) ? vs ??
3) ? vs ??
4) Cinta Negra, El Ídolo, El Vengador vs Comando II, Pantera Azul, Septiembre Negro
5) Alberto Muñoz, Cien Caras vs Judas, Perro Aguayo

EMLL (SUN) 01/11/1976 Pista Arena Revolución [Box Y Lucha 1212]
1) Impacto vs Toro Toro
2) El Troyano vs El Invasor
3) Scaramouche I vs Roy Lancer
4) Gorilla Flores vs Flama Azul
5) Chucho Villa, Mr. Steel vs Huroki Sito, Leo López
6) El Halcón, José Luis Mendieta vs Adorable Rubi, Bruno Victoria

indy (SUN) 01/11/1976 Arena San Juan Pantitlan, Ciudad Nezahualcóyotl, Estado de México [Box Y Lucha 1212]
1) ? vs ??
## too blury to read
2) Misterio Blanco II vs Jorge Ortiz
3) Chivo Martinez vs Misterio Blanco I
4) Muerte De La Barranca I, Muerte De La Barranca II vs Bengala I, Bengala II
5) Dos Caras, Potro Salvaje vs Buddy Montes, Escorpión

indy (SUN) 01/11/1976 Pachuca, Hidalgo [Halcon 186]
1) Dr. Misterio, Tino Arreita  (c) vs Alberto Ventura, Golden Boy [HIDALGO TAG]

indy (SUN) 01/11/1976 Plaza de Toros Valente Arellano, Torreón, Coahuila [El Siglo de Torreon 1976-01-11]
1) Tony Arellano vs Joe Marquina
2) Rayito Sanchez vs Índio Navajo
3) Halcón Suriano vs Eric el Rojo
4) La Sombra, Ruben Palma vs Satán, Vicente Nuño
5) Astro Rey, Cuauhtémoc Torres, Mario Ramírez vs Jungla Negra I, Jungla Negra I, Pelón Águilar

EMLL (TUE) 01/13/1976 Arena Coliseo [Box Y Lucha 1214]
1) El Maldito b Titanic
2) El Suriano b Gran Davis
3) Chucho Villa, Halcón Dorado b Manuel Robles, Rizado Ruiz
4) El Invasor b Mario Rocca
5) Cachorro Mendoza, Flama Azul b Rodolfo Ruiz, Tauro
6) El Cobarde, Gallo Tapado, Pepin Mendieta b Demonio Blanco, El Nazi, Tony Salazar
## Tecnicos took 1/3. Tony Salazar bled from the face.

EMLL (TUE) 01/13/1976 Arena Coliseo Guadalajara [El Informador 1976-01-13]
1) ? vs ??
2) ? vs ??
3) ? vs ??
4) El Monarca, Remo vs Black Killer, Iván El Bronco
5) Enrique Vera, Máscara Roja, Ringo Mendoza vs Comando I, Comando II, Perro Aguayo

indy (TUE) 01/13/1976 Cuautitlán, Estado de México [Halcon 187]
1) el Signo, Scorpió, Zeus b El Cóndor, El Húngaro, Tawa Vera
2) Cesar Valentino, Lobo Rubio, Ray Mendoza b Anibal, Huracán Ramírez, Sunny War Cloud

indy (THU) 01/15/1976 Cuernavaca, Morelos [Halcon 187]
1) Ringo Mendoza  (c) vs Adorable Rubi [MEX MIDDLE]

EMLL (FRI) 01/16/1976 Arena Coliseo [Box Y Lucha 1214, Halcon 187]
1) Mr. Lancer b Ángel Negro
2) Dr. O’Borman b Dardo Aguilar
3) Espectro Jr. b Flama Azul
## spectacular match
4) Leo López b Halcón Dorado
## Halcon Dorado is an emergecy sub for Mr. Tempest. Leo Lopez fell on Tempest head during the battle royal, knocking him out. Tempest was out for 10 minutes, with fear for his life, but  seemed relatively fine when he woke up, but ordered to rest for a few weeks. Lopez was shaken up by the whole thing.
5) Bruno Victoria b Gallo Tapado
6) Pepin Mendieta b Demonio Blanco
7) Gemelo Diablo I, Gemelo Diablo II DCOR El Halcón, Ringo Mendoza
## Gemelos took 1, tencicos 2, Gemelo I dived onto Halcon and Ringo onto Gemelo II
8) Dr. Wagner DQ Adorable Rubi
## Wagner took 2/3, both by DQ
&& battle royal set many of the matches

indy (FRI) 01/16/1976 Milpa Alta, Distrito Federal [Halcon 188]
1) Fantasma Plateado b Satanic [mask]
## finales of ruleta de la muerte

EMLL (SUN) 01/18/1976 Arena Coliseo Guadalajara [El Informador 1976-01-18]
1) ? vs ??
2) ? vs ??
3) ? vs ??
4) El Vengador  (c) vs Septiembre Negro [OCCIDENTE LH]
5) Blue Demon, Ciclón Veloz Jr., Enrique Vera vs Alfonso Dantes, Judas, Perro Aguayo

indy (SUN) 01/18/1976 Pachuca, Hidalgo [Halcon 187]
1) Dr. Wagner  (c) b Rey Neptuno [HIDALGO WELTER]

indy (SUN) 01/18/1976 Plaza de Toros Valente Arellano, Torreón, Coahuila [El Siglo de Torreon 1976-01-18]
1) ? vs ??
2) ? vs ??
3) ? vs ??
4) Halcón Suriano, Ruben Palma vs Pelón Águilar, Vicente Nuño
5) César Silva, Chino Chow, Polo Torres vs Gran Markus, Rizado Ruiz, Sangre Chicana

indy (SUN) 01/18/1976 Toluca, Estado de México [Halcon 187]
1) Leo Pineda, Ramsés vs Marthe, Toluco [EdM TAG]

EMLL (TUE) 01/20/1976 Arena Coliseo [Box Y Lucha 1214]
1) El Maldito b Mr. Lancer
2) El Suriano DRAW Roy Lancer
3) El Invasor DQ Agente X
4) Cachorro Mendoza, Flama Azul b Polaco, Tauro
5) Espectro I, Espectro Jr. b Estrella Blanca, Tony López
## Espectros took 1/3.
6) Demonio Blanco, Fishman, Tony Salazar b El Cobarde, Gallo Tapado, José Luis Mendieta
## Mendieta bloodied. Straight falls, rudos DQed in both.

EMLL (TUE) 01/20/1976 Arena Coliseo Guadalajara [El Informador 1976-01-20]
1) ? vs ??
2) ? vs ??
3) ? vs ??
4) Cesar Curiel, Remo vs Calavera I, Calavera II
5) Blue Demon, Ciclón Veloz Jr., Máscara Roja vs Comando I, Comando II, Perro Aguayo

indy (TUE) 01/20/1976 Gimnasio Municipal Lic. Benito Juárez, Cuautitlán, Estado de México [Halcon 187, Halcon 188]
1) Ray Mendoza, Villano III ?? Ángel Blanco, Cesar Valentino
## happened but not result mentioned
2) Homnre Nuclear b Lobo Rubio
3) El Húngaro  (c) b el Signo [EDM LIGHT]
## straight falls, first by DQ
4) Anibal, Kung Fu, Pepe Casas b El Greco, Scorpió, Tigre Hispano
## debut of Kung Fu, replacing Condor
5) Zeus b Tawa Vera [hair]

MORA (TUE) 01/20/1976 Arena Aficion [Box Y Lucha 1214]
1) Comunista Mao vs Blue Prince II
2) Tupamaro vs Lalo Montenegro
3) Dos Caras, Huracán Ramírez, Sunny War Cloud vs Babe Face, Golden Rogers, TNT
4) Villano III  (c) vs Hashi Masataka [UWA WELTER]
&& Halcon 188 seems to have this on 01/27 (just says hoy)

EMLL (THU) 01/22/1976 Arena Apatlaco, Iztapalapa, Distrito Federal [Box Y Lucha 1214]
1) Ángel Negro vs Titanic
2) Tino Herrera vs Tauro
3) Tony López vs Escorpión I
4) Blue Demon, El Cobarde vs El Nazi, Fishman

EMLL (FRI) 01/23/1976 Arena Coliseo [Box Y Lucha 1214, Box Y Lucha 1215, Halcon 188]
1) Roy Lancer b Marcos Alcala
2) El Polaco b Flama Azul
3) Dr. O’Borman b Dardo Aguilar
4) Demonio Blanco b Mar Allah
## Mr. Tempest originally announced, but out after his injury last week. Box Y Lucha says it was by Cacique Mara, who may just be a nickname
5) Espectro Jr. b Gallo Tapado
## Espectro started bleeding from the mouth both seemed OK
6) José Luis Mendieta, Mano Negra vs Bruno Victoria, Gemelo Diablo I
7) Adorable Rubi, Gemelo Diablo I b Dr. Wagner, El Halcón
## Gemelo Diablo II pulled a switch in the second fall with his brother, helping them win that fall. Gemelo I replaced him again in the third to get the win.

EMLL (SAT) 01/24/1976 Pista Arena Revolución [Box Y Lucha 1214]
1) El Talismán vs Toro Toro
2) El Troyano vs Bufalo Salvaje
3) Mr. Steel vs Roy Lancer
4) Mario Alcala vs Satán
5) Estrella Blanca vs Escorpión II
6) Cachorro Mendoza, Chucho Villa vs Huroki Sito, Leo López
7) Chino Chow, El Cobarde, Ringo Mendoza vs El Nazi, Fishman, Karloff Lagarde

indy (SAT) 01/24/1976 Arena Zapata, Cuautla, Morelos [Box Y Lucha 1214]
1) Rostro I vs Memo Arenas
2) Apolo Chino I, Apolo Chino II vs El Socio, Sanguriano
3) Budy Montes, Puma Solitario vs Kenji Kaplin, Taro Yonekura
4) El Matematico, Misterio Blanco I vs Chacal De La Rosa, Príncipe Odin

EMLL (SUN) 01/25/1976 Arena Coliseo [Box Y Lucha 1214]
1) El Trueno vs Gran Davis
2) Gorilla Flores vs Scaramouche I
3) Tino Herrera vs Escorpión I
4) Cacique Mara, Tony López vs Espectro I, Manuel Robles
5) Blue Demon, Cien Caras, El Faraón vs Coloso Colosetti, Judas, Tony Salazar

EMLL (SUN) 01/25/1976 Arena Coliseo Guadalajara [El Informador 1976-01-25]
1) ? vs ??
2) ? vs ??
3) ? vs ??
4) Máscara Roja, Raúl Torres vs Comando I, Sangre Chicana
5) Ciclón Veloz Jr., El Halcón, Ringo Mendoza vs Alfonso Dantes, Perro Aguayo, Rubí Ruvalcaba

EMLL (SUN) 01/25/1976 Pista Arena Revolución [Box Y Lucha 1214]
1) Impacto vs Oso Blanco
2) El Suriano vs Roy Lancer
3) Agente X vs Demonio Blanco
4) Flama Azul vs Tauro
5) Halcón Dorado, Rafael Salamanca vs Espectro Jr., Leo López
6) José Luis Mendieta, Mano Negra vs Bruno Victoria, Karloff Lagarde

indy (SUN) 01/25/1976 Arena Raff, Ciudad Nezahualcóyotl, Estado de México [Halcon 188]
1) Dimensión X, El Insólito, Ultraman vs Cavernario Galindo, Villano I, Villano II

indy (SUN) 01/25/1976 Arena San Fernando, Huixquilucan, Estado de México [Box Y Lucha 1214]
1) Mohicano vs Maricano
2) Mr. Alvador vs Firlandes Volador
3) Rey Duran vs Nitro As
4) Destructor Nazi vs Tartaro Salvaje
5) Cuasimodo, Nanoc La Momia vs Molusco, Rodan X

indy (SUN) 01/25/1976 Arena San Juan Pantitlan, Ciudad Nezahualcóyotl, Estado de México [Box Y Lucha 1214]
1) El Socio vs Memo Arenas
2) El Chacal I vs Saeta Hernández
3) Soberbio I, Soberbio II vs Kenji Kaplin, Taro Yonekura
4) El Puma Solitario, Potro Salvaje vs Buddy Montes, Chivo Martinez
5) El Matematico, Misterio Blanco I vs Chacal De La Rosa, Príncipe Odin

indy (SUN) 01/25/1976 Plaza de Toros La Monumental, Monterrey, Nuevo León [https://www.facebook.com/boxylucha.net/posts/10153512200176559 Box Y Lucha]
1) Sugi Sito b Gran Hamada [lucha de Kimonos]
## Both were dressed in Kimonos.

indy (SUN) 01/25/1976 Plaza de Toros Valente Arellano, Torreón, Coahuila [El Siglo de Torreon 1976-01-25]
1) ? vs ??
2) ? vs ??
3) Índio Navajo vs Halcón Suriano
4) Espanto III, Hermes, Pelón Águilar vs La Sombra, Ruben Palma, The King
5) Gemelo Diablo I, Yuma vs Astro Rey, César Silva
## Gemelo Diablo I unmasked

indy (SUN) 01/25/1976 Toluca, Estado de México [Halcon 188]
1) Rommel b Tony Sugar [hair]

EMLL (TUE) 01/27/1976 Arena Coliseo [Box Y Lucha 1215]
1) Mr. Lancer vs Toro Toro
2) El Talismán vs Impacto
3) Gorilla Flores vs El Invasor
4) Cachorro Mendoza, Rafael Salamanca vs Dick Angelo, El Polaco
5) Chucho Villa, Estrella Blanca vs Escorpión I, Escorpión II [super libre]
6) El Cobarde, Gallo Tapado, José Luis Mendieta vs Demonio Blanco, Fishman, Tony Salazar

EMLL (TUE) 01/27/1976 Arena Coliseo Guadalajara [El Informador 1976-01-27]
1) ? vs ??
2) ? vs ??
3) ? vs ??
4) El Monarca, Luis Vera vs Iván El Bronco, Satánico
5) Ciclón Veloz Jr., El Vengador, Ringo Mendoza vs Perro Aguayo, Rubí Ruvalcaba, Septiembre Negro

EMLL (WED) 01/28/1976 Arena Coliseo Acapulco, Acapulco, Guerrero [Halcon 240]
1) Talismán b Mario Valenzuela
2) Huroki Sito b Lucifer
3) Cesar Valentino, Judas DRAW Cien Caras, Mano Negra
4) Tauro  (c) b Yanco [MEX LIGHT]
5) Ringo Mendoza  (c) b Adorable Rubi [MEX MIDDLE]
&& gate of 50,1980

indy (THU) 01/29/1976 Arena Apatlaco, Iztapalapa, Distrito Federal [Box Y Lucha 1215]
1) Ángel Negro vs Gran Davis
2) Marcos Alcala vs Roy Steve
3) Chino Chow vs Rizado Ruiz
4) El Cobarde, Ringo Mendoza vs Adorable Rubi, Karloff Lagarde

indy (THU) 01/29/1976 Arena Toluca, Toluca, Estado de México [Halcon 190]
1) Marthe b Leo Pineda [hair]

EMLL (FRI) 01/30/1976 Arena Coliseo [Box Y Lucha 1215]
1) Irazú vs Roy Lancer
2) Mario Alcala vs Roy Steve
3) Cachorro Mendoza vs Rodolfo Ruiz
4) Cacique Mara vs Leo López
5) Tony López vs Espectro Jr.
6) José Luis Mendieta vs Bruno Victoria
7) Blue Demon, El Halcón, Ringo Mendoza vs Adorable Rubi, Gemelo Diablo I, Gemelo Diablo II

EMLL (SAT) 01/31/1976 Pista Arena Revolución [Box Y Lucha 1215]
1) Titanic vs Toro Toro
2) Troyano vs Gran Davis
3) Tino Herrera vs Satán
4) Halcón Dorado vs El Polaco
5) Chucho Villa, Dardo Aguilar vs Demonio Blanco, Dr. O’Borman
6) El Cobarde, Mano Negra, Ringo Mendoza vs El Nazi, Fishman, Karloff Lagarde

indy (SAT) 01/31/1976 Arena Zapata, Cuautla, Morelos [Box Y Lucha 1215]
1) Jinete Negro vs Memo Arenas
2) El Sanguinario, Puma Solitario vs Apolo Chino I, Apolo Chino II
3) Toña La Tapatia vs Karina
4) Chamaco Ortiz, Ultraman vs Budy Montes, Rolando Manzur
5) Hashi Masataka vs Greco

EMLL (SUN) 02/01/1976 Arena Coliseo [Box Y Lucha 1215]
1) Mario Rocca vs Oso Blanco
2) Mr. Steel vs Huroki Sito
3) Astro Boy vs Rizado Ruiz
4) César Silva, Chino Chow vs Espectro I, Manuel Robles
5) Cien Caras, El Faraón, Mano Negra vs Coloso Colosetti, Judas, Tony Salazar

EMLL (SUN) 02/01/1976 Arena Coliseo Guadalajara [El Informador 1976-02-01]
1) ? vs ??
2) ? vs ??
3) ? vs ??
4) Iván El Bronco, Septiembre Negro vs Cinta Negra, El Vengador
5) Alfonso Dantes, Perro Aguayo, Sangre Chicana vs Ciclón Veloz Jr., El Halcón, Ringo Mendoza

EMLL (SUN) 02/01/1976 Arena Coliseo Monterrey [Halcon 190]
1) Alberto Muñoz, Enrique Vera, Henry London b Gemelo Diablo I, Gemelo Diablo II, Nazi
2) Médico I, Médico II b Espanto III, The King I [hair]
## Medico's faces were exposed via ripped masks but they still won
3) Dr. Wagner  (c) b Raúl Reyes [NWA LH]
## bad match
&& disppointing show

EMLL (SUN) 02/01/1976 Pista Arena Revolución [Box Y Lucha 1215]
1) Ángel Negro vs Toro Toro
2) Impacto vs Roy Steve
3) Agente X vs Dick Angelo
4) Tino Herrera vs Rodolfo Ruiz
5) Mr. Tempest, Tony López vs Demonio Blanco, Escorpión I
6) Blue Demon, José Luis Mendieta vs Adorable Rubi, Bruno Victoria

indy (SUN) 02/01/1976 Arena San Fernando, Huixquilucan, Estado de México [Box Y Lucha 1215]
1) Irlandes Volador vs Ocndor Del Misterio
2) Acuario Bc vs Paladin
3) El Galante vs Rudy Cruz
4) Corsman vs Kid Látigo
5) Felix Lozada, Molusco, Roberto Lodaza vs Destructor Nazi, Nanoc La Momia, Tartaro Salvaje

indy (SUN) 02/01/1976 Arena San Juan Pantitlan, Ciudad Nezahualcóyotl, Estado de México [Box Y Lucha 1215]
1) Jinete Negro vs Memo Arenas
2) Puma Solitario vs Bárbaro Fonseca
3) Kenji Kaplin, Tayo Yonekura vs Soberbio I, Soberbio II
4) Chamaco Ortiz, Potro Salvaje vs Chivo Martinez, Rolando Manzur
5) El Matematico, Hashi Masataka vs Buddy Montes, Príncipe Odin

indy (SUN) 02/01/1976 Club Deportivo Antonio Cardenas, Saltillo, Coahuila
1) Faisan Dorado vs La Furia
2) Ronco Lopez vs Tony Gut
3) Costeñito Moy, La Hiena vs Halcón Morales, Rudy Gloria
4) Capitán American, Tizoc Sandoval vs El Arquitecto, Milo Caballero

indy (SUN) 02/01/1976 Plaza de Toros Valente Arellano, Torreón, Coahuila [El Siglo de Torreon 1976-02-01]
1) ? vs ??
2) ? vs ??
3) ? vs ??
4) Flama Azul, Hermano Alcala I, Hermano Alcala I vs Hermes, Pelón Águilar, Vicente Nuño
5) Cacique Mara, El Nómada vs El Polaco, Escorpión II

MORA (SUN) 02/01/1976 Plaza de Toros La Monumental, Monterrey, Nuevo León [Halcon 190]
1) José Torres b Remington [NORTE HEAVY, final]
## billed as the first person to hold this title. Other matches on previous shows?
2) Remington b Dick Medrano [NORTE HEAVY, semifinal]
3) José Torres b Tormenta II [NORTE HEAVY, semifinal]
4) Remington b Rubén Juárez [NORTE HEAVY, quarterfinal]
5) José Torres b Tormenta I [NORTE HEAVY, quarterfinal]
6) Mario Segura, Pequeño Diamante b Kirvan Kid, Renegado
7) Humberto Garza, Rubén Juárez b La Momia, Mazambula El Brujo
8) Anibal, El Solitario b Ángel Blanco, Rene Guajardo
9) Villano III  (c) b Babe Face [UWA WELTER]

EMLL (TUE) 02/03/1976 Arena Coliseo Guadalajara [El Informador 1976-02-03]
1) ? vs ??
2) ? vs ??
3) ? vs ??
4) Cesar Curiel, El Monarca vs Black Killer, Memo Valles
5) Ciclón Veloz Jr., El Halcón, Máscara Roja vs Comando I, Comando II, Perro Aguayo
&& Diablo Velasco 40 year anniversary celebration

indy (TUE) 02/03/1976 Auditorio, Cuautitlán, Estado de México [Halcon 190]
1) el Signo b Liviathan  (c) [EDM JW]
## Junior Welterweight title change
2) Cesar Valentino, El Vikingo, Renato Torres vs ?, ??, ???
3) Anibal, Tawa Vera, Ultraman vs Scorpió, Tigre Hispano, Zeus
## Ultraman billed as Ultramar spelling out in the recap

EMLL (FRI) 02/06/1976 Arena Coliseo [Halcon 190]
1) Marcos Alcala b Gran Davis
2) Enrique Vera, Gallo Tapado b Coloso Colosetti, Espectro Jr. [quarterfinal]
3) El Halcón, Mr. Tempest b El Nazi, Leo López [quarterfinal]
## Halcon is out of contract with EMLL and public about it, but still wrestling in EMLL on a verbal deal
4) Adorable Rubi, Bruno Victoria b Cacique Mara, Chino Chow [quarterfinal]
5) ?, José Luis Mendieta b Demonio Blanco, Raúl Reyes [quarterfinal]
6) Adorable Rubi, Bruno Victoria b El Halcón, Mr. Tempest [semifinal]
7) ?, José Luis Mendieta b Enrique Vera, Gallo Tapado [semifinal]
8) Adorable Rubi, Bruno Victoria b ?, José Luis Mendieta [final]

EMLL (SAT) 02/07/1976 Pista Arena Revolución [Halcon 190]
1) Bufalo Salvaje b Troyano [mask]
## Troyano is Juan Antonio Gomez Arellano (under the mask since 1969, trained by Pedro Bolanos), says he's retiring.
2) Ringo Mendoza  (c) vs Fishman [MEX MIDDLE]

EMLL (SUN) 02/08/1976 Arena Coliseo Guadalajara [El Informador 1976-02-08]
1) ? vs ??
2) ? vs ??
3) ? vs ??
4) Alfonso Dantes, Gemelo Diablo I, Sangre Chicana vs Alberto Muñoz, Dr. Wagner, Mano Negra
5) Perro Aguayo  (c) vs Ringo Mendoza [NWA MIDDLE]

indy (SUN) 02/08/1976 Toluca, Estado de México [Halcon 190]
1) Danny Cruz, Lobo Rubio, Pepe Casas vs Cid, Marthe, Toluco

MORA (SUN) 02/08/1976 Plaza de Toros La Monumental, Monterrey, Nuevo León [Halcon 192]Attendance: 18000
1) Masataka b Villano III
&& date is a guess

EMLL (TUE) 02/10/1976 Arena Coliseo Guadalajara [El Informador 1976-02-10]
1) ? vs ??
2) ? vs ??
3) ? vs ??
4) Comando I, Comando II vs Cesar Curiel, Máscara Roja
5) Alfonso Dantes, Sangre Chicana vs Dr. Wagner, Mano Negra

indy (WED) 02/11/1976 Arena Veracruz, Veracruz, Veracruz [Halcon 190]
1) Ray Mendoza  (c) vs Anibal [UWA LH]

EMLL (FRI) 02/13/1976 Arena Coliseo [http://superluchas.com/2015/02/13/en-un-dia-como-hoy-1976-bruno-victoria-destroza-el-faraon-1959-guerra-de-empresas-en-durango/ SuperLuchas]
1) Dick Angelo b Agente X
2) Satán b Rafael Salamanca
3) Manuel Robles DRAW Chucho Villa
4) Cacique Mara b Demonio Blanco
5) Leo López b Chino Chow
6) Bruno Victoria DQ El Faraón
## straight falls, Faraon fouling Victoria to end a bloody match
7) Dr. Wagner, El Halcón, Enrique Vera b Adorable Rubi, Cesar Valentino, Judas

EMLL (SUN) 02/15/1976 Arena Coliseo Guadalajara [El Informador 1976-02-15]
1) ? vs ??
2) ? vs ??
3) ? vs ??
4) El Monarca, Máscara Roja vs Comando II, Sangre Chicana
5) Alberto Muñoz, Dr. Wagner, Mano Negra vs Gemelo Diablo I, Gemelo Diablo II, Rubí Ruvalcaba

indy (SUN) 02/15/1976 Deportivo Talleres, Monterrey, Nuevo Leon [Halcon 192]
1) Apache I, Atila Jr. b Kriminal I, Kriminal II [mask]
## Kriminals are Mundo and Joe Perez

indy (SUN) 02/15/1976 Plaza de Toros Valente Arellano, Torreón, Coahuila [El Siglo de Torreon 1976-02-15]
1) Tony Arellano vs Guapo Ibarra
2) Jesus Chavez vs Índio Navajo
3) Ruben Palma vs Eric el Rojo
4) Hermes, Pelón Águilar vs La Sombra, Mr. Niebla
5) Gran Markus, Judas vs El Halcón, Polo Torres

MORA (SUN) 02/15/1976 Plaza de Toros La Monumental, Monterrey, Nuevo León [Halcon 192]
1) Milo Milan b Ricardo Arroyo
2) Hermano Corzo I, Hermano Corzo II b Mario Segura, Pequeño Diamante
3) Masataka, Ultraman b Villano II, Villano III
4) José Torres, Rubén Juárez DQ Bello Greco, Ray Mendoza
5) Remington L Anibal, Mazambula El Brujo [mask]
## Mazambula escaped first, Anibal beat Remington. Remington gave his name as Jose Luis from Tampico.

EMLL (TUE) 02/17/1976 Arena Coliseo Guadalajara [El Informador 1976-02-17]
1) ? vs ??
2) ? vs ??
3) ? vs ??
4) Cinta Negra, El Vengador vs Black Killer, Iván El Bronco
5) Dr. Wagner, Mano Negra vs Rubí Ruvalcaba, Septiembre Negro

indy (WED) 02/18/1976 Veracruz, Veracruz [Halcon 192]
1) Villano I b Johnny Lezcano [mask]

EMLL (FRI) 02/20/1976 Arena Coliseo [Halcon 192]
1) El Trueno b Invasor
2) Estrella Blanca b Huroki Sito
3) César Silva b Espectro Jr.
4) Leo López b Halcón Dorado
## Dorado replaced Tony Lopez
5) José Luis Mendieta b El Nazi
6) Bruno Victoria, Fishman b Ciclón Veloz Jr., El Faraón
## straight falls. Veloz bled a lot. Faraon wants a hair match with Vicotira
7) Adorable Rubi, Alfonso Dantes b Dr. Wagner, El Halcón
## cold match

indy (SAT) 02/21/1976 Arena Apatlaco, Iztapalapa, Distrito Federal [Halcon 192]
1) Impacto b Rolando Valentino [hair]

indy (SAT) 02/21/1976 Club Deportivo Antonio Cardenas, Saltillo, Coahuila
1) Costeñito Moy vs La Hiena, Chamaco Tormenta, Bronco Lopez, La Furia, Halcón Morales, Reed Power, Bronco Ibarra, Tony Gut, Sombra Lagunera [COAHUILA WELTER]

EMLL (SUN) 02/22/1976 Arena Coliseo Guadalajara [El Informador 1976-02-22]
1) ? vs ??
2) ? vs ??
3) ? vs ??
4) Memo Valles, Sangre Chicana vs El Monarca, Máscara Roja
5) Adorable Rubi, Gemelo Diablo I, Gemelo Diablo II vs Alberto Muñoz, Dr. Wagner, Mano Negra [super libre]

EMLL (SUN) 02/22/1976 Arena Coliseo Monterrey [Halcon 192]
1) Perro Aguayo  (c) b Ringo Mendoza [NWA MIDDLE]
&& date may be off

indy (SUN) 02/22/1976 Plaza de Toros Valente Arellano, Torreón, Coahuila [El Siglo de Torreon 1976-02-22]
1) ? vs ??
2) ? vs ??
3) Espanto III, Hermes vs Mr. Niebla, Ruben Palma
4) Karloff Lagarde, Pelón Águilar vs Cuauhtémoc Torres, Henry London
5) El Halcón  (c) vs Gran Markus [MEX HEAVY]

EMLL (TUE) 02/24/1976 Arena Coliseo Guadalajara [El Informador 1976-02-24]
1) ? vs ??
2) ? vs ??
3) ? vs ??
4) El Ídolo, El Monarca vs Memo Valles, Septiembre Negro
5) Dr. Wagner, Mano Negra vs Adorable Rubi, Sangre Chicana

MORA (TUE) 02/24/1976 Arena Aficion [https://www.facebook.com/aquilalucha/photos/a.721082084645039.1073741839.673071696112745/1284481658305076/?type=3 Aqui la Lucha]
1) El Matematico  (c) b el Signo [UWA LIGHT]

EMLL (WED) 02/25/1976 Arena Coliseo Acapulco, Acapulco, Guerrero [Haclon 192, Halcon 200, Halcon 240]
1) El Centauro b Talismán
2) Satán b Tino Herrera
3) Dr. Wagner, El Cobarde DRAW Cesar Valentino, Perro Aguayo
4) Yanco vs Tauro [hair]
5) Blue Demon  (c) b Fishman [NWA WELTER]
&& gate 60975

indy (THU) 02/26/1976 Arena Toluca, Toluca, Estado de México [Halcon 192]
1) Frankenstein vs TNT

EMLL (FRI) 02/27/1976 Arena México [https://www.facebook.com/cmll.oficial/photos/a.352219088254374.1073741827.351036975039252/683208991822047/?type=3 CMLL, Halcon 194, RB]
1) Cesar Valentino, Sangre Chicana ?? Blue Demon, Mano Negra
## Sangre Chicana's debut in Arena Mexico.
2) El Faraón b Bruno Victoria [hair]
3) Adorable Rubi b Dr. Wagner  (c) [NWA LH]

EMLL (SUN) 02/29/1976 Arena Coliseo Guadalajara [El Informador 1976-02-29]
1) ? vs ??
2) ? vs ??
3) ? vs ??
4) El Vengador, Máscara Roja vs Adorable Rubi, As Charro
5) Memo Valles vs El Monarca [hair]
6) Dr. Wagner, Gallo Tapado vs Gemelo Diablo I, Gemelo Diablo II

indy (SUN) 02/29/1976 Plaza de Toros Valente Arellano, Torreón, Coahuila [El Siglo de Torreon 1976-02-29]
1) Tony Arellano vs Guapo Ibarra
2) Jesus Chavez vs Eric el Rojo
3) Halcón Suriano vs Índio Navajo
4) El Extraño, Flama Azul vs Espanto III, Hermes
5) Chino Chow, Medics I, Medics II vs Escorpión I, Pelón Águilar, Tigre Romano

MORA (SUN) 02/29/1976 Auditorio, Tecomán, Colima [Halcon 192, Halcon 194]
1) Toro Cruz b Gran Jacobo [COLIMA WELTER]
2) El Matematico  (c) b Hashi Masataka [UWA LIGHT]
&& Nacho Hernandez & Rafael Cervantes Pizano promoter

EMLL (TUE) 03/02/1976 Arena Coliseo Guadalajara [El Informador 1976-03-02]
1) ? vs ??
2) ? vs ??
3) ? vs ??
4) El Ídolo, Gallo Tapado vs As Charro, Septiembre Negro
5) Alberto Muñoz, Dr. Wagner vs Adorable Rubi, Fishman

EMLL (TUE) 03/02/1976 Arena México [Box Y Lucha 1222, Halcon 194]
1) Enrique Vera b El Cobarde
2) Anibal, Huracán Ramírez vs Canek, Dory Dixon
3) Ray Mendoza, Villano III vs Hamada, Hiro Matsuda
4) Blue Demon, El Halcón, Santo b Perro Aguayo, Raúl Reyes, Tony Salazar
&& Guatemala benefit show (earthquake) with EMLL and Mora wrestlers. Written like it's happened but with also a preview, something doesn't seem right. Sugi Sito vs Karloff Lagarde was announced but full results do not appear in either magazine; they may have teamed with Vera & Cobarde. Box Y Lucha says Guajardo, Jalisco and Solitario all excluded. 178,000 pesos were raised and given to the Guatemalan ambassador. Wolf Rubinski worked as referee on the show and got a lot of attention for his showman performance.

indy (TUE) 03/02/1976 Cuautitlán, Estado de México [Halcon 194]
1) Bengala I, Ultraman b Scorpió, Tigre Hispano

EMLL (WED) 03/03/1976 Arena Coliseo Acapulco, Acapulco, Guerrero [Halcon 196]
1) Sangre Chicana b Ciclón Veloz Jr.
## second straight week for this match
2) El Halcón, El Santo, Enrique Vera DQ Hiro Matzuda, Perro Aguayo, Raúl Reyes

indy (WED) 03/03/1976 Arena Bravo, Cuauhtémoc, Distrito Federal [https://www.facebook.com/96186896558/posts/10153580647156559 Box Y Lucha]
1) Rafa Nuñez b Alfonso Morales [hair]

EMLL (FRI) 03/05/1976 Arena México [Halcon 194]
1) Halcón Dorado b Huroki Sito
2) As Charro b Chino Chow
3) Mano Negra, Ringo Mendoza b Cesar Valentino, Sangre Chicana
## Mano & Ringo took 2/3.
4) Gemelo Diablo I, Gemelo Diablo II b Cien Caras, Enrique Vera
## straight falls
5) Dr. Wagner, El Halcón, Santo b Hiro Matzuda, Perro Aguayo, Rubí Ruvalcaba
## debut of Matzuda/Matsuda (who had wrestled there 15 years prior as Sujiro Kojima), billed as as World Junior Heavyweight championship. Tecnicos took 2/3, Halcon wants a shot at Matsuda

EMLL (SUN) 03/07/1976 Arena Coliseo Guadalajara [El Informador 1976-03-07]
1) ? vs ??
2) ? vs ??
3) ? vs ??
4) Iván El Bronco, Septiembre Negro vs Cinta Negra, El Ídolo
5) Blue Demon, El Halcón, El Santo vs Fishman, Hiro Matsuda, Perro Aguayo

indy (SUN) 03/07/1976 Arena KO Algusto, Naucalpan, Estado de México [Halcon 194]
1) Javier Llanes, Rayo De Dorado b Bulldog Morgan, Gory Medina [KO TAG, final]
## final of a tournament
2) Hombre Nuclear, Mil Máscaras b Bruno Estrada, TNT

indy (SUN) 03/07/1976 Palacio de los Deportes, Villahermosa, Tabasco [Halcon 194]
1) El Solitario, La Furia vs Cadáver I, Príncipe Rebelde

indy (SUN) 03/07/1976 Plaza de Toros Valente Arellano, Torreón, Coahuila [El Siglo de Torreon 1976-03-07]
1) Tony Arellano vs Joe Marquina
2) Jesus Chavez vs Guapo Ibarra
3) Halcón Suriano, Ruben Palma vs Eric el Rojo, Vicente Nuño
4) El Nómada, Flama Azul vs Hermes, Pelón Águilar
5) Ciclón Veloz Jr. vs Adorable

EMLL (TUE) 03/09/1976 Arena Coliseo [http://superluchas.com/2015/03/09/en-un-dia-como-hoy-1976-hiro-matsuda-y-fishman-vs-el-halcon-y-alberto-munoz-se-pelean-as-charro-y-demonio-blanco/ SuperLuchas]
1) El Suriano b Titanic
2) Mario Rocca DQ Diogenes
3) Bufalo Salvaje b Gorila Flores Jr.
4) Mr. Steel, Sergio Borrayo b Roy Stive, Tauro
5) Cinta Negra, Halcón Dorado b Escorpión I, Escorpión II
## straight falls, Escorpions DQed in the first
6) Enrique Vera, José Luis Mendieta, Ringo Mendoza b As Charro, Demonio Blanco, Tony Salazar
## As Charro & Demonjio Blanco turned on each other.

EMLL (TUE) 03/09/1976 Arena Coliseo Guadalajara [http://superluchas.com/2015/03/09/en-un-dia-como-hoy-1976-hiro-matsuda-y-fishman-vs-el-halcon-y-alberto-munoz-se-pelean-as-charro-y-demonio-blanco/ SuperLuchas]
1) Marcos Alcala, Mario Alcala b Black Killer, Comando I
2) Alberto Muñoz, El Halcón b Fishman, Hiro Matsuda

indy (TUE) 03/09/1976 Gimnasio Municipal Lic. Benito Juárez, Cuautitlán, Estado de México [http://superluchas.com/2015/03/09/en-un-dia-como-hoy-1976-hiro-matsuda-y-fishman-vs-el-halcon-y-alberto-munoz-se-pelean-as-charro-y-demonio-blanco/ SuperLuchas]
1) Tamba b Satán Verde
2) Mario el Exotico b Zaratustra
3) Bengala I, Mr. Niebla, Octavio Gaona Jr. b Danny Cruz, Hijo Del Frankenstein, Hombre Nuclear
4) Babe Face, Cesar Valentino, León Negro DQ Carlos Mata, El Santo, Tawa Vera
## Tawa pulled Leon Negro's mask

EMLL (WED) 03/10/1976 Arena Coliseo Acapulco, Acapulco, Guerrero [Halcon 197]
1) Agente X b Musclman
2) Dr. Wagner, Máscara Roja b Gemelo Diablo I, Gemelo Diablo II [semifinal]
3) Dr. Wagner, Máscara Roja b Alfonso Dantes, Hiro Matzuda [final]
&& no mention of the other final

EMLL (FRI) 03/12/1976 Arena México [Box Y Lucha 1222]
1) Manuel Robles TLDRAW Henry London
## no time mentioned
2) Tony López b Rizado Ruiz
3) Cacique Mara, Máscara Roja b Sangre Chicana, Tony Salazar
## strong debut by Mascara Reyes
4) Alfonso Dantes, Gemelo Diablo I, Gemelo Diablo II DRAW Dr. Wagner, Mano Negra, Ringo Mendoza
## double pin by Wagner & Dantes, rare trios draw
5) El Halcón, Santo DQ Adorable Rubi, Hiro Matzuda
## tecnicos took 1/3, Halcon challenging Matzuda again

indy (FRI) 03/12/1976 Arena, Coyuca de Catalán, Guerrero
1) Apolo Chino I, Apolo Chino II b Comanche, Soberbio
2) Esclavo, Lucio Risas b El Peligro, Pegaso

EMLL (SAT) 03/13/1976 Arena Puebla [Box Y Lucha 1222]
1) Hiro Matsuda  (c) b Dr. Wagner [NWA JH]
&& location an educated guess

EMLL (SAT) 03/13/1976 Pista Arena Revolución [Halcon 196]
1) Blue Demon  (c) b Karloff Lagarde [NWA WELTER]
&& may be off a week.

EMLL (SUN) 03/14/1976 Arena Coliseo Guadalajara [El Informador 1976-03-14]
1) ? vs ??
2) ? vs ??
3) ? vs ??
4) El Vengador, Gallo Tapado vs Comando II, Memo Valles
5) Blue Demon, El Halcón, El Santo vs Adorable Rubi, Fishman, Hiro Matsuda

EMLL (SUN) 03/14/1976 Arena Coliseo Monterrey [Box Y Lucha 1222]
1) Alfonso Dantes  (c) b Dr. Wagner [MEX LH]
## Wagner loses in title matches in back to back days
&& location an educated guess

indy (SUN) 03/14/1976 Arena Coliseo Acapulco, Acapulco, Guerrero [Halcon 240]
1) Caudllo b Cometa
2) Galeonero DRAW Guerrero
3) Extraño, Lizmark b Braulio Mendoza, The Ranger
4) Troyano, Yanco b Mario Valenzuela, Musulman
5) Hércules  (c) b Johnny Ceballos [GUERRERO LH]
6) Abundio Radilla b Corachi [hair]
## Radilla retirement match after a 22 year career. He's retiring while Guerrero lightweight champion.

indy (SUN) 03/14/1976 Arena Lopez Mateos [Halcon 196]
1) Chucho El Roto, El Magno b Cadáver I, Centella Roja [mask]
## Centella Roja is Celedonio Jimenez and Cadaver I is Pedro Garcia

indy (SUN) 03/14/1976 Deportivo Tallers, Monterrey, Nuevo Leon [Halcon 194]
1) Villano I, Villano III vs El Matematico, Solar I
2) Némesis vs Red Rebelde

indy (SUN) 03/14/1976 Plaza de Toros La Aurora, Ciudad Nezahualcóyotl, Estado de México [Halcon 196]
1) Ráfaga Moreno b Rayo De Tlaxcala [hair]

indy (SUN) 03/14/1976 Plaza de Toros Valente Arellano, Torreón, Coahuila [El Siglo de Torreon 1976-03-14]
1) ? vs ??
2) ? vs ??
3) Griego Salas, Roy Roger vs The King, Vicente Nuño
4) Cuauhtémoc Torres, Mr. Occidente vs Espanto III, Pelón Águilar
5) Flama Azul vs Hermes [mask]

MORA (SUN) 03/14/1976 Plaza de Toros La Monumental, Monterrey, Nuevo León [Halcon 196]
1) Hermano Escobedo I, Hermano Escobedo II b Canek, Tormenta
2) Kung Fu b La Momia II [mask]
## bad match
3) Babe Face, Ray Mendoza b Rayo de Jalisco, Sunny War Cloud
4) Villano III  (c) b Ultraman [UWA WELTER]
## called the match of the year. V3 took 2/3.
&& tournament strong

EMLL (TUE) 03/16/1976 Arena Coliseo [Box Y Lucha 1222]
1) Impacto vs Doberman
2) Gran Davis vs Roy Lancer
3) Bengala II vs Bufalo Salvaje
4) Apolo Casillas, Cachorro Mendoza vs Dick Angelo, Tauro
5) Cinta Negra, Halcón Dorado vs Manuel Robles, Rizado Ruiz
6) Enrique Vera, José Luis Mendieta, Ringo Mendoza vs Demonio Blanco, Sangre Chicana, Tony Salazar

EMLL (TUE) 03/16/1976 Arena Coliseo Guadalajara [El Informador 1976-03-16]
1) ? vs ??
2) ? vs ??
3) ? vs ??
4) Hermano Alcala I, Marco Alcala vs Comando I, Luis González
5) El Faraón, El Halcón vs Hiro Matsuda, Perro Aguayo

indy (THU) 03/18/1976 Arena Apatlaco, Iztapalapa, Distrito Federal [Box Y Lucha 1222]
1) El Suriano vs El Maldito
2) Estrella Blanca, Rafael Salamanca vs Espectro I, Espectro Jr.
3) Chino Chow, Ringo Mendoza vs Bruno Victoria, Demonio Blanco
4) Bengala II vs Tauro  (c) [MEX LIGHT]

EMLL (FRI) 03/19/1976 Arena México [Box Y Lucha 1222, Halcon 196]
1) César Silva b Escorpión I
2) José Luis Mendieta DRAW El Cobarde
3) El Faraón, Máscara Roja DQ Gemelo Diablo I, Gemelo Diablo II
4) Tony Salazar b Cacique Mara [hair]
5) Dr. Wagner, El Santo b Adorable Rubi, Perro Aguayo
6) Hiro Matzuda  (c) b El Halcón [NWA JH]
## Matsuda took 2/3. Danny Hodge is (or was recently) champ at this point so unclear what title Matzuda is actually carrying through Mexico.

EMLL (SAT) 03/20/1976 Pista Arena Revolución [Box Y Lucha 1222]
1) Gorilla Flores vs Gran Davis
2) Mr. Steel vs Dick Angelo
3) Sergio Borrayo vs Dr. O’Borman
4) Henry London, Mr. Tempest vs Escorpión II, Leo López
5) Enrique Vera, Ringo Mendoza vs Coloso Colosetti, Sangre Chicana
6) Cachorro Mendoza vs Rodolfo Ruiz [hair]
7) Blue Demon  (c) vs Karloff Lagarde [NWA WELTER]

indy (SAT) 03/20/1976 Arena Apatlaco, Iztapalapa, Distrito Federal [Box Y Lucha 1222]
1) Soberbio vs Tigre De Guanajato
2) Javier Llanes vs Bruno Estrada
3) Fantastic, Mr. Niebla vs Pepe Casas, Zorro Plateado
4) Anibal, Carlos Mata vs Babe Face, El Polaco

indy (SAT) 03/20/1976 Arena Zapata, Cuautla, Morelos [Box Y Lucha 1222]
1) Azteca vs Dragón Negro
2) El Toluco vs Ángel De La Muerte
3) Hombre Nuclear vs Kenji Kaplin
4) Luis Mariscal vs El Cóndor
5) El Solitario, Ultraman vs Budy Montes, Dany Cruz

EMLL (SUN) 03/21/1976 Arena Coliseo [Box Y Lucha 1222]
1) Mr. Lancer vs Diogenes
2) Estrella Blanca vs El Polaco
3) Cinta Negra vs Demonio Blanco
4) Chino Chow, Tony López vs Espectro I, Espectro Jr.
5) El Cobarde, Mano Negra, Ringo Mendoza vs Gemelo Diablo I, Gemelo Diablo II, Perro Aguayo

EMLL (SUN) 03/21/1976 Arena Coliseo Guadalajara [El Informador 1976-03-21]
1) ? vs ??
2) ? vs ??
3) ? vs ??
4) Alberto Muñoz, Blue Demon, Gallo Tapado vs As Charro, Fishman, Septiembre Negro
5) Adorable Rubi  (c) b El Santo [NWA LH]
## first defense

EMLL (SUN) 03/21/1976 Pista Arena Revolución [Box Y Lucha 1222]
1) Mario Rocca vs Ciclón Rojo
2) El Trueno vs Bengala II
3) Agente X vs Bufalo Salvaje
4) Halcón Dorado vs Huroki Sito
5) Cacique Mara, Henry London vs Leo López, Manuel Robles
6) El Halcón, José Luis Mendieta vs Bruno Victoria, Tony Salazar

indy (SUN) 03/21/1976 Arena Puebla [Box y Lucha 1524]
1) ?, El Egipcio b Oso Blanco, Roy Lancer
## Egipico's debut. Mentioned six years later in an Egipico interview where he says he'll retire if he doesn't make it big in 1982 and can't remember who he teamed with here.

indy (SUN) 03/21/1976 Arena San Juan Pantitlan, Ciudad Nezahualcóyotl, Estado de México [Box Y Lucha 1222]
1) El Socio vs Memo Arenas
2) El Chacal vs Lucio Risas
3) Danny Cruz vs Kenji Kaplin
4) Golden Boy, Luis Mariscal vs El Cóndor, Toluco
5) El Solitario, Ultraman vs Buddy Montes, Hombre Nuclear

indy (SUN) 03/21/1976 Auditorio Municipal, Tecomán, Colima
1) Tauro II b Chamaco Escobedo [hair]

indy (SUN) 03/21/1976 Cuernavaca, Morelos [Halcon 197]
1) Salamandra b Kaliman [mask]
## Kaliman is Baltazar Garcia. Finals of a ruleta mortal.

indy (SUN) 03/21/1976 Orizaba, Veracruz [Halcon 197]
1) Cavernario Galindo b Jorge Oropeza [hair]

indy (SUN) 03/21/1976 Plaza de Toros Valente Arellano, Torreón, Coahuila [El Siglo de Torreon 1976-03-21]
1) ? vs ??
2) ? vs ??
3) Halcón Suriano vs Eric el Rojo
4) Griego Salas, Roy Estrada vs Pelón Águilar, Vicente Nuño
5) Gran Markus, Rizado Ruiz vs Mil Caras, Temoc Torres

EMLL (TUE) 03/23/1976 Arena Coliseo Guadalajara [El Informador 1976-03-23]
1) ? vs ??
2) ? vs ??
3) ? vs ??
4) Cachorro Mendoza, El Vengador vs As Charro, Tauro
5) Alberto Muñoz, Blue Demon vs Adorable Rubi, Fishman

indy (TUE) 03/23/1976 Cuautitlán, Estado de México [Halcon 196]
1) León Negro b Tawa Vera  (c) [CUATITLAN WELTER]
## first defense
2) Danny Cruz b Octavio Gaona  (c) [EDM HEAVY]
3) Villano I, Villano II b Bengala I, Ultraman [EdM TAG]
## initial champion
4) Mil Máscaras, Octavio Gaona, Tawa Vera vs Danny Cruz, León Negro, TNT

EMLL (FRI) 03/26/1976 Arena México [Halcon 197]
1) Cinta Negra b Escorpión I
## unclear which Escorpion
2) Tony López b Demonio Blanco
3) Sangre Chicana b El Cobarde
4) Alfonso Dantes, Fishman, Tony Salazar b Dr. Wagner, Mano Negra, Ringo Mendoza
5) Blue Demon, El Faraón, Enrique Vera DQ Gemelo Diablo I, Gemelo Diablo II, Perro Aguayo
6) Alfonso Dantes, Fishman, Tony Salazar b Blue Demon, El Faraón, Enrique Vera [final]
## Rudos took 2/3. Faraon and Salazar are feuding.
&& a bit more than half full

MORA (FRI) 03/26/1976 Palacio de los Deportes, Iztacalco, Distrito Federal
1) Golden Rogers vs Astro Rey
2) El Matematico, Ultraman vs Villano I, Villano II
3) José Torres, Mil Máscaras vs Canek, Cesar Valentino
4) Dr. Wagner, El Solitario vs Ángel Blanco, Ray Mendoza
5) Anibal, Gran Hamada vs Rene Guajardo, Villano III [relevos suicidas]

EMLL (SUN) 03/28/1976 Arena Coliseo Guadalajara [El Informador 1976-03-28]
1) ? vs ??
2) ? vs ??
3) ? vs ??
4) Comando I, Comando II vs El Ídolo, El Vengador
5) Cien Caras, Dr. Wagner, El Halcón vs Alfonso Dantes, Gemelo Diablo I, Gemelo Diablo II

indy (SUN) 03/28/1976 Arena Coliseo Monterrey [Halcon 197]
1) Manny Espino vs Johnny Carrillo
2) Extraño, Ruben Palma vs Cadete Ruiz, El Vasco
3) Cuauhtémoc Torres, Flama Azul vs Jungla I, Jungla II
4) Ciclón Veloz vs Chucho Villa
5) Blue Demon, El Santo vs Adorable Ruvalcaba, Fishman

indy (SUN) 03/28/1976 Arena KO Algusto, Naucalpan, Estado de México
1) Perro Sosa vs El Suicida
2) Castorico vs Rudy Rivera
3) El Vagabundo vs Negro Navarro
4) Villano I, Villano II vs Javier Llanes, Rayo Dorado
5) Dos Caras, Mil Máscaras, Mr. Niebla vs Gory Medina, Hijo Del Frankenstein, Nahur Kaliff

indy (SUN) 03/28/1976 Arena Toluca, Toluca, Estado de México [Halcon 197]
1) Javier Montes  (c) vs Barba Negra [TOLUCA WELTER]

indy (SUN) 03/28/1976 Ecatepec, Estado de México [Halcon 197]
1) Aguaman b Gastro Del Valle [hair]
2) Águila Imperial, Tigre Gomez b Lancero I, Lancero II [ECATEPEC TAG]
3) Príncipe b Seky [mask]
&& 6th Anniversary for Rafael Cervantes

indy (SUN) 03/28/1976 Plaza de Toros Valente Arellano, Torreón, Coahuila [El Siglo de Torreon 1976-03-28]
1) Tony Arellano vs Guapo Ibarra
2) Jesus Chavez vs Eric el Rojo
3) Simio I, Simio II vs Índio Navajo, Vicente Nuño
4) Griego Salas, Mr. Occidente, Roy Estrada vs Espanto III, Pelón Águilar, The King
5) Enrique Vera vs Gran Markus

STIC (SUN) 03/28/1976 Parque Deportivo P. Elias Calles, Venustiano Carranza, Distrito Federal [Halcon 197]
1) Villano I, Villano II b Barba Negra, Príncipe Odin
2) Ray Mendoza, Villano III b El Matematico, Gran Hamada

EMLL (TUE) 03/30/1976 Arena Coliseo Guadalajara [El Informador 1976-03-30]
1) ? vs ??
2) ? vs ??
3) ? vs ??
4) Cachorro Mendoza, Gallo Tapado, Mario Alcala vs As Charro, Septiembre Negro, Tauro
5) Alberto Muñoz, Dr. Wagner vs Gemelo Diablo I, Gemelo Diablo II

MORA (TUE) 03/30/1976 Auditorium, Cuautitlán, Estado de México [Halcon 197]
1) Villano I, Villano II, Villano III vs Bengala, El Matematico, Tawa Vera
2) Arrazola, Ray Mendoza, Renato Torres vs Anibal, Danny Cruz, Octavio Gaona

EMLL (WED) 03/31/1976 Arena Coliseo Acapulco, Acapulco, Guerrero [Halcon 200]
1) Máscara Roja b Sangre Chicana
2) Blue Demon, Mano Negra, Ringo Mendoza DQ Coloso Colosetti, Karloff Lagarde, Perro Aguayo
## Perro fouled Mendoza

EMLL (WED) 03/31/1976 Arena Veracruz, Veracruz, Veracruz [Box Y Lucha 1222]
1) Ray Mendoza  (c) vs Audaz [UWA LH]
&& the two had been feuding in Veracruz and Villahermosa

indy (THU) 04/01/1976 Chilpancingo, Guerrero [Halcon 2000]
1) Halcón Dorado I, Lizmark vs Alfa Centauris, Mario Valenzuela
2) Marcos Nava, The Bowman vs Aristos, El Musulman

EMLL (SAT) 04/03/1976 Arena México [Halcon 200]
1) El Faraón, Fishman vs ?, ??
&& a recap teasing these two in a mask match mentions they feuded on this show, matches set by a 16 man battle royal

EMLL (SUN) 04/04/1976 Arena Coliseo [http://superluchas.com/2015/04/04/en-un-dia-como-hoy-1976-ringo-mendoza-vence-a-karloff-lagarde-rizado-ruiz-rapa-a-cesar-silva/ SuperLuchas]
** Arena Coliseo 33rd Anniversary
1) Agente X b Roy Lancer
2) Cacique Mara, Tony López b Alfa Centauris, Manuel Robles
3) Coloso Colosetti, Perro Aguayo b Cien Caras, El Cobarde
4) Rizado Ruiz b César Silva [hair]
5) Ringo Mendoza  (c) b Karloff Lagarde [MEX MIDDLE]

EMLL (SUN) 04/04/1976 Arena Coliseo Guadalajara [http://superluchas.com/2015/04/04/en-un-dia-como-hoy-1976-ringo-mendoza-vence-a-karloff-lagarde-rizado-ruiz-rapa-a-cesar-silva/ SuperLuchas]
1) Cesar Curiel, Gallo Tapado b Memo Valles, Pantera Azul
2) Dr. Wagner, El Halcón, Enrique Vera b Alfonso Dantes, Gemelo Diablo I, Gemelo Diablo II

indy (SUN) 04/04/1976 Arena KO Algusto, Naucalpan, Estado de México [http://superluchas.com/2015/04/04/en-un-dia-como-hoy-1976-ringo-mendoza-vence-a-karloff-lagarde-rizado-ruiz-rapa-a-cesar-silva/ SuperLuchas]
1) El Vagabundo b Negro Navarro
2) Gory Medina, Hijo Del Frankenstein, Nahur Kaliff b Dos Caras, Javier Llanes, Rayo Dorado
3) El Matematico, Estrella Del Sur, Memo Ventura DQ Villano I, Villano II, Villano III

indy (SUN) 04/04/1976 Arena Puebla [http://superluchas.com/2015/04/04/en-un-dia-como-hoy-1976-ringo-mendoza-vence-a-karloff-lagarde-rizado-ruiz-rapa-a-cesar-silva/ SuperLuchas]
1) Bufalo Salvaje, Hércules Poblano b El Trueno, Ray Vega
2) Estrella Blanca, Halcón Dorado I DQ Dick Angelo, El Polaco

indy (SUN) 04/04/1976 Arena Raff, Ciudad Nezahualcóyotl, Estado de México [http://superluchas.com/2015/04/04/en-un-dia-como-hoy-1976-ringo-mendoza-vence-a-karloff-lagarde-rizado-ruiz-rapa-a-cesar-silva/ SuperLuchas]
1) Villano I, Villano II, Villano III b Dimensión X, Halcón Dorado II, Ultraman

indy (SUN) 04/04/1976 Chilpancingo, Guerrero [Halcon 200]
1) Braulio Mendoza, Leo López b Rafael Salamanca, Troyano
2) El Centauro, Satán b El Rebelde, Sergio Borrayo

indy (SUN) 04/04/1976 Coliseo Olimpico Universidad de Guadalajara, Guadalajara, Jalisco [http://superluchas.com/2015/04/04/en-un-dia-como-hoy-1976-ringo-mendoza-vence-a-karloff-lagarde-rizado-ruiz-rapa-a-cesar-silva/ SuperLuchas]
1) Tauro b Cachorro Mendoza
2) Black Killer, Iván El Bronco b El Ídolo, El Monarca
3) As Charro b Alberto Muñoz

indy (SUN) 04/04/1976 Plaza de Toros La Aurora, Ciudad Nezahualcóyotl, Estado de México [http://superluchas.com/2015/04/04/en-un-dia-como-hoy-1976-ringo-mendoza-vence-a-karloff-lagarde-rizado-ruiz-rapa-a-cesar-silva/ SuperLuchas]
1) El Bengala, El Dinámico b Rayo De Tlaxcala, Zebra Kid
2) Piloto Mortal b Mr. Niebla
3) El Insólito, Ultraman b Buddy Montes, Cesar Valentino

indy (SUN) 04/04/1976 Plaza de Toros Valente Arellano, Torreón, Coahuila [El Siglo de Torreon 1976-04-04]
1) ? vs ??
2) ? vs ??
3) Halcón Suriano vs Vicente Nuño
4) La Sombra, Ruben Palma vs Espanto III, The King
5) Carlos Monterrosa, Temoc Torres, Tony Reyna vs Jungla Negra I, Pelón Águilar, Tony Salazar

EMLL (TUE) 04/06/1976 Arena Coliseo Guadalajara [El Informador 1976-04-06]
1) ? vs ??
2) ? vs ??
3) ? vs ??
4) Cachorro Mendoza, Marco Alcala, Mario Alcala vs Araña Atómica, Roy Stive, Tauro
5) Alberto Muñoz, Dr. Wagner vs Alfonso Dantes, As Charro

indy (WED) 04/07/1976 Arena Coliseo Acapulco, Acapulco, Guerrero [Halcon 200]
1) Gran Markus, Karloff Lagarde b Cien Caras, Máscara Roja
2) El Halcón, Ringo Mendoza b Perro Aguayo, Tony Salazar
&& date an educated guess, may be off a week

EMLL (FRI) 04/09/1976 Arena México [Halcon 199]
1) Leo López b Chino Chow
2) Sangre Chicana b Cacique Mara
3) Enrique Vera, Ringo Mendoza b Coloso Colosetti, Gran Markus
## Took 1/3
4) Dr. Wagner, El Santo b Alfonso Dantes, Perro Aguayo
## straight falls, first by DQ.
5) El Faraón b Tony Salazar [hair]
## Faraon bled but won.
6) Fishman b Blue Demon [NWA WELTER]
## Seconds Cacique mara (Demon), Espectro Jr. (Fishman.) Demon is 76 kg, Fishman is 78 kg. Demon took the first fall in 15 minutes, Fishman took fall 2, Demon took the third fall. Fishman vacates the national welterweight title (again) after winning

MORA (SAT) 04/10/1976 Arena Puebla [https://www.facebook.com/photo.php?fbid=625614104152995&set=a.461505387230535.102143.454597374588003&type=1 DJ Spectro]
1) Perro Aguayo  (c) DRAW El Santo [NWA MIDDLE]
## Perro kept the title

EMLL (SUN) 04/11/1976 Arena Coliseo Guadalajara [El Informador 1976-04-11, Halcon 200]
1) ? vs ??
2) ? vs ??
3) ? vs ??
4) Tauro  (c) vs Cachorro Mendoza [MEX LIGHT]
5) Alberto Muñoz, Ciclón Veloz Jr., El Halcón vs As Charro, Gemelo Diablo I, Gemelo Diablo II
6) Alfonso Dantes  (c) b Dr. Wagner [MEX LH]

indy (SUN) 04/11/1976 Arena Apatlaco, Iztapalapa, Distrito Federal [Halcon 2000]
1) Ultraman vs Kung Fu
&& final show of Raul Reyes as matchmasker

indy (SUN) 04/11/1976 Auditorio Municipal, Tecomán, Colima [Halcon 197]
1) Black Terry, Tawa Vera vs El Chicano, Índio Vitela

indy (SUN) 04/11/1976 Plaza de Toros el Progreso, Guadalajara, Jalisco [El Informador 1976-04-11]
1) ? vs ??
2) ? vs ??
3) ? vs ??
4) Babe Face vs Gallo de Oro
5) Frankenstein, Renato Torres vs Hermano Escobedo I, Hermano Escobedo II
6) El Solitario, Gran Hamada, Mil Máscaras vs Ángel Blanco, El Vikingo, Ray Mendoza

indy (SUN) 04/11/1976 Plaza de Toros Valente Arellano, Torreón, Coahuila [El Siglo de Torreon 1976-04-11]
1) Joe Marquina vs Tony Arellano
2) Índio Navajo vs Jesus Chavez
3) Eric el Rojo vs Ruben Palma
4) The King, Vicente Nuño vs La Sombra, Mr. Occidente
5) Jungla Negra I, Jungla Negra II, Pelón Águilar vs Chucho Villa, Medics I, Medics II

EMLL (TUE) 04/13/1976 Arena Coliseo Guadalajara [El Informador 1976-04-13]
1) ? vs ??
2) ? vs ??
3) ? vs ??
4) Gallo Tapado, Marco Alcala, Mario Alcala vs Araña Atómica, Memo Valles, Roy Stive
5) Ciclón Veloz Jr., Dr. Wagner vs Gemelo Diablo I, Gemelo Diablo II

Santo (WED) 04/14/1976 Reynosa, Tamaulipas [Halcon 197]
1) Mil Máscaras vs El Halcón [IWA HEAVY]
## not entirely sure it is a title match

indy (SAT) 04/17/1976 Deportivo Lopez Velarde, Venustiano Carranza, Distrito Federal [Halcon 200]
1) Anibal, El Vagabundo b Lobo Rubio, Villano II
## Lobo Rubio started in this arena as La Moska
&& guessing city

EMLL (SUN) 04/18/1976 Arena Coliseo Guadalajara [El Informador 1976-04-18]
1) ? vs ??
2) ? vs ??
3) ? vs ??
4) El Ídolo, Gallo Tapado vs Karate Hayato, Kimura Sato
5) Ciclón Veloz Jr., Cien Caras, Ringo Mendoza vs Gemelo Diablo I, Gemelo Diablo II, Perro Aguayo

indy (SUN) 04/18/1976 Arena Azteca, Calz. Tulyehualco, Iztapalapa, Distrito Federal [Halcon 200]
1) Impacto b Mr. Niebla [DF MIDDLE, final]
## tournament final

indy (SUN) 04/18/1976 Plaza de Toros el Progreso, Guadalajara, Jalisco [El Informador 1976-04-18]
1) ? vs ??
2) ? vs ??
3) Hermano Escobedo I, Hermano Escobedo II vs Babe Face, Mr. Justicia
4) El Vikingo, Remington, Renato Torres vs Alberto Muñoz, Rayo de Jalisco, Ultraman
5) El Solitario, Gran Hamada, Mil Máscaras vs Ángel Blanco, Frankenstein, Ray Mendoza

indy (SUN) 04/18/1976 Plaza de Toros Valente Arellano, Torreón, Coahuila [El Siglo de Torreon 1976-04-18]
1) Jesus Chavez vs Índio Navajo [super libre]
2) Eric el Rojo vs Vicente Nuño
3) Halcón Suriano, La Sombra, Ruben Palma vs Espanto III, Pelón Águilar, The King
4) Coloso Colosetti, Jungla Negra vs Enrique Vera, Polo Torres

indy (MON) 04/19/1976 Cancha San Pedro, Puebla, Puebla [Halcon 201]
1) Villano III b Soberano [mask]
## This Soberano is Leonel Rivas from Guatemala, who was returning after this match

EMLL (TUE) 04/20/1976 Arena Coliseo Guadalajara [El Informador 1976-04-20, https://www.facebook.com/Luchalibredelrecuerdo/photos/223266944766325/ Lucha Libre Del Recuerdo]
1) Demonio Rojo vs El Chacal
2) Alberto Cortes vs El Nómada
3) Sangre India vs Luis Vera
4) El Ídolo, Spider Man vs Calavera I, Calavera II
5) Cachorro Mendoza, Gallo Tapado, Ringo Mendoza vs As Charro, Perro Aguayo, Tauro

MORA (TUE) 04/20/1976 Auditorium, Cuautitlán, Estado de México [Halcon 201]
1) el Signo, Lobo Rubio b Bengala I, Bengala II
2) Villano II, Villano III b El Matematico, Tawa Vera
&& may be off a week

EMLL (WED) 04/21/1976 Arena Coliseo Acapulco, Acapulco, Guerrero [Halcon 201]
1) Roy Lancer b El Cadete
2) Demonio Blanco b Rafael Salamanca
3) Blue Demon, Santo b Adorable Ruvalcaba, Karloff Lagarde
## straight falls
4) Dardo Aguilar b Huroki Sito [hair]
5) Perro Aguayo  (c) b Ringo Mendoza [NWA MIDDLE]
## Ringo's fourth failed challenge (Acapulco, Guadalajara, Monterrey, Acapulco) and Aguayo's 12 defense, though they seem to missing at least one
&& gate of 70,065.

indy (WED) 04/21/1976 Arena Bravo, Ciudad de México, Distrito Federal [Halcon 201]
1) Conde Azul, Raúl Guerrero b ? [semifinal, DF LIGHT]
## will meet the following week for the title

indy (WED) 04/21/1976 Arena KO Algusto, Naucalpan, Estado de México [Halcon 200]
1) Javier Montes, Memo Ventura vs Villano I, Villano II
## either a tag title match or building to one

EMLL (FRI) 04/23/1976 Arena México [Box y Lucha 1638, Halcon 201, Luchas 2000 668, Punch 87, RB]
** Arena Mexico 20th Anniversary
1) Manuel Robles b Estrella Blanca
2) Carlos Plata b Karloff Lagarde
3) Enrique Vera, Mano Negra b Gemelo Diablo I, Gemelo Diablo II
4) El Halcón, El Santo DQ Adorable Rubi, Alfonso Dantes
## straight falls, first by DQ
5) Perro Aguayo b Ringo Mendoza  (c) [NWA MIDDLE]
## Perro kept the title
6) Fishman b El Faraón [mask]
## Faraon is Jose Luis Barajas Fernandez, 28 years old, from Mexico City.

indy (SAT) 04/24/1976 Arena Tijuana 72, Tijuana, Baja California
1) El Suriano vs Ráfaga M.
2) El Doberman vs Marino Velazquez
3) Bruno Victoria, Espectro Jr. vs Cesar Curiel, Flama Azul
4) El Invasor vs Pantera Azul

indy (SAT) 04/24/1976 Atlixco, Puebla [Halcon 201]
1) Anibal, Carlos Mata b León Negro, Tupamaro

indy (SAT) 04/24/1976 Huauchinango, Puebla [Halcon 201]
1) Villano I b Escudo Rojo [mask]

EMLL (SUN) 04/25/1976 Arena Coliseo Guadalajara [El Informador 1976-04-25]
1) ? vs ??
2) ? vs ??
3) ? vs ??
4) Gallo Tapado vs Cachorro Mendoza, Halcón Dorado, El Monarca, Iván El Bronco, Tauro, Roy Stive, Leo López
5) Ciclón Veloz Jr., El Faraón, El Santo vs Gran Markus, Perro Aguayo, Tony Salazar
## Tony Salazar's first unmasked appearance.

indy (SUN) 04/25/1976 Atlixco, Puebla [Halcon 201]
1) Exorcista, León Negro b Arlequín, La Furia

indy (SUN) 04/25/1976 Plaza de Toros el Progreso, Guadalajara, Jalisco [El Informador 1976-04-25]
1) ? vs ??
2) ? vs ??
3) ? vs ??
4) Alberto Muñoz, Tinieblas, Ultraman vs Ángel Blanco, El Vikingo, Ray Mendoza
5) Frankenstein vs El Solitario [super libre]

indy (SUN) 04/25/1976 Plaza de Toros Valente Arellano, Torreón, Coahuila [El Siglo de Torreon 1976-04-25]
1) Tony Arellano vs Guapo Ibarra
2) Eric el Rojo vs Jesus Chavez
3) Vicente Nuño vs Índio Navajo
4) La Sombra, Ruben Palma vs Hermes, The King
5) Mario Ramírez, Mil Caras, Polo Torres vs Comando I, Comando II, Jungla Negra

indy (SUN) 04/25/1976 Tecomán, Colima [Halcon 201]
1) Villano I vs Babe Face

EMLL (TUE) 04/27/1976 Arena Coliseo [Box Y Lucha 1229, Punch 87]
1) Mr. Lancer TLDRAW Gran Davis
## Box Y Lucha says this was announced as 15 minute draw but went around 30 (and the next went 7 bad minutes.)
2) Joe Marino vs Roy Lancer
3) Impacto vs El Trueno
4) Sergio Borrayo, Tino Herrera vs Dick Angelo, Satán
5) Cacique Mara, Tony López vs Escorpión I, Escorpión II
6) José Luis Mendieta, Mano Negra, Máscara Roja vs Coloso Colosetti, Karloff Lagarde, Septiembre Negro

EMLL (TUE) 04/27/1976 Arena Coliseo Guadalajara [El Informador 1976-04-27]
1) ? vs ??
2) ? vs ??
3) ? vs ??
4) As Charro, Karate Hayato, Kimura Sato vs Gallo Tapado, Marco Alcala, Mario Alcala
5) Ciclón Veloz Jr., Cien Caras vs Gran Markus, Perro Aguayo

indy (TUE) 04/27/1976 Auditorium, Cuautitlán, Estado de México [Halcon 201]
1) Solar I vs Zeus, Brazo de Oro, Javier Montes, La Zebra, La Furia, Golden Rogers, Mario el Exotico
2) Alberto Muñoz, Johnny García, Tawa Vera vs Babe Face, Bello Greco, Lobo Rubio

EMLL (WED) 04/28/1976 Arena Coliseo Acapulco, Acapulco, Guerrero [Halcon 204]
1) Septiemnre Begro vs El Cobarde
2) Blue Demon, El Faraón, Enrique Vera vs Apolo Dantés, Fishman, Tony Salazar

indy (WED) 04/28/1976 Arena Bravo, Ciudad de México, Distrito Federal [Halcon 201]
1) Raúl Guerrero vs Conde Azul [final, DF LIGHT]
## finalists in a tournament

EMLL (FRI) 04/30/1976 Arena Coliseo [Punch 87]
1) Águila India vs Apolo Casillas
2) Sergio Borrayo vs Huroki Sito
3) César Silva vs Alfa Centauris
4) Cacique Mara vs Demonio Blanco
5) Gallo Tapado vs Espectro I
6) Carlos Plata, Enrique Vera vs Coloso Colosetti, Septiembre Negro
7) El Faraón, El Halcón vs Alfonso Dantes, Fishman

MORA (FRI) 04/30/1976 Cuautitlán, Estado de México [Halcon 200]
1) El Matematico COR Villano II
## Villano II was KOed by a dive.
2) Octavio Gaona b Arrazola [hair]

EMLL (SAT) 05/01/1976 Pista Arena Revolución [Punch 87]
1) Mario Rocca vs Roy Lancer
2) Gorilla Flores vs Diogenes
3) Flama Azul vs El Invasor
4) Dardo Aguilar vs Gran Cochisse
5) Cinta Negra vs El Polaco
6) Estrella Blanca, Tino Herrera vs Escorpión I, Escorpión II
7) José Luis Mendieta, Máscara Roja, Ringo Mendoza vs Comando I, Comando II, Tony Salazar

indy (SAT) 05/01/1976 Arena San Juan Pantitlan, Ciudad Nezahualcóyotl, Estado de México [Punch 87]
1) Chacal II vs El Socio
2) Meteoro vs Black Center
3) Al Suarez, El Chacal vs Misterio Blanco I, Misterio Blanco II
4) El Sanguinario, Zebra Kid vs Chamaco Ortiz, El Dinámico

indy (SAT) 05/01/1976 Deportivo Tepito, Cuauhtémoc, Distrito Federal [Halcon 201]
1) Rayo de Jalisco, Tawa Vera vs Scorpió, Zeus

indy (SAT) 05/01/1976 Plaza de Toros Valente Arellano, Torreón, Coahuila [El Siglo de Torreon 1976-05-01]
1) ? vs ??
2) ? vs ??
3) Carlos Jaquez, Índio Navajo vs Halcón Suriano, Vicente Nuño
4) El Nazi, Jungla Negra, Pelón Águilar vs Medics I, Medics II, Polo Torres
5) The King vs La Sombra [hair]

MORA (SAT) 05/01/1976 Palacio de los Deportes, Iztacalco, Distrito Federal [Box Y Lucha 1229, Punch 87]
1) El Cid b Pepe Casas
2) Carlos Mata, Ultraman DQ Babe Face, El Vikingo
3) Audaz, Gran Hamada, Mil Máscaras b Canek, Ray Mendoza, TNT
4) Dos Caras b Mazambula [mask]
## Caras took 2/3. Mazambula is Francisco Salinas, born in Oaxaca, raises in Acapulco.
5) Anibal, Rene Guajardo DQ Ángel Blanco, El Solitario [Relevos Increíbles]
## straight falls, though much confusion about the reuslt. Guajardo/Anibal took fall 1. Anibal avoided a Solitario dive in the second, knocking Solitario out. Anibal accidentally dropkicked Guajardo, Guajardo and Blanco beat up Anibal, and the referee DQed Guajardo for attacking his own parnter. Box Y Lucha hates the finish and says the fasn did as well.

DdN (SUN) 05/02/1976 Plaza de Toros La Monumental, Monterrey, Nuevo León [Halcon 201, Halcon 206]
1) Johnny Lezcano, Tinieblas vs Dorrel Dixon, Espanto III
2) Audaz, El Solitario vs Hippie I, Hippie II
3) Anibal, Huracán Ramírez vs Ángel Blanco, Ray Mendoza
4) Canek vs Torbellino Blanco, La Máscara [mask]
5) Gran Hamada b Rene Guajardo  (c) [UWA MIDDLE]
&& Halcon 206, much after this hsow, mentions this as setting a record gate of 250,000 pesos.

EMLL (SUN) 05/02/1976 Arena Coliseo [Punch 87]
1) Mr. Lancer vs Gran Davis
2) Rafael Salamanca vs Satán
3) Henry London vs Dr. O’Borman
4) Mr. Tempest, Tony López vs Demonio Blanco, Manuel Robles
5) Blue Demon, El Cobarde, Mano Negra vs Adorable Rubi, Karloff Lagarde, Sangre Chicana

EMLL (SUN) 05/02/1976 Arena Coliseo Guadalajara [El Informador 1976-05-02]
1) ? vs ??
2) ? vs ??
3) El Ídolo, José Luis Mendieta vs Karate Hayato, Kimura Sato
4) Tauro vs Cachorro Mendoza
5) Gran Markus, Perro Aguayo, Tony Salazar vs Ciclón Veloz Jr., Cien Caras, Ringo Mendoza

EMLL (SUN) 05/02/1976 Pista Arena Revolución [Punch 87]
1) Talismán vs El Trueno, Agente X, Impacto, Mr. Lancer, Águila India, Hércules Poblano, El Maldito, Rudy Castillo
2) Dardo Aguilar, Mr. Steel vs Alfa Centauris, Huroki Sito
3) Carlos Plata, Gallo Tapado vs Fishman, Septiembre Negro

indy (SUN) 05/02/1976 Arena San Juan Pantitlan, Ciudad Nezahualcóyotl, Estado de México [Punch 87]
1) El Socio vs Misterio Blanco II
2) Al Suarez vs Misterio Blanco I
3) Apolo Chino I, Apolo Chino II vs Soberbio I, Soberbio II [super libre]
4) El Chicano, Mario el Exotico vs Chamaco Ortiz, Potro Salvaje
5) Dos Caras, Fantástico, Mil Máscaras vs Babe Face, Danny Cruz, Luis Mariscal

indy (SUN) 05/02/1976 Plaza de Toros el Cortijo, Venustiano Carranza, Distrito Federal [Punch 87]
1) Joe Marino vs Toro Toro
2) Apolo Casillas vs Diogenes
3) Flama Azul vs Gran Cochisse
4) Sergio Borrayo vs Espectro I
5) Cacique Mara, César Silva, Máscara Roja vs Coloso Colosetti, Comando I, Comando II

EMLL (TUE) 05/04/1976 Arena Coliseo [Box Y Lucha 1229]
1) Mr. Lancer vs Gran Davis
2) Apolo Casillas vs Diogenes
3) Impacto vs El Invasor
4) Flama Azul, Rafael Salamanca vs Dr. O’Borman, El Polaco
5) Cacique Mara, César Silva, Tony López vs Escorpión I, Escorpión II, Manuel Robles
6) El Cobarde, Máscara Roja vs Comando I, Comando II

EMLL (WED) 05/05/1976 Arena Coliseo Acapulco, Acapulco, Guerrero [Halcon 205]
1) Mano Negra, Máscara Roja vs Karloff Lagarde, Rubí Ruvalcaba and Carlos Plata, El Cobarde and Coloso Colosetti, Sangre Chicana

EMLL (WED) 05/05/1976 Arena Coliseo Guadalajara [El Informador 1976-05-05]
1) ? vs ??
2) ? vs ??
3) Dos Caras, Rayo de Jalisco vs Atila, Bello Greco
4) Alberto Muñoz, El Solitario, Tinieblas vs Ángel Blanco, Frankenstein, Ray Mendoza
5) El Vikingo, Renato Torres vs Hermano Escobedo I, Hermano Escobedo II [hair]

indy (WED) 05/05/1976 Cancha San Pedro, Puebla, Puebla [Halcon 204]
1) Bengala I, Bengala II b Cadáver I, Cadáver II [mask]
## Cadaver I & II are Pedro Garcia & Jose Rodriguez

indy (THU) 05/06/1976 Chilpancingo, Guerrero [Halcon 205]
1) Aristos vs Marcos Nava [mask, hair]
2) ?, El Centauro DQ El Cadete, Hércules

EMLL (FRI) 05/07/1976 Arena Coliseo [Box Y Lucha 1229]
1) El Talismán vs Águila India
2) Mr. Steel vs Satán
3) Sergio Borrayo vs Dr. O’Borman
4) Cacique Mara vs Espectro I
5) Gallo Tapado vs Septiembre Negro
6) El Cobarde vs El Nazi
7) Carlos Plata, El Faraón, El Halcón vs Adorable Rubi, Alfonso Dantes, Tony Salazar

indy (FRI) 05/07/1976 Arena Tropicana, Tehuacán, Puebla [Box Y Lucha 1229]
1) Lobo Negro vs Coarililo
2) Araña Blanca vs Piscis
3) Chimuelo Sanchez, Maya vs Bengala I, Cebra Kid
4) Buddy Montes, Cavernario Galindo vs Kung Fu, Zaratustra

indy (FRI) 05/07/1976 Plaza de Toros, Reynosa, Tamaulipas [https://www.facebook.com/Luchalibredelrecuerdo/photos/223267131432973/ Lucha Libre del Recuerdo]
1) Dory Dixon, El Solitario vs Anibal, Cesar Valentino
2) Blue Demon, El Santo, Huracán Ramírez vs Karloff Lagarde, Ray Mendoza, Rene Guajardo
3) Mil Máscaras  (c) vs Ángel Blanco [IWA HEAVY]

EMLL (SAT) 05/08/1976 Pista Arena Revolución [Box Y Lucha 1229]
1) Joe Marino vs Doberman
2) Gorilla Flores vs El Impacto
3) Agente X vs Invasor
4) Flama Azul vs Dick Angelo
5) Cinta Negra vs Gran Cochisse
6) Estrella Blanca, Mr. Tempest vs Escorpión I, Escorpión II
7) Demonio Blanco, Mano Negra, Máscara Roja vs Coloso Colosetti, Comando I, Comando II

indy (SAT) 05/08/1976 Plaza de Toros Valente Arellano, Torreón, Coahuila [El Siglo de Torreon 1976-05-08]
1) ? vs ??
2) Rayito Sanchez vs Guapo Ibarra
3) Halcón Suriano, La Sombra, Vicente Nuño vs Eric el Rojo, Índio Navajo, The King
4) Caballero Negro, Roy Estrada vs Pelón Águilar, Yuma
5) Polo Torres  (c) vs Jungla Negra I [NORTE HEAVY]

EMLL (SUN) 05/09/1976 Arena Coliseo [Box Y Lucha 1229]
1) Mario Rocca vs Diogenes
2) Dardo Aguilar vs Huroki Sito
3) Henry London vs Alfa Centauris
4) Demonio Blanco, Tony López vs Espectro I, Manuel Robles
5) Blue Demon, Cien Caras, El Cobarde vs Gemelo Diablo I, Gemelo Diablo II, Karloff Lagarde

EMLL (SUN) 05/09/1976 Arena Coliseo Guadalajara [El Informador 1976-05-09]
1) ? vs ??
2) ? vs ??
3) ? vs ??
4) El Monarca, Terremoto vs Gran Markus, Roy Stive
5) Ciclón Veloz Jr., El Faraón, Ringo Mendoza vs Adorable Rubi, Coloso Colosetti, Perro Aguayo

EMLL (SUN) 05/09/1976 Pista Arena Revolución [Box Y Lucha 1229]
1) Oso Blanco vs Gran Davis
2) Mr. Lancer vs Bufalo Salvaje
3) El Trueno vs Roy Lancer
## tiebreaker (draw last week?)
4) Apolo Casillas vs Mr. Steel
5) Rafael Salamanca, Sergio Borrayo vs Araña Atómica, Pantera Azul
6) Carlos Plata, Gallo Tapado vs Septiembre Negro, Tony Salazar

indy (SUN) 05/09/1976 Arena Cocolapan, Orizaba, Veracruz [Box Y Lucha 1229]
1) Índio Yacamba vs Piscis
2) Pantera Negra vs Balam
3) Chimuelo Sanchez, El Maya vs Cebra Kid, Shazam
4) Cavernario Galindo, Golden Boy vs Bengala I, Zaratustra

indy (SUN) 05/09/1976 Arena San Juan Pantitlan, Ciudad Nezahualcóyotl, Estado de México [Box Y Lucha 1229]
1) Alberto Muñoz, Dos Caras vs Rolando Manzur, Villano III
2) Soberbio I, Soberbio II vs Apolo Chino I, Apolo Chino II [mask, hair]
3) Kung Fu vs El Diabólico
4) El Comanche vs Misterio Blanco I
5) Misterio Blanco II vs Black Center

indy (SUN) 05/09/1976 León, Guanajuato [Halcon 204]
1) Hércules León b Black Terror [hair]
## Hercules put his beard on the line

indy (MON) 05/10/1976 Arena Fernando, Toluca, Estado de México [Box Y Lucha 1229]
1) Juan Ramírez vs Mame Juarez, Many Rosales, Tarantula Asesina, Relámpago Rojo, Ray Tony
2) Ángel Romano, Índio Magudu vs Furia Blanca, Novato De Oro

EMLL (TUE) 05/11/1976 Arena Coliseo Guadalajara [El Informador 1976-05-11]
1) ? vs ??
2) ? vs ??
3) ? vs ??
4) Cachorro Mendoza, Ciclón Veloz Jr. vs Espectro Jr., Gran Markus
5) El Faraón, Ringo Mendoza vs Coloso Colosetti, Perro Aguayo

indy (TUE) 05/11/1976 Centro Social, Acapulco, Guerrero [Halcon 205]
1) Lucio Risas DRAW Pegaso
2) Centurión b Príncipe Águila
3) Soberbio I, Soberbio II DQ Apolo Chino I, Apolo Chino II
4) Comanche, Lobo Rubio DQ Kung Fu, Villano I

indy (TUE) 05/11/1976 Salón Acapulco Tropical, Acapulco, Guerrero [Halcon 204]
1) Kung Fu, Villano I b Comanche, Lobo Rubio

indy (WED) 05/12/1976 Arena Coliseo Acapulco, Acapulco, Guerrero [Halcon 206]
1) Chario Silva, Karina vs La Vendetta, Toña La Tapatia
2) Gemelo Diablo I, Gemelo Diablo II, Tony Salazar vs Blue Demon, Cien Caras, Mano Negra

MORA (WED) 05/12/1976 Palacio de los Deportes, Iztacalco, Distrito Federal [Box Y Lucha 1231, https://www.facebook.com/LuchaLibreDeAyerdeHoyYSiempre/posts/886105121437224 DJ Spectro]Attendance: 20000
1) Scorpió b Carlos Mata
2) Alberto Muñoz, El Matematico b Villano I, Villano III
## Munoz challenged V3 to a title match
3) Huracán Ramírez, Tinieblas b Dorrel Dixon, TNT
4) Ángel Blanco, Ray Mendoza b Gran Hamada, Mil Máscaras
## Angel Blanco challenged Mil Mascaras to a title match.
5) Audaz, El Solitario b Anibal, Rayo de Jalisco [relevos suicidas]
## Team Anibal took 1/3.
6) El Solitario b Audaz [mask]
## El Audaz is Domenico Bazan, from Veracruz and 11 years a wrestler. Box Y Lucha 1231 notes most believed Audaz would lose given the people involved.

EMLL (FRI) 05/14/1976 Arena Coliseo [Box Y Lucha 1231]
1) Apolo Casillas b Gorilla Flores
2) Dardo Aguilar b Huroki Sito
3) Sergio Borrayo b Escorpión II
4) Mr. Tempest b Escorpión I
5) As Charro DRAW Gallo Tapado
6) Sangre Chicana DQ El Cobarde
## straight falls DQ for a series of punches
7) Alfonso Dantes, Gemelo Diablo I, Gemelo Diablo II b Carlos Plata, El Faraón, El Halcón

indy (FRI) 05/14/1976 Auditorio Municipal, Ciudad Juárez, Chihuahua [https://www.facebook.com/photo.php?fbid=2550781921825807&set=a.1384329475137730&type=3&theater Jose Renteria]
1) Mil Máscaras vs Coloso Colosetti
2) Blue Demon, El Santo, Huracán Ramírez vs Ray Mendoza, Rizado Ruis, Septiembre Negro
3) El Solitario vs El Infierno
4) Irma González, Rocio vs Chabela Romero, Lola González
5) Fili Estrella, Gulliver vs Gaby Da Silva, Gran Nikolai
&& Year is a guess

indy (SAT) 05/15/1976 Plaza de Toros Valente Arellano, Torreón, Coahuila [El Siglo de Torreon 1976-05-15]
1) ? vs ??
2) ? vs ??
3) Ruben Palma vs Eric el Rojo
4) Chucho Villa, Cuauhtémoc Torres vs Dr. Muerte, Espanto III
5) Flama Roja, Gacela vs El Delfin, Pelón Águilar

EMLL (SUN) 05/16/1976 Acapulco, Guerrero [Halcon 206]
1) Águila India, Gran Cochisse vs El Impacto, Henry London

EMLL (SUN) 05/16/1976 Arena Coliseo [Box Y Lucha 1231]
1) Joe Marino vs Gran Davis
2) Cacique Mara, Cinta Negra vs Estrella Blanca, Máscara Roja and Enrique Vera, Tino Herrera and Dardo Aguilar, Demonio Blanco and El Polaco, Tony Salazar and Pantera Azul, Septiembre Negro and Huroki Sito, Manuel Robles and Espectro I, Espectro Jr. [torneo]

EMLL (SUN) 05/16/1976 Arena Coliseo Guadalajara [El Informador 1976-05-16, Halcon 205]
1) ? vs ??
2) ? vs ??
3) ? vs ??
4) ? vs ??
5) Ringo Mendoza b Perro Aguayo [hair]

indy (SUN) 05/16/1976 Arena KO Algusto, Naucalpan, Estado de México [Halcon 204]
1) Villano I, Villano II, Villano III vs El Matematico, Huracán Ramírez, Memo Ventura

indy (SUN) 05/16/1976 Arena Tijuana 72, Tijuana, Baja California
1) Rafa Moreno vs Soldier Blue
2) Ruso Flores vs La Muralla
3) Dr. O’Borman, Leo López vs El Exorcista, Halcón Dorado
4) El Santo, José Luis Mendieta vs Bruno Victoria, Ruby Ruvalcaba

indy (SUN) 05/16/1976 Plaza de Toros el Progreso, Guadalajara, Jalisco [El Informador 1976-05-16]
1) ? vs ??
2) Marina Rey vs Estela Molina
3) Gran Nikolai vs Gulliver
4) José Torres, Rayo de Jalisco vs Cesar Valentino, El Vikingo
5) Anibal, Audaz, Rubén Juárez vs Kanec, Ray Mendoza, Rene Guajardo
## Kanec is probably Canek.

indy (SUN) 05/16/1976 Santa Cruz Atizapán, Estado de México [Halcon 204]
1) Kung Fu, Ultraman DQ Lobo Rubio, Scorpió

MORA (SUN) 05/16/1976 Centro Social Acapulco Tropical, Acapulco, Guerrero [Halcon 206]
1) Lucio Risas b Centinela
2) Príncipe Águila b Centurión
3) Apolo Chin I, Apolo Chin II b Comanche, Soberbio
4) Chamaco Ortiz, El Matematico b Lobo Rubio, Villano II

EMLL (TUE) 05/18/1976 Arena Coliseo Guadalajara [El Informador 1976-05-18]
1) ? vs ??
2) ? vs ??
3) ? vs ??
4) Cachorro Mendoza, Halcón Dorado vs Karate Hayato, Kimura Sato
5) Ciclón Veloz Jr., Mano Negra, Ringo Mendoza vs Adorable Rubi, Karloff Lagarde, Roy Stive

MORA (TUE) 05/18/1976 Gimnasio Municipal Lic. Benito Juárez, Cuautitlán, Estado de México [Halcon 204]
1) Estrella Del Sur b León Negro Jr.
2) Victor Ramírez b Bulldog Morgan
3) Bengala I, Bengala II, Ultraman b El Tupamaro, La Furia, Villano III
4) León Negro  (c) b Johnny García [CUATITLAN WELTER]
5) Brazo de Oro, Javier Montes b Destino Negro, La Cebra [hair, mask]
## no name listed

indy (WED) 05/19/1976 Arena KO Algusto, Naucalpan, Estado de México [Halcon 205]
1) Barón Rojo I, Barón Rojo II, Memo Ventura vs Golden Boy, Villano I, Villano II

indy (WED) 05/19/1976 Distrito Federal [Halcon 204]
1) Chucho El Roto vs Fantasma de la Opera [DF WELTER]

MORA (WED) 05/19/1976 Palacio de los Deportes, Iztacalco, Distrito Federal [Box Y Lucha 1231, Halcon 205, http://wrestlingclassics.com/.ubb/ultimatebb.php?ubb=get_topic Matt Farmer]
1) Kung Fu b Lobo Rubio
2) Rayo de Jalisco, Ultraman b Babe Face, El Vikingo
3) Dorrel Dixon, Ray Mendoza, Rene Guajardo b Audaz, Huracán Ramírez, Sunny War Cloud
4) Villano III  (c) b Alberto Muñoz [UWA WELTER]
5) Mil Máscaras  (c) b Ángel Blanco [IWA HEAVY]

indy (THU) 05/20/1976 Pachuca, Hidalgo [Box Y Lucha 1231]
1) Dos Caras vs Tiburón
2) Rayo, Tinieblas vs Cesar Valentino, Dory Dixon
3) Anibal, Audaz vs Canek, TNT
4) El Solitario, Mil Máscaras, Santo vs Ángel Blanco, Ray Mendoza, Rene Guajardo

EMLL (FRI) 05/21/1976 Arena Coliseo [Box Y Lucha 1231]
1) Araña Atómica b El Trueno
2) Águila India b Flama Azul
3) Halcón Dorado b Gran Cochisse
4) Sergio Borrayo DRAW Alfa Centauris
5) As Charro b Mr. Tempest
6) Adorable Rubi, Sangre Chicana b Carlos Plata, Mano Negra [semifinal]
7) Blue Demon, El Faraón DQ Alfonso Dantes, Karloff Lagarde [semifinal]
8) Blue Demon, El Faraón b Adorable Rubi, Sangre Chicana [final]
## tecnicos took 2/3

EMLL (SAT) 05/22/1976 Pista Arena Revolución [Box Y Lucha 1231]
1) Mr. Lancer vs Toro Negro
2) El Cobarde, Máscara Roja vs César Silva, Henry London and Estrella Blanca, Tino Herrera and Agente X, Rafael Salamanca and Septiembre Negro, Tony Salazar and Espectro I, Espectro Jr. and Escorpión I, Escorpión II and El Invasor, Huroki Sito [torneo]

EMLL (SUN) 05/23/1976 Arena Coliseo [Box Y Lucha 1231]
1) El Suriano vs Dick Angelo
2) Cacique Mara, Tony López vs Comando I, Comando II
3) Dr. Wagner, Enrique Vera vs Coloso Colosetti, Gemelo Diablo II
4) Demonio Blanco vs Manuel Robles [mask, hair]
5) El Halcón vs Gemelo Diablo I [MEX HEAVY]

EMLL (SUN) 05/23/1976 Arena Coliseo Guadalajara [El Informador 1976-05-23, Halcon 206]
1) ? vs ??
2) ? vs ??
3) ? vs ??
4) ? vs ??
5) Perro Aguayo  (c) b Ringo Mendoza [NWA MIDDLE]

EMLL (SUN) 05/23/1976 Pista Arena Revolución [Box Y Lucha 1231]
1) Joe Marino vs Roy Lancer
2) Talismán vs Bufalo Salvaje
3) Mr. Steel vs Satán
4) Dardo Aguilar vs El Polaco
5) Halcón Dorado, Mr. Tempest vs Alfa Centauris, Leo López
6) Gallo Tapado, Mano Negra vs El Nazi, Sangre Chicana

indy (SUN) 05/23/1976 Arena Raff, Ciudad Nezahualcóyotl, Estado de México [Halcon 205]
1) Bello Greco, El Veterinario vs El Solitario, Halcón Dorado II

indy (SUN) 05/23/1976 Arena San Juan Pantitlan, Ciudad Nezahualcóyotl, Estado de México [Box Y Lucha 1231]
1) Al Suarez vs Juan Manuel
2) Ariman vs El Comanche
3) Apolo Chino I, Estrella Del Sur vs Bárbaro Fonseca, Jorge Ortiz
4) El Sanguinario vs Fantastic [super libre]
5) Buddy Montes, Judas, Rolando Manzur vs El Cóndor, Johnny García, Potro Salvaje

indy (SUN) 05/23/1976 Plaza de Toros Valente Arellano, Torreón, Coahuila [El Siglo de Torreon 1976-05-23]
1) ? vs ??
2) ? vs ??
3) ? vs ??
4) Espanto III, The King vs La Sombra, Ruben Palma
5) El Delfin, Jungla Negra I, Pelón Águilar vs El Vengador, Flama Roja, Gacela

EMLL (TUE) 05/25/1976 Arena Coliseo Guadalajara [El Informador 1976-05-25]
1) ? vs ??
2) ? vs ??
3) ? vs ??
4) Cachorro Mendoza, El Vengador vs Bruno Victoria, Iván El Bronco
5) Carlos Plata, Ciclón Veloz Jr., Ringo Mendoza vs Alfonso Dantes, Karloff Lagarde, Perro Aguayo

MORA (TUE) 05/25/1976 Gimnasio Municipal Lic. Benito Juárez, Cuautitlán, Estado de México [Halcon 205]
1) Alberto Muñoz, Brazo de Oro, Tawa Vera vs el Signo, Lobo Rubio, Villano III
2) Hombre Nuclear, Huracán Ramírez, Mil Máscaras vs Ángel Blanco, Canek, El Vikingo

indy (WED) 05/26/1976 Chilpancingo, Guerrero [Halcon 240]
1) Aristos b Marcos Nava [hair]

MORA (WED) 05/26/1976 Palacio de los Deportes, Iztacalco, Distrito Federal [Halcon 205, Halcon 206]
1) Golden Rogers b Astro Rey
2) El Matematico, Ultraman b Villano I, Villano II
3) Joe Torres, Mil Máscaras b Canek, Cesar Valentino
4) Dr. Wagner, El Solitario DQ Ángel Blanco, Ray Mendoza
## Wagner's debut with this group. Mendoza fouled Wagner in a brawl.
5) Rene Guajardo, Villano III b Anibal, Gran Hamada [relevos suicidas]
6) Anibal b Gran Hamada [mask, hair]

EMLL (FRI) 05/28/1976 Arena Coliseo [Halcon 206]
1) Impacto b Bufalo Salvaje
## Impacto is the current DF MIDDLE champ
2) Rafael Salamanca DRAW El Polaco
3) Tino Herrera DQ Alfa Centauris
4) César Silva b Leo López
5) Bruno Victoria b Cacique Mara
6) Máscara Roja DCOR Coloso Colosetti
7) Gemelo Diablo I, Gemelo Diablo II, Perro Aguayo DQ Carlos Plata, El Faraón, El Halcón
## Straight falls. Faraon fouled Aguayo, wants a title match with him

EMLL (SAT) 05/29/1976 Guadalajara, Jalisco [Halcon 207]
1) Fishman  (c) vs Blue Demon [NWA WELTER]

EMLL (SUN) 05/30/1976 Arena Coliseo Guadalajara [El Informador 1976-05-30]
1) ? vs ??
2) ? vs ??
3) ? vs ??
4) Cachorro Mendoza, El Vengador vs Iván El Bronco, Roy Stive
5) Carlos Plata, El Halcón, El Santo vs Alfonso Dantes, Sangre Chicana, Tony Salazar

indy (SUN) 05/30/1976 Club Deportivo Rolando Vera, Col. Tolteca, Guadalupe, Nuevo Leon [https://www.facebook.com/Luchalibredelrecuerdo/photos/357521438007541 Lucha Libre del Recuerdo]
1) Versátil vs Victor Hernández
2) El Diulvio vs Johnny Ramírez
3) Budu vs Daga Infernal
4) Garringo, Relámpago Ramírez vs Bello David, Texano
5) Mr. Niebla, Némesis vs Cavernario Galindo II, Rudy Reyna

indy (SUN) 05/30/1976 Plaza de Toros Valente Arellano, Torreón, Coahuila [El Siglo de Torreon 1976-05-30]
1) ? vs ??
2) ? vs ??
3) Carlos Jaquez vs Halcón Suriano
4) Bon Hitler, El Delfin, Espanto III vs La Sombra, Mr. Occidente, Ruben Palma
5) Cuauhtémoc Torres, Flama Roja vs Gran Markus, Pelón Águilar

EMLL (TUE) 06/01/1976 Arena Coliseo Guadalajara [El Informador 1976-06-01]
1) ? vs ??
2) ? vs ??
3) ? vs ??
4) Cesar Curiel, El Monarca vs Sangre Chicana, Sangre India
5) Carlos Plata, El Halcón vs Alfonso Dantes, Tony Salazar

indy (TUE) 06/01/1976 Auditorio, Cuautitlán, Estado de México [Halcon 206]
1) Cesar Valentino, el Signo, Lobo Rubio vs El Matematico, Huracán Ramírez, Tawa Vera
2) Anibal, Black Terry, El Solitario vs Ángel Blanco, Bestia Nazi, Ray Mendoza

indy (SAT) 06/05/1976 Plaza de Toros Valente Arellano, Torreón, Coahuila [El Siglo de Torreon 1976-06-05]
1) ? vs ??
2) ? vs ??
3) Eric el Rojo vs Halcón Suriano
4) Carlos Jaquez, Espanto III, Pelón Águilar vs La Sombra, Ruben Palma, Vicente Nuño
5) Sangre Chicana, Sangre India vs Demonio Blanco, Gacela
## debuts of all but Gacela (who debuted last week)

EMLL (SUN) 06/06/1976 Arena Coliseo Acapulco, Acapulco, Guerrero [Halcon 240]
1) Braulio Mendoza, Lizmark b Extraño, Mario Valenzuela [relevos suicidas]
2) Mario Valenzuela b Extraño [mask]
## name cut off in the recap

EMLL (SUN) 06/06/1976 Arena Coliseo Guadalajara [El Informador 1976-06-06]
1) ? vs ??
2) ? vs ??
3) ? vs ??
4) Escorpión I, Escorpión II vs Cesar Curiel, El Monarca
5) Blue Demon, Carlos Plata, El Halcón vs Alfonso Dantes, Fishman, Tony Salazar

MORA (SUN) 06/06/1976 Villahermosa, Tabasco [Halcon 207]
1) Audaz  (c) b Canek [UWA LH]

indy (MON) 06/07/1976 Arena Municipal, Tampico, Tamaulipas [https://www.facebook.com/LuchaLibreDeAyerdeHoyYSiempre/posts/720829614631443 DJ Spectro]
1) Buddy Cervantes vs El Jaibo II
2) El Emperador vs El Predicador
3) El Jibali, Mazambula vs Carlos Mata, Satánico
4) Asesino Negro, Índio Vitela vs Alberto Muñoz, José Torres [relevos suicidas]
5) Asesino Negro b Índio Vitela [hair]

EMLL (TUE) 06/08/1976 Arena Coliseo Guadalajara [El Informador 1976-06-08]
1) ? vs ??
2) ? vs ??
3) ? vs ??
4) Carlos Plata, El Vengador, José Luis Mendieta vs Roy Stive, Tony Salazar, Yuma
5) Blue Demon, El Halcón vs Alfonso Dantes, Fishman

indy (TUE) 06/08/1976 Auditorio Municipal, Ciudad Juárez, Chihuahua
1) Anibal, El Solitario vs Ángel Blanco, El Vikingo
2) El Jaguar, Villano II vs ?
## may be a mask match against each other
&& Melchor Vera promoter

EMLL (FRI) 06/11/1976 Arena México [http://www.facebook.com/cmll.oficial/photos/a.352219088254374.1073741827.351036975039252/583883411754606/?type=1 CMLL, Punch 95, RB]
1) Carlos Plata, Ringo Mendoza DQ Gemelo Diablo I, Gemelo Diablo II [hair]
2) Perro Aguayo  (c) b El Faraón [NWA MIDDLE]
&& Punch 96 says Santo appeared and Fishman maybe defended his title, but not a sell out.

MORA (FRI) 06/11/1976 Palacio de los Deportes, Iztacalco, Distrito Federal [Halcon 206]
1) Solar I vs Bello Greco
2) Alberto Muñoz, El Matematico, Ultraman vs Villano I, Villano II, Villano III
3) Audaz, Rayo de Jalisco vs Canek, Rene Guajardo
4) Dr. Wagner, El Solitario vs Ángel Blanco, Ray Mendoza
5) Anibal vs Gran Hamada  (c) [UWA MIDDLE]

DdV (SUN) 06/13/1976 Plaza de Toros La Monumental, Monterrey, Nuevo León [Halcon 207, Punch 95]
1) Anibal, Dr. Wagner vs Cesar Valentino, Rene Guajardo
## may not be in the same match, just listed as appearing. Punch 95 Anibal being suspended for 6 months after hitting a referee after a UWA MIDDLE title match in Palacio de los Deportes; Halcon 207's preview doesn't mention a title match.
2) El Matematico, Ultraman vs Gallo de Oro, Solar I [relevos suicidas]
3) ? vs ?? [mask]
4) Villano III  (c) vs Alberto Muñoz [UWA WELTER]
&& Division del Norte 2nd anniverasry show

EMLL (SUN) 06/13/1976 Arena Coliseo Guadalajara [El Informador 1976-06-13]
1) ? vs ??
2) ? vs ??
3) ? vs ??
4) El Vengador, José Luis Mendieta vs El Bronco, Septiembre Negro
5) Blue Demon, El Cobarde, El Halcón vs Alfonso Dantes, Fishman, Tony Salazar

indy (SUN) 06/13/1976 Arena KO Algusto, Naucalpan, Estado de México [Halcon 207]
1) Estrella Del Sur, Javier Llanes vs Bulldog Morgan, Negro Navarro

indy (SUN) 06/13/1976 Plaza de Toros Valente Arellano, Torreón, Coahuila [El Siglo de Torreon 1976-06-13]
1) ? vs ??
2) ? vs ??
3) Ruben Palma vs Carlos Jaquez
4) Halcón Suriano, La Sombra, Vicente Nuño vs Espanto III, Pelón Águilar, The King
5) Demonio Blanco, El Ídolo vs Coloso Colosetti, Roy Steve

EMLL (TUE) 06/15/1976 Arena Coliseo Guadalajara [El Informador 1976-06-15]
1) ? vs ??
2) ? vs ??
3) ? vs ??
4) El Ídolo, Solder Blue vs Flama Roja, Pantera Azul
5) El Cobarde, El Halcón, Terremoto vs Alfonso Dantes, Tony Salazar, Yuma

MORA (WED) 06/16/1976 Palacio de los Deportes, Iztacalco, Distrito Federal [http://wrestlingclassics.com/cgi-bin/.ubbcgi/ultimatebb.cgi?ubb=get_topic Matt Farmer, Punch 95]
1) El Solitario, Ultraman DQ Ángel Blanco, Sunny War Cloud [losers advance, eightfinal]
2) Anibal, José Torres b Babe Face, Villano III [losers advance, eightfinal]
3) Alberto Muñoz, Audaz b Cesar Valentino, Rene Guajardo [losers advance, eightfinal]
4) Dorrel Dixon, TNT b El Matematico, Huracán Ramírez [losers advance, eightfinal]
5) Ángel Blanco, Sunny War Cloud b Babe Face, Villano III [losers advance, quarterfinal]
6) Cesar Valentino, Rene Guajardo b El Matematico, Huracán Ramírez [losers advance, quarterfinal]
7) El Matematico, Huracán Ramírez b Babe Face, Villano III [losers advance, semifinal]
8) Villano III b Babe Face [hair, losers advance, final]
9) Dr. Wagner  (c) b Ray Mendoza [MEX LH]
## first national title defense in a Mora promotion show (Wagner jumped as champ)
&& Originally billed as an all mask match tournament with Solitario, Anibla, Huracan Ramirez, Rostro, Ultraman, Matematico, Villano I, Villano II, VIllano II, Rayo de Jalisco, Astro Rey, Solar, Canek, Tupamaro , Dos Caras and Golden Rogers.

indy (THU) 06/17/1976 Auditorio Municipal, Torreón, Coahuila [El Siglo de Torreon 1976-06-17]
1) ? vs ??
2) ? vs ??
3) Frankenstein, TNT vs Dos Caras, José Torres
4) Anibal, Rayo de Jalisco, Tinieblas vs Ángel Blanco, Canek, Dorrel Dixon
5) Audaz  (c) vs El Solitario [UWA LH]

EMLL (FRI) 06/18/1976 Arena Coliseo [Punch 95]
1) Carlos Plata, El Faraón, Ringo Mendoza b Gemelo Diablo I, Gemelo Diablo II, Raúl Reyes

Indy (SAT) 06/19/1976 Yoli Ramirez, Guadalajara, Jalisco [RL]
1) El Hawaiano vs Apolo Romano
2) Raúl Armas vs Pancho Ramírez
3) El Ídolo, Eolo vs Calavera II, Sangre India
4) Blue Demon, El Vengador, Terremoto vs Septiembre Negro, Tony Salazar, Yuma

indy (SUN) 06/20/1976 Cancha Muniicipal, Ciudad Frontera, Coahuila
1) Alberto Mora vs El Salvaje, Memo Ramírez, Cavernario Sanchez, Costeñito Moy, Flama Del Sur, La Bestia Negra, Rey Veloz, Jonny Estrada, Espartaco
&& first show of season

Indy (SUN) 06/20/1976 Coliseo Olimpico Universidad de Guadalajara, Guadalajara, Jalisco [RL]
1) Chino García vs El Faisán
2) Dracula vs Astral
3) Charito Silva, Irma Águilar, Irma González vs Chabela Romero, Toña La Tapatia, Viuda Negra
4) Alberto Cortes, Luis Vera vs Americo Cortes, Rey Centella

Indy (SUN) 06/20/1976 Gimnasio Rio de Janerio, Guadalajara, Jalisco [RL]
1) Ave Fénix vs Tino Gomez
2) Danny Sanchez vs El Renegado
3) Rudy Mora, Verdugo Nazi vs Gran Charly, Príncipe Negro
&& date is a guess

indy (SUN) 06/20/1976 Plaza de Toros el Progreso, Guadalajara, Jalisco [El Informador 1976-06-20]
1) Alberto Muñoz, Rayo de Jalisco vs Lobo Rubio, Renato Torres
2) Ultraman vs El Matematico  (c) [UWA LIGHT]
3) Dr. Wagner vs Cesar Valentino
4) Ángel Blanco, El Solitario vs Anibal, Ray Mendoza
5) Frankenstein vs TNT [mask, hair]

EMLL (TUE) 06/22/1976 Arena Coliseo [Punch 95]
1) Mario Rocca vs Oso Blanco
2) Mr. Lancer vs Roy Lancer
3) Talismán vs Irazú
4) Cachorro Mendoza, Flama Azul vs Águila India, Tauro
5) Cacique Mara, Cinta Negra vs Leo López, Manuel Robles
6) Ciclón Veloz, Demonio Blanco, El Cobarde vs El Nazi, Raúl Reyes, Sangre Chicana

EMLL (TUE) 06/22/1976 Arena Coliseo Guadalajara [El Informador 1976-06-22]
1) ? vs ??
2) ? vs ??
3) ? vs ??
4) Chela Salazar, Irma González vs Chabela Romero, La Viuda Negra
5) Blue Demon, Ringo Mendoza, Terremoto vs Alfonso Dantes, Fishman, Tony Salazar

indy (TUE) 06/22/1976 Arena Raff, Ciudad Nezahualcóyotl, Estado de México [https://twitter.com/lucha_femeniles/status/1406063943345442819/photo/1 @lucha_femeniles]
1) El Trampas vs Rocambole
2) Príncipe vs Ermitano
3) Misterio Blanco I, Zimba vs El Gangster, Marduck
4) Halcón Dorado II, Orfeo Negro vs 13 Negro, Barba Negra
5) Bengala I, Bengala II, Kung Fu vs Danny Cruz, Luis Mariscal, Mario el Exotico

indy (THU) 06/24/1976 Auditorio Municipal, Torreón, Coahuila [El Siglo de Torreon 1976-06-24]
1) ? vs ??
2) ? vs ??
3) Alberto Muñoz, Rubén Juárez vs El Greco, Sergio Sarabia
4) Huracán Ramírez, José Torres, Mil Máscaras vs Rene Guajardo, TNT, Villano III
5) Anibal vs Ángel Blanco

indy (THU) 06/24/1976 Nueva Arena Apatlaco, Iztapalapa, Distrito Federal [Punch 95]
1) Joe Marino vs Toro Toro
2) Dardo Aguilar vs Rodolfo Ruiz
3) César Silva, Estrella Blanca vs Huroki Sito, Tauro
4) El Cobarde, Mano Negra vs Karloff Lagarde, Raúl Reyes

EMLL (FRI) 06/25/1976 Arena Coliseo [Punch 95]
1) Dick Angelo vs El Trueno
2) Dr. O’Borman vs Rafael Salamanca
3) César Silva vs Manuel Robles
4) Cacique Mara vs Comando II
5) Tony López vs Comando I
6) Demonio Blanco vs El Nazi
7) Blue Demon, Carlos Plata, El Faraón vs Adorable Rubi, Fishman, Perro Aguayo

EMLL (SAT) 06/26/1976 Pista Arena Revolución [Punch 95]
1) El Suriano vs Oso Blanco [MEX WELTER, torneo]
2) Talismán vs Diogenes [MEX WELTER, torneo]
3) Remo vs Roy Steve [MEX WELTER, torneo]
4) Dardo Aguilar vs The King I [MEX WELTER, torneo]
5) Cachorro Mendoza vs Rodolfo Ruiz [MEX WELTER, torneo]
6) Halcón Dorado, Mr. Tempest vs Espectro I, Leo López
7) Gallo Tapado, Máscara Roja, Ringo Mendoza vs Karloff Lagarde, Sangre Chicana, Tony Salazar

indy (SAT) 06/26/1976 Nueva Arena Apatlaco, Iztapalapa, Distrito Federal [Punch 95]
1) Chico Baeza vs Fili Guerrero
2) Bengala I, Bengala II vs Bárbaro Fonseca, Dick Angelo
3) El Polaco, Manuel Robles vs Demonio Blanco, Flama Azul
4) Tinieblas vs Raúl Reyes

EMLL (SUN) 06/27/1976 Arena Coliseo [Punch 95]
1) Joe Marino vs Gran Davis
2) Mr. Steel vs Satán
3) Halcón Dorado vs Henry London
4) Cacique Mara, Sergio Borrayo vs Bruno Victoria, Índio Vitela
5) Carlos Plata, El Cobarde, Mano Negra vs Perro Aguayo, Raúl Reyes, Tony Salazar

EMLL (SUN) 06/27/1976 Arena Coliseo Guadalajara [El Informador 1976-06-27]
1) ? vs ??
2) ? vs ??
3) El Ídolo, El Monarca vs Comando I, Comando II
4) El Vengador vs Iván El Bronco [mask, hair]
5) Cien Caras, El Santo, Terremoto vs Adorable Rubi, Alfonso Dantes, Coloso Colosetti

EMLL (SUN) 06/27/1976 Pista Arena Revolución [Punch 95]
1) Mario Rocca vs Bufalo Salvaje
2) Agente X vs El Invasor
3) El Trueno vs Dick Angelo
4) Cinta Negra vs Araña Atómica
5) César Silva, Flama Azul vs Huroki Sito, Tauro
6) Demonio Blanco, El Faraón vs El Nazi, Fishman

indy (SUN) 06/27/1976 Arena San Juan Pantitlan, Ciudad Nezahualcóyotl, Estado de México [Punch 95]
1) Black Center vs Estrella Roja
2) Ariman vs Bárbaro Fonseca
3) Al Suarez vs Misterio Blanco II
4) Chico Veloz, Puños De Oro II vs Danny Cruz, Verdugo Negro
5) El Matematico, Fantastik, Potro Salvaje vs El Chicano, El Sanguinario, El Veterinario

indy (SUN) 06/27/1976 Plaza de Toros el Progreso, Guadalajara, Jalisco [El Informador 1976-06-27]
1) ? vs ??
2) ? vs ??
3) Lobo Rubi, Máscara Roja vs Insólito, Solar I
4) Ángel Blanco, Frankenstein, Renato Torres vs Audaz, Dos Caras, Ultraman
5) Rayo de Jalisco, Tinieblas vs El Solitario, Terremoto Kid [relevos sucidas]

indy (SUN) 06/27/1976 Plaza de Toros Valente Arellano, Torreón, Coahuila [El Siglo de Torreon 1976-06-27]
1) ? vs ??
2) ? vs ??
3) Vicente Nuño vs Carlos Jaquez
4) Karate Ayato, Kimura Sato vs Espanto III, Jungla Negra I
## listed as two Japanese karate fighters, these fighters come later in the year.
5) Enrique Vera, Titán I, Titán II vs As Charro, Gran Markus, Pelón Águilar

MORA (SUN) 06/27/1976 Plaza de Toros el Cortijo, Venustiano Carranza, Distrito Federal [Punch 95]
1) Mr. Lancer vs Oso Blanco
2) Talismán vs Águila India
3) Remo vs The King I
4) Mr. Tempest, Tony López vs Leo López, Manuel Robles
5) Máscara Roja, Ringo Mendoza vs Espectro I, Karloff Lagarde

EMLL (TUE) 06/29/1976 Arena Coliseo Guadalajara [El Informador 1976-06-29]
1) ? vs ??
2) ? vs ??
3) ? vs ??
4) Eolo, Luis Vera vs Calavera I, Calavera II
5) Cien Caras, José Luis Mendieta, Terremoto vs Adorable Rubi, Coloso Colosetti, Septiembre Negro

indy (THU) 07/01/1976 Auditorio Municipal, Torreón, Coahuila [El Siglo de Torreon 1976-07-01]
1) ? vs ??
2) ? vs ??
3) ? vs ??
4) Karina, Marina Rey, Norma González vs Estela Molina, La Vendetta, Pantera Suriana
5) Dr. Wagner, Gran Hamada vs Espanto II, Rene Guajardo

EMLL (SUN) 07/04/1976 Arena Coliseo Guadalajara [El Informador 1976-07-04]
1) ? vs ??
2) ? vs ??
3) ? vs ??
4) Apolo Casillas, José Luis Mendieta vs Médico I, Médico II
5) Cien Caras, El Halcón, Mano Negra vs Alfonso Dantes, Judas, Karloff Lagarde

EMLL (TUE) 07/06/1976 Arena Coliseo Guadalajara [El Informador 1976-07-06]
1) ? vs ??
2) ? vs ??
3) ? vs ??
4) Cesar Curiel, El Vengador vs Escorpión I, Escorpión II
5) El Halcón, Mano Negra, Terremoto vs Judas, Karloff Lagarde, Septiembre Negro

EMLL (THU) 07/08/1976 Arena Coliseo Acapulco, Acapulco, Guerrero [Halcon 240]
1) Fishman  (c) b Blue Demon [NWA WELTER]
2) El Halcón  (c) b Gemelo Diablo [MEX HEAVY]
&& 69705 pesos gate

indy (THU) 07/08/1976 Auditorio Municipal, Torreón, Coahuila [El Siglo de Torreon 1976-07-08]
1) Dr. Wagner, Gran Hamada vs Espanto II, TNT and Humberto Garza, Rubén Juárez and Bello Greco, Sergio Sarabia and José Torres, Sunny War Cloud and Kux Kux Klan I, Kux Kux Klan II and Tigre Del Ring, Tigre Del Ring I and Hermano Escobedo I, Hermano Escobedo II

EMLL (SUN) 07/11/1976 Arena Coliseo Guadalajara [El Informador 1976-07-11]
1) ? vs ??
2) ? vs ??
3) ? vs ??
4) Apolo Casillas, Cinta Negra vs Black Killer, Yuma
5) Mano Negra, Ringo Mendoza vs Alfonso Dantes, Karloff Lagarde and Carlos Plata, Cien Caras and Judas, Septiembre Negro

indy (SUN) 07/11/1976 Plaza de Toros Valente Arellano, Torreón, Coahuila [El Siglo de Torreon 1976-07-11]
1) ? vs ??
2) Ciclón Negro vs Rayito Sanchez
3) Espanto III vs Vicente Nuño
4) Arizona, Rommel vs Hermano Alcala I, Marco Alcala
5) Bruno Victoria, El Exorcista, El Nazi vs Cacique Mara, Titán I, Titán II

EMLL (TUE) 07/13/1976 Arena Coliseo Guadalajara [El Informador 1976-07-13]
1) ? vs ??
2) ? vs ??
3) ? vs ??
4) Irma Águilar, Irma González vs Chabela Romero, Chela Salazar
5) Carlos Plata, Mano Negra, Terremoto vs Comando I, Judas, Karloff Lagarde

EMLL (FRI) 07/16/1976 Arena México [RB]
1) Carlos Plata b Adorable Rubi  (c) [NWA LH]

indy (SAT) 07/17/1976 El Carmen Tequexquitla, Tlaxcala [https://www.facebook.com/photo/?fbid=513384506964490&set=g.1063818623692271 Angel Luzbel Nezahualcoyotl]
1) Araña Solitario, El Egipcio, Flamingo, Leopardo, Pequeño Guerrero, Vengador Errante vs Black Hernández, Diamante Azul, El Caiman, El Mosquetero, El Universitario, Jungla Roja
2) Black Center, El Dinámico vs Danny Cruz, Negro Navarro

EMLL (SUN) 07/18/1976 Arena Coliseo Guadalajara [El Informador 1976-07-18]
1) ? vs ??
2) ? vs ??
3) ? vs ??
4) Mano Negra b Karloff Lagarde [NWA WELTER, #1 Contenders]
## Listed as Middlewieght, should've been Welterweight. Winner gets a shot at Fishman. Mano Negra is listed as getting the title shot the following week.
5) Cien Caras, Demonio Blanco, Ringo Mendoza vs Gemelo Diablo I, Gemelo Diablo II, Perro Aguayo

indy (SUN) 07/18/1976 Plaza de Toros Valente Arellano, Torreón, Coahuila [El Siglo de Torreon 1976-07-18]
1) Centella Azul vs Guapo Ibarra
2) Mario Saucedo vs El Fraterno
3) Ruben Palma vs Eric el Rojo
4) Caballero Negro, Cuauhtémoc Torres, La Sombra vs Espanto III, Pelón Águilar, The King
5) Ciclón Veloz Jr., Enrique Vera vs Bruno Victoria, Judas

EMLL (TUE) 07/20/1976 Arena Coliseo Guadalajara [El Informador 1976-07-20]
1) ? vs ??
2) ? vs ??
3) ? vs ??
4) Apolo Casillas, José Luis Mendieta vs Septiembre Negro, Yuma
5) El Santo, Mano Negra, Terremoto vs Gemelo Diablo I, Gemelo Diablo II, Karloff Lagarde

EMLL (SUN) 07/25/1976 Arena Coliseo Acapulco, Acapulco, Guerrero [Halcon 240]
1) Máscara Roja, Rayo de Jalisco b Coloso Colosetti, Raúl Reyes
&& 33340 pesos gate

EMLL (SUN) 07/25/1976 Arena Coliseo Guadalajara [El Informador 1976-07-25]
1) ? vs ??
2) ? vs ??
3) ? vs ??
4) El Faraón, Ringo Mendoza, Terremoto vs Gran Markus, Perro Aguayo, Yuma
5) Fishman  (c) vs Mano Negra [NWA WELTER]

indy (SUN) 07/25/1976 Plaza de Toros Valente Arellano, Torreón, Coahuila [El Siglo de Torreon 1976-07-25]
1) ? vs ??
2) Ciclón Negro vs Mario Saucedo
3) Índio Navajo, The King vs Halcón Suriano, Vicente Nuño
4) Espanto II, Pelón Águilar vs Hermano Alcala I, Marco Alcala
5) Judas, Karloff Lagarde vs Ciclón Veloz Jr., Dardo Aguilar

EMLL (TUE) 07/27/1976 Arena Coliseo Guadalajara [El Informador 1976-07-27]
1) ? vs ??
2) ? vs ??
3) ? vs ??
4) Apolo Casillas, El Vengador vs Rodolfo Ruiz, Sangre India
5) El Faraón, Mano Negra, Ringo Mendoza vs Fishman, Gran Markus, Perro Aguayo

EMLL (FRI) 07/30/1976 Arena Coliseo [Lucha Libre 666, http://superluchas.com/2015/07/30/en-un-dia-como-hoy-2008-fallace-el-maestro-alfonso-dantes-1976-blue-demon-vs-mano-negra-por-el-campeonato-nacional-de-peso-welter/ SuperLuchas]
1) Flama Azul b Satán
2) César Silva b Huroki Sito
3) Henry London DQ Bruno Victoria
4) Mr. Tempest b Septiembre Negro
5) Carlos Plata, El Halcón DQ Alfonso Dantes, Gran Markus
6) Enrique Vera b Raúl Reyes [hair]
7) Blue Demon, Mano Negra b Cachorro Mendoza, César Silva, Dardo Aguilar, El Centauro, Espectro I, Estrella Blanca, Gallo Tapado, Hermano King I, Ráfaga Moreno, Remo, Rodolfo Ruiz, Roy Stive, Tauro [MEX WELTER, torneo]
## Vacant title (Fishman won NWA WELTER.) Method of tournament not specified, only Demon & Negro being in the final; tournament likely happened on previous shows. King I is Norte Welterweight Champion. Remo is Occidente (Welterweight?) champion.
8) Blue Demon b Mano Negra [MEX WELTER]

EMLL (SUN) 08/01/1976 Arena Coliseo Guadalajara [El Informador 1976-08-01]
1) ? vs ??
2) ? vs ??
3) ? vs ??
4) El Ídolo, Tony López vs Flama Roja, Iván El Bronco
5) Fishman, Gemelo Diablo I, Gemelo Diablo II vs El Faraón, Máscara Roja, Ringo Mendoza

indy (SUN) 08/01/1976 Plaza de Toros Valente Arellano, Torreón, Coahuila [El Siglo de Torreon 1976-08-01]
1) ? vs ??
2) ? vs ??
3) Halcón Suriano, Mario Saucedo vs Eric el Rojo, The King
4) La Sombra, Vicente Nuño vs Espanto III, Jungla Negra II
5) Cien Caras, Polo Torres vs As Charro, Pelón Águilar

EMLL (TUE) 08/03/1976 Arena Coliseo Guadalajara [El Informador 1976-08-03]
1) ? vs ??
2) ? vs ??
3) ? vs ??
4) Marco Alcala, Mario Alcala vs Calavera I, Calavera II
5) El Faraón, El Vengador, José Luis Mendieta vs Fishman, Médico I, Médico II

EMLL (SUN) 08/08/1976 Arena Coliseo Guadalajara [El Informador 1976-08-08]
1) ? vs ??
2) ? vs ??
3) ? vs ??
4) Flama Roja, Índio Vitela vs Apolo Casillas, José Luis Mendieta
5) El Faraón, Enrique Vera, Ringo Mendoza vs Fishman, Gemelo Diablo I, Gemelo Diablo II

indy (SUN) 08/08/1976 Plaza de Toros La Monumental, Monterrey, Nuevo León [Halcon 217]
1) Anibal, El Solitario b Cesar Valentino, Ray Mendoza
2) Gran Hamada b Babe Face [UWA MIDDLE]
## Hamada took 1/3
3) Dos Caras, Tawa Vera b Atila, Espanto II
4) Mario Segura, Pequeño Diamante vs La Momia, Tarzan Rocha
5) Astro Azul vs Chamaco Escobedo
&& another good turnout

indy (SUN) 08/08/1976 Plaza de Toros Valente Arellano, Torreón, Coahuila [El Siglo de Torreon 1976-08-08]
1) ? vs ??
2) ? vs ??
3) Halcón Suriano, Vicente Nuño vs Índio Navajo, The King
4) Cuauhtémoc Torres, La Sombra vs Espanto III, Pelón Águilar
5) El Santo, Máscara Roja vs Alfonso Dantes, As Charro

EMLL (TUE) 08/10/1976 Arena Coliseo Guadalajara [El Informador 1976-08-10]
1) ? vs ??
2) ? vs ??
3) ? vs ??
4) Calavera I, Pantera Azul vs Cinta Negra, Sergio Borrayo
5) El Vengador, Enrique Vera, Ringo Mendoza vs Gemelo Diablo I, Médico I, Médico II

indy (TUE) 08/10/1976 Cuautitlán, Estado de México [Halcon 217]
1) Zeus vs El Matematico
2) El Bello Greco, Príncipe Rebelde, Sergio el Hermoso vs Arkángel, Dr. Wagner, El Rostro

EMLL (FRI) 08/13/1976 Arena Coliseo [Halcon 217]
1) Araña Atómica b Talismán
2) El Reo b Rafael Salamanca
3) Kimura Sato b Sergio Borrayo
4) Cacique Mara b Yuma
5) El Cobarde DQ Bruno Victoria
6) Carlos Plata, El Halcón DRAW Alfonso Dantes, Rubí Ruvalcaba
## tecnicos took 1, rudos took 2, Halocn knocked himself and Ruvalcaba out on a dive and Dantes & Plata went to a double pin on a tapatia
7) Cien Caras, Enrique Vera b Gran Markus, Sangre Chicana

indy (SAT) 08/14/1976 Deportivo Lopez Velarde, Tepito, Cuauhtémoc, Distrito Federal [Halcon 217]
1) Lobo Rubio, Scorpió vs Hermano Escobedo I, Hermano Escobedo II
2) Villano I, Villano II vs Fantastic, Hombre Nuclear

indy (SAT) 08/14/1976 Gimnasio, Tláhuac, Distrito Federal [Halcon 217]
1) Enfermero Jr. b Solar I [DF WELTER]

indy (SAT) 08/14/1976 Nueva Arena Apatlaco, Iztapalapa, Distrito Federal [Halcon 217]
1) Mil Máscaras vs Cesar Valentino

MORA (SAT) 08/14/1976 Cuautitlán, Estado de México [Halcon 217]
1) La Furia vs Pepe Casas
2) Huichol Tapatío vs Black Terry
3) Hermano Escobedo I, Hermano Escobedo II, Liviathan vs El Tupamaro, Lobo Rubio, Príncipe Rebelde
4) Arkángel, El Rostro vs Ángel Blanco, Astro Rey
5) El Matematico  (c) vs Zeus [UWA LIGHT]

CNOP (SUN) 08/15/1976 Estadio Laguna, Gómez Palacio, Durango [http://h.elsiglodetorreon.com.mx/Repository/getFiles.asp?Style=OliveXLib:LowLevelEntityToSaveGifMSIE_ELSIGLO&Type=text/html&Locale=spanish-skin-custom&Path=EDT/1976/08/15&ChunkNum=-1&ID=Ar00409&PageLabel=4 El Siglo de Torreon]
1) Carnicero Águilar vs Tarzan Rocha
2) Pequeño Diamante vs Mario Segura
3) José Torres, Torbellino Blanco vs El Destroyer, Espanto II
4) Anibal, El Solitario vs El Vikingo, Ray Mendoza

EMLL (SUN) 08/15/1976 Arena Coliseo Guadalajara [El Informador 1976-08-15]
1) ? vs ??
2) ? vs ??
3) ? vs ??
4) Cesar Curiel, El Vengador vs Huroki Sito, Pantera Azul
5) El Santo, Mil Máscaras, Ringo Mendoza vs Fishman, Gemelo Diablo I, Gemelo Diablo II

indy (SUN) 08/15/1976 Arena Jalisco, Guadalajara, Jalisco [KO 1215]
1) Cóndor Blanco DRAW Chamaco Rodríguez
2) Jarocho b Tartaro
3) Astro Negro, Jaime El Príncipe b Cadáver Viviente, Gran Dabu
4) Luis Bustos, Mascare b Danubi Blanco, La Pantera
5) Bestia Nazi, TNT b Gran Gongora, Luis Canales
&& good turnout

indy (SUN) 08/15/1976 Coliseo Olimpico Universidad de Guadalajara, Guadalajara, Jalisco [KO 1215]
1) Chino García b Simba
2) Asesino Negro b Raúl Torres
3) Inmortal, Spider b Monje Loco, Raúl Armas
4) Apolo Casillas, José Luis Mendieta b Flama Roja, Sangre India

indy (SUN) 08/15/1976 Plaza de Toros el Cortijo, Venustiano Carranza, Distrito Federal [http://superluchas.com/2015/06/12/el-cortijo-esta-siendo-demolido-la-historia-de-uno-de-los-principales-escenarios-luchisticos-de-la-ciudad-de-mexico/ SuperLuchas]
1) Rams vs Dante Villeda
2) Arturo Cruz vs El Centinela
## This Centinela is Teddy Baños
3) El Vagabundo vs Nahur Kaliff
4) Bello Greco, Sergio el Hermoso vs Alberto Muñoz, Spirit
5) Dr. Wagner, El Matematico vs Villano I, Villano III

indy (SUN) 08/15/1976 Plaza de Toros Valente Arellano, Torreón, Coahuila [El Siglo de Torreon 1976-08-15]
1) ? vs ??
2) ? vs ??
3) La Sombra, Mr. Niebla, Vicente Nuño vs Eric el Rojo, Espanto III, Pelón Águilar
4) The King  (c) vs Halcón Suriano [NUEVO LEON WELTER]
5) Ciclón Veloz Jr., Mano Negra vs As Charro, Gran Markus

EMLL (TUE) 08/17/1976 Arena Coliseo [Box Y Lucha 1245]
1) Talismán DCOR Gran Davis
2) Estrella Blanca, Máscara Roja b El Nazi, Polaco [quarterfinal]
3) Cachorro Mendoza, Gallo Tapado b Tony Salazar, Yuma [quarterfinal]
4) Karloff Lagarde, Rodolfo Ruiz b Halcón Dorado I, Halcón Dorado II [quarterfinal]
5) Cinta Negra, El Cobarde b Dr. O’Borman, Sangre Chicana [quarterfinal]
6) Karloff Lagarde, Rodolfo Ruiz b Cinta Negra, El Cobarde [semifinal]
7) Cachorro Mendoza, Gallo Tapado b Estrella Blanca, Máscara Roja [semifinal]
8) Cachorro Mendoza, Gallo Tapado b Karloff Lagarde, Rodolfo Ruiz [final]

