
/**********************
luchadb archive (for year 1977)
export started at 2025-12-02 02:32:56
export finished at 2025-12-02 02:35:38

particular parser syntax for nerds:

PROMOTION (DAY) MM/DD/YYYY ArenaName [linkURL linkName]
MatchNo) side1-1, side1-2, side1-3 DECISION side2-1, side2-2, side2-3 [matchstip]

special codes 
(c) champion obviously
## note attached to preeceding match
&& note attached to event
%% attendence (always integer, always suspect) 
** event name
**********************/
EMLL (SUN) 01/02/1977 Arena Coliseo Guadalajara [El Informador 1977-01-02]
1) ? vs ??
2) ? vs ??
3) ? vs ??
4) Máscara Roja, Terremoto vs Pantera Azul, Septiembre Negro
5) Cien Caras, El Faraón, Enrique Vera vs Alfonso Dantes, Gemelo Diablo I, Gemelo Diablo II

Indy (SUN) 01/02/1977 Arena Lopez Mateos
1) Cuervo Azul I, Cuervo Azul II vs Bello Adan, Pepe Luna
2) Chino Lopez, Conde Azul vs Golden Boy, Orfeo Negro II
3) Cienfuegos, Dr. Wagner vs Sunny War Cloud, Tino Herrera

EMLL (TUE) 01/04/1977 Arena Coliseo [Box Y Lucha 1265, http://wrestlingclassics.com/cgi-bin/.ubbcgi/ultimatebb.cgi?ubb=get_topic&f=10&t=004694#000000 Matt Farmer]
1) Gran Davis b Mario Rocca
2) Mr. Lancer b Roy Lancer
3) Impacto b Gorilla Flores
4) Saeta Azteca, Spider b El Polaco, Satánico
5) Bruno Victoria, Rizado Ruiz b Estrella Blanca, Halcón Dorado
6) As Charro, El Nazi b Gallo Tapado, José Luis Feliciano
## 2-1

EMLL (TUE) 01/04/1977 Arena Coliseo Guadalajara [El Informador 1977-01-04]
1) ? vs ??
2) ? vs ??
3) ? vs ??
4) Cachorro Mendoza, Cinta Negra vs Herodes, Iván El Bronco
5) Gemelo Diablo I, Gemelo Diablo II vs Cien Caras, El Faraón

MORA (TUE) 01/04/1977 Unidad Deportiva de Acapulco, Acapulco, Guerrero [Box Y Lucha 1265]
1) Pepe Casas b Chamaco Ramírez
2) Capitán Sangre I, Capitán Sangre II b El Matematico, Johnny Lezcano
3) Cesar Valentino, Ray Mendoza DQ El Santo, Huracán Ramírez

EMLL (FRI) 01/07/1977 Arena Coliseo [Box Y Lucha 1265, Halcon 238, http://wrestlingclassics.com/cgi-bin/.ubbcgi/ultimatebb.cgi?ubb=get_topic&f=10&t=004694#000000 Matt Farmer]
1) El Invasor b Agente X
2) Apolo Casillas b Rodolfo Ruiz
3) Franco Colombo b El Tauro
4) Chamaco Ortiz b Manuel Robles
5) Cachorro Mendoza b Bruno Victoria
6) José Luis Feliciano b Septiembre Negro
7) Gemelo Diablo I, Gemelo Diablo II, Tony Salazar b Blue Demon, El Halcón, Ringo Mendoza

indy (SAT) 01/08/1977 Ixtapan de la Sal, Estado de México [Box Y Lucha 1265]
1) Rizado Ruiz vs Blue Demon

EMLL (SUN) 01/09/1977 Arena Coliseo Guadalajara [El Informador 1977-01-09]
1) ? vs ??
2) ? vs ??
3) ? vs ??
4) El Vengador, Mario Alcala vs Herodes, Sangre India
5) El Faraón, Ringo Mendoza vs Gemelo Diablo I, Gemelo Diablo II

indy (SUN) 01/09/1977 Arena Coliseo Acapulco, Acapulco, Guerrero [Box Y Lucha 1265, Halcon 238]
1) Flama Azul  (c) b Mario Valenzuela [MEX LIGHT]

indy (SUN) 01/09/1977 Plaza de Toros Valente Arellano, Torreón, Coahuila [El Siglo de Torreon 1977-01-09]
1) ? vs ??
2) ? vs ??
3) ? vs ??
4) ? vs ??
5) Tigre Del Ring I, Tigre Del Ring II b El Exorcista, Frankenstein Jr. [mask]
## Tiger del Ring bet their mask two weeks away

EMLL (TUE) 01/11/1977 Arena Coliseo [Box Y Lucha 1265, http://wrestlingclassics.com/cgi-bin/.ubbcgi/ultimatebb.cgi?ubb=get_topic&f=10&t=004694#000000 Matt Farmer, Punch 125]
1) Roy Lancer b Joe Marino
2) Talismán DQ Bufalo Salvaje
3) El Trueno b Mr. Lancer
4) Apolo Casillas, Rafael Salamanca b Divino Roy, Satánico
5) Bruno Victoria, Manuel Robles b El Monarca, Estrella Blanca
## 2-1
6) Karloff Lagarde, Septiembre Negro DRAW Gallo Tapado, José Luis Mendieta
## double pin in third

EMLL (TUE) 01/11/1977 Arena Coliseo Guadalajara [El Informador 1977-01-11]
1) ? vs ??
2) ? vs ??
3) ? vs ??
4) Cinta Negra, Solder Blue vs Calavera I, Calavera II
5) El Faraón, Ringo Mendoza, Terremoto vs Gemelo Diablo I, Gemelo Diablo II, Iván El Bronco

EMLL (TUE) 01/11/1977 Arena Nueva Atzacoalco, Gustavo A. Madero, Distrito Federal [Box Y Lucha 1265]
1) El Suriano vs Irazú
2) Flama Azul vs Satana
3) Índio Vitela, Rizado Ruiz vs Máscara Roja, Tony López
4) Adorable Rubi, Demonio Blanco vs Blue Demon, El Halcón	(Ortiz)

MORA (TUE) 01/11/1977 Pachuca, Hidalgo [Box Y Lucha 1265]
1) El Santo, El Solitario, Mil Máscaras vs Cesar Valentino, Coloso Colosetti, Ray Mendoza

indy (WED) 01/12/1977 Nueva Arena Apatlaco, Iztapalapa, Distrito Federal [Box Y Lucha 1265]
1) Talismán vs Gran Davis
2) Saeta Azteca vs El Invasor
3) Cachorro Mendoza, El Monarca vs Karate Hayato, Kimura Sato
4) Mano Negra, Máscara Roja vs Karloff Lagarde, Raúl Reyes

Mora (THU) 01/13/1977 Arena Isabel, Cuernavaca, Morelos [LuchaWorld, Punch 125]
1) Gory Cortes b El Senorial
2) Indomable De Tepito, Mario Rojas, Victor Del Moral b Apolo Imperial, Demon Dorada, Mr. Tormenta
3) Manzano b Mr. Drayner [hair]
## Manzano took 1/3
4) Blue Selem, Dos Caras, Pepe El Toro b Gory Medina, Tony Padilla, Zeus

MORA (THU) 01/13/1977 Toluca, Estado de México [Box Y Lucha 1265]
1) Dick Angelo b Brazo de Oro
2) Dos Caras b Astro Rey
3) Dr. Wagner, Huracán Ramírez b El Vikingo, Renato Torres
## Tecnicos took 1/3
4) El Solitario, Mil Máscaras DQ Coloso Colosetti, Ray Mendoza
## Tecnicos took 2/3, the last when Mendoza unmasked Mascaras

EMLL (FRI) 01/14/1977 Arena Coliseo [Box Y Lucha 1265, http://wrestlingclassics.com/cgi-bin/.ubbcgi/ultimatebb.cgi?ubb=get_topic&f=10&t=004694#000000 Matt Farmer, Punch 125]
1) El Trueno b El Invasor
2) Sangre Chicana, Tony Salazar b Enrique Vera, Spirit [quarterfinal]
3) Cachorro Mendoza, Ringo Mendoza b Karate Hayato, Kimura Sato [quarterfinal]
4) Adorable Rubi, As Charro b Carlos Plata, Tigre Colombiano [quarterfinal]
5) El Halcón, José Luis Mendieta b Gemelo Diablo I, Gemelo Diablo II [quarterfinal]
6) Cachorro Mendoza, Ringo Mendoza DQ Sangre Chicana, Tony Salazar [semifinal]
7) Adorable Rubi, As Charro b El Halcón, José Luis Mendieta [semifinal]
8) Cachorro Mendoza, Ringo Mendoza b Adorable Rubi, As Charro [final]
## Mendoza took 1/3.

EMLL (SAT) 01/15/1977 Pista Arena Revolución [Box Y Lucha 1265]
1) Gorilla Flores vs Irazú
2) Dardo Aguilar vs Tauro
3) Henry London vs Huroki Sito
4) Flama Azul, Halcón Dorado vs Alfa Centauris, El Reo
5) Gallo Tapado, Máscara Roja vs Bruno Victoria, Demonio Blanco
6) El Monarca vs Índio Pinto [hair]
7) Mano Negra  (c) vs Karloff Lagarde [NWA WELTER]

Indy (SAT) 01/15/1977 Arena Apatlaco, Iztapalapa, Distrito Federal
1) Zaratustra vs El Soberbio I
2) Dick Angelo, Tino Herrera vs León Negro, Mazambula
3) Villano I, Villano II vs Jhonny Lezcano, Mr. Randal
4) El Centinela vs Ringo Medina [mask, hair]

indy (SAT) 01/15/1977 Arena Cocolapam, Orizaba, Veracruz [Box Y Lucha 1265]
1) Beto García vs Memo Reyes
2) Vick Cruz vs Halcón Negro
3) Chimuleo Sanchez, El Etíope vs Joe Mulluqin, Richard
4) Cavernario Galindo, Oso Porutgal vs Apolo Acosta, Marinero Acosta
&& first show of season

indy (SAT) 01/15/1977 Arena Nueva Atzacoalco, Gustavo A. Madero, Distrito Federal [Box Y Lucha 1265]
1) Sergio Borrayo vs Mr. Steel, Franco Colombo, Estrella Blanca, Dr. O’Borman, El Polaco, Satánico, Divino Roy
2) Ringo Mendoza, Spirit vs Adorable Rubi, Sangre Chicana

indy (SAT) 01/15/1977 Arena Zapata, Cuautla, Morelos [Box Y Lucha 1265]
1) As Negro vs Estrella Plateada
2) El Brujo vs Ariman
3) Lucio Risas vs Gatubedo
4) Zorro Plateado vs La Cebra De Acapulco
5) Dr. Wagner vs Coloso Colosetti

indy (SAT) 01/15/1977 Nueva Arena Apatlaco, Iztapalapa, Distrito Federal [Box Y Lucha 1265, Halcon 239]
1) El Troyano vs Diogenes
2) Golden Boy, Scorpió vs Bengala I, Bengala II
3) Impacto, Rayo de Jalisco vs Chicano Power, Manuel Robles
4) Fiera Vilchis b Chamaco Ortiz [hair]

indy (SAT) 01/15/1977 Unidad Deportiva de Acapulco, Acapulco, Guerrero [Box y Lucha 3533]
1) Dick Angelo vs Mazambula
2) Chamaco Ramírez vs Villano I
3) Johnny Lezcano vs Capitán Sánchez [hair, mask]
4) Felipe Ham Lee, Gran Hamada, Karl Gotch vs Canek, Cesar Valentino, Coloso Colosetti  (c)

Mora (SAT) 01/15/1977 Cozumel, Quintana Roo [Halcon 239]
1) Gran Hamada vs Cesar Valentino
&& first in a series of weekend loops in Quintana Roo (Cozumel, Cancun, Chetumal.) Magazine only mentions the main events.

EMLL (SUN) 01/16/1977 Arena Coliseo [Box Y Lucha 1265, http://wrestlingclassics.com/cgi-bin/.ubbcgi/ultimatebb.cgi?ubb=get_topic&f=10&t=004694#000000 Matt Farmer, Punch 125]
1) Roy Lancer b El Suriano
2) Rafael Salamanca DQ Satán
## Satan was finishing up in EMLL.
3) Chino Chow, Tony López b Índio Vitela, Manuel Robles
4) Spirit, Tigre Colombiano b El Nazi, Septiembre Negro
## 2-1
5) El Halcón  (c) b Raúl Reyes [MEX HEAVY]
## Halcon took 1/3.

EMLL (SUN) 01/16/1977 Arena Coliseo Guadalajara [El Informador 1977-01-16]
1) ? vs ??
2) ? vs ??
3) ? vs ??
4) Herodes, Sangre India vs El Vengador, Mario Alcala
5) El Faraón, Ringo Mendoza vs Adorable Rubi, Perro Aguayo

EMLL (SUN) 01/16/1977 Pista Arena Revolución [Box Y Lucha 1265]
1) Joe Marino vs Gran Davis
2) Saeta Azteca vs Bufalo Salvaje
3) Apolo Casillas vs Divino Roy
4) Mr. Steel vs Rodolfo Ruiz
5) Leo López, Rizado Ruiz vs Chino Chow, Tony Salazar
6) As Charro, Tony Salazar vs Blue Demon, José Luis Mendieta

indy (SUN) 01/16/1977 Arena Aficion [Halcon 239]
1) Mario el Exotico b Perro González [hair]

indy (SUN) 01/16/1977 Arena San Juan Pantitlan, Ciudad Nezahualcóyotl, Estado de México [Box Y Lucha 1265]
1) As Negro vs Estrella Plateada
2) Lucio Rosas vs Gatubedo
3) Chacal de la Rosa vs Ariman [super libre]
4) Zorro Plateado I, Zorro Plateado II vs El Pescador, La Cebra De Acapulco
5) Coloso Colosetti, Renato Torres vs El Rostro, Popeye

indy (SUN) 01/16/1977 Plaza de Toros el Cortijo, Venustiano Carranza, Distrito Federal [Box Y Lucha 1265]
1) Villano I, Villano II vs Fantastic, Ultraman and Astro Rey, León Negro and Kung Fu, Tamba and Enfermerno I, Enfermerno II and Brazo de Oro, El Vagabundo and Rommel, Sunny War Cloud and Delfin II, Pepe Casas [torneo, ? TAG]

indy (SUN) 01/16/1977 Plaza de Toros La Aurora, Ciudad Nezahualcóyotl, Estado de México [Box Y Lucha 1265]
1) Spider vs Huroki Sito
2) Chamaco Ortiz vs El Reo
3) Karata Hayato, Kimura Sato vs El Monarca, Sergio Borrayo
4) Gemelo Diablo I, Gemelo Diablo II vs Enrique Vera, Gallo Tapado

indy (SUN) 01/16/1977 Plaza de Toros Valente Arellano, Torreón, Coahuila [El Siglo de Torreon 1977-01-16]
1) ? vs ??
2) ? vs ??
3) ? vs ??
4) Espanto III, Pelón Águilar vs La Sombra, Temoc Torres
5) As Charro, Li-Chang, Sangre Chicana vs Máscara Roja, Tiger Del Ring I, Tiger Del Ring II

MORA (SUN) 01/16/1977 Auditorio, Cuautitlán, Estado de México [Box Y Lucha 1265]
1) Dr. Wagner, El Matematico, El Solitario vs Astro Rey, el Signo, Ray Mendoza
&& dates is a guess

Mora (SUN) 01/16/1977 Cancún, Quintana Roo [Halcon 239]
1) Gran Hamada vs Cesar Valentino

Mora (SUN) 01/16/1977 Palacio de los Deportes, Villahermosa, Tabasco [Halcon 240]
1) Villano III  (c) b Huracán Ramírez [UWA WELTER]
## could be off a week (listed as last Sunday)

indy (MON) 01/17/1977 Arena Veracruz, Veracruz, Veracruz [Halcon 240]
1) Diamante Negro, El Cid DQ Lobo Rubio, Rey Saúl
2) El Exorcista, el Signo b Brazo de Oro, Kung Fu

Mora (MON) 01/17/1977 Chetumal, Quintana Roo [Halcon 239]
1) Gran Hamada vs Cesar Valentino

EMLL (TUE) 01/18/1977 Arena Coliseo [http://wrestlingclassics.com/cgi-bin/.ubbcgi/ultimatebb.cgi?ubb=get_topic&f=10&t=004694#000000 Matt Farmer, Punch 125]
1) Joe Marino vs ?
2) Roy Lancer vs Mario Rocca
## Punch has Mr. Lancer instead of Roy Lancer.
3) Spider vs Irazú
4) Dardo Aguilar, Saeta Azteca vs El Polaco, Índio Pinto
5) Franco Colombo, Halcón Dorado vs Índio Vitela, Manuel Robles
6) Gallo Tapado, Spirit vs Septiembre Negro, Tony Salazar

EMLL (TUE) 01/18/1977 Arena Coliseo Guadalajara [El Informador 1977-01-18]
1) ? vs ??
2) ? vs ??
3) ? vs ??
4) Cesar Curiel, Luis Vera vs Black Killer, Rey Centella
5) El Faraón, Ringo Mendoza, Terremoto vs Adorable Rubi, Iván El Bronco, Perro Aguayo

EMLL (TUE) 01/18/1977 Arena Nueva Atzacoalco, Gustavo A. Madero, Distrito Federal [LuchaWorld, Punch 125]
1) Impacto vs Bufalo Salvaje
2) Chamaco Ortiz vs Satánico
3) Leo López, Rizado Ruiz vs Chino Chow, Tony López
4) Blue Demon, El Halcón vs Gemelo Diablo I, Gemelo Diablo II

indy (TUE) 01/18/1977 Gimnasio Municipal Lic. Benito Juárez, Cuautitlán, Estado de México [Halcon 239]
1) Anibal, El Solitario, Tawa Vera vs el Signo, Ray Mendoza, Zeus
2) Bello Greco, Lobo Rubio, Sergio el Hermoso vs Bengala I, Brazo de Oro, El Matematico

EMLL (WED) 01/19/1977 Arena Coliseo Acapulco, Acapulco, Guerrero [LuchaWorld, Punch 125]
1) Musulman vs Johnny Ceballos
2) El Extraño vs Huroki Sito
3) Cachorro Mendoza, Flama Azul vs Bruno Victoria, El Tauro
4) El Halcón, Enrique Vera, Spirit vs Gemelo Diablo I, Gemelo Diablo I, Tony Salazar

indy (WED) 01/19/1977 Arena KO Algusto, Naucalpan, Estado de México [LuchaWorld, Punch 125]
1) Rocambole vs Bárbaro Fonseca
2) Benny Castello vs Pedro Sosa
3) Conde Azul, Rayo Dorado II vs Golden Boy, Negro Navarro
4) Estrella del Sur, Kung Fu, Rayo Dorado vs El Tupamaro, Villano I, Villano II

indy (WED) 01/19/1977 Arena Veracruz, Veracruz, Veracruz [LuchaWorld, Punch 125]
1) Gorila Osorio vs Marinero Acosta
2) El Matematico, El Vagabundo vs Ku Klux Klan I, Ku Klux Klan II
3) El Solitario, Gran Hamada, Tawa Vera vs El Vikingo, Luis Mariscal, Villano III

indy (WED) 01/19/1977 Nueva Arena Apatlaco, Iztapalapa, Distrito Federal [LuchaWorld, Punch 125]
1) Gorilla Flores vs Roy Lancer
2) Divino Roy vs Mr. Steel
3) Alfa Centauris vs Henry London
4) Blue Demon, Gallo Tapado, José Luis Mendieta vs Karate Hayato, Kimura Sato, Septiembre Negro

EMLL (THU) 01/20/1977 Arena Isabel, Cuernavaca, Morelos [LuchaWorld, Punch 125]
1) El Suriano vs El Invasor
2) Sergio Borrayo vs Huroki Sito
3) El Nazi, Septiembre Negro vs José Luis Mendieta, Tigre Colombiano
4) Blue Demon, El Halcón	(Ortiz) vs Gemelo Diablo I, Gemelo Diablo II

indy (THU) 01/20/1977 Arena Coliseo Guadalajara [luchablog photolog (2013-09-17 18.30.28)]
1) Misterio Rojo b Bookman
2) Silvestre Soto DRAW Luis Bustos
3) Hermano Esquiviel I, Hermano Esquiviel II b Lorenzo El Gitano, Tigre Negro
4) Bestia Nazi b Black Terry
5) Arturo Gaona, Bucanero I, Octagón Gaona b Baby Sharon, Comando I, Luis Chavir

indy (THU) 01/20/1977 Arena Toluca, Toluca, Estado de México [LuchaWorld, Punch 125]
1) El Leñador vs Javier Montes
2) Astro Rey vs El Cid
3) Solar I vs Scorpió
4) Dr. Wagner, El Santo, El Solitario vs Cesar Valentino, Jack Dillon, Ray Mendoza

indy (THU) 01/20/1977 Chilpancingo, Guerrero [Halcon 242]
1) El Guerrero, Mario Valenzuela b El Extraño, The Bowman
2) Lizmark, The Spirit b El Centauro, Tony Salazar

EMLL (FRI) 01/21/1977 Arena Coliseo [Halcon 240, http://wrestlingclassics.com/cgi-bin/.ubbcgi/ultimatebb.cgi?ubb=get_topic&f=10&t=004694#000000 Matt Farmer]
1) Karloff Lagarde b Gallo Tapado
2) El Monarca DQ El Reo
3) Máscara Roja b Manuel Robles
4) As Charro b Franco Colombo
5) José Luis Mendieta b Rizado Ruiz
6) Carlos Plata DQ Sangre Chicana
7) Blue Demon, Cachorro Mendoza, Ringo Mendoza b Adorable Rubi, Fishman, Tony Salazar
## Rudos took 2/3. Fishman got in a foul on Cachorro, then pinned Bleu Demon.

Mora (FRI) 01/21/1977 Cozumel, Quintana Roo [Halcon 239]
1) El Solitario vs Canek
&& second in a series of weekend loops in Quintana Roo (Cozumel, Cancun, Chetumal.) Magazine only mentions the main events.

EMLL (SAT) 01/22/1977 Pista Arena Revolución [LuchaWorld, Punch 125]
1) Talismán vs Divino Roy
2) El Trueno vs El Invasor
3) Satánico vs Agente X
4) Mr. Steel vs El Polaco
5) Dr. O’Borman vs Henry London
6) Estrella Blanca, Halcón Dorado vs Índio Vitela, Leo López
7) El Halcón, Mano Negra vs Bruno Victoria, Raúl Reyes

indy (SAT) 01/22/1977 Arena Apatlaco, Iztapalapa, Distrito Federal [Halcon 240]
1) Villano II b Florentino Lopez [hair]
## Florentino Lopez is the former Mr. Randall
&& El Condor won a battle royal on this show

indy (SAT) 01/22/1977 Arena Nueva Atzacoalco, Gustavo A. Madero, Distrito Federal [LuchaWorld, Punch 125]
1) Saeta Azteca vs Roy Lancer
2) Índio Pinto vs Rafael Salamanca
3) Máscara Roja vs El Nazi
4) Gallo Tapado, Ringo Mendoza, Spirit vs Gemelo Diablo I, Gemelo Diablo II, Karloff Lagarde

indy (SAT) 01/22/1977 Arena Tláhuac, Tláhuac, Distrito Federal [LuchaWorld, Punch 125]
1) Tinieblas, Ultraman vs Astro Rey, Renato Torres

indy (SAT) 01/22/1977 Nueva Arena Apatlaco, Iztapalapa, Distrito Federal [Halcon 239, Punch 125]
1) Jimmy Cuevas vs Chamaco Vazquez
2) Bengala I, Bengala II vs Golden Boy, Rolando Valentino
3) Fiera Vilchis vs Chamaco Ortiz [DF MIDDLE]
4) Blue Demon, Fantastic vs Chicano Power, Rizado Ruiz
&& Halcon 239 had a different main event (but not the full card)

Mora (SAT) 01/22/1977 Cancún, Quintana Roo [Halcon 239]
1) El Solitario vs Canek

EMLL (SUN) 01/23/1977 Arena Coliseo [http://wrestlingclassics.com/cgi-bin/.ubbcgi/ultimatebb.cgi?ubb=get_topic&f=10&t=004694#000000 Matt Farmer, Punch 125]
1) Gorilla Flores vs Bufalo Salvaje
2) Rafael Salamanca vs Huroki Sito
3) Dardo Aguilar vs Alfa Centauris
4) Karate Hayato, Kimura Sato vs Chino Chow, Tony López
5) El Faraón, Spirit, Tigre Colombiano vs Demonio Blanco, Gemelo Diablo I, Gemelo Diablo II

EMLL (SUN) 01/23/1977 Arena Coliseo Guadalajara [El Informador 1977-01-23, Halcon 241]
1) ? vs ??
2) ? vs ??
3) ? vs ??
4) Mario Alcala b Sangre India [hair]
5) Carlos Plata, El Halcón vs Adorable Rubi, Perro Aguayo

EMLL (SUN) 01/23/1977 Pista Arena Revolución [LuchaWorld, Punch 125]
1) El Suriano vs El Maldito
2) Impacto vs Irazú
3) Apolo Casillas vs Saeta Azteca
4) Spider vs Rodolfo Ruiz
5) Franco Colombo, Sergio Borrayo vs Índio Pinto, Tauro
6) José Luis Mendieta, Ringo Mendoza vs Septiembre Negro, Tony Salazar

indy (SUN) 01/23/1977 Arena Aficion [LuchaWorld, Punch 125]
1) El Comunista vs Negro Granados
2) El Enfermero, Misterio vs Príncipe Odin, Troglodita Flores
3) El Nómada, Mr. Crimen vs Lalo Montenegro, Tawa Vera
4) el Signo, Lobo Rubio vs El Árabe, Solar I

indy (SUN) 01/23/1977 Arena Coliseo Acapulco, Acapulco, Guerrero [Halcon 242]
1) Braulio Mendoza, Mario Valenzuela vs ?, ??
2) El Centauro, El Nazi, Índio Vitela b Halcón Dorado I, Kung Fu, Máscara Roja

indy (SUN) 01/23/1977 Arena Coliseo Monterrey [Halcon 241]
1) Gran Markus vs Enrique Vera
## Markus was arrested after hitting a child fan during this match

indy (SUN) 01/23/1977 Arena San Juan Pantitlan, Ciudad Nezahualcóyotl, Estado de México [LuchaWorld, Punch 125]
1) Lucio Risas vs Misterio Blanco
2) Chacas De La Rosa vs El Comanche
3) Las Saetas Chinas vs Los Soberbios
4) Coloso Colosetti, Renato Torres vs El Rostro, Popeye
5) Dr. Wagner, El Hombre Nuclear vs Cesar Valentino, Zorro Plateado

indy (SUN) 01/23/1977 Arena Toluca, Toluca, Estado de México [LuchaWorld, Punch 125]
1) Terremoto vs Aaron Canales
2) Chico Sanchez, El Delfin vs Lasser, Vic Ramírez
3) Azteca Rubio vs La Cebra
4) El Alacrán, La Furia vs El Toluco, Marte

indy (SUN) 01/23/1977 Deportivo Venustiano Carranza, Venustiano Carranza, Distrito Federal [LuchaWorld, Punch 125]
1) Chivo Alonso vs Trampas
2) Carnicerito vs Lucio Risas
3) Fantastic, Saeta China II vs El Alacrán, El Delfin
4) Chamaco Ramírez, Negro Navarro, Saeta China I vs El Bello Greco, El Comanche, Sergio el Hermoso

indy (SUN) 01/23/1977 Plaza de Toros el Cortijo, Venustiano Carranza, Distrito Federal [LuchaWorld, Punch 125]
1) El Moro vs Lalo Guerra
2) Zebra Kidd vs Titanic
3) Brazo de Oro, El Patriarca vs Pepe Casas, Rommel
4) Kung Fu, Ultraman vs Astro Rey, León Negro
5) II, Los Villanos I vs Fantastic, Tamba

indy (SUN) 01/23/1977 Plaza de Toros La Aurora, Ciudad Nezahualcóyotl, Estado de México [LuchaWorld, Punch 125]
1) Mr. Lancer vs Roy Lancer
2) Chamaco Ortiz vs El Polaco
3) El Monarca, Henry London vs El Reo, Leo López
4) Blue Demon, Gallo Tapado vs Bruno Victoria, Karloff Lagarde

indy (SUN) 01/23/1977 Plaza de Toros Valente Arellano, Torreón, Coahuila [El Siglo de Torreon 1977-01-23]
1) ? vs ??
2) ? vs ??
3) ? vs ??
4) La Sombra, Temoc Torres vs Espanto III, Pelón Águilar [super libre]
5) As Charro, Sangre Chicana b Tigre Del Ring I, Tigre Del Ring II [mask]
## Tiger del ring mentioned as unmasked next week

Mora (SUN) 01/23/1977 Chetumal, Quintana Roo [Halcon 239]
1) El Solitario vs Canek

indy (MON) 01/24/1977 Zacatelco, Tlaxcala [Halcon 240]
1) Caballero Rojo b Imposible [mask]
## This Imposible is listed as Flortenino Lopez, who would have also lost his hair two days prior to Villano II (and was formerly Mr. Randall.)

EMLL (TUE) 01/25/1977 Arena Coliseo Guadalajara [El Informador 1977-01-25]
1) ? vs ??
2) ? vs ??
3) ? vs ??
4) El Dorado, Luis Vera vs Araña Atómica, Rey Centella
5) Carlos Plata, El Halcón, Terremoto vs Adorable Rubi, Herodes, Perro Aguayo

indy (TUE) 01/25/1977 Unidad Deportiva de Acapulco, Acapulco, Guerrero [Halcon 241, Halcon 242]
1) Johnny Lezcano b Capitán Sangre II [mask]
## Capitan Sangre II is Ruben Salas, who previously lost his mask as Dr. Kirmen to Huracan Ramirez in Xalapa.
2) Dr. Wagner, Rayo de Jalisco vs Cesar Valentino, Villano III
## Wagner wrestled for 25 inutes straight in the first fall, recap suggests something was wrong with Rayo and he got in to it with fans.
&& 52,370 gate.

Indy 1 (WED) 01/26/1977 Arena Nueva Atzacoalco, Gustavo A. Madero, Distrito Federal [KO 1275, RB]
1) Escudo Real DQ Chacal de la Rosa
2) Soberbio I b Rams I
3) Delfin I b Mr. Raff
4) Chino Lopez, El Vagabundo b Barba Negra, Rocambole
5) Bello Greco, Sergio el Hermoso b Gran Hamada, Tatsumi Fujinami

indy (THU) 01/27/1977 Gimnasio Municipal, Ciudad Juárez, Chihuahua [luchablog photolog (2013-09-17 18.29.37)]
1) Canelo Villela b Dorado Hernández
2) Ray Estrada b Delfin
3) El Impostor, Lalo Linch b Hermes, La Bestia
4) El Vagabundo, Tony Reyna b Mercenario I, Mercenario II
## straight falls
5) El Cobarde, Johnny Lazacno b Espectro Tapia, Judas Monterrosa
## winners took 2/3

Indy 1 (THU) 01/27/1977 Arena San Agustin, Zapotiltic, Jalisco [KO 1275, RB]
1) Perro Asiatico, Ventarron b ?, Ben Hur
2) Mario Cadena, Tamba b Diablo Huasteco, Joe Ramírez
&& sellout

EMLL (FRI) 01/28/1977 Arena Coliseo [Halcon 241, http://wrestlingclassics.com/cgi-bin/.ubbcgi/ultimatebb.cgi?ubb=get_topic&f=10&t=004694#000000 Matt Farmer]
1) Talismán b Gran Davis
2) Spider b El Tauro
3) Franco Colombo b Alfa Centauris
4) Leo López DRAW Tony López
5) Máscara Roja b El Reo
6) Enrique Vera b As Charro
7) Fishman, Perro Aguayo, Tony Salazar b Cachorro Mendoza, El Faraón, Ringo Mendoza

Mora (FRI) 01/28/1977 Cozumel, Quintana Roo [Halcon 239]
1) Dos Caras, Mil Máscaras vs Bestia Roja, TNT
&& third in a series of weekend loops in Quintana Roo (Cozumel, Cancun, Chetumal.) Magazine only mentions the main events.

indy (SAT) 01/29/1977 Arena Puebla [luchablog photolog (2013-09-17 18.30.21)]
1) Porthos b Ray Lancer
2) Satánico b Mr. Settel
3) Karate Hayoto, Kimura Sato b El Monarca, Gallo Tapado
4) El Faraón, Mano Negra, Spirit b Adorable Rubi, Gemelo Diablo I, Gemelo Diablo II

Mora (SAT) 01/29/1977 Cancún, Quintana Roo [Halcon 239]
1) Dos Caras, Mil Máscaras vs Bestia Roja, TNT

EMLL (SUN) 01/30/1977 Arena Coliseo Guadalajara [El Informador 1977-01-30]
1) ? vs ??
2) ? vs ??
3) ? vs ??
4) El Ídolo, Terremoto vs Herodes, Pantera Azul
5) Carlos Plata, El Halcón, Mano Negra vs Fishman, Gemelo Diablo I, Gemelo Diablo II

indy (SUN) 01/30/1977 Guatemala City, Guatemala [Halcon 241, Halcon 242]
1) Villano III  (c) b Rayo Chapin [UWA WELTER]
&& Halcon 241 says Villano III is defending soon, Halcon 242 has a defense with no city against Rayo Chapin.

indy (SUN) 01/30/1977 Plaza de Toros el Progreso, Guadalajara, Jalisco [El Informador 1977-01-30, Halcon 240]
1) Pedro Anguiano vs Félix Mosqueda
2) Chela Salazar, Estela Molina vs Marina Rey, Pantera Sureña
3) El Greco, Sergio Sarabia vs Brazo de Oro, Solar I
4) Alberto Muñoz, Huracán Ramírez vs Frankenstein, The Monsther
5) El Santo, El Solitario, Tinieblas vs Ángel Blanco, Coloso Colosetti, Sunny War Cloud

indy (SUN) 01/30/1977 Plaza de Toros Valente Arellano, Torreón, Coahuila [El Siglo de Torreon 1977-01-30]
1) ? vs ??
2) Eric el Rojo vs Ciclón Negro
3) The King vs La Sombra
4) Espanto III vs Temoc Torres [hair]
5) Gran Markus, Li-Chang, Pelón Águilar vs Cinta Negra, Tigre Del Ring I, Tigre Del Ring II

indy (SUN) 01/30/1977 Zacatelco, Tlaxcala [luchablog photolog (2013-09-17 18.30.17)]
1) Sabú b Simon Blanco
2) Murciélago b Torbellino Rojo
3) El Dean, Gorila Osorio DQ Hermano Robinson I, Hermano Robinson II
4) Charito, Diana Cruz DQ Viuda Negra I, Viuda Negra II

Mora (SUN) 01/30/1977 Chetumal, Quintana Roo [Halcon 239]
1) Dos Caras, Mil Máscaras vs Bestia Roja, TNT

indy (MON) 01/31/1977 Arena Puebla [luchablog photolog (2013-09-17 18.29.43)]
1) La Piraña DRAW Gran Kimma
2) Pepe Remero b El Yunke
3) Destino Negro, Lasser DQ Chamaco Ramírez, Saeta Infernal
4) Chabela Romero, Lola González b Irma González, Rocio
&& location may be off

EMLL (TUE) 02/01/1977 Arena Coliseo [Halcon 242, http://wrestlingclassics.com/cgi-bin/.ubbcgi/ultimatebb.cgi?ubb=get_topic&f=10&t=004694#000000 Matt Farmer]
1) Gorilla Flores, Roy Lancer b El Maldito, Gran Davis
2) Bufalo Salvaje DQ Impacto
3) Dr. O’Borman, Rodolfo Ruiz b Apolo Casillas, Halcón Dorado
4) Karate Hayato, Kimura Sato b El Monarca, Estrella Blanca
5) Septiembre Negro, Tony Salazar b José Luis Mendieta, Máscara Roja

EMLL (TUE) 02/01/1977 Arena Coliseo Guadalajara [El Informador 1977-02-01]
1) ? vs ??
2) ? vs ??
3) ? vs ??
4) Cesar Curiel, Mano Negra vs Gemelo Diablo II, Iván El Bronco
5) Carlos Plata, El Halcón vs Fishman, Gemelo Diablo I

indy (TUE) 02/01/1977 Auditorio, Cuautitlán, Estado de México [Halcon 241, Halcon 242]
1) Livianthan b El Húngaro [UWA LIGHT, #1 Contenders, torneo]
2) Javier Montes b Dr. Misterio [UWA LIGHT, #1 Contenders, torneo]
3) Negro Navarro b El Taraco [UWA LIGHT, #1 Contenders, torneo]
4) Lobo Rubio b Lacer [UWA LIGHT, #1 Contenders, torneo]
## Lacer, who may be Lazzer, is the Mexico State lightweight champion
5) El Matematico b Rokambole [UWA LIGHT, #1 Contenders, torneo]
6) Zeus b Bengala I [UWA LIGHT, #1 Contenders, torneo]
7) Solar I b Amenaza Blanca [mask]
## Amenza Blanca is Chamaco Moreno.
8) Dr. Wagner  (c) b Astro Rey [MEX LH]
## Wagner wants a title match with Alfonso Dantes
&& date is a guess. The tournament results are different in an earlier report than a big section on it later, using the later

MORA (TUE) 02/01/1977 Arena Aficion [Halcon 241, Halcon 242]
1) Ray Mendoza  (c) b El Solitario [UWA LH]

MORA (TUE) 02/01/1977 Unidad Deportiva de Acapulco, Acapulco, Guerrero [Halcon 244]
1) Nahur Kliff b Tony Barbetta
2) Brazo de Oro, José Torres b El Enfermero, Enfermero Jr.
3) Cesar Valentino, El Vikingo, Renato Torres b Anibal, Dory Dixon, Tinieblas

MORA (WED) 02/02/1977 Veracruz, Veracruz [Halcon 242]
1) Villano III  (c) b Tawa Vera [UWA WELTER]

EMLL (THU) 02/03/1977 Arena Coliseo Acapulco, Acapulco, Guerrero [Halcon 244]
1) As Charro, Demonio Blanco, Tauro b Flama Azul, José Luis Mendieta, Tigre Colombiano
2) El Faraón, Mil Máscaras vs Raúl Reyes, Tony Salazar

EMLL (FRI) 02/04/1977 Arena Coliseo [http://superluchas.com/2015/02/04/en-un-dia-como-hoy-1977-perro-aguayo-y-fishman-vs-faraon-y-ringo-mendoza-1945-bobby-arreola-campeon-de-peso-medio-del-norte/ SuperLuchas]
1) Agente X vs Roy Lancer
2) Rafael Salamanca vs Huroki Sito
3) Dardo Aguilar vs Índio Pinto
4) Sergio Borrayo vs Leo López
5) Franco Colombo b Manuel Robles
6) Cachorro Mendoza, Máscara Roja b El Reo, Karloff Lagarde
7) El Faraón, Ringo Mendoza b Fishman, Perro Aguayo [super libre]
## straight falls

indy (FRI) 02/04/1977 Arena Zapotitlan, Tláhuac, Distrito Federal [luchablog photolog (2013-09-17 18.29.42)]
1) Blue Demon, El Santo b El Nazi, Septiembre Negro
## tecnicos took 2/3
2) El Solitario, Kung Fu b Dick Angelo, Golden Boy
&& rest of card is too blurry.

indy (FRI) 02/04/1977 Centro Cívico de Zapotitlán, Ciudad de México, Distrito Federal [http://superluchas.com/2015/02/04/en-un-dia-como-hoy-1977-perro-aguayo-y-fishman-vs-faraon-y-ringo-mendoza-1945-bobby-arreola-campeon-de-peso-medio-del-norte/ SuperLuchas]
1) El Troyano, Jack Veloz b Al Galicia, Bárbaro Fonseca
## Jack replaced Solar
2) El Solitario, Kung Fu b Dick Angelo, Golden Boy
3) Blue Demon, El Santo b El Nazi, Septiembre Negro

Mora (FRI) 02/04/1977 Cozumel, Quintana Roo [Halcon 239]
1) Carlos García, Villano III vs Alberto Muñoz, El Boschito
## El Boschito is also listed as Corsario (?)
&& fourth in a series of weekend loops in Quintana Roo (Cozumel, Cancun, Chetumal.) Magazine only mentions the main events.

Mora (SAT) 02/05/1977 Cancún, Quintana Roo [Halcon 239]
1) Carlos García, Villano III vs Alberto Muñoz, El Boschito
## El Boschito is also listed as Corsario (?)

EMLL (SUN) 02/06/1977 Arena Coliseo Guadalajara [El Informador 1977-02-06]
1) ? vs ??
2) ? vs ??
3) ? vs ??
4) Mario Alcala, Terremoto vs Américo Rocca, Herodes
5) Blue Demon, El Halcón, Mano Negra vs Fishman, Gemelo Diablo I, Gemelo Diablo II

indy (SUN) 02/06/1977 Acapulco, Guerrero [luchablog photolog (2013-09-17 18.31.59)]
1) Charro Valdez b Sureño
2) El Murciélago b El Norteño
3) El Extraño, The Bowman DRAW El Centauro, La Fiera Valenzuela
4) Chanoc, Índio Vitela, Septiembre Negro b Dardo Aguilar, Lizmark, Rafael Salamanca

indy (SUN) 02/06/1977 Arena Azteca, Iztapalapa, Distrito Federal [luchablog photolog (2013-09-17 18.31.46)]
1) Bengala II, Chamaco Ramírez b Cadáver II, Pepe Casas
2) El Troyano b Cadáver I
3) Electrón b Lalo Guerra
4) Príncipe Águila b El Centinela
5) Dick Angelo, Tino Herrera b Kung Fu, Ultraman

indy (SUN) 02/06/1977 Arena Coliseo Acapulco, Acapulco, Guerrero [Halcon 244]
1) Leo López, Sangre Chicana vs Agente X, Apolo Casillas

indy (SUN) 02/06/1977 Arena KO Algusto, Naucalpan, Estado de México [luchablog photolog (2013-09-17 18.30.57)]
1) Juan Guerrero b Pequeño Mike
2) Estrella del Sur b Leopardo II
3) Rayo Dorado I, Rayo Dorado II b Bulldog Morgan, Leopardo Negro
4) Rokambole b Centella Nolasco [hair]
5) Espectro Hernández, Negro Navarro, Tupamaro b Cobra, El Rostro, Javier Llanes
&& date may be off a week

indy (SUN) 02/06/1977 Arena San Juan Pantitlan, Ciudad Nezahualcóyotl, Estado de México [luchablog photolog (2013-09-17 18.31.22)]
1) De La Rosa, Soberbio I, Soberbio II vs Apolo Chino I, Apolo Chino II, Misterio Blanco I
2) Golden Boy, Mario el Exotico b ?, Hombre Nuclear
3) Astro Rey, Renato, Satán b El Rostro, José Torres, Potro Salvaje
&& date may be off a week

indy (SUN) 02/06/1977 Guatemala [Arena 968, RB]
1) El Alacrán, Scorpió b La Fiera, Leonal Rivas
&& city unknown

indy (SUN) 02/06/1977 Plaza de Toros el Cortijo, Venustiano Carranza, Distrito Federal [luchablog photolog (2013-09-17 18.31.54)]
1) Chico Baeza vs La Saeta Del Ring
2) El Veterinario vs El Toluca
3) Rommel vs El Patriarca
4) Cid, El Cóndor vs Delfin I, Delfin II

indy (SUN) 02/06/1977 Plaza de Toros el Progreso, Guadalajara, Jalisco [luchablog photolog (2013-09-17 18.30.32)]
1) Félix Mosqueda b Masakre
2) Puños De Acero, Solar I b Bastardo, Frank Tejeda
3) Baby Sharon, Frankenstein b Martin Escobedo, Tony Escobedo
4) El Solitario b Ángel Blanco [hair]
5) Marina Rey b Chela Salazar
## planned to be a hair match, but not because of the commission. They had a very bloody match as if to prove a point.
&& date may be off a week

indy (SUN) 02/06/1977 Plaza de Toros Valente Arellano, Torreón, Coahuila [El Siglo de Torreon 1977-02-06]
1) Centella Azul vs El Fraterno
2) Ciclón Negro vs Índio Navajo
3) Cesar Curiel, Pantera Azul vs Espanto III, Pelón Águilar
4) Charito Silva, Lupita Lara vs Pantera Suriana, Tony La Tapatia
5) Karina, Rosita De La Cruz vs Estela Molina, Viuda Negra

indy (SUN) 02/06/1977 Venustiano Carranza, Distrito Federal [luchablog photolog (2013-09-17 18.31.09)]
1) Fantastic, Kung Fu b Chacal de la Rosa, Odin

indy (SUN) 02/06/1977 Vergel de Guadalupe, Ciudad Nezahualcóyotl, Estado de México [luchablog photolog (2013-09-17 18.31.46)]
1) El Cumbao b Many Rosales
2) Rocco Valente b El Indomable
3) Murciélago Infernal b Universo 76
4) Barba Negra, Bárbaro Fonseca, Benny Castelo DQ Carnicerito, Panama Panther, Tony Arce
5) Mr. Cobra, Veterinario b Hombre Nuclear, Maravilla Peruana

Mora (SUN) 02/06/1977 Chetumal, Quintana Roo [Halcon 239]
1) Carlos García, Villano III vs Alberto Muñoz, El Boschito
## El Boschito is also listed as Corsario (?)

MORA (SUN) 02/06/1977 Plaza de Toros La Monumental, Monterrey, Nuevo León [Halcon 242]
1) el Signo  (c) vs El Matematico [UWA LIGHT]
2) Ray Mendoza  (c) vs Anibal [UWA LH]

MORA (SUN) 02/06/1977 Toreo de Cuatro Caminos, Naucalpan, Estado de México [luchablog photolog (2013-09-17 18.29.29)]
1) Tony Sugar b Reyes Olivia
2) Rudy Valentino b El Químico
3) Nahur Kaliff b Bengala I
4) Bello Greco, Sergio Sarabia DQ Dr. Wagner, Tinieblas
5) El Santo, Gran Hamada, Huracán Ramírez b Cesar Valentino, Dorrel Dixon, Sunny War Cloud

indy (MON) 02/07/1977 Tampico, Tamaulipas [Halcon 242, Halcon 244]
1) El Rostro b Mr. Power [mask]
## no name given

EMLL (TUE) 02/08/1977 Arena Coliseo [http://wrestlingclassics.com/cgi-bin/.ubbcgi/ultimatebb.cgi?ubb=get_topic&f=10&t=004694#000000 Matt Farmer]
1) El Maldito vs Gran Davis
2) El Trueno vs Joe Marino
3) Spider vs Bufalo Salvaje
4) Dardo Aguilar, Rafael Salamanca vs Huroki Sito, Roy Steve
5) Franco Colombo, Tony López vs Índio Vitela, Sangre Chicana
6) Máscara Roja vs Septiembre Negro

EMLL (TUE) 02/08/1977 Arena Coliseo Guadalajara [El Informador 1977-02-08]
1) ? vs ??
2) ? vs ??
3) ? vs ??
4) Blue Demon, Mano Negra vs Cesar Curiel, El Halcón and Gemelo Diablo I, Gemelo Diablo II and Fishman, Iván El Bronco [torneo]

indy (TUE) 02/08/1977 Tulancingo, Hidalgo [halcon 242]
1) Flama Azul, Gallo Tapado, Tigre Colombiano vs El Nazi, El Reo, Karloff Lagarde

Mora (TUE) 02/08/1977 Gimnasio Municipal Lic. Benito Juárez, Cuautitlán, Estado de México [Halcon 241, Halcon 242, Halcon 244]
1) Javier Montes b Tapatío Turok
## straight falls
2) Negro Navarro b Lobo Rubio [UWA LIGHT, #1 Contenders, torneo]
## Navarro, Zeus and Matematico meet in a final
3) Zeus b Lobo Rubio [UWA LIGHT, #1 Contenders, torneo]
4) Fili Estrella, Gulliver b Gaby Da Silva, Gran Nikolai
5) Rostro, Ultraman DQ Astro Rey, Villano III

EMLL (WED) 02/09/1977 Arena Coliseo Acapulco, Acapulco, Guerrero [Halcon 242, Halcon 245]
1) Yanco b Aristos
2) Flama Azul  (c) b Tauro [MEX LIGHT]
3) Enrique Vera, Mil Máscaras b Adorable Rubi, Gran Markus
4) El Faraón  (c) b Tony Salazar [NWA MIDDLE]

EMLL (FRI) 02/11/1977 Arena México [Halcon 244, http://wrestlingclassics.com/cgi-bin/.ubbcgi/ultimatebb.cgi?ubb=get_topic&f=10&t=004694#000000 Matt Farmer]
1) Karate Hayato b Apolo Casillas
2) Cachorro Mendoza b Kimura Sato
3) Carlos Plata, Máscara Roja b As Charro, El Reo
4) Blue Demon, Mano Negra b Adorable Rubi, Demonio Blanco
## 2-0
5) Fishman, Gran Markus, Perro Aguayo b El Faraón, Mil Máscaras, Ringo Mendoza
## 2-1

indy (FRI) 02/11/1977 Centro Civico, Zapotitlan, Puebla [Halcon 242]
1) El Troyano, Solar I vs Al Galica, Bárbaro Fonscea
2) El Solitario, Kung Fu vs Dick Angelo, Golden Boy
3) Blue Demon, El Santo vs El Nazi, Septiembre Negro

INDY (FRI) 02/11/1977 Los Angeles, California [RB, wrestling-titles]
1) Chavo Guerrero b Alfonso Dantes  (c) [NWA LH]

Mora (FRI) 02/11/1977 Cozumel, Quintana Roo [Halcon 239]
1) Chabela Romero, Chela Salazar vs Irma González, Marina Rey
## all listed as appearing, match may be slightly different
&& fifth in a series of weekend loops in Quintana Roo (Cozumel, Cancun, Chetumal.) Magazine only mentions the main events.

indy (SAT) 02/12/1977 Arena Apatlaco, Iztapalapa, Distrito Federal [luchablog photolog (2013-09-17 18.30.42)]
1) Arturo Cruz, Mario Rubio vs Angelo, Zebra and El Cóndor, Tino Herrera and El Tupamaro, Polaco and Apolo Chino I, Apolo Chino II and Kaplin, Ray [torneo]
## Ray & Kaplin are favorites

indy (SAT) 02/12/1977 Deportivo Lopez Velarde, Venustiano Carranza, Distrito Federal [luchablog photolog (2013-09-17 18.31.09)]
1) Johnny García Fantastic, Popeye vs Delfin Alacrán, Villano II
2) Perro Sosa vs Rokambole
3) Ciclón Moreno, Tony Arce vs Chacal de la Rosa, Chucho Conde
4) Cóndor Azul vs Mr. Bronce
5) Pequeño Veneno vs Chino Alonso
&& date may be off a week

indy (SAT) 02/12/1977 Deportivo Lopez Velarde, Venustiano Carranza, Distrito Federal [Halcon 244]
1) Rokambole b Perro Sosa [hair]

Mora (SAT) 02/12/1977 Cancún, Quintana Roo [Halcon 239]
1) Chabela Romero, Chela Salazar vs Irma González, Marina Rey
## all listed as appearing, match may be slightly different

EMLL (SUN) 02/13/1977 Arena Coliseo Guadalajara [El Informador 1977-02-13]
1) ? vs ??
2) ? vs ??
3) ? vs ??
4) Blue Demon, Ciclón Veloz Jr., Terremoto vs Alfonso Dantes, Fishman, Gemelo Diablo II
5) El Halcón  (c) vs Gemelo Diablo I [MEX HEAVY]

indy (SUN) 02/13/1977 Arena Azteca, Iztapalapa, Distrito Federal [luchablog photolog (2013-09-17 18.31.46)]
1) Ave Blanca vs Lalo Guerra
2) Arcángel, Chamaco Ramírez vs Cadáver I, Cadáver II
3) Príncipe Águila vs Electrón
4) Kung Fu, Mil Máscaras vs Dick Angelo, El Reo

indy (SUN) 02/13/1977 Arena Coliseo San Luis Potosí, San Luis Potosí, San Luis Potosí [Halcon 245]
1) Cinta Negra vs ?
2) Black Killer vs Iván El Bronco [hair]

indy (SUN) 02/13/1977 Arena KO Algusto, Naucalpan, Estado de México [luchablog photolog (2013-09-17 18.30.57)]
1) Pequeño Mike vs El Griego
2) Centella Nolasco vs Tigre Imperial
3) Rokambole vs Rayo Dorado I
4) Cobra, Esetrella Del Sur vs Espectro Hernández, Negro Navarro
## Navarro is a double champion
5) Chicano Power, Ray, Tupamaro vs Javier Llanes, Maravilla Perez, Ruben Palima
&& date may be off a week

indy (SUN) 02/13/1977 Arena Lopez Mateos [luchablog photolog (2013-09-17 18.29.43)]
1) Alex García vs Antcrcha
2) Muerte Reyna vs Atómico Blanco
3) Fantasma de la Opera, Pepe Larme vs Al Steve, Birdman
4) Al Galicia, Emperador vs Danny Boy, Maravilla Negro I
5) Gary Medina, Monje Siniestro vs Cienfuegos, Terry Bolaños
&& names are blurry

indy (SUN) 02/13/1977 Arena San Juan Pantitlan, Ciudad Nezahualcóyotl, Estado de México [luchablog photolog (2013-09-17 18.31.22)]
1) Recio vs Dinámico
2) Juan Manual vs Rudy Vazaquez
3) Misterio Blanco II vs Jorge Ortiz
4) Gatubedo, Hombre Nuclear, Misterio Blanco I vs Chacal de la Rosa, Soberbio I, Soberbio II
## Gatovedo is local champion
5) El Rostro, José Torres, Potro Salvaje vs Astro Rey, Golden Boy, Satán
## rematch
&& date may be off a week

indy (SUN) 02/13/1977 Arena Venustiano Carranza, Venustiano Carranza, Distrito Federal [Halcon 244]
1) Apolo Chino I b Rokambole  (c) [DVC LIGHT]
2) Tiger Hispano b Zebra Kid [hair]

indy (SUN) 02/13/1977 Ecatepec, Estado de México [luchablog photolog (2013-09-17 18.30.42)]
1) Ricky Martinez vs Perro Asesino
2) Tony Padilla vs Satán Verde
3) Fankie Hernández, Lechuza vs 13 Negro, As Negro
4) ? vs Juan Colorado [super libre]
5) El Polar, Kid Acero vs Diogenes, Rudy Espinosa
&& date may be off a week

indy (SUN) 02/13/1977 Guatemala [Arena 968, RB]
1) Dorrel Dixon, Scorpió b Edgar Echeverria, Leonal Rivas
&& city unknown

indy (SUN) 02/13/1977 Plaza de Toros el Cortijo, Venustiano Carranza, Distrito Federal [luchablog photolog (2013-09-17 18.31.54)]
1) El Solitario, Fantastic, Tamba b Sunny War Cloud, Villano I, Villano II

indy (SUN) 02/13/1977 Plaza de Toros el Progreso, Guadalajara, Jalisco [El Informador 1977-02-13, Halcon 245]
1) Martin Escobedo, Wong Lee vs El Bastardo, Frank Tejada
2) Puño De Acero, Solar I vs Babe Face, Baby Sharon
3) Canek, Lobo Rubio vs Alberto Muñoz, El Santo
4) el Signo  (c) vs El Matematico [UWA LIGHT]
5) Frankenstein vs The Monsther [mask]

indy (SUN) 02/13/1977 Plaza de Toros Valente Arellano, Torreón, Coahuila [El Siglo de Torreon 1977-02-13]
1) ? vs ??
2) ? vs ??
3) Kasak vs Eric el Rojo
4) La Sombra, Temoc Torres vs Espanto III, The King
5) Gallo Tapado, Hermano Mata I, Hermano Mata II vs El Rebelde, Li-Chang, Pelón Águilar

indy (SUN) 02/13/1977 Venustiano Carranza, Distrito Federal [luchablog photolog (2013-09-17 18.31.09)]
1) Zebra Kid b Tiger Hispano [hair]

Mora (SUN) 02/13/1977 Chetumal, Quintana Roo [Halcon 239]
1) Chabela Romero, Chela Salazar vs Irma González, Marina Rey
## all listed as appearing, match may be slightly different

MORA (SUN) 02/13/1977 Toreo de Cuatro Caminos, Naucalpan, Estado de México [http://i.imgur.com/8udrsFW.jpg luchablog photolog (2013-09-17 18.28.42)]
1) Arturo Cruz vs Miguel Chamorro
2) Bengala vs Dr. Krimen
3) Ultraman vs Pepe Casas
4) Cesar Valentino, Coloso Colosetti vs Astro Rey, Rudy Juarez
5) Bello Greco, Sergio Sarabia vs Dr. Wagner, Tinieblas
&& date may be off a week

EMLL (TUE) 02/15/1977 Arena Coliseo Guadalajara [El Informador 1977-02-15]
1) ? vs ??
2) ? vs ??
3) ? vs ??
4) Marco Alcala, Mario Alcala vs Black Killer, Iván El Bronco
5) Blue Demon, Ciclón Veloz, El Halcón vs Fishman, Gemelo Diablo I, Gemelo Diablo II

indy (TUE) 02/15/1977 Arena Aficion [Halcon 244]
1) Dr. Wagner vs Canek

MORA (TUE) 02/15/1977 Gimnasio Municipal Lic. Benito Juárez, Cuautitlán, Estado de México [Halcon 244]
1) Negro Navarro b Zeus, El Matematico [UWA LIGHT, #1 Contenders, torneo]
## said to have gone five falls

Mora (TUE) 02/15/1977 Unidad Deportiva de Acapulco, Acapulco, Guerrero [Halcon 245]
1) Lucio Risas b Pegasso
2) Chamaco Ramírez b Barba Negra
3) Brazo de Oro, Solar I b Fantasma de la Quebrada, Polaco
4) El Solitario b Vargas
## Solitario put his mask up against 60,000 pesos.
&& set a gate record of 76700, more than 4000 pesos of the previous record (but they've been running here only since late last year)

unknown (WED) 02/16/1977 Arena Coliseo Acapulco, Acapulco, Guerrero [KO 1238, RB]
1) El Auténtico b Wama
2) Rocambole b Lucio Risas
3) Mario el Exotico b Zaratustra
4) Saeta China I, Saeta China II b El Polaco, La Furia
5) Alberto Muñoz, Dr. Wagner b Frankenstein, Villano I

unknown (THU) 02/17/1977 Arena Municipal, Ciudad Juárez, Chihuahua [KO 1238, RB]
1) Canelo Villela b Avispón Verde
2) Dorado Hernández b El Inquisidor
3) El Impostor, El Vagabundo b La Bestia, Von Hitler
4) Alex Reyna, Tony Reyna b Hermes, Tony Krest
5) Flama Roja, Judas Monterrosa b Johnny Lezcano, La Gacela

unknown (THU) 02/17/1977 Cozumel, Quintana Roo [KO 1238, RB]
1) Irma González b Chabela Romero [MEX WOMEN]

unknown (THU) 02/17/1977 Huauchinango, Puebla [Arena 967, Halcon 245, RB]
1) Lasser b El Patriarca
2) El Aposto, El Tupamaro b Tony Romano, Zebra Kid
3) Dr. Wagner, Huracán Ramírez b Dick Angelo, Mazambula El Brujo

EMLL (FRI) 02/18/1977 Arena México [https://www.facebook.com/photo.php?fbid=622631397784599&set=a.461505387230535.102143.454597374588003&type=1 DJ Spectro, Halcon 245]
1) Leo López DRAW Tony López
2) Gran Markus, Tony Salazar b Ciclón Veloz, Enrique Vera
3) Dantes, Rubí Ruvalcaba b Demonio Blanco, El Santo
4) Perro Aguayo b Ringo Mendoza  (c) [MEX MIDDLE]
5) Máscara Roja COR El Reo [mask]
## El Reo is Luis Gonzalez Miranda from Tacubaya
6) El Faraón  (c) b Fishman [NWA MIDDLE]
## Fishman took 2/3
&& Chavo Guerrero appeared in between matches as the NWA LH champ, his first Arena Mexico appearnace.

unknown (FRI) 02/18/1977 Cancún, Quintana Roo [KO 1238, RB]
1) Irma González b Chabela Romero [MEX WOMEN]

EMLL (SAT) 02/19/1977 Arena Puebla [KO 1238, RB]
1) El Zaino b El Maldito
2) Dardo Aguilar DQ Satánico
3) Chino Chow, Ciclón Veloz b El Nazi, Rizado Ruiz
4) Enrique Vera, Mano Negra b Alfonso Dantes, Demonio Blanco
5) Blue Demon DQ Perro Aguayo
## Mano Negra ran in to attack Perro afterwards & issue title match challenge

EMLL (SAT) 02/19/1977 Pista Arena Revolución [Halcon 244, Halcon 247]
1) El Halcón  (c) b Sangre Chicana [MEX HEAVY]
2) Flama Azul  (c) vs Tauro [MEX LIGHT]

indie (SAT) 02/19/1977 Cancún, Quintana Roo [KO 1238, RB]
1) Coloso Colosetti b Sunny War Cloud

MORA (SAT) 02/19/1977 Tuxtla Gutiérrez, Chiapas [Halcon 246]
1) el Signo  (c) b El Matematico [UWA LIGHT]
## date is a guess

EMLL (SUN) 02/20/1977 Arena Coliseo Guadalajara [El Informador 1977-02-20]
1) ? vs ??
2) ? vs ??
3) ? vs ??
4) El Vengador, Raúl Mata vs Iván El Bronco, Sangre India
5) Fishman, Gran Markus vs Blue Demon, El Halcón

EMLL (SUN) 02/20/1977 Arena Puebla [Halcon 246, KO 1238, RB]
1) Caballero Azul b Chico Madrid
2) Estrella Blanca b Huroki Sito
3) Roberto Robles b As Negro
4) Mr. Steel, Porthos DQ Alfa, Tauro
5) Flama Azul  (c) b Rodolfo Ruiz [MEX LIGHT]
&& matches 2-4 with a battle royal

indie (SUN) 02/20/1977 Arena Ecatepec de Morelos, Ecatepec, Estado de México [Arena 967, Halcon 245, RB]
1) Diablo Hernández b Tormenta
2) El As b Gaston del Valle
3) Satán Verde b Ricky Martinez
4) Frank Hernández, Polar b 13 Negro, Aquaman
5) Kid Acero, Tigre Gomez b Diogenes, Rudy Espinoza
6) Zuanga b Juan Colorado [mask, hair]

indie (SUN) 02/20/1977 Arena Municipal, Ciudad Juárez, Chihuahua [KO 1238, RB]
1) Impostor, Johnny Lezcano, La Gacela b Flama Roja, La Bestia, Tony Krest
2) Dorado Hernández, El Vagabundo b El Delfin, Hermes
3) Judas Monterrosa NF Tony Reyna
## bloody match stopped @ 45 min mark

indie (SUN) 02/20/1977 Arena Pichucalco, Pichucalco, Chiapas [Arena 967, RB]
1) Lince Del Sur b Satanas
2) El Tigre b Hombre De Negro
3) Frankenstein, Lobo Negro b El Jaguar, El Rubi
4) Pillo De Tepito b El Zorro Guatemalteco  (c) [? LIGHT]
## said to be

indy (SUN) 02/20/1977 Guatemala [Arena 968, RB]
1) Dorrel Dixon, Scorpió b Edgar Echeverria, Leonal Rivas
## revancha
&& city unknown

indy (SUN) 02/20/1977 Plaza de Toros Valente Arellano, Torreón, Coahuila [El Siglo de Torreon 1977-02-20]
1) ? vs ??
2) Ciclón Negro vs Tony Arellano
3) Kasak, La Sombra vs Eric el Rojo, Espanto III
4) Charito Silva, Viuda Negra vs Lupita Lara, Norma González
5) As Charro, Pelón Águilar vs Príncipe Rebelde, Temoc Torres

EMLL (TUE) 02/22/1977 Arena Coliseo Guadalajara [El Informador 1977-02-22]
1) ? vs ??
2) ? vs ??
3) ? vs ??
4) Estela Molina, La Viuda Negra vs Karina, Pantera Suriana
5) Blue Demon, El Halcón, Terremoto vs Fishman, Gran Markus, Terremoto

EMLL (TUE) 02/22/1977 Arena México [http://wrestlingclassics.com/cgi-bin/.ubbcgi/ultimatebb.cgi?ubb=get_topic&f=10&t=004694#000000 Matt Farmer]
1) Mil Máscaras b El Halcón [semifinal]
2) El Halcón b Alfonso Dantes [semifinal]
3) Mil Máscaras b Alfonso Dantes [mask, hair]
## 2-1
&& sold out

MORA (TUE) 02/22/1977 Gimnasio Municipal Lic. Benito Juárez, Cuautitlán, Estado de México [Combates 70, Halcon 245]
1) Nahur Kaliff, Tupamaro, Zebra Kid b Danny Boy, Dick Angelo, Ráfaga Moreno
2) El Vikingo, Renato Torres b José Torres, Kung Fu
3) Anibal, Tawa Vera DQ Atila, Ray Mendoza
## Atila replaced Villano III (travel issues from Monterrey)
4) Zeus b El Matematico [super libre]
5) el Signo  (c) b Negro Navarro [UWA LIGHT]

EMLL (WED) 02/23/1977 Arena Coliseo Acapulco, Acapulco, Guerrero [Halcon 248]
1) Nazi DRAW El Cobarde
2) Adorable Rubi, Alfonso Dantes, Perro Aguayo b Carlos Plata, Mano Negra, Spirit

indie (THU) 02/24/1977 Auditorio Municipal, Ciudad Juárez, Chihuahua [KO 1239, RB]
1) Alex Reyna b Canelo Villela
2) Impostor, La Gacela b Corsario Blanco, Flama Roja
3) Dorado Hernández b La Bestia
4) El Delfin b Sergio Palgar
5) El Cid, Índio Medina, Judas Monterrosa b Johnny Lezcano, Tony Reyna, Vic Ramírez
## set up Monterrosa vs Reyna in a hair match

MORA (THU) 02/24/1977 Arena Toluca, Toluca, Estado de México [Combates 70, Combates 74]
1) Javier Llanes b Baby Sharon
## Shadown replaced Nomada
2) Ultratumba DQ Astro Rey
3) Dos Caras, Dr. Wagner, Huracán Ramírez DQ Canek, Cesar Valentino, Judas
## Dos Caras replaced Rostro
4) Ray Mendoza  (c) b El Solitario [UWA LH]
&& 51,000 peso gate, a record

EMLL (FRI) 02/25/1977 Arena México [Arena 967, Halcon 246, RB]
1) Índio Vitela b Sergio Borrayo
2) Ciclón Veloz DRAW El Nazi
## Arena 967 says El Nazi is subbing for As Charro
3) Gemelo Diablo I, Gemelo Diablo II b Carlos Plata, Enrique Vera
4) Fishman, Rubí Ruvalcaba b Chavo Guerrero, Ringo Mendoza
5) Alfonso Dantes, Gran Markus, Perro Aguayo b El Faraón, El Halcón, Santo

EMLL (SAT) 02/26/1977 Pista Arena Revolución [Arena 967, RB]
1) El Suriano b Mario Rocca
2) El Trueno b Bufalo Salvaje
3) Rodolfo Ruiz b Mr. Steel
4) Karate Hayato b Rafael Salamanca
5) Kimura Sato b Halcón Dorado
6) El Monarca DQ Septiembre Negro
7) Blue Demon, Gallo Tapado, Máscara Roja b Demonio Blanco, El Reo, Roy Reyes

indie (SAT) 02/26/1977 Nueva Arena Apatlaco, Iztapalapa, Distrito Federal [Arena 967, RB]
1) El Polaco DRAW Tino Herrera
2) Ángel Blanco, Canek DQ Alberto Muñoz, Anibal
3) El Solitario, Ultraman b El Vikingo, Renato Torres

indie (SAT) 02/26/1977 Sala De Fiestas Carta Blanca, Candelaria, Campeche [Arena 968, RB]
1) Frankenstein, Lobo Negro b El Lince, Rubi
2) Pillo De Tepito  (c) b El Zorro Guatemalteco [? LIGHT]

Alvarez (SUN) 02/27/1977 Arena San Juan Pantitlan, Ciudad Nezahualcóyotl, Estado de México [KO 1238, RB]
1) Dinámico, Johnny García, Zebra Acapulquena b Destino Negro, El Extraño, Zorro Plateado
2) Chacal de la Rosa b Potro Salvaje [super libre]
3) Dr. Wagner, Tinieblas b Danny Cruz, Ray Mendoza
&& promoter Salvador Alvarez

Cervantes (SUN) 02/27/1977 Arena Ecatepec de Morelos, Ecatepec, Estado de México [Arena 968, RB]
1) Kid Acero, Tigre Gomez DQ El Salvaje, Zuanga  ’
## sets up revancha
2) Tinieblas, Ultraman b Diogenes, Dr. O’Borman

EMLL (SUN) 02/27/1977 Arena Coliseo Guadalajara [https://www.facebook.com/96186896558/posts/10153565771006559  Box Y Lucha, El Informador 1977-02-27, KO 1238, RB]
1) Águila India DRAW El Dorado
2) El Ídolo b Calavera I
3) Sangre India b El Vengador
4) Chavo Guerrero, El Halcón, Raúl Mata b El Reo, Gran Markus, Iván El Bronco
5) Fishman b Blue Demon  (c) [MEX WELTER]

indie (SUN) 02/27/1977 Arena Azteca, Iztapalapa, Distrito Federal [KO 1238, RB]
1) El Santo, Príncipe Azteca b El Alacrán, Pepe Casas
&& lleno total

indie (SUN) 02/27/1977 Arena Coliseo Acapulco, Acapulco, Guerrero [KO 1239, RB]
1) El Galeonero b Silencioso
2) Cometa, Yanco b Aristos, Musulman
3) Bowman, Lucifer b Índio Vitela, The Ranger
4) Hércules, Lizmark b Príncipe Rebelde, Septiembre Negro

indie (SUN) 02/27/1977 Arena Jalisco, Guadalajara, Jalisco [KO 1238, RB]
1) El Desertor DRAW Gabriel Lomeli
2) Cachorro Esquivel b Súper Star I
3) El Capitán, Guerrero Nazi b Centurión Azul III, Johnny Esquivel
## debut of El Capitan
4) Chucho García, El Brujo b El Paladin, El Sagitario
5) Comando, El Argentino, Luis Bustos b Dr. Lama, Huichol Tapatío I, Huichol Tapatío II

indie (SUN) 02/27/1977 Auditorio Municipal, Ciudad Juárez, Chihuahua [KO 1239, RB]
1) Canelo Villela b Dorado Hernández
2) El Impostor, Roy Estrada b Corsario Blanco, El Delfin
3) El Cid, Índio Medina b Johnny Lezcano, Vick Ramírez
4) Flama Roja DQ La Gacela
5) Tony Reyna b Judas Monterrosa [hair]
## Reyna offered up a $15,000.00 purse if he had lost

indie (SUN) 02/27/1977 Deportivo Venustiano Carranza, Venustiano Carranza, Distrito Federal [Arena 967, RB]
1) Negro Navarro b Soberbio I [DVC WELTER]
2) Barba Negra, El Polaco, el Signo b Cóndor Azul, Fantastic, Saeta Chino I

indie (SUN) 02/27/1977 Palacio de los Deportes, Villahermosa, Tabasco [KO 1238, RB]
1) El Matematico, Tifón Negro b Guapo Siniestro, Príncipe Odin

indie (SUN) 02/27/1977 Plaza de Toros el Cortijo, Venustiano Carranza, Distrito Federal [Arena 967, RB]
1) El Carnicero DRAW Tom Mix
2) El Patriarca b Rommel
## setting up apuesta match
3) El Cóndor, El Toluco, Saeta Hernández b El Polaco, Miguelito Negro, Zeus
4) Fantastic, Tamba b El Polaco, Villano I
5) Ángel Blanco b El Solitario

indie (SUN) 02/27/1977 Tulancingo, Hidalgo [KO 1238, RB]
1) Huracán Ramírez, Lalo Guerra b ?, El Tiburón

Indy (SUN) 02/27/1977 Arena Isabel, León, Guanajuato
1) Rayo Universitario vs Hijo Del Diablo
2) Lince Azul vs El Ángel Rojo
3) Chale Armenta vs El Americano
4) Barney Killer, El Enfermero Jr. vs Cienfuegos, Hércules León
&& location, year is a guess

indy (SUN) 02/27/1977 Guatemala [Arena 968, RB]
1) Edgar Echeverria b Scorpió [Guatemala Heavyweight]
&& city unknown

indy (SUN) 02/27/1977 Plaza de Toros Valente Arellano, Torreón, Coahuila [El Siglo de Torreon 1977-02-27]
1) Ciclón Negro vs Guapo Ibarra
2) Centella Azul vs El Fraterno
3) Johnny Carrillo vs Eric el Rojo
4) Equus, La Sombra vs Espanto III, The King
5) Carlos Plata, Hermano Alcala I, Marco Alcala vs Herodes, Pelón Águilar, Tony Salazar

MORA (SUN) 02/27/1977 Plaza de Toros La Monumental, Monterrey, Nuevo León [Comabtes 74, Halcon 245]
1) Gran Hamada, Rene Guajardo b Anibal, Villano III [Relevos Increíbles]
## straight falls.

More (SUN) 02/27/1977 Toreo de Cuatro Caminos, Naucalpan, Estado de México [Arena 967, Halcon 246, RB]
1) Jorge Ortiz b Roberto Rey
2) El Astro b Reyes Oliva
3) Bengala I, Bengala II b Lobo Rubio, Nahur Kaliff
4) El Vikingo, Renato Torres b Kung Fu, Ultraman
5) Cesar Valentino, Coloso Colosetti b Bello Greco, Sergio el Hermoso [hair]

Moreno (SUN) 02/27/1977 Arena KO Algusto, Naucalpan, Estado de México [KO 1238, RB]
1) Maravilla Perez, Ráfaga Moreno b Bulldog Morgan, Tigre Hispano
2) Negro Navarro b Estrella del Sur [NAUCALPAN LIGHT]
3) El Rostro, Javier Llanes, La Cobra b Chicano Power, El Destroyer, El Exorcista
&& magazine doesn't specifically say this is Arena KO but seems to be

Perez-Aldana (SUN) 02/27/1977 Arena Raff, Ciudad Nezahualcóyotl, Estado de México [KO 1238, RB]
1) Rocco Valente b Rey America
2) Relámpago Negro II b Zaeta Del Ring
## only 1 fall because Zaeta injured arm in 1st fall
3) Cruz Blanca b El Trampas
## sets up revancha for next week
4) Genio Negro, Tony Arce b Rayo Dorado, Ricky Roldan
5) Agente X, Gallo Tapado DQ Kalimaco, Raúl Reyes

indu (MON) 02/28/1977 Tampico, Tamaulipas [Combates 70]
1) El Rostro vs Mr. Power

EMLL (TUE) 03/01/1977 Arena Coliseo Guadalajara [El Informador 1977-03-01]
1) ? vs ??
2) ? vs ??
3) ? vs ??
4) Estela Molina, La Viuda Negra vs Karina, Pantera Suriana [super libre]
5) Blue Demon, El Halcón, Máscara Roja vs El Reo, Fishman, Gran Markus

indie (TUE) 03/01/1977 Acapulco, Guerrero [KO 1238, RB]
1) Rocambole b Lucio Risas [mask, hair]

indie (TUE) 03/01/1977 Arena Nueva Atzacoalco, Gustavo A. Madero, Distrito Federal [KO 1238, RB]
1) El Monarca, Sergio Borrayo b Alfa Centauris, Leo López
2) Alfonso Dantes, Perro Aguayo b El Cobarde, El Faraón

MORA (TUE) 03/01/1977 Arena Aficion [Arena 968, Halcon 246, RB]
1) Bello Greco, Sergio el Hermoso DQ Scorpió, Villano I
## Scorpio is back from a month long tour of Guatemala
2) El Solitario, Solar I b Coloso Colosetti, Frankenstein
3) Dr. Wagner  (c) b Canek [MEX LH]

MORA (TUE) 03/01/1977 Gimnasio Municipal Lic. Benito Juárez, Cuautitlán, Estado de México [Combate 74, Halcon 246]
1) Danny Boy, Javier Montes, Lacer vs El Húngaro, Homus Homega, Zebra Kid
2) Dick Angelo, Ráfaga Moreno vs Nahur Kaliff, Tupamaro
3) el Signo, Polaco, Zeus vs El Vikingo, Mazambula, Renato Torres
4) Anibal b Ray Mendoza

MORA (TUE) 03/01/1977 Unidad Deportiva de Acapulco, Acapulco, Guerrero [Combates 70, Halcon 247]
1) La Cebra b Arturo Cruz
2) Soberbio I, Soberbio II b Saeta China, Saeta China I
3) Rokambole b Lucio Risas [hair]
## said to be better than the main event. Halcon 248 alleges Risas didn't actually get his hair cut and demands the comission get inovlved
4) Huracán Ramírez DQ Sunny War Cloud
5) Villano III  (c) b Alberto Muñoz [UWA WELTER]
## Villano took 2/3. 45 minute match. third challenge.

indie (THU) 03/03/1977 Arena Municipal, Ciudad Juárez, Chihuahua [KO 1240, RB]
1) Sergio Palgar b Villela
2) El Mercenario II b Alex Reyna
3) El Mercenario I b Roy Estrada
## Estrada suffered a dislocated arm
4) Impostor, Serpiente Blanca b Cid, Luthor
5) Gacela, Rudy Reyna, Vic Ramírez b Flama Roja, Índio Medina, Judas Monterrosa

indie (THU) 03/03/1977 Celaya, Guanajuato [KO 1238, RB]
1) Bengala II, Tinieblas vs Miguel Chamorro, Nahur Khalif

indie (THU) 03/03/1977 Milpa Alta, Distrito Federal [KO 1238, RB]
1) Ángel Salvaje vs Chamaco Orduña
2) Tizoc vs Ciclón Mexicano
3) El Químico, Raúl Guerrero vs Nahur Khalif, Reyes Oliva
4) Arturo Gaona, Octavio Gaona vs Dick Angelo, La Furia

indie (THU) 03/03/1977 Xalapa, Veracruz [KO 1238, RB]
1) Bengala I, Blue Demon vs El Veterinario, Siberiano

EMLL (FRI) 03/04/1977 Arena México [Arena 968, KO 1238, RB]
1) Índio Pinto b Rafael Salamanca
2) Spirit DQ Karloff Lagarde
3) Chavo Guerrero b Raúl Reyes
## Adrable Rubi appeared afterwards for a title challenge
4) Blue Demon b El Reo
5) Adorable Rubi, Gemelo Diablo II b Carlos Plata, El Cobarde
## sets up Diablo/Plata hair match
6) Alfonso Dantes, Gemelo Diablo I, Perro Aguayo b El Faraón, El Halcón, José Luis Mendieta
## sets up Perro/Faraon title match
&& all matches except opener determined by battle royale

indie (FRI) 03/04/1977 Arena Tuxtla Gutiérrez, Tuxtla Gutiérrez, Chiapas [KO 1238, RB]
1) Apolo Chino I, Apolo Chino II vs Soberbio I, Soberbio II
2) Dr. Wagner, El Barco vs Astro Rey, El Noruego

indie (FRI) 03/04/1977 Arena Zapotitlan, Tláhuac, Distrito Federal [KO 1238, RB]
1) Ciclón Moreno vs Fantasma Del Bajío
2) Rokambole vs Chacal de la Rosa
3) Fantasma de la Opera vs Al Galicia
4) Conde Azul, El Cóndor vs Orfeo Negro II, Príncipe Odin
5) Alberto Muñoz, Fantastic, Huracán Ramírez vs Ray Mendoza, Villano I, Villano II

indie (FRI) 03/04/1977 Gimnasio Lazaro Cardenas, Salamanca, Guanajuato [KO 1238, RB]
1) Jorge Ortiz, Roberto Rey vs Atomus, Lobo
2) Lola González vs La Samuray
3) El Fugitivo vs Centella Verde
4) Astro Rey, Tinieblas vs Cesar Valentino, Rudy Reyna

indy (FRI) 03/04/1977 Ciudad Madero, Tamaulipas [Halcon 247]
1) Bengala I, Bengala II vs Furia, Zebra Kidd
2) Rene Guajardo, Rodolfo Valentino vs Alejandro Montaña, Gran Hamada

indy (FRI) 03/04/1977 Tuxtla Gutiérrez, Chiapas [Halcon 247]
1) el Signo, Enfermero vs El Matematico, Javier Llanes

EMLL (SAT) 03/05/1977 Arena Nueva Atzacoalco, Gustavo A. Madero, Distrito Federal [Halcon 247, KO 1238, RB]
1) Bufalo Salvaje vs Gorilla Flores
2) El Monarca, Halcón Dorado II vs ? Robles, Leo López
3) Flama Azul  (c) b Tauro [MEX LIGHT]
## said to be sixth defense
4) Carlos Plata, El Faraón vs Adorable Rubi, Sangre Chicana
&& date could be off a week

EMLL (SAT) 03/05/1977 Pista Arena Revolución [KO 1238, RB]
1) El Maldito vs Mario Rocca
2) El Suriano vs Impacto
3) Mr. Steel vs El Nómada
4) Halcón Dorada II vs Rodolfo Ruiz
5) Estrella Blanca vs Huroki Sito
6) Ciclón Veloz Jr., Tony López vs Cachorro Mendoza, Ringo Mendoza and Demonio Blanco, Fishman and As Charro, El Nazi

indie (SAT) 03/05/1977 Arena Apatlaco, Iztapalapa, Distrito Federal [KO 1238, RB]
1) Conde Murciélago vs Saeta Hernández
2) Atomus, Mr. Misterio vs Ciclón Moreno, Fantasma Del Bajío
3) El Alacrán, El Comanche vs Saeta Chicana I, Saeta Chicana II
4) Anibal, Tino Herrera vs El Polaco, TNT

indie (SAT) 03/05/1977 Arena Nueva Atzacoalco, Gustavo A. Madero, Distrito Federal [KO 1239, RB]
1) Flama Azul  (c) b Tauro [MEX LIGHT]

indie (SAT) 03/05/1977 Arena Rio Blanco, Ciudad de México, Distrito Federal [KO 1238, RB]
1) Beto García vs El Gato
2) Vick Cruz vs Halcón Negro
3) Apolo Acosta, Pequeño Mariscal vs El Etíope, El Fraile
4) Mario Acosta, Tinieblas vs Canek, Chimuelo Sánchez

indie (SAT) 03/05/1977 Arena Zapata, Cuautla, Morelos [KO 1238, RB]
1) Soberbio III vs Ariman
2) Misterio Blanco I vs Juan Manuel
3) Cebra De Acapulco, Potro Salvaje vs Chacal De La Roa, Ruddy Vaquez
4) Anibal, El Rostro vs Ángel Asesino, El Tupamaro

indie (SAT) 03/05/1977 Deportivo Lopez Velarde, Venustiano Carranza, Distrito Federal [KO 1238, RB]
1) Galante vs Bestia Nazi
2) Cóndor Azul vs Samurai
3) Perro Sosa vs Peregrino
4) El Soberbio, Príncipe Odin vs Gran Popeye, Tony Arce
5) Ray Mndeoza, Villano I, Villano III vs Conde Azul, Fantastic, Huracán Ramírez

indie (SAT) 03/05/1977 Nueva Arena Apatlaco, Iztapalapa, Distrito Federal [Arena 968, RB]
1) El Solitario, Ultraman b Raúl Reyes, Tony Salazar

indie (SAT) 03/05/1977 Tláhuac, Distrito Federal [Halcon 247, KO 1238, RB]
1) Sandokan vs Mario Montl
2) Bello Adan vs Zaratustra
3) Danny Cruz vs Saeta Hernández
4) El Matematico, Javier Llanes vs el Signo, Enfermero Jr.
5) Dr. Wagner vs Astro Rey

Bonales (SUN) 03/06/1977 Plaza de Toros el Cortijo, Venustiano Carranza, Distrito Federal [Halcon 247, KO 1239, RB]
1) Saeta Hernández b Roberto El Bambino
2) Carnicerito b Tom Mix
3) Cóndor, Toluco b Apóstol, El Polaco
4) Fantastic, Tamba NM Villano I, Villano II [CORTIJO TAG, final]
## scheduled match canceled due to a Villano II car accident. Match is expected to be made up; Tamba & Fantastik may have been awarded the titles by default on this show.
5) Bello Greco, Sergio el Hermoso DQ Fantastic, Tamba
6) Patriarca b Rommel [mask]
## Rommel is Paulino Mar
&& Anniversary show

EMLL (SUN) 03/06/1977 Arena Coliseo [KO 1238, RB]
1) Gorilita Flores vs Irazú
2) Dardo Aguilar vs Tauro
3) Chino Chow, El Monarca vs Índio Vitela, Manuel Robles
4) El Faraón, Spirit vs Gemelo Diablo I, Gemelo Diablo II
5) Perro Aguayo vs Mano Negra

EMLL (SUN) 03/06/1977 Arena Coliseo Guadalajara [El Informador 1977-03-06, Halcon 248]
1) ? vs ??
2) ? vs ??
3) ? vs ??
4) Máscara Roja, Terremoto vs As Charro, Herodes
5) El Vengador b Sangre India [mask, hair]
6) Chavo Guerrero, El Halcón vs Gran Markus, Tony Salazar

EMLL (SUN) 03/06/1977 Pista Arena Revolución [KO 1238, RB]
1) Joe Marino vs Diogenes
2) Gran Davis vs Agente X
3) El Trueno vs Bufalo Salvaje
4) Alfa Centauris vs Rafael Salamanca
5) Flama Azul, Sergio Borrayo vs Karate Hayate, Kimura Sato
6) Bruno Victoria, Sangre Chicana vs El Cobarde, José Luis Mendieta

indie (SUN) 03/06/1977 Arena Aficion [KO 1238, RB]
1) el Signo, Villano I, Villano II vs Enfermero Jr., Rayo Dorado I, Rayo Dorado II

indie (SUN) 03/06/1977 Arena Azteca Budokan, Ciudad Nezahualcoyotl, Estado de México [KO 1238, RB]
1) Ziranuaco vs Memo Juarez
2) El Predicador vs El Jinete
3) El Criollo vs El Zorrillo
4) El Centinela, Electrón, Pequeño Gigante vs Argel, Arquero, Juanito Ramírez
5) Macario, Simitrio vs Bello Fontanelli, Tangaroa
6) Anibal, Joe Franco vs Mr. Cobra, Poder Griego

indie (SUN) 03/06/1977 Arena Azteca, Iztapalapa, Distrito Federal [KO 1238, RB]
1) Príncipe Águila vs Ángel Solitario I, Ángel Solitario II, Atomus, Fantasma Del Bajio, Halcón Celeste [ruleta de la muerte, mask]
2) El Alacrán vs Pepe Casas, Tony Vilichis, Fatasmon II, Rene Curiel, Bárbaro Fonseca, Benny Castello, Jimmy Cuevas, Chico Baeza, Príncipe Azteca [ruleta de la muerte, hair]

indie (SUN) 03/06/1977 Arena Coliseo Acapulco, Acapulco, Guerrero [KO 1240, RB]
1) El Extraño, Yanko b Aristos, Mario Valenzuela
2) El Centauro, Gurkan b Bowman, Ceballos
3) Lucifer b Ranger
## sets up an apuesta match
4) El Reo, Roy Reyes b Cachorro Mendoza, Cacique Maya

indie (SUN) 03/06/1977 Arena Ecatepec de Morelos, Ecatepec, Estado de México [KO 1238, RB]
1) Ricky Martinez vs Diablo Hernández
2) Gaston del Valle vs Aquaman
3) Trébol De Plata vs El Zodiaco
4) Kid Acero, Tigre Gomez vs El Salvaje, Zuanga [super libre]
5) Tino Herrera, Zaratustra vs El Maldito, Zeus

indie (SUN) 03/06/1977 Arena Lopez Mateos [KO 1238, RB]
1) Yorbik vs El Cardenal
2) El Padrino vs El Gitano, Dr. Misterio, Danny Boy, Tigre Negro, Romano García [battle royal]
## would've determined other matches on the card
3) Alberto Muñoz, Anibal vs Dick Angelo, El Emperador

indie (SUN) 03/06/1977 Arena Municipal, Ciudad Juárez, Chihuahua [KO 1240, RB]
1) Villela b Alex Reyna
2) Hermes b Sergio Palgar
3) Dorado Hernández, Serpiente Blanca b Mercenario I, Mercenario II
4) Impostor, Rudy Reyna, Vic Ramírez b Cid, Espectro Tapia, Luthor
5) Gacela, Índio Medina b Flama Roja, Judas Monterrosa

indie (SUN) 03/06/1977 Arena Raff, Ciudad Nezahualcóyotl, Estado de México [KO 1238, RB]
1) Rey America vs Rocco Valente
2) Trampas vs Cruz Blanca
3) Kalimaco, Tony Arce vs Ángel Negro, Ricky Roldán
4) Dr. Wagner, El Enfermero vs Agente X, Astro Rey

indie (SUN) 03/06/1977 Arena San Juan Pantitlan, Ciudad Nezahualcóyotl, Estado de México [KO 1238, KO 1239, RB]
1) Ariman b Soberbio III
2) Zorro Plateado II b La Zebra De Acapulco
3) Danny Cruz b Johnny García
4) El Rostro, Potro Salvaje b Chacal de la Rosa, Golden Boy
5) Anibal, Dr. Wagner b Coloso Colosetti, El Tupamaro

indie (SUN) 03/06/1977 Arena Toluca, Toluca, Estado de México [KO 1238, RB]
1) Baby Sharon, Rocambole vs Saeta China I, Saeta China II
2) Barba Negra, El Recio vs Javier Montes, Lancer

indie (SUN) 03/06/1977 Deportivo Venustiano Carranza, Venustiano Carranza, Distrito Federal [Arena 968, KO 1238, RB]
1) Luna Negra vs Mr. Bronce
2) Chucho Conde II vs ?
3) El Alacrán, El Delfin, El Tupamaro vs El Aposol, Saeta China I, Saeta China II
4) El Comanche, El Polaco, el Signo b Conde Azul, Fantastic, Negro Navarro

indie (SUN) 03/06/1977 Oaxaca, Oaxaca [KO 1238, RB]
1) Águila Azteca vs Tony Sugar
2) Lola González vs La Samuray
3) Reyes Oliva vs Bengala I
4) El Matematico vs Rudy Valentino
5) El Santo, Huracán Ramírez vs Herodes, Nahur Khalif

indie (SUN) 03/06/1977 Plaza de Toros La Aurora, Ciudad Nezahualcóyotl, Estado de México [KO 1238, RB]
1) El Maldito vs Mario Rocca
2) Mr. Steel vs Rodolfo Ruiz
3) Estrella Blanca, Tony López vs Huroki Sito, Leo López
4) Ciclón Veloz Jr., Ringo Mendoza vs Adorable Rubi, Karloff Lagarde

indy (SUN) 03/06/1977 Club Deportivo Rene Guajardo, Topo Chico, Nuevo Leon [Halcon 247]
1) Alberto Mora, La Pantera vs Johnny Fuenes, Romero Valdez
2) Kid Astro, Némesis vs Cavernario Galindo II, Señor Tormenta
3) Juan Gallardo vs Chato Martinez [hair]

indy (SUN) 03/06/1977 Plaza de Toros La Monumental, Monterrey, Nuevo León [https://www.facebook.com/96186896558/posts/10153580650726559 Box Y Lucha]
1) Felipe Ham Lee b The Monster [mask]
## This Monster was Jack Dillon

indy (SUN) 03/06/1977 Plaza de Toros Valente Arellano, Torreón, Coahuila [El Siglo de Torreon 1977-03-06]
1) Joe Maquina vs Tony Arellano
2) Centella Azul vs Índio Navajo
3) Kasak, La Sombra vs Espanto III, The King
4) Lupita Lara, Norma González vs Charito Silva, Toña La Tapatia
5) El Nazi, Pelón Águilar vs Tigre Del Ring I, Tigre Del Ring II

Moreno (SUN) 03/06/1977 Arena KO Algusto, Naucalpan, Estado de México [KO 1238, RB]
1) El Griego vs Kronos
2) Mr. Bronce vs Juan Guerrero
3) Leopardo Negro vs Centella Nolasco
4) Estrella del Sur, Ráfaga Moreno vs El Destroyer, El Exorcista
5) El Rostro, Huracán Ramírez, Javier Llanes vs Coloso Colosetti, El Tupamaro, Negro Navarro
&& magazine doesn't specifically say this is Arena KO but seems to be

indy (MON) 03/07/1977 Tampico, Tamaulipas [Halcon 237]
1) Anibal, José Torres vs Asesino Negro, Canek
2) Tigre Del Ring I, Tigre Del Ring II vs Alejandro Montano, Brazo de Oro

EMLL (TUE) 03/08/1977 Arena Coliseo Guadalajara [El Informador 1977-03-08]
1) ? vs ??
2) ? vs ??
3) ? vs ??
4) Karina, Pantera Suriana vs Estela Molina, La Viuda Negra
5) Chavo Guerrero, El Halcón, Máscara Roja vs As Charro, Gran Markus, Tony Salazar

indie (TUE) 03/08/1977 Arena Nueva Atzacoalco, Gustavo A. Madero, Distrito Federal [KO 1239, RB]
1) Bufalo Salvaje b Trueno
2) ? Stevens b Rafael Salamanca
3) Chino Chow, Tony López b El Reo, Rizado Ruiz
4) Alfonso Dantes, El Faraón b Blue Demon, El Faraón ?
## El Faraon listed on both sides of the match
&& claimed sellout

Mora (TUE) 03/08/1977 Arena Aficion [Halcon 248]
1) Dr. Wagner vs Ángel Blanco [trofeo]

Mora (TUE) 03/08/1977 Gimnasio Municipal Lic. Benito Juárez, Cuautitlán, Estado de México [Combates 74, Halcon 248]
1) El Húngaro  (c) b Lasser [EDM LIGHT]
2) Rokambole  (c) b Zebra Kid [Toluca WELTER]
3) Coloso Colosetti vs Dr. Wagner
&& Combates lists different title matches

Mora (TUE) 03/08/1977 Unidad Deportiva de Acapulco, Acapulco, Guerrero [Halcon 248]
1) Lucio Risas b Arturo Cruz
2) Reyes Oliva b Zorro
3) Fili Estrella, Gulliver b Gaby Da Silva, Gran Nikolai
4) Cesar Valentino, Sunny War Cloud, TNT b Anibal, José Torres, Ultraman

EMLL (WED) 03/09/1977 Arena Coliseo Acapulco, Acapulco, Guerrero [Halcon 247]
1) Chanoc b El Hércules
2) Cachorro Mendoza, Lizmark b Karate Hayato, Kimura Sato
3) Chavo Guerrero, El Santo b Alfonso Dantes, Rubí Ruvalcaba
4) Rodolfo Ruiz b Yanco [hair]
5) Mano Negra  (c) b Perro Aguayo [NWA WELTER]
## said to be Aguayo's second challenge

indie (WED) 03/09/1977 Arena Apatlaco, Iztapalapa, Distrito Federal [KO 1239, RB]
1) El Polaco, TNT b Anibal, Tino Herrera
2) Angelo Alacrán, Comanche b Apolo Chino, Pepe Casas
3) Atomus, Mr. Misterio b Ciclón Moreno, Fantasma Del Bajio
4) Tony Ledesma b Conde Murciélago

indie (WED) 03/09/1977 Atoyac de Álvarez, Guerrero [KO 1240, RB]
1) Gaby Da Silva, Gran Nikolai b Fili Estrella, Gulliver
&& sold out

indie (THU) 03/10/1977 Arena Toluca, Toluca, Estado de México [Halcon 248, KO 1240, RB]
1) Apóstol b El Veterinario
2) Baby Sharon b El Polaco
3) El Rostro, Johnny Lezcano, Tino Herrera b Bello Greco, El Vikingo, Sarabia
4) Gran Hamada b Ángel Blanco [money]
## 5000 pesos purse

indy (THU) 03/10/1977 Arena KO Algusto, Naucalpan, Estado de México [Combates 74]
1) Enfermero Jr., Rayo Dorado I, Rayo Dorado II vs el Signo, Villano I, Villano II

indy (THU) 03/10/1977 Auditorio, Ciudad Juárez, Chihuahua [luchablog photolog (2013-09-17 18.28.15)]
1) La Gacela b Flama Roja
2) Tony Reyna, Trovador b El Cid, Espectro
3) Serpiente Blanca, Vick Ramírez b Bestia, Luthor
4) Hermes b Dorado Hernández

indy (THU) 03/10/1977 Chilpancingo, Guerrero [Halcon 248]
1) El Centauro  (c) b Lizmark [GUERRERO MIDDLE]

EMLL (FRI) 03/11/1977 Arena México [Halcon 248, KO 1239, http://wrestlingclassics.com/cgi-bin/.ubbcgi/ultimatebb.cgi?ubb=get_topic&f=10&t=004694#000000 Matt Farmer, RB]
1) El Monarca TLDRAW Manuel Robles
## 15 minute draw
2) Mano Negra, Raúl Mata DQ Karloff Lagarde, Tony Salazar
3) Alfonso Dantes, Gran Markus b El Halcón, Ringo Mendoza
4) Chavo Guerrero  (c) b Rubí Ruvalcaba [NWA LH]
## Chavo won (1/3) but magazine thought Rubi dominated.
5) Gemelo Diablo I b Carlos Plata [hair]
## Gemelo took 2/3
6) Perro Aguayo b El Faraón  (c) [NWA MIDDLE]
## Aguayo takes 2/3 to win the title. Aguayo, already national champion, becomes world champion.
&& full house

indie (FRI) 03/11/1977 Arena Tuxtla, Tuxtla Gutiérrez, Chiapas [KO 1239, RB]
1) El Vikingo, Renato Torres vs Solar I, Tony Cabral
2) El Zarco, Príncipe Astral vs Dr. Kiro, El Cometa
3) Lolita González vs Rocio Urbina

indie (FRI) 03/11/1977 Ciudad Madero, Tamaulipas [KO 1240, RB]
1) Bengala I vs Furia
## magazine clears up Furia did not risk his mask twice, this was just a mano a mano

indie (FRI) 03/11/1977 Gimnasio Lazaro Cardenas, Salamanca, Guanajuato [KO 1240, RB]
1) Arturo Gaona b Chale Armenta
2) Hércules León b El Americano
3) Tamba b Cienfuegos
4) El Rostro, Octavio Gaona b Dick Angelo, El Rebelde

indy (FRI) 03/11/1977 Arena Zapotitlan, Tláhuac, Distrito Federal [KO 1239, RB]
1) Atomus vs Cometa Azul I
2) Príncipe Águila vs Tony Ledezma
3) Chacal de la Rosa, Príncipe Odin vs El Cóndor, Fantasma de la Opera
4) Conde Azul, Johnny Lezcano vs Mario el Exotico, Orfeo Negro
5) Alberto Muñoz, Anibal vs Dick Angelo, Scorpió

Moreno (FRI) 03/11/1977 Arena Azteca Budokan, Ciudad Nezahualcoyotl, Estado de México [KO 1239, RB]
1) The Black vs Escarlata
2) Black Dragón vs Chamaco Perez
3) Halcón Suriano, Ray Cruz vs Tigre De Guanajuato, Zorrillo
4) Halcón Dorado I, Halcón Dorado II vs Muerte De La Barranca I, Muerte De La Barranca II

EMLL (SAT) 03/12/1977 Pista Arena Revolución [KO 1239, RB]
1) Doberman vs El Maldito
2) Joe Marino vs Irazú
3) Halcón Dorado II vs Roy Steve
4) Satánico vs Rafael Salamanca
## return of Satanico
5) Flama Azul vs Huroki Sito
6) Cachorro Mendoza, Estrella Blanca vs Rizado Ruiz, Rodolfo Ruiz
7) Blue Demon, Ciclón Veloz Jr. vs Bruno Victoria, Sangre Chicana

indie (SAT) 03/12/1977 Arena Apatlaco, Iztapalapa, Distrito Federal [KO 1239, KO 1240, RB]
1) Ciclón Moreno vs Fantasma Del Bajio
2) Apolo Chino I, Apolo Chino II vs Benny Castello, El Comanche
3) Alberto Muñoz, Tony Sugar b Villano I, Villano III [semifinal]
4) Canek, El Rebelde b Bárbaro Fonseca, El Polaco []
5) Alberto Muñoz, Tony Sugar b Canek, El Rebelde [final]

indie (SAT) 03/12/1977 Arena Nueva Atzacoalco, Gustavo A. Madero, Distrito Federal [KO 1239, RB]
1) Saeta Azul vs Gran Davis
2) Alfa Centauris vs Chamaco Ortiz
3) Chino Chow, Mendieta Jr. vs El Nazi, Índio Pinto
4) Carlos Plata, El Halcón vs Alfonso Dantes, Gran Markus

indie (SAT) 03/12/1977 Deportivo Lopez Velarde, Venustiano Carranza, Distrito Federal [KO 1239, RB]
1) Ancla vs Látigo
2) Conde Azul vs Destructor Nazi
3) Bronce vs Peregrino
4) Chacal de la Rosa, Negro Navarro vs Chucho Conde II, Genaro Contreras
5) Conde Azul, Fantastic, Popeye vs Odin, Polaco, Soberbio I

indie (SAT) 03/12/1977 Río Blanco, Veracruz [KO 1239, RB]
1) Vick Cruz vs El Gato
2) Buitre Asesino, Fraile Azul vs Pequeño Mariscal, Ray Jimenez
3) Apolo Acosta vs Etíope [hair, VERACRUZ MIDDLE]
## Acosta's hair vs Etiope's title
4) Marinero Acosta, Zaratustra vs Chimuelo Sanchez, Zebra Kid

Indy (SAT) 03/12/1977 Arena Nueva Atzacoalco, Gustavo A. Madero, Distrito Federal [KO 1239, RB]
1) Saeta Azteca vs Gran Davis
2) Chamaco Ortiz vs Alfa Centauris
3) Chino Chow, José Luis Mendieta vs El Nazi, Índio Pinto
4) Carlos Plata, El Halcón vs Alfonso Dantes, Gran Markus

indy (SAT) 03/12/1977 Arena Puebla [luchablog photolog (2013-09-17 18.27.21)]
1) Dr. O’Borman, Ruby b Ringo Mendoza, Spirit
2) Chavo Guerrero, El Faraón, El Santo DRAW Gemelo Diablo I, Gemelo Diablo II, Perro Aguayo

Indy (SAT) 03/12/1977 Arena Zapata, Cuautla, Morelos [KO 1239, RB]
1) Sergio Aragaon vs Socio I
2) Zebra Kidd vs Misterio Blanco I
3) Destino Negro, El Tupamaro vs Johnny García, Postro Salvaje
4) Anibal, El Rostro vs Ángel Asesino, Astro Rey

indy (SAT) 03/12/1977 Nueva Arena Apatlaco, Iztapalapa, Distrito Federal [Arena 698, Halcon 248, KO 1239, RB]
1) Filli Guerrero vs Gran Davis
2) Baby Sharon vs Bengala II
3) Barba Negra, Fiera Vilchis vs Bengala I, Impacto
4) Dr. Wagner, Kung Fu, Ultraman vs Raúl Reyes, Sugi Sito, Tony Sugar
&& Raul Reyes is the  promoter here

indy (SAT) 03/12/1977 Orizaba, Veracruz [Halcon 248]
1) El Etíope b Apolo Acosta  (c) [ORIZABA MIDDLE]

Mora (SAT) 03/12/1977 Tláhuac, Distrito Federal [Comabte 73, KO 1240, RB]
1) Sandokan b Jorge Ortiz
2) El Patriarca, Tlahuicole b Apóstol, Bello Adan
3) El Vagabundo, Javier Llanes b Danny Cruz, Enfermero Jr.
4) el Signo  (c) b El Matematico [UWA LIGHT]

EMLL (SUN) 03/13/1977 Arena Coliseo [https://i.imgur.com/3yxIc6r.png KO 1239, RB, http://superluchas.com/2015/03/13/en-un-dia-como-hoy-1977-gran-markus-campeon-nacional-de-peso-completo-santo-y-solitario-en-el-toreo/ SuperLuchas]
1) Bufalo Salvaje vs Impacto
2) Tony López vs Chino Chow, Sergio Borrayo, Dardo Aguilar, Halcón Dorado I, El Nazi, El Reo, Índio Vitela, Leo López, Alfa Centauris [battle royal]
3) El Cobarde, El Faraón, Spirit b Gemelo Diablo I, Gemelo Diablo II, Raúl Reyes

EMLL (SUN) 03/13/1977 Arena Coliseo Guadalajara [KO 1240, RB, http://superluchas.com/2015/03/13/en-un-dia-como-hoy-1977-gran-markus-campeon-nacional-de-peso-completo-santo-y-solitario-en-el-toreo/ SuperLuchas]
1) Monje Loco b Tigre Del Ring II
2) Tigre Del Ring I b Mr. Niebla
3) Cinta Negra, Ídolo b Águila India, Gran Cochisse
4) Chavo Guerrero, Máscara Roja b Alfonso Dantes, As Charro
5) Gran Markus b El Halcón  (c) [MEX HEAVY]
## title change!

EMLL (SUN) 03/13/1977 Pista Arena Revolución [KO 1239, RB, http://superluchas.com/2015/03/13/en-un-dia-como-hoy-1977-gran-markus-campeon-nacional-de-peso-completo-santo-y-solitario-en-el-toreo/ SuperLuchas]
1) Diogenes vs Mario Rocca
2) Saeta Azteca vs Gran Davis
3) Mr. Steel vs Halcón Dorado II
4) Chamaco Ortiz vs Dr. O’Borman
5) Cacique Mara, El Monarca vs Índio Pinto, Manuel Robles
6) Adorable Rubi, Karloff Lagarde b José Luis Mendieta, Mano Negra

indie (SUN) 03/13/1977 Arena Azteca Budokan, Ciudad Nezahualcoyotl, Estado de México [KO 1239, RB]
1) Magia Negra vs Pequeño Gigante, Tony Ledezma, Atomus, Tigre De Guanajuato, Luxman, El Zarco, Ellcaro, El Predicador, Saul Montaña, Sombra Escarlata, Caballero Escarlata, Argel, Electrón
2) Macario, Simintrio vs Bello Fontanelly, Tangaroa

indie (SUN) 03/13/1977 Arena Ecatepec de Morelos, Ecatepec, Estado de México [KO 1240, RB]
1) Bulldog Ramírez b Manny Rosales
2) Ricky Martinez b Diablo Hernández
3) Zodiaco b Aquaman
4) Lancero I, Lancero II, Trébol De Plata b El Salvaje, Makabro Rojo, Zuanga
5) Agente X, Dardo Aguilar b Nómada, Zeus
&& sold out

indie (SUN) 03/13/1977 Arena Lopez Mateos [KO 1239, RB]
1) Tigre Negro vs El Magn
2) El Gitano, Saeta Imperial vs Bello Adan, Rey Alfredo
3) Johnny Lezcano, Terry Bolaños vs El Emperador, Pepe Luna
4) Anibal, El Padrino vs Dick Angelo, Dr. Misterio

indie (SUN) 03/13/1977 Arena Raff, Ciudad Nezahualcóyotl, Estado de México [KO 1239, KO 1240, RB]
1) Príncipe I b Tino González
2) Lucifer b Relámpago Negro I
3) Rudy Espinoza b Polar
4) Kalimaco, Tony Arce b Ángel Negro, Ricky Roldan
## a revancha from previous week
5) Averno (Laguna), José Torres b Danny Cruz, El Maldito

indie (SUN) 03/13/1977 Arena San Juan Pantitlan, Ciudad Nezahualcóyotl, Estado de México [KO 1240, RB]
1) Chacal I b Sergio Aragon
2) Dinámico b Ariman
3) Misterio Blanco I b Cebra
4) Potro Salvaje, Ráfaga Moreno b Danny Cruz, Destino Negro
5) Beto Munoz, El Socio, José Torres b Astro Rey, El Tupamaro, Golden Boy
&& sold out

indie (SUN) 03/13/1977 Arena Venustiano Carranza, Venustiano Carranza, Distrito Federal [KO 1240, RB]
1) Mr. Bronce b Luna Negra
2) Conde II b Enrique Hernández
3) Chucho Conde b Peregrino
4) Alacrán, Delfin, El Tupamaro b Apóstol, Saeta China I, Saeta China II
5) Barba Negra, El Polaco, el Signo b Conde Azul, Fantastic, Negro Navarro

indie (SUN) 03/13/1977 Deportivo Lopez Velarde, Venustiano Carranza, Distrito Federal [KO 1239, RB]
1) Chacal de la Rosa vs Peregrino
2) Rocambole vs Tony Arce
3) Saeta China I, Saeta China II vs Alacrán, Odin
4) Conde Azul, Fantastic, Negro Navarro vs Delfin, el Signo, El Tupamaro

indie (SUN) 03/13/1977 Ticoman, Gustavo A. Madero, Distrito Federal [KO 1239, KO 1240, RB]
1) Rocco Valente vs Terror
2) Drake vs El Trampas
3) Bello Fontanelly, Genio Negro vs Inhumano I, Ruddy Onfro Rivera
4) Doberman, Joe Marino vs Rayo Dorado I, Rayo Dorado II
5) Rayo Dorado I, Rayo Dorado II b Doberman, Joe Marino
## Marino turned on Doberman, who is said to be leaving for a 6 month tour of Puerto Rico

Indy (SUN) 03/13/1977 Arena Aficion [KO 1239, RB]
1) Puño De Rocca vs Freddy Perez
2) Alman Negra II, Mr. Crimen vs Tiburón I, Tiburón II
3) Sugi Sito, Troglodita Flores vs El Carnicero, Zaratrusta
4) el Signo, El Vikingo vs ?, El Vagabundo

indy (SUN) 03/13/1977 Arena Azteca, Iztapalapa, Distrito Federal [KO 1239, RB, http://superluchas.com/2015/03/13/en-un-dia-como-hoy-1977-gran-markus-campeon-nacional-de-peso-completo-santo-y-solitario-en-el-toreo/ SuperLuchas]
2) Saeta Del Ring vs Halcón Celeste
3) Fantasma Del Bajio vs Ciclón Moreno
4) Bárbaro Fonseca, Benny Castello vs Ángel Solitario II, Tony Vazquez
5) El Polaco, Golden Boy vs Chico Baeza, Príncipe Azteca
6) Tony Vilchis  (c) b El Fantasmón II [DF MIDDLE]

indy (SUN) 03/13/1977 Arena Coliseo Acapulco, Acapulco, Guerrero [luchablog photolog (2013-09-17 18.27.38), http://superluchas.com/2015/03/13/en-un-dia-como-hoy-1977-gran-markus-campeon-nacional-de-peso-completo-santo-y-solitario-en-el-toreo/ SuperLuchas]
1) El Guerrero b El Norteño
2) El Galeonero, Yanco DQ Aristos, Braulio Mendoza
3) Rizado Ruiz, Sangre Chicana b El Extraño, Juan Ceballos
4) Lizmark, The Bowman b El Centauro, Gurkhan [ACAPULCO TAG]
5) The Ranger b Lucifer [hair]

Indy (SUN) 03/13/1977 Arena Isabel, Cuernavaca, Morelos [KO 1239, RB]
1) Argos vs Búfalo Negro, Príncipe II, Relámpago Negro II, Chico Sanchez

indy (SUN) 03/13/1977 Arena Puebla [luchablog photolog (2013-09-17 18.27.28), http://superluchas.com/2015/03/13/en-un-dia-como-hoy-1977-gran-markus-campeon-nacional-de-peso-completo-santo-y-solitario-en-el-toreo/ SuperLuchas]
1) El Suriano b Porthos [hair]
## local wrestler lost (unclear which is the local)
2) Cachorro Mendoza, Estrella Blanca b Rizado Ruiz, Tauro

indy (SUN) 03/13/1977 Auditorio, Ciudad Juárez, Chihuahua [http://superluchas.com/2015/03/13/en-un-dia-como-hoy-1977-gran-markus-campeon-nacional-de-peso-completo-santo-y-solitario-en-el-toreo/ SuperLuchas]
1) Flama Roja b La Gacela [hair]
## Roja's mask vs Gacela's hair. Gacela is the future Black Man

indy (SUN) 03/13/1977 LA Sports Arena, Los Angeles, California [Comabte 73, Halcon 247, http://superluchas.com/2015/03/13/en-un-dia-como-hoy-1977-gran-markus-campeon-nacional-de-peso-completo-santo-y-solitario-en-el-toreo/ SuperLuchas]Attendance: 6000
1) Mando López, Saeta Alonso b Nahur Kaliff., Rasputín
## Mando Lopez is the short term Super Star from Mexico City
2) Huracán Ramírez, Ultraman DQ Cesar Valentino, Sunny War Cloud
## Ultraman replaced Tinieblas. Cesar Valentino replaced Coloso Colosetti

indy (SUN) 03/13/1977 Plaza de Toros el Cortijo, Venustiano Carranza, Distrito Federal [KO 12239, http://superluchas.com/2015/03/13/en-un-dia-como-hoy-1977-gran-markus-campeon-nacional-de-peso-completo-santo-y-solitario-en-el-toreo/ SuperLuchas]
1) Panama Panther b El Toluco
## Panama Panther replaced Destino Negro
2) El Cóndor DRAW Hombre Nuclear
3) El Alacrán, El Delfin b El Patriarca, Tino Herrera
## This match and the two prior were set by seeding battle royal
4) Fantastic, Tamba vs Astro Rey, Golden Boy
## Bello Greco y Sergio el Hermoso were supposed to be facing Fantastic & Tamba, but replaced by Golden Boy & Astro Rey

Indy (SUN) 03/13/1977 Plaza de Toros La Aurora, Ciudad Nezahualcóyotl, Estado de México [KO 1239, RB]
1) Gorilita Flores vs Irzu
2) El Nómada vs Agente X
3) Flama Azul, Rafael Salamanca vs Roy Steve, Satánico
4) Ciclón Veloz Jr., Ringo Mendoza vs Bruno Victoria, Tony Salazar

indy (SUN) 03/13/1977 Plaza de Toros Valente Arellano, Torreón, Coahuila [El Siglo de Torreon 1977-03-13]
1) Centella Azul vs Guapo Ibarra
2) Ciclón Negro vs Tony Arellano
3) Kasak, Mario Saucedo vs Eric el Rojo, Índio Navajo
4) La Sombra, Temoc Torres vs Espanto II, The King
5) Luis Vera, Soldier Blue vs Frankenstein Jr., Star Águilar

indy (SUN) 03/13/1977 Tampico, Tamaulipas [Halcon 248]
1) El Matematico, Solar I vs Tigre Del Ring I, Tigre Del Ring II
2) Anibal, José Torres vs Canek, Frankenstein

Moreno (SUN) 03/13/1977 Arena KO Algusto, Naucalpan, Estado de México [KO 1239, RB]
1) El Griego b Mr. Bronce
2) Juan Guerrero b Kuromeco
3) Centella Nolazco b Bulldog Morgan
4) Centella Nolasco, Ráfaga Moreno b El Exorcista, El Extraño
5) Alberto Muñoz, El Rostro, Javier Llane b Destroyer, El Tupamaro, Negro Navarro

PRONESA (SUN) 03/13/1977 Toreo de Cuatro Caminos, Naucalpan, Estado de México [KO 1239, KO 1240, RB, http://superluchas.com/2015/03/13/en-un-dia-como-hoy-1977-gran-markus-campeon-nacional-de-peso-completo-santo-y-solitario-en-el-toreo/ SuperLuchas]
1) Barba Negra b Tony Sugar
2) Raúl Guerrero b Genaro Contreras
3) Bengala I, Bengala II, El Matematico b Lobo Rubio, Reyes Olivia, Rudy Valentino
4) Dos Caras, El Rostro b Príncipe Rebelde, Renato Torres
5) El Santo, El Solitario DQ El Vikingo, Scorpió

Carballo (MON) 03/14/1977 Arena Tropicana, Tehuacán, Puebla [KO 1239, RB]
1) Fantasma De La Cruz vs Chamaco Olmos
2) Emperador vs Fraile Azul
3) Apolo Acosta, Marinero Acosta vs Cerebro, Pantera Negra
4) Kung Fu, Zaratustra vs Cebra Kid, El Húngaro

EMLL (TUE) 03/15/1977 Arena Coliseo [@therealfredo, Box Y Lucha 1275]
1) El Maldito b Mario Rocca
2) Aristarco b Joe Marino
3) El Nómada b El Trueno
4) Chamaco Ortiz, Saeta Azteca DRAW Dr. O’Borman, Rodolfo Ruiz
## double pin
5) El Reo, Leo López b El Monarca, Flama Azul
6) El Cobarde, Ringo Mendoza b Raúl Reyes, Sangre Chicana
## Reyes and Chicana had problems, Reyes going tecnico.

EMLL (TUE) 03/15/1977 Arena Coliseo Guadalajara [El Informador 1977-03-15]
1) ? vs ??
2) ? vs ??
3) ? vs ??
4) Marco Alcala, Mario Alcala vs Calavera I, Calavera II
5) El Halcón, El Vengador, Máscara Roja vs Alfonso Dantes, As Charro, Gran Markus

indie (TUE) 03/15/1977 Arena Nueva Atzacoalco, Gustavo A. Madero, Distrito Federal [KO 1240, RB]
1) Cacique Mara, Chino Chow b El Nazi, Rizado Ruiz
2) Satánico b Steel
3) Mano Negra, Mil Máscaras b Gemelo Diablo I, Gemelo Diablo II
&& sellout, fans left waiting outside

indie (TUE) 03/15/1977 Tulancingo, Hidalgo [KO 1240, RB]
1) Estrella Blanca b Huroki Sito
## Estrella Blanca earns shot at Flama Azul for title following week

Perez-Aldana (TUE) 03/15/1977 Arena Raff, Ciudad Nezahualcóyotl, Estado de México [KO 1239, RB]
1) Relámpago Negro b Fantasmita Roja
2) Rocco Valente b Rey America
3) Cruz Blanca b El Trampas
## rematch
4) Kalimaco, Tony Arce b Ángel Negro, Ricky Roldan
5) Astro Rey, El Enfermero DQ Agente X, Dr. Wagner
&& date is a guess

indie (THU) 03/17/1977 Arena Toluca, Toluca, Estado de México [KO 1240, RB]
1) Dr. Wagner, Gran Hamada vs Ángel Blanco, Monster

indie (THU) 03/17/1977 Celaya, Guanajuato [KO 1240, RB]
1) Bengala I, Bengala II vs Barba Negra, Príncipe Rebelde

indie (THU) 03/17/1977 Xalapa, Veracruz [KO 1240, RB]
1) Anibal, El Rostro vs Dick Angelo, Siberiano

EMLL (FRI) 03/18/1977 Arena México [@therealfredo, luchablog photolog (2013-09-17 18.28.33), http://wrestlingclassics.com/cgi-bin/.ubbcgi/ultimatebb.cgi?ubb=get_topic&f=10&t=004694#000000 Matt Farmer]
1) Apolo Casillas b Invasor
2) Cachorro Mendoza DQ Manuel Robles
3) Bruno Victoria, Sangre Chicana DRAW Beto Veloz, Carlos Plata
4) Blue Demon, Mano Negra, Raúl Mata b Fishman, Gemelo Diablo I, Gemelo Diablo II
5) Alfonso Dantes, Gran Markus DQ El Faraón, Mil Máscaras
## Markus faked a foul from Mil.
&& day may be off a week.

indie (FRI) 03/18/1977 Arena Zapotitlan, Tláhuac, Distrito Federal [KO 1240, RB]
1) Ángel Solitario II, Fantastic vs Alacrán, Fantasma de la Opera
2) Conde Azul, Johnny Lezcano vs Hermano Orfeo Negro I, Hermano Orfeo Negro II
3) Anibal, Dr. Wagner vs El Polaco, Scorpió

indie (FRI) 03/18/1977 Gimnasio Lazaro Cardenas, Salamanca, Guanajuato [KO 1240, RB]
1) Mario Rubio vs Ángel Solitario
2) Hércules León vs Ciclón Mexicano
3) Enigma vs Espectro
4) Dos Caras, Octavio Gaona vs Dick Angelo, El Rebelde

indie (SAT) 03/19/1977 Arena Apatlaco, Iztapalapa, Distrito Federal [KO 1240, RB]
1) Ciclón Sanchez vs Juanito Ramírez
2) Fantasma Del Bajio vs Halcón Celeste
3) Johnny Lezcano, Tamba vs Bárbaro Fonseca, Benny Castello
4) ? vs Soberbio, TNT, Villano III

indie (SAT) 03/19/1977 Arena Nueva Atzacoalco, Gustavo A. Madero, Distrito Federal [KO 1240, RB]
1) Aristarco vs Bufalo Salvaje
2) Rafael Salamanca vs Tony López
3) As Charro, Tony Salazar vs Carlos Plata, El Socio
4) El Halcón vs Alfonso Dantes

indie (SAT) 03/19/1977 Arena Zapata, Cuautla, Morelos [KO 1240, RB]
1) Sergio Aragon vs Ariman
2) Estrella del Sur vs Amenaza Negra
3) Misterio Blanco I, Misterio Blanco II vs Soberbio III, Zebra Kid
4) Johnny García, José Torres vs El Apóstol, Negro Navarro

indie (SAT) 03/19/1977 Tláhuac, Distrito Federal [KO 1240, RB]
1) Centinela vs Saeta Roja
2) Arturo Gaona vs Apóstol
3) Bello Adan, Danny Cruz vs El Patriarca, El Vagabundo
4) Anibal, Solar I vs el Signo, Enfermero Jr.

Indy (SAT) 03/19/1977 Arena Yoli Ramirez, Guadalajara, Jalisco
1) El Escudero vs El Hawaiano
2) Raúl Armas vs Pancho Ramírez
3) Asesino Negro, Monje Loco vs Hermano Alcala I, Marco Alcala
4) Américo Rocca, Perro Aguayo vs Cesar Curiel, El Vengador

indy (SAT) 03/19/1977 Cancún, Quintana Roo [Halcon 248]
1) Chabela Romero vs Irma González [MEX WOMEN]

indy (SAT) 03/19/1977 Orizaba, Veracruz [Halcon 250]
1) Apolo Acosta b El Etíope [Veracruz MIDDLE]

Gordoa (SUN) 03/20/1977 Arena Azteca, Iztapalapa, Distrito Federal [KO 1240, RB]
1) Halcón Celeste vs Tony Ledesma
2) Atomus vs Fantasma Del Bajio
3) Ángel Solitario I, Saeta Del Ring vs Electrón, Rolling
4) Ángel Solitario II, Tony Vazquez vs Castello, Fonseca
5) Chico Baeza vs El Polaco [hair]

indie (SUN) 03/20/1977 Arena Ecatepec de Morelos, Ecatepec, Estado de México [KO 1240, RB]
1) El Salvaje, Zunaga vs Diablo Hernández, Húngaro and Capitán Galaxia, Ricky Martinez and Manny Rosales, Satán Verde and Bulldog Ramírez, Gaston del Valle and Lancero I, Lancero II [ECATEPEC TAG, #1 Contenders, torneo]
2) Anibal vs Tigre Gomez

indie (SUN) 03/20/1977 Arena Lopez Mateos [KO 1240, RB]
1) Rocco vs Tormenta Negra
2) Tigre Negro vs Tony Ramírez
3) Birdman, Magno vs Bello Adan, Romano García
4) El Gitano, Pedro Lancer, Saeta Imperial vs Cadáver II, Chacal de la Rosa, Conde Murciélago I
5) Johnny Lezcano, Terry Bolaños vs Ángel Blanco, Dr. Misterio
&& date is a guess

indie (SUN) 03/20/1977 Arena Raff, Ciudad Nezahualcóyotl, Estado de México [KO 1240, RB]
1) Tony Arce vs Ricky Roldan [hair]
2) José Torres vs Danny Cruz

indie (SUN) 03/20/1977 Arena San Juan Pantitlan, Ciudad Nezahualcóyotl, Estado de México [KO 1240, RB]
1) Chacal II vs Amenaza Negra
2) Ariman vs Sergio Aragon
3) Carnicerito, Cebra vs Dinámico, Soberbio III
4) Estrella del Sur, Misterio Blanco I, Misterio Blanco II vs Apóstol, Comanche, Negro Navarro
5) Johnny García, Potro Salvaje vs Astro Rey, Danny Cruz

indie (SUN) 03/20/1977 Arena Venustiano Carranza, Venustiano Carranza, Distrito Federal [KO 1240, RB]
1) Ciclón Moreno vs Príncipe Águila
2) Anibal, Kung Fu vs Barba Negra, Villano I
&& not the Plaza De Toros El Cortijo

indie (SUN) 03/20/1977 Plaza de Toros el Cortijo, Venustiano Carranza, Distrito Federal [KO 1240, RB]
1) Lalo Castell vs Soberbio
2) Satán vs Rommel
3) Alacrán, Delfin II vs El Cóndor, El Toluco
4) Astro Rey, El Delfin, Tino Herrera vs El Patriarca, Fantastic, Tamba

indy (SUN) 03/20/1977 Arena Estadio, Veracruz, Veracruz
1) Astro Nuclear, Flecha Veloz, Vengador b El Buitre, El Pecador, Guapo Infernal
## win via mask pull
2) Conde Bruma, El Cíclope b El Profeta, José Romero
3) El Duende, Zodiac b Ángel Azul, Juan El Desalmado
4) El Montañez b Chamaco Hernández

indy (SUN) 03/20/1977 Arena Jalisco, Guadalajara, Jalisco [luchablog photolog (2013-09-17 18.28.04), luchablog photolog (2013-09-17 18.28.04)]
1) Indian Black b Deserator
2) Serpiente Blanca b Diabólico Rojo
3) Drácula, Masacre b Leopardo, Marco Polo
4) El Paladin b Red Power
## set up a mask/hair match for 03/27
5) Argentino, Frankenstein, Satargo b Astro Negro, Black Terry, Centella Verde

indy (SUN) 03/20/1977 Arena Toluca, Toluca, Estado de México [Halcon 250]
1) Bronco b Aaron Canales [hair]

indy (SUN) 03/20/1977 Gimnasio Nacional Teodoro Palacio Flores, Guatemala City, Guatemala [Combates 73, Halcon 248]
1) Ray Mendoza  (c) b Leonel Rivas [UWA LH]
## Rivas replaced Edgar Echeverria, who earned a shot but hurt a knee in a lead up match with Mendoza

indy (SUN) 03/20/1977 Guadalajara, Jalisco [luchablog photolog (2013-09-17 18.27.59)]
1) El Fantasma, Hawaiano b ?, El Nómada
2) El Ídolo b Calavera I
3) El Cobarde, Terremoto b Steve, Tony Salazar
4) Mano Negra, Ringo Mendoza DRAW Perro Aguayo, Ruby Ruvalcaba
&& arena unspecified

indy (SUN) 03/20/1977 Plaza de Toros Valente Arellano, Torreón, Coahuila [El Siglo de Torreon 1977-03-20]
1) Ciclón Negro vs Guapo Ibarra
2) Centella Azul vs Tony Arellano
3) Mario Saucedo vs Eric el Rojo
4) Kasak, La Sombra vs Aramis, The King
5) Eduardo De Linch, Shibata vs Li-Chang, Star Águilar

MORA (SUN) 03/20/1977 Arena Aficion [Halcon 250]
1) el Signo  (c) DRAW Solar I [UWA LIGHT]

MORA (SUN) 03/20/1977 Toreo de Cuatro Caminos, Naucalpan, Estado de México [https://www.facebook.com/photo.php?fbid=4473252532744701&set=pb.100001799954940.-2207520000..&type=3 Arturo Gaona Jr.]
1) Arturo Gaona vs Ciclón Mexicano
2) Arturo Cruz vs Miguel Chamorro
3) Bengala I, Bengala II, Kung Fu vs Barba Negra, Príncipe Rebelde, Rudy Valentino
4) Renato Torres, Scorpió vs Alberto Muñoz, Dos Caras
5) Dr. Wagner, El Solitario vs Coloso Colosetti, El Vikingo

Moreno (SUN) 03/20/1977 Arena KO Algusto, Naucalpan, Estado de México [KO 1240, RB]
1) Mr. Bueno vs Tony Arce
2) Mario Correa vs Kuroneko
3) Centella Nolasco, Maravilla Perez vs Kalimaco, Leopardo Negro
4) El Extraño, Ruben Palma vs Bulldog Morgan, Negro Navarro
5) Javier Llanes vs El Destroyer [hair, mask]
## Llanes hair versus Destroyer's mask

Duarte (MON) 03/21/1977 Tampico, Tamaulipas [KO 1240, RB]
1) El Vagabundo, Solar I vs Tiger Del Ring I, Tiger Del Ring II
2) Anibal, El Matematico vs Black Power, el Signo

indy (MON) 03/21/1977 Tehuacán, Puebla [Halcon 250]
1) Tupamaro b Marinero Veracruz [Veracruz LH]

EMLL (TUE) 03/22/1977 Arena Coliseo [Lucha Libre 691, http://wrestlingclassics.com/cgi-bin/.ubbcgi/ultimatebb.cgi?ubb=get_topic&f=10&t=004694#000000 Matt Farmer]
1) Apolo Casillas b Joe Marino
2) José Luis Mendieta, Saeta Azteca b Demonio Blanco, Leo López [quarterfinal]
3) Karloff Lagarde, Rodolfo Ruiz b Ciclón Veloz, Mr. Steel [quarterfinal]
4) José Luis Mendieta, Saeta Azteca b Dr. O’Borman, Rizado Ruiz [semifinal]
5) Karloff Lagarde, Rodolfo Ruiz b Cachorro Mendoza, Dardo Aguilar [semifinal]
6) Karloff Lagarde, Rodolfo Ruiz b José Luis Mendieta, Saeta Azteca [final]

EMLL (TUE) 03/22/1977 Arena Coliseo Guadalajara [El Informador 1977-03-22]
1) ? vs ??
2) ? vs ??
3) ? vs ??
4) Cesar Curiel, Mario Alcala vs Herodes, Iván El Bronco
5) El Cobarde, El Vengador, Ringo Mendoza vs Adorable Rubi, Roy Stive, Tony Salazar

INDIE (TUE) 03/22/1977 Arena Atzacoalco, Gustavo A. Madero, Distrito Federal [@therealfredo, Box Y Lucha 1275]
1) Agente X vs El Invasor
2) Apolo Casillas vs Tauro
3) El Reo vs El Monarca
4) Blue Demon, Carlos Plata, El Faraón vs As Charro, Gemelo Diablo I, Gemelo Diablo II

indy (TUE) 03/22/1977 Tulancingo, Hidalgo [Halcon 250]
1) Flama Azul  (c) b Estrella Blanca [MEX LIGHT]
## magazine column says Flama Azul has beaten everyone in the division

indy (TUE) 03/22/1977 Unidad Deportiva de Acapulco, Acapulco, Guerrero [Halcon 250]
1) ?, El Matematico, Solar I vs ??, ???, ????
## recap mentions Wagner was Matematico's partner but no-showed, among others.
2) Gulliver b Gran Nikolai [hair]

Mora (TUE) 03/22/1977 Arena Aficion [Halcon 250]
1) Ángel Blanco, Ray Mendoza vs Gran Hamada, Tinieblas

INDIE (WED) 03/23/1977 Nueva Arena Apatlaco, Iztapalapa, Distrito Federal [@therealfredo, Box Y Lucha 1275]
1) Doberman vs Gorilla Flores
2) Satánico vs Chamaco Ortiz
3) Karate Hayato, Rodolfo Ruiz vs Halcón Dorado I, Halcón Dorado II
4) Blue Demon, Carlos Plata vs Gemelo Diablo I, Gemelo Diablo II

indy (WED) 03/23/1977 Arena Coliseo San Luis Potosí, San Luis Potosí, San Luis Potosí [Halcon 250]
1) Adorable Rubi, Roy Steve, Tony Salazar vs El Cobarde, Ringo Mendoza, Vengador
## Roy Steve mentioned to be Adorable Rubi's nephew.

indy (WED) 03/23/1977 Arena KO Algusto, Naucalpan, Estado de México [Halcon 250]
1) el Signo, Negro Navarro b ?, ?? [torneo, final]

EMLL (THU) 03/24/1977 Arena Isabel, Cuernavaca, Morelos [Halcon 250]
1) Impacto b El Suriano
2) Índio Vitela, Sangre Chicana b Chino Chow, Tony López
3) Blue Demon, Gran Markus b El Halcón	(Ortiz), Raúl Reyes
4) Mil Máscaras  (c) b Alfonso Dantes [IWA HEAVY]
&& full house

INDIE (THU) 03/24/1977 Plaza de Toros Alberto Balderas, Ciudad Juárez, Chihuahua [@therealfredo, Box Y Lucha 1275, Combates 73, KO 1240, RB]
1) El Vikingo, Flama Roja vs Baby Sharon, Trovador
2) Irma González  (c) vs Chabela Romero [MEX WOMEN]
3) Dr. Wagner  (c) vs Canek [MEX LH]
4) Villano III  (c) vs Alberto Muñoz [UWA WELTER]
5) Rene Guajardo  (c) vs Anibal [UWA MIDDLE]
&& Gran Carnaval de Campeones

EMLL (FRI) 03/25/1977 Arena México [Halcon 250, Lucha Libre 691, http://wrestlingclassics.com/cgi-bin/.ubbcgi/ultimatebb.cgi?ubb=get_topic&f=10&t=004694#000000 Matt Farmer]
1) El Nazi, Manuel Robles b Cachorro Mendoza, Máscara Roja
## 2-1
2) Demonio Blanco b As Charro [MEX MIDDLE, quarterfinal]
3) José Luis Mendieta b Spirit [MEX MIDDLE, quarterfinal]
4) Adorable Rubi b Tony Salazar [MEX MIDDLE, quarterfinal]
5) El Faraón b Ringo Mendoza [MEX MIDDLE, quarterfinal]
## (2-0)
6) Alfonso Dantes, Fishman, Gran Markus b Blue Demon, El Halcón, Mil Máscaras
## 2-1

indy (FRI) 03/25/1977 Arena Zapotitlan, Tláhuac, Distrito Federal [luchablog photolog (2013-09-17 18.28.33)]
1) Saeta Del Ring vs Electrón
2) Orefero II vs Ángel Blanco
3) Ángel Solitario I, Ángel Solitario II vs Alacrán De Durango, Dr. Misterio
4) Johnny Lezcano, Tinieblas vs Ángel Blanco, Judas
5) Conde Azul vs Orfero Negro [mask]

EMLL (SAT) 03/26/1977 Arena Nueva Atzacoalco, Gustavo A. Madero, Distrito Federal [@therealfredo, Box Y Lucha 1275]
1) Aristarco vs Roy Lancer
2) Mr. Steel vs Índio Pinto
3) Índio Vitela, Karate Hayato vs Cachorro Mendoza, Cacique Mara
4) El Halcón, Ringo Mendoza vs Alfonso Dantes, Gran Markus

EMLL (SAT) 03/26/1977 Pista Arena Revolución [@therealfredo, Box y Lucha 1275]
1) Asdrubal vs Mario Rocca
2) Carlos Plata, El Monarca vs Rizado Ruiz, Sangre Chicana and Bruno Victoria, Leo López and Raúl Mata, Tony López [torneo]
3) Satánico, Tauro vs Halcón Dorado I, Halcón Dorado II and Estrella Blanca, Franco Colombo and Huroki Sito, Irazú [torneo]

indy (SAT) 03/26/1977 Arena Apatlaco, Iztapalapa, Distrito Federal [luchablog photolog (2013-09-17 18.27.24)]
1) Bárbaro Fonseca, Benny Castello b Lezcano, Tamba
&& date may be off a week

indy (SAT) 03/26/1977 Nueva Arena Apatlaco, Iztapalapa, Distrito Federal [Halcon 250]
1) Bengala I b Barba Negra [hair]

EMLL (SUN) 03/27/1977 Arena Coliseo [@therealfredo, Box Y Lucha 1275]
1) Joe Marino vs El Suriano
2) Rafael Salamanca vs Índio Pinto
3) Alfa Centauris vs Sergio Borrayo
4) El Nazi, El Reo, Karloff Lagarde vs Cacique Mara, Chino Chow, Ciclón Veloz
5) El Faraón, Raúl Reyes vs Gemelo Diablo I, Gemelo Diablo II

EMLL (SUN) 03/27/1977 Arena Coliseo Guadalajara [El Informador 1977-03-27]
1) ? vs ??
2) ? vs ??
3) ? vs ??
4) El Cobarde, El Vengador vs Black Killer, Iván El Bronco
5) Cachorro Mendoza, Mano Negra, Ringo Mendoza vs Adorable Rubi, Perro Aguayo, Roy Stive

EMLL (SUN) 03/27/1977 Pista Arena Revolución [@therealfredo, Box Y Lucha 1275]
1) Apolo Casillas vs Mr. Steel, Saeta Azteca, Impacto, Chamaco Ortiz, Agente X, Rodolfo Ruiz, El Invasor, Diogenes, Bufalo Salvaje, Aristarco, El Maldito [battle royal]
2) As Charro, Tony Salazar vs Máscara Roja, Spirit

INDIE (SUN) 03/27/1977 Arena Aurora, Cuautitlán Izcalli, Estado de México [@therealfredo, Box Y Lucha 1275]
1) Tommy Nava vs Irazú
2) Satánico vs Franco Colombo
3) Índio Vitela, Leo López vs El Monarca, Tony López
4) Carlos Plata, Raúl Mata vs Alfonso Dantes, Sangre Chicana

indy (SUN) 03/27/1977 Arena Aficion [Halcon 250]
1) Chabela Romero, Irma González vs Chela Salazar, Marina Rey

indy (SUN) 03/27/1977 Arena Isabel, Cuernavaca, Morelos [Halcon 250]
1) Corsario Morelense vs Erick Romano [hair]
2) Ráfaga Moreno  (c) vs Barón Siniestro [MORELOS WELTER]

indy (SUN) 03/27/1977 Arena KO Algusto, Naucalpan, Estado de México [Halcon 250]
1) Javier Llanes b Destroyer [mask]
## Destroyer is Danny Guzman from Xalapa

indy (SUN) 03/27/1977 Arena Lopez Mateos [http://i.imgur.com/8udrsFW.jpg luchablog photolog (2013-09-17 18.28.42)]
1) Diluvio, Tiger Negro vs Bello Adan, Vengador Negro
2) Chacal de la Rosa, Conde Murciélago, Romano García vs Danny Boy, Pedro Lancer, Saeta Imperial
3) Golden Boy, Gory Medina vs Cadáver II, Dr. Misterio
4) Monje Siniestro I, Monje Siniestro II vs El Nuclear, Terry Bolaños

indy (SUN) 03/27/1977 Arena Toluca, Toluca, Estado de México [Halcon 250]
1) Homus Omega vs Rubio Azteca
2) Apolo Chino I, Apolo Chino Ii vs Muerte De La Barranca I, Muerte De La Barranca Ii
3) Tarasco I, Tarasco II vs Sergio Aragon, Zebra Kid
4) Rokambole b Bronco [mask]
## Bronco is Chico Vertiz from Hidalgo

indy (SUN) 03/27/1977 Monterrey, Nuevo León [Box y Lucha 1279, RB]
1) Gran Markus  (c) b Halcón Ortiz [MEX HEAVY]
## May be 04/03. Might be part of the Plaza de Toros show on 03/27, building unclear.

indy (SUN) 03/27/1977 Plaza de Toros La Monumental, Monterrey, Nuevo León [https://www.facebook.com/96186896558/posts/10153635066986559 Box Y Lucha]
1) Canek b Rubén Juárez [hair]

indy (SUN) 03/27/1977 Plaza de Toros Valente Arellano, Torreón, Coahuila [El Siglo de Torreon 1977-03-27]
1) Joe Maquina vs El Fraterno
2) Centella Azul vs Eric el Rojo
3) Bella Karina vs Pantera Suriana, Lupita Lara, Norma González, Viuda Negra, Estela Molina, Toña La Tapatia, Charito Silva [battle royale]
