
/**********************
luchadb archive (for year 1978)
export started at 2024-07-09 10:17:49
export finished at 2024-07-09 10:43:16

particular parser syntax for nerds:

PROMOTION (DAY) MM/DD/YYYY ArenaName [linkURL linkName]
MatchNo) side1-1, side1-2, side1-3 DECISION side2-1, side2-2, side2-3 [matchstip]

special codes 
(c) champion obviously
## note attached to preeceding match
&& note attached to event
%% attendence (always integer, always suspect) 
** event name
**********************/
EMLL (SUN) 01/01/1978 Arena Coliseo Guadalajara [El Informador 1978-01-01, Halcon 347]
1) ? vs ??
2) ? vs ??
3) ? vs ??
4) El Faraón, Raúl Mata, Ringo Mendoza vs Alfonso Dantes, Black Gordman, Perro Aguayo
5) Índio Salvaje I, Índio Salvaje II b Calavera I, Calavera II [hair]

indy (SUN) 01/01/1978 Acapulco, Guerrero [Halcon 347]
1) Mario Valenzuela  (c) b Yanco [MEX LIGHT]

indy (SUN) 01/01/1978 Pachuca, Hidalgo [Halcon 347]
1) Astro Rey b Sombra Verde [mask]
## Sombre Verde is Danny Cruz

indy (SUN) 01/01/1978 Plaza de Toros Valente Arellano, Torreón, Coahuila [El Siglo de Torreon 1978-01-01]
1) Jesus Chavez vs Guapo Ibarra
2) Ciclón Negro vs El Fraterno
3) Johnny Carrillo, Rayito Sanchez vs Eric el Rojo, Índio Navajo
4) La Sombra, Mario Saucedo vs Espanto III, Milo Caballero
5) El Trueno, Temoc Torres vs El Exorcista, Star Águilar

indy (SUN) 01/01/1978 Poza Rica, Veracruz [Halcon 347]
1) Lobo Rubio b Abismo [mask]
## Abismo is Arturo Escobedo

indy (SUN) 01/01/1978 Topo Chico, Nuevo Leon [Halcon 347]
1) Rudy Reyna b El Cadete Ruiz [hair]

indy (MON) 01/02/1978 Mérida, Yucatán [Halcon 347]
1) el Signo  (c) b Carlos García [UWA LIGHT]

EMLL (TUE) 01/03/1978 Arena Coliseo Guadalajara [El Informador 1978-01-03]
1) ? vs ??
2) ? vs ??
3) ? vs ??
4) Cesar Curiel, Terremoto vs El Ídolo, Sangre India
5) Cien Caras, Máscara Año 2000, Ringo Mendoza vs Alfonso Dantes, Gemelo Diablo I, Gemelo Diablo II

indy (TUE) 01/03/1978 Cuautitlán, Estado de México [Halcon 347]
1) Cesar Valentino  (c) b Huracán Ramírez [UWA JLH]

EMLL (SUN) 01/08/1978 Arena Coliseo Guadalajara [El Informador 1978-01-08]
1) ? vs ??
2) ? vs ??
3) ? vs ??
4) Enrique Vera, Siglo XX vs Sangre India, Solder Blue
5) Cachorro Mendoza, Cien Caras, Ringo Mendoza vs Adorable Rubi, El Ídolo, Perro Aguayo

indy (SUN) 01/08/1978 Naucalpan, Estado de México [Halcon 347]
1) Estrella Del Sur b Bulldog Morgan [hair]

indy (SUN) 01/08/1978 Plaza de Toros Valente Arellano, Torreón, Coahuila [El Siglo de Torreon 1978-01-08]
1) ? vs ??
2) Rayito Sanchez vs Índio Navajo
3) Jhonny Carrillo, Mario Saucedo vs El Fraterno, Eric el Rojo
4) Kasak, Torbellino vs Destructor, Star Águilar
5) Mano Negra, Mr. Niebla vs Divino Roy, Li-Chang

MORA (SUN) 01/08/1978 Toreo de Cuatro Caminos, Naucalpan, Estado de México [https://www.facebook.com/photo.php?fbid=468075916573482&set=a.461505387230535.102143.454597374588003&type=1&theater DJ Spectro, https://www.facebook.com/LuchaLibreDeAyerdeHoyYSiempre/photos/a.461505387230535.102143.454597374588003/828010483913355/?type=1 DJ Spectro (UWA Middle), Halcon 347, Matt Farmer]
1) Anibal  (c) b América Salvaje [UWA MIDDLE]
2) El Santo, El Solitario, Gran Hamada b Cesar Valentino, Ray Mendoza, Temojin el Mongol
3) Canek DQ Dr. Wagner [MEX LH]
## Canek won the title from Wagner. Wagner was said to have 11 defenses. Canek is listed as the 20th champion.
&& Sources differ on the Canek/Wagner date - the newspaper has a 01/08 date, but another DJ Spectro post has it on the 15th (and so does a photo I took.)

EMLL (TUE) 01/10/1978 Arena Coliseo Guadalajara [El Informador 1978-01-10]
1) ? vs ??
2) ? vs ??
3) ? vs ??
4) Cesar Curiel, Cinta Negra, Máscara Año 2000 vs Calavera I, Calavera II, Terremoto
5) Cien Caras, Ringo Mendoza vs Adorable Rubi, Perro Aguayo

EMLL (SUN) 01/15/1978 Arena Coliseo Guadalajara [El Informador 1978-01-15]
1) ? vs ??
2) ? vs ??
3) ? vs ??
4) Enrique Vera, Mario Alcala vs El Ídolo, The Irs
5) Cien Caras, Mano Negra, Ringo Mendoza vs Adorable Rubi, Perro Aguayo, Terremoto

indy (SUN) 01/15/1978 Monterrey, Nuevo León [Halcon 347]
1) Rubén Juárez  (c) b José Torres [NORTE LH]
2) Centurión Negro b Carnicero Águilar  (c) [NORTE MIDDLE]

indy (SUN) 01/15/1978 Plaza de Toros Valente Arellano, Torreón, Coahuila [El Siglo de Torreon 1978-01-15]
1) ? vs ??
2) ? vs ??
3) Jhonny Carrillo, Rayito Sanchez vs El Fraterno, Índio Navajo
4) La Sombra, Mr. Niebla vs El Extraño, Star Águilar
5) Carlos Plata, Tony Salazar vs Gemelo Diablo I, Gemelo Diablo II

indy (SUN) 01/15/1978 Reynosa, Tamaulipas [Halcon 347]
1) Sangre Chicana  (c) b Yuma [MEX MIDDLE]

EMLL (TUE) 01/17/1978 Arena Coliseo Guadalajara [El Informador 1978-01-17]
1) ? vs ??
2) ? vs ??
3) ? vs ??
4) Cesar Curiel, El Caudillo, Siglo XX vs Águila India, Gran Cochisse, Sangre India
5) Mano Negra, Ringo Mendoza vs Adorable Rubi, Perro Aguayo

indy (THU) 01/19/1978 Cuernavaca, Morelos [Halcon 347]
1) Avispón Verde b Mr. Misterio [mask]
## No real name given for Mr. Misterio

indy (SAT) 01/21/1978 Apatlaco, Iztapalapa, Distrito Federal [Halcon 347]
1) el Signo  (c) b Black Man [UWA LIGHT]

EMLL (SUN) 01/22/1978 Arena Coliseo Guadalajara [El Informador 1978-01-22]
1) ? vs ??
2) ? vs ??
3) ? vs ??
4) Cien Caras, Mano Negra vs Adorable Rubi, Fishman
5) Ringo Mendoza vs Perro Aguayo

indy (SUN) 01/22/1978 Arena Lopez Mateos [https://www.facebook.com/photo?fbid=4448775711859050&set=pcb.4448778931858728 Arturo Gaona Jr.]
1) Maravilla Negra II vs Marvin
2) La Hormiga vs Mutante
3) Arturo Gaona, Chino Lopez vs El Magnífico, El Mago
4) Estrella Del Sur, Octavio Gaona vs Al Galcia, El Apóstol
5) Chamaco Ramírez, El Solitario vs Ángel Blanco, Fantasma de la Opera

indy (SUN) 01/22/1978 Monterrey, Nuevo León [Halcon 347]
1) Sangre Chicana  (c) b Ultraman [MEX MIDDLE]

indy (SUN) 01/22/1978 Pachuca, Hidalgo [Halcon 347]
1) Chamaco Robles b Perro González  (c) [Hidalgo Light]

indy (SUN) 01/22/1978 Plaza de Toros Valente Arellano, Torreón, Coahuila [El Siglo de Torreon 1978-01-22]
1) ? vs ??
2) Centella Azul vs Guapo Ibarra
3) Eric el Rojo, Índio Navajo vs Johnny Carrillo, Mario Saucedo
4) El Extraño, Espanto III, Star Águilar vs La Sombra, Mr. Niebla, Temoc Torres
5) Escorpión I, Escorpión II vs Cachorro Mendoza, Ultraman

indy (MON) 01/23/1978 Campeche, Campeche [Halcon 347]
1) Lobo Rubio b Ovni [mask]
## Ovni is Ismael Gonzalez

EMLL (TUE) 01/24/1978 Arena Coliseo [https://www.facebook.com/boxylucha.net/posts/10154442116006559 Box Y Lucha, Halcon 347, http://www.boxylucha.com/foro/viewtopic.php?p=736963#p736963 ricardo aguilar hidalgo @ box y lucha foro]
1) Gran Davis vs Joe Marino
## rematch
2) Barba Negra vs Impacto
3) El Nómada vs Rafael Salamanca
4) Chino Chow, Franco Colombo vs Manuel Robles, Tupamaro
5) Alfonso Dantes, Karloff Lagarde vs Blue Demon, Raúl Reyes
6) Mario Valenzuela  (c) b Talismán [MEX LIGHT]
7) Flama Azul b Américo Rocca [hair, mask]
## Americo Rocca's hair vs Flama Azul's mask.

EMLL (TUE) 01/24/1978 Arena Coliseo Guadalajara [El Informador 1978-01-24]
1) ? vs ??
2) ? vs ??
3) ? vs ??
4) Cinta Negra vs Gran Cochisse
5) Cien Caras, Máscara Año 2000 vs Adorable Rubi, Perro Aguayo and Mano Negra, Rorro Rogeau and El Ídolo, Fishman [torneo]

indy (TUE) 01/24/1978 Cuautitlán, Estado de México [Halcon 347]
1) Tawa Vera b Texano  (c) [Cuautitlan Welter]
2) Renato Torres vs Ray Lopez [hair]

indy (TUE) 01/24/1978 Distrito Federal [Halcon 347]
1) Príncipe Odin b El Delfin [hair]

indy (WED) 01/25/1978 Arena Xochimilco, Xochimilco, Distrito Federal
1) Black Shadow, El Monarca, Tigre Colombiano vs Demonio Blanco, El Reo, Sangre Chicana

EMLL (SUN) 01/29/1978 Arena Coliseo Guadalajara [El Informador 1978-01-29]
1) ? vs ??
2) ? vs ??
3) ? vs ??
4) Enrique Vera, Rorro Rogeau vs El Ídolo, Terremoto
5) Cien Caras, El Halcón, Mano Negra vs Alfonso Dantes, Fishman, Perro Aguayo

indy (SUN) 01/29/1978 Arena Azteca Budokan, Ciudad Nezahualcoyotl, Estado de México [http://www.boxylucha.com/foro/viewtopic.php?p=736963#p736963 ricardo aguilar hidalgo @ box y lucha foro]
1) Romano García vs La Hormiga
2) El Alacrán vs Fantasma de la Opera
3) Impacto, Patriarca vs Fantasmon, Fantastic
4) Mario Valenzuela  (c) vs Arturo Cruz [MEX LIGHT]
## Valenzuela is champion
5) Gallo Tapado, Huracán Ramírez vs Cesar Valentino, Septiembre Negro

indy (SUN) 01/29/1978 Arena Lopez Mateos [https://www.facebook.com/photo?fbid=4448776018525686&set=pcb.4448778931858728 Arturo Gaona Jr.]
1) ? vs ??
2) Marvin vs Loco Asesino
3) El Magnífico vs El Mutante
4) Arturo Gaona, Estrella Del Sur, Octavio Gaona vs Al Galicia, El Mago, Fantasma de la Opera
5) Chamaco Ramírez, El Solitario vs Ángel Blanco, Renato Torres

indy (SUN) 01/29/1978 Cancha de San Pedro, Puebla, Puebla [https://www.facebook.com/photo/?fbid=515297593439848&set=g.1063818623692271 Angel Luzbel Nezahualcoyotl]
1) Cobra Roja vs Sartana
2) Rodan X vs The Monster
3) Rocambole, Simon Blanco vs Marinero Loco, Profesor Dante
4) Alzadu, Mr. America vs El Latino, El Maya

indy (SUN) 01/29/1978 Ciudad Juárez, Chihuahua [Halcon 347]
1) Fireman, Legionario b Mercenario I, Mercenario II [mask]
## Mercenarios are Juan Limon and Ex-Diablo

indy (SUN) 01/29/1978 Distrito Federal [Halcon 347]
1) Mario Valenzuela  (c) b Arturo Cruz [MEX LIGHT]

indy (SUN) 01/29/1978 Monterrey, Nuevo León [Halcon 347]
1) Raúl Mata  (c) b Gran Markus [MEX HEAVY]
2) Solar I  (c) b Villano III [UWA WELTER]
3) Brazo de Oro b Águila Roja [mask]

indy (SUN) 01/29/1978 Pachuca, Hidalgo [Halcon 347]
1) Chamaco Robles b Perro González  (c) [Hidalgo Light, hair]
## listed as both a title and a hair match

indy (SUN) 01/29/1978 Plaza de Toros Valente Arellano, Torreón, Coahuila [El Siglo de Torreon 1978-01-29]
1) ? vs ??
2) ? vs ??
3) La Sombra, Mario Saucedo, Temoc Torres vs Eric el Rojo, Espanto III, Star Águilar
4) Mr. Niebla vs El Extraño [mask]
5) Chino Chow, El Impostor vs Demonio Blanco, El Nazi

MORA (SUN) 01/29/1978 Toreo de Cuatro Caminos, Naucalpan, Estado de México [Halcon 347, http://imgur.com/HA5rj3O luchablog photolog (2013-09-17 17.34.26), http://www.boxylucha.com/foro/viewtopic.php?p=736975#p736975 ricardo aguilar hidalgo @ box y lucha foro]
** UWA 3rd Aniversario
1) Bobby Lee b Negro Navarro
2) Bello Greco, Sergio el Hermoso b Babe Face, Scorpió [hair]
3) Ángel Blanco, Dr. Wagner b Ray Mendoza, Rene Guajardo
4) Black Man, El Matematico b el Signo, Lobo Rubio [hair]
## tecnicos put their masks on the line
5) Mil Máscaras b Temojin el Mongol [IWA HEAVY]
## Mil Mascaras is champions

indy (MON) 01/30/1978 Tampico, Tamaulipas [Halcon 347]
1) Cesar Valentino  (c) b Gran Hamada [UWA JLH]

EMLL (TUE) 01/31/1978 Arena Coliseo Guadalajara [El Informador 1978-01-31]
1) ? vs ??
2) ? vs ??
3) ? vs ??
4) Cesar Curiel, Rorro Rogeau, Siglo XX vs Calavera I, Calavera II, Sangre India
5) El Halcón, Mano Negra vs Fishman, Perro Aguayo

indy (TUE) 01/31/1978 Pachuca, Hidalgo [Halcon 347]
1) El Solitario  (c) b Rene Guajardo [UWA LH]

EMLL (WED) 02/01/1978 Arena Coliseo Acapulco, Acapulco, Guerrero [Halcon 347]
1) Tony Salazar, Ultraman b Bruno Victoria, Roy Steve
## last (or one of the last) date for Ultraman in EMLL before jumping
2) Mario Valenzuela  (c) b Lizmark [MEX LIGHT]
## said to be the third defense in 9 days (which does check out; 01/23 against Talisman, 01/29 versus Arturo Cruz)
3) Carlos Plata b Raúl Reyes [hair]
4) Mil Máscaras, Tigre Colombiano b Gran Markus, Herodes
## straight falls

EMLL (SUN) 02/05/1978 Arena Coliseo Guadalajara [El Informador 1978-02-05]
1) ? vs ??
2) ? vs ??
3) ? vs ??
4) Enrique Vera, Rorro Rogeau vs Sangre India, The Irs
5) Mano Negra, Raúl Mata, Ultraman vs Alfonso Dantes, Fishman, Perro Aguayo

indy (SUN) 02/05/1978 Cancha de San Pedro, Puebla, Puebla [https://www.facebook.com/photo/?fbid=515297780106496&set=g.1063818623692271 Angel Luzbel Nezahualcoyotl]
1) La Llorona vs Sartana
2) Blue Bird vs The Monster
3) Rocamboel, Simon Blanco vs Astro Boy, Profesor Dante
4) Columbus, Felipe Ham Lee vs Spartaco, Sugi Sito

indy (SUN) 02/05/1978 Cuernavaca, Morelos [Halcon 347]
1) Salamandra b Avispón Verde [mask]
## No real name given for Avispon Verde

indy (SUN) 02/05/1978 Plaza de Toros Valente Arellano, Torreón, Coahuila [El Siglo de Torreon 1978-02-05]
1) Ciclón Negro vs Loco Díaz
2) Centella Azul vs Guapo Ibarra
3) Rayito Sanchez vs Eric el Rojo
4) La Sombra, Mario Saucedo, Polo Estrada vs El Extraño, Espanto III, Star Águilar
5) Chamaco Ortiz, El Impostor vs Escorpión I, Escorpión II

indy (SUN) 02/05/1978 Puebla, Puebla [Halcon 347]
1) Caballero Azul b Polar [mask]
## Polar is Roberto Paz

EMLL (TUE) 02/07/1978 Arena Coliseo [Box Y Lucha 1332, http://wrestlingclassics.com/cgi-bin/.ubbcgi/ultimatebb.cgi?ubb=get_topic&f=10&t=004698 Matt Farmer]
1) Bufalo Salvaje b Impacto
2) El Nómada, Satánico b Rafael Salamanca, Talismán
3) El Vengador, Flama Azul b Mario Valenzuela, Rizado Ruiz
## Valenzeula is the future La Fiera
4) Karloff Lagarde, Sangre Chicana b Black Shadow, Cachorro Mendoza
&& only 4 matches listed in the results but likely 1 or 2 more

EMLL (TUE) 02/07/1978 Arena Coliseo Guadalajara [El Informador 1978-02-07]
1) ? vs ??
2) ? vs ??
3) ? vs ??
4) Cesar Curiel, Máscara Año 2000, Ultraman vs Índio I, Índio I, Terremoto
5) Mano Negra, Raúl Mata vs Fishman, Perro Aguayo

indy (WED) 02/08/1978 Ciudad Juárez, Chihuahua [Halcon 347]
1) Fireman b Furia Negra [mask]
## Furia Negra is Arturo Carrillo

indy (WED) 02/08/1978 Irapuato, Guanajuato [Halcon 347]
1) Médico I b Faraón De Oro [mask]
## No real name given for Faraon de Oro

EMLL (FRI) 02/10/1978 Arena Coliseo [http://wrestlingclassics.com/cgi-bin/.ubbcgi/ultimatebb.cgi?ubb=get_topic&f=10&t=004698 Matt Farmer]
1) Joe Marino vs Tommy Nava
2) El Egipcio vs Zebra Kid
3) Bufalo Salvaje vs Mr. Steel
4) Chamaco Ortiz, Talismán vs Dr. O’Borman, Tauro
5) El Vengador, José Luis Mendieta vs El Reo, Manuel Robles
6) Blue Demon, Tony Salazar vs Karloff Lagarde, Sangre Chicana
&& Not mentioned in Box Y Lucha covering this date (maybe a different date? EMLL had not started running Coliseo & Mexico on the same day.)

EMLL (FRI) 02/10/1978 Arena México [Box Y Lucha 1332, http://wrestlingclassics.com/cgi-bin/.ubbcgi/ultimatebb.cgi?ubb=get_topic&f=10&t=004698 Matt Farmer]
1) Kato Kung Lee b Demonio Blanco
2) Tigre Colombiano, Tony Salazar b Carlos Plata, Herodes
3) El Monarca, Mano Negra b Fishman, Sangre Chicana
## Nine straight weeks with wins for Monarca, who will challenge Sangre Chicana for MEX MIDDLE next week.
4) Mil Máscaras, Pierre Gagne, Raúl Mata DRAW Alfonso Dantes, Gran Markus, Perro Aguayo
&& Only a four match card according to the recap

indy (FRI) 02/10/1978 Olympic Auditorium, Los Angeles, California [Box Y Lucha 1332]
1) Ringo Mendoza b El Faraón  (c) [NWA MIDDLE]

EMLL (SUN) 02/12/1978 Arena Coliseo Guadalajara [El Informador 1978-02-12, Halcon 347]
1) ? vs ??
2) ? vs ??
3) ? vs ??
4) Enrique Vera, Pierre Gagne, Raúl Mata vs Adorable Rubi, Divino Roy, Herodes
5) Mano Negra  (c) b Perro Aguayo [NWA WELTER]

indy (SUN) 02/12/1978 Arena Coliseo Monterrey
1) Cachorro Mendoza, El Monarca, Tigre Colombiano vs As Charro, Dr. Galaxia, Lee Chang
2) El Monarca, Kato Kung Lee, Tigre Colombiano vs Alfonso Dantes, As Charro, Carlos Plata
3) El Trueno vs Ari Romero [hair, mask]
&& two different shows?

indy (SUN) 02/12/1978 Arena Toluca, Toluca, Estado de México [Halcon 299]
1) Javier Montes b Rokambole  (c) [TOLUCA WELTER]

indy (SUN) 02/12/1978 Monterrey, Nuevo León [Halcon 347]
1) el Signo b Bobby Lee [UWA LIGHT]

indy (SUN) 02/12/1978 Plaza de Toros Valente Arellano, Torreón, Coahuila [El Siglo de Torreon 1978-02-12]
1) ? vs ??
2) Centella Azul vs Loco Díaz
3) Kasak vs El Fraterno
4) El Extraño, La Sombra vs Espanto III, Star Águilar
5) Cachorro Mendoza, Cien Caras, Dr. Galaxia vs Gran Markus, King Kong, Li-Chang

MORA (SUN) 02/12/1978 Toreo de Cuatro Caminos, Naucalpan, Estado de México [Box Y Lucha 1332, Matt Farmer]
1) Príncipe Odin b Scorpió Negro
2) Filli Estrella, Gulliver b Gaby De Silva, Gran Nikolai
3) Gallo Tapado DCOR Rey Saúl
4) Ray Mendoza, Villano III DQ Black Star, Tinieblas
## Tinieblase ended up unmasked
5) Ángel Blanco, Dr. Wagner, Septiembre Negro DQ Anibal, El Solar, El Solitario
## Anibal fouled Wagner

EMLL (TUE) 02/14/1978 Arena Coliseo [http://wrestlingclassics.com/cgi-bin/.ubbcgi/ultimatebb.cgi?ubb=get_topic&f=10&t=004698 Matt Farmer]
1) Joe Marino vs Tommy Nava
2) El Egipcio vs Zebra Kid
3) Bufalo Salvaje vs Mr. Steel
4) Chamaco Ortiz, Talismán vs Dr. O’Borman, Tauro
5) El Vengador, José Luis Mendieta vs El Reo, Manuel Robles
6) Blue Demon, Tony Salazar vs Karloff Lagarde, Sangre Chicana

EMLL (TUE) 02/14/1978 Arena Coliseo Guadalajara [El Informador 1978-02-14]
1) ? vs ??
2) ? vs ??
3) ? vs ??
4) Mano Negra, Raúl Mata vs Pierre Gagne, Siglo XX and Adorable Rubi, Divino Roy and ?, ?? [torneo]

indy (TUE) 02/14/1978 Arena Nueva Atzacoalco, Gustavo A. Madero, Distrito Federal [Box Y Lucha 1332]
1) Vulcano II vs El Infinito
2) Chamaco Orduna vs El Galante
3) Chamaco Escobedo, Conde Azul vs Enfermero I, Enfermero II
4) El Patriarca, Gallo Tapado, Vick Ramírez vs Cacqiue Mara, Kuroneko, Tony Arce

indy (WED) 02/15/1978 Arena Coliseo Acapulco, Acapulco, Guerrero [Box Y Lucha 1332, Halcon 347]
1) Lucifer vs Johnny Ceballos
2) Lizmark, Tony López vs Gurkan, Índio Vitela
3) Gemelo Diablo I, Gemelo Diablo II, Sangre Chicana vs El Cobarde, El Impostor, Tony Salazar
4) Mil Máscaras  (c) b Danny Ortiz [IWA Heavy]

indy (WED) 02/15/1978 Arena Naucalpan [Halcon 299]
1) Destino Negro b Texano
2) Cacique Mara, Kuroneko b Estrella Del Sur, Javier Llanes
3) Escorpión Negro, Escorpión Negro, Vick Ramírez b Ángel Blanco, Villano I, Villano II
## Straight falls. Escorpion Negro replaced Patriarca
4) Cesar Valentino, TNT DQ Anibal, Dorrel Dixon
## TNT replaced Temojin. Sets up Valentino versus Anibal

indy (WED) 02/15/1978 Arena San Juan Pantitlan, Ciudad Nezahualcóyotl, Estado de México [Box Y Lucha 1332]
1) Osiris vs Ángel Asesino
2) Sombra de Plata I vs Sombra De Plata II, Rey Halcón, Gallo Giro, Benny Castello, Bárbaro Fonseca, Tony Arce, Mr. Lancer, Perro Sosa, Misterio Blanco II [battle royal]

indy (WED) 02/15/1978 Arena Xochimilco, Xochimilco, Distrito Federal [Box Y Lucha 1332]
1) El Maldito vs Cebra Kid
2) Flama Azul vs Tauro
3) El Monarca, Raúl Reyes vs Demonio Blanco, Fishman and El Impostor, Tony Salazar and Escorpión I, Escorpión II [torneo]

indy (WED) 02/15/1978 Nueva Arena Apatlaco, Iztapalapa, Distrito Federal [Box Y Lucha 1332, Halcon 347]
1) Chacal de la Rosa vs Astral
2) Catedrático, El Matematico vs Mr. Bronce, Mr. Cobra
3) Impacto b Barba Negra  (c) [DF Middle]
4) Kung Fu, Ultraman vs Kaos, Negro Navarro
5) Mario Valenzuela  (c) b Arturo Cruz [MEX LIGHT]

indy (THU) 02/16/1978 Arena Santa Maria Aztahuacan, Iztapalapa, Distrito Federal [Box Y Lucha 1332]
1) Misterio Blanco II vs El Meteoro
2) Rudy Espinosa vs El Dinámico
3) El Toluco vs Fantasmon
4) Raúl Guerrero, Tawa Vera vs Gatubedo, Verdugo Negro
5) Hermano Muerte I, Hermano Muerte II, Rocambole vs El Matematico, Hombre Nuclear, Potro Salvaje

EMLL (FRI) 02/17/1978 Arena México [Box Y Lucha 1332, Halcon 299, http://wrestlingclassics.com/cgi-bin/.ubbcgi/ultimatebb.cgi?ubb=get_topic&f=10&t=004698 Matt Farmer]
1) Huroki Sito b Impacto
2) Kato Kung Lee b Divino Roy
3) Raúl Mata, Tigre Colombiano DQ Gemelo Diablo I, Gemelo Diablo II
## Straight falls, both by DQ
4) Sangre Chicana  (c) b El Monarca [MEX MIDDLE]
## Monarca took fall in 18 minutes, Chicano took the second in 4 and the third in 10.
5) Mano Negra, Mil Máscaras, Pierre Gagne b Alfonso Dantes, Gran Markus, Perro Aguayo
## Tecnicos took 1(DQ) and 3
6) Carlos Plata b Tony Salazar [hair]
## Salazar took 2/3 to take Plata's hair.
&& The DF commission handed out 1977 awards on this show

indy (FRI) 02/17/1978 Los Angeles, California [Halcon 347]
1) Ringo Mendoza b El Faraón  (c) [NWA MIDDLE]

EMLL (SAT) 02/18/1978 Pista Arena Revolución [Box Y Lucha 1332]
1) Joe Marino vs Kalimaco
2) Mr. Steel vs Barba Negra
3) El Impostor vs Mario Valenzuela
4) Franco Colombo, Tony López vs Escorpión I, Escorpión II
5) Black Shadow, José Luis Mendieta vs Bruno Victoria, Karloff Lagarde
6) Cachorro Mendoza vs Adorable Rubi

Halcon (SAT) 02/18/1978 Unidad Deportiva de Acapulco, Acapulco, Guerrero [Halcon 299]
1) Mario el Exotico, Rokambole b Destino Negro, Mario el Exotico
2) Dorrel Dixon b Renato Torres
3) el Signo, Lobo Rubio, Villano III b Black Man, Brazo de Oro, Halcón 78
## debut of Halcon 78
4) Ray Mendoza, Villano I, Villano II DQ América Salvaje, Bello Greco, Sergio el Hermoso
5) Anibal, El Solitario, Gran Hamada DQ Cesar Valentino, Dr. Wagner, Temojin el Mongol
&& 42,000 pesos

indy (SAT) 02/18/1978 Arena Coliseo Acapulco, Acapulco, Guerrero [Halcon 299]
1) El Guerrero, Heroes vs Aristos, El Gallegero
2) Black Tiger vs El Cursos
3) Flama Azul, Lizmark vs Américo Rocca, Tupamaro
4) Blue Demon, Mano Negra vs Fishman, Perro Aguayo

indy (SAT) 02/18/1978 Arena Nueva Atzacoalco, Gustavo A. Madero, Distrito Federal [Box Y Lucha 1332]
1) Tony Ledesma vs Sergio Aragon
2) Anfibio vs Mr. Raff, Joe Ramírez, La Furia, Espectro I, Ciclón Tabasqueno, El Delfin I, Juan Colorado [ANA LH]
3) Halcón Dorado I, Halcón Dorado II vs Mr. Bronce, Rey Cóndor [relevos suicidas]

indy (SAT) 02/18/1978 Arena Xochimilco, Xochimilco, Distrito Federal [Box Y Lucha 1332]
1) El Egipcio vs Mr. Lancer
2) Rafael Salamanca vs El Nómada
3) El Vengador, Sergio Borrayo vs Leo López, Rizado Ruiz
4) El Cobarde, Pierre Gayne vs Gemelo Diablo I, Gemelo Diablo II

indy (SAT) 02/18/1978 Nueva Arena Apatlaco, Iztapalapa, Distrito Federal [Box Y Lucha 1332]
1) Bull Santana vs Chacal de la Rosa
2) El Vagabundo, Fantastic vs Máquina Infernal, Texano
3) Bengala I, Kung Fu vs Hermano Muerte I, Hermano Muerte II
4) Raúl Reyes, Rayo de Jalisco, Ultraman vs Ángel Blanco, Karos, Negro Navarro

EMLL (SUN) 02/19/1978 Arena Coliseo [Box Y Lucha 1332, http://wrestlingclassics.com/cgi-bin/.ubbcgi/ultimatebb.cgi?ubb=get_topic&f=10&t=004698 Matt Farmer]
1) Agente X vs El Nómada
2) Scaramouche vs Rafael Salamanca
3) Índio Vitela vs Manuel Robles
4) Demonio Blanco, El Reo vs El Imposter, El Vengador
5) Alfonso Dantes, Fishman, Perro Aguayo vs Blue Demon, El Cobarde, Tigre Colombiano

EMLL (SUN) 02/19/1978 Arena Coliseo Guadalajara [El Informador 1978-02-19]
1) ? vs ??
2) ? vs ??
3) ? vs ??
4) Máscara Año 2000, Siglo XX vs El Ídolo, Terremoto
5) El Faraón, Pierre Gagne, Raúl Mata vs Adorable Rubi, Gran Markus, Herodes

indy (SUN) 02/19/1978 Arena San Juan Pantitlan, Ciudad Nezahualcóyotl, Estado de México [Box Y Lucha 1332]
1) Chacal II vs El Peregrino
2) Al Suarez vs Chivo Martinez
3) El Venterinario, Piloto Mortal vs El Dinámico, Estrella Del Sur
4) Soberbio I, Soberbio II vs El Polaco, Kuroneko
5) José Torres, Mazambula vs El Marques, Misterio Blanco I

indy (SUN) 02/19/1978 Ciudad Juárez, Chihuahua [Halcon 347]
1) Canek  (c) b Dos Caras [MEX LH]
2) Flama Roja b Tony Reyna [hair]

indy (SUN) 02/19/1978 Plaza de Toros Valente Arellano, Torreón, Coahuila [El Siglo de Torreon 1978-02-19]
1) ? vs ??
2) Loco Díaz vs Rayito Sanchez
3) Eric el Rojo vs Mario Saucedo
4) Espanto III, King Kong, Star Águilar vs El Trueno, La Sombra, Temoc Torres
5) As Charro, Dr. Galaxia vs Charro Mendoza, Cien Caras

indy (SUN) 02/19/1978 unknown state [Halcon 347]
1) el Signo  (c) b Black Man [UWA LIGHT]

MORA (SUN) 02/19/1978 Toreo de Cuatro Caminos, Naucalpan, Estado de México [Box Y Lucha 1332, luchablog photolog (2013-09-17 17.34.26), Matt Farmer]
1) Texano vs Anebyer
2) Black Star, Nakamura vs Frankenstein, Scorpió
3) Gallo Tapado b Ray Saul [mask]
## Rey Saul is Saul Lopez Salinas, from Veracruz
4) Cesar Valentino, Villano III vs Huracán Ramírez, Ultraman
5) Tinieblas, TNT vs Gran Hamada, Temojin el Mongol

indy (MON) 02/20/1978 San Pedro, Puebla, Puebla [Halcon 299]
1) Boiler vs Tigre [hair]
2) Gran Hamada vs El Matematico

indy (MON) 02/20/1978 Tampico, Tamaulipas [Halcon 347]
1) Astro Rey b Infierno II [mask]

EMLL (TUE) 02/21/1978 Arena Coliseo Guadalajara [El Informador 1978-02-21]
1) ? vs ??
2) ? vs ??
3) ? vs ??
4) Cesar Curiel, Pierre Gagne, Riki Romero vs Águila India, Herodes, Sangre India
5) El Faraón, Raúl Mata vs Adorable Rubi, Gran Markus

indy (TUE) 02/21/1978 Arena Aficion [Halcon 299]
1) Ray Mendoza, Temojin el Mongol, Villano III vs El Solitario, Gran Hamada, Huracán Ramírez
2) Dr. Wagner, El Solitario vs Canek, Cesar Valentino
## just listed as Ola Blanca, guessing which two

indy (TUE) 02/21/1978 Cuautitlán, Estado de México [Halcon 347]
1) Cesar Valentino  (c) b Villano III [UWA JLH]
2) Máscara Roja b Anfibius [mask]
3) Tawa Vera b Texano [hair]

indy (WED) 02/22/1978 Arena Naucalpan [Halcon 299, Halcon 347]
1) Danny Boy b Polar
2) Kuroneko b Javier Llanes
3) Villano I, Villano II b Dick Angelo, Negro Navarro
## great match
4) Dory Dixon, Gran Hamada, Huracán Ramírez DQ Ángel Blanco, Black Terror, Gorila Flores Sr.
## Debut of Black Terror
5) Anibal  (c) DQ Cesar Valentino [UWA MIDDLE]

indy (WED) 02/22/1978 Arena Xochimilco, Xochimilco, Distrito Federal
1) Tigre Colombiano, Tony Salazar vs El Nazi, Sangre Chicana

indy (WED) 02/22/1978 Veracruz, Veracruz [Halcon 347]
1) Solar I  (c) b Villano III [UWA WELTER]

indy (THU) 02/23/1978 Arena Isabel, Cuernavaca, Morelos
1) Black Shadow, Blue Demon, Tigre Colombiano vs Alfonso Dantes, El Nazi, Perro Aguayo

indy (THU) 02/23/1978 Distrito Federal [Halcon 347]
1) Tawa Vera b Verdugo Negro [hair]

EMLL (FRI) 02/24/1978 Arena México [http://wrestlingclassics.com/cgi-bin/.ubbcgi/ultimatebb.cgi?ubb=get_topic&f=10&t=004698 Matt Farmer]
1) El Faraón, Mil Máscaras b Alfonso Dantes, Gran Markus

EMLL (SUN) 02/26/1978 Arena Coliseo Guadalajara [El Informador 1978-02-26]
1) ? vs ??
2) ? vs ??
3) ? vs ??
4) Mario Alcala, Riki Romero vs Índio Salvaje I, Índio Salvaje II
5) El Faraón, Pierre Gagne, Raúl Mata vs Alfonso Dantes, Gran Markus, Herodes

indy (SUN) 02/26/1978 Plaza de Toros Valente Arellano, Torreón, Coahuila [El Siglo de Torreon 1978-02-26]
1) ? vs ??
2) Rayito Sanchez vs Eric el Rojo
3) La Sombra, Mario Saucedo vs Espanto III, Sagitario
4) El Trueno, Mr. Niebla, Temoc Torres vs King Kong, Li-Chang, Star Águilar
5) Cachorro Mendoza vs Dr. Galaxia [super libre]

MORA (SUN) 02/26/1978 Toreo de Cuatro Caminos, Naucalpan, Estado de México [Halcon 300, Matt Farmer]
1) Tigre Hispano vs Kuroneko
2) Alberto Muñoz, Halcón 78 vs América Salvaje, Baby Sharon
## Halcon debut.
3) Babe Face, Scorpió, Villano III vs Gran Hamada, Solar I, Ultraman
4) El Solitario  (c) vs Cesar Valentino [UWA LH]
5) Temojin el Mongol vs TNT

Ring 2000 (SUN) 02/26/1978 Gimnasio Nacional Teodoro Palacios Flores, Guatemala City, Guatemala
1) ? vs ??
2) ? vs ??
3) ? vs ??
4) Rayo Chapin vs Thunderson [mask]
## Rayo Chapin almost definitely won

EMLL (TUE) 02/28/1978 Arena Coliseo Guadalajara [El Informador 1978-02-28]
1) El Faraón, Máscara Año 2000 vs El Ídolo, Gran Markus and Pierre Gagne, Siglo XX and Alfonso Dantes, Terremoto and Cesar Curiel, Cinta Negra and Calavera II, Herodes and El Caudillo, Raúl Mata and Calavera I, Sangre India [torneo]

indy (WED) 03/01/1978 Arena Naucalpan [Halcon 300]
1) Roberto Paz vs Estrella Del Sur
2) Chamaco Escobedo vs Escorpión Negro
3) Arturo Cruz, Javier Llanes vs Kuroneko, Negro Navarro
4) Black Terror, Dick Angelo vs Tarasco I, Tarasco II
5) Villano I, Villano II, Villano III vs Gran Hamada, Huracán Ramírez, Saeta Azteca

indy (SAT) 03/04/1978 Distrito Federal [Halcon 347]
1) Javier Llanes  (c) b Kahoz [DF LH]

EMLL (SUN) 03/05/1978 Arena Coliseo [http://superluchas.com/2015/03/05/en-un-dia-como-hoy-1978-temojin-el-mongol-y-ray-mendoza-vs-el-solitario-y-tnt-los-exoticos-vencen-a-los-villanos/ SuperLuchas]
1) Cien Caras, Enrique Vera, Mano Negra b Adorable Rubi, Divino Roy, El Nazi

EMLL (SUN) 03/05/1978 Arena Coliseo Guadalajara [El Informador 1978-03-05]
1) ? vs ??
2) ? vs ??
3) ? vs ??
4) El Monarca, Pierre Gagne vs Demonio Blanco, Sangre Chicana
5) El Faraón, Raúl Mata vs Alfonso Dantes, Gran Markus [super libre]

EMLL (SUN) 03/05/1978 Pista Arena Revolución [http://superluchas.com/2015/03/05/en-un-dia-como-hoy-1978-temojin-el-mongol-y-ray-mendoza-vs-el-solitario-y-tnt-los-exoticos-vencen-a-los-villanos/ SuperLuchas]
1) Fishman, Karloff Lagarde b Black Shadow, Kung Fu

indy (SUN) 03/05/1978 Arena Aficion [http://superluchas.com/2015/03/05/en-un-dia-como-hoy-1978-temojin-el-mongol-y-ray-mendoza-vs-el-solitario-y-tnt-los-exoticos-vencen-a-los-villanos/ SuperLuchas]
1) Chabela Romera, Chela Salazar, Samanta vs Katy Mendoza, Pantera Sureña, Vicky Carranza
2) El Santo, Solar I vs Babe Face, El Tiburón

indy (SUN) 03/05/1978 Auditorio Municipal, Ciudad Juárez, Chihuahua [http://superluchas.com/2015/03/05/en-un-dia-como-hoy-1978-temojin-el-mongol-y-ray-mendoza-vs-el-solitario-y-tnt-los-exoticos-vencen-a-los-villanos/ SuperLuchas]
1) La Serpiente Azul, Serpiente Blanca b Costeño, Pepe Galindo
2) Black Terry, Dorado Hernández b Huichol Tapatío, Judas Monterrosa
## Huichol Tapatio is the future Zandokan
3) Flama Azul, Índio Medina, Lobo Rubio b El Matematico, el Signo, Ultraman

indy (SUN) 03/05/1978 Monterrey, Nuevo León [Halcon 347]
1) Ciclón Veloz, Cuauhtémoc Torres b Gemelo Diablo I, Gemelo Diablo II  (c) [NORTE TAG]

indy (SUN) 03/05/1978 Plaza de Toros Valente Arellano, Torreón, Coahuila [El Siglo de Torreon 1978-03-05]
1) ? vs ??
2) ? vs ??
3) Elektron, Star Águilar vs La Sombra, Mario Saucedo
4) King Kong vs El Trueno [mask]
5) Fiera Valenzuela, Li-Chang vs Eduardo De Linch, Kato Kung Lee

indy (SUN) 03/05/1978 Toluca, Estado de México [Halcon 347]
1) El Toluco b El Capitán [hair]

MORA (SUN) 03/05/1978 Toreo de Cuatro Caminos, Naucalpan, Estado de México [http://superluchas.com/2015/03/05/en-un-dia-como-hoy-1978-temojin-el-mongol-y-ray-mendoza-vs-el-solitario-y-tnt-los-exoticos-vencen-a-los-villanos/ SuperLuchas]
1) Enfermero Jr. b Chamaco Escobedo
## Chamaco Escobedo is the future Robin
2) Estrella Blanca b El Polaco
3) Gran Hamada, Halcón 78 b América Salvaje, Septiembre Negro
4) Baby Sharon, Bello Greco, Sergio el Hermoso b Villano I, Villano II, Villano III
5) Ray Mendoza, Temojin el Mongol b El Solitario, TNT

indy (MON) 03/06/1978 Tampico, Tamaulipas [Halcon 347]
1) Astro Rey b El Infierno [hair]

EMLL (TUE) 03/07/1978 Arena Coliseo
1) Blue Demon, Tony Salazar vs Enrique Vera, Tigre Colombiano and Flama Azul, Rafael Salamanca and Chamaco Ortiz, Franco Colombo and Bruno Victoria, Fishman and Karloff Lagarde, Tauro and Rizado Ruiz, Rodolfo Ruiz and Américo Rocca, Tauro [torneo]

EMLL (TUE) 03/07/1978 Arena Coliseo Guadalajara [El Informador 1978-03-07]
1) ? vs ??
2) ? vs ??
3) ? vs ??
4) El Monarca, Siglo XX vs Demonio Blanco, Sangre India
5) El Faraón, Pierre Gagne, Raúl Mata vs Alfonso Dantes, Gran Markus, Sangre Chicana

indy (WED) 03/08/1978 Distrito Federal [Halcon 347]
1) Javier Llanes  (c) b Kuroneko [DF LH]

EMLL (FRI) 03/10/1978 Arena México [https://twitter.com/ostpies/status/1372683715109744641 @ostpies, Arena 1021]
1) Rizado Ruiz b Vengador
2) Tigre Colombiano DQ El Reo
3) Cachorro Mendoza, Kung Fu b As Charro, Sangre Chicana
## sets up Mendoza/Chicana
4) Blue Demon, Pierre Gagne b Adorable Rubi, Fishman
## Tencicos took 1/3.
5) Alfonso Dantes, Carlos Plata, Perro Aguayo b El Faraón, Mano Negra, Ringo Mendoza
## straight falls (first by DQ), sets up Plata/Mendoza

indy (FRI) 03/10/1978 Tuxtla Gutiérrez, Chiapas [Halcon 347]
1) Mil Máscaras  (c) b Temojin el Mongol [IWA Heavy]

indy (SAT) 03/11/1978 Distrito Federal [Halcon 347]
1) Ciclón Tabasqueno b Anfibio [mask]
## No real name given for Anfibio

indy (SAT) 03/11/1978 Puebla, Puebla [Halcon 347]
1) Alfonso Dantes  (c) b El Faraón [NWA LH]

EMLL (SUN) 03/12/1978 Arena Coliseo Guadalajara [El Informador 1978-03-12, Halcon 347]
1) ? vs ??
2) ? vs ??
3) ? vs ??
4) El Faraón, Tony Salazar vs El Nazi, Sangre Chicana
5) Raúl Mata  (c) b Gran Markus [MEX HEAVY]

indy (SUN) 03/12/1978 Acapulco, Guerrero [Halcon 347]
1) Chanoc, El Centauro  (c) b Heros, Lizmark [Guerrero TAG]

indy (SUN) 03/12/1978 Guadalajara, Jalisco [Halcon 347]
1) Gran Charly, Rudy Mora b Linterna Verde, Tarantula [mask]
## Linterna Verde is Ernesto Hernandez, Tarantula is Jesus Hernandez)

indy (SUN) 03/12/1978 Plaza de Toros el Progreso, Guadalajara, Jalisco [El Informador 1978-03-12]
1) ? vs ??
2) ? vs ??
3) Alberto Cortes, Mascare vs Frank Tejeda, Pedro Anguiano
4) Enfermero I, Enfermero II vs Bobby Lee, Martin Escobedo
5) América Salvaje, Frankenstein, Temojin el Mongol vs Halcón 78, Septiembre Negro, TNT

indy (SUN) 03/12/1978 Plaza de Toros Valente Arellano, Torreón, Coahuila [El Siglo de Torreon 1978-03-12]
1) ? vs ??
2) Centella Azul vs El Fraterno
3) Mario Saucedo, Rayito Sanchez vs Loco Díaz, Pantera Blanca
4) La Sombra, Rudy Palma vs Star Águilar, The King
5) Cien Caras, Eduardo De Linch vs Herodes, Li-Chang

indy (SUN) 03/12/1978 Puebla, Puebla [Halcon 347]
1) Estrella Blanca b Barba Negra [hair]

indy (MON) 03/13/1978 Cancha San Pedro, Puebla, Puebla [Combates 127]
1) Estrella Blanca b Barba Negra [mask, hair]

indy (MON) 03/13/1978 Puerto Vallarta, Jalisco [Halcon 347]
1) El Monje Loco b El Fantasma [mask]
## Fantasma is Francisco Fuentes Garcia

EMLL (TUE) 03/14/1978 Arena Coliseo [Box Y Lucha 1327, http://wrestlingclassics.com/cgi-bin/.ubbcgi/ultimatebb.cgi?ubb=get_topic&f=10&t=004698 Matt Farmer]
1) Tommy Nava DQ Diogenes
2) Joe Marino b El Doberman
3) Impacto b Zebra Kid
4) El Invasor b Rafael Salamanca
5) Dr. O’Borman, Manuel Robles, Rizado Ruiz DRAW Flama Azul, Franco Colombo, José Luis Mendieta
## Ruiz & Mendieta went to a double pin. Neither side was happy and the tecnicos ounmasked Oborman after the amtch.
6) Blue Demon, Cachorro Mendoza b Fishman, Karloff Lagarde

EMLL (TUE) 03/14/1978 Arena Coliseo Guadalajara [El Informador 1978-03-14]
1) ? vs ??
2) ? vs ??
3) ? vs ??
4) Cinta Negra, Riki Romero vs Calavera I, Calavera II
5) El Faraón, El Monarca, Tony Salazar vs Demonio Blanco, El Nazi, Sangre Chicana

EMLL (FRI) 03/17/1978 Arena México [Arena 1021, Box Y Lucha 1327, http://wrestlingclassics.com/cgi-bin/.ubbcgi/ultimatebb.cgi?ubb=get_topic&f=10&t=004698 Matt Farmer]
1) José Luis Mendieta b Demonio Blanco
2) ?, El Cobarde DQ Gemelo Diablo I, Gemelo Diablo II
## foul to Cobrade in the second fall. No mention of his partner.
3) Sangre Chicana  (c) b Cachorro Mendoza [MEX MIDDLE]
## Chicano took 2/3
4) Tigre Colombiano b El Reo [hair]
5) Alfonso Dantes, Fishman, Gran Markus b Cien Caras, El Faraón, Mano Negra
## Dantes & Faraon feuded
6) Ringo Mendoza  (c) b Carlos Plata [NWA MIDDLE]
## Mendoza took 2/3.
&& previously listed as 03/24, Arena 1021 has the correct date

indy (FRI) 03/17/1978 Puebla, Puebla [Halcon 347]
1) Villano II b Gorila Osorio [hair]

EMLL (SAT) 03/18/1978 Arena Xochimilco, Xochimilco, Distrito Federal [https://twitter.com/ostpies/status/1372683715109744641 @ostpies, Arena 1021]
1) Agente X vs Scaramouche
2) Chamaco Ortiz vs El Nómada
3) Divino Roy, Leo López vs El Cobarde, Impostor
4) Alfonso Dantes, Sangre Chicana vs El Faraón, Pierre Gagne

EMLL (SAT) 03/18/1978 Pista Arena Revolución [Arena 1021, Box Y Lucha 1327, Halcon 347]
1) Impacto b Gran Davis
2) Raúl Armas b Rafael Salamanca
3) Adorable Rubi, Bruno Victoria, Karloff Lagarde b Blue Demon, Kato Kung Lee, Tony Salazar
4) Tony López, Vengador DQ Américo Rocca, Huroki Sito
5) Flama Azul b Mario Valenzuela [hair]
## Azul took 2/3 to keep his mask
6) Raúl Mata  (c) b Herodes [MEX HEAVY]
## Mata weighed in at 100 KG, Herodes at 110. Mata took 2/3, getting Herodes in a tapatia in the third.

indy (SAT) 03/18/1978 Arena Zapata, Cuautla, Morelos [https://twitter.com/ostpies/status/1372683715109744641 @ostpies, Arena 1021]
1) Dr. Wagner, El Tupamaro vs Astro Rey, El Marques and Baby Sharon, Escorpión Negro and Gallo Tapado, Potro Salvaje and Bull Santana, Fantastic and Arturo Cruz, El Socio and Misterio Blanco I, Saeta Del Ring and ?, El Aparecido

indy (SAT) 03/18/1978 Irapuato, Guanajuato [Halcon 347]
1) Rudy Valentino b Dick Angelo [hair]

indy (SAT) 03/18/1978 Nueva Atzacoalco, Gustavo A. Madero, Distrito Federal [Halcon 347]
1) El Peregrino vs Asesino S.
2) Panama Panther vs Juan Colorado
3) El Catedrático, El Matematico b Villano I, Villano II  (c) [EdM TAG]
4) Anfibio, Anibal vs Barba Negra, Septiembre Negro

Mora (SAT) 03/18/1978 Arena Apatlaco, Iztapalapa, Distrito Federal [https://twitter.com/ostpies/status/1372683715109744641 @ostpies, Arena 1021]
1) Estrella Del Sur vs Destino Negro
2) La Furia, Rey Saúl vs Enfermero I, Enfermero Jr.
3) Audaz, Black Man vs el Signo, Lobo Rubio

EMLL (SUN) 03/19/1978 Arena Coliseo [Arena 1021]
1) Roy Lancer vs Doberman
2) Mr. Steel vs Rodolfo Ruiz
3) Franco Colombo vs Leo López
4) Impostor, Índio Vitela vs Divino Roy, Manuel Robles
5) El Faraón, Enrique Vera, Tony Salazar vs Adorable Rubi, Gemelo Diablo I, Gemelo Diablo II

EMLL (SUN) 03/19/1978 Arena Coliseo Guadalajara [El Informador 1978-03-19]
1) ? vs ??
2) ? vs ??
3) ? vs ??
4) Ciclón Veloz, El Vengador vs El Ídolo, Sangre India
5) Cachorro Mendoza, El Monarca, Ringo Mendoza vs Carlos Plata, Perro Aguayo, Sangre Chicana

EMLL (SUN) 03/19/1978 Pista Arena Revolución [Arena 1021]
1) El Invasor vs Satánico, El Nómada, Bufalo Salvaje, Scaramouche, Agente X, Mr. Lancer, Kalimaco
2) Sergio Borrayo, Talismán vs El Reo, Tauro
3) Black Shadow, Kung Fu vs Demonio Blanco, Fishman

indy (SUN) 03/19/1978 Arena Naucalpan [Combates 127]
1) Enfermero I, Enfermero II, Javier Llanes b Enfermero I, Enfermero II, Javier Llanes
2) Dory Dixon, Hombre Nuclear, Saeta Azteca DQ Ángel Blanco, Gorilla Flores, José Torres

indy (SUN) 03/19/1978 Arena San Juan Pantitlan, Ciudad Nezahualcóyotl, Estado de México [https://twitter.com/ostpies/status/1372683715109744641 @ostpies, Arena 1021]
1) Pequeño Gigante vs El Chacal
2) El Aparecido vs ?
3) Barba Negra, Gran Comanche vs Misterio Blanco I, Saeta Del Ring
4) El Marques, Potro Salvaje vs Escorpión Negro, Fantastic
5) Cesar Valentino, José Torres vs Astro Rey, Gallo Tapado

indy (SUN) 03/19/1978 Plaza de Toros el Cortijo, Venustiano Carranza, Distrito Federal [Arena 1021, Halcon 347]
1) El Centinela vs El Moro
2) Súper Flash vs Chacal de la Rosa
3) Javier Llanes  (c) b El Veterinario [DF LH]
3) Carnicero García, Índio Rodríguez vs Potro Salvaje, Raúl Guerrero
4) Anibal, Astro Rey, Ultraman vs Cesar Valentino, Enfermero, Villano III

indy (SUN) 03/19/1978 Plaza de Toros el Progreso, Guadalajara, Jalisco [El Informador 1978-03-19, Halcon 347]
1) ? vs ??
2) ? vs ??
3) Halcón 78, Huracán Ramírez vs Máscara Roja, Renato Torres
4) América Salvaje b Martin Escobedo [mask, hair]
5) Temojin el Mongol vs TNT [money]
## 30000 Mexican pesos vs 30000 Mexican Pesos

indy (SUN) 03/19/1978 Plaza de Toros Valente Arellano, Torreón, Coahuila [El Siglo de Torreon 1978-03-19]
1) ? vs ??
2) ? vs ??
3) Pantera Blanca vs Mario Saucedo
4) Star Águilar, The King, Tony Venetto vs La Sombra, Rudy Palma, Temoc Torres
5) Gran Markus, Li-Chang vs Cien Caras, Eduardo De Linch

indy (SUN) 03/19/1978 Poza Rica, Veracruz [Halcon 347]
1) Irma González  (c) b Estela Molina [MEX WOMEN]
2) El Vagabundo vs Pistolero [mask]
## Pistolero is Mario Fernandez

Mora (SUN) 03/19/1978 Arena Azteca, Calz. Tulyehualco, Iztapalapa, Distrito Federal [https://twitter.com/ostpies/status/1372683715109744641 @ostpies, Arena 1021]
1) Samy Cuevas vs Bello Fantanelli
2) Fantasmon vs Súper Flash
3) Raúl Santana, Trébol De Plata vs Ramiro García, Satán
4) Bengala, Fantastic vs Mr. Bronce, Mr. Cobra
5) Dos Caras, El Impacto, Raúl Reyes vs Kaos, Máquina Infernal, Negro Navarro

MORA (SUN) 03/19/1978 Toreo de Cuatro Caminos, Naucalpan, Estado de México [Arena 1021, Box Y Lucha 1327, Combates 127, Matt Farmer]
1) Babe Face, Scorpió b Bello Greco, Sergio el Hermoso
2) Ángel Blanco, Dr. Wagner, Septiembre Negro b Dos Caras, Solar I, Tinieblas
3) el Signo  (c) b El Matematico [UWA LIGHT]
## Matematico 72 kg, Signo 76 kg (which the magazine believes is over the limit) Signo took 2/3 in about 30 minute match.
4) Villano I b Baby Sharon [hair]
## Villano I saved his mask.
5) El Solitario  (c) b Ray Mendoza [UWA LH]
## Mendoza weighed in at 90.2K, Solitario at 89KG. Mendoza took fall one in 8 minutes, Solitario too 2 in five, then trapped Mendoza to win the final fall in 11 minutes. Said to be the 15th defense

indy (MON) 03/20/1978 Ciudad Juárez, Chihuahua [Halcon 347]
1) Flama Roja b Fireman [mask]
## Fireman is Antonio Alcantara
2) Índio Medina b Black Terry [hair]

EMLL (TUE) 03/21/1978 Arena Coliseo Guadalajara [El Informador 1978-03-21]
1) ? vs ??
2) ? vs ??
3) ? vs ??
4) El Monarca, El Vengador vs Índio Salvaje I, Índio Salvaje II
5) Cachorro Mendoza, Ciclón Veloz, Ringo Mendoza vs Carlos Plata, Sangre Chicana, Terremoto

indy (TUE) 03/21/1978 Cuautitlán, Estado de México [Halcon 347]
1) Estrella Blanca b Súper Libre [mask]
## Super libre is Francisco P.

indy (TUE) 03/21/1978 Gimnasio Municipal Lic. Benito Juárez, Cuautitlán, Estado de México [Combates 127]
1) Negro Navarro b Tawa Vera  (c) [ABJ WELTER]

indy (WED) 03/22/1978 Veracruz [Halcon 347]
1) Sombra de Plata I, Sombra De Plata II b Muerte De La Barranca III, Veneno [mask]
## Veneno is Yayo Valentino & Muerte de la Barranca III is Jose Luis Huertas

Mora (WED) 03/22/1978 Arena San Juan Pantitlan, Ciudad Nezahualcóyotl, Estado de México [https://twitter.com/ostpies/status/1372683715109744641 @ostpies, Arena 1021]
1) Ciclón Moreno vs Jack Veloz
2) Arturo Cruz vs Gran Comanche
3) El Polaco vs Ráfaga Moreno
4) Baby Sharon, Septiembre Negro vs Astro Rey, El Vagabundo
5) Alberto Muñoz, Estrella Blanca, Gran Hamada vs Ray Mendoza, Scorpió, Villano III

EMLL (SUN) 03/26/1978 Arena Coliseo Guadalajara [El Informador 1978-03-26]
1) ? vs ??
2) ? vs ??
3) ? vs ??
4) Ciclón Veloz, El Vengador vs Demonio Blanco, Terremoto
5) El Monarca, Pierre Gagne, Ringo Mendoza vs Gemelo Diablo I, Gemelo Diablo II, Perro Aguayo

indy (SUN) 03/26/1978 Arena Naucalpan [Combates 127]
1) Audaz, Marques, Saeta Azteca vs Cacique Mara, Ray Mendoza, Tupamaro
2) Audaz vs Ray Mendoza

indy (SUN) 03/26/1978 Cuernavaca, Morelos [Halcon 347]
1) Memo Santana b El Espía [hair]

indy (SUN) 03/26/1978 Pachuca, Hidalgo [Halcon 347]
1) Solar I  (c) b el Signo [UWA WELTER]

indy (SUN) 03/26/1978 Plaza de Toros el Progreso, Guadalajara, Jalisco [Combates 127]
1) Halcón 78 vs Renato Torres [hair, mask]
2) Martin Escobedo vs American Salvaje [hair]

indy (SUN) 03/26/1978 Plaza de Toros Valente Arellano, Torreón, Coahuila [El Siglo de Torreon 1978-03-26]
1) Joe Marquina vs Carnicerito
2) Centella Azul vs Guapo Ibarra
3) Jhonny Carrillo, Rayito Sanchez vs El Fraterno, Eric el Rojo
4) La Sombra, Rudy Palma vs Espanto III, Star Águilar
5) Raúl Mata, Tigre Colombiano vs El Nazi, Gran Markus

indy (SUN) 03/26/1978 Tulyehualco, Distrito Federal [Halcon 347]
1) Impacto  (c) b Negro Navarro [DF Middle]

EMLL (TUE) 03/28/1978 Arena Coliseo [http://wrestlingclassics.com/cgi-bin/.ubbcgi/ultimatebb.cgi?ubb=get_topic&f=10&t=004698 Matt Farmer]
1) Diogenes vs El Doberman
2) Gran Davis vs Tommy Nava
3) Mr. Lancer vs El Invasor
4) Huroki Sito, Satánico vs Mr. Steel, Rafael Salamanca
5) Franco Colombo, Índio Vitela vs Dr. O’Borman, Manuel Robles
6) Fishman, Karloff Lagarde vs Kato Kung Lee, Tony Salazar
7) Chacal de la Rosa vs Titanic

EMLL (TUE) 03/28/1978 Arena Coliseo Guadalajara [El Informador 1978-03-28]
1) ? vs ??
2) ? vs ??
3) ? vs ??
4) El Monarca, Máscara Año 2000, Pierre Gagne vs Calavera I, Calavera II, Demonio Blanco
5) Ciclón Veloz, Ringo Mendoza vs Gemelo Diablo I, Gemelo Diablo II

indy (TUE) 03/28/1978 Arena Nueva Atzacoalco, Gustavo A. Madero, Distrito Federal [Box Y Lucha 1327]
1) Pequeño Gigante, Pequeño Gladiador vs Conde Murciélago II, Destructor Nazi I
2) Arturo Gaona, Bull Santana vs Conde Murciélago, El Galante
3) Rokambole, Tamba vs Comanche, El Delfin I
4) Ciclón Moreno, El Marques, Ultraman vs La Furia, Mazambula, Tony Arce

indy (TUE) 03/28/1978 Cuautitlán, Estado de México [Halcon 347]
1) Tawa Vera b Negro Navarro [hair]

indy (TUE) 03/28/1978 Gimnasio Ajusco, Coyoacán, Distrito Federal [Box Y Lucha 1327]
1) Joe Marino vs Roy Lancer
2) Chamaco Ortiz vs El Nómada
3) El Impostor, Talismán vs Rizado Ruiz, Rodolfo Ruiz
4) Bruno Victoria, Carlos Plata vs Black Shadow, Cachorro Mendoza

indy (TUE) 03/28/1978 Gimnasio Municipal Lic. Benito Juárez, Cuautitlán, Estado de México [Combates 127]
1) José Torres, TNT vs Judas, Ray Mendoza
2) Negro Navarro vs Tawa Vera [hair]

indy (WED) 03/29/1978 Arena Coliseo Acapulco, Acapulco, Guerrero [Box Y Lucha 1327, Halcon 347]
1) Flama Azul vs Chanoc
2) El Sureño vs El Guerrero
3) El Faraón, Kung Fu, Lizmark vs Carlos Plata, Fishman, Karloff Lagarde
4) Enrique Vera vs Gurkan [hair]
5) Ringo Mendoza  (c) b Sangre Chicana [NWA MIDDLE]

indy (WED) 03/29/1978 Arena San Juan Pantitlan, Ciudad Nezahualcóyotl, Estado de México [Box Y Lucha 1327]
1) Ángel o Demonio vs Ico
2) Lancero I vs Lancero II, Rayo Dorado I, Rayo Dorado II, Ariman, El Dinámico, Al Suarez, El Aparecido, Símbolo Rojo, Chucho Conde I, Chucho Conde II, Fantasma Del Bajio

indy (WED) 03/29/1978 Arena Xochimilco, Xochimilco, Distrito Federal [Box Y Lucha 1327]
1) Fantasmon vs Chacal de la Rosa
2) Bengala, Impacto vs Mr. Bronce, Mr. Cobra
3) Catedrático, El Matematico vs Karos, Negro Navarro
4) Raúl Santana vs Romano García
5) Brazo de Oro, Rayo de Jalisco vs el Signo, Lobo Rubio

indy (WED) 03/29/1978 Distrito Federal [Halcon 347]
1) Raúl Santana b Romano García [hair]

indy (THU) 03/30/1978 Arena Santa Maria Aztahuacan, Iztapalapa, Distrito Federal [Box Y Lucha 1327, Halcon 347]
1) Alas De Oro, Dragón Dorado vs Águila Venezolana, Saeta Poblana
2) Ciclón Moreno vs Fantasma Del Bajio
3) Villano I, Villano II vs Germano, Verdugo Negro
4) Arturo Cruz  (c) b Rokambole [DF LIGHT]
5) Mazambula, Ray Mendoza vs El Vagabundo, Fantastic

EMLL (FRI) 03/31/1978 Arena México [http://wrestlingclassics.com/cgi-bin/.ubbcgi/ultimatebb.cgi?ubb=get_topic&f=10&t=004698 Matt Farmer]
1) Raúl Armas vs Rafael Salamanca
2) Manuel Robles vs El Vengador
3) Enrique Vera, Pierre Gagne vs Demonio Blanco, Herodes
4) Adorable Rubi, Gran Markus, Sangre Chicana vs Cachorro Mendoza, Raúl Mata, Tigre Colombiano
5) Alfonso Dantes, Perro Aguayo vs El Faraón, Ringo Mendoza

indy (FRI) 03/31/1978 Auditorio Municipal, Jojutla, Morelos [Box Y Lucha 1327]
1) Ciclón Moreno vs Tony Arce
2) Rayo Dorado I, Rayo Dorado II vs Bárbaro Fonseca, Benny Castelo
3) Catedrático, Mr. Raff vs Comanche, Dr. Z
4) El Matematico, Tinieblas vs el Signo, Lobo Rubio

indy (FRI) 03/31/1978 Centro Social y Deportivo CONELEC, Puebla, Puebla [https://www.facebook.com/photo/?fbid=515297983439809&set=g.1063818623692271 Angel Luzbel Nezahualcoyotl]
1) Gallito De Oro vs El Tapatío
2) El Avispón, Simon Blanco vs El Buitre, Prof. Dante
3) Ángel Del Puebla, El Argel vs Mohicano I, Súper Libre
4) Gran Hamada, Spartaco vs El Dean, El Tupamaro

EMLL (SAT) 04/01/1978 Pista Arena Revolución [Box Y Lucha 1327]
1) Joe Marino vs Rolando Valentino
2) Mr. Lancer vs Bufalo Salvaje
3) Satánico vs El Invasor
4) Chamaco Ortiz vs Mario Valenzuela
5) Américo Rocca, Rizado Ruiz, Rodolfo Ruiz vs Flama Azul, Franco Colombo, José Luis Mendieta
6) Carlos Plata, Fishman vs Blue Demon, Mano Negra

indy (SAT) 04/01/1978 Arena Nueva Atzacoalco, Gustavo A. Madero, Distrito Federal [Box Y Lucha 1327]
1) Gory Velazquez vs El Asesino
2) Rudy Espinosa vs Mr. Bronce
3) Conde Azul, Espectro I vs Kuroneko, Tupamaro
4) El Mago, El Matematico, Gran Hamada vs el Signo, Lobo Rubio, Villano III

indy (SAT) 04/01/1978 Arena Xochimilco, Xochimilco, Distrito Federal [Box Y Lucha 1327]
1) Mr. Steel vs Rey Saúl
2) Huroki Sito vs Impacto
3) El Cobarde vs Leo López
4) El Faraón, El Monarca, Kato Kung Lee vs Adorable Rubi, Divino Roy, Fishman

indy (SAT) 04/01/1978 Arena Zapata, Cuautla, Morelos [Box Y Lucha 1327]
1) Búfalo Blanco vs Chacal II
2) Potro Salvaje vs Kenji Kaplin
3) Astro Rey vs Fantastic
4) Fili Estrella, Gulliver vs Gaby Da Silva, Gran Nikolai

indy (SAT) 04/01/1978 Nueva Arena Apatlaco, Iztapalapa, Distrito Federal [Box Y Lucha 1327]
1) Danny Boy vs Perro Sosa
2) Romano García vs Raúl Santana
3) Bengala, El Matematico vs Kaos, Tony Arce
4) Brazo de Oro, Dos Caras, Rayo de Jalisco vs el Signo, Lobo Rubio, Negro Navarro

EMLL (SUN) 04/02/1978 Arena Coliseo [http://wrestlingclassics.com/cgi-bin/.ubbcgi/ultimatebb.cgi?ubb=get_topic&f=10&t=004698 Matt Farmer]
1) Rey Saúl vs Mr. Lancer
2) Mr. Steel vs Roy Lancer
3) Índio Vitela, Sergio Borrayo vs Dr. O’Borman, Leo López
4) Cien Caras, El Monarca, Pierre Gagne vs Bruno Victoria, Demonio Blanco, El Reo
5) Carlos Plata vs El Faraón

EMLL (SUN) 04/02/1978 Arena Coliseo Guadalajara [El Informador 1978-04-02]
1) ? vs ??
2) ? vs ??
3) ? vs ??
4) José Luis Mendieta, Mario Alcala vs Calavera I, Calavera II
5) Cachorro Mendoza, Ciclón Veloz, Ringo Mendoza vs Gemelo Diablo I, Gemelo Diablo II, Perro Aguayo

EMLL (SUN) 04/02/1978 Pista Arena Revolución [Box Y Lucha 1327, Box Y Lucha 1329]
1) Tommy Nava vs El Maldito
2) El Nómada vs Gran Davis
3) Lizmark, Rafael Salamanca vs Huroki Sito, Manuel Robles
4) Karloff Lagarde, Sangre Chicana vs Kato Kung Lee, Tony Salazar
5) Talismán vs Tauro [hair]
6) Kung Fu b Fishman  (c) [MEX WELTER]
## Kung Fu recaptures the championship

indy (SUN) 04/02/1978 Arena Azteca, Calz. Tulyehualco, Iztapalapa, Distrito Federal [Halcon 347]
1) Chacal de la Rosa vs Titanic
2) El Catedrático vs Tony Arce
3) Cometa Azul I, Cometa Azul II vs Mr. Bronce, Mr. Cobra
4) Bull Santana b Perro Sosa [hair]
5) Mil Máscaras, Raúl Reyes vs Ángel Blanco, Dr. Wagner

indy (SUN) 04/02/1978 Arena San Fernando, Huixquilucan, Estado de México [Box Y Lucha 1327]
1) El Galgo, Molusco vs León Rodan X I, León Rodan X II
2) Mario González, Torrente I vs Asesino Negro, Dragón Verde
3) Benito Martinez vs Caballero Cruz
4) El Paracaidista vs Nebrasca

indy (SUN) 04/02/1978 Arena San Juan Pantitlan, Ciudad Nezahualcóyotl, Estado de México [Box Y Lucha 1327]
1) Pequeño Gigante vs Memo Arenas
2) Búfalo Blanco vs El Aparecido
3) Kenji Kaplin, Potro Salvaje vs El Maya, Fantastic
4) Astro Rey, El Marques vs Hermano Muerte I, Hermano Muerte II
5) Ray Mendoza vs Rayo de Jalisco

indy (SUN) 04/02/1978 Arena San Martha, Iztapalapa, Distrito Federal [Box Y Lucha 1327]
1) El Genunio vs Dany Martinez
2) Juanito Ramírez vs Gori Cortes
3) El Bendic vs Dragón Sangriento [super libre]
4) Ariman, La Serpiente, Terry Bolaños vs El Centinela, Germano, Rudy Espinosa
5) Ringo Medina vs Príncipe Uxmal [hair]

indy (SUN) 04/02/1978 Auditorio Municipal, Tapachula, Chiapas [https://twitter.com/ScottyAstro/status/1396885207358246912 Scotty Astro]
1) Pantera Negro vs Índio Salvaje
2) El Facinante vs Vendaor Negro
3) El Cardenal, Relámpago Gomez vs Tiburón Rojo, Wahiuca
4) Scorpió, Temojin el Mongol vs Bobby Lee, Tony López

indy (SUN) 04/02/1978 Ciudad Juárez, Chihuahua [Halcon 347]
1) El Solitario  (c) b Flama Roja [UWA LH]

indy (SUN) 04/02/1978 Ciudad Nezahualcóyotl, Estado de México [Halcon 347]
1) Rokambole b Arturo Cruz  (c) [NEZA TITLE]

indy (SUN) 04/02/1978 Plaza de Toros Valente Arellano, Torreón, Coahuila [El Siglo de Torreon 1978-04-02]
1) Ciclón Negro vs Guapo Ibarra
2) El Fraterno vs Loco Díaz
3) Rayito Sanchez vs Eric el Rojo
4) Apolo Estrada, El Trueno, Mario Saucedo vs Li-Chang, Star Águilar, The King
5) Raúl Mata, Tigre Colombiano vs El Nazi, Gran Markus [super libre]

indy (SUN) 04/02/1978 Puebla, Puebla [Halcon 347]
1) Mario Valenzuela  (c) b Flama Azul [MEX LIGHT]
2) Estela Molina b Charito Silva [hair]

MORA (SUN) 04/02/1978 Toreo de Cuatro Caminos, Naucalpan, Estado de México [Matt Farmer]
1) Ángel Blanco, Cesar Valentino, Dr. Wagner b Anibal, Gran Hamada, Tinieblas

indy (MON) 04/03/1978 Arena Tropicana, Tehuacán, Puebla [Box Y Lucha 1327]
1) Pantera Negra vs El Emperador
2) Toro Salvaje I vs El Académico I
3) Rey Gitano vs El Coralillo [hair]
4) Al Furia, El Tupamaro vs La Saeta Azteca, Tawa Vera

EMLL (TUE) 04/04/1978 Arena Coliseo [Box Y Lucha 1329, http://wrestlingclassics.com/cgi-bin/.ubbcgi/ultimatebb.cgi?ubb=get_topic&f=10&t=004698 Matt Farmer]
1) Rolando Valentino b Diogenes
2) Bufalo Salvaje b Mr. Lancer
3) Rafael Salamanca b El Nómada
4) Manuel Robles, Rizado Ruiz b El Vengador, Flama Azul
5) Carlos Plata, Karloff Lagarde b Black Shadow, Tony Salazar
## Karloff Lagarde's last match in Arena Coliseo
6) Dr. O’Borman b Franco Colombo [mask, hair]

EMLL (TUE) 04/04/1978 Arena Coliseo Guadalajara [El Informador 1978-04-04]
1) ? vs ??
2) ? vs ??
3) ? vs ??
4) Cachorro Mendoza, Ringo Mendoza vs Gemelo Diablo I, Gemelo Diablo II and Ciclón Veloz Jr., José Luis Mendieta and Sangre India, Terremoto

EMLL (FRI) 04/07/1978 Arena México [Box Y Lucha 1329, http://wrestlingclassics.com/cgi-bin/.ubbcgi/ultimatebb.cgi?ubb=get_topic&f=10&t=004698 Matt Farmer]
1) Tony López b Índio Vitela
2) Tony Salazar b Black Shadow
3) Mil Máscaras, Raúl Mata b Gran Markus, Perro Aguayo
4) Gemelo Diablo I, Gemelo Diablo II DQ Enrique Vera, Pierre Gagne
## Vera accidentally fouled one of the Diablos
5) Adorable Rubi b Tigre Colombiano [hair]
6) Sangre Chicana b Cachorro Mendoza [hair]
7) El Faraón b Alfonso Dantes  (c) [NWA LH]

indy (FRI) 04/07/1978 Tampico, Tamaulipas [Box Y Lucha 1329]
1) Impacto, Panama Panther b Diamante Negro, Ruben Rubio
2) Blue Demon, Chino Chow b Karloff Lagarde, Rizado Ruiz
## Chino Chow replaced Black Shadow (worked Arena Mexico instead)
3) Robot C-2, Robot C-3 b Halcón Dorado, Raúl Reyes
## debut of the Star Wars inspired Robots.

EMLL (SUN) 04/09/1978 Arena Coliseo [http://superluchas.com/2015/04/11/en-un-dia-como-hoy-1978-en-la-arena-coliseo-el-torneo-de-las-alternativas-la-ola-blanca-en-cuautitlan/ SuperLuchas]
1) Chamaco Ortiz, Kato Kung Lee b El Nómada, El Reo [Torneo de las Alternativas, quarterfinal]
2) El Nazi, Roy Lancer b El Cobarde, Mr. Lancer [Torneo de las Alternativas, quarterfinal]
## said to be best match of the night.
3) Black Shadow, Talismán b Demonio Blanco, El Invasor [Torneo de las Alternativas, quarterfinal]
4) El Monarca, Flama Azul b Fishman, Rey Saúl [Torneo de las Alternativas, quarterfinal]
5) El Nazi, Roy Lancer b Chamaco Ortiz, Kato Kung Lee [Torneo de las Alternativas, semifinal]
6) El Monarca, Flama Azul b Black Shadow, El Talismán [Torneo de las Alternativas, semifinal]
7) El Monarca, Flama Azul b El Nazi, Roy Lancer [Torneo de las Alternativas, final]
&& Torneo de las Alternativas, a Gran Alternativa predecessor

indy (SUN) 04/09/1978 Acapulco, Guerrero [Halcon 347]
1) Irma González  (c) b Chabela Romero [MEX WOMEN]

indy (SUN) 04/09/1978 Arena Coliseo Guadalajara [Box Y Lucha 1329, El Informador 1978-04-09, Halcon 347]
1) Perro Aguayo b Ringo Mendoza  (c) [NWA MIDDLE]
2) Cachorro Mendoza, Ciclón Veloz, Cien Caras vs Carlos Plata, El Ídolo, Sangre Chicana

indy (SUN) 04/09/1978 Gimnasio Municipal Lic. Benito Juárez, Cuautitlán, Estado de México [http://superluchas.com/2015/04/11/en-un-dia-como-hoy-1978-en-la-arena-coliseo-el-torneo-de-las-alternativas-la-ola-blanca-en-cuautitlan/ SuperLuchas]
1) Yayo Valentino b Mr. Cobra
2) Aquiles, El Polaco, El Vagabundo b Ave De La Muerte, Dick Angelo, Tonina Harris
3) Negro Navarro, Texano b Bengala, El Catedrático
4) Ángel Blanco, Cesar Valentino, Dr. Wagner b Bobby Lee, Dorrel Dixon, Tawa Vera

indy (SUN) 04/09/1978 Monterrey, Nuevo León [Halcon 347]
1) Black Danger b Dr. Coleman [mask]
## Dr. Coleman is Joaquin Pinto

indy (SUN) 04/09/1978 Naucalpan, Estado de México [Halcon 347]
1) Villano II b Estrella Del Sur [hair]

indy (SUN) 04/09/1978 Plaza de Toros Valente Arellano, Torreón, Coahuila [Box Y Lucha 1329, El Siglo de Torreon 1978-04-09]
1) ? vs ??
2) ? vs ??
3) Apolo Estrada, La Sombra vs Espanto III, The King
4) Cesar Curiel, Siglo XX vs Li-Chang, Star Águilar
5) Eduardo De Linch, Tony Salazar vs Adorable Rubi, Dr. O’Borman
6) Raúl Mata  (c) b Gran Markus [MEX HEAVY]

indy (SUN) 04/09/1978 San Luis Potosí, San Luis Potosí [Halcon 347]
1) Araña Atómica b El Escudero [mask]
## No real name given for El Escudero

MORA (SUN) 04/09/1978 Toreo de Cuatro Caminos, Naucalpan, Estado de México [https://www.facebook.com/photo.php?fbid=439277104375231&set=pb.100048788359126.-2207520000..&type=3 Angel Luzbel Nezahualcoyotl, Box Y Lucha 1329, Matt Farmer]
1) Javier Llanes vs Delfin II
2) Alberto Muñoz, Halcón 78 b el Signo, Lobo Rubio
3) El Matematico, Ultraman b El Polaco, Negro Navarro
4) Septiembre Negro, Temojin el Mongol b Canek, Villano III
## Villano III & Canek left bloody
5) El Solitario, Gran Hamada b Ángel Blanco, Dr. Wagner

EMLL (TUE) 04/11/1978 Arena Coliseo [Box Y Lucha 1329]
1) Kalimaco vs Rolando Valentino
2) El Monarca, Flama Azul vs Demonio Blanco, El Invasor and Black Shadow, Talismán and Divino Boy, El Nazi and El Nómada, El Reo and Chamaco Ortiz, Kato Kung Lee and El Cobarde, Mr. Lancer and Fishman, Rey Saúl
&& tag tournament show

EMLL (TUE) 04/11/1978 Arena Coliseo Guadalajara [El Informador 1978-04-11]
1) ? vs ??
2) ? vs ??
3) ? vs ??
4) Ciclón Veloz, Cien Caras, Mario Alcala vs Araña Atómica, Sangre India, Terremoto
5) Cachorro Mendoza, Ringo Mendoza vs Carlos Plata, Sangre Chicana

indy (TUE) 04/11/1978 Arena Nueva Atzacoalco, Gustavo A. Madero, Distrito Federal [Box Y Lucha 1329]
1) Rodan X vs Chacal de la Rosa
2) Escudo Real I, Escudo Real II vs Macabro Rojo I, Macabro Rojo II
3) Rocambole, Rudy Escobedo vs Enfermero I, Enfermero II
4) Arturo Cruz, Chamaco Escobedo, Chino Lopez vs América Salvaje, La Furia, Pepe Casas

indy (TUE) 04/11/1978 Gimnasio Ajusco, Coyoacán, Distrito Federal [Box Y Lucha 1329]
1) El Doberman vs Agente X
2) Franco Colombo vs Huroki Sito
3) José Luis Mendieta vs Rizado Ruiz
4) Blue Demon, Kung Fu, Mano Negra vs Alfonso Dantes, Escorpión I, Escorpión II

indy (WED) 04/12/1978 Arena Coliseo Acapulco, Acapulco, Guerrero [Box Y Lucha 1329]
1) Eros vs Joe Marino
2) Américo Rocca vs Bowman
3) Fishman, Herodes vs Blue Demon, El Cobarde
4) Alfonso Dantes, Harley Race vs Mano Negra, Mil Máscaras

indy (WED) 04/12/1978 Arena Xochimilco, Xochimilco, Distrito Federal [Box Y Lucha 1329]
1) Tony Arce vs Danny Boy
2) Fantastic, Raúl Santana vs El Alacrán, Negro Navarro
3) El Matematico, Impacto vs el Signo, Lobo Rubio
4) Brazo de Oro, Rayo de Jalisco vs Ángel Blanco, Kaos
5) Dr. Wagner vs Astro Rey

indy (WED) 04/12/1978 Plaza de Toros Silverio Perez, Texcoco, Estado de México [Box Y Lucha 1329]
1) Alimaña vs El Olmeca
2) Bárbaro Fonseca, Benny Castello vs Karate Do, Kid Acero
3) Alberto Muñoz, Pepe Casas vs Enfermero I, Enfermero II
4) As Charro, Tinieblas vs Frankenstein, Temojin el Mongol

inyd (WED) 04/12/1978 Arena San Juan Pantitlan, Ciudad Nezahualcóyotl, Estado de México [Box Y Lucha 1329]
1) Chacal II vs Chamaco Orduna
2) El Siberiano vs El Ejecutro
3) Anfirio, El Galante vs Fantasma Del Bajio, Mr. Bronce
4) Hermano Simba I, Hermano Simba II vs Ariman, El Dinámico

indy (THU) 04/13/1978 Arena Santa Maria Aztahuacan, Iztapalapa, Distrito Federal [Box Y Lucha 1329]
1) Danny Martinez vs Alas De Oro
2) Cruz Gavilán vs El Genunio
3) Fantastic vs Verdugo Del Valle
4) El Sanguinario, Rocambole vs El Gemano I, Perro Sosa
5) Rayo de Jalisco, Ultraman vs Dory Dixon, Ray Mendoza

indy (THU) 04/13/1978 Xalapa, Veracruz [Halcon 347]
1) Enfermero I, Enfermero II b Hermano Corzo I, Hermano Corzo II [hair]

EMLL (FRI) 04/14/1978 Arena México [Box Y Lucha 1329, http://superluchas.com/2015/04/14/en-un-dia-como-hoy-1978-llega-a-la-arena-mexico-harley-race-el-campeon-mundial-de-peso-completo-nwa/ SuperLuchas]
1) Satánico b El Imposter
2) Escorpión I b Kato Kung Lee
3) Blue Demon, El Cobarde DQ Demonio Blanco, El Nazi
4) Fishman, Perro Aguayo b Kung Fu, Mano Negra
5) Alfonso Dantes, Harley Race, Sangre Chicana b El Faraón, Mil Máscaras, Ringo Mendoza

EMLL (FRI) 04/14/1978 Plaza de Toros La Asunción, Milpa Alta, Distrito Federal [http://superluchas.com/2015/04/14/en-un-dia-como-hoy-1978-llega-a-la-arena-mexico-harley-race-el-campeon-mundial-de-peso-completo-nwa/ SuperLuchas]
1) Tawa Vera, Tony Sugar b América Salvaje, Destino Negro
2) Octavio Gaona Jr., Saeta Azteca DQ La Furia, Rómulo Méndez

indy (FRI) 04/14/1978 Auditorio Municipal, Jojutla, Morelos [http://superluchas.com/2015/04/14/en-un-dia-como-hoy-1978-llega-a-la-arena-mexico-harley-race-el-campeon-mundial-de-peso-completo-nwa/ SuperLuchas]
1) Pequeño Gigante vs Asesino S
2) El Príncipe vs Chacal de la Rosa
3) El Galante, Kuroneko b Ivan Hood, Rokambole
4) Ángel Blanco, Barba Negra, Dr. Wagner b El Matematico, El Rostro, Ultraman

indy (FRI) 04/14/1978 Auditorio Municipal, Matehuala, San Luis Potosí [http://superluchas.com/2015/04/14/en-un-dia-como-hoy-1978-llega-a-la-arena-mexico-harley-race-el-campeon-mundial-de-peso-completo-nwa/ SuperLuchas]
1) Puños De Acero, Sugi Sito b Satán, Septiembre Negro

EMLL (SAT) 04/15/1978 Pista Arena Revolución [Box Y Lucha 1329]
1) El Maldito vs Diogenes
2) Gran Davis vs Joe Marino
3) El Nómada vs Mr. Lancer
4) Invasor vs Rafael Salamanca
5) Américo Rocca vs Franco Colombo
## rematch
6) Huroki Sito, Mario Valenzuela vs El Vengador, Índio Vitela
7) Black Shadow, José Luis Mendieta, Tony Salazar vs Bruno Victoria, Carlos Plata, Escorpión II

indy (SAT) 04/15/1978 Arena Nueva Atzacoalco, Gustavo A. Madero, Distrito Federal [Box Y Lucha 1329]
1) Ariman vs Ráfaga
2) Alzadu El Gitano vs Fantasma Del Bajio, El Fantasma De La Ópera
3) Mr. Bronce vs Tupamaro [ANA MIDLDE]
4) Mago, Saeta Azteca, Ultraman vs Baby Sharon, Bello Greco, Sergio el Hermoso

indy (SAT) 04/15/1978 Arena Xochimilco, Xochimilco, Distrito Federal [Box Y Lucha 1329]
1) Puños De Acero vs Mauro Conde
2) Kenji Kaplin, Panama Panther vs Destino Negro, Mr. Cobra
3) Robot C3, Robot R-2 vs Halcón Dorado I, Halcón Dorado II
4) Felipe Ham Lee, Halcón 78, José Torres vs Máquina Salvaje, Scorpió, Sugi Sito

indy (SAT) 04/15/1978 Arena Zapata, Cuautla, Morelos [Box Y Lucha 1329]
1) El Galante vs Centinela
2) Escorpión Negro vs Madruk El Triunfador
3) Pequeño Gigante vs Memo Arenas
4) Danny Cruz, Máquina Salvaje vs Puños De Acero, Rudy Palma

indy (SAT) 04/15/1978 Nueva Arena Apatlaco, Iztapalapa, Distrito Federal [Box Y Lucha 1329, Halcon 347]
1) Veterinario vs Tony Vazquez
2) Hermano Muerte I, Hermano Muerte II vs Bobby Lee, El Catedrático
3) América Salvaje, Kanek vs Brazo de Oro, Manuel Robles
4) Impacto  (c) b Kahoz [DF Middle]
5) Mil Máscaras vs Ángel Blanco

indy (SAT) 04/15/1978 Puebla, Puebla [Halcon 347]
1) Raúl Mata  (c) b Herodes [MEX HEAVY]
2) Dr. O’Borman b Sergio Borrayo [hair]

EMLL (SUN) 04/16/1978 Arena Coliseo [http://wrestlingclassics.com/cgi-bin/.ubbcgi/ultimatebb.cgi?ubb=get_topic&f=10&t=004698 Matt Farmer]
1) Gran Davis vs Agente X
2) El Monarca, José Luis Mendieta vs Alfonso Dantes, Dr. O’Borman and Gemelo Diablo I, Gemelo Diablo II and Rizado Ruiz, Rodolfo Ruiz and El Nazi, Rey Saúl and El Vengador, Mano Negra

EMLL (SUN) 04/16/1978 Arena Coliseo Guadalajara [El Informador 1978-04-16]
1) ? vs ??
2) ? vs ??
3) ? vs ??
4) Cachorro Mendoza, Mario Alcala vs El Ídolo, The Irs
5) Harley Race, Perro Aguayo, Sangre Chicana vs Ciclón Veloz, Cien Caras, El Faraón
## Harley Race 1st time appearance in this arena.

EMLL (SUN) 04/16/1978 Pista Arena Revolución [Box Y Lucha 1329]
1) Titanic vs Kalimaco
2) Bufalo Salvaje vs Roy Lancer
3) Mr. Steel vs Tauro
4) El Reo, Satánico vs Chamaco Ortiz, Lizmark
5) El Cobarde, El Impostor, Kato Kung Lee vs Gemelo Diablo I, Gemelo Diablo II, Manuel Robles

indy (SUN) 04/16/1978 Arena Azteca, Calz. Tulyehualco, Iztapalapa, Distrito Federal [Box Y Lucha 1329]
1) Tony Vazquez vs Pequeño Gigante
2) Ángel de Oro vs Jimmy Cuevas
3) Bobby Lee, Catedrático vs El Venterinaro, Satán
4) Robot C3, Robot R-2 vs Brazo de Oro, Impacto
5) Blue Demon, Ultraman vs América Salvaje, Sugi Sito

indy (SUN) 04/16/1978 Arena San Fernando, Huixquilucan, Estado de México [Box Y Lucha 1329]
1) Black Sender vs Relicario
2) Conquistador vs Chamaco Rivera
3) Asesino Negro vs Mario González
4) Índio Magudu vs Danny Torres
5) Chamaco Segura, Molusco vs Ángel Del Ring, Johny Guillen

indy (SUN) 04/16/1978 Arena San Juan Pantitlan, Ciudad Nezahualcóyotl, Estado de México [Box Y Lucha 1329]
1) El Galante vs Centinela
2) Rudy Palma vs Chivo Martinez
3) Marduk vs Destino Negro
4) El Marques, Escorpión Negro vs Danny Cruz, Fantastic
5) Máquina Salvaje, Tupamaro vs Gori Casanova, La Sombra

indy (SUN) 04/16/1978 Arena Santa Maria Aztahuacan, Iztapalapa, Distrito Federal [Box Y Lucha 1329]
1) El Peligro vs Dragón Sangriento
2) Rommel vs Vellocino Sagrado
3) Estrella Fantasma, Pequeño Gigante vs Ángel Asesino I, Ángel Asesino II
4) Escudo Real I, Escudo Real II vs Kurok, Mario Rojas
5) Birdman, La Serpiente, Mr. Misterio vs Dracula, Germano I, León Negro Jr.

indy (SUN) 04/16/1978 Ciudad Juárez, Chihuahua [Halcon 347]
1) Gallo Tapado b Judas [hair]

indy (SUN) 04/16/1978 Guadalajara, Jalisco [Halcon 347]
1) Bucanero I, Índio Cheroque b Monje Siniestro, Tonina Norton [mask]
## No real names given for Tonina Norton & Monje Siniestro

indy (SUN) 04/16/1978 Plaza de Toros Valente Arellano, Torreón, Coahuila [El Siglo de Torreon 1978-04-16]
1) ? vs ??
2) ? vs ??
3) The King vs Mario Saucedo
4) Toña La Tapatia, Viuda Negra vs Chairto Silva, Karina
5) Escorpión I, Escorpión II, Star Águilar vs Cesar Curiel, Robot C-3, Siglo XX

indy (SUN) 04/16/1978 Puebla, Puebla [Box Y Lucha 1329]
1) Flama Azul vs Bulmaor Anaya
2) Caballero Azul vs Chico Madrid [hair, mask]

MORA (SUN) 04/16/1978 Toreo de Cuatro Caminos, Naucalpan, Estado de México [Box Y Lucha 1329, Matt Farmer]
1) Príncipe Odin vs Rafael Moreno
2) Hermano Muerte I, Hermano Muerte II vs Tamba, Tawa Vera
3) Bello Greco, Sergio el Hermoso vs Dorrel Dixon, Ultraman
4) Sunny War Cloud, Temojin el Mongol vs Canek, Judas
5) El Solitario, Lou Thesz vs Ángel Blanco, Dr. Wagner

indy (MON) 04/17/1978 Arena Tropicana, Tehuacán, Puebla [Box Y Lucha 1329]
1) El Mercenario vs La Tarantula
2) Goldem vs Lobo Negro
3) Toro Salvaje I, Toro Salvaje II vs Araña Blanca, Capitán Astucia
4) Académico I, Supsean vs Súper Libre, Villano III

EMLL (TUE) 04/18/1978 Arena Coliseo Guadalajara [El Informador 1978-04-18]
1) ? vs ??
2) ? vs ??
3) ? vs ??
4) Máscara Año 2000, Riki Romero vs Calavera I, Calavera II
5) Harley Race, Sangre Chicana vs Cien Caras, El Faraón

indy (TUE) 04/18/1978 Cuautitlán, Estado de México [https://twitter.com/ostpies/status/1517251315436769280 @ostpeis, Combates 131, Halcon 347]
1) Dorrel Dixon b José Torres
2) Bobby Lee, El Polaco b Dick Angelo, Tonina Harris
3) Babe Richard b Danny Boy [EDM Light]
4) Negro Navarro  (c) b Bengala [Cuautitlan Welter]
5) América Salvaje, Ángel Blanco, Cesar Valentino DQ La Sombra, Pantera Negra, Tawa Vera

indy (WED) 04/19/1978 San Luis Potosí, San Luis Potosí [Halcon 347]
1) Sangre Chicana  (c) b Ciclón Veloz [MEX MIDDLE]

EMLL (FRI) 04/21/1978 Arena México [http://www.facebook.com/photo.php?fbid=526284044086002&set=a.461505387230535.102143.454597374588003&type=1 DJ Spectro]
1) El Imposter b Leo López
2) El Monarca b Demonio Blanco
3) Gemelo Diablo I, Gemelo Diablo II DRAW Enrique Vera, Tony Salazar
4) Blue Demon, Mano Negra b Fishman, Perro Aguayo
## straight falls, Mano Negra sneaking in a foul on Fishman
5) Harley Race b El Halcón [NWA HEAVY]
## Harley Race took falls 2/3 to keep his title cleanly. Another title match is mentioned as taking place against As Charro in Pachuca
6) El Faraón, Ringo Mendoza b Alfonso Dantes, Sangre Chicana [hair]
## Ringo & Faraon took falls 1/3.

Gomez (FRI) 04/21/1978 Auditorio Municipal, Torreón, Coahuila [El Siglo de Torreon 1978-04-21]
1) ? vs ??
2) ? vs ??
## semimain is an eight tag team touranemnt
3) Espanto III, The King, Verdugo vs Halcón Suriano, La Sombra, Vicente Nuño
&& Gonzalo Gomez taking over as promoter?

indy (FRI) 04/21/1978 Pachuca, Hidalgo [Halcon 347]
1) Harley Race  (c) b As Charro [NWA Heavy]
## Race also wrestled in Arena Mexico same day beating El Halcon (Danny Ortiz) to retain the title as well.

EMLL (SUN) 04/23/1978 Arena Coliseo Guadalajara [El Informador 1978-04-23, Halcon 347]
1) ? vs ??
2) ? vs ??
3) ? vs ??
4) El Cobarde, El Faraón vs Adorable Rubi, Perro Aguayo
5) Sangre Chicana  (c) b Ciclón Veloz [MEX MIDDLE]

indy (SUN) 04/23/1978 Gimnasio Deportivo 47, Monclova, Coahuila
1) Carbonero vs Halcón Blanco
2) Apolo Montaña, Costeñito Moy vs Mundo Ibarra, Romeo Valdez
3) Chamaco Romo vs Cavernario Sanchez
4) Demonio Rojo vs Boby Garza [mask, hair]
&& Year is a guess. 3rd Anniversary.

indy (SUN) 04/23/1978 Naucalpan, Estado de México [Halcon 347]
1) Audaz b Gorilita Flores [hair]

indy (SUN) 04/23/1978 Pachuca, Hidalgo [Halcon 347]
1) Solar I  (c) b As Charro [UWA WELTER]

indy (SUN) 04/23/1978 Plaza de Toros Valente Arellano, Torreón, Coahuila [El Siglo de Torreon 1978-04-23]
1) ? vs ??
2) Ciclón Negro vs Pantera Blanca
3) El Trueno, Mario Saucedo vs Índio Navajo, Loco Díaz
4) Robot C-3, Siglo XX vs Gran Markus, Star Águilar
5) Cachorro Mendoza, Ringo Mendoza vs Alfonso Dantes, Fishman

EMLL (TUE) 04/25/1978 Arena Coliseo Guadalajara [El Informador 1978-04-25]
1) ? vs ??
2) ? vs ??
3) ? vs ??
4) Máscara Año 2000, Solder Blue vs Índio Salvaje I, Índio Salvaje II
5) Ciclón Veloz, El Cobarde, El Faraón vs Adorable Rubi, Sangre Chicana, Sangre India

indy (TUE) 04/25/1978 Cuautitlán, Estado de México [Halcon 347]
1) El Polaco b Tonina Harris [hair]

indy (TUE) 04/25/1978 Nueva Atzacoalco, Gustavo A. Madero, Distrito Federal [Halcon 347]
1) Arturo Cruz  (c) b Rokambole [DF Light]

indy (WED) 04/26/1978 Acapulco, Guerrero [Halcon 347]
1) El Faraón  (c) b Alfonso Dantes [NWA LH]

indy (WED) 04/26/1978 Distrito Federal [Halcon 347]
1) Impacto  (c) b Negro Navarro [DF Middle]

indy (FRI) 04/28/1978 Auditorio Municipal, Torreón, Coahuila [El Siglo de Torreon 1978-04-28]
1) ? vs ??
2) ? vs ??
3) ? vs ??
4) Espanto III, The King vs Halcón Suriano, La Sombra
5) Príncipe Azul, Vicente Nuño vs Cavernarrio Galindo III, Verdugo

indy (FRI) 04/28/1978 Centro Social y Deportivo CONELEC, Puebla, Puebla [https://www.facebook.com/photo/?fbid=515299230106351&set=g.1063818623692271 Angel Luzbel Nezahualcoyotl]
1) ? vs ??
2) Gallito De Oro vs Cardenal
3) Caballero De La Torre, El Buitre vs El Símbolo, Sombra Azul
4) Rocambole vs Súper Libre
5) China Boxer, Gorila Osorio, Ray Mendoza vs Ángel De Puebla, José Torres, Nakamura

EMLL (SUN) 04/30/1978 Arena Coliseo Guadalajara [El Informador 1978-04-30]
1) ? vs ??
2) ? vs ??
3) ? vs ??
4) Máscara Año 2000, Solder Blue vs Sangre India, Terremoto
5) El Cobarde, El Faraón, Tony Salazar vs Adorable Rubi, Perro Aguayo, Sangre Chicana

indy (SUN) 04/30/1978 Ciudad Juárez, Chihuahua [Halcon 347]
1) Flama Roja  (c) b Astro Rey [NORTE LH]
2) Eduardo De Linch b Costeño [hair]

indy (SUN) 04/30/1978 Ciudad Nezahualcóyotl, Estado de México [Halcon 347]
1) Maravilla b Pepe Casas [hair]

indy (SUN) 04/30/1978 Monterrey, Nuevo León [Halcon 347]
1) Kung Fu  (c) b Roy Steve [MEX WELTER]

indy (SUN) 04/30/1978 Plaza de Toros Valente Arellano, Torreón, Coahuila [El Siglo de Torreon 1978-04-30]
1) ? vs ??
2) ? vs ??
3) Centella Azul vs Marinero Cruz
4) Jhonny Carrillo, Kasak vs Índio Navajo, Loco Díaz
5) Cesar Curiel, Enrique Vera, Siglo XX vs Gran Markus, Li-Chang, Star Águilar

indy (MON) 05/01/1978 Pachuca, Hidalgo [Halcon 347]
1) Vicky Carranza b Yadira [mask]
## No real name given for Yadira
2) Charro Robles b Fredy Perez [hair]

EMLL (TUE) 05/02/1978 Arena Coliseo Guadalajara [El Informador 1978-05-02]
1) ? vs ??
2) ? vs ??
3) ? vs ??
4) Calavera I, Calavera II vs El Caudillo, El Cobarde
5) El Faraón, Tony Salazar vs Adorable Rubi, Sangre Chicana

indy (WED) 05/03/1978 Arena Naucalpan [Halcon 310]
1) El Lendaor b El Suicida
2) Escorpión Negro b Relámpago Negro
3) Pepe Casas, Rokambole b El Efectivo, Rudy Escobedo
## Efectico replaced Chamaco Escobedo
4) Dick Angelo, Negro Navarro, Tupamaro b Bengala, Brazo de Oro, Castorico
5) Audaz, Huracán Ramírez, La Sombra DQ Hermano Muerte I, Hermano Muerte II, Karloff Lagarde

indy (THU) 05/04/1978 Panama [Halcon 347]
1) Septiembre Negro  (c) b Zandokan I [EUROPE World Middle]

indy (THU) 05/04/1978 Poza Rica, Veracruz [Halcon 347]
1) Solar I  (c) b el Signo [UWA WELTER]

indy (FRI) 05/05/1978 Auditorio Municipal, Torreón, Coahuila [El Siglo de Torreon 1978-05-05]
1) ? vs ??
2) ? vs ??
3) ? vs ??
4) Príncipe Azul, Vicente Nuño vs Cavernario III, El Verdugo
5) Halcón Suriano, La Sombra vs Espanto III, The King

indy (FRI) 05/05/1978 Jojutla, Morelos [Halcon 310]
1) Cesar Valentino vs el Signo

indy (FRI) 05/05/1978 Panama City, Panama [Halcon 311]
1) Septiembre Negro  (c) b Zandokan I [PANAMA MIDDLE]

indy (FRI) 05/05/1978 Toluca, Estado de México [Halcon 347]
1) El Toluco b El Capitán [hair]
2) Ciclón Moreno b El Bronco [hair]

indy (SAT) 05/06/1978 Apatlaco, Iztapalapa, Distrito Federal [Halcon 347]
1) Enfermero Jr.  (c) b Potro Salvaje [DF WELTER]

indy (SAT) 05/06/1978 Ixtlahuaca, Estado de México [Halcon 310]
1) Avenger, El Emperador vs Tarasco I, Tarasco II

EMLL (SUN) 05/07/1978 Arena Coliseo Guadalajara [El Informador 1978-05-07, Halcon 311]
1) Chacal b Sultan
2) Félix Mosqueda b Tarzan Zimba
3) Fantasma b Araña Atómica
4) Cinta Negra, Riki Romero DQ Terremoto, The Irs
5) El Faraón, Kung Fu, Tony Salazar DRAW Adorable Rubi, Perro Aguayo, Sangre Chicana

ind (SUN) 05/07/1978 Arena Naucalpan [Halcon 311]
1) Audaz, Halcón 78, Santo b Babe Face, Cesar Valentino, Yayo Valentino

indy (SUN) 05/07/1978 Plaza de Toros Valente Arellano, Torreón, Coahuila [El Siglo de Torreon 1978-05-07]
1) ? vs ??
2) El Fraterno vs Guapo Ibarra
3) Centella Azul, Rayito Sanchez vs Índio Navajo, Loco Díaz
4) El Trueno, Temoc Torres vs Milo Caballero, Star Águilar
5) Cesar Curiel, Kato Kung Lee vs Escorpión I, Escorpión II

indy (SUN) 05/07/1978 Poza Rica, Veracruz [Halcon 347]
1) Mr. Bronce b Relámpago [mask]
## Relampago is David Villegas

indy (SUN) 05/07/1978 Puebla, Puebla [Halcon 347]
1) Centella Roja, El Egipcio b As Charro, Chico Madrid  (c) [Puebla Tag]

indy (SUN) 05/07/1978 Toluca, Estado de México [Halcon 310, Halcon 311]
1) Ciclón Moreno b El Bronco [hair]
2) El Yety, Mr. Tempest vs Memo Santana, Mr. Cobra

EMLL (TUE) 05/09/1978 Arena Coliseo [Halcon 311, http://wrestlingclassics.com/cgi-bin/.ubbcgi/ultimatebb.cgi?ubb=get_topic&f=10&t=004698 Matt Farmer]
1) Bruno Victoria, Rey Saúl b José Luis Mendieta, Mr. Lancer [quarterfinal]
2) Chamaco Ortiz, El Monarca b Demonio Blanco, Raúl Armas [quarterfinal]
3) Rizado Ruiz, Roy Lancer b El Vengador, Lizmark [quarterfinal]
4) Blue Demon, Talismán b El Reo, Satánico [quarterfinal]
5) Blue Demon, Talismán b Bruno Victoria, Rey Saúl [semifinal]
6) Rizado Ruiz, Roy Lancer b Chamaco Ortiz, El Monarca [semifinal]
7) Blue Demon, Talismán b Rizado Ruiz, Roy Lancer [final]

EMLL (TUE) 05/09/1978 Arena Coliseo Guadalajara [El Informador 1978-05-09]
1) ? vs ??
2) ? vs ??
3) ? vs ??
4) El Dorado, Kun Fu, Máscara Año 2000 vs Calavera I, Calavera II, Sangre India
5) El Faraón, Tony Salazar vs Adorable Rubi, Sangre Chicana [super libre]

indy (TUE) 05/09/1978 Gimnasio Municipal Lic. Benito Juárez, Cuautitlán, Estado de México [Halcon 310]
1) Javier Montes DRAW Lucio Risas
2) Danny Boy, El Mago b Chamaco Richard, El Húngaro
3) Catedrático, El Matematico, La Sombra DQ Negro Navarro, Pepe Casas, Rokambole
4) Dick Angelo, Ray Mendoza, Scorpió DQ Brazo de Oro, Tawa Vera, Ultraman
5) El Polaco b Naty Arrazola [hair]

indy (TUE) 05/09/1978 Monterrey, Nuevo León [Halcon 347]
1) Black Danger b Dr. Coleman [mask]
## Dr. Coleman is Joaquin Pinto
&& same match as listed in April 9, one date is likely wrong

indy (WED) 05/10/1978 Arena Naucalpan [Halcon 310, Halcon 311]
1) Suicida b Zuanga
2) Rokambole DQ Castorico
3) Chamaco Escobedo, Rudy Escobedo b El Capitán, Kuroneko
4) Anfibio, El Matematico b América Salvaje, Tupamaro [quarterfinal]
5) Ángel Blanco, Dr. Wagner b Estrella Del Sur, Ráfaga Moreno [quarterfinal]
6) Karloff Lagarde, Negro Navarro b Estrella Del Sur, Ráfaga Moreno [semifinal]
7) Ángel Blanco, Dr. Wagner b Anfibio, El Matematico [semifinal]
8) Ángel Blanco, Dr. Wagner b Karloff Lagarde, Negro Navarro [final]
&& 6 team tag tournament

indy (THU) 05/11/1978 Durango, Durango [Halcon 347]
1) El Solitario  (c) b Rene Guajardo [UWA LH]

indy (THU) 05/11/1978 Toluca, Estado de México [Halcon 311]
1) Babe Face, Scorpion vs Dorrel Dixon, Rayo de Jalisco
2) Dos Caras, Mil Máscaras vs Canek, Sunny War Cloud

EMLL (FRI) 05/12/1978 Arena Coliseo [https://twitter.com/ostpies/status/1396221334070300673/photo/4 Arena Box y Lucha 1030, Halcon 311, https://twitter.com/ostpies/status/1396221841929170944/photo/3 Lucha Libre 1978-05-21, http://wrestlingclassics.com/cgi-bin/.ubbcgi/ultimatebb.cgi?ubb=get_topic&f=10&t=004698 Matt Farmer]
1) Joe Marino b El Doberman
2) Talismán b El Invasor
3) Franco Colombo b Rey Saúl
4) Sergio Borrayo b Huroki Sito
5) El Monarca b Manuel Robles
6) Escorpión I, Escorpión II DQ Cachorro Mendoza, Kato Kung Lee
7) El Faraón, Mano Negra DRAW Adorable Rubi, Alfonso Dantes
## First for the tecnicos, second for the rudos, double pin by Rubi & Nega

indy (FRI) 05/12/1978 Auditorio Municipal, Torreón, Coahuila [El Siglo de Torreon 1978-05-12]
1) ? vs ??
2) ? vs ??
3) Halcón Suriano vs The King
4) Espanto III, Verdugo vs La Sombra, Vicente Nuño

indy (FRI) 05/12/1978 Puebla, Puebla [Halcon 347]
1) Rokambole b Súper Libre [mask]
## Super Libre is Sergio Linares

indy (SAT) 05/13/1978 Cancún, Quintana Roo [Halcon 347]
1) Cesar Valentino  (c) b Dos Caras [UWA JLH]

indy (SAT) 05/13/1978 Guadalajara, Jalisco [Halcon 347]
1) Dos Caras b Dr. Coleman [hair]

indy (SAT) 05/13/1978 Nueva Atzacoalco, Gustavo A. Madero, Distrito Federal [Halcon 347]
1) Tupamaro b Rey Centella [hair]

Mora (SAT) 05/13/1978 Plaza de Toros Ponciano Diaz, Cuernavaca, Morelos [Halcon 310]
1) Ráfaga Moreno vs Chamaco Escobedo
2) Black Man, Solar I vs El Lobo Rubio, el Signo
3) Bello Greco, Sergio el Hermoso vs Scorpió, Septiembre Negro
4) El Santo, Mil Máscaras vs Canek, Ray Mendoza

EMLL (SUN) 05/14/1978 Arena Coliseo Guadalajara [http://superluchas.com/2015/05/14/en-un-dia-como-hoy-1978-el-faraon-vs-perro-aguayo-por-el-campeonato-mundial-semicompleto-nwa-la-ola-blanca-vs-fishman-y-el-cobarde/ SuperLuchas]
1) Águila India, Gran Cochisse b Calavera I, Calavera II
2) Alfonso Dantes, El Nazi b Kung Fu, Tony Salazar
3) El Faraón  (c) b Perro Aguayo [NWA LH]

indy (SUN) 05/14/1978 Arena Isabel, Cuernavaca, Morelos [Halcon 310, Halcon 311]
1) Astro, Avenger b Corzo, Maya
2) Glamoroso Froylan b Ray Lopez [MORELOS LIGHT]
3) El Buitre b Red King [mask]
## Red King is Luis David Campos

indy (SUN) 05/14/1978 Ciudad Juárez, Chihuahua [ http://superluchas.com/2015/05/14/en-un-dia-como-hoy-1978-el-faraon-vs-perro-aguayo-por-el-campeonato-mundial-semicompleto-nwa-la-ola-blanca-vs-fishman-y-el-cobarde/ SuperLuchas]
1) Eduardo De Linch, Impostor, Tony Reyna b Flama Roja, Índio Medina, Judas Monterrosa
2) El Cobarde, Fishman DQ Ángel Blanco, Dr. Wagner

indy (SUN) 05/14/1978 Cuernavaca, Morelos [Halcon 347]
1) Glamoroso Froylan  (c) b Fray Lopez [Morelos Light]

indy (SUN) 05/14/1978 Monterrey, Nuevo León [Halcon 347]
1) Cesar Valentino  (c) b Felipe Ham Lee [UWA JLH]

indy (SUN) 05/14/1978 Plaza de Toros el Cortijo, Venustiano Carranza, Distrito Federal [ http://superluchas.com/2015/05/14/en-un-dia-como-hoy-1978-el-faraon-vs-perro-aguayo-por-el-campeonato-mundial-semicompleto-nwa-la-ola-blanca-vs-fishman-y-el-cobarde/ SuperLuchas]
1) El Catedrático, Mr. Raff b Destino Negro, Robot C3
2) Delfín II, El Veterinario, Karloff Lagarde b Impacto, Potro Salvaje, Saeta Azteca
3) Temojin el Mongol DQ Tamba

indy (SUN) 05/14/1978 Plaza de Toros Valente Arellano, Torreón, Coahuila [El Siglo de Torreon 1978-05-14]
1) ? vs ??
2) ? vs ??
3) Índio Navajo, Loco Díaz vs El Fraterno, Rayito Sanchez
4) Demonio Negro, Star Águilar vs Apolo Estrada, Temoc Torres
5) Adorable Rubi, Li-Chang vs Mano Negra, Siglo XX

EMLL (TUE) 05/16/1978 Arena Coliseo [Box Y Lucha 1335, http://wrestlingclassics.com/cgi-bin/.ubbcgi/ultimatebb.cgi?ubb=get_topic&f=10&t=004698 Matt Farmer]
1) Tommy Nava b Rolando Valentino
2) Diogenes b Kalimaco
3) El Invasor DCOR El Nómada
4) Chamaco Ortiz, Mr. Lancer b Huroki Sito, Satánico
5) Franco Colombo, Lizmark b Manuel Robles, Rizado Ruiz
## straight falls
6) El Monarca, Enrique Vera b El Reo, Gemelo Diablo I

EMLL (TUE) 05/16/1978 Arena Coliseo Guadalajara [El Informador 1978-05-16]
1) ? vs ??
2) ? vs ??
3) ? vs ??
4) Máscara Año 2000, Solder Blue vs Terremoto, Tony Beneto
5) Kung Fu, Mano Negra, Tony Salazar vs Adorable Rubi, Alfonso Dantes, El Nazi

indy (TUE) 05/16/1978 Campeche [Halcon 347]
1) La Bestia Roja b Espartano I [hair]

indy (TUE) 05/16/1978 Cuautitlán, Estado de México [Halcon 311]
1) Catedrático, El Matematico, Estrella Blanca vs Índio Vitela, Negro Navarro, Rokambole
2) Karloff Lagarde, Ray Mendoza, Villano III vs Dos Caras, El Halcón, Ultraman

indy (TUE) 05/16/1978 Distrito Federal [Halcon 347]
1) Agente X b Gran Davis [hair]

EMLL (WED) 05/17/1978 Arena Coliseo Acapulco, Acapulco, Guerrero [Halcon 311]
1) Mario Valenzuela  (c) vs Talismán [MEX LIGHT]
## Valenzuela is at first believed to be out of contract headed to Mora, but still doing this defense (which Halcon believes means title change.) Box Y Lucha 1335 has EMLL claiming Valenzuela is still under contract - and since he holds onto the title and is listed next week, maybe he was.
&& A Roy Lancer hair match is mentioned for this show, but he appears to put it up the next week isntead

indy (WED) 05/17/1978 Arena Naucalpan [Halcon 311]
1) Comodín vs El Lendaor
2) Fantasma Del Bajio vs Zuanga
3) Anfibio, Castorico vs Pepe Casas, Rokambole
4) Chamaco Escobedo, Rudy Escobedo b Androide, Capitán
5) Alberto Muñoz, El Lince, Nakamura vs ?, América Salvaje, Negro Navarro
## final man wasn't known at press time

indy (WED) 05/17/1978 Unidad Deportiva de Acapulco, Acapulco, Guerrero [Halcon 311]
1) Halcón Dorado I, Halcón Dorado II vs Enfermero I, Enfermero II

indy (THU) 05/18/1978 Arena Poza Rica, Poza Rica, Veracruz [https://twitter.com/ostpies/status/1396221334070300673/photo/4 Arena Box y Lucha 1030]
1) Cacique Mara vs Mazambula
2) Tamba vs León Negro
3) As Charro, Karloff Lagarde vs Black Man, Brazo de Oro
4) Babe Face, Canek, Cesar Valentino vs Anibal, El Solitario, Sunny War Cloud

indy (THU) 05/18/1978 Arena Toluca, Toluca, Estado de México [https://twitter.com/ostpies/status/1396221334070300673/photo/4 Arena Box y Lucha 1030]
1) El Mago vs Chamaco Escobedo
2) El Polaco vs La Saeta Azteca
3) Scorpió, Septiembre Negro vs Bello Greco, Sergio el Hermoso
4) América Salvaje, Temojin el Mongol vs Pantera Negra, Tinieblas

EMLL (FRI) 05/19/1978 Arena Coliseo [https://twitter.com/ostpies/status/1396221334070300673 Arena Box y Lucha 1030, http://wrestlingclassics.com/cgi-bin/.ubbcgi/ultimatebb.cgi?ubb=get_topic&f=10&t=004698 Matt Farmer]
1) Ari Romero b Joe Marino
2) Mr. Steel b Bufalo Salvaje
3) El Vengador DQ Américo Rocca
4) Raúl Armas b Sergio Borrayo
5) Leo López DQ José Luis Mendieta
6) Herodes b Cien Caras
7) Kato Kung Lee, Kung Fu, Ringo Mendoza b Alfonso Dantes, Escorpión I, Escorpión II

EMLL (SAT) 05/20/1978 Nueva Arena Apatlaco, Iztapalapa, Distrito Federal [https://twitter.com/ostpies/status/1396221334070300673/photo/4 Arena Box y Lucha 1030]
1) Texano vs Danny Boy
2) León Negro, Príncipe Odin vs Bengala I, Bengala III
3) Robot R-2, Siberiano vs Black Man, Manuel Robles
4) Anibal, Halcón 78 vs Cesar Valentino, Sunny War Cloud

EMLL (SAT) 05/20/1978 Pista Arena Revolución [https://twitter.com/ostpies/status/1396221334070300673/photo/4 Arena Box y Lucha 1030, Box Y Lucha 1335]
1) Irazú b Caballero Blanco
2) Franco Colombo b Rodolfo Ruiz
3) Cachorro Mendoza, El Monarca b Bruno Victoria, Divino Roy
4) Halcón Ortiz, Mano Negra b Adorable Rubi, Nazi
5) Flama Azul b Satánico [hair]
6) Sangre Chicana  (c) b Tony Salazar [MEX MIDDLE]

indy (SAT) 05/20/1978 Arena Nueva Atzacoalco, Gustavo A. Madero, Distrito Federal [https://twitter.com/ostpies/status/1396221334070300673/photo/4 Arena Box y Lucha 1030]
1) Pequeño Gigante vs El Ermitano
2) Fantasma Del Baijo, Ráfaga vs Sombra de Plata I, Sombra De Plata II
3) Halcón Dorado I, Halcón Dorado II vs Leopardo Negro I, Leopardo Negro II
4) As Charro, Canek, La Furia vs Estrella Blanca, Impacto, Tawa Vera

indy (SAT) 05/20/1978 Arena Zapata, Cuautla, Morelos [Halcon 311]
1) Brazo de Oro, Ray Mendoza, Rayo de Jalisco vs ?

Martinez (SAT) 05/20/1978 Plaza de toros Fermin Rivera, San Luis Potosí, San Luis Potosí [https://twitter.com/ostpies/status/1396221334070300673/photo/4 Arena Box y Lucha 1030]
1) Filli Salazar vs Bienviendo Mayo
2) Amenaza Roja vs Apolo Potosino
3) Ángel Arano, El Gavilán vs Enfermero, Mr. America
4) Dorrel Dixon, Puños De Acero vs Índio Vitela, Septiembre Negro

Mora (SAT) 05/20/1978 Arena Apatlaco, Iztapalapa, Distrito Federal [https://twitter.com/ostpies/status/1396221334070300673/photo/4 Arena Box y Lucha 1030]
1) Conde Murciélago vs Juanito Ramírez
2) El Moro vs Romo II
3) Rams I vs Cuervo Azul
4) Destino Negro, Tony Sugar vs Potro Salvaje, Rokambole
5) Anibal, Ray Centella vs El Polaco, Temojin el Mongol

EMLL (SUN) 05/21/1978 Arena Coliseo [https://twitter.com/ostpies/status/1396221334070300673/photo/4 Arena Box y Lucha 1030]
1) Joe Marino vs Doberman
2) Rafael Salamanca vs Rey Saúl
3) Franco Colombo, Magnífico vs Huroki Sito, Manuel Robles
4) Enrique Vera, José Luis Mendieta vs El Reo, Rizado Ruiz
5) El Faraón, Kung Fu vs Gemelo Diablo I, Gemelo Diablo II

EMLL (SUN) 05/21/1978 Arena Coliseo Guadalajara [El Informador 1978-05-21]
1) ? vs ??
2) ? vs ??
3) ? vs ??
4) Calavera I, Calavera II b Índio Salvaje I, Índio Salvaje II [OCCIDENTE TAG]
5) Cachorro Mendoza, Cien Caras, Ringo Mendoza vs Alfonso Dantes, El Nazi, Perro Aguayo

EMLL (SUN) 05/21/1978 Pista Arena Revolución [https://twitter.com/ostpies/status/1396221334070300673/photo/4 Arena Box y Lucha 1030]
1) Diogenes vs Kalimaco
2) Mr. Lancer vs Ari Romero
3) Mr. Steel vs El Invasor
4) Lizmark, Sergio Borrayo vs Américo Rocca, Dr. O’Borman
5) El Monarca, Kato Kung Lee, The Black Shadow vs Escorpión I, Escorpión II, Herodes

indy (SUN) 05/21/1978 Arena Toluca, Toluca, Estado de México [https://twitter.com/ostpies/status/1396221334070300673/photo/4 Arena Box y Lucha 1030]
1) El Lendaro vs Billy Jack
2) Danny Boy, La Lalo Castell vs El Carincero, Lucio Risas
3) El Toluco, Mr. Tempest vs La Cobra, Pepe Casas
4) Golden Boy vs Ciclón Moreno

indy (SUN) 05/21/1978 Plaza de Toros el Cortijo, Venustiano Carranza, Distrito Federal [https://twitter.com/ostpies/status/1396221334070300673/photo/4 Arena Box y Lucha 1030]
1) El Moro vs Chacal de la Rosa
2) El Siberiano vs Mr. Raff
3) El Veterinario vs Catedrático
4) Impacto, Saeta Azteca vs Desino Negro, Robot C-3
5) Blue Demon, El Químico, Tamba vs Babe Face, Deflino II, Sugi Sito

indy (SUN) 05/21/1978 Plaza de Toros Valente Arellano, Torreón, Coahuila [El Siglo de Torreon 1978-05-21]
1) ? vs ??
2) El Fraterno vs Guapo Ibarra
3) Centella Azul, Rayito Sanchez vs Índio Navajo, Loco Díaz
4) El Trueno, Temoc Torres, Torbellino vs Demonio Negro, Milo Caballero, Star Águilar
5) Mano Negra vs Sangre Chicana

indy (SUN) 05/21/1978 Toluca, Estado de México [Halcon 347]
1) Golden Boy b Ciclón Moreno [hair]

indy (SUN) 05/21/1978 Veracruz, Veracruz [Halcon 347]
1) El Etíope b Apolo Acosta  (c) [Veracruz Middle]

Mora (SUN) 05/21/1978 Arena Aficion [https://twitter.com/ostpies/status/1396221334070300673/photo/4 Arena Box y Lucha 1030]
1) La Dama De Antifaz vs Yadira
2) Anfibius, Chamaco Robles, Tino Arrieta vs El Bronco, Leopardo Negro I, Leopardo Negro II
3) Bobby Lee, El Vagabundo vs Mr. Krimen, Takamba

MORA (SUN) 05/21/1978 Arena Neza [Box Y Lucha 1335, Halcon 311, Matt Farmer]Attendance: 3500
1) Mario Valenzuela vs Chamaco Escobedo [UWA LIGHT, torneo]
## unclear where this is part of the tournament, but Valenzuela's national lightweight title does not appear on the line. This was to be Valenzuela jumping from EMLL to Mora, but Box Y Lucha 1335 doesn't mention the match in their results and elsewhere says EMLL believes Valenzuela is still under contract, so it might have been scrapped
2) Alberto Muñoz, Halcón 78 vs Villano I, Villano III
3) La Dama Enmascarada (70s), La Medusa b Oyuki, Vicky Carranza
4) Irma González, Pantera Sureña b Estela Molina, Marina Rey
5) Canek, Karloff Lagarde, Ray Mendoza b Anibal, El Solitario, Huracán Ramírez
&& Originally planned for Cuatro Caminos, moved at the last minute to Arena Neza when Naucalpan blocked the show (which is implied to be blocking women from wrestling)

MORA (SUN) 05/21/1978 Toreo de Cuatro Caminos, Naucalpan, Estado de México [https://twitter.com/ostpies/status/1396221334070300673/photo/4 Arena Box y Lucha 1030]
1) Mario Valenzuela vs Chamaco Escobedo
2) Villano I, Villano III vs Alberto Muñoz, Halcón 78
3) Dama Enmascarada, La Medusa vs Oyuki, Vicky Carranza
4) Irma González, Pantera Sureña vs Estela Molina, Marina Rey
5) Anibal, El Solitario, Huracán Ramírez vs Canek, Karloff Lagarde, Ray Mendoza

indy (MON) 05/22/1978 Tampico, Tamaulipas [Box Y Lucha 1336]
1) Karloff Lagarde, Rene Guajardo b Halcón 78, Huracán Ramírez

EMLL (TUE) 05/23/1978 Arena Coliseo [Box Y Lucha 1336, Lucha Libre 753, http://wrestlingclassics.com/cgi-bin/.ubbcgi/ultimatebb.cgi?ubb=get_topic&f=10&t=004698 MF]
1) Ary Romero b Tommy Nava
2) Caballero Blanco DQ Gran Davis
3) Mr. Lancer b Bufalo Salvaje
4) Chamaco Ortiz DRAW Nómada
5) El Supremo, Lizmark b Américo Rocca, Dr. O’Borman
## tecnicos took 1/3. Best match on the night.
6) Blue Demon, El Monarca, José Luis Mendieta b Escorpión I, Karate Hayato, Manuel Robles
## Karate Hayato showing up as a a main event indicates they were scrambling to find people
&& top two matches changed a lot with no Divino Roy, Tony Salazar or Escorpion II (not on original card) mentioned as being missing.

EMLL (TUE) 05/23/1978 Arena Coliseo Guadalajara [El Informador 1978-05-23]
1) ? vs ??
2) ? vs ??
3) ? vs ??
4) Cachorro Mendoza, Mano Negra, Robot R-2 vs El Nazi, Sagitario, Sangre Chicana
5) Ringo Mendoza vs Perro Aguayo [super libre]

indy (TUE) 05/23/1978 Gimnasio Ajusco, Coyoacán, Distrito Federal [Box Y Lucha 1335]
1) Joe Marino vs Rolando Valentino
2) Rafael Salamanca vs Reu Saul
3) José Luis Mendieta vs Leo López
4) Enrique Vera, Kato Kung Lee, Kung Fu vs Bruno Victoria, Herodes, Rizado Ruiz

indy (WED) 05/24/1978 Arena Coliseo Acapulco, Acapulco, Guerrero [Box Y Lucha 1335, Lucha Libre 753]
1) Guerrero vs Aristos
2) Mario Valenzuela vs Sergio Borrayo
3) Kato Kung Lee, Kung Fu, Ringo Mendoza vs Divino Roy, Gemelo Diablo I, Gemelo Diablo II
4) Lizmark vs Roy Lancer [mask, hair]
5) El Faraón  (c) b Alfonso Dantes [NWA LH]

indy (WED) 05/24/1978 Arena San Juan Pantitlan, Ciudad Nezahualcóyotl, Estado de México [Box Y Lucha 1335]
1) Apache Negro vs El Baby
2) Pepe Romero vs Águila Real
3) El Caballero vs Esclavo De Oro
4) Misterio Blanco I, Misterio Blanco II vs Al Suarez, Centinela
5) Ciclón Moreno, Estrella Del Sur vs Hermano Simba I, Hermano Simba II

indy (WED) 05/24/1978 Arena Xochimilco, Xochimilco, Distrito Federal [Box Y Lucha 1335]
1) Sombra de Plata I, Sombra De Plata II vs Bárbaro Fonseca, Benny Castello
2) Raúl Santana vs Chacal de la Rosa
3) Hombre Nuclear, Impacto vs El León Negro, Siberiano
4) Anibal, Black Man, El Solitario vs Kanek, Karloff Lagarde, Sonny War Cloud

indy (WED) 05/24/1978 Xalapa, Veracruz [Halcon 347]
1) Cesar Valentino  (c) b Huracán Ramírez [UWA JLH]

indy (THU) 05/25/1978 Arena Santa Maria Aztahuacan, Iztapalapa, Distrito Federal [Box Y Lucha 1335, Box Y Lucha 1336]
1) Dany Martinez vs Estrella Fantasma
2) Fantasma Del Bajio vs Príncipe Uxmal
3) Mr. Neblina vs Rudy Palma
4) Fantastic vs El Sanguinario
5) Blue Demon b Rizado Ruiz [hair]
## said to be a great match

EMLL (FRI) 05/26/1978 Arena Coliseo [Box Y Lucha 1335, Box Y Lucha 1336, http://wrestlingclassics.com/cgi-bin/.ubbcgi/ultimatebb.cgi?ubb=get_topic&f=10&t=004698 Matt Farmer]
1) Kalimaco b Diogenes
2) Roy Lancer b Chamaco Ortiz
3) Franco Colombo DQ Américo Rocca
4) Flama Azul b Manuel Robles
5) José Luis Mendieta b Leo López
6) Escorpión I, Escorpión II b Kato Kung Lee, Kung Fu
7) Alfonso Dantes, Sangre Chicana b Halcón Ortiz, Ringo Mendoza
## Rudos won cleanly, took 2/3.

EMLL (SAT) 05/27/1978 Pista Arena Revolución [Box Y Lucha 1335]
1) Tommy Nava vs El Maldito
2) Ary Romero vs Mr. Lancer
3) Mr. Steel vs Irazú
4) El Invasor vs El Talismán
5) Lizmark vs Huroki Sito
6) Cachorro Mendoza, José Luis Mendieta vs Bruno Victoria, Demonio Blanco
7) Blue Demon, El Monarca vs Gemelo Diablo I, Gemelo Diablo II

indy (SAT) 05/27/1978 Arena Xochimilco, Xochimilco, Distrito Federal [Box Y Lucha 1335]
1) Atomos vs Chacal de la Rosa
2) Bengala I, Bengala II vs Comanche, Príncipe Odin
3) Hermano Muerte I, Hermano Muerte II vs Javier Llanes, Tamba
4) Alberto Muñoz, El Matematico, Huracán Ramírez vs Villano I, Villano II, Villano III

indy (SAT) 05/27/1978 Arena Zapata, Cuautla, Morelos [Box Y Lucha 1335]
1) El Chacal vs Pequeño Veneno [super libre]
2) Bárbaro Fonseca vs Johnny El Olímpico
3) Kenji Kaplin, Roberto Rey vs Danny Cruz, Negro Navarro
4) Pantera Negra, Ray Mendoza vs Astro Rey, La Sombra

indy (SAT) 05/27/1978 Nueva Arena Apatlaco, Iztapalapa, Distrito Federal [Box Y Lucha 1335]
1) Bull Santana vs Yayo Valentino
2) Sombra de Plata I, Sombra De Plata II vs León Negro, Texano
3) Black Man, Manuel Robles vs Mr. Bronce, Mr. Cobra
4) Brazo de Oro, Mil Máscaras vs Cesar Valentino, Sonny War Cloud

EMLL (SUN) 05/28/1978 Arena Coliseo [Box Y Lucha 1335, http://wrestlingclassics.com/cgi-bin/.ubbcgi/ultimatebb.cgi?ubb=get_topic&f=10&t=004698 Matt Farmer]
1) El Doberman vs Gran Davis
2) Rafael Salamanca vs Raúl Armas
3) Satánico vs Sergio Borrayo
4) El Supremo, El Vengador vs El Reo, Rizado Ruiz
5) Enrique Vera, Mano Negra, Tony Salazar vs Adorable Rubi, Herodes, Sangre Chicana

EMLL (SUN) 05/28/1978 Arena Coliseo Guadalajara [El Informador 1978-05-28, Halcon 347]
1) ? vs ??
2) ? vs ??
3) ? vs ??
4) Cachorro Mendoza, Cien Caras, El Faraón vs Alfonso Dantes, El Nazi, Sagitario
5) Perro Aguayo  (c) b Ringo Mendoza [NWA MIDDLE]

EMLL (SUN) 05/28/1978 Pista Arena Revolución [Box Y Lucha 1335]
1) Rolando Valentino vs El Maldito
2) Agente X vs Roy Lancer
3) Scaramouche vs Rey Saúl
4) Rodolfo Ruiz vs Chamaco Ortiz
5) El Monarca, José Luis Mendieta vs Escorpión I, Escorpión II and Black Shadow, Kato Kung Lee and Divino Roy, Manuel Robles

indy (SUN) 05/28/1978 Arena Azteca, Calz. Tulyehualco, Iztapalapa, Distrito Federal [Box Y Lucha 1335]
1) Sombra de Plata I, Sombra De Plata II vs La Furia, León Negro
2) Bengala I, Brazo de Oro vs el Signo, Lobo Rubio
3) Alberto Muñoz, El Solitario vs Karloff Lagarde, Septiembre Negro

indy (SUN) 05/28/1978 Arena San Fernando, Huixquilucan, Estado de México [Box Y Lucha 1335]
1) Rodolfo vs Bruno Pere
2) Halconcero vs Flecha Azul
3) Rey Duran vs Escorpión Blanco
4) Memo Juarez vs Flecha Marcada
5) Chivo Martinez, El Poderoso vs Terrible, Torrente I

indy (SUN) 05/28/1978 Arena San Juan Pantitlan, Ciudad Nezahualcóyotl, Estado de México [Box Y Lucha 1335]
1) Atomos vs Pequeño Veneno
2) Loren Lay vs Chacal I
3) Bárbaro Fonseca, Benny Castello vs El Chicano, Kenji Kaplin
4) Bombero, Roberto Rey vs Danny Cruz, Índio Vitela
5) Astro Rey, La Sombra vs Pantera Negra, Renato Torres

indy (SUN) 05/28/1978 Arena Santa Maria Aztahuacan, Iztapalapa, Distrito Federal [Box Y Lucha 1335]
1) Gory Velazquez vs Bendix
2) Victor Del Moral vs Dragón Sangriento
3) La Serpiene vs Kurok
4) Estrella Fantasma, Ringo Medina vs El Chacal, Makabrik
5) Billy Jack, El Mulato vs Gladiador Marino, Mr. Neblina

indy (SUN) 05/28/1978 Club Deportivo y Social Otilio Zurdo Galvan, Saltillo, Coahuila
1) Comodín vs Black Diamond
2) Índio Lopez vs Tony Gutierrez
3) Gato Negro vs Desconocido I
4) Black Power, Rudy Galas vs Costeñito Moy, Penjamo Pequeño [super libre]

indy (SUN) 05/28/1978 Gimnasio Ajusco, Coyoacán, Distrito Federal [Box Y Lucha 1335]
1) Kalimaco vs Diogenes
2) Bufalo Salvaje vs El Onvasor
3) Huroki Sito vs Mr. Steel
4) Águila Solitaria, Lizmark, Mr. Lancer vs Américo Rocca, Leo López, Príncipe Carnero

indy (SUN) 05/28/1978 Oaxaca, Oaxaca [Halcon 347]
1) Mil Máscaras  (c) b Temojin el Mongol [IWA Heavy]

indy (MON) 05/29/1978 Ciudad Juárez, Chihuahua [Halcon 347]
1) Lalo De Linch, Serpiente Blanca b Delfin, Tony Barbetta [hair]

indy (MON) 05/29/1978 Tampico, Tamaulipas [Box Y Lucha 1336]
1) Karloff Lagarde, Rene Guajardo vs Gran Hamada, Nakamura

EMLL (TUE) 05/30/1978 Arena Coliseo [Box Y Lucha 1336, http://wrestlingclassics.com/cgi-bin/.ubbcgi/ultimatebb.cgi?ubb=get_topic&f=10&t=004698 Matt Farmer]
1) Joe Marino vs Ari Romero
2) Kalimaco vs Caballero Blanco
3) El Invasor vs Agente X
4) Chamaco Ortiz, Talismán vs El Nómada, Tauro
5) Américo Rocca, Rodolfo Ruiz vs Flama Azul, Lizmark
6) Blue Demon, El Monarca vs Demonio Blanco, Sangre Chicana

EMLL (TUE) 05/30/1978 Arena Coliseo Guadalajara [El Informador 1978-05-30]
1) ? vs ??
2) ? vs ??
3) ? vs ??
4) Cesar Curiel, Siglo XX vs El Leopardo, The Irs
5) Cachorro Mendoza, Ringo Mendoza, Robot R-2 vs Alfonso Dantes, El Nazi, Tony Beneto

indy (TUE) 05/30/1978 Cuautitlán, Estado de México [Halcon 347]
1) Babe Richard  (c) b El Húngaro [EDM Light]
2) Negro Navarro  (c) b El Catedrático [EDM Welter]
3) Danny Boy b Águila Real [mask]
## Fernando Amezcua is Aguila Real

indy (TUE) 05/30/1978 Gimnasio Ajusco, Coyoacán, Distrito Federal [Box Y Lucha 1336]
1) El Doberman vs Diogenes
2) Rafael Salamanca vs Rey Saúl
3) Leo López, Raúl Armas vs El Vengador, José Luis Mendieta
4) El Santo, Mano Negra vs Adorable Rubi, Divino Roy

EMLL (WED) 05/31/1978 Arena Coliseo Acapulco, Acapulco, Guerrero [Box Y Lucha 1336]
1) Black Tiger vs ?
2) Flama Azul, Sergio Borrayo vs Chanoc, Huroki Sito
3) Adorable Rubi, Divino Roy vs El Cobarde, Tony Salazar
4) Perro Aguayo, Sangre Chicana vs Mano Negra, Ringo Mendoza

indy (WED) 05/31/1978 Arena San Juan Pantitlan, Ciudad Nezahualcóyotl, Estado de México [Box Y Lucha 1336]
1) Memo Arenas vs Iku
2) Águila Real vs Pepe Romero
3) Centinela vs Tony Ledezma
4) Misterio Blanco I, Misterio Blanco II vs Ram I, Ram II
5) Ariman, El Dinámico vs Hermano Simba I, Hermano Simba II

indy (WED) 05/31/1978 Arena Xochimilco, Xochimilco, Distrito Federal [Box Y Lucha 1336, https://www.facebook.com/LuchaLibreDeAyerdeHoyYSiempre/photos/a.461505387230535.102143.454597374588003/941699475877788/?type=1 DJ Spectro]
1) Raúl Santana, Tawa Vera vs Bárbaro Fonsenca, Benny Castello
2) Black Man, El Catedrático vs La Furia, León Negro
3) Anibal, Dos Caras vs As Charro, Sonny War Cloud
4) Impacto b Siberiano [mask]
## El Siberiano is Raymundo Salvador Mendoza Rodriguez, 26 years old. He would pass away in 1986.

indy (THU) 06/01/1978 Arena Santa Maria Aztahuacan, Iztapalapa, Distrito Federal [Box Y Lucha 1336]
1) Gori Velazuqez vs Dragón Dorado
2) Victor Del Moral vs Bendix
3) Ringo Medina vs Danny Martinez
4) Mr. Neblina vs Príncipe Uxmal
5) El Sanguinario, Enfermero I, Enfermero II vs Fantastic, La Serpiente, Zeus

EMLL (FRI) 06/02/1978 Arena Coliseo [Box Y Lucha 1336, Lucha Libre 753, http://wrestlingclassics.com/cgi-bin/.ubbcgi/ultimatebb.cgi?ubb=get_topic&f=10&t=004698 Matt Farmer]
1) Gran Davis b Tommy Nava
2) Irazú b Talismán
3) El Doberman DRAW Sergio Borrayo
4) El Reo b El Vengador
5) Bruno Victoria b El Imposter
6) Tony Salazar b El Nazi
7) Blue Demon, Kung Fu, Raúl Mata b Escorpión I, Escorpión II, Sangre Chicana

EMLL (SAT) 06/03/1978 Pista Arena Revolución [Box Y Lucha 1336]
1) Caballero Blanco vs Rolando Valentino
2) Mr. Lancer vs Scaramouche
3) Chamaco Ortiz vs El Nómada
4) Satánico vs Rafael Salamanca
5) José Luis Mendieta, Lizmark vs Rizado Ruiz, Rodolfo Ruiz
6) El Monarca, Enrique Vera, Halcón Ortiz vs Gemelo Diablo I, Gemelo Diablo I, Herodes

indy (SAT) 06/03/1978 Arena San Fernando, Huixquilucan, Estado de México [Box Y Lucha 1336]
