
/**********************
luchadb archive (for year 1982)
export started at 2024-05-09 10:32:04
export finished at 2024-05-09 10:58:19

particular parser syntax for nerds:

PROMOTION (DAY) MM/DD/YYYY ArenaName [linkURL linkName]
MatchNo) side1-1, side1-2, side1-3 DECISION side2-1, side2-2, side2-3 [matchstip]

special codes 
(c) champion obviously
## note attached to preeceding match
&& note attached to event
%% attendence (always integer, always suspect) 
** event name
**********************/
EMLL (FRI) 01/01/1982 Arena Coliseo [Box y Lucha 1521, http://wrestlingclassics.com/.ubb/ultimatebb.php?ubb=get_topic;f=10;t=005180 Matt Farmer]
1) Rey David b Caballero Blanco
2) Rafael Salamanca b El Invasor
3) El Doberman, El Egipcio b Belcebú, Rolando Valentino
## debut of Belcebu. Straight falls. Rolando Valentino replaced Bruno Victoria (moved up)
4) El Fantasma, Joe Martin b Bruno Victoria, El Nazi
## debut of Martin. Victoria replaced Divino Roy (ill father.)
5) Cesar Curiel, Máscara Año 2000, Tony Salazar b Adorable Rubi, El Faraón, Satánico

INDIE (FRI) 01/01/1982 Arena San Juan Pantitlan, Ciudad Nezahualcóyotl, Estado de México [Box Y Lucha 1520, KO 1485]
1) Bunny Black vs El Baby
2) Aventurero Chino vs Flash Gordon
3) Ciclón Moreno, Hombre Araña vs León Chino, Rey America
4) Bengala I, Bengala III vs Barba Negra, La Furia
5) Brazo de Oro, Brazo de Plata vs Dios Negro, Dios Rojo

INDIE (FRI) 01/01/1982 Auditorio San Felipe, Soledad de Graciano Sánchez, San Luis Potosi [Box Y Lucha 1520]
1) Halcón Índio vs Doctor Averno
2) Perro Sosa, Romano García vs Chamaco Audaz, Puños De Plata
3) Terrorista I, Terrorista II vs Siki Osama, Tawa Vera
4) El Talismán, Halcón Ortiz vs Crucero I, Pirata Morgan

INDIE (FRI) 01/01/1982 Gimnasio San Pedro, Iztacalco, Distrito Federal [Box Y Lucha 1520]
1) Roy Moreno vs Rudy Acosta
2) Negro Hernández vs Capitán America
3) Apache, Piloto Nazi I, Piloto Nazi II vs El Intocable, La Silueta, Torbellino
4) El Nómada, Enigmatico, Mr. Misterio vs Celeste, Chavo Hernández, Kendor
5) Herodes, Ruby Ruvalcaba vs Cien Caras, Halcón Ortiz

INDIE (FRI) 01/01/1982 Plaza de Toros el Cortijo, Venustiano Carranza, Distrito Federal [Box Y Lucha 1520]
1) Gonzalo Ruiz, Primate vs Chamaco Ramos, Randy García
2) Arturito vs Fili Estrella [super libre]
3) Astro Rey, Ray Mendoza vs Kato Kung Lee, Kung Fu
4) Villano I, Villano II, Villano III vs Brazo de Oro, Brazo de Plata, El Brazo

MORA (FRI) 01/01/1982 Arena Neza [Box Y Lucha 1520, KO 1485]
1) Gran Petroneo vs Tony Ledesma
2) José Luis Feliciano, Negro Casas vs Bull Santana, Solar II
3) Luis Mariscal, Villano I vs Escorpión I, Escorpión II
4) Adrian Street, Scorpió vs Justiciero, Tamba
5) Gran Hamada, Kuniaki Kobayashi, Saito vs Ángel Blanco, Anibal, Babe Face

MORA (FRI) 01/01/1982 Arena Poza Rica, Poza Rica, Veracruz [KO 1485]
1) Lasser vs Puños De Rocca
2) El Matematico vs Takamba
3) Hector Guerrero, Javier Llanes vs El Broncas, El Tiburón
4) Batman, Black Man, Robin vs Black Terry, Lobo Rubio, Rokambole

MORA (FRI) 01/01/1982 Pista Arena Revolución [Box Y Lucha 1520, KO 1485]
1) Ciclón Moreno, Mando Amezcua, Pequeño Solin vs Bestia Rubia, Charro de Jalisco, Destino Negro
2) La Sombra, Tawa Vera vs Rizado Ruiz, Rudy Reyna
3) Cesar Valentino, Coloso Colosetti vs Rayo de Jalisco Jr., Solar I
4) Dos Caras, Mano Negra, Ultraman vs el Signo, Negro Navarro, Texano

EMLL (SAT) 01/02/1982 Arena Puebla [Box Y Lucha 1520]
1) El Virrey, León García vs Diogenes, Minotauro
2) As, Clímax II vs Satangel, Vulcano
3) Pirata Morgan, Rey Salomón vs Cesar Curiel, Mercurio
4) Espectro Jr., Popitekus, Satánico vs Cien Caras, Halcón Ortiz, Tony Salazar

EMLL (SAT) 01/02/1982 Pista Arena Revolución [Box Y Lucha 1520]
1) Terror Blanco vs Aries
2) Caballero Rojo vs Alto Voltaje
3) Dardo Aguilar, Jerry Estrada vs Rodolfo Ruiz, Zorro Mendoza
4) Águila De Plata, Águila Solitaria vs MS-1, Pánico
5) Américo Rocca, El Faraón, Mocho Cota vs El Vengador, Franco Colombo, Máscara Año 2000

INDIE (SAT) 01/02/1982 Arena Xochimilco, Xochimilco, Distrito Federal [Box Y Lucha 1520]
1) Delicado del Moral, Negro Peralta vs Impala, Módulo
2) El Primate, Rocky Norton vs Clímax, Relámpago Dorado
3) El Matematico, Impacto vs Perfumado Reyna, Rizado Ruiz
4) Babe Face, Black Terry vs Black Man, Ultraman
5) Huracán Ramírez, Kato Kung Lee, Kung Fu vs Coloso Colosetti, Guerrillero Valentino, Ray Mendoza

INDIE (SAT) 01/02/1982 Arena Zapata, Cuautla, Morelos [Box Y Lucha 1520]
1) Sombra Chicana vs Chamaco Reyes
2) Tormenta Negra vs Aventurero Chino
3) Tláloc vs Chucho Mar
4) Cuchillo, Gran Petroneo vs Estrella Blanca I, Estrella Blanca II

INDIE (SAT) 01/02/1982 Nueva Arena Apatlaco, Iztapalapa, Distrito Federal [Box Y Lucha 1520]
1) La Silueta vs La Fiera Guerrero
2) Caballero Romano, Tony Aguirre vs Calimaco, Mr. Cobra
3) Catedrático, Negro Casas vs Flama Azul, Fuerza Guerrera
4) El Falcón, Halcón 78, Yuma vs Astro Rey, Bestia Rubia, Máquina Salvaje
5) el Signo, Negro Navarro, Texano vs Villano I, Villano II, Villano III

EMLL (SUN) 01/03/1982 Arena Coliseo [Box Y Lucha 1520]
1) Minotauro vs Rolando Valentino
2) El Nómada, Scaramouche vs Crucero, Rey Salomón and El Centauro, El Vengador and El Celeste, Rafael Salamanca
3) Espectro Jr., Herodes vs Cesar Curiel, Cien Caras and El Fantasma, Halcón Ortiz and Adorable Rubi, Divino Roy

EMLL (SUN) 01/03/1982 Arena Coliseo Guadalajara [El Informador 1982-01-03]
1) ? vs ??
2) ? vs ??
3) ? vs ??
4) Américo Rocca, Calavera I, El Supremo vs Cinta Negra, El Leopardo, Rayo de Jalisco Jr.
5) Alfonso Dantes, El Faraón vs Máscara Año 2000, Ringo Mendoza

EMLL (SUN) 01/03/1982 Arena Puebla [Box Y Lucha 1520]
1) Hermoso Hércules, Tony Arce vs Felino I, Felino II
2) Caballero Rojo, Jerry Estrada, Piloto Suicida vs Bufalo Salvaje, Rodolfo Ruiz, Sombra Poblana
3) Águila De Plata, El Egipcio vs Bruno Victoria, Diogenes
4) Franco Colombo, Hombre Bala vs El Guerrero Negro, Mocho Cota

EMLL (SUN) 01/03/1982 Pista Arena Revolución [Box Y Lucha 1520]
1) Clímax II vs León García
2) Caballero Blanco, Voltio Negro vs Aries, Electrón
3) El Invasor, Rey David vs El As, El Doberman
4) Joe Martin, Mario Valenzuela, Mercurio vs El Nazi, Leo López, Manuel Robles
5) El Faraón vs Satánico

INDIE (SUN) 01/03/1982 Arena Azteca, Iztapalapa, Distrito Federal [Box Y Lucha 1520]
1) Delicado del Moral, La Fiera Guerrero vs Espuelas de Oro I, Espuelas de Oro II
2) Pepe Casas, Relámpago Dorado vs El Primate, Rudy Norton
3) Impala, Negro Casas vs Calimaco, Fuerza Guerrera
4) Flama Azul, Impacto vs El Herrero, El Veterinario
5) El Matematico, Kung Fu, Ultraman vs Black Terry, Coloso Colosetti, Guerrillero Valentino

INDIE (SUN) 01/03/1982 Arena Naucalpan [Box Y Lucha 1520]
1) Chucho Montoya vs Amenaza Del Ring
2) Mike Robledo vs Marduck
3) El Soberbio, Pequeño Solin vs Titanic, Zimba
4) Estrella Blanca I, Estrella Blanca II vs Cuchillo, Rams
5) Black Man, Javier Llanes, Kato Kung Lee vs Escorpión I, Escorpión II, Yuma

INDIE (SUN) 01/03/1982 Arena San Juan Pantitlan, Ciudad Nezahualcóyotl, Estado de México [Box Y Lucha 1520]
1) Memo Arenas vs El Venado
2) Misterio Blanco I vs Gran Petroneo
3) La Sombra, Tawa Vera vs Lobo Rubio, Piloto Mortal
4) Batman, El Matematico, El Monarca vs As Charro, Black Terry, Lobo Rubio
5) Dorrel Dixon, Dos Caras, Tinieblas vs Renato Torres, Sergio el Hermoso, Tláloc

INDIE (SUN) 01/03/1982 Festival, Santa Cruz Atoyac Portales, Benito Juárez, Distrito Federal [Box Y Lucha 1520]
1) Charrito De Oro, Diamante Negro vs El Impala II, Mr. Águila
2) Piloto Nazi I, Piloto Nazi II vs Chico Malo I, Chico Malo II
3) Flecha Verde I, Flecha Verde II vs Amakun, Bello González
4) Chico Malo III vs El Costeño [hair]
5) Corsario Negro, Gran Kendor, La Serpiente vs Dr. Koleman I, Dr. Koleman II, Enigmatico

INDIE (SUN) 01/03/1982 Gimnasio Ramos Millan, Iztacalco, Distrito Federal [Box Y Lucha 1520]
1) Torbellino Rojo II vs Comodín II
2) El Apóstol Infernal, Leo Espinosa vs Saeta Azul, Torbellino Rojo I
3) Batu, Chicano Salvaje I, Chicano Salvaje II vs Lama I, Lama II, Lama III
4) Dr. Averno I, Dr. Averno II, Lobo Rojo I vs Ángel Plateado, Comodín I, El Dandy Infernal
5) Dany Martinez vs Gory Cortes [super libre]

INDIE (SUN) 01/03/1982 Gimnasio San Pedro, Iztacalco, Distrito Federal [Box Y Lucha 1520]
1) Perro Callejero vs Sol De Oriente
2) Chavo Hernández vs Serpiente, Kendor, Piloto Nazi I, Makabro Rojo, El Sanguinario, Enigmatico, Internacional, Chico Malo III, Voluntario [? MIDDLE]
3) Invasor I, Invasor II vs Chico Malo I, Chico Malo II
4) Diamante Negro vs Delta [mask]

INDIE (SUN) 01/03/1982 Plaza de Toros el Cortijo, Venustiano Carranza, Distrito Federal [Box Y Lucha 1520]
1) Pequeño Monarca vs Relámpago Imperial
2) El Britanico, Novato De Oro vs Drake, Zodical
3) Muralla Sangrienta, Panther Mendoza vs El Pavorreal, Triangulo Negro
4) El Guarura vs El Perseo
5) El Indomable, Ringo Medina, Ultraman vs El Lobo Asesino, Renato Ramos, Rudy Ramos

indy (SUN) 01/03/1982 Arena Aficion [KO 1485]
1) El Azteca vs Rudy Sanchez
2) Charro de Jalisco, Chucho Segura vs Barulo Flores, Tino Arrieta
3) Estela Molina, La Monster vs Irma González, Pantera Sureña
4) Kobayashi, Lalo Montenegro, Saito vs El Varaon, Luis Mariscal, Tiburón Jr.

indy (SUN) 01/03/1982 Arena Poza Rica, Poza Rica, Veracruz [KO 1485]
1) El Terrestre vs El Payo
2) Gato Montes vs El Petrolero
3) Lasser vs Tiburón III
4) Irma Águilar, Reyna Galleogos vs La Briosa, Marina Rey

indy (SUN) 01/03/1982 Auditorio Miguel Barragan, San Luis Potosí, San Luis Potosí [KO 1485]
1) La Meudsa vs Vicky Carranza
2) Dick Angelo, Fugitivo, Satán vs Centella Verde, Danny Grimaldo, Galaxis
3) El Rebedle, El Vagabundo vs América Salvaje, Scorpió

indy (SUN) 01/03/1982 Plaza de Toros Valente Arellano, Torreón, Coahuila [El Siglo de Torreon 1982-01-03]
1) ? vs ??
2) ? vs ??
3) Joel García, Mr. Atlantic vs El Mestizo, The King
4) Centella Azul, Mario Saucedo vs El Moro, Star Águilar
5) Águila India, Gran Cochisse vs Calavera II, Índio Vitela

MORA (SUN) 01/03/1982 Arena Lopez Mateos [KO 1485]
1) Huasteco I, Huasteco II vs Rey Cobra, Rocky Santana
2) Clímax, Danny Boy, Hombre Araña vs Perro Sosa, Príncipe Infernal, Romano García
3) Amezcua, Cerebro Tamba, Mando vs El Alacrán, Enfermero I, Enfermero II
4) Batman, Mil Máscaras, Robin vs Anibal, Escorpión I, Escorpión II

MORA (SUN) 01/03/1982 Arena Neza [KO 1485]
1) Blas Espana vs Rayo Tapatío
2) El Campesino, Luis Lopez vs Rudy Ramos, Tony Aguirre
3) As Charro, La Furia vs Leopardo Negro, Rey Halcón
4) José Luis Feliciano, Rokambole, Villano III vs el Signo, Negro Navarro, Texano

INDIE (MON) 01/04/1982 Arena Xochimilco, Xochimilco, Distrito Federal [Box Y Lucha 1520]
1) Escarabajo Rojo vs La Silueta
2) El Climax, Impala vs Mr. Rolling, Negro Peralta
3) Módulo, Relámpago Dorado vs Delicado del Moral, Rocky Norton
4) Catedrático, Negro Casas, Pepe Casas vs Calimaco, El Primate, Fuerza Guerrera
5) El Matematico, Impacto vs El Herrero, Veterinario

MORA (MON) 01/04/1982 Arena Isabel, Cuernavaca, Morelos [KO 1485]
1) Lasser vs Polar
2) Black Man, El Monarca vs Rizado Ruiz, Rudy Reyna
3) La Monster, Marina Rey vs Chela Salazar, Oyuki
4) El Solitario, Rayo de Jalisco vs Villano I, Villano III

MORA (MON) 01/04/1982 Arena Puebla [Box Y Lucha 1520]
1) El Falcón, El Halcón, Tawa Vera vs Escorpión I, Escorpión II, Villano I
2) José Luis Mendieta, Solar I vs As Charro, Astro Rey
3) Luis Mariscal, Scorpió vs Mano Negra, Ultraman
4) el Signo, Negro Navarro, Texano vs Gran Hamada, Kuniaki Kobayashi, Saito

MORA (MON) 01/04/1982 Deportivo Ixtlahuacan, Iztapalapa, Distrito Federal [KO 1485]
1) Pequeño Solin vs Leopardo Negro
2) Enfermero I, Enfermero II vs Javier Llanes, La Sombra
3) Black Terry, Lobo Rubio vs Brazo de Oro, Brazo de Plata
4) Dos Caras, Hamada, Ultraman vs Babe Face, Cesar Valentino, Coloso Colosetti

EMLL (TUE) 01/05/1982 Arena Coliseo [http://wrestlingclassics.com/.ubb/ultimatebb.php?ubb=get_topic;f=10;t=005180 Matt Farmer]
1) Clímax II b Voltio Negro
2) El Egipcio, Tony Salazar b Belcebú, Satánico
3) El Nazi, Pirata Morgan, Satánico b Bruno Victoria, Manuel Robles, Pánico
4) Franco Colombo, Halcón Ortiz, Tony Salazar b El Doberman, Mercurio, Rafael Salamanca
&& ruleta rusa determined matches

EMLL (TUE) 01/05/1982 Arena Coliseo Guadalajara [El Informador 1982-01-05]
1) ? vs ??
2) ? vs ??
3) ? vs ??
4) Águila India, Gran Cochisse vs Índio Jerónimo, Índio Vitela
5) Máscara Año 2000, Rayo de Jalisco Jr., Ringo Mendoza vs Américo Rocca, El Faraón, El Supremo

MORA (TUE) 01/05/1982 Arena Aficion [Box y Lucha 1521]
1) Black Terry vs El Matematico
2) Rizado Ruiz, Rudy Reyna vs Kuniaki Kobayashi, Saito
3) Dorrel Dixon, Rayo de Jalisco vs Luis Mariscal, Scorpió
4) el Signo, Negro Navarro, Texano vs El Solitario, Fishman, Gran Hamada

EMLL (WED) 01/06/1982 Arena Coliseo Acapulco, Acapulco, Guerrero [Box y Lucha 1521]
1) El Anonimo, El Fugitivo vs El Renegado, Príncipe Temoc
2) Aristóteles, El Galeonero vs Histrion, Marcos Nava
3) Cien Caras, Franco Colombo vs Herodes, Mocho Cota
4) Lizmark, Tony Salazar vs Espectro Jr., Satánico

indy (WED) 01/06/1982 Arena San Juan Pantitlan, Ciudad Nezahualcóyotl, Estado de México [Box y Lucha 1521]
1) Halcón Índio, Halcón Índio II vs Correcaminos, Perro Callejero
2) Ángel Plateado, Rayo Diabólico vs El Ciriaco, Star Boy
3) El Dinámico, El Zafiro vs El Intocable, Médico Forense
4) Misterio Blanco, Silver Star vs Gran Petroneo, León Chino

MORA (WED) 01/06/1982 Arena Naucalpan [Box y Lucha 1521]
1) Clímax, El Bombero vs Rams, Zimba
2) Javier Llanes, Romano García vs El Primate, Rey Neptuno
3) Dorrel Dixon, Kato Kung Lee, Kuniaki Kobayashi vs Leopardo Negro, Lobo Rubio, Villano II
4) Lola González, Panterita Surena vs Estela Molina, La Briosa

MORA (WED) 01/06/1982 Arena Querétaro [http://www.facebook.com/photo.php?fbid=510531092322424&set=p.510531092322424&type=1 Arena QRO Facebook, Box Y Lucha 1521, KO 1485]
1) Destino Negro vs Pequeño Solin
2) Rokambole vs Príncipe Valiente
3) Luis Mariscal, Villano I vs Black Man, El Falcón
4) el Signo, Negro Navarro, Texano vs Brazo de Oro, Brazo de Plata, El Brazo
5) Ray Mendoza, Villano III vs Enrique Vera, Gran Hamada
&& Box y Lucha lists this as Arena Corregidora.

EMLL (THU) 01/07/1982 Arena Zapata, Acapulco, Guerrero [Box y Lucha 1521]
1) Lintera Verde, Talismán Negro vs El Fariseo, El Graduado
2) El Esclavo, Kendor vs El Emigrante I, El Fugitivo
3) Black Silver, Hipocampo vs Antares, El Apolo
4) Franco Colombo, Lizmark vs Alma Grande, Mocho Cota

indy (THU) 01/07/1982 Arena Poza Rica, Poza Rica, Veracruz [Box y Lucha 1521]
1) Bestia Rubia vs Tawa Vera
2) As Charro vs El Falcón
3) Astro Rey vs Javier Llanes
4) Rizado Ruiz, Rudy Reyna, Scorpió vs Brazo de Oro, Brazo de Plata, Hector Guerrero

MORA (THU) 01/07/1982 Pista Arena Revolución [Box y Lucha 1521]
1) Black Man, El Matematico vs Enfermero I, Enfermero II
2) Escorpión I, Escorpión II vs El Monarca, José Luis Mendieta
3) Mano Negra, Solar I, Ultraman vs Black Terry, Luis Mariscal, Villano I
4) Dos Caras, El Solitario, Fishman vs Canek, Dr. Wagner, Villano III

EMLL (FRI) 01/08/1982 Arena Coliseo [http://wrestlingclassics.com/.ubb/ultimatebb.php?ubb=get_topic;f=10;t=005180 Matt Farmer]
1) ?, ?? vs ???, ????
2) ?, ?? vs ???, ????
3) Celeste, El Doberman vs El Crucero, Manuel Robles
4) Franco Colombo, Talismán vs Américo Rocca, Mocho Cota
5) Cesar Curiel, Máscara Año 2000, Ringo Mendoza vs Adorable Rubi, El Faraón, Satánico

MORA (FRI) 01/08/1982 Arena Neza [Box y Lucha 1521]
1) Enfermero I, Enfermero II vs El Falcón, La Sombra
2) El Matematico, Solar I vs As Charro, Black Terry
3) Rizado Ruiz, Rudy Reyna vs Brazo de Oro, Brazo de Plata
4) Hector Guerrero, Mano Negra, Rayo de Jalisco vs Scorpió, Villano I, Villano II
5) el Signo, Negro Navarro, Texano vs Dos Caras, El Solitario, Fishman

indy (SAT) 01/09/1982 Arena Zapata, Cuautla, Morelos [Box y Lucha 1521]
1) Sombra Chicana II vs Máscara India II
2) Sombra Chicana I vs Máscara India I
3) Estrella Blanca Jr., Pequeño Solin vs Gran Petroneo, Zafiro Infernal
4) Estrella Blanca I, La Sombra vs Cuchillo, Tláloc

MORA (SAT) 01/09/1982 Arena Apatlaco, Iztapalapa, Distrito Federal [Box y Lucha 1521]
1) La Silueta, Tony Aguirre vs Fiera Guerrero, Negro Peralta
2) Impala, Pequeño Solin vs El Herrero, Mr. Cobra
3) Módulo, Negro Casas vs El Yuma, Rocky Norton
4) Bello Greco, Sergio el Hermoso vs Perfumado Reyna, Rizado Ruiz
5) Gran Hamada, Kuniaki Kobayashi, Saito vs el Signo, Negro Navarro, Texano

MORA (SAT) 01/09/1982 Arena Isabel, Cuernavaca, Morelos [Box y Lucha 1521]
1) Escorpión II vs Brazo de Plata
2) Escorpión I vs Brazo de Oro
3) Dory Dixon, Mano Negra vs Luis Mariscal, Scorpió
4) Dos Caras, El Solitario, Fishman vs Canek, Dr. Wagner, Villano III

MORA (SAT) 01/09/1982 Arena Xochimilco, Xochimilco, Distrito Federal [Box y Lucha 1521]
1) Caballero Romano vs Delicado del Moral
2) Flama Azul, Relámpago Dorado, Suicida vs Bestia Rubia, Kalimaco, Primate
3) Black Man, El Matematico vs Black Terry, Fuerza Guerrera
4) Astro Rey, Villano I, Villano II vs El Falcón, El Impacto, Ultraman
5) Blue Demon, Kato Kung Lee, Kung Fu vs Coloso Colosetti, Guerrillero Valentino, Ray Mendoza

EMLL (SUN) 01/10/1982 Arena Coliseo Guadalajara [El Informador 1982-01-10]
1) ? vs ??
2) ? vs ??
3) ? vs ??
4) Águila India, Gran Cochisse, Olímpico Flores vs Calavera I, Calavera II, El Supremo
5) El Halcón, Ringo Mendoza vs Alfonso Dantes, El Faraón

indy (SUN) 01/10/1982 Arena Santa Maria Aztahuacan, Iztapalapa, Distrito Federal [Box y Lucha 1521]
1) Enigma Azul vs Batu
2) Sodiacan vs El Britanico
3) Muralla Sangrienta, Novato De Oro vs Cobra Azteca, Macabrick
4) El Indomble, Ringo Medina, Ultraman vs Lobo Asesino, Renato Ramos, Rudy Ramos
5) Guarura vs Perseo [mask]

indy (SUN) 01/10/1982 Gimnasio Ramos Millan, Iztacalco, Distrito Federal [Box y Lucha 1521]
1) Torbellino Rojo vs Coyote Negro
2) El Chicano vs Mr. Tormenta
3) Lama I, Lama II vs Batu, Oliver
4) Comodín I, Comodín II vs Lobo Rojo I, Lobo Rojo II
5) Dany Martinez vs Gori Cortes [hair]

indy (SUN) 01/10/1982 Plaza de Toros el Cortijo, Venustiano Carranza, Distrito Federal [Box y Lucha 1521]
1) Kato Kung Lee, Kung Fu vs Kalimaco, Luis Mariscal and El Falcón, Halcón 78 and Polarys I, Polarys II and Tawa Vera, Tigre Del Ring and As Charro, Barba Negra and Rayo Dorado I, Rayo Dorado II and Rocky Norton, Satán

indy (SUN) 01/10/1982 Plaza de Toros Valente Arellano, Torreón, Coahuila [El Siglo de Torreon 1982-01-10]
1) ? vs ??
2) ? vs ??
3) Joe Andrade, Mr. Atlantic vs El Mestizo, Gran Sabú
4) El Moro, Star Águilar vs Centella Azul, Joel García
5) Índio Jerónimo, Índio Vitela vs Mario Saucedo, Tony Salazar

MORA (SUN) 01/10/1982 Arena Azteca, Calz. Tulyehualco, Iztapalapa, Distrito Federal [Box y Lucha 1521]
1) Delicado del Moral, La Fiera Guerrero vs Caballero Romano, Módulo
2) Astro Rey, Máquina Salvaje, Mr. Cobra vs Flama Azul, Pepe Casas, Relámpago Dorado
3) El Impacto vs El Herrero [DF LH]
4) Fuerza Guerrera  (c) vs Impala [DF LIGHT]
5) Huracán Ramírez, Ultraman vs Coloso Colosetti, Guerrillero Valentino
6) Black Terry  (c) vs El Matematico [UWA LIGHT]

MORA (SUN) 01/10/1982 Arena Naucalpan [Box y Lucha 1521]
1) Bunny Black vs Cataclismo
2) Morduk vs Mike Robledo
3) Estrella Blanca I, Estrella Blanca Jr. vs El Comunista, Titanic
4) Danny Boy, Pequeño Solin vs Rams, Timba
5) Black Man, Javier Llanes, Mil Máscaras vs ?, ??, Yuma

MORA (SUN) 01/10/1982 Arena Puebla [Box y Lucha 1521]
1) Mano Negra, Ultraman vs Rizado Ruiz, Rudy Reyna
2) Cesar Valentino, Coloso Colosetti vs Dorrel Dixon, Huracán Ramírez
3) el Signo, Negro Navarro, Texano vs Hamada, Kobayashi, Saito
4) El Solitario, Enrique Vera, Fishman vs Anibal, Canek, Perro Aguayo

MORA (SUN) 01/10/1982 Arena San Juan Pantitlan, Ciudad Nezahualcóyotl, Estado de México [Box y Lucha 1521]
1) El Boy vs Pequeño Veneno
2) Memo Arenas vs El Vengado [super libre]
3) Bestia Rubia, Piloto Mortal vs El Bombero, Misterio Blanco I
4) El Matematico, Tawa Vera vs Black Terry, Lobo Rubio
5) Bello Greco, La Sombra, Sergio el Hermoso vs As Charro, Renato Torres, Talaloc

MORA (SUN) 01/10/1982 Toreo de Cuatro Caminos, Naucalpan, Estado de México [https://www.facebook.com/groups/1461911524124484/permalink/1571879093127726/ Matt Farmer]
1) Irma González, Lola González b La Monster, Marina Rey
2) Dorrel Dixon, Dos Caras b Escorpión I, Escorpión II
3) Adrian Street, Anibal, Dr. Wagner b Gran Hamada, Kuniaki Kobayashi, Saito
4) Ray Mendoza, Villano I, Villano II b el Signo, Negro Navarro, Texano
5) El Solitario, Fishman b Canek, Perro Aguayo

EMLL (TUE) 01/12/1982 Arena Coliseo Guadalajara [El Informador 1982-01-12]
1) ? vs ??
2) ? vs ??
3) ? vs ??
4) El Dorado, Orión vs El Salvaje, Índio Vitela
5) El Halcón, El Leopardo, Ringo Mendoza vs El Faraón, El Supremo, Índio Jerónimo

indy (TUE) 01/12/1982 Parque de Beisbol, Aguilar y mara, Guanajuato, Guanajuato [Box y Lucha 1521]
1) Escarabarjo De Oro vs Circuito II
2) La Mole vs Potreo
3) Destructor Nazi, José Luis Feliciano vs José Luis Lopez, Soberabio
4) Gran Petroneo vs Tony Ledezma [mask, ? CHAMP]
5) Tinieblas vs El Sibernaio [hair]
## 10000 pesos (Tinibleas) vs Siberiano's hair

indy (WED) 01/13/1982 Arena Naucalpan [luchablog photolog (20130915_234658)]
1) Clímax, El Bombero vs Rams, Zimba
2) Cuchillo, Yuma vs Danny Boy, Javier Llanes
3) Black Man, Impacto, Kung Fu vs Villano I, Villano II, Villano III
4) La Venus, Lola González, Panterita Surena vs Estela Molina, Marina Rey, Rossy Moreno

indy (WED) 01/13/1982 Arena Querétaro [luchablog photolog (20130915_234658)]
1) Dalton Stone vs Bull Santana
2) Leopardo Negro vs La Sombra
3) El Matematico, José Luis Mendieta vs Rizado Ruiz, Rudy Reyna
4) Dorrel Dixon, Enrique Vera, Mano Negra vs el Signo, Negro Navarro, Texano
5) El Solitario, Fishman, Gran Hamada vs Anibal, Canek, Perro Aguayo

EMLL (THU) 01/14/1982 Pista Arena Revolución [luchablog photolog (20130915_234658)]
1) El Matematico, José Luis Mendieta, Tawa Vera vs Destino Negro, El Enfermero I, El Enfermero II
2) El Monarca, Mano Negra vs As Charro, Black Terry
3) Hector Guerrero, Rayo de Jalisco vs Villano I, Villano II
4) Dorrel Dixon, El Solitario, Kuniaki Kobayashi vs Coloso Colosetti, Dr. Wagner, Perro Aguayo

indy (THU) 01/14/1982 Arena Poza Rica, Poza Rica, Veracruz [luchablog photolog (20130915_234658)]
1) El Petrolero vs Gato Herrera
2) El Brazo vs Leopardo Negro
3) As Charro vs El Falcón
4) Luis Mariscal, Scorpió, Villano III vs el Signo, Negro Navarro, Texano

indy (THU) 01/14/1982 Arena Xalapa, Xalapa, Veracruz [luchablog photolog (20130915_234658)]
1) ?, As Charro, Lobo Rubio vs Black Man, Emilio Charles Jr., La Sombra
2) Kung Fu, Solar I, Ultraman vs Máquina Salvaje, Septiembre Negro, Súper Máquina

EMLL (FRI) 01/15/1982 Arena Coliseo [luchablog photolog (20130915_234658)]
1) Rey David vs Yanco
2) Jerry Estrada vs Rodolfo Ruiz
3) El Egipcio, Mercurio vs Manuel Robles, Rey Salomón
4) Adorable Rubi, Satánico vs El Halcón, Lizmark and El Faraón, El Nazi and Cesar Curiel, Máscara Año 2000 and Takasugi, Tony Salazar

indy (FRI) 01/15/1982 Arena Neza [luchablog photolog (20130915_234658)]
1) El Falcón, El Matematico vs Cuchillo, Rokambole
2) Irma Águilar, Lola González vs La Monster, Rossy Moreno
3) Siglo XX, Solar I vs América Salvaje, Luis Mariscal
4) Brazo de Oro, Brazo de Plata vs Anibal, Coloso Colosetti
5) El Solitario, Enrique Vera, Rayo de Jalisco vs el Signo, Negro Navarro, Texano

indy (FRI) 01/15/1982 Deportivo Arena México, Puebla, Puebla [luchablog photolog (20130915_234658)]
1) Pequeño Solin vs Leopardo Negro
2) Batman, Robin vs Lobo Rubio, Polar
3) As Charro, Black Terry, Huichol vs El Monarca, Hector Guerrero, Kung Fu
4) José Luis Mendieta, Mano Negra, Ultraman vs Astro Rey, Rizado Ruiz, Rudy Reyna
5) Canek, Dr. Wagner, Perro Aguayo vs Ray Mendoza, Villano I, Villano III

EMLL (SAT) 01/16/1982 Arena Puebla [luchablog photolog (20130915_234658)]
1) Cid Campeador, Tony Arce vs Felino I, Felino II
2) El As, El Doberman vs MS-1, Tierra Viento y Fuego
3) Águila De Plata, El Fantasma vs Leo López, Mocho Cota
4) Popitekus vs Cien Caras
5) Hombre Bala, Lizmark, Tony Salazar vs Adorable Rubi, El Faraón, Satánico

indy (SAT) 01/16/1982 Auditorio Emiliano Zapata, Cuautla, Morelos [luchablog photolog (20130915_234658)]
1) Mastin vs Galaxia
2) Memo Arenas vs Cachorro Lopez
3) Gran Petroneo vs Zafiro
4) Bull Santana, La Sombra vs Hombre Nuclear, Tawa Vera

EMLL (SUN) 01/17/1982 Arena Coliseo [luchablog photolog (20130915_234658)]
1) Diogenes vs Caballero Blanco
2) Águila De Plata, El Vengador vs Belcebú, El Invasor
3) Leo López, Manuel Robles vs Mercurio, Takasugi
4) Cesar Curiel, Cien Caras, Máscara Año 2000 vs Adorable Rubi, El Nazi, Espectro Jr.

EMLL (SUN) 01/17/1982 Arena Coliseo Guadalajara [El Informador 1982-01-17]
1) ? vs ??
2) ? vs ??
3) ? vs ??
4) El Halcón, Lismark vs Américo Rocca, Herodes
5) El Faraón vs Ringo Mendoza [super libre]

EMLL (SUN) 01/17/1982 Pista Arena Revolución [luchablog photolog (20130915_234658)]
1) Terror Blanco vs Aries
2) Aristos, El Guerrero vs Electrón, León García
3) Rey David, Tony Arce vs Aristóteles, Yanco
4) Bufalo Salvaje, MS-1 vs El As, El Doberman
5) Talismán, Tony Salazar vs Mocho Cota, Satánico

indy (SUN) 01/17/1982 Arena Aficion [luchablog photolog (20130915_234658)]
1) Chamaco Robles, Silver Star vs Alma Negra, Braulio Flores
2) Príncipe Valiente I, Príncipe Valiente II vs Takamba, Teddy
3) El Azteca, Lalo Montenegro vs Tiburón III, Tiburón Jr.
4) Charro de Jalisco, El Monarca vs Benny Castello, Blue Panther

indy (SUN) 01/17/1982 Arena Atlas, Col Valle Guadalupe, Tenancingo, Estado de México [luchablog photolog (20130915_234658)]
1) Alex Rivera, Aventurero vs Desertor, Tharots
2) Rodan Xx I, Rodan Xx II vs Brujo Maldito, Gastro Del Valle
3) Ébano Ruiz, Mahoma vs Leo Ramírez, Toro Sentado
4) Armando Montoya, Príncipe Gitano vs ?, ??

indy (SUN) 01/17/1982 Arena Azteca Budokan, Ciudad Nezahualcoyotl, Estado de México [luchablog photolog (20130915_234658)]
1) Espuelas de Oro I, Espuelas de Oro II vs Escarabajos I, Escarabajos II
2) Delicado del Moral, Fiera Guerrera vs Látigo Negro, Ultra Roja
3) El Herrero, Rocky Norton vs Caballero Romano, Impala
4) Calimaco, Fuerza Guerrera vs Módulo, Relámpago Dorado
5) El Libertador, Flama Azul, Pepe Casas vs Máquina Salvaje, Polaris I, Polaris II

indy (SUN) 01/17/1982 Arena Lopez Mateos [luchablog photolog (20130915_234658), http://superluchas.com/2015/01/17/en-un-dia-como-hoy-1982-huracan-ramirez-vs-anibal-1969-mil-mascaras-y-huracan-ramirez-vs-solitario-y-angel-blanco/ SuperLuchas]
1) ? vs ??
2) ? vs ??
3) Chela Salazar, Sarahi b La Hiena, Marina Rey
## Replaced the other women's match?
4) Irma Águilar, Irma González vs La Briosa, Medussa
5) Tamba vs El Alacrán [DF HEAVY]
## Tamba is champion

indy (SUN) 01/17/1982 Arena Neza [luchablog photolog (20130915_234658)]
1) Rayo Tapatío vs Pequeño Gigiante
2) Dr. Maligno vs Blas Espana
3) Gran Petroneo, Rey Halcón vs El Dorado, Pepe Casas
4) Luis Lopez vs Tony Aguirre [super libre]
5) José Luis Feliciano, Villano III vs As Charro, Cuchillo

indy (SUN) 01/17/1982 Arena Poza Rica, Poza Rica, Veracruz [luchablog photolog (20130915_234658)]
1) Pequeño Bena vs Payo III
2) El Puma vs Lucano
3) Ciclón Moreno, Clímax vs Gorillta Flores, Polar
4) Siglo XX vs Scorpió

indy (SUN) 01/17/1982 Arena Puebla [luchablog photolog (20130915_234658)]
1) El Crucero, Jerry Estrada vs El Egipcio, El Reo
2) Franco Colombo, Joe Martin vs El Supremo, Pánico

indy (SUN) 01/17/1982 Arena Querétaro [luchablog photolog (20130915_234658)]
1) Furia Negra vs Ramiro Santos
2) Destructor Nazi vs Takamba
3) ? vs ??
4) Perro Sosa, Satán vs Babe Richard, Leopardo Negro
5) Rokambole, Villano II vs Hector Guerrero, Justiciero

indy (SUN) 01/17/1982 Arena San Juan Pantitlan, Ciudad Nezahualcóyotl, Estado de México [luchablog photolog (20130915_234658)]
1) El Chacal vs El Babe
2) Escorpión III vs Chacal de la Rosa
3) 13 Negro, Barba Negra vs Misterio Blanco I, Misterio Blanco II
4) El Sombero, La Sombra vs América Salvaje, Hombre Nuclear
5) El Greco, Sergio el Hermoso vs Septiembre Negro, Súper Máquina

indy (SUN) 01/17/1982 Arena Santa Maria Aztahuacan, Iztapalapa, Distrito Federal [Box y Lucha 1524]
1) Drake, Zodical b Astro Salvaje I, Astro Salvaje II [mask]
## Astro Salvajes are Lino Aguilar and Mario Aguilar.

indy (SUN) 01/17/1982 Arena Toluca, Toluca, Estado de México [luchablog photolog (20130915_234658)]
1) Astro Boy, Gato Blanco vs El Coyote, Tláloc
2) Danger, El Felino vs Billy Jack, Ranchero
3) Bull Santana, Martha vs Dalton Stone, El Tiburón
4) India Sioux, Medussa vs Oyuki, Selene

indy (SUN) 01/17/1982 Plaza de Toros Valente Arellano, Torreón, Coahuila [El Siglo de Torreon 1982-01-17]
1) El Bronco vs Ángel De La Muerte
2) Joe Andrade vs Guapo Ibarra
3) Ciclón Negro vs Gran Sabú
4) Centella Azul, El Rebelde, Joel García vs El Mestizo, El Moro, The King
5) Mario Saucedo, Rayo de Jalisco Jr. vs Asesino Negro, El Salvaje

MORA (SUN) 01/17/1982 Arena Naucalpan [http://superluchas.com/2015/01/17/en-un-dia-como-hoy-1982-huracan-ramirez-vs-anibal-1969-mil-mascaras-y-huracan-ramirez-vs-solitario-y-angel-blanco/ SuperLuchas]
1) Fili Estrella, Pequeño Goliath b Arturito, Gulliver

MORA (SUN) 01/17/1982 Toreo de Cuatro Caminos, Naucalpan, Estado de México [http://superluchas.com/2015/01/17/en-un-dia-como-hoy-1982-huracan-ramirez-vs-anibal-1969-mil-mascaras-y-huracan-ramirez-vs-solitario-y-angel-blanco/ SuperLuchas]
1) Chela Salazar b Marina Rey
2) Rizado Ruiz, Rudy Reyna b José Luis Mendieta, Solar I
3) Cesar Valentino, Coloso Colosetti, Luis Mariscal b Brazo de Oro, Brazo de Plata, Ultraman
4) Anibal, Canek, Dr. Wagner b Dorrel Dixon, Huracán Ramírez, Rayo de Jalisco
5) el Signo, Negro Navarro, Perro Aguayo, Texano b El Solitario, Enrique Vera, Fishman, Gran Hamada

EMLL (TUE) 01/19/1982 Arena Coliseo [Box Y Lucha 1524, http://wrestlingclassics.com/.ubb/ultimatebb.php?ubb=get_topic;f=10;t=005180 Matt Farmer]
1) Rolando Valentino DRAW Diogenes
2) Voltio Negro b Clímax II
3) Águila De Plata, El As b Bufalo Salvaje, Rodolfo Ruiz
4) Leo López, MS-1 b El Celeste, El Egipcio
5) Franco Colombo, Joe Martin, Rayo de Jalisco Jr. DQ La Fiera, Mocho Cota, Satánico

EMLL (TUE) 01/19/1982 Arena Coliseo Guadalajara [El Informador 1982-01-19]
1) ? vs ??
2) ? vs ??
3) ? vs ??
4) Águila India, Gran Cochisse vs Índio Jerónimo, Índio Vitela
5) El Halcón, Lismark, Ringo Mendoza vs Américo Rocca, El Faraón, Herodes

EMLL (TUE) 01/19/1982 Pista Arena Revolución [luchablog photolog (20130915_234658)]
1) Minotauro vs Rolando Valentino
2) Voltio Blanco, Voltio Negro vs Caballero Rojo, Clímax
3) Nómada, Scaramouche vs Celeste, Rafael Salamanca
4) El Reo, Mario Valenzuela vs Belcebú, Pánico
5) Lizmark, Rayo de Jalisco Jr., Tony Salazar vs Américo Rocca, Espectro Jr., Herodes

EMLL (THU) 01/21/1982 Arena Coliseo Guadalajara [El Informador 1982-01-21]
1) ? vs ??
2) ? vs ??
3) ? vs ??
4) Ángel del Silencio, Cinta Negra, El Leopardo vs Asesino Negro, Calavera I, Calavera II
5) Cien Caras, Lismark vs El Faraón, Herodes

EMLL (FRI) 01/22/1982 Arena Coliseo [Box y Lucha 1524, http://wrestlingclassics.com/.ubb/ultimatebb.php?ubb=get_topic;f=10;t=005180 Matt Farmer]
1) Zorro Mendoza b Minotauro
2) Mario Valenzuela b El Nómada
3) Cien Caras, El Fantasma b El Nazi, Leo López
## Leo Lopez filled in for Herodes.
4) El Reo, El Vengador DQ Belcebú, Rey Salomón
5) Cesar Curiel, Lizmark, Máscara Año 2000 b Adorable Rubi, El Faraón, Satánico
## Tecnicos took 2 (DQ) and 3. Curiel on a six week win streak, which Box y Lucha is very excited about.

indy (SAT) 01/23/1982 Astro Pista, Texcoco, Estado de México [Halcon 510]
1) Fishman, Ultraman b El Infernal, Perro Aguayo
&& 57000 pesos gate

EMLL (SUN) 01/24/1982 Arena Coliseo Guadalajara [El Informador 1982-01-24]
1) ? vs ??
2) ? vs ??
3) ? vs ??
4) Águila India, El Dorado vs El Salvaje, Índio Vitela
5) El Halcón, Lismark, Ringo Mendoza vs El Faraón, Herodes, Índio Jerónimo

indy (SUN) 01/24/1982 Arena Coliseo Acapulco, Acapulco, Guerrero [Halcon 510]
1) ?, El Brazo b Negro Casas, Play Boy [final]
## sets up a title match the nxt week.

indy (SUN) 01/24/1982 Plaza de Toros Valente Arellano, Torreón, Coahuila [El Siglo de Torreon 1982-01-24]
1) ? vs ??
2) ? vs ??
3) Centella Azul, Joel García vs El Moro, The King
4) El Rebelde, Mario Saucedo vs Asesino Negro, Bull Killer
5) Franco Colombo, Joe Martin vs Calavera I, Calavera II

MORA (SUN) 01/24/1982 Toreo de Cuatro Caminos, Naucalpan, Estado de México [Box y Lucha 1524, https://www.facebook.com/groups/1461911524124484/permalink/1571879093127726/ Matt Farmer]
1) La Bruja b La Venus
2) Ángel Blanco, Cesar Valentino, Coloso Colosetti b El Solar, Huracán Ramírez, Rayo de Jalisco
## Coloso Colosetti & Cesar Valentino got into it with Wolf Rubinski
3) Carolina Kid, Haiti Kid b Arturito, Gulliver
4) Ray Mendoza, Villano I, Villano III b Anibal, Canek, Dr. Wagner
5) el Signo, Negro Navarro, Texano b Ray Mendoza, Villano I, Villano III
6) El Solitario, Enrique Vera, Fishman, Gran Hamada DQ el Signo, Negro Navarro, Perro Aguayo, Texano
## Signo fouled Solitario
&& El Santo & Enrique Llanes & Wolf Rubinsky & Sheik Mar Allah in attendance. Top 3 matches appear to be part of a tournament, but the recap doesn't mention the circumstances.

EMLL (TUE) 01/26/1982 Arena Coliseo [Box y Lucha 1254, http://wrestlingclassics.com/.ubb/ultimatebb.php?ubb=get_topic;f=10;t=005180 Matt Farmer]
1) Rolando Valentino b Diogenes
## rematch
2) Rey David b Voltio Negro
3) Celeste, Rafael Salamanca b El Nómada, Scaramouche
4) MS-1, Rey Salomón DRAW El Egipcio, Mercurio
5) Américo Rocca, El Faraón, La Fiera b Franco Colombo, Joe Martin, Rayo de Jalisco Jr.
## La Fiera won via mask pull on Rayo

EMLL (TUE) 01/26/1982 Arena Coliseo Guadalajara [El Informador 1982-01-26]
1) ? vs ??
2) ? vs ??
3) ? vs ??
4) Orión vs El Dandy
## El Dandy first appearance on a card
5) Gran Cochisse, Ringo Mendoza vs El Faraón, León Kirilenko and El Halcón, Lismark and Asesino Negro, Herodes

MORA (TUE) 01/26/1982 Arena Aficion
** Arena Aficion Anniversary
1) José Luis Mendieta, Justiciero vs Luis Mariscal, Villano I
2) Rizado Ruiz, Rudy Reyna vs Mano Negra, Solar I
3) Hamada, Saito, Takano vs el Signo, Negro Navarro, Texano
4) Perro Aguayo vs Fishman
&& Anniversary show

MORA (TUE) 01/26/1982 Arena Querétaro [Box y Lucha 1524]
1) Tawa Vera vs Rokambole
2) Scorpió vs El Monarca
3) Arturito, Gulliver vs Carolina Kid, Haiti Kid
4) Dorrel Dixon, Ultraman vs Cesar Valentino, Coloso Colosetti
5) Anibal, Canek, Villano III vs El Solitario, Kuniaki Kobayashi, Rayo de Jalisco

EMLL (WED) 01/27/1982 Arena Coliseo Acapulco, Acapulco, Guerrero [Box y Lucha 1524]
1) Histrion vs Kendor
2) Braulio Mendoza, Play Boy vs Aristóteles, Black Silver
3) El Fantasma, Mario Valenzuela vs Alma Grande, Antares
4) Cesar Curiel, Lizmark, Tony Salazar vs Américo Rocca, Mocho Cota, Satánico

indy (WED) 01/27/1982 Arena San Juan Pantitlan, Ciudad Nezahualcóyotl, Estado de México [Box y Lucha 1524]
1) Limberg vs El Briatanico
2) El Diplomatico vs Olímpico Del Sur
3) Bobby 79, El Baby vs Teddy, Tiburón Blanco
4) Black Espana, Luis Lopez vs El Dorado, Rayo Tapatío
5) El Galante, Silver Star vs Benny Castello, El Barón

indy (WED) 01/27/1982 Arena Xochimilco, Xochimilco, Distrito Federal [Box y Lucha 1524]
1) El Sultan vs Mr. Rolling
2) El Herrero, Negro Peralta vs Rayo Dorado I, Rayo Dorado II
3) Kalimaco, Rocky Norton vs Impala, Módulo
4) Polarys I, Polarys II vs Chamaco Orduna, Relámpago Dorado
5) La Fiera, Máquina Salvaje vs El Impacto, Mano Negra

indy (WED) 01/27/1982 Salón de Actos, Tierra Colorada, Guerrero
1) Príncipe Marino vs El Cerrajero
2) Rayo Diabólico vs Cruz Imperial
3) Misterio Blanco I, Misterio Blanco II vs Jorge Ortiz, Karateka Chino
4) Pantera Sureña, Reyna Gallegos vs Estela Molina, Marina Rey

MORA (WED) 01/27/1982 Arena Naucalpan [Box y Lucha 1524]
1) El Bombero b Black Star
2) Antorcha, El Falcón b El Primate, Polar
3) Fuerza Guerrera, Rams, Zimba b Castorcito, Danny Boy, Negro Casas
4) Black Man, Kato Kung Lee, Kung Fu b Cuchillo, Rocambole, Yuma

MORA (WED) 01/27/1982 Auditorio Benito Juárez, Veracruz, Veracruz
1) Morocho vs El Condenado
2) El Fúnebre vs Silver Star
3) Mando Amezcua, Perro Sosa vs Bestia Rubia, Destino Negro
4) Centurión Negro, Dory Dixon, La Sombra vs Blue Panther, Lobo Rubio, Scorpió
5) El Solitario, Rayo de Jalisco vs Canek, Súper Máquina

MORA (WED) 01/27/1982 Auditorio Miguel Barragan, San Luis Potosí, San Luis Potosí
1) Ángel Arano vs Rudy Valentino
2) Arturito, Gulliver vs Carolina Kid, Haiti Kid
3) el Signo, Negro Navarro, Texano vs Batman, José Luis Mendieta, Robin
4) Fishman, Ultraman vs Anibal, Scorpió

EMLL (THU) 01/28/1982 Aguascalientes, Aguascalientes [Box y Lucha 1524]
1) El Faraón  (c) b Ringo Mendoza [NWA MIDDLE]

EMLL (THU) 01/28/1982 Arena Isabel, Cuernavaca, Morelos [Box y Lucha 1524]
1) Clímax II vs Electrón
2) Pánico, Scaramouche vs Celeste, El Reo
3) Manuel Robles, Mocho Cota, Roy Steve vs Joe Martin, Máscara Año 2000, Rayo de Jalisco Jr.
4) Talismán vs La Fiera

EMLL (THU) 01/28/1982 Arena Xalapa, Xalapa, Veracruz
1) Caballero Negro, Suicida vs Perro Sosa, Romano García
2) Destino Negro, Huichol, Universo vs Emilio Charles Jr., Polar, Tawa Vera
3) Black Man, Dory Dixon, El Falcón vs Blue Panther, Terrorista I, Terrorista II
4) Súper Máquina vs TNT
5) Blue Demon, Rayo de Jalisco vs Anibal, Cuchillo

EMLL (THU) 01/28/1982 Arena Zapata, Acapulco, Guerrero [Box y Lucha 1524]
1) El Átomo, Lintera Verde vs El Aventurero, El Graduado
2) El Bucanero, Príncipe Temoc vs El Anonimo, El Renegado
3) Pantera Sureña, Reyna Gallegos vs Estela Molina, Marina Rey
4) Lizmark vs Américo Rocca

MORA (THU) 01/28/1982 Arena Poza Rica, Poza Rica, Veracruz
1) As Charro vs Flama Azul
2) Septiembre Negro vs La Sombra
3) Batman, Robin vs Astro Rey, Villano II
4) El Monarca, José Luis Mendieta, Mano Negra vs América Salvaje, Lobo Rubio, Luis Mariscal

MORA (THU) 01/28/1982 Arena Toluca, Toluca, Estado de México
1) Rocambole vs Solar II
2) Justiciero, Solar I vs Rizado Ruiz, Rudy Reyna
3) Saito, Ultraman vs Ray Mendoza, Scorpió
4) Hamada, Kuniaki Kobayashi, Takano vs Canek, Dr. Wagner, Villano III

MORA (THU) 01/28/1982 Pista Arena Revolución [Box Y Lucha 1524]
1) Ciclón Moreno, Lasser, Pequeño Solin vs Bestia Rubia, Gorilla Flores, Gran Petroneo
2) Arturito, Gulliver vs Carolina Kid, Haiti Kid
3) Adrian El Exotico, Cesar Valentino vs Brazo de Oro, Brazo de Plata
4) Fishman, Hector Guerrero, Huracán Ramírez vs el Signo, Negro Navarro, Texano

EMLL (FRI) 01/29/1982 Arena Coliseo [Box Y Lucha 1524, Box Y Lucha 1525, http://wrestlingclassics.com/.ubb/ultimatebb.php?ubb=get_topic;f=10;t=005180 Matt Farmer]
1) Dardo Aguilar b Vulcano
2) El Crucero b Rafael Salamanca
3) Bruno Victoria b El Vengador
4) Máscara Año 2000, Melchor Ortiz, Tony Salazar DQ Adorable Rubi, El Nazi, Herodes
## straight falls, last by DQ
5) El Faraón, Espectro Jr., Satánico DRAW Cesar Curiel, Lizmark, Ringo Mendoza
## Rudos took 2/3. Double pin on a tapatia. Box y Lucha seems to say Faraon won while Halcon is sure it was a draw.. Halcon raves about this match.

EMLL (FRI) 01/29/1982 Chiautempan, Tlaxcala [Box y Lucha 1524]
1) Aries vs Alto Voltaje
2) Yanco vs Ruso Flores
3) El Egipcio, Hombre Bala vs Belcebú, Leo López
4) El Fantasma, Rayo de Jalisco Jr. vs Américo Rocca, Pirata Morgan

MORA (FRI) 01/29/1982 Arena Deportivo Mexico, Puebla, Puebla
1) Lasser vs Pequeño Solin
2) Black Man, Escudo Negro vs Blue Panther, Polar
3) Brazo de Oro, Brazo de Plata, Ultraman vs El Enfermero Jr., Enfermero, Negro Casas
4) Canek, Cesar Valentino, Scorpió vs Enrique Vera, Fishman, TNT
5) Villano I, Villano II, Villano III vs el Signo, Negro Navarro, Texano

MORA (FRI) 01/29/1982 Arena Neza [Box y Lucha 1524]
1) Batman, Robin vs Cuchillo, Lobo Rubio
2) Adrian El Exotico, Rizado Ruiz, Rudy Reyna vs Hector Guerrero, Mano Negra, Saito
3) Arturito, Gulliver vs Carolina Kid, Haiti Kid
4) Huracán Ramírez, Rayo de Jalisco vs Coloso Colosetti, Luis Mariscal
5) Hamada, Kuniaki Kobayashi, Takano vs Anibal, Dr. Wagner, Perro Aguayo

EMLL (SAT) 01/30/1982 Arena Puebla [Box y Lucha 1524]
1) El Califa vs Mr. Misterio
2) Caballero Rojo, Jerry Estrada vs Hércules Poblano, La Sombra Poblana
3) Doberman, El Egipcio vs Bruno Victoria, Leo López
4) Hombre Bala, Lizmark, Talismán vs Espectro Jr., Rey Salomón, Satánico
5) Cien Caras, El Halcón vs El Faraón, Popitekus

EMLL (SAT) 01/30/1982 Pista Arena Revolución [Box y Lucha 1524]
1) León García vs Terror Blanco
2) Clímax II, Rolando Valentino vs Minotauro, Voltio Negro
3) Águila De Plata, El As vs Bufalo Salvaje, Rodolfo Ruiz
4) El Reo, Mercurio vs Belcebú, MS-1
5) Franco Colombo, Joe Martin, Rayo de Jalisco Jr. vs Américo Rocca, La Fiera, Roy Steve

indy (SAT) 01/30/1982 Arena Atlas, Valle de Guadalupe, Ecatepec, Estado de México
1) Interruptor vs Aventurero
2) Alas Doradas, Drake vs Lancero Jr., Mahoma
3) Armando Montoya, Príncipe Gitano vs Chucho Conde I, Chucho Conde II
4) El Interceptor, Exterminador, Tupac Amaru vs Diamante Blanco, El Canalla, Lobo Negro
5) Ébano Ruiz, Tartos vs Leo Ramírez, Toro Sentado [mask, hair]
## one mask and one hair on each side

indy (SAT) 01/30/1982 Arena Zapata, Cuautla, Morelos [Box y Lucha 1524]
1) Chamaco Reyes vs El Britanico
2) León Dorado I, León Dorado II vs Médico Vengador, Pedro Negro
3) Chacal de la Rosa, Estrella Fantasma vs Invasion I, Invasion II
4) El Galante, Kenji Kaplin vs El Leproso, Hombre Nuclear

indy (SAT) 01/30/1982 Nueva Arena Apatlaco, Iztapalapa, Distrito Federal [Box y Lucha 1524, http://www.boxylucha.com/foro/viewtopic.php?p=736490#p736490 ricardo aguilar hidalgo @ box y lucha]
1) Caballero Romano, Negro Casas vs Fiera Guerrero, Mr. Cobra
2) Fuerza Guerrera vs Impala [DF LIGHT]
3) Rocky Norton vs Módulo [DF FEATHER]
4) Fishman, Impacto, Kato Kung Lee vs Coloso Colosetti, Guerrillero Valentino, Perro Aguayo
5) Carolina Kid, Haiti Kid vs Arturito, Gulliver
6) Renato Torres vs El Monarca [hair]
&& listed as Nueva Arena Apatlaco

MORA (SAT) 01/30/1982 Arena Isabel, Cuernavaca, Morelos
1) Lasser vs Lobo Rubio
2) Saito vs América Salvaje
3) Luis Mariscal, Scorpió vs Kuniaki Kobayashi, Mano Negra
4) El Solitario, Hamada, Takano vs Ángel Blanco, Anibal, Dr. Wagner

MORA (SAT) 01/30/1982 Arena Xochimilco, Xochimilco, Distrito Federal [Box y Lucha 1524]
1) Polarys I, Polarys II vs Chamaco Orduna, Relámpago Dorado
2) El Falcón, El Matematico vs Bestia Rubia, Kalimaco
3) Bello Greco, Sergio el Hermoso vs Perfumado Reyna, Rizado Ruiz [super libre]
4) Black Man, Ultraman vs Flama Azul, Septiembre Negro
5) Canek, Súper Máquina vs Enrique Vera, Siglo XX
6) Ray Mendoza, Villano I, Villano II vs el Signo, Negro Navarro, Texano

MORA (SAT) 01/30/1982 Gimnasio San Pedro, Iztacalco, Distrito Federal [Box y Lucha 1524]
1) Capitán Aermica vs Estrella Marina
2) Paracaidista, Piloto Nazi vs Charly González, Estrella De Oro
3) Aventurero, Gory Cortes vs El Intocable, La Silueta
4) Clímax, La Serpiente, Pequeño Solin vs Baby Casanova, Dinámico, Sanguinario Jr.

EMLL (SUN) 01/31/1982 Arena Coliseo [Box y Lucha 1524, KO]
1) Caballero Blanco vs Alto Voltaje
2) El Invasor vs El Nómada
3) El Egipcio vs Rey Salomón
4) Leo López, Manuel Robles, Pánico vs El Doberman, Joe Martin, Vengador
5) El Halcón, Máscara Año 2000, Ringo Mendoza vs Adorable Rubi, El Nazi, Espectro Jr.

EMLL (SUN) 01/31/1982 Arena Puebla [Box y Lucha 1524]
1) El Virrey, Porthos vs Danger, El Azteca
2) Rayo de Jalisco Jr. vs Mercurio, Águila De Plata, Bull Santana, El As, Ráfaga Moreno, Américo Rocca, El Crucero, Guerrero Negro, El Maya, Príncipe Valiente I, Príncipe Valiente II

EMLL (SUN) 01/31/1982 Pista Arena Revolución [Box y Lucha 1524]
1) Aries vs Diogenes
2) Dardo Aguilar, Sombra Roja vs Rey David, Vulcano
3) Águila Solitaria, Jerry Estrada, Yanco vs Ruso Flores, Tony Arce, Zorro Mendoza
4) Cesar Curiel, El Fantasma, Talismán vs Bruno Victoria, Mocho Cota, Pirata Morgan
5) Tony Salazar vs Satánico

indy (SUN) 01/31/1982 Arena Atlas, Valle de Guadalupe, Ecatepec, Estado de México
1) Desertor vs Reyes Veloz
2) Drake vs Camacho Flores
3) Brujo Maldito, El Comunista vs Drake, Rodan X
4) Estrella Blanca I, Estrella Blanca II vs ?, El Maldito
5) El Vagabundo vs ?

indy (SUN) 01/31/1982 Arena Azteca, Calz. Tulyehualco, Iztapalapa, Distrito Federal [Box y Lucha 1524]
1) El Sultan vs Desalmado Trejo
2) Chamaco Orduna, Relámpago Dorado vs Escarabajo I, Negro Peralta
3) Caballero Romano, Hara Kiri, Impala vs Mr. Cobra, Rocky Norton, Ultra Rojo
4) Fuerza Guerrera vs El Módulo [super libre]
5) Kalimaco vs El Falcón [DF WELTER]
6) Espuelas De Oro vs Escarabajo Rojo [mask]

indy (SUN) 01/31/1982 Arena Coliseo Acapulco, Acapulco, Guerrero [Halcon 510]
1) El Brazo vs Negro Casas  (c) [EDM LIGHT]

indy (SUN) 01/31/1982 Arena del Comite 39 CNC, Ciudad Nezahualcóyotl, Estado de México [Box y Lucha 1524]
1) Acuático vs Cuauhtémoc
2) El Chiapaneco, Médico Salvaje, Relámpago Del Sur vs El Índio, Torbellino Negro I, Torbellino Negro II
3) El Enigmatico, Yoko II vs El Bendix, Supersónico
4) Cobra Azteca I, Cobra Azteca II vs Chico Malo I, Chico Malo II
5) Rayo Diabólico  (c) vs Chamaco Duran [COMITE WELTER]

indy (SUN) 01/31/1982 Arena Lopez Mateos
1) Lagargo vs Pequeño Yanqui
2) El Lacandón vs Amenaza Del Ring
3) Príncipe Infernal vs El Lacandón
4) Luis Mariscal, Renato Torres vs ?, Saeta Azteca
5) Tony Ledesma  (c) vs Rocky Santana [Arena Lopez Mateos LIGHT]

indy (SUN) 01/31/1982 Arena Poza Rica, Poza Rica, Veracruz
1) Braulio Flores vs El Gladiador II
2) El Gladiador I vs Pedro Nieves
3) El Terrestre, Mano Negra vs El Petrolero, Hijo Del Médico Asesino
4) Gulliver vs Arturito

indy (SUN) 01/31/1982 Arena San Juan Pantitlan, Ciudad Nezahualcóyotl, Estado de México [Box y Lucha 1524]
1) Flash Gordon vs Atomus
2) El Galante vs Aventurero Chino
3) Misterio Blanco I, Misterio Blanco II vs Dr. Karonte I, Dr. Karonte II
4) Bengala I, Bengala II vs Chacal de la Rosa, Chamaco Casanova
5) El Halcón, Justiciero vs Hombre Nuclear, Súper Máquina

indy (SUN) 01/31/1982 Arena Santa Maria Aztahuacan, Iztapalapa, Distrito Federal [Box y Lucha 1524]
1) Chava Juarez vs Agente 76
2) Trueno vs El Demoledor
3) Astro Salvaje II, Nube Guerrera vs Águila Mazatleca, Johnny Madrid
4) Astro Salvaje I, Elio Guzman, Rudy Ramos vs Pastor I, Pastor II, Pastor III
5) Rams, Zimba vs Búfalo Negro, Perseo

indy (SUN) 01/31/1982 Arena Toluca, Toluca, Estado de México
1) Tláloc vs El Coyote
2) Ciclón Moreno, Danger vs Alma Negra, Ranchero
3) Flama Azul, La Sombra, Marte vs Benny Castello, Dalton Stone, Tiburón

indy (SUN) 01/31/1982 Auditorio Miguel Barragan, San Luis Potosí, San Luis Potosí
1) Chacal Ruiz vs Puños De Oro
2) Aztoa Negro, Pepe El Exotico vs Chamaco Hernández, Galaxia 79
3) Clímax, Exterminador, Interceptor vs Dr. Sangre, El Sangre, Índio García
4) Centurión Negro, Tupac Amaru vs El Espía, Zar Rojo

indy (SUN) 01/31/1982 Plaza de Toros el Cortijo, Venustiano Carranza, Distrito Federal [Box y Lucha 1524]
1) Conde Murciélago, González Rios vs Chamaco Ramos, Randy García
2) Genaro Contreras, Mando Amezcua vs Beto Llanes, Rayo Dorado
3) El Veterinario, Polarys I, Polarys II vs Bengala I, Bengala III, Gorilla Flores
4) El Monarca vs Astro Rey [super libre]
5) Kato Kung Lee, Kung Fu vs Rizado Ruiz, Satán

indy (SUN) 01/31/1982 Plaza de Toros Valente Arellano, Torreón, Coahuila [El Siglo de Torreon 1982-01-31]
1) ? vs ??
2) ? vs ??
3) Joel García, Mr. Atlantic vs El Mestizo, The King
4) Águila India, Gran Cochisse vs Índio Jerónimo, Índio Vitela

MORA (SUN) 01/31/1982 Arena Aficion
1) El Comunista vs El Ejecutor
2) Caballero Azul, Silver Star vs Dragón Negro, El Payo
3) El Barón, Rudy Reyna vs Chucho Segura, Lalo Montenegro
4) Blue Panther, Takamba, Teddy vs Charro de Jalisco, El Azteca, Máscara Negra

MORA (SUN) 01/31/1982 Arena Deportivo Mexico, Puebla, Puebla
1) Fantasma Dorado vs Rey Pantera
2) El Castorcito, Solar II vs Red Star, Tedd
3) La Texana, La Valentina vs Diosa de Plata, Verónica
4) Enrique Vera, Rayo de Jalisco, Solar I vs América Salvaje, Dr. O’Borman, Huichol
5) Cuchillo  (c) vs As Charro [PUEBLA MIDDLE]

MORA (SUN) 01/31/1982 Arena Naucalpan [Box y Lucha 1524]
1) Cataclismo vs Chucho Montoya
2) Soberbio vs Mike Robledo
3) Danny Boy, El Bombero vs Dick Angelo, El Pirmate
4) Carlos Vera, Hombre Arena vs Siki Osama, Zar Rojo
5) Impacto, Javier Llanes, Siglo XX vs Arlequín, Máquina Salvaje, Súper Máquina

MORA (SUN) 01/31/1982 Arena Querétaro
1) Luis Lopez, Polar vs Amenaza India, Coloso
2) India Sioux, Marina Rey vs Oyuki, Vicky Carranza
3) Lasser, Pequeño Solin vs Ciclón Moreno, Perro Sosa
4) Black Man, Brazo de Oro, Brazo de Plata vs Babe Richard, José Luis Feliciano, Lobo Rubio

MORA (SUN) 01/31/1982 Toreo de Cuatro Caminos, Naucalpan, Estado de México [Box y Lucha 1525, https://www.facebook.com/groups/1461911524124484/permalink/1571879093127726/ Matt Farmer]
** 7th Anniversary
1) Estela Molina, The Monster b Lola González, Pantera Sureña
2) Filli Estrella, Gran Nikolai b Carolina Kid, Haiti Kid
3) Anibal, Canek, Cesar Valentino b Gran Hamada, Kuniaki Kobayashi, Saito
4) Ray Mendoza, Villano I, Villano II, Villano III DQ el Signo, Negro Navarro, Perro Aguayo, Texano
## Rudos versus rudos. Match got out of control late, with Texano being eliminated but coming back and the commission stopping it as a DQ. Halcon 558 (year in review) says this was actually a draw when the commission and doctor stopped it due to blood loss on everyone's part.
5) Fishman  (c) b George Takano [UWA LH]
## Fishman took 2/3 in about 35 minutes, with the last fall around 14 minutes. Fishman weighed in at 94 KG, Takano 95.

MORA (MON) 02/01/1982 Arena Puebla [Box y Lucha 1524, Halcon Mensual 6, KO]
1) José Luis Mendieta, Siglo XX, Ultraman vs América Salvaje, Rizado Ruiz, Rudy Reyna
2) Fili Estrella, Gulliver vs Carolina Kid, Haiti Kid
3) Dory Dixon, Enrique Vera, Fishman, Solar I vs Astro Rey, Cesar Valentino, Coloso Colosetti, Luis Mariscal
4) Canek  (c) b Ángel Blanco [UWA Heavy]

MORA (MON) 02/01/1982 Auditorio Municipal, Tampico, Tamaulipas
1) Black Man, Mano Negra vs Alejandro Montaña, Lobo Rubio
2) Gran Hamada, Kuniaki Kobayashi vs Scorpió, Súper Máquina

MORA (MON) 02/01/1982 Deportivo Ixtlahuaca, Ixtlahuaca, Estado de México
1) Huichol vs Tamba
2) El Falcón, Justiciero vs Blue Panther, Dalton Stone
3) Estela Molina, Marina Rey vs Irma Águilar, Lola González
4) el Signo, Negro Navarro, Texano vs Los Villanos
## not specified which Villanos

EMLL (TUE) 02/02/1982 Arena Coliseo [Box y Lucha 1525, http://wrestlingclassics.com/.ubb/ultimatebb.php?ubb=get_topic;f=10;t=005180 Matt Farmer]
1) Terror Blanco vs Electrón
2) Voltio Negro vs Caballero Rojo
3) Águila Solitaria, Sombra Roja vs Ruso Flores, Tony Arce
4) Belcebú, Rey Salomón vs El Vengador, Mercurio
5) Rayo de Jalisco Jr., Takasugi, Tony Salazar vs Américo Rocca, La Fiera, Roy Steve

EMLL (TUE) 02/02/1982 Arena Coliseo Guadalajara [El Informador 1982-02-02]
1) ? vs ??
2) ? vs ??
3) ? vs ??
4) Águila India, Gran Cochisse vs Índio Vitela, León Kirilenko
5) Cien Caras, Lismark, Olímpico Flores vs El Faraón, Herodes, Índio Jerónimo

indy (TUE) 02/02/1982 San Antonio, Texas [Halcon Mensual 6]
1) El Solitario  (c) b Gran Kabuki [UWA JLH]

MORA (TUE) 02/02/1982 Arena Aficion [Box y Lucha 1525]
1) Javier Llanes vs Rudy Reyna
2) Estela Molina, Marina Rey, The Monster vs Chela Salazar, Lola González, Pantera Sureña
3) Ángel Blanco, Scorpió vs Dorrel Dixon, Hector Guerrero
4) el Signo, Negro Navarro, Perro Aguayo, Texano vs Enrique Vera, Gran Hamada, Kobayashi, Takano

MORA (TUE) 02/02/1982 Arena Querétaro [Box y Lucha 1525]
1) América Salvaje vs Tawa Vera
2) Lobo Rubio vs Black Man
3) Carolina Kid, Haiti Kid vs Fili Estrella, Gran Nikolai
4) Saito, Solar I vs Cesar Valentino, Coloso Colosetti
5) Anibal, Canek, Villano III vs Fishman, Huracán Ramírez, Mano Negra

MORA (TUE) 02/02/1982 Unidad Deportiva de Acapulco, Acapulco, Guerrero [Box y Lucha 1525]
1) Arancel vs Ángel Salvaje
2) Black Demon, Jefe Índio vs Lucio Risas, Solin
3) India Sioux, La Bruja vs La Venus, Vicky Carranza
4) Brazo de Oro, Brazo de Plata vs Astro Rey, Dalton Stone

EMLL (WED) 02/03/1982 Arena Coliseo Acapulco, Acapulco, Guerrero [Box y Lucha 1525]
1) Bronco Bill vs Serpiente Roja
2) Aristóteles, El Galeonero vs El Guerrero, Emigrante
3) Antares, La Fiera vs Águila De Plata, Mario Valenzuela
4) Lizmark, Rey Morgan, Ringo Mendoza vs Adorable Rubi, Espectro Jr., Satánico

indy (WED) 02/03/1982 Arena San Juan Pantitlan, Ciudad Nezahualcóyotl, Estado de México [Box y Lucha 1525]
1) El Diplomatico vs El Britanico
2) El Espacial vs Piloto Fantasma I
3) El Baby, El Dorado vs Blas Espana, Luis Lopez
4) El Barón, Oso Medina vs Boby 79, Silver Star
5) Babe Richard, Benny Castello vs El Galante, El Zafiro

MORA (WED) 02/03/1982 Arena Naucalpan [Box y Lucha 1525]
1) Clímax vs El Bombero
2) Carlos Vera, El Matematico vs Black Terry, Gran Petroneo
3) Brazo de Oro, Brazo de Plata, El Brazo vs Lobo Rubio, Rams, Zimba
4) Enrique Vera, Gran Hamada, Siglo XX vs Leopardo Negro, Ray Mendoza, Rokambole

MORA (WED) 02/03/1982 Arena Xochimilco, Xochimilco, Distrito Federal [Box y Lucha 1525]
1) Caballero Romano vs Negro Peralta
2) Chamaco Orduna, Relámpago Dorado vs El Primate, Rocky Norton
3) Impala, Módulo vs Kalimaco, Máquina Salvaje
4) El Impacto, Mano Negra vs Perfumado Reyna, Rizado Ruiz
5) Black Man vs Flama Azul [super libre]

MORA (WED) 02/03/1982 Auditorio Benito Juárez, Veracruz, Veracruz [Box y Lucha 1525]
1) Galileo vs El Diabólico
2) Fly Man vs Morocho
3) Kato Kung Lee, La Sombra vs El Universo, Súper Máquina
4) Carolina Kid, Haiti Kid vs Arturito, Gulliver
5) Kuniaki Kobayashi, Saito, Takano vs el Signo, Negro Navarro, Texano

EMLL (THU) 02/04/1982 Arena Isabel, Cuernavaca, Morelos [Box y Lucha 1525]
1) León García vs Minotauro
2) Rafael Salamanca vs Scaramouche
3) El Fantasma, Hombre Bala vs Crucero, El Nazi
4) Cesar Curiel, Rey Morgan, Ringo Mendoza vs Adorable Rubi, La Fiera, Satánico

EMLL (THU) 02/04/1982 Arena Zapata, Acapulco, Guerrero [Box y Lucha 1525]
1) El Átomo, Taliman Negro vs El Aventurero, El Navegante
2) Bronco Bill, El Desertor vs Demetrius, Serpiente Roja
3) Aristos, El Apolo vs Emigrante II, Hipocampo
4) Águila De Plata, Lizmark vs Alma Grande, Espectro Jr.

MORA (THU) 02/04/1982 Arena Olimpico Laguna, Gomez Palacio, Durango [Halcon Mensual 4, luchablog photolog (2013-09-15 23.57.20)]
1) Chamuco Treviño vs Máscara Azul
2) Bello David, Espartaco vs Blue Ángel, Kodiak
3) Barrabas, Blue Fish vs Mr. Lince, Rino Castro
4) Black Terry  (c) b Chamaco Maravilla [UWA LIGHT]
## Black Terry is champion.

MORA (THU) 02/04/1982 Pista Arena Revolución [Box y Lucha 1525]
1) Blue Panther, Septiembre Negro vs El Matematico, El Monarca
2) Fili Estrella, Gran Nikolai vs Carolina Kid, Haiti Kid
3) Hector Guerrero, Saito, Ultraman vs América Salvaje, Cesar Valentino, Coloso Colosetti
4) Ángel Blanco, Dr. Wagner, Súper Máquina vs Anibal, Canek, Perro Aguayo

EMLL (FRI) 02/05/1982 Arena Coliseo [Box y Lucha 1525, http://wrestlingclassics.com/.ubb/ultimatebb.php?ubb=get_topic;f=10;t=005180 Matt Farmer]
1) Rolando Valentino vs Caballero Blanco
2) Rafael Salamanca vs El Invasor
3) Bruno Victoria, Leo López b El Doberman, Takasugi
4) Cien Caras, El Halcón vs Adorable Rubi, El Nazi
5) Lizmark, Ringo Mendoza, Tony Salazar vs El Faraón, Espectro Jr., Satánico

indy (FRI) 02/05/1982 Gimnasio San Pedro, Iztacalco, Distrito Federal [Box y Lucha 1525]
1) Aventurero, Capitán America, Gory Cortes vs Estrella Marina, La Silueta, Piloto Nazi
2) Clímax, Pequeño Solin vs Dinámico, El Intocable
3) Dios Negro, Dios Rojo vs Serpiente, Tony Ledezma

MORA (FRI) 02/05/1982 Arena Neza [Box y Lucha 1525]
1) Enfermero I, Enfermero II vs Batman, Robin
2) El Falcón, Solar I vs América Salvaje, Dalton Stone
3) Rizado Ruiz, Rudy Reyna vs Brazo de Oro, Brazo de Plata
4) El Monarca, Hector Guerrero vs Cesar Valentino, Coloso Colosetti
5) Fishman, Takano, Ultraman vs Ángel Blanco, Anibal, Dr. Wagner

MORA (FRI) 02/05/1982 Ecatepec, Estado de México [Halcon Mensual 6]
1) Lola González  (c) b Estela Molina [UWA WOMEN]

EMLL (SAT) 02/06/1982 Arena Puebla [Box y Lucha 1525, Halcon Mensual 6]
1) Josué, Porthos vs El Azteca, Sombra Poblana
2) El Egipcio, Talismán vs El Crucero, Manuel Robles
3) El Halcón, Rey Morgan, Tony Salazar vs El Faraón, Pirata Morgan, Satánico
4) Cien Caras  (c) b Popitekus [MEX HEAVY]

EMLL (SAT) 02/06/1982 Pista Arena Revolución [Box y Lucha 1525]
1) León García vs Voltio Negro
2) Clímax II vs Diogenes
3) Dardo Aguilar, El As vs Bufalo Salvaje, Rey David
4) El Vengador, Mercurio vs Belcebú, MS-1 [super libre]
5) Franco Colombo, Joe Martin, Lizmark vs Américo Rocca, La Fiera, Roy Steve

indy (SAT) 02/06/1982 Astro Pista, Texcoco, Estado de México [Box y Lucha 1525]
1) La Rata, Rodan X vs El Magisterio, El Venado
2) El Hereo, El Mecanico vs Pato Coloco Salvaje, Ultra Roja
3) Gran Petroneo, Mando Amezcua vs Polarys I, Polarys II
4) Barón Chumedo, Bull Santana vs El Espíritu, El Primate
5) Bello Greco, Sergio el Hermoso vs Rizado Ruiz, Rudy Reyna

indy (SAT) 02/06/1982 Auditorio, Chiautempan, Tlaxcala [https://twitter.com/ElHijodelSanto/status/1361405093648556033 El Hijo del Santo, https://www.facebook.com/HijodelSanto.Oficial/photos/a.525254430884865.1073741831.124043311005981/968692349874402/?type=3 El Hijo del Santo (2)]
1) ? vs ??
2) Korak vs Maldito Mendoza
## debut of future Hijo del Santo, who says this match went 50 minutes. Maldito Mendoza replaced Voltio Negro.
3) Frankenstein, Profetio vs El Químico, Magnum
4) Kato Kung Lee, Kung Fu vs El Mercenario, Nahur Kaliff

MORA (SAT) 02/06/1982 Arena Isabel, Cuernavaca, Morelos [Box y Lucha 1525]
1) Robin vs Septiembre Negro
2) Batman vs Lobo Rubio
3) Dorrel Dixon, El Monarca vs Anibal, Luis Mariscal
4) Fishman, Takano, Ultraman vs el Signo, Negro Navarro, Texano

MORA (SAT) 02/06/1982 Arena Xochimilco, Xochimilco, Distrito Federal [Box y Lucha 1525]
1) Desalmado, Negro Peralta vs Chamaco Orduna, Relámpago Dorado
2) Beto Llanes, Freddy Mendoza vs Kalimaco, Rocky Norton
3) Impacto, Negro Casas vs Bestia Rubia, El Etíope
4) Enrique Vera, Siglo XX vs Bull Power, Coloso Colosetti
5) Carolina Kid, Haiti Kid vs Arturito, Gulliver

MORA (SAT) 02/06/1982 Nueva Arena Apatlaco, Iztapalapa, Distrito Federal [Box y Lucha 1525]
1) Tony Aguirre vs Caballero Romano
2) Impala, Módulo vs Terrorista I, Terrorista II
3) Catedrático, El Matematico vs Bobby Richard, Fuerza Guerrera
4) Black Man, Mano Negra vs Black Terry, Flama Azul
5) Brazo de Oro, Brazo de Plata, El Solitario vs Canek, Renato Torres, Súper Máquina

EMLL (SUN) 02/07/1982 Arena Coliseo [http://wrestlingclassics.com/.ubb/ultimatebb.php?ubb=get_topic;f=10;t=005180 Matt Farmer]
1) Minotauro vs Vulcano
2) Zorro Mendoza vs Dardo Aguilar
3) Rafael Salamanca vs El Nómada
4) Leo López, Manuel Robles, Pánico vs El Fantasma, El Vengador, Talismán
5) Cesar Curiel, Ringo Mendoza, Tony Salazar vs Espectro Jr., Mocho Cota, Satánico

EMLL (SUN) 02/07/1982 Arena Coliseo Acapulco, Acapulco, Guerrero [Halcon 512]
1) El Apolo, Pepe Casas b Esclavo, Serpico
2) Black Silver  (c) DQ Marcos Nava [GUERRERO WELTER]
## first defense. Lucifer fouled Silver
3) Aristos, El Guerrero  (c) b El Galeonero, Hipocampo [GUERRERO TAG]
4) Negro Casas  (c) b El Brazo [EDM LIGHT]
5) Franco Colombo, Mario Valenzuela b La Fiera, MS-1

EMLL (SUN) 02/07/1982 Arena Coliseo Guadalajara [El Informador 1982-02-07]
1) ? vs ??
2) ? vs ??
3) ? vs ??
4) Gran Cochisse, Rayo de Jalisco Jr. vs Calavera I, Índio Jerónimo
5) Cien Caras, Lismark, Rey Morgan vs El Faraón, Herodes, La Fiera

EMLL (SUN) 02/07/1982 Arena Puebla [Box y Lucha 1525]
1) Felino II vs El Comanche
2) Águila Solitaria, León García vs Hércules Poblano, Satangel
3) Caballero Rojo, Sombra Roja vs Príncipe Valiente I, Príncipe Valiente II
4) Bruno Victoria, Guerrero Negro vs Águila De Plata, El As
5) Américo Rocca, Rey Salomón vs Joe Martin, Mercurio

EMLL (SUN) 02/07/1982 Pista Arena Revolución [Box y Lucha 1525]
1) Caballero Blanco vs Alto Voltaje
2) Aries vs Terror Blanco
3) Jerry Estrada, Yanco vs Ruso Flores, Tony Arce
4) Doberman, El Egipcio, El Reo vs El Crucero, El Invasor, Índio Vitela
5) El Halcón, Máscara Año 2000, Takasugi vs Adorable Rubi, El Nazi, Pirata Morgan

indy (SUN) 02/07/1982 Arena del Comite 39 CNC, Ciudad Nezahualcóyotl, Estado de México [Box y Lucha 1525]
1) Cobra Azteca I, Cobra Azteca II vs Chico Malo I, Chico Malo II and Enigmatico, Yako and El Bendix, Supersónico and El Chiapaneco, Sangre Latina and Índio Acautico, Relámpago Del Sur and Cuauhtémoc, Rayo Diabólico

indy (SUN) 02/07/1982 Arena San Juan Pantitlan, Ciudad Nezahualcóyotl, Estado de México [Box y Lucha 1525]
1) Memo Arenas vs El Caminate Espacial
2) El Galante vs Diosa Maya
3) Hombre Nuclear, Septiembre Negro vs Bengala I, Bengala III
4) Chacal de la Rosa vs Baby Casanova [hair]
5) Bello Greco, Sergio el Hermoso vs Estrella Blanca, Estrella Blanca Jr.

indy (SUN) 02/07/1982 Plaza de Toros el Cortijo, Venustiano Carranza, Distrito Federal [Box y Lucha 1525]
1) González Rios vs Randy García [hair]
2) Conde Murciélago vs Chamaco Ramos [hair]
3) Bengala I, Bengala III, Javier Llanes, Saeta Azteca vs El Veterinario, Genaro Contreras, Polarys I, Polarys II
4) Tamba  (c) vs Satán [CORTIJO HEAVY]
5) Kato Kung Lee, Kung Fu  (c) vs Ray Mendoza, Villano II [CORTIJO TAG]

indy (SUN) 02/07/1982 Plaza de Toros Valente Arellano, Torreón, Coahuila [El Siglo de Torreon 1982-02-07]
1) ? vs ??
2) ? vs ??
3) Joe Andrade, Joel García vs Ciclón Negro, Gran Sabú
4) Centella Azul, Javier Cruz vs Calavera II, El Mestizo
5) Franco Colombo, Mario Saucedo vs Asesino Negro, Divino Roy

indy (SUN) 02/07/1982 Tijuana, Baja California [Halcon 512, Halcon Mensual 6]
1) Chela Salazar b Marina Rey [hair]
2) Perro Aguayo  (c) b Gran Hamada [WWF LH]

MORA (SUN) 02/07/1982 Arena Naucalpan [Box y Lucha 1525]
1) Soberbio vs Chucho Montoya
2) Rams, Zimba vs Gladiador I, Gladiador II
3) Chamaco Orduna, Relámpago Dorado vs El Etíope, El Primate
4) Arlequín, Astro Rey, Cuchillo vs ?, Impacto, José Luis Mendieta

MORA (SUN) 02/07/1982 Arena Palenque Agua Azul, Guadalajara, Jalisco [Halcon Mensual 6, luchablog photolog (2013-09-17 18.04.48)]
1) Cora Perez vs Capitán Cobra
2) Seki Yaawa vs Barón Blanco
3) Hombre De Piedra I, Hombre De Piedra II vs Guerrero Blanco, Ray Lopez
4) Centurión Negro, Solar I, Tawa Vera vs Lobo Rubio, Villano I, Villano II
5) Black Terry  (c) b Black Man [UWA LIGHT]

MORA (SUN) 02/07/1982 Toreo de Cuatro Caminos, Naucalpan, Estado de México [Halcon 510, https://www.facebook.com/groups/1461911524124484/permalink/1571879093127726/ Matt Farmer]
1) La Texana, La Valentina vs Irma Águilar, Verónica
2) Dorrel Dixon, TNT vs Cesar Valentino, Coloso Colosetti
3) Carolina Kid, Haiti Kid vs Filli Estrella, Gran Nikolai
4) Brazo de Oro, Brazo de Plata, George Takano vs Ángel Blanco, Canek, Dr. Wagner
5) el Signo, Negro Navarro, Texano vs El Solitario, Enrique Vera, Fishman

Uribe (SUN) 02/07/1982 Gimnasio Ramos Millan, Iztacalco, Distrito Federal [Box y Lucha 1525]
1) Memo Juarez vs Mario Romero
2) El Impala II vs Diamante Negro
3) Saeta Azul vs Maya Azteca
4) Suspenso Infernal I, Suspenso Infernal II vs Comodín, Lama I
5) Chamaco Barreda, Charly González, Wama vs Danny Martinez, El Leopardo, Ku Kuk Klan

indy (MON) 02/08/1982 Auditorio Josefa Ortiz de Domínguez, Querétaro, Querétaro [https://www.facebook.com/HijodelSanto.Oficial/photos/a.525254430884865.1073741831.124043311005981/968692349874402/?type=3 Hijo del Santo]
1) Cóndor Azul, Korak b José Cruz, La Momia
## La Momia replaced Voltio Negro. 40 minute match.

MORA (MON) 02/08/1982 Arena Puebla [Box y Lucha 1525]
1) Black Man, Hector Guerrero vs Rizado Ruiz, Rudy Reyna
2) Cesar Valentino, Coloso Colosetti, Scorpió vs Dorrel Dixon, El Monarca, Ultraman
3) Enrique Vera, TNT vs Ángel Blanco, Dr. Wagner
4) Canek, Perro Aguayo, Súper Máquina vs Fishman, Hamada, Takano

EMLL (TUE) 02/09/1982 Arena Coliseo Guadalajara [El Informador 1982-02-09]
1) ? vs ??
2) ? vs ??
3) ? vs ??
4) Águila India, Cien Caras, Olímpico Flores vs Belcebú, Herodes, MS-1
5) Lismark, Rey Morgan vs El Faraón, La Fiera

EMLL (WED) 02/10/1982 Arena Coliseo Acapulco, Acapulco, Guerrero [Halcon 512, Halcon Mensual 6]
1) Lizmark b Satánico  (c) [MEX MIDDLE]
2) Ringo Mendoza, Tony Salazar b Espectro Jr., Índio Jerónimo
3) Mario Valenzuela b Antares [hair]
4) Franco Colombo, Joe Martin b Américo Rocca, Mocho Cota
5) Emigrante II, Serpico b Sidartha, Tahúr

MORA (WED) 02/10/1982 Arena Naucalpan [Box y Lucha 1525]
1) Castorcito b Gran Petroneo
2) Carlos Vera, El Matematico b Black Terry, Negro Casas
3) Enrique Vera, Gran Hamada, Siglo XX b Barba Negra, Lobo Rubio, Ray Mendoza
## straigh tfalls, first by DQ.
4) el Signo, Negro Navarro, Texano b Brazo de Oro, Brazo de Plata, El Brazo
## Signo snuck in a foul on Brazo de Oro

EMLL (FRI) 02/12/1982 Arena México [Halcon 512, https://www.patreon.com/posts/box-y-lucha-no-3-49550608 Lucha Libre 946, LuchaWorld]
1) Dr. Wagner, El Faraón, Sangre Chicana b David Morgan, Ringo Mendoza, Tony Salazar
## Rudos took 1/3, setting up Wagner/Salazar
2) Adorable Rubi, Espectro Jr., Satánico b Cesar Curiel, Lizmark, Máscara Año 2000
## best match on the show
3) Kato Kung Lee, Kung Fu b Américo Rocca, Mocho Cota
4) Cachorro Mendoza, El Fantasma DRAW Índio Jerónimo, Rey Salomón
5) Rodolfo Ruiz b Sombra Roja
6) Invasor b Nómada
&& first show of this run, a little over half full

indy (SAT) 02/13/1982 Pista Arena Revolución [Halcon 512, Halcon Mensual 6]
1) Roy Steve b Joe Martin [hair]
2) La Fiera  (c) b Franco Colombo [NWA WELTER]

EMLL (SUN) 02/14/1982 Arena Coliseo Guadalajara [El Informador 1982-02-14]
1) ? vs ??
2) ? vs ??
3) ? vs ??
4) Alfonso Dantes, Herodes, La Fiera vs Cien Caras, Rayo de Jalisco Jr., Rey Morgan
5) El Faraón  (c) vs Lismark [NWA MIDDLE]

indy (SUN) 02/14/1982 Arena Naucalpan [https://www.facebook.com/HijodelSanto.Oficial/photos/a.525254430884865.1073741831.124043311005981/968692349874402/?type=3 Hijo del Santo]
&& Hijo del Santo filmed a lucha libre scene for a movie after the main event with Chanoc, Voltio Negro and Charles Bronson Mexicano - Santo's first time wearing the costume.

indy (SUN) 02/14/1982 Plaza de Toros Valente Arellano, Torreón, Coahuila [El Siglo de Torreon 1982-02-14]
1) ? vs ??
2) ? vs ??
3) El Mestizo, Gran Sabú, Rayo Lasser vs Centella Azul, El Gavilán, Mr. Atlantic
4) El Lobo, Perverso vs Piloto I, Piloto II
5) Asesino Negro, Pánico vs Franco Colombo, Mario Saucedo

MORA (SUN) 02/14/1982 Toreo de Cuatro Caminos, Naucalpan, Estado de México [https://www.facebook.com/fuegoring/posts/10153732350109947 Fuego en el Ring, RB]
** 7th Anniversary Show
1) Black Man, Enrique Vera, Mano Negra b Babe Face, Rudy Reyna, Scorpió
2) George Takano, Kuniaki Kobayashi, Saito vs el Signo, Negro Navarro, Texano
3) Gran Hamada b Centurión Negro  (c) [UWA MIDDLE]
## Halcon 558 (year in review) calls this one of the matches of the year.
4) Canek  (c) b Don Corleone [UWA Heavy]
5) Abdullah the Butcher, Perro Aguayo DQ Antonio Inoki, Tatsumi Fujinami
&& Gate of 1,318,270 a new record.

MORA (MON) 02/15/1982 Ixtlahuaca, Estado de México [Halcon Mensual 6]
1) Lola González  (c) b Estela Molina [UWA WOMEN]

EMLL (TUE) 02/16/1982 Arena Coliseo Guadalajara [El Informador 1982-02-16]
1) ? vs ??
2) ? vs ??
3) ? vs ??
4) Alfonso Dantes, Asesino Negro vs Gran Cochisse, Lismark and El Faraón, León Kirilenko and Olímpico Flores, Rey Morgan and Herodes, MS-1 and El Dorado, Rayo de Jalisco Jr. and Belcebú, La Fiera and Ángel del Silencio, Cien Caras [torneo]

MORA (WED) 02/17/1982 Arena Naucalpan [Halcon 512, luchablog photolog (2013-09-16 01.55.17)]
1) Bestia Negra, Negro Casas b Black Star, Perro Sosa
2) El Leopardo, Rokambole b Castorcito, José Luis Mendieta
3) Danny Boy, El Matematico, Gran Hamada b Black Terry, Lobo Rubio, Ray Mendoza
## straight falls. Hamada/Mendoza feud
4) el Signo, Negro Navarro, Texano b Brazo de Oro, Brazo de Plata, El Brazo

EMLL (FRI) 02/19/1982 Arena México [http://www.facebook.com/cmll.oficial/photos/a.352219088254374.1073741827.351036975039252/533423096800638/?type=1 CMLL, Halcon Mensual 6]
1) Lizmark  (c) b Satánico [MEX MIDDLE]
## first defense.
2) Tony Salazar  (c) b Dr. Wagner [NWA LH]

indy (SAT) 02/20/1982 Toluca, Estado de México [Halcon Mensual 6]
&& 106000 Mexican pesos gate, a record (no matches listed)

MORA (SAT) 02/20/1982 Arena Apatlaco, Iztapalapa, Distrito Federal [Halcon Mensual 6]
1) Black Terry  (c) b El Matematico [UWA LIGHT]

EMLL (SUN) 02/21/1982 Arena Coliseo Guadalajara [El Informador 1982-02-21]
1) ? vs ??
2) ? vs ??
3) ? vs ??
4) El Halcón, Rayo de Jalisco Jr., Rey Morgan vs Adorable Rubi, Alfonso Dantes, MS-1
5) Cien Caras  (c) vs Herodes [MEX HEAVY]

EMLL (SUN) 02/21/1982 Pista Arena Revolución [Halcon Mensual 6]
1) Tony Salazar  (c) b Sangre Chicana [NWA LH]

indy (SUN) 02/21/1982 Plaza de Toros Valente Arellano, Torreón, Coahuila [El Siglo de Torreon 1982-02-21]
1) ? vs ??
2) ? vs ??
3) Centella Azul, Flecha Veloz, Fredy Contreras vs El Desconocido, El Moro, Macabro II
4) Olimpo, Spirit vs Bello Califa, Coloso Marino
5) Mario Saucedo vs Asesino Negro [super libre]

MORA (SUN) 02/21/1982 Toreo de Cuatro Caminos, Naucalpan, Estado de México [https://www.patreon.com/posts/box-y-lucha-no-3-49550608 Lucha Libre 946, LuchaWorld, https://www.facebook.com/groups/1461911524124484/permalink/1571879093127726/ Matt Farmer]
1) Black Man, Mano Negra b Rizado Ruiz, Rudy Reyna
2) El Solar, Enrique Vera, Ultraman b Ángel Blanco, Cesar Valentino, Dr. Wagner
3) Don Corleone, Fishman b Scorpió, Villano III
4) Gran Hamada, Tatsumi Fujinami b Babe Face, El Solitario
5) Abdullah the Butcher, Perro Aguayo DQ Canek, Ray Mendoza

EMLL (TUE) 02/23/1982 Arena Coliseo Guadalajara [El Informador 1982-02-23]
1) ? vs ??
2) ? vs ??
3) ? vs ??
4) Águila India, Gran Cochisse vs Calavera I, Calavera II
5) Cien Caras, El Halcón, Pirata Morgan vs Adorable Rubi, Alfonso Dantes, Herodes

MORA (TUE) 02/23/1982 Gimnasio Municipal Lic. Benito Juárez, Cuautitlán, Estado de México [luchablog photolog (2013-09-17 18.01.53)]
1) Antorcha vs Yako
2) Babe Richard vs Danny Boy
3) El Matematico vs Negro Casas
4) El Falcón, El Halcón vs Cuchillo, Fuego
5) Mil Máscaras, Tawa Vera, Ultraman vs Black Terry, Dick Angelo, Fishman

MORA (WED) 02/24/1982 Arena Naucalpan [luchablog photolog (2013-09-16 01.55.17)]
1) Castorcito, Ráfaga Moreno vs Black Star, Perro Sosa
2) Javier Llanes, José Luis Mendieta vs Leopardo Negro, Rokambole
3) El Matematico, Fishman vs Black Terry, Lobo Rubio
4) Brazo de Oro, Brazo de Plata, El Brazo, Gran Hamada vs el Signo, Kuroneko, Negro Navarro, Texano Jr.

EMLL (FRI) 02/26/1982 Arena México [Lucha Libre 948, https://www.patreon.com/posts/lucha-libre-no-3-61780805 LuchaWorld, http://wrestlingclassics.com/.ubb/ultimatebb.php?ubb=get_topic;f=10;t=005180 Matt Farmer]
1) Águila Solitaria b Vulcano
2) Joe Martin, Talismán DQ Divino Roy, Mocho Cota
3) El Nazi, Rey Salomón b El Fantasma, Takasugi
4) Kato Kung Lee, Kung Fu, Lizmark b Américo Rocca, El Supremo, Satánico
5) David Morgan, Ringo Mendoza, Tony Salazar b Alfonso Dantes, El Faraón, Sangre Chicana
## David Morgan betrayed his partners

MORA (FRI) 02/26/1982 Toluca, Estado de México [Halcon Mensual 6]
1) Lola González  (c) b Estela Molina [UWA WOMEN]

INDIE (SAT) 02/27/1982 Cortijo La Siguiriya, Santa Maria Aztahuacan, Iztapalapa, Distrito Federal [Lucha Libre 948, https://www.patreon.com/posts/lucha-libre-no-3-61780805 LuchaWorld]
1) Tinieblas b El Yeti

EMLL (SUN) 02/28/1982 Arena Coliseo Guadalajara [El Informador 1982-02-28]
1) ? vs ??
2) ? vs ??
3) El Fantasma, Rayo de Jalisco Jr. vs El Nazi, Satánico
4) Cien Caras b Herodes [mask]
## no result listed, but Cien obviously won.

EMLL (SUN) 02/28/1982 Pista Arena Revolución [Box y Lucha 1530]
1) Tony Salazar  (c) vs Sangre Chicana

indy (SUN) 02/28/1982 Plaza de Toros Valente Arellano, Torreón, Coahuila [El Siglo de Torreon 1982-02-28]
1) ? vs ??
2) ? vs ??
3) Centella Azul, El Griego, Torbellino Blanco vs El Moro, El Romano, Perverso
4) Cesar Curiel, Olímpico Flores vs Ring Danger, Star Águilar
5) Mario Saucedo vs Asesino Negro [hair]

MORA (SUN) 02/28/1982 Arena Isabel, León, Guanajuato [luchablog photolog (2013-09-15 23.59.16)]
1) José Luis Mendieta, Tamba vs As Charro, Dalton Stone
2) Rizado Ruiz, Rudy Reyna vs Batman, El Matematico
3) Dos Caras, Fishman, Hector Guerrero vs Ángel Blanco, Canek, Villano III
4) Black Terry vs Robin [UWA LIGHT]
## Black Terry is champion

EMLL (TUE) 03/02/1982 Arena Coliseo [Box y Lucha 1530, http://wrestlingclassics.com/.ubb/ultimatebb.php?ubb=get_topic;f=10;t=005180 Matt Farmer]
1) Minotauro b Aries
2) Sombra Roja b Jorge Cuevas
3) Manuel Robles, Pánico b Águila De Plata, Mercurio
4) Águila Solitaria, Jerry Estrada, Yanco b Bufalo Salvaje, Rodolfo Ruiz, Vulcano
5) Cachorro Mendoza, Kato Kung Lee, Kung Fu DQ Américo Rocca, El Supremo, Mocho Cota
## straight falls, Rocca fouled Kato

EMLL (TUE) 03/02/1982 Arena Coliseo Guadalajara [El Informador 1982-03-02]
1) ? vs ??
2) ? vs ??
3) ? vs ??
4) Cinta Negra, El Leopardo, Gran Cochisse vs Belcebú, El Nazi, MS-1
5) Cien Caras, El Fantasma vs Herodes, Satánico

indy (THU) 03/04/1982 Arena Zapata, Cuautla, Morelos [luchablog photolog (2013-09-17 18.06.36)]
1) El Átomo vs El Taitur
2) El Renegado, Misterio Verde vs Cadete Segundo, Demetrius
3) Aristóteles, Tawa Vera vs Babe Richard, Destino Negro
4) El Falcón, El Matematico, Halcón 78 vs Black Terry, Cuchillo, Negro Casas

MORA (THU) 03/04/1982 Pista Arena Revolución
1) Astro Rey, Lobo Rubio vs Impacto, La Sombra
2) América Salvaje, Villano I vs Solar I, Tamba
3) Cesar Valentino, Scorpió vs Saito, Siglo XX
4) Don Corleone, Enrique Vera, Rayo de Jalisco vs Ángel Blanco, Anibal, Babe Face

EMLL (FRI) 03/05/1982 Arena México [Box y Lucha 1530, Lucha Libre 949, http://wrestlingclassics.com/.ubb/ultimatebb.php?ubb=get_topic;f=10;t=005180 Matt Farmer]
1) Franco Colombo, Takasugi vs Leo López, Roy Steve
2) Cesar Curiel, El Fantasma DQ Índio Jerónimo, Rey Salomón
3) Kato Kung Lee, Kung Fu, Lizmark b Américo Rocca, El Faraón, Espectro Jr.
4) Alfonso Dantes, David Morgan, El Faraón b Halcón Ortiz, Máscara Año 2000, Tony Salazar
## Morgan is now a rudo.
5) Rafael Salamanca b Zorro Mendoza
## Prelim match appening after the main event.

EMLL (SUN) 03/07/1982 Arena Coliseo Guadalajara [El Informador 1982-03-07]
1) ? vs ??
2) ? vs ??
3) ? vs ??
4) Cinta Negra, Gran Cochisse vs Belcebú, Calavera I
5) El Halcón, Rayo de Jalisco Jr., Tony Salazar vs Adorable Rubi, El Nazi, Satánico

indy (SUN) 03/07/1982 Plaza de Toros Valente Arellano, Torreón, Coahuila [El Siglo de Torreon 1982-03-07]
1) ? vs ??
2) Piloto I, Piloto II vs El Mestizo, Gran Sabú
3) Caudillo Del Sur, Centella Azul, Olimpo vs El Moro, Perverso, Renegado
4) Águila India, El Leopardo, Mario Saucedo vs Calavera II, Índio Vitela, Star Águilar

MORA (SUN) 03/07/1982 Toreo de Cuatro Caminos, Naucalpan, Estado de México [https://mobile.twitter.com/therealfredo/status/1444072338681520128/photo/1 @therealfredo, Box y Lucha 1530, Lucha Libre 948, https://www.facebook.com/groups/1461911524124484/permalink/1571879093127726/ Matt Farmer]
1) Rizado Ruiz, Rudy Reyna b Abdullah Tamba, Impacto
2) Brazo de Oro, Brazo de Plata b Astro Rey, Cuchillo
3) Dos Caras, Rayo de Jalisco b Ángel Blanco, Scorpió
4) Enrique Vera, George Takano, Kuniaki Kobayashi, Saito DQ Babe Face, el Signo, Negro Navarro, Texano
## Babe Face fouled Kobyaashi
5) Don Corleone, El Solitario, Fishman b Canek, Ray Mendoza, Villano III
## Setting up Corleone/Canek in a mask match. Canek beat Corleone eliminated Corleone, but Corleone interferred with him from the outside to set up Solitario's win.

EMLL (TUE) 03/09/1982 Arena Coliseo [Box y Lucha 1530, http://wrestlingclassics.com/.ubb/ultimatebb.php?ubb=get_topic;f=10;t=005180 Matt Farmer]
1) Josué vs Terror Blanco
2) El Caudillo vs Jorge Cuevas
3) El As, Sombra Roja vs Rodolfo Ruiz, Ruso Flores
4) El Doberman, Franco Colombo vs Manuel Robles, Pánico
5) Cachorro Mendoza, Lizmark, Talismán vs Américo Rocca, El Supremo, La Fiera

EMLL (TUE) 03/09/1982 Arena Coliseo Guadalajara [El Informador 1982-03-09]
1) ? vs ??
2) ? vs ??
3) ? vs ??
4) Águila India, Ángel del Silencio, Rayo de Jalisco Jr. vs El Nazi, Índio Vitela, MS-1
5) El Halcón, Tony Salazar vs Adorable Rubi, Satánico

MORA (TUE) 03/09/1982 Arena Aficion [Box y Lucha 1530]
1) El Matematico vs Destino Negro
2) El Huichol, Septiembre Negro vs Siglo XX, Tamba
3) Dorrel Dixon, Solar I vs Astro Rey, Scorpió
4) el Signo, Negro Navarro, Texano vs El Solitario, Enrique Vera, Rayo de Jalisco

MORA (TUE) 03/09/1982 Arena Querétaro [Box y Lucha 1530]
1) Gran Petroneo vs Pequeño Solin
2) Bestia Rubia, Negro Casas vs Batman, Robin
3) El Falcón, Halcón 78 vs Leopardo Negro, Rokambole
4) El Monarca, Mano Negra vs América Salvaje, Villano I
5) Dos Caras, Fishman vs Ángel Blanco, Babe Face

indy (WED) 03/10/1982 Arena San Juan Pantitlan, Ciudad Nezahualcóyotl, Estado de México [Box y Lucha 1530]
1) El Diplomatico vs Perro Callejero
2) Antorcha, Estrella Del Norte vs Bunny Black, Luis Lopez
3) Aventurero Chino, Zebra vs El Meteoro, El Mutante

indy (WED) 03/10/1982 Arena Xochimilco, Xochimilco, Distrito Federal [Box y Lucha 1530]
1) El Sultan vs Escarbajo Rojo
2) Negro Peralta vs Mr. Rolling
3) El Módulo, Impala vs Chamaco Orduna, Relámpago Dorado
4) El Exterminador, El Interceptor, Tupac Amaru vs El Herrero, Primate, X13
5) El Vikingo, Guerrillero Valentino, Súper Máquina vs El Impacto, El Monarca, Solar I

indy (WED) 03/10/1982 Cancha Ferrocarrilera, Irapuato, Guanajuato [Box y Lucha 1530]
1) Sombra De Plata III vs Batu
2) Dios Negro, Dios Rojo vs Misterio Blanco I, Misterio Blanco II
3) Lola González vs La Bruja
4) Fishman, Tamba vs Índio García, Rudy El Gigante

MORA (WED) 03/10/1982 Arena Coliseo Acapulco, Acapulco, Guerrero [Box y Lucha 1530]
1) Charito Silva, Karina, Rebecea Flores vs La Marquesa, La Viuda Negra I, Toña La Tapatia
2) Cesar Curiel, El Centauro vs Alma Grande, Play Boy
3) El Faraón, La Fiera, Pirata Morgan vs Kato Kung Lee, Kung Fu, Mario Valenzuela

EMLL (THU) 03/11/1982 Arena Isabel, Cuernavaca, Morelos [Box y Lucha 1530]
1) Javier Llanes, La Sombra vs As Charro, Septiembre Negro
2) Arturito, Guilliver vs Gran Nikolai, Pequeño Goliath
3) El Monarca, José Luis Mendieta, Siglo XX vs América Salvaje, Black Terry, Lobo Rubio
4) Kato Kung Lee, Kung Fu, Lizmark vs El Faraón, Espectro Jr., Pirata Morgan

MORA (THU) 03/11/1982 Pista Arena Revolución [Box y Lucha 1530]
1) Javier Llanes, La Sombra vs As Charro, Septiembre Negro
2) Arturito, Gulliver vs Gran Nikolai, Pequeño Goliath
3) El Monarca, José Luis Mendieta, Siglo XX vs América Salvaje, Black Terry, Lobo Rubio
4) Dos Caras, Enrique Vera, Rayo de Jalisco vs Ray Mendoza, Villano I, Villano III

EMLL (FRI) 03/12/1982 Arena México [Box y Lucha 1320, http://superluchas.com/2015/03/12/en-un-dia-como-hoy-1982-david-morgan-campeon-se-presenta-atsushi-onita-el-fantasma-y-cesar-curiel-ganan-lucha-de-apuestas/ SuperLuchas]
1) El Egipcio b El Invasor
2) Cachorro Mendoza, Takasugi b Bruno Victoria, Manuel Robles
## Cachorro Mendoza replaced Franco Colombo
3) Kato Kung Lee, Kung Fu b Américo Rocca, La Fiera
## Rocca & Fiera broke up, Rocca going tecnico.
4) Atsushi Onita, Halcón Ortiz, Máscara Año 2000 b Alfonso Dantes, El Faraón, Sangre Chicana
5) Cesar Curiel, El Fantasma b Índio Jerónimo, Rey Salomón [mask, hair]
## Indio lost his hair. Salomón is Salomón Meza Camarena, 26 years old from Guadalajara, Jalisco
6) David Morgan b Tony Salazar  (c) [NWA LH]
&& the commission also announced the 1981 award winners. Faraon was both luchador of the year and rudo of the year. Cesar Curiel & Mascara Ano 2000 were tag team of the year. Negro Casas & Fuerza Guerrera were awarded for match of the year. Escorpio Jr. was novato of the year, and Rayo de Jalisco is revelation of the year.

MORA (FRI) 03/12/1982 Arena Apatlaco, Iztapalapa, Distrito Federal [Box y Lucha 1530]
1) El Venusino, Fiera Guerrero vs Espuelas de Oro I, Espuelas de Oro II
2) Bobby Richard, Delfin Verde vs El Emperador, Ray Cruz
3) Bestia Rubia, Fuerza Guerrera, Negro Casas vs El Herrero, Impala, Módulo
4) Brazo de Oro, Brazo de Plata, Impacto vs Black Terry, Leopardo Negro, Rokambole
5) George Takano, Gran Hamada, Saito vs Villano I, Villano II, Villano III

EMLL (SAT) 03/13/1982 Arena Puebla [Box y Lucha 1530]
1) El Cid vs Caballero Azul
2) Rafael Salamanca vs Scaramouche
3) El Caudillo, Sombra Roja vs El Comanche, Minotauro
4) Cesar Curiel, Cien Caras, Lizmark vs Adorable Rubi, Herodes, Leo López
5) Kato Kung Lee, Kung Fu, Onita vs Alfonso Dantes, El Faraón, Rey Morgan

EMLL (SAT) 03/13/1982 Pista Arena Revolución [Box y Lucha 1530]
1) León García vs Terror Blanco
2) Caballero Rojo, Jerry Estrada vs Caballero Blanco, Rey David
3) Dardo Aguilar, El As, El Reo vs Belcebú, Bufalo Salvaje, Vulcano
4) Cachorro Mendoza, Mercurio, Talismán vs El Crucero, Espectro Jr., Mocho Cota
5) El Supremo  (c) vs Franco Colombo [MEX WELTER]

indy (SAT) 03/13/1982 Arena Santa Maria Aztahuacan, Iztapalapa, Distrito Federal [Box y Lucha 1530]
1) Johnny Suavecito vs Enigma Azul
2) El Invicto, Pequeño Maruqes vs Bello Andy, El Hereje
3) Orión vs Antorcha
4) Elio Guzman, Pastor vs El Jaguar, Escarabajo De Oro
5) El Antifaz, El Ltyei, Guarura vs El Profeta, Gallo Giro, Panama Panther

indy (SAT) 03/13/1982 Arena Zapata, Cuautla, Morelos [Box y Lucha 1530]
1) Sombra Chicana II vs Chamaco Reyes
2) Bunny Black vs El Mutante
3) El Brujo, León Chino vs Astronomo, Cheyenne
4) Justiciero, Pequeño Solin vs Barba Negra, Hombre Nuclear

MORA (SAT) 03/13/1982 Arena Isabel, Cuernavaca, Morelos [Box y Lucha 1530]
1) Lasser vs Cuchillo
2) Impacto vs América Salvaje
3) Babe Face, Scorpió vs Rayo de Jalisco, Solar I
4) Ángel Blanco, Bufalo Allen, Dr. Wagner vs Don Corelone, El Solitario, Kobayashi

MORA (SAT) 03/13/1982 Arena Xochimilco, Xochimilco, Distrito Federal [Box y Lucha 1530]
1) Mr. Rolling, X13 vs Rayo Dorado I, Rayo Dorado II
2) Chamaco Orduna, Relámpago Dorado vs El Primate, Kalimaco
3) Perfumado Reyna, Rizado Ruiz vs Hermano Llanes I, Hermano Llanes II
4) El Monarca, Mano Negra, Siglo XX vs Bello Greco, Flama Azul, Sergio el Hermoso
5) Dos Caras, Enrique Vera, Tinieblas vs El Vikingo, Guerrillero Valentino, Súper Máquina

MORA (SAT) 03/13/1982 Astro Pista, Texcoco, Estado de México [Box y Lucha 1530]
1) El Mecanico vs Carta Negra
2) Rodan X, Tarot vs Amenaza India, Black Espana
3) Ciclón Moreno, Ultraman vs Lobo Rubio, Perro Sosa
4) La Marquesa, Lola González vs India Sioux, La Bruja
5) Fishman vs Taos [UWA LH]
## maybe Kahos?

Bonales (SUN) 03/14/1982 Plaza de Toros el Cortijo, Venustiano Carranza, Distrito Federal [Box y Lucha 1530]
1) El Coreman, Juanito Ramírez vs Memo Arenas, Ray Tony
2) Rayo Dorado I, Rayo Dorado II vs Ariman, Conde Murciélago
3) Fuerza Guerrera, Kalimaco, Rudy Rivera vs Chamaco Ramos, Delfin II, Módulo
4) Bull Power, El Veterinario, Satán vs Gorilla Flores, Impala, Panama Panther
5) El Monarca, La Sombra, Tamba vs As Charro, El Enfermero Jr., Enfermero I

EMLL (SUN) 03/14/1982 Arena Coliseo [http://wrestlingclassics.com/.ubb/ultimatebb.php?ubb=get_topic;f=10;t=005180 Matt Farmer]
1) Yanco vs Tony Arce
2) Cien Caras, Máscara Año 2000 vs El Halcón, Takasugi and Cesar Curiel, El Vengador and El Fantasma, Joe Martin and El Faraón, Rey Salomón and Índio Jerónimo, Rey Morgan and Adorable Rubi, Leo López and Herodes, Índio Vitela [torneo]

EMLL (SUN) 03/14/1982 Arena Coliseo Guadalajara [El Informador 1982-03-14]
1) ? vs ??
2) ? vs ??
3) ? vs ??
4) Ángel del Silencio, Olímpico Flores vs Asesino Negro, Calavera II
5) Alfonso Dantes, El Nazi, Satánico vs Onita, Rayo de Jalisco Jr., Tony Salazar

EMLL (SUN) 03/14/1982 Arena Puebla [Box y Lucha 1530]
1) El Azteca vs Príncipe Rojo
2) Danger, El Invasor vs El Virrey, Roberto Robles
3) Caballero Rojo, Jerry Estrada, Josué vs Pequeño Solin, Ruso Flores, Sombra Poblana
4) El Crucero, Manuel Robles vs El Egipcio, Hombre Bala
5) El Supremo, Espectro Jr. vs Cachorro Mendoza, Mercurio

EMLL (SUN) 03/14/1982 Pista Arena Revolución [Box y Lucha 1530]
1) Clímax II vs Rolando Valentino
2) Rodolfo Ruiz, Zorro Mendoza vs Águila Solitaria, Electrón
3) Celeste, Rafael Salamanca vs El Nómada, Scaramouche
4) Águila De Plata, Doberman vs Bruno Victoria, Pánico
5) Kato Kung Lee, Kung Fu, Lizmark vs Américo Rocca, El Faraón, La Fiera

indy (SUN) 03/14/1982 Arena San Juan Pantitlan, Ciudad Nezahualcóyotl, Estado de México [Box y Lucha 1530]
1) Destructor Nazi vs El Bohby
2) Dios Negro, Dios Rojo vs Castorcito, Lasser
3) José Luis Mendieta, La Sombra vs Barba Negra, León Chino
4) Irma Águilar, Irma González vs Lola González, Mujer Salvaje
5) Mano Negra, Mil Máscaras vs América Salvaje, Súper Máquina

indy (SUN) 03/14/1982 Centro Social No. 1, Valle de Aragon, Ecatepec, Estado de México [Box y Lucha 1530]
1) Juanito Ramírez vs Invasion II
2) Oso Medina, Oso Vikingo vs Espacial, Lasser
3) El Galante, Mano Negra vs Barba Negra, León Chino
4) Irma Águilar, Irma González vs La Mujer Salvaje, Rosa Isabel

indy (SUN) 03/14/1982 Gimnasio Ramos Millan, Iztacalco, Distrito Federal [Box y Lucha 1530]
1) El Marcado vs Cesar Lopez
2) El Leopardo vs Joe Martin
3) Alejandro Guzman, Piloto Nazi I vs El Extravagante, Enrique Villa
4) Makabro Rojo I, Makabro Rojo II vs Gran Kendor, Silver Fox
5) Barba Negra, La Serpiente vs Terrorista I, Terrorista II

indy (SUN) 03/14/1982 Gimnasio, San Pedro, Iztacalco, Distrito Federal [Box y Lucha 1530]
1) El Milenario vs Babe Star
2) Bello Memo vs Paracaidista II
3) Piloto Nazi I, Piloto Nazi II vs El Gringo, Maya Azteca
4) El Intocable, Torbellino vs Rodan X, Tarote
5) Chucho Condi I, Chucho Condi II, Sanguinario Jr. vs Cassper, El Zurdo, Serpiente

indy (SUN) 03/14/1982 Plaza de Toros Valente Arellano, Torreón, Coahuila [El Siglo de Torreon 1982-03-14]
1) ? vs ??
2) Joe Andrade vs Gran Sabú
3) Ciclón Negro vs El Mestizo
4) Centella Azul, Coloso Marino, Mario Saucedo vs Bello Califa, El Moro, Perverso
5) El As, León García, Terror Blanco vs Caballero Blanco, Rey David, Vulcano

MORA (SUN) 03/14/1982 Toreo de Cuatro Caminos, Naucalpan, Estado de México [https://www.facebook.com/photo.php?fbid=441301244172817&set=pb.100048788359126.-2207520000..&type=3 Angel Luzbel Nezahualcoyotl, Lucha Libre 949, https://www.facebook.com/groups/1461911524124484/permalink/1571879093127726/ Matt Farmer]
1) Dorrel Dixon, El Solar b Rizado Ruiz, Rudy Reyna
2) Ángel Blanco, Dr. Wagner b Dos Caras, Enrique Vera
3) Babe Face, el Signo, Negro Navarro, Texano b George Takano, Gran Hamada, Kuniaki Kobayashi, Saito
4) Bufalo Allen, Ray Mendoza b El Solitario, Fishman
5) Canek b Don Corleone [mask, hair]
## Don Corleone is Tony Stone

Reyes (SUN) 03/14/1982 Arena Azteca, Calz. Tulyehualco, Iztapalapa, Distrito Federal [Box y Lucha 1530]
1) El Venusino vs El Galan
2) Delicado del Moral vs Espuelas II
3) Delfin Verde, Fiera Guerrero vs El Emperador, Espuelas de Oro I
4) Flama Azul, Polarys I, Polarys II vs Mr. Rolling, Neutrón I, Neutrón II
5) Mil Máscaras, Siglo XX vs El Vikingo, Súper Máquina

MORA (MON) 03/15/1982 Arena Puebla [Box y Lucha 1530]
1) El Monarca, Solar I vs As Charro, Escorpión I
2) Mano Negra, Ultraman vs Black Terry, Lobo Rubio
3) América Salvaje, Astro Rey, Scorpió vs Hamada, Saito, Takano
4) Anibal, Bufalo Allen, Perro Aguayo vs Ray Mendoza, Villano I, Villano III

EMLL (TUE) 03/16/1982 Arena Coliseo Guadalajara [El Informador 1982-03-16]
1) ? vs ??
2) ? vs ??
3) ? vs ??
4) Águila India, Cinta Negra vs El Nazi, Satánico
5) Gran Cochisse, Onita, Rayo de Jalisco Jr. vs Alfonso Dantes, Calavera I, Índio Vitela

indy (WED) 03/17/1982 Cancha Ferrocarrilera, Irapuato, Guanajuato [Box y Lucha 1530]
1) Hombre Araña vs Clímax, Espectro Di, La Momia Astaroth, Joven Maravilla, Pequeño Halcón, Lainterna Verde, Ray Silva, El Fugtiivo, Mr. Átomo
2) Blue Demon, Estrella Azul vs El Vikingo, Índio García

indy (THU) 03/18/1982 Arena Zapata, Acapulco, Guerrero [Halcon 558]
1) El Matematico L Negro Casas, Black Terry [hair, mask, UWA LIGHT]
## Halcon calls this the most exicitng match of the year, citing Combates' Pepe Valdez for covering it. Terry (title) defeated Casas, then Casas (hair) defeated Matematico, who had to give up 25,000 pesos.

indy (THU) 03/18/1982 Arena Zapata, Cuautla, Morelos [luchablog photolog (2013-09-17 18.04.02)]
1) El Eclipse, Kendor vs Cruz Diablo, El Anonimo
2) Aristos, El Guerrero vs El Galeonero, Serpico
3) Black Silver, El Centauro vs Alma Grande, Alto Voltaje
4) Destino Negro vs Tawa Vera
5) Negro Casas vs El Matematico, Black Terry [hair, UWA LIGHT, money]
## Negro Casas wagered his hair versus Black Terry's title versus El Matematico's 25000 pesos

EMLL (FRI) 03/19/1982 Arena México [Arena de Box Y Lucha 1231]
1) Joe Martin, Takasugi b Manuel Robles, Mocho Cota
2) Américo Rocca, Lizmark b La Fiera, Satánico
## Said to be the best match of the night.
3) Adorable Rubi, Alfonso Dantes, Herodes b Cien Caras, El Fantasma, Halcón Ortiz
## Team Dantes took falls 2/3
4) Atsushi Onita, Cesar Curiel, Máscara Año 2000 b David Morgan, El Faraón, Sangre Chicana
## Straight falls, excessive violence DQ in the first, clean in the second

indy (SAT) 03/20/1982 Arena Cuahtemoc, Torreón, Coahuila [https://twitter.com/ElEleganteAngel/status/1693668187882094820/photo/3 Angel el Elegante]
1) Furia Negra vs El Lobo
2) El Fakir vs Comatzu
3) Frankenstein, Landru vs Acuario, Saeta Roja
4) El Dragón Verde vs La Momia [mask]

indy (SAT) 03/20/1982 Arena Xochimilco, Xochimilco, Distrito Federal [luchablog photolog (2013-09-17 18.05.53)]
1) Chamaco Orduna, Ray Cruz vs Bestia Rubia, El Venusino
2) El Falcón, Halcón 78 vs Leopardo Negro, Rokambole
3) Enrique Llanes, Javier Llanes vs Perfumado Reyna, Rizado Ruiz
## Perfumado surely Rudy
4) Flama Roja, Hippie I, Hippie II vs El Monarca, Enrique Vera, Siglo XX
## Flama name may be wrong
5) Kato Kung Lee, Kung Fu vs Black Terry, Carlos Plata
6) Gran Hamada, Kuniaki Kobayashi, Takano vs Villano I, Villano II, Villano III

EMLL (SUN) 03/21/1982 Arena Coliseo Guadalajara [El Informador 1982-03-21]
1) ? vs ??
2) ? vs ??
3) ? vs ??
4) Calavera I, Calavera II vs Águila India, Cinta Negra
5) Expectro Jr., La Fiera, Rey Salomón vs Gran Cochisse, Lismark, Onita

INDIE (SUN) 03/21/1982 Plaza de Toros el Cortijo, Venustiano Carranza, Distrito Federal [Arena de Box Y Lucha 1231]
1) Fuerza Guerrera, Kalimaco b El Módulo, El Murciélago
2) Ray Tony b Memo Arenas
## feud between former parnters
3) Enfermero I, Enfermero II b Beto Llanes, Chamaco Ramos
4) Bull Power, El Veterinario, Satán b Gorilla Flores, Impala, Panama Panther
5) Luis Mariscal, Scorpió b Dorrel Dixon, Tamba

indy (SUN) 03/21/1982 Plaza de Toros Valente Arellano, Torreón, Coahuila [El Siglo de Torreon 1982-03-21]
1) ? vs ??
2) ? vs ??
3) Mujer Maravilla, Susuky Wong vs La Esclava, Mireya Ramos
4) Centella Azul, Coloso Marino vs El Moro, Perverso
5) El Griego, Mario Saucedo vs El Lobo, Star Águilar

MORA (SUN) 03/21/1982 Toreo de Cuatro Caminos, Naucalpan, Estado de México [Arena de Box Y Lucha 1231]
1) José Luis Mendieta, Solar I b América Salvaje, Lobo Rubio
2) Rayo de Jalisco, Ultraman b Ángel Blanco, Cesar Valentino
3) Canek, Dr. Wagner b Dos Caras, Tony Rocco
## Tony Rocco is the recently unmasked Don Corleone. Bufalo Allen attacked Canek post match to build towards their match
4) Anibal, Babe Face, Bufalo Allen b El Solitario, Enrique Vera, Fishman
5) el Signo, Negro Navarro, Perro Aguayo, Texano DQ Ray Mendoza, Villano I, Villano II, Villano III
## Aguayo snuck in a foul on Mendoza, Mendoza got caught doing the same.

MORA (THU) 03/25/1982 Pista Arena Revolución [Lucha Libre 952]
1) Negro Casas, Septiembre Negro b La Sombra, Lasser
## Negro Casas replaced Black Terry
2) Lobo Rubio, Rizado Ruiz b Pequeño Solin, Tamba
## Solin replaced Monarca (moved up)
3) Ray Mendoza, Villano I, Villano II b El Falcón, El Monarca, Halcón 78
## Monarca replaced Saito (injury)
4) Gran Hamada, Kuniaki Kobayashi, Takano DQ Babe Face, Bufalo Allen, Cesar Valentino
## Valentino fouled Kungaki

EMLL (FRI) 03/26/1982 Arena México [Arena de Box Y Lucha 1231]
1) Sombra Roja vs Bufalo Salvaje
2) El Egipcio, El Vengador vs El Crucero, Leo López
3) Cachorro Mendoza, Franco Colombo vs El Supremo, Espectro Jr.
4) Américo Rocca, Lizmark, Rayo de Jalisco Jr. vs La Fiera, Sangre Chicana, Satánico
5) Atsushi Onita, Cesar Curiel, Máscara Año 2000 vs Alfonso Dantes, David Morgan, El Faraón

Lebell (FRI) 03/26/1982 Olympic Auditorium, Los Angeles, California
1) ? vs ??
2) ? vs ??
3) ? vs ??
4) ? vs ??
5) ? vs ??
6) Mil Máscaras vs Perro Aguayo

EMLL (SAT) 03/27/1982 Pista Arena Revolución [Arena de Box Y Lucha 1231]
1) Minotauro vs Clímax II
2) Caballero Rojo, El Caudillo vs Jorge Cuevas, Rey David
3) Águila De Plata, Yanco vs Tony Arce, Zorro Mendoza [supre libre]
4) El Doberman, Joe Martin, Takasugi vs Belcebú, Índio Vitela, MS-1
5) Halcón Ortiz, Tony Salazar vs Adorable Rubi, David Morgan

INDIE (SAT) 03/27/1982 Salón Ejidal, Tepeji del Rio, Hidalgo [Arena de Box Y Lucha 1231]
1) Perro Barbosa Callejero vs Edipo Rey
2) Bunny Black vs Luis Lopez
3) El Cosaco, Gran Petroneo vs El Galante, Kenji Kaplin
4) Irma Águilar, Irma González vs La Mujer Salvaje, Vicky Carranza

EMLL (SUN) 03/28/1982 Arena Coliseo [Arena de Box Y Lucha 1231]
1) Dardo Aguilar, El As vs El Nómada, Ruso Flores
2) El Reo, Rafael Salamanca vs El Crucero, El Invasor
3) Cachorro Mendoza, El Fantasma, Máscara Año 2000 vs El Nazi, La Fiera, Manuel Robles
4) Franco Colombo, Takasugi vs Bruno Victoria, Índio Vitela [hair]
5) Cien Caras vs Herodes [MEX HEAVY]

EMLL (SUN) 03/28/1982 Arena Coliseo Guadalajara [El Informador 1982-03-28]
1) ? vs ??
2) ? vs ??
3) ? vs ??
4) Asesino Negro, Rey Salomón vs Ángel del Silencio, Celeste
5) Alfonso Dantes, Rey Morgan, Sangre Chicana vs El Halcón, Máscara Año 2000, Onita

EMLL (SUN) 03/28/1982 Pista Arena Revolución [Arena de Box Y Lucha 1231]
1) León García vs Histrion
2) Aries, Electrón vs Caballero Blanco, Gladiador II
3) Águila Solitaria, Jerry Estrada vs Rodolfo Ruiz, Vulcano
4) Talismán, Vengador vs Leo López, Pánico
5) Américo Rocca, Lizmark, Rayo de Jalisco Jr. vs El Faraón, Mocho Cota, Sangre Chicana

INDIE (SUN) 03/28/1982 Arena San Juan Pantitlan, Ciudad Nezahualcóyotl, Estado de México [Arena de Box Y Lucha 1231]
1) El Chacal II vs El Vaquero Infernal
2) Terremoto II vs Misterio Blanco II
3) Kenji Kaplin, Misterio Blanco I vs Dr. Karonte I, Dr. Karonte Jr.
4) Bengala I, Bengala II vs El Maldito, Septiembre Negro
5) Dorrel Dixon, Dos Caras vs Astro Rey, Máquina Salvaje

INDIE (SUN) 03/28/1982 Arena Santa Martha Acatitla, Iztapalapa, Distrito Federal [Arena de Box Y Lucha 1231]
1) Cachorro García vs El Cisne
2) Tony Arreola vs Fantasma Fascinante
3) Hermy vs Zodical
4) Príncipe Mexicano vs Ángel Diabólico [super libre]
5) Edipo Rey vs Perro Callejero
6) Ovni I, Ovni II vs Lobo Estepario, Mike Robledo
7) Cometa Del Mal I, Cometa Del Mal II vs Cachorro Lopez, Gran Apache

INDIE (SUN) 03/28/1982 Centro Social No. 2, Valle de Aragon, Ecatepec, Estado de México [Arena de Box Y Lucha 1231]
1) Alas De Oro vs Sky Star
2) Perro Barbosa Hernández, Terremoto vs Aruz, El Mutante
3) Dios Negro, Dios Rojo vs Genaro Contreras, Mando Amezcua
4) El Maldito, Máquina Salvaje vs El Galante, Rocco Valente

INDIE (SUN) 03/28/1982 Plaza de Toros el Cortijo, Venustiano Carranza, Distrito Federal [Arena de Box Y Lucha 1231]
1) Bengala I, Bengala II, Beto Llanes vs El Veterinario, Fuerza Guerrera, Kalimaco
2) Impala vs Chamaco Ramos [DF LIGHT]
3) Módulo vs Memo Arenas [MEX FEATHER]
4) Luis Mariscal, Scorpió vs Dorrel Dixon, Solar I
5) Satán vs Tamba [CORTIJO HEAVY]

indy (SUN) 03/28/1982 Plaza de Toros Valente Arellano, Torreón, Coahuila [El Siglo de Torreon 1982-03-28]
1) ? vs ??
2) ? vs ??
3) Ciclón Negro, Joe Andrade vs El Mestizo, Gran Sabú
4) Águila India, Gran Cochisse, Mario Saucedo vs El Moro, Silverman, Star Águilar
5) Centella Azul vs Perverso [hair]

MORA (SUN) 03/28/1982 Toreo de Cuatro Caminos, Naucalpan, Estado de México [https://www.facebook.com/photo.php?fbid=439277191041889&set=pb.100048788359126.-2207520000..&type=3 Angel Luzbel Nezahualcoyotl, Arena de Box Y Lucha 1231, https://www.facebook.com/photo.php?fbid=2002786873291984&set=pb.100006820717653.-2207520000..&type=3&theater Jose Renteria, https://www.facebook.com/groups/1461911524124484/permalink/1571879093127726/ Matt Farmer]
1) Black Terry, Lobo Rubio vs Mano Negra, Ultraman
2) Enrique Vera, Rayo de Jalisco, Tony Rocca vs Ángel Blanco, Dr. Wagner, Ray Mendoza
3) El Solitario, Fishman vs Babe Face, Perro Aguayo
4) el Signo, Negro Navarro, Texano vs Villano I, Villano II, Villano III
5) Canek  (c) b Bufalo Allen [UWA Heavy]

EMLL (TUE) 03/30/1982 Arena Coliseo [wrestling-titles]
1) Talismán b El Supremo  (c) [MEX WELTER]

EMLL (TUE) 03/30/1982 Arena Coliseo Guadalajara [El Informador 1982-03-30]
1) ? vs ??
2) ? vs ??
3) ? vs ??
4) Javier Cruz, Olímpico Flores vs Centenario, León Kirilenko
5) El Halcón, Máscara Año 2000, Onita vs Alfonso Dantes, Calavera II, Rey Salomón

INDIE (WED) 03/31/1982 Cancha Ferrocarrilera, Irapuato, Guanajuato [Arena de Box Y Lucha 1231]
1) Hijo Del Diablo vs Rayo Veloz
2) Centella Verde, Pequeño Halcón vs Jungla Verde, Mar. Átomo
3) Batu vs Sombra De Plata [mask, hair]
4) Dalia, Lola González vs La Bruja, Rosa Isabel

indy (THU) 04/01/1982 Arena Poza Rica, Poza Rica, Veracruz [luchablog photolog (20130915_234658)]
1) Terrorista vs El Petrolero
2) La Sombra vs El Ejecutor
3) Blue Panther, Lobo Rubio vs Batman, El Matematico
4) El Olímpico, Kahoz vs Dorrel Dixon, Enrique Vera

EMLL (FRI) 04/02/1982 Arena México [http://www.facebook.com/cmll.oficial/photos/a.352219088254374.1073741827.351036975039252/555112707965010/?type=1 CMLL, Halcon Mensual 7, luchablog photolog (20130915_234949)]
1) Franco Colombo, Takasugi vs Belcebú, Mocho Cota
2) El Jalisco, Onita, Rayo de Jalisco Jr. vs Alfonso Dantes, Espectro Jr., Sangre Chicana
3) Cesar Curiel b El Faraón  (c) [NWA MIDDLE]
## El Faraon won the title
4) Américo Rocca b La Fiera [hair]
5) Máscara Año 2000 b David Morgan  (c) [NWA LH]
## Morgan falls on his first defense in a shocker.

MORA (FRI) 04/02/1982 Arena Neza [luchablog photolog (20130915_234949)]
1) José Luis Feliciano, Lobo Rubio vs Pequeño Solin, Tawa Vera
2) Cesar Valentino, Kahoz vs Chela Salazar, Lola González
## that can't be right, but it's listed in the lineup like that
3) El Solitario, Enrique Vera, Fishman vs Ángel Blanco, Anibal, Perro Aguayo

MORA (FRI) 04/02/1982 Deportivo Arena México, Puebla, Puebla [luchablog photolog (20130915_234949)]
1) Batman, Robin vs Mr. Infierno, Roberto Paz
2) Leopardo Negro, Rokambole vs El Matematico, El Monarca
3) Mano Negra, Solar I, Ultraman vs Luis Mariscal, Olímpico, Scorpió
4) Ray Mendoza, Villano I, Villano III vs Gran Hamada, Kuniaki Kobayashi, Takano
5) el Signo, Negro Navarro, Texano vs Brazo de Oro, Brazo de Plata, El Brazo

EMLL (SAT) 04/03/1982 Pista Arena Revolución [luchablog photolog (20130915_234949)]
1) Rolando Valentino vs Aries
2) Josué, Sombra Roja vs Caballero Blanco, Minotauro
3) Jerry Estrada, Rafael Salamanca vs Scaramouche, Tony Arce
4) Bruno Victoria, Crucero, MS-1 vs Águila De Plata, Joe Martin, Vengador
5) Adorable Rubi, Sangre Chicana vs Onita, Tony Salazar

MORA (SAT) 04/03/1982 Arena Isabel, Cuernavaca, Morelos [luchablog photolog (20130915_234949)]
1) Escorpión I vs Justiciero
2) Estela Molina, Marina Rey vs Lola González, Pantera Sureña
3) Cuchillo, Olímpico vs Batman, Robin
4) Enrique Vera, Tony Rocco vs Ángel Blanco, Anibal

EMLL (SUN) 04/04/1982 Arena Coliseo [luchablog photolog (20130915_234949)]
1) Rey David vs Terror Blanco
2) Dardo Aguilar vs Vulcano
3) Invasor, Nómada vs El Egipcio, El Reo
